pubdate,source,title,link
2025-12-17-10-00-37 +0000,nyt,Exploring Hawaii’s Big Island on a Budget,https://www.nytimes.com/2025/12/17/travel/camping-on-a-budget-hawaii-trip.html
2025-12-17-10-00-17 +0000,nyt,What Trump’s Embrace of Crypto Has Unleashed,https://www.nytimes.com/2025/12/17/technology/trump-crypto-unleashed.html
2025-12-17-10-00-11 +0000,wapo,"Marjorie Taylor Greene’s trans bill, long unpalatable to House, gets a vote",https://www.washingtonpost.com/nation/2025/12/17/marjorie-taylor-greene-trans-care-ban/
2025-12-17-10-00-00 +0000,wapo,Killing the ‘brain trust’: How Israel targeted Iran’s nuclear scientists,https://www.washingtonpost.com/national-security/2025/12/17/iran-israel-war-nuclear-scientists-frontline-pbs/
2025-12-17-09-59-00 +0000,wsj,Indonesia’s Central Bank Holds Rates as Rupiah Stability in Focus,https://www.wsj.com/articles/indonesias-central-bank-holds-rates-again-to-stabilize-rupiah-58beaa8e
2025-12-17-09-46-16 +0000,bbc,Alleged Bondi gunman charged with 15 counts of murder,https://www.bbc.com/news/articles/c98nm1ry38jo?at_medium=RSS&at_campaign=rss
2025-12-17-09-44-00 +0000,wsj,Oil Prices Climb as Trump’s Venezuela Blockade Raises Supply Risks,https://www.wsj.com/business/energy-oil/oil-prices-climb-as-trumps-venezuela-blockade-raises-supply-risks-bf44db1f?mod=pls_whats_news_us_business_f
2025-12-17-09-37-47 +0000,nypost,Trailblazing great white shark named ‘Ripple’ ventures deep into new area — surprising experts,https://nypost.com/2025/12/17/us-news/great-white-shark-named-ripple-ventures-deep-into-gulf-of-mexico-surprising-experts/
2025-12-17-09-34-00 +0000,wsj,"U.S. Futures, Global Markets Rise as Commodities Spurred by Trump’s Venezuela Blockade",https://www.wsj.com/finance/stocks/u-s-futures-global-markets-rise-as-commodities-spurred-by-trumps-venezuela-blockade-ead8f461?mod=rss_markets_main
2025-12-17-09-31-00 +0000,wsj,Diageo to Sell Kenyan Drinks Stakes to Japan’s Asahi for $2.3 Billion,https://www.wsj.com/business/retail/diageo-to-sell-kenyan-drinks-stakes-to-japans-asahi-for-2-3-billion-7a67e9f0?mod=pls_whats_news_us_business_f
2025-12-17-09-13-00 +0000,wsj,"Bondi Beach Shooting Suspect Charged With Terrorism, Murder",https://www.wsj.com/us-news/bondi-beach-shooting-suspect-charged-with-terrorism-murder-b772a195
2025-12-17-09-04-20 +0000,cbc,"Under pressure to surrender land to Russia, Zelenskyy pitches a referendum",https://www.cbc.ca/news/world/ukraine-donetsk-russia-negotiations-9.7018008?cmp=rss
2025-12-17-09-00-00 +0000,cbc,How ISIS could be linked to the deadly Bondi Beach mass shooting,https://www.cbc.ca/news/world/bondi-beach-attack-isis-9.7018720?cmp=rss
2025-12-17-09-00-00 +0000,cbc,Bare trust tax filings on pause again as government mulls exemptions,https://www.cbc.ca/news/politics/bare-trust-changes-2026-9.7018566?cmp=rss
2025-12-17-08-44-00 +0000,wsj,SBI Shinsei Bank Shares Surge in Tokyo Debut,https://www.wsj.com/finance/banking/sbi-shinsei-bank-shares-surge-in-tokyo-debut-e16a5a85?mod=rss_markets_main
2025-12-17-08-43-00 +0000,wsj,Bank of Thailand Resumes Rate Cuts as Economy Wilts,https://www.wsj.com/articles/bank-of-thailand-lowers-rates-to-boost-growth-7e8ef987
2025-12-17-08-36-35 +0000,wsj,Stock Market Today: Dow Inches Higher; Oil Rallies After Trump Pressures Venezuela,https://www.wsj.com/livecoverage/stock-market-today-dow-sp-500-nasdaq-12-17-2025?mod=rss_markets_main
2025-12-17-08-33-17 +0000,bbc,Shock as popular South African DJ shot dead in Johannesburg,https://www.bbc.com/news/articles/c75vkw4veq1o?at_medium=RSS&at_campaign=rss
2025-12-17-08-30-55 +0000,nyt,"On British Roads, Chinese Cars Are Racing Ahead",https://www.nytimes.com/2025/12/17/business/britain-china-cars-byd.html
2025-12-17-08-25-50 +0000,bbc,'An unspeakable loss': Funeral takes place for rabbi killed in Bondi shooting,https://www.bbc.com/news/articles/cyvg17y24jmo?at_medium=RSS&at_campaign=rss
2025-12-17-08-22-48 +0000,nypost,Oil rises over 1% as Trump’s Venezuela blockade stokes uncertainty,https://nypost.com/2025/12/17/business/oil-prices-rises-over-1-as-trumps-venezuela-blockade-stokes-uncertainty/
2025-12-17-08-22-00 +0000,wsj,U.K. Inflation Slows to Eight-Month Low as BOE Prepares Rate Decision,https://www.wsj.com/economy/central-banking/u-k-inflation-slows-to-eight-month-low-as-boe-prepares-rate-decision-79e33d9e
2025-12-17-08-21-00 +0000,wsj,Bunzl Shares Fall on Lower Operating Margin Outlook,https://www.wsj.com/business/earnings/bunzl-expects-revenue-growth-backs-guidance-15b98210?mod=pls_whats_news_us_business_f
2025-12-17-08-14-20 +0000,nypost,Former ‘SNL’ star Leslie Jones wants Democrats to jail ICE agents if they take back Congress after midterm elections,https://nypost.com/2025/12/17/us-news/former-snl-star-leslie-jones-wants-democrats-to-jail-ice-agents-if-they-take-back-congress-after-midterm-elections/
2025-12-17-07-51-10 +0000,bbc,F1's Kimi Antonelli goes incognito while go-karting,https://www.bbc.com/news/articles/cgke26n55zgo?at_medium=RSS&at_campaign=rss
2025-12-17-07-47-59 +0000,nypost,Bondi Beach terrorist Naveed Akram charged with 15 murders as funerals of victims begin,https://nypost.com/2025/12/17/world-news/australias-bondi-beach-gunman-naveed-akram-charged-with-15-murders-as-funerals-of-victims-begin/
2025-12-17-07-44-31 +0000,nypost,Vegas killers who intentionally mowed down retired police chief in viral video learn their fate,https://nypost.com/2025/12/17/us-news/vegas-men-jesus-ayala-and-jzamir-keys-who-killed-retired-police-chief-andreas-probst-in-viral-video-sentenced/
2025-12-17-07-38-00 +0000,wsj,Bank of Japan on Cusp of Raising Rates to Highest in 30 Years,https://www.wsj.com/articles/bank-of-japan-on-cusp-of-raising-rates-to-highest-in-30-years-31cf6f40
2025-12-17-07-33-00 +0000,wsj,AI Chip Startup MetaX Leaps in Trading Debut,https://www.wsj.com/finance/stocks/ai-chip-startup-metax-leaps-in-trading-debut-5f1dff0b?mod=rss_markets_main
2025-12-17-07-32-37 +0000,nypost,Video shows Nick Reiner casually buying drink inside gas station moments before arrest for parents’ murders,https://nypost.com/2025/12/17/us-news/nick-reiner-casually-bought-drink-inside-gas-station-moments-before-arrest-for-parents-murders-video-shows/
2025-12-17-06-45-10 +0000,bbc,"Childhood friends find  '$55,000 diamond' in India",https://www.bbc.com/news/articles/c80x39d44klo?at_medium=RSS&at_campaign=rss
2025-12-17-06-34-34 +0000,nypost,"ICE rejects Rep. Ilhan Omar claim son was pulled over by feds, pressed for citizenship proof: ‘Absolutely zero record’",https://nypost.com/2025/12/17/us-news/ice-rejects-squad-rep-omar-claim-son-was-pulled-over-by-feds-pressed-for-citizenship-proof/
2025-12-17-06-33-28 +0000,nyt,Grief Mixes With Anger at Funeral of Rabbi Killed in Bondi Beach Attack,https://www.nytimes.com/2025/12/17/world/asia/rabbi-eli-schlanger-funeral-bondi-shooting.html
2025-12-17-06-17-14 +0000,wapo,Trump announces ‘complete blockade’ of sanctioned oil tankers to Venezuela,https://www.washingtonpost.com/world/2025/12/16/trump-venezuela-oil-tanker-blockade/
2025-12-17-06-14-20 +0000,bbc,How many homes could be heated by cow poo?,https://www.bbc.com/news/articles/cg7ve41je3lo?at_medium=RSS&at_campaign=rss
2025-12-17-06-10-46 +0000,nypost,Florida teen Anna Kepner captured on video dancing at cruise sail away party before mysterious death,https://nypost.com/2025/12/17/us-news/florida-teen-anna-kepner-captured-on-video-dancing-at-cruise-sail-away-party-before-mysterious-death/
2025-12-17-05-43-54 +0000,nypost,Thieves snatch 40-foot inflatable Santa from family-owned Christmas tree lot,https://nypost.com/2025/12/17/us-news/thieves-snatch-40-foot-inflatable-santa-from-family-owned-christmas-tree-lot/
2025-12-17-05-24-54 +0000,nyt,"On Bali, the Holiday Vibe Masks Memories of a Massacre",https://www.nytimes.com/2025/12/17/world/asia/bali-indonesia-communist-massacres.html
2025-12-17-05-21-34 +0000,48hills,The dangerous fantasy of upzoning,https://48hills.org/2025/12/the-dangerous-fantasy-of-upzoning/
2025-12-17-05-09-13 +0000,48hills,Appeal in Epps manslaughter case could put DA’s ethics on trial,https://48hills.org/2025/12/appeal-in-epps-manslaughter-case-could-put-das-ethics-on-trial/
2025-12-17-05-08-28 +0000,bbc,Who are the Bondi shooting victims?,https://www.bbc.com/news/articles/ckgz15d5718o?at_medium=RSS&at_campaign=rss
2025-12-17-05-03-29 +0000,nypost,NYC man stabbed by irate suspect in crime cops probing as possible antisemitic attack,https://nypost.com/2025/12/17/us-news/nyc-man-stabbed-by-irate-suspect-in-crime-cops-probing-as-possible-antisemitic-attack/
2025-12-17-05-01-13 +0000,nyt,Does China Have a Robot Bubble?,https://www.nytimes.com/2025/12/17/business/china-robot-unitree-ubtech.html
2025-12-17-05-00-37 +0000,wapo,Welcome to the ‘new world disorder’,https://www.washingtonpost.com/world/2025/12/17/sudan-irc-report-2026-miliband-world-disorder/
2025-12-17-04-58-07 +0000,wapo,"Norman Podhoretz, neoconservative stalwart and Commentary editor, dies at 95",https://www.washingtonpost.com/obituaries/2025/12/16/norman-podhoretz-commentary-conservative-dead/
2025-12-17-04-45-54 +0000,nyt,ISIS and the Bondi Beach Attack,https://www.nytimes.com/2025/12/16/world/isis-bondi-beach-attack-ukraine-trump.html
2025-12-17-04-39-56 +0000,bbc,Mourners pay tribute to Rabbi Schlanger during funeral,https://www.bbc.com/news/videos/c5yjvx4vp5do?at_medium=RSS&at_campaign=rss
2025-12-17-04-34-05 +0000,bbc,Miss Finland's viral 'slanted-eyes' photo stirs racism firestorm,https://www.bbc.com/news/articles/cde657xj3pxo?at_medium=RSS&at_campaign=rss
2025-12-17-04-15-28 +0000,nyt,A Single Mother’s Fight to Free Her Daughter From Saudi Arabia,https://www.nytimes.com/2025/12/11/world/africa/saudi-arabia-unmarried-mothers.html
2025-12-17-04-04-17 +0000,nypost,Last US pennies ever minted fetch whopping $16.7 million at auction,https://nypost.com/2025/12/16/us-news/last-us-cents-ever-minted-fetch-whopping-16-7-million-at-auction/
2025-12-17-04-00-00 +0000,wsj,"For Ukraine’s Allies in Europe, a Bad Deal With Russia Is Worse Than No Deal",https://www.wsj.com/world/europe/for-ukraines-allies-in-europe-a-bad-deal-with-russia-is-worse-than-no-deal-f9b99fde
2025-12-17-03-50-10 +0000,nypost,"Sports reporter, husband dead in suspected murder-suicide — with son, 3, found safe nearby",https://nypost.com/2025/12/16/us-news/sports-reporter-husband-found-dead-at-alabama-home-in-suspected-murder-suicide/
2025-12-17-03-44-20 +0000,cbc,Jared Kushner no longer part of hostile takeover bid for Warner Bros. Discovery,https://www.cbc.ca/news/world/jared-kushner-trump-affinity-paramount-warner-bros-discovery-9.7019051?cmp=rss
2025-12-17-03-43-28 +0000,nypost,"Trump frets Congress is ‘becoming antisemitic’ during Hanukkah celebration, hints at new WH ballroom price",https://nypost.com/2025/12/16/us-news/trump-frets-congress-is-becoming-antisemitic-during-hanukkah-celebration-hints-at-new-wh-ballroom-price/
2025-12-17-03-43-19 +0000,48hills,Tip-top tomes: Our favorite books of 2025,https://48hills.org/2025/12/tip-top-tomes-our-favorite-books-of-2025/
2025-12-17-03-40-00 +0000,wsj,"The Senate majority leader said Congress won’t be able to extend federal health-insurance subsidies before leaving for the holidays, punting any possible fix into the new year",https://www.wsj.com/politics/policy/house-gop-aca-obamacare-subsidies-57add6a6
2025-12-17-03-39-00 +0000,wsj,California Gives Tesla 90 Days to Change Autopilot Advertising,https://www.wsj.com/business/autos/california-gives-tesla-90-days-to-change-autopilot-advertising-51a21bfc?mod=pls_whats_news_us_business_f
2025-12-17-03-33-19 +0000,nyt,"Sydney Attackers Motivated by “Islamic State Ideology,” Officials Say",https://www.nytimes.com/2025/12/16/world/australia/bondi-beach-shooting-terror-attack-isis.html
2025-12-17-03-15-17 +0000,48hills,Phoenix Hotel goes out with a bang—and More!—on New Year’s Eve,https://48hills.org/2025/12/phoenix-hotel-goes-out-with-a-bang-and-more-on-new-years-eve/
2025-12-17-03-04-00 +0000,latimes,"Larry David, Martin Short and other famous friends had this to say about Rob Reiner",https://www.latimes.com/california/story/2025-12-16/larry-david-martin-short-billy-crystal-statement-rob-reiner-death
2025-12-17-03-01-56 +0000,nypost,California Gov hopeful Eric Swalwell neglects job in House to mingle with celebs,https://nypost.com/2025/12/16/us-news/california-gov-hopeful-eric-swalwell-neglects-job-in-house-to-mingle-with-celebs/
2025-12-17-02-58-00 +0000,wsj,Trump Orders Blockade of Sanctioned Oil Tankers In and Out of Venezuela,https://www.wsj.com/world/americas/trump-orders-blockade-of-sanctioned-oil-tankers-in-and-out-of-venezuela-3143a24a
2025-12-17-02-58-00 +0000,wsj,The Final Hours and Shocking End to Rob and Michele Reiner’s Efforts to Save Their Son,https://www.wsj.com/us-news/rob-reiner-last-week-death-c13b363e
2025-12-17-02-56-00 +0000,wsj,"Japan Exports Growth Streak Continues, Boosting Rate Hike Hopes",https://www.wsj.com/economy/trade/japan-exports-grow-for-third-straight-month-121ad795
2025-12-17-02-55-52 +0000,nyt,Why Nick Reiner Could Face the Death Penalty,https://www.nytimes.com/2025/12/16/us/nick-reiner-death-penalty-murder.html
2025-12-17-02-47-34 +0000,wapo,PayPal applies to form its own bank to expand small-business lending,https://www.washingtonpost.com/business/2025/12/16/paypal-bank-small-business-us-trump/
2025-12-17-02-47-26 +0000,nyt,Nick Reiner Formally Charged With Murdering His Parents,https://www.nytimes.com/2025/12/16/us/nick-reiner-charges-murder-rob-michele.html
2025-12-17-02-46-35 +0000,nypost,"Kash Patel defends private jet use, and his girlfriend slaps down bizarre conspiracies she’s Mossad",https://nypost.com/2025/12/16/us-news/kash-patel-defends-private-jet-use-and-his-girlfriend-slaps-down-conspiracies-shes-mossad/
2025-12-17-02-43-13 +0000,nyt,Johnson Rules Out House Vote to Extend Health Insurance Subsidies,https://www.nytimes.com/2025/12/16/us/politics/obamacare-subsidies-house.html
2025-12-17-02-37-49 +0000,latimes,"SoCal serial child molester, a cheer coach, faces over 150 years in prison",https://www.latimes.com/california/story/2025-12-16/o-c-serial-child-molester-faces-more-than-150-years-in-prison
2025-12-17-02-27-00 +0000,nyt,Judge Says He Will Not Immediately Halt Trump’s Ballroom Project,https://www.nytimes.com/2025/12/16/us/politics/judge-trump-ballroom.html
2025-12-17-02-17-09 +0000,nyt,New Details Emerge About How Rob and Michele Reiner Were Found,https://www.nytimes.com/2025/12/16/us/reiner-family-rob-nick-michele.html
2025-12-17-02-16-57 +0000,nyt,U.S. Sends Cubans to Naval Station at Guantánamo Bay,https://www.nytimes.com/2025/12/16/us/politics/cubans-deportations-guantanamo-bay.html
2025-12-17-02-13-53 +0000,missionlocal,Drone wars: Doordash will need S.F. permit to test flying burritos in the Mission,https://missionlocal.org/2025/12/sf-doordash-drone-testing-pdr-zoning-control-fielder-land-use/
2025-12-17-02-04-59 +0000,eltecolote,Protest at SF immigration courthouse ends in dozens of arrests,https://eltecolote.org/content/en/protest-sf-immigration-courthouse-arrests/
2025-12-17-02-02-33 +0000,bbc,Trump expands US travel ban to five more countries,https://www.bbc.com/news/articles/c4gkvxlpn55o?at_medium=RSS&at_campaign=rss
2025-12-17-02-00-00 +0000,wsj,The War on Poverty Failed Them—and They’re No Longer Waiting For Help,https://www.wsj.com/us-news/poverty-west-virginia-986a1865
2025-12-17-02-00-00 +0000,wsj,Tuesday’s jobs report was the latest ominous sign in an era of big corporate layoff announcements and CEOs warning that AI will replace workers,https://www.wsj.com/economy/jobs/white-collar-workers-job-anxiety-d8f83885
2025-12-17-01-50-53 +0000,wapo,Here are the Caribbean allies helping the U.S. against Venezuela,https://www.washingtonpost.com/world/2025/11/29/us-venezuela-dominican-trinidad-grenada/
2025-12-17-01-48-48 +0000,bbc,Trump's chief of staff disputes Vanity Fair story in which she criticises Vance and Musk,https://www.bbc.com/news/articles/c8dy532193do?at_medium=RSS&at_campaign=rss
2025-12-17-01-32-56 +0000,nypost,"Trump orders blockade of oil tankers from ‘foreign terrorist organization’ Venezuela, demands regime cede oil and land",https://nypost.com/2025/12/16/us-news/trump-orders-blockade-of-oil-tankers-from-venezuela-demands-regime-cede-oil-land-and-other-assets/
2025-12-17-01-25-49 +0000,bbc,Police release new video in manhunt for Brown University attacker,https://www.bbc.com/news/articles/cedxe02vj2wo?at_medium=RSS&at_campaign=rss
2025-12-17-01-24-28 +0000,nypost,Famed Australian Rabbi Eli Schlanger killed in Bondi Beach terrorist attack laid to rest: ‘The loss is unspeakable’,https://nypost.com/2025/12/16/world-news/famed-australian-rabbi-killed-in-bondi-beach-massacre-laid-to-rest/
2025-12-17-01-18-35 +0000,wapo,"After secret church trial, Illinois N. American Anglican bishop acquitted",https://www.washingtonpost.com/investigations/2025/12/16/stewart-ruch-angilican-bishop-aquitted/
2025-12-17-01-11-54 +0000,nyt,Team Races Against Time to Save a Tangled Sea Lion in British Columbia,https://www.nytimes.com/2025/12/16/world/canada/sea-lion-rescue-cowichan-bay-vancouver.html
2025-12-17-01-11-43 +0000,nyt,Australia Doubles Down on Gun Control in Wake of Bondi Beach Shooting,https://www.nytimes.com/2025/12/16/world/australia/australia-gun-control-bondi-shooting.html
2025-12-17-01-09-13 +0000,nyt,"U.S. Is Seeking Exemption From a European Climate Law, Officials Say",https://www.nytimes.com/2025/12/16/climate/trump-europe-methane-rules.html
2025-12-17-01-06-00 +0000,wsj,Rob Reiner’s Son Charged in Double Homicide,https://www.wsj.com/us-news/nick-reiner-rob-reiner-death-charges-hearing-50c012bf
2025-12-17-01-04-27 +0000,nyt,India Charges Pakistan-Based Groups in April Terrorist Attack in Kashmir,https://www.nytimes.com/2025/12/16/world/asia/india-pakistan-charges-kashmir.html
2025-12-17-01-00-00 +0000,wsj,U.S. Tanker Seizure Has Paralyzed Venezuelan Oil Shipping—Except Chevron’s,https://www.wsj.com/world/americas/venezuela-oil-chevron-0dca243f
2025-12-17-00-56-08 +0000,nyt,Jared Kushner’s Affinity Partners Pulls Out of Bid for Warner Bros. Discovery,https://www.nytimes.com/2025/12/16/business/kushner-paramount-warner-bros-discovery.html
2025-12-17-00-52-37 +0000,latimes,"SoCal rabbi, victim of 2019 antisemitic shooting, mourns relative slain in Sydney",https://www.latimes.com/california/story/2025-12-16/socal-rabbi-shot-2019-mourns-family-member-killed-sydney
2025-12-17-00-52-12 +0000,cbc,Via Rail CEO stepping down as Crown corporation faces increasing scrutiny,https://www.cbc.ca/news/politics/via-rail-ceo-stepping-down-9.7018907?cmp=rss
2025-12-17-00-50-27 +0000,wapo,"Coast Guard enacts policy calling swastikas, nooses ‘potentially divisive’",https://www.washingtonpost.com/national-security/2025/12/16/coast-guard-swastikas-nooses/
2025-12-17-00-49-32 +0000,nyt,Trump Expands Travel Ban and Restrictions to 20 More Countries,https://www.nytimes.com/2025/12/16/us/politics/trump-expanded-travel-ban.html
2025-12-17-00-44-00 +0000,wsj,Blackstone Leads $400 Million Investment in Cyber Startup Cyera,https://www.wsj.com/tech/ai/blackstone-leads-400-million-investment-in-cyber-startup-cyera-a6b74b91?mod=pls_whats_news_us_business_f
2025-12-17-00-36-56 +0000,wapo,Police release ‘enhanced photo’ of Brown University shooting person of interest,https://www.washingtonpost.com/nation/2025/12/16/brown-university-shooting-investigation-providence/
2025-12-17-00-33-34 +0000,latimes,"Cerritos couple found dead in murder-suicide, authorities say",https://www.latimes.com/california/story/2025-12-16/cerritos-couple-found-dead-murder-suicide
2025-12-17-00-27-23 +0000,nyt,"US Boat Strikes Shift to Pacific, Placing Colombia on Watch",https://www.nytimes.com/2025/12/16/world/americas/boat-strikes-colombia-usa-trump-petro.html
2025-12-17-00-24-00 +0000,wsj,New Video Shows Suspected Brown Gunman’s Movements Before and After Attack,https://www.wsj.com/us-news/brown-university-shooting-suspect-photo-release-7e4cbe20
2025-12-17-00-23-46 +0000,nyt,U.S. Threatens Penalties Against European Tech Firms Amid Regulatory Fight,https://www.nytimes.com/2025/12/16/business/economy/us-eu-tech-penalties.html
2025-12-17-00-21-30 +0000,nyt,"Trinidad and Tobago Sides With U.S. in Battle Against Venezuela, Military Tool Suggests",https://www.nytimes.com/2025/12/16/world/americas/trinidad-and-tobago-us-military-venezuela.html
2025-12-17-00-20-19 +0000,nyt,"3 Days After Deadly Brown Shooting, Killer and Motive Remain a Mystery",https://www.nytimes.com/2025/12/16/us/brown-university-shooter-search-investigation.html
2025-12-17-00-17-55 +0000,wapo,Nick Reiner charged with murder in killing of parents,https://www.washingtonpost.com/nation/2025/12/16/nick-reiner-murder-charges/
2025-12-17-00-08-00 +0000,wsj,Lennar Fourth-Quarter Profit Falls as Housing Market Remains Stagnant,https://www.wsj.com/business/earnings/lennar-profit-falls-as-housing-market-remains-stagnant-c888fdda?mod=pls_whats_news_us_business_f
2025-12-17-00-06-34 +0000,nypost,Why Warner Bros. Discovery shareholders shouldn’t count on a holiday bidding war,https://nypost.com/2025/12/16/media/why-warner-bros-discovery-shareholders-shouldnt-count-on-a-holiday-bidding-war/
2025-12-17-00-04-09 +0000,bbc,Roads or rice fields - Madagascar's highway dilemma,https://www.bbc.com/news/articles/cqjeqx007rlo?at_medium=RSS&at_campaign=rss
2025-12-17-00-03-58 +0000,bbc,US military build-up in Caribbean has shadows of the past - but differences are stark,https://www.bbc.com/news/articles/c4g92dj8l3eo?at_medium=RSS&at_campaign=rss
2025-12-17-00-02-47 +0000,latimes,Eaton fire survivors ask Edison for emergency housing relief,https://www.latimes.com/environment/story/2025-12-16/eaton-fire-survivors-ask-edison-for-emergency-housing-relief
2025-12-17-00-01-07 +0000,nyt,Penguins Become Prey for the Pumas of Patagonia,https://www.nytimes.com/2025/12/16/science/penguins-pumas-patagonia.html
2025-12-17-00-01-06 +0000,nyt,"When the Bones Were Good, These Bees Buried Their Babies",https://www.nytimes.com/2025/12/16/science/bees-bones-nests.html
2025-12-16-23-59-00 +0000,wsj,"The Trump administration expanded its travel ban to cover five additional countries, and added partial bans on 15 additional countries",https://www.wsj.com/politics/policy/trump-administration-expands-travel-ban-to-additional-countries-293a9a48
2025-12-16-23-43-08 +0000,missionlocal,S.F. supervisors pass bill requiring 3.5 years of rental aid for tenants displaced by new housing,https://missionlocal.org/2025/12/sf-tenant-protections-legislation/
2025-12-16-23-42-59 +0000,missionlocal,S.F. moves to accelerate stalled housing at Tenderloin food hall site,https://missionlocal.org/2025/12/sf-accelerate-stalled-housing-tenderloin-la-cocina/
2025-12-16-23-32-50 +0000,bbc,'Felt like humiliation' - Egypt reacts to Salah's Liverpool row,https://www.bbc.com/sport/articles/clydxyg1l4do?at_medium=RSS&at_campaign=rss
2025-12-16-23-24-21 +0000,wapo,Nick Reiner struggled with addiction and with his parents,https://www.washingtonpost.com/nation/2025/12/16/nick-reiner-dopey-podcast/
2025-12-16-23-20-50 +0000,nyt,Two More Heritage Foundation Trustees Resign Over Support for Tucker Carlson,https://www.nytimes.com/2025/12/16/us/politics/heritage-foundation-trustees-resign-tucker-carlson.html
2025-12-16-23-19-39 +0000,nyt,Man Who Plowed Car Into Liverpool F.C. Parade Is Sentenced to 21 Years,https://www.nytimes.com/2025/12/16/world/europe/uk-liverpool-parade-attack-paul-doyle.html
2025-12-16-23-17-38 +0000,bbc,Jewish Australians on why Bondi is a 'sanctuary' for them,https://www.bbc.com/news/videos/c1w947rpv3qo?at_medium=RSS&at_campaign=rss
2025-12-16-23-16-03 +0000,latimes,Port of Los Angeles records bustling 2025 but expects trade to fall off next year,https://www.latimes.com/business/story/2025-12-16/port-of-la-records-busy-2025-but-expects-trade-to-fall-off-next-year
2025-12-16-23-16-00 +0000,wsj,"Inflationary pressures in Canada appear contained, Bank of Canada Gov. Tiff Macklem said Tuesday",https://www.wsj.com/articles/inflationary-pressures-appear-contained-bank-of-canadas-macklem-says-cf66ed2b
2025-12-16-23-09-40 +0000,nypost,Amal Clooney blasted as a mouthpiece for Hollywood liberals and ‘kangaroo court’ the ICC by critics,https://nypost.com/2025/12/16/world-news/amal-clooney-blasted-as-a-mouthpiece-for-hollywood-liberals-and-kangaroo-court-by-critics/
2025-12-16-23-02-07 +0000,nyt,Hegseth Declines to Show Lawmakers Boat Strike Video,https://www.nytimes.com/2025/12/16/us/politics/hegseth-congress-boat-strike-video.html
2025-12-16-23-01-51 +0000,nyt,"Alan Jackson, Nick Reiner’s Lawyer, Represented Harvey Weinstein, Karen Read and More",https://www.nytimes.com/2025/12/16/us/alan-jackson-nick-reiner-lawyer.html
2025-12-16-22-54-26 +0000,wapo,The Trump administration is trying to talk voters into liking the economy,https://www.washingtonpost.com/business/2025/12/16/trump-economy-affordability-concerns/
2025-12-16-22-54-00 +0000,wsj,Opinion | Europe Wakes Itself Up on Defense,https://www.wsj.com/opinion/europe-defense-nato-mark-rutte-friedrich-merz-russia-vladimir-putin-559a3890
2025-12-16-22-48-00 +0000,wsj,Opinion | Where Are Those Manufacturing Jobs?,https://www.wsj.com/opinion/jobs-report-bls-manufacturing-tariffs-economy-donald-trump-f1f6d219
2025-12-16-22-40-00 +0000,wsj,Opinion | ISIS Rears Its Head Once More,https://www.wsj.com/opinion/isis-syria-australia-terrorism-middle-east-2b6e0887
2025-12-16-22-40-00 +0000,nyt,Rob and Nick Reiner: A Father-Son Relationship in Several Acts,https://www.nytimes.com/2025/12/16/us/rob-nick-reiner-father-son-being-charlie.html
