pubdate,source,title,link
2025-12-17-14-53-55 +0000,nyt,"Norman Podhoretz, Influential Editor and Neoconservative Force, Dies at 95",https://www.nytimes.com/2025/12/16/us/politics/norman-podhoretz-dead.html
2025-12-17-14-50-42 +0000,nyt,Next Fed Chair in ‘No-Win Scenario’ as Selection Process Draws to a Close,https://www.nytimes.com/2025/12/17/us/politics/trump-federal-reserve-chair-independence.html
2025-12-17-14-48-16 +0000,nypost,Teen who shielded Bondi Beach victims’ kids with her own injured body hailed as ‘true heroine’ after massacre,https://nypost.com/2025/12/17/world-news/14-year-old-teen-shields-bondi-victims-kids-with-her-own-injured-body/
2025-12-17-14-45-15 +0000,bbc,Starmer tells Abramovich to 'pay up now' or face court,https://www.bbc.com/news/articles/cx2e64lr3zeo?at_medium=RSS&at_campaign=rss
2025-12-17-14-44-47 +0000,latimes,Nick Reiner's elusive movements across L.A. the weekend his parents were killed,https://www.latimes.com/california/story/2025-12-17/rob-reiner-santa-monica-nick-reiners-movements
2025-12-17-14-38-42 +0000,bbc,Six-month wait for driving tests set to last until 2027,https://www.bbc.com/news/articles/cqlkg11d5gxo?at_medium=RSS&at_campaign=rss
2025-12-17-14-38-34 +0000,bbc,Warner Bros favours Netflix offer over $108bn Paramount bid,https://www.bbc.com/news/articles/cz687wv9vqxo?at_medium=RSS&at_campaign=rss
2025-12-17-14-36-00 +0000,wsj,Justice Department Indicts Adderall Startup After CEO’s Conviction,https://www.wsj.com/us-news/law/justice-department-indicts-adderall-startup-after-ceos-conviction-7e81e065
2025-12-17-14-34-53 +0000,bbc,New £150m funding package to protect jobs at Grangemouth,https://www.bbc.com/news/articles/c75ve576x5eo?at_medium=RSS&at_campaign=rss
2025-12-17-14-32-43 +0000,nypost,Champion bodybuilder Wang Kun who boasted about living ‘monk’s life’ dead at just 30,https://nypost.com/2025/12/17/world-news/champion-bodybuilder-wang-kun-dead-at-30/
2025-12-17-14-30-28 +0000,wapo,A “recession” is arriving for people who want jobs in technology,https://www.washingtonpost.com/business/2025/12/17/tech-jobs-unemployment/
2025-12-17-14-28-22 +0000,nyt,"Warner Bros. Urges Shareholders to Reject Paramount Takeover Bid, Saying Ellisons ‘Misled’ Them",https://www.nytimes.com/2025/12/17/business/media/warner-bros-paramount-takeover-netflix.html
2025-12-17-14-28-00 +0000,wsj,"Nucor, Steel Dynamics Warn of Profit Shortfalls",https://www.wsj.com/business/earnings/nucor-steel-dynamics-warn-of-profit-shortfalls-520fe623?mod=pls_whats_news_us_business_f
2025-12-17-14-27-18 +0000,bbc,Pay freeze for Father Christmas but elves fare better,https://www.bbc.com/news/articles/cx25eln2kd0o?at_medium=RSS&at_campaign=rss
2025-12-17-14-24-33 +0000,nyt,Here’s the latest.,https://www.nytimes.com/live/2025/12/17/us/rob-nick-reiner-murder-charges/heres-the-latest
2025-12-17-14-18-53 +0000,nyt,Trump Revised Chevron’s Venezuela Deal. Maduro’s Oil Trader Profited.,https://www.nytimes.com/2025/12/17/world/americas/trump-chevron-venezuela-oil.html
2025-12-17-14-18-10 +0000,bbc,Why this month's inflation figure may be good news for you,https://www.bbc.com/news/articles/c0r9x1xx0x7o?at_medium=RSS&at_campaign=rss
2025-12-17-14-13-34 +0000,cbc,Pressure mounts on Quebec Liberal leader after illegal fundraising allegations,https://www.cbc.ca/news/canada/montreal/pablo-rodriguez-liberals-meeting-9.7019192?cmp=rss
2025-12-17-14-12-19 +0000,bbc,Venezuela denounces Trump's order for ship blockade as 'warmongering threats',https://www.bbc.com/news/articles/c4gej5ezyypo?at_medium=RSS&at_campaign=rss
2025-12-17-14-06-31 +0000,nyt,UK Rejoins EU’s Erasmus Student Exchange Program That It Left After Brexit,https://www.nytimes.com/2025/12/17/world/europe/uk-eu-erasmus-scheme-students-brexit.html
2025-12-17-14-01-23 +0000,nyt,Suspect in Bondi Beach Killings Is Charged With Murder and Terrorism,https://www.nytimes.com/2025/12/17/world/asia/australia-bondi-beach-shooting.html
2025-12-17-14-00-00 +0000,missionlocal,Nature’s golden palette,https://missionlocal.org/2025/12/sf-photos-natures-golden-palette/
2025-12-17-14-00-00 +0000,wsj,U.S. Natural Gas Futures Pick Up After String of Losses,https://www.wsj.com/articles/u-s-natural-gas-futures-pick-up-after-string-of-losses-ab268651?mod=rss_markets_main
2025-12-17-13-57-48 +0000,bbc,Six Canadian MPs denied entry by Israel to occupied West Bank,https://www.bbc.com/news/articles/c30j90m09g8o?at_medium=RSS&at_campaign=rss
2025-12-17-13-57-00 +0000,wsj,Tricolor Executives Charged Over Subprime Auto Lender’s Collapse,https://www.wsj.com/articles/tricolor-executives-charged-over-subprime-auto-lenders-collapse-6318b474?mod=rss_markets_main
2025-12-17-13-56-50 +0000,nyt,Trump Dangles Cash Payments to Assuage Affordability Concerns,https://www.nytimes.com/2025/12/17/us/politics/trump-cash-payments.html
2025-12-17-13-55-27 +0000,nyt,Australia Shooting Is a Reminder of Islamic State’s Power to Inspire Attacks,https://www.nytimes.com/2025/12/17/world/europe/islamic-state-attacks-australia.html
2025-12-17-13-54-31 +0000,bbc,Ex-Labour mayor joins Green Party,https://www.bbc.com/news/articles/cdrnm56xdr5o?at_medium=RSS&at_campaign=rss
2025-12-17-13-54-08 +0000,bbc,Nick Reiner charged with murder of his parents Rob and Michele,https://www.bbc.com/news/articles/c5yjv5md3jzo?at_medium=RSS&at_campaign=rss
2025-12-17-13-42-26 +0000,nyt,South Africa Arrests Workers Processing U.S. Refugee Applications,https://www.nytimes.com/2025/12/17/world/africa/south-africa-kenya-workers.html
2025-12-17-13-36-25 +0000,bbc,"What we know about Nick Reiner, son charged with murder of director Rob Reiner",https://www.bbc.com/news/articles/cvgj14l3v8vo?at_medium=RSS&at_campaign=rss
2025-12-17-13-32-00 +0000,wsj,"Warner Rejects Paramount’s Hostile Bid, Saying Netflix Deal Still Superior",https://www.wsj.com/business/media/warner-rejects-paramounts-hostile-bid-saying-netflix-deal-still-superior-3fda76ee?mod=pls_whats_news_us_business_f
2025-12-17-13-29-14 +0000,bbc,Starmer calls doctors' strike 'dangerous' as five-day walkout begins,https://www.bbc.com/news/articles/c98nqz29vg2o?at_medium=RSS&at_campaign=rss
2025-12-17-13-29-13 +0000,nyt,A New Stage in the Fight for Warner Bros. Discovery,https://www.nytimes.com/2025/12/17/business/dealbook/paramount-warner-bros-netflix.html
2025-12-17-13-25-40 +0000,bbc,Five of the greatest players never to win Afcon,https://www.bbc.com/sport/football/articles/c7v84d3j983o?at_medium=RSS&at_campaign=rss
2025-12-17-13-25-26 +0000,nypost,Nick Reiner due in court for parents’ murders day after he was a no-show,https://nypost.com/2025/12/17/us-news/nick-reiner-due-in-court-for-parents-murders-day-after-he-was-a-no-show/
2025-12-17-13-22-00 +0000,nyt,"Israel Says It Killed Senior Hamas Commander, Despite Cease-Fire",https://www.nytimes.com/2025/12/13/world/middleeast/israel-hamas-commander-gaza-strike.html
2025-12-17-13-18-00 +0000,wsj,Venezuela Tanker Blockade Has Limited Upside for Crude,https://www.wsj.com/finance/commodities-futures/oil-rises-on-likely-technical-recovery-5f5fa39d?mod=rss_markets_main
2025-12-17-13-14-31 +0000,wapo,"As Europe eyes Russia’s frozen assets, Belgium fears Moscow’s revenge",https://www.washingtonpost.com/world/2025/12/17/russia-europe-belgium-frozen-assets-intimidation/
2025-12-17-13-14-05 +0000,bbc,Why is Trump threatening Venezuela's Maduro?,https://www.bbc.com/news/articles/c93n4nx5yqro?at_medium=RSS&at_campaign=rss
2025-12-17-13-11-00 +0000,wsj,Warner Rejected Paramount’s Tender Offer. What to Know.,https://www.wsj.com/business/media/paramount-made-a-hostile-bid-for-warner-after-netflix-deal-what-happens-next-ebf11d66?mod=pls_whats_news_us_business_f
2025-12-17-13-10-29 +0000,nyt,"Brown University Students Were Prepping for an Exam. Then, a Gunman at the Classroom Door.",https://www.nytimes.com/2025/12/17/us/exam-review-brown-shooting.html
2025-12-17-13-10-28 +0000,nyt,"‘Paddington: The Musical’: At Just 4 Feet, He’s London’s Biggest New Stage Star",https://www.nytimes.com/2025/12/17/arts/paddington-bear-musical.html
2025-12-17-13-09-56 +0000,bbc,Left-wing candidate beats Starmer ally to lead UK's biggest union,https://www.bbc.com/news/articles/ce3wdv7rg67o?at_medium=RSS&at_campaign=rss
2025-12-17-13-07-33 +0000,nypost,‘Melania’ Trump documentary trailer shows run-up to husband Donald’s inauguration: ‘Here we go again’,https://nypost.com/2025/12/17/us-news/melania-trump-documentary-trailer-shows-run-up-to-husband-donalds-inauguration/
2025-12-17-13-05-03 +0000,wapo,"In tribute to late wife, husband rebuilds her snowman village at Kansas mall",https://www.washingtonpost.com/lifestyle/2025/12/17/kansas-snowman-village-mall-wife/
2025-12-17-13-04-00 +0000,wsj,TransAlta Gets Energy Department Order to Keep Washington Coal-Fired Plant in Operation for 90 Days,https://www.wsj.com/business/energy-oil/transalta-gets-energy-department-order-to-keep-washington-coal-fired-plant-in-operation-for-90-days-98d28ee4?mod=pls_whats_news_us_business_f
2025-12-17-13-02-38 +0000,nypost,Rob Reiner’s daughter found his body — but didn’t initially realize her mom was also murdered,https://nypost.com/2025/12/17/us-news/rob-reiners-daughter-found-his-body-but-didnt-initially-realize-her-mom-was-also-murdered/
2025-12-17-13-02-17 +0000,nyt,"Billy Crystal, Larry David and Others Remember Rob Reiner as a ‘Master Story Teller’",https://www.nytimes.com/2025/12/17/us/billy-crystal-larry-david-rob-reiner-statement.html
2025-12-17-12-59-58 +0000,nypost,How Bondi Beach gunman potentially planned massacre months ahead — with ‘final insult’ to victims’ families,https://nypost.com/2025/12/17/world-news/bondi-beach-gunman-sajid-akram-potentially-planned-massacre-months-ahead-ultimate-final-insult-to-victims/
2025-12-17-12-59-17 +0000,nypost,"Warner Bros. Discovery board urges shareholders to reject Paramount’s hostile takeover bid, throws support behind Netflix merger",https://nypost.com/2025/12/17/business/warner-bros-discovery-board-urges-shareholders-to-reject-paramounts-hostile-takeover-bid-throws-support-behind-netflix-merger/
2025-12-17-12-48-38 +0000,bbc,US accused of using illegal workers at centre processing refugee claims in South Africa,https://www.bbc.com/news/articles/c2468q3y75vo?at_medium=RSS&at_campaign=rss
2025-12-17-12-40-59 +0000,nyt,Trump Orders Blockade of Some Oil Tankers to and From Venezuela,https://www.nytimes.com/2025/12/16/us/politics/trump-blockade-venezuela-oil-tankers.html
2025-12-17-12-40-53 +0000,bbc,Lower clothing and food prices help inflation fall by more than expected,https://www.bbc.com/news/articles/cy7vjz3ngy7o?at_medium=RSS&at_campaign=rss
2025-12-17-12-40-41 +0000,bbc,UK will rejoin Erasmus student scheme in 2027,https://www.bbc.com/news/articles/cg4ng7ee9vwo?at_medium=RSS&at_campaign=rss
2025-12-17-12-28-00 +0000,wsj,"After Bondi Suspects’ Trip, Philippines Hunts for Signs of ISIS-Linked Resurgence",https://www.wsj.com/world/after-bondi-suspects-trip-philippines-hunts-for-signs-of-isis-linked-resurgence-964b5a40
2025-12-17-12-26-07 +0000,nypost,Nick Reiner threw ‘terrifying’ tantrums even as a kid: ‘So much anger in his eyes’,https://nypost.com/2025/12/17/us-news/nick-reiner-threw-terrifying-tantrums-even-as-a-kid-family-friend/
2025-12-17-12-25-00 +0000,wsj,Franco-German Defense Group KNDS to Go Public in Dual Listing,https://www.wsj.com/business/c-suite/franco-german-defense-group-knds-to-go-public-in-dual-listing-8a394dd7
2025-12-17-12-24-00 +0000,wsj,General Mills Quarterly Profit Falls Amid Price Cuts,https://www.wsj.com/business/earnings/general-mills-quarterly-profit-falls-amid-price-cuts-1a865046?mod=pls_whats_news_us_business_f
2025-12-17-12-16-50 +0000,bbc,Weight-loss jab ads banned for exploiting body insecurities,https://www.bbc.com/news/articles/cly5v89xny3o?at_medium=RSS&at_campaign=rss
2025-12-17-12-15-00 +0000,wsj,Sterling Could Fall Against Australian Dollar on Monetary Policy Divergence,https://www.wsj.com/finance/currencies/asian-currencies-consolidate-fed-rate-cut-prospects-may-support-1d033590?mod=rss_markets_main
2025-12-17-12-13-24 +0000,nyt,"Australia, After a Mass Shooting During Hanukkah, Looks for a Path Forward",https://www.nytimes.com/2025/12/16/world/australia/sydney-shooting-antisemitism-path-forward.html
2025-12-17-12-12-01 +0000,nypost,Hero cop who killed Bondi Beach terrorist with ‘once-in-a-lifetime shot’ is ID’d,https://nypost.com/2025/12/17/world-news/hero-cop-who-killed-bondi-beach-terrorist-with-once-in-a-lifetime-shot-is-idd/
2025-12-17-12-11-13 +0000,latimes,"Warner Bros. rejects Paramount's hostile bid, accuses Ellison family of failing to put money into the deal",https://www.latimes.com/entertainment-arts/business/story/2025-12-17/warner-bros-accusations-against-paramount-ellison-family-what-to-know
2025-12-17-12-08-44 +0000,nypost,"Older Americans driving polarization, online conspiracy theories, study finds",https://nypost.com/2025/12/17/us-news/older-americans-driving-polarization-and-online-conspiracies-study-finds/
2025-12-17-12-01-00 +0000,startribune,Why Hormel is struggling to profit off America’s protein obsession,https://www.startribune.com/hormel-protein-diet-healthy-meat-pork-spam-bacon-jennie-o-high-cost-profit-sales-why/601541157
2025-12-17-12-00-01 +0000,startribune,Minnesota’s immigration cases are increasingly held in secret,https://www.startribune.com/minnesotas-immigration-cases-are-increasingly-held-in-secret/601542378
2025-12-17-12-00-00 +0000,nypost,"Fitness trainer scammed would-be NYC renters out of $100K, bilked workout customers before fleeing to Connecticut: DA",https://nypost.com/2025/12/17/us-news/serial-scammer-stole-100k-from-renters-in-fraud-scheme-da/
2025-12-17-12-00-00 +0000,missionlocal,Asylum-seekers are desperate for lawyers. Scammers are filling the gap,https://missionlocal.org/2025/12/sf-asylum-seekers-ice-immigration-scams/
2025-12-17-12-00-00 +0000,missionlocal,Fake immigration lawyers are scamming Bay Area families. Here’s how to protect yourself.,https://missionlocal.org/2025/12/sf-bay-area-immigration-attorney-scam-guide/
2025-12-17-12-00-00 +0000,startribune,3 local chefs share the traditional holiday recipes they make at home,https://www.startribune.com/minnesota-chefs-holiday-cooking-recipe-gai-noi-ann-ahmed-all-saints-fika/601533596
2025-12-17-12-00-00 +0000,startribune,Anoka-Hennepin educators to vote on strike after negotiations fail,https://www.startribune.com/anoka-hennepin-educators-to-vote-on-strike-after-negotiations-fail/601543507
2025-12-17-12-00-00 +0000,startribune,Minneapolis teen pursues his hoop dreams in stripes as youngest high school official in the city,https://www.startribune.com/basketball-across-minnesota-teenager-pursues-career-as-basketball-referee/601543508
2025-12-17-12-00-00 +0000,startribune,Roper: Delayed George Floyd Square decision came at a cost,https://www.startribune.com/george-floyd-square-minnapolis/601546547
2025-12-17-11-55-00 +0000,wsj,"Rising jobless rate under Trump has some precedent, and it often ain’t pretty. Read more in today’s WSJ Politics newsletter:",https://www.wsj.com/politics/policy/rising-jobless-rate-under-trump-has-some-precedent-and-it-often-aint-pretty-eddbc290
2025-12-17-11-46-23 +0000,wapo,Alleged Bondi gunman charged with 59 offenses as first funerals held,https://www.washingtonpost.com/world/2025/12/17/australia-bondi-beach-murder-charged/
2025-12-17-11-38-00 +0000,wsj,Basic Materials Roundup: Market Talk,https://www.wsj.com/business/basic-materials-roundup-market-talk-b09cb164?mod=rss_markets_main
2025-12-17-11-37-26 +0000,nyt,Harvard Secretly Investigates Students Over Larry Summers Video on Epstein,https://www.nytimes.com/2025/12/17/us/harvard-investigates-students-larry-summers-video-epstein.html
2025-12-17-11-32-00 +0000,wsj,Financial Services Roundup: Market Talk,https://www.wsj.com/business/financial-services-roundup-market-talk-37e31586?mod=rss_markets_main
2025-12-17-11-30-36 +0000,bbc,Fallout and the secret of the perfect video game adaptation,https://www.bbc.com/news/articles/cvgr488vlmmo?at_medium=RSS&at_campaign=rss
2025-12-17-11-27-00 +0000,wsj,"Tech, Media & Telecom Roundup: Market Talk",https://www.wsj.com/business/tech-media-telecom-roundup-market-talk-306969b2?mod=rss_markets_main
2025-12-17-11-23-00 +0000,wsj,Energy & Utilities Roundup: Market Talk,https://www.wsj.com/business/energy-utilities-roundup-market-talk-1b443a71?mod=pls_whats_news_us_business_f
2025-12-17-11-20-00 +0000,wsj,Auto & Transport Roundup: Market Talk,https://www.wsj.com/business/auto-transport-roundup-market-talk-9b565a8a?mod=pls_whats_news_us_business_f
2025-12-17-11-16-17 +0000,bbc,What are the 'ghost ships' Venezuela is using to evade oil sanctions?,https://www.bbc.com/news/articles/c4g562vz34ro?at_medium=RSS&at_campaign=rss
2025-12-17-11-16-17 +0000,nypost,IRS whistleblowers tell ‘Pod Force One’ of ‘unprecedented’ corruption swept ‘under rug’ by Hunter Biden pardon,https://nypost.com/2025/12/17/us-news/irs-whistleblowers-reveal-unprecedented-biden-corruption-swept-under-rug-by-hunter-pardon/
2025-12-17-11-14-17 +0000,bbc,Why are UK prices still rising?,https://www.bbc.com/news/articles/c17rgd8e9gjo?at_medium=RSS&at_campaign=rss
2025-12-17-11-07-00 +0000,wsj,"Copper Supported by Supply Stress, Easing Monetary Policy Bets",https://www.wsj.com/finance/gold-edges-higher-aided-by-fed-rate-cut-prospects-4b7fa245?mod=rss_markets_main
2025-12-17-11-01-19 +0000,nyt,"Dutch Return ‘Java Man’ Bones, With 40,000 Fossils Set to Follow",https://www.nytimes.com/2025/12/17/arts/java-man-indonesia-netherlands.html
2025-12-17-11-00-44 +0000,wapo,A school locked down after AI flagged a gun. It was a clarinet.,https://www.washingtonpost.com/nation/2025/12/17/ai-gun-school-detection/
2025-12-17-11-00-35 +0000,wapo,‘You see this news?’: What Charlie Kirk’s alleged killer told friends after the attack,https://www.washingtonpost.com/investigations/interactive/2025/tyler-robinson-charlie-kirk-shooting/
2025-12-17-11-00-00 +0000,latimes,A teenager processes life after disaster. 'My whole life was stripped away',https://www.latimes.com/california/story/2025-12-17/how-one-teenager-is-coping-after-palisades-fire
2025-12-17-11-00-00 +0000,latimes,The fire took his sister and his lifelong home. He's been fighting to get back ever since,https://www.latimes.com/california/story/2025-12-17/fire-destruction-altadena-community
2025-12-17-11-00-00 +0000,latimes,This mom loves the buzz of her Palisades neighborhood rising from the ashes,https://www.latimes.com/california/story/2025-12-17/palisades-fire-reconstruction-gives-hope-to-one-resident
2025-12-17-11-00-00 +0000,latimes,"For L.A.'s mayor, a Palisades recovery marked by missteps, reversals and delays",https://www.latimes.com/california/story/2025-12-17/la-mayor-year-of-false-starts
2025-12-17-11-00-00 +0000,latimes,After the fires: A glance back at The Times' coverage of the Eaton and Palisades wildfires,https://www.latimes.com/california/story/2025-12-17/after-fires-glance-back-at-times-coverage-of-eaton-palisades-wildfires
2025-12-17-11-00-00 +0000,latimes,L.A.'s hydrants ran dry during the fires. Residents are still demanding solutions,https://www.latimes.com/environment/story/2025-12-17/la-fires-water-system
2025-12-17-11-00-00 +0000,latimes,"After the Fires: L.A.'s double disaster left thousands of scars, and the healing will take years",https://www.latimes.com/after-the-fires
2025-12-17-11-00-00 +0000,latimes,Reiner family tragedy sheds light on pain of families grappling with addiction,https://www.latimes.com/science/story/2025-12-17/reiner-family-tragedy-sheds-light-on-pain-of-families-grappling-with-addiction
2025-12-17-11-00-00 +0000,latimes,"After Palisades failures, is LAFD prepared for the next major wildfire?",https://www.latimes.com/california/story/2025-12-17/after-palisades-failures-is-lafd-prepared-for-next-major-wildfire
2025-12-17-11-00-00 +0000,latimes,This housekeeper lost her job in the Palisades fire — but not her hope,https://www.latimes.com/california/story/2025-12-17/palisades-fire-housekeeper-lost-job-has-hope
2025-12-17-11-00-00 +0000,latimes,Lopez: Nearly every house on their west Altadena block was incinerated. Nearly everyone will be back,https://www.latimes.com/california/story/2025-12-17/nearly-every-house-on-their-west-altadena-block-was-incinerated-nearly-everyone-will-be-back
2025-12-17-11-00-00 +0000,latimes,"On a $1 houseboat, one of the Palisades fire's 'great underdogs' fights to stay afloat",https://www.latimes.com/environment/story/2025-12-17/the-great-underdogs-of-the-palisades-fire-fight-to-stay-afloat
2025-12-17-11-00-00 +0000,latimes,Edison neglected maintenance of its aging transmission lines before the Jan. 7 fires. Now it's trying to catch up,https://www.latimes.com/environment/story/2025-12-17/edison-neglected-maintenance-of-its-aging-transmission-lines-before-jan-7-fires-now-its-trying-to-catch-up
2025-12-17-11-00-00 +0000,latimes,"After a rocky start, rebuilding in the Palisades and Altadena is gaining momentum",https://www.latimes.com/california/story/2025-12-17/after-rocky-start-rebuilding-in-palisades-altadena-is-gaining-momentum
2025-12-17-11-00-00 +0000,latimes,"'Both sides botched it.' Bass, in unguarded moment, rips responses to Palisades, Eaton fires",https://www.latimes.com/california/story/2025-12-17/both-sides-botched-it-bass-rips-responses-to-palisades-eaton-fires
2025-12-17-11-00-00 +0000,latimes,"Arellano: With his un-Christian Rob Reiner insults, Trump proves he's the real 'Meathead'",https://www.latimes.com/california/story/2025-12-17/donald-trump-rob-reiner-insults-holidays
2025-12-17-11-00-00 +0000,latimes,Recipe for L.A.'s fire disaster: Intense rains followed by unprecedented heat and dry conditions,https://www.latimes.com/california/story/2025-12-17/palisades-and-eaton-fires-fueled-by-a-catastrophic-combination-of-worst-case-scenarios
2025-12-17-11-00-00 +0000,latimes,"Hiltzik: Republicans don't have a healthcare plan, just a plan to kill Obamacare",https://www.latimes.com/business/story/2025-12-17/republicans-dont-have-healthcare-plan-just-a-plan-to-kill-obamacare
2025-12-17-11-00-00 +0000,latimes,"At a Silicon Valley summit, robots fold laundry—and investors open their wallets",https://www.latimes.com/business/story/2025-12-17/robot-conference-shows-how-californian-companies-are-leading-bot-wars
2025-12-17-11-00-00 +0000,startribune,Old National claims rival Bell Bank staged ‘coup d’etat’ at its Brainerd branch,https://www.startribune.com/old-national-claims-rival-bell-bank-staged-coup-detat-at-its-brainerd-branch/601547449
2025-12-17-11-00-00 +0000,startribune,"Analysis: Vikings’ Will Reichard, with possible boost from new K-ball rules, is helping kickers shatter NFL records",https://www.startribune.com/vikings-kicker-will-reichard-helping-shatter-nfl-field-goal-records-with-new-k-ball-rule/601546131
2025-12-17-11-00-00 +0000,wsj,Podcasters Love YouTube. That’s Making Podcast Advertising Less Predictable.,https://www.wsj.com/articles/podcasters-love-youtube-thats-making-podcast-advertising-less-predictable-cb8ffd5c?mod=pls_whats_news_us_business_f
2025-12-17-11-00-00 +0000,wapo,61% of young adults trust social media investing tips. But should they?,https://www.washingtonpost.com/business/2025/12/17/social-media-financial-advice/
2025-12-17-10-49-39 +0000,nyt,One Way the Brown Attack Was Unusual: The Gunman Escaped,https://www.nytimes.com/2025/12/17/us/brown-attack-manhunt-gunman-escaped.html
2025-12-17-10-30-00 +0000,wapo,George Washington portrait that helped inspire $1 bill will go to highest bidder,https://www.washingtonpost.com/nation/interactive/2025/washington-madison-stuart-portrait-auction/
2025-12-17-10-30-00 +0000,wsj,The Squishy Number Behind the Rise and Fall of Oracle’s Stock,https://www.wsj.com/finance/stocks/the-squishy-number-behind-the-rise-and-fall-of-oracles-stock-45461595?mod=pls_whats_news_us_business_f
2025-12-17-10-27-59 +0000,wapo,All the countries affected by Trump’s expanded travel ban,https://www.washingtonpost.com/world/2025/12/16/trump-travel-ban-countries-list/
2025-12-17-10-25-00 +0000,wsj,German Business Sentiment Unexpectedly Retreats as 2026 Outlook Weakens,https://www.wsj.com/economy/central-banking/german-business-sentiment-unexpectedly-retreats-as-2026-outlook-weakens-147be827
2025-12-17-10-23-55 +0000,bbc,'It's just a nightmare': Ten-year-old victim's mum speaks at Bondi memorial,https://www.bbc.com/news/videos/c93w7y8475qo?at_medium=RSS&at_campaign=rss
2025-12-17-10-11-24 +0000,bbc,How would a cut in UK interest rates affect me?,https://www.bbc.com/news/articles/c3dky111m40o?at_medium=RSS&at_campaign=rss
2025-12-17-10-11-13 +0000,nypost,Skydivers plunge to their death after parachutes tangled in mid-air,https://nypost.com/2025/12/17/world-news/italian-skydivers-plunge-to-their-death-after-parachutes-tangled-in-mid-air/
2025-12-17-10-02-14 +0000,nyt,Heating Costs Expected to Rise 9.2% This Winter,https://www.nytimes.com/2025/12/17/business/energy-environment/winter-heating-costs-increase.html
2025-12-17-10-01-44 +0000,nyt,Immigration Agents and Protesters Face Off in Frigid Minnesota,https://www.nytimes.com/2025/12/17/us/immigration-agents-protesters-roof-minnesota.html
2025-12-17-10-01-12 +0000,nyt,Free Nigerian Students Recount Mass Kidnapping,https://www.nytimes.com/2025/12/17/world/africa/nigeria-kidnapping-school.html
2025-12-17-10-00-44 +0000,wapo,2025 was supposed to be the year you bought a car,https://www.washingtonpost.com/business/2025/12/17/car-prices-sales-slowing/
2025-12-17-10-00-43 +0000,nyt,The Secret Trial of the General Who Refused to Attack Tiananmen Square,https://www.nytimes.com/2025/12/17/world/asia/china-general-tiananmen-square.html
