pubdate,source,title,link
2025-08-18-02-42-57 +0000,nypost,2 premature babies die from infection linked to suspected dish soap contamination at Italy hospital as director warns ‘not unique’ issue,https://nypost.com/2025/08/17/world-news/2-premature-babies-die-from-infection-linked-to-suspected-dish-soap-contamination-at-italy-hospital/
2025-08-18-02-40-31 +0000,nyt,Trump Officials Hint at Possible Concessions by Putin,https://www.nytimes.com/2025/08/17/us/politics/trump-witkoff-ukraine-putin-concessions.html
2025-08-18-02-21-24 +0000,cbc,WATCH | Why this Wales rugby team carried a friend in a wheelchair up a mountain,https://www.cbc.ca/player/play/9.6870363?cmp=rss
2025-08-18-01-55-44 +0000,latimes,"Bodies of Sacramento mother and baby, who were missing for weeks, are found in submerged car",https://www.latimes.com/california/story/2025-08-17/car-of-missing-mother-baby-found-underwater
2025-08-18-01-32-57 +0000,nypost,"Texas family of 6, including 2 children, narrowly escape house fire set by hooded arsonist while they slept",https://nypost.com/2025/08/17/us-news/texas-family-of-6-including-2-children-narrowly-escape-house-fire-set-by-hooded-arsonist-while-they-slept/
2025-08-18-01-30-04 +0000,nyt,Israelis Join Nationwide Rallies to Call for Release of Hostages,https://www.nytimes.com/2025/08/17/world/middleeast/israel-rallies-labor-strike.html
2025-08-18-01-25-05 +0000,nypost,Spain deploys military to battle 20 major wildfires across country as heat wave ravages Southern Europe,https://nypost.com/2025/08/17/world-news/spain-deploys-military-to-battle-20-major-wildfires-across-country-as-heat-wave-ravages-southern-europe/
2025-08-18-01-18-50 +0000,nyt,"The Trauma of Childhood in Gaza: No School, Few Toys, Little Hope",https://www.nytimes.com/2025/08/15/world/middleeast/gaza-children-school-play.html
2025-08-18-01-13-37 +0000,nyt,European Leaders to Join Zelensky for Meeting With Trump,https://www.nytimes.com/2025/08/17/us/politics/trump-european-leaders-zelensky-meeting.html
2025-08-18-01-07-37 +0000,bbc,"Expect smaller broccoli if heatwave continues, farmers warn",https://www.bbc.com/news/articles/c7541rxgez1o?at_medium=RSS&at_campaign=rss
2025-08-18-01-00-00 +0000,wsj,Strong Crop of Earnings Eases Investors’ Economic Concerns,https://www.wsj.com/finance/stocks/strong-crop-of-earnings-eases-investors-economic-concerns-7acc1772?mod=rss_markets_main
2025-08-18-00-44-59 +0000,nypost,"Hurricane Erin set to regain strength, bring life-threatening conditions to East Coast beaches",https://nypost.com/2025/08/17/us-news/hurricane-erin-set-to-regain-strength-bring-life-threatening-conditions-to-east-coast-beaches/
2025-08-18-00-44-00 +0000,latimes,Newsom demands information from Trump after Border Patrol swarms outside governor's news conference,https://www.latimes.com/california/story/2025-08-17/border-patrol-at-news-conference-newsom-demands-information-from-trump
2025-08-18-00-43-52 +0000,bbc,New wave of African pride rises in the Caribbean,https://www.bbc.com/news/articles/czxyw4w440vo?at_medium=RSS&at_campaign=rss
2025-08-18-00-40-06 +0000,nypost,10th South Carolina teen expected to surrender to cops in murder of 16-year-old lured to his end and filmed dying: reports,https://nypost.com/2025/08/17/us-news/10th-south-carolina-teen-expected-to-surrender-to-cops-in-murder-of-16-year-old-lured-to-his-end-and-filmed-dying-reports/
2025-08-18-00-19-27 +0000,48hills,SFPD surveillance unit’s close ties to crypto billionaire,https://48hills.org/2025/08/sfpd-surveillance-units-close-ties-to-crypto-billionaire/
2025-08-18-00-15-39 +0000,bbc,Whirlwind day of White House talks could reshape Ukraine's future,https://www.bbc.com/news/articles/ckglxlx5vldo?at_medium=RSS&at_campaign=rss
2025-08-18-00-00-38 +0000,48hills,How to unsell Mama Earth,https://48hills.org/2025/08/how-to-unsell-mama-earth/
2025-08-17-23-43-49 +0000,latimes,"Two New Yorkers arrested on suspicion of breaking into Redondo Beach home, zip-tying residents",https://www.latimes.com/california/story/2025-08-17/redondo-beach-home-invasion-zip-tied-arrests
2025-08-17-23-32-50 +0000,bbc,Health v heritage: Pigeon feeding ban sparks debate in India,https://www.bbc.com/news/articles/cvg3mj0vkzro?at_medium=RSS&at_campaign=rss
2025-08-17-23-03-19 +0000,bbc,Should Europe wean itself off US tech?,https://www.bbc.com/news/articles/c3dpr2zkny0o?at_medium=RSS&at_campaign=rss
2025-08-17-23-02-59 +0000,bbc,The Green Party is at a crossroads. Is it time they get angry?,https://www.bbc.com/news/articles/cm2kzrr4375o?at_medium=RSS&at_campaign=rss
2025-08-17-23-00-29 +0000,bbc,Croatian ultra-nationalist mega-gig exposes divided society,https://www.bbc.com/news/articles/cz60nyp3714o?at_medium=RSS&at_campaign=rss
2025-08-17-22-36-17 +0000,nypost,"US tourist, 63, attacked by shark, severely injured while spearfishing in the Bahamas",https://nypost.com/2025/08/17/world-news/us-tourist-attacked-by-shark-severely-injured-while-spearfishing-in-the-bahamas/
2025-08-17-22-30-35 +0000,nyt,"Ronnie Rondell, Stuntman Set on Fire for Pink Floyd Cover, Dies at 88",https://www.nytimes.com/2025/08/17/us/ronnie-rondell-dead.html
2025-08-17-22-29-56 +0000,nypost,More Palestinians are calling for Hamas to leave power — and the terror group is responding with horrific violence,https://nypost.com/2025/08/17/world-news/more-palestinians-are-calling-for-hamas-to-leave-power-and-the-terror-group-is-responding-with-horrific-violence/
2025-08-17-22-17-43 +0000,latimes,"Man killed after trying to stop thieves from stealing his car in South L.A., authorities say",https://www.latimes.com/california/story/2025-08-17/attempted-car-theft-south-l-a-one-man-killed-another-injured
2025-08-17-22-05-10 +0000,nypost,"Small plane crash lands onto Sydney golf course in lesson gone wrong, caught on hair-raising video",https://nypost.com/2025/08/17/world-news/small-plane-crash-lands-onto-sydney-golf-course-in-lesson-gone-wrong-caught-on-hair-raising-video/
2025-08-17-21-57-52 +0000,nypost,Air Canada delays restart after flight attendants strike — despite order to return,https://nypost.com/2025/08/17/business/air-canada-delays-restart-after-flight-attendants-strike-despite-order-to-return/
2025-08-17-21-45-24 +0000,nypost,New Yorkers fighting against massive battery storage plants find new ally in EPA chief Lee Zeldin,https://nypost.com/2025/08/17/us-news/new-yorkers-fighting-against-massive-battery-storage-plants-find-new-ally-in-epa-chief-lee-zeldin/
2025-08-17-21-21-43 +0000,bbc,Huge crowds gather in Israel calling for hostage deal and end to Gaza war,https://www.bbc.com/news/articles/ce93y2dxlg4o?at_medium=RSS&at_campaign=rss
2025-08-17-21-13-41 +0000,nyt,"Canada’s Wildfire Season Is One of Its Worst Ever, and It’s Not Over Yet",https://www.nytimes.com/2025/08/13/world/canada/canada-wildfire-season-newfoundland-saskatchewan.html
2025-08-17-21-13-29 +0000,wapo,What to know as GOP governors plan to send National Guard units to D.C.,https://www.washingtonpost.com/nation/2025/08/17/national-guard-deployments-washington-developments/
2025-08-17-21-12-00 +0000,wsj,"On D.C. Streets, Feds Make a Show of Force",https://www.wsj.com/us-news/national-guard-washington-dc-959d9844
2025-08-17-21-11-43 +0000,wapo,Mass protests erupt in Israel as IDF readies plans to occupy Gaza City,https://www.washingtonpost.com/world/2025/08/17/israel-protests-gaza-occupation/
2025-08-17-21-11-00 +0000,wsj,Air Canada Flight Attendants to Defy Back-to-Work Order,https://www.wsj.com/business/airlines/air-canada-flight-attendants-to-defy-back-to-work-order-6d912a2c?mod=pls_whats_news_us_business_f
2025-08-17-20-31-47 +0000,latimes,"Boy, 16, killed at huge Covina party; 4 police agencies called in",https://www.latimes.com/california/story/2025-08-17/16-year-old-boy-fatally-shot-at-covina-house-party
2025-08-17-20-28-09 +0000,nypost,Mayor Adams slams Mamdani for wanting to decriminalize prostitution: ‘Don’t know where in his Quran it states that it’s OK’,https://nypost.com/2025/08/17/us-news/mayor-adams-slams-mamdani-for-wanting-to-decriminalize-prostitution/
2025-08-17-20-24-00 +0000,wsj,Opinion | What Kind of Peace in Ukraine?,https://www.wsj.com/opinion/what-kind-of-peace-in-ukraine-russia-summit-trump-putin-f5daf72f
2025-08-17-20-19-00 +0000,wsj,Opinion | The Coming Robot Home Invasion,https://www.wsj.com/opinion/the-coming-robot-home-invasion-82ff1218
2025-08-17-20-18-00 +0000,wsj,"Opinion | Don’t Bomb Mexico, Mr. President",https://www.wsj.com/opinion/dont-bomb-mexico-mr-president-75bcc45f
2025-08-17-20-15-00 +0000,wsj,Opinion | Will E.J. Antoni Raise Your Taxes?,https://www.wsj.com/opinion/will-e-j-antoni-raise-your-taxes-77170e73
2025-08-17-20-14-00 +0000,wsj,Opinion | AI Won’t Replace Historians,https://www.wsj.com/opinion/ai-wont-replace-historians-3b68751c
2025-08-17-20-10-00 +0000,wsj,Opinion | Time to Shut Down the Failed U.N. Lebanon Mission,https://www.wsj.com/opinion/time-to-shut-down-the-failed-u-n-lebanon-mission-7075a0ff
2025-08-17-20-01-05 +0000,nypost,"Trump weaponization czar teases ‘more’ developments with Schiff, warns J6 Committee alums to ‘keep an eye on their mailbox’",https://nypost.com/2025/08/17/us-news/trump-weaponization-czar-teases-more-developments-with-schiff-warns-j6-committee-alums-to-keep-an-eye-on-their-mailbox/
2025-08-17-19-46-16 +0000,nyt,$800 for a Credit Card? Why Your Premium Cards Will Cost More.,https://www.nytimes.com/2025/08/17/business/airlines-credit-cards-loyalty.html
2025-08-17-19-45-00 +0000,nypost,Which crypto has the most potential in 2025? The Smart Money is watching one thing,https://nypost.com/business/which-crypto-has-the-most-potential/
2025-08-17-19-40-47 +0000,nypost,EU push to protect digital rules holds up trade statement with US: report,https://nypost.com/2025/08/17/business/eu-push-to-protect-digital-rules-holds-up-trade-statement-with-us-report/
2025-08-17-19-39-31 +0000,wapo,Florida GOP scraps ‘Deport Depot’ merch after Home Depot objects,https://www.washingtonpost.com/nation/2025/08/17/home-depot-florida-gop-merch/
2025-08-17-19-36-42 +0000,nypost,Lindsey Graham threatens bill designating Russia state sponsor of terror over kidnapping of Ukrainian children,https://nypost.com/2025/08/17/us-news/lindsey-graham-threatens-bill-designating-russia-state-sponsor-of-terror-over-kidnapping-of-ukrainian-children/
2025-08-17-19-30-02 +0000,nyt,Trump Administration Minimizes Summit Papers Left in Hotel,https://www.nytimes.com/2025/08/17/us/politics/trump-putin-summit-papers-hotel.html
2025-08-17-19-20-45 +0000,nyt,Pence Welcomes Trump’s D.C. Deployment of the National Guard,https://www.nytimes.com/2025/08/17/us/politics/pence-trump-dc-national-guard.html
2025-08-17-19-13-51 +0000,bbc,"Putin agreed to 'robust' security guarantees for Ukraine, US envoy says",https://www.bbc.com/news/articles/crm4ln2ekg1o?at_medium=RSS&at_campaign=rss
2025-08-17-18-58-38 +0000,nyt,"Trump’s Selective Stance on Justice: Redemption for Some, Scorn for Others",https://www.nytimes.com/2025/08/17/us/politics/trump-dc-criminals-justice.html
2025-08-17-18-54-29 +0000,nyt,U.S. Pauses Visitor Visas for Gazans After Laura Loomer Posts,https://www.nytimes.com/2025/08/16/us/politics/gaza-visitor-visas-medical-trump-loomer.html
2025-08-17-18-52-45 +0000,nypost,"Nationwide strike erupts across Israel demanding hostage deal, end to Gaza war",https://nypost.com/2025/08/17/world-news/nationwide-strike-erupts-across-israel-demanding-hostage-deal-end-to-gaza-war/
2025-08-17-18-36-28 +0000,cbc,"Terrence Stamp, U.K. actor who played General Zod in early Superman films, dead at 87",https://www.cbc.ca/news/entertainment/terrence-stamp-obit-1.7611196?cmp=rss
2025-08-17-18-31-42 +0000,bbc,Air Canada delays return to flights after union defies government order,https://www.bbc.com/news/articles/cwyex8489gno?at_medium=RSS&at_campaign=rss
2025-08-17-18-12-56 +0000,bbc,Three Republican-led states to send National Guard troops to DC,https://www.bbc.com/news/articles/cvgv1pmypdyo?at_medium=RSS&at_campaign=rss
2025-08-17-17-55-55 +0000,nypost,Pence urges Trump to take out the ‘hammer’ on Russia: ‘Putin’s not going to stop until he’s stopped’,https://nypost.com/2025/08/17/us-news/mike-pence-urges-president-trump-to-take-out-the-hammer-on-russia-putins-not-going-to-stop-until-hes-stopped/
2025-08-17-17-51-38 +0000,nypost,"Ukraine won’t give up land that Russia doesn’t already occupy, Zelensky says after Putin’s demand",https://nypost.com/2025/08/17/world-news/ukraine-wont-give-up-land-that-russia-hasnt-captured-zelensky-says/
2025-08-17-17-49-13 +0000,bbc,Resignation and betrayal: What handing Donbas to Putin would mean for Ukraine,https://www.bbc.com/news/articles/cvgv1pdkll8o?at_medium=RSS&at_campaign=rss
2025-08-17-17-34-40 +0000,nyt,Protesters Against National Guard Deployment Flood D.C. Streets,https://www.nytimes.com/2025/08/16/us/politics/washington-dc-national-guard-protest.html
2025-08-17-17-27-06 +0000,nyt,Putin’s Ukraine Proposal Backed by Trump Centers on Donbas. Here’s Why.,https://www.nytimes.com/2025/08/17/world/europe/russia-donbas-importance.html
2025-08-17-17-26-24 +0000,nypost,"Midtown showing strength with sale of apartment building, office tower",https://nypost.com/2025/08/17/business/midtown-showing-strength-with-sale-of-apartment-building-office-tower/
2025-08-17-17-25-50 +0000,nyt,Ukraine Weighs Trump’s Offer of Security Guarantees With Caution,https://www.nytimes.com/2025/08/17/world/europe/ukraine-security-guarantees-trump-russia.html
2025-08-17-17-23-05 +0000,nypost,"Fintech, AI firms give Refinery at Domino sweet new lease on life",https://nypost.com/2025/08/17/business/refinery-at-domino-filling-up-despite-not-be-able-to-lease-out-building-to-single-tenant/
2025-08-17-17-18-00 +0000,wsj,"More National Guard troops are heading soon to Washington, D.C., and they are preparing to start carrying weapons in the coming days, officials say, a shift in policy",https://www.wsj.com/politics/national-security/national-guard-soldiers-prepare-to-carry-weapons-in-washington-d-c-3965923c
2025-08-17-17-11-00 +0000,wsj,"European Leaders to Back Zelensky in Washington, Hoping to Counter Putin",https://www.wsj.com/world/europe/european-leaders-to-back-zelensky-in-washington-hoping-to-counter-putin-2a82aaa4
2025-08-17-17-01-21 +0000,cbc,European leaders to join Zelenskyy's meeting with Trump in apparent show of support,https://www.cbc.ca/news/world/european-leaders-nato-zelenskyy-trump-ukraine-russia-1.7611162?cmp=rss
2025-08-17-16-59-39 +0000,nypost,Tempus AI moving to SL Green’s 11 Madison Ave.,https://nypost.com/2025/08/17/business/tempus-ai-moving-to-sl-greens-11-madison-ave/
2025-08-17-16-56-00 +0000,wsj,Opinion | Readers Debate Blinken on a Palestinian State,https://www.wsj.com/opinion/readers-debate-blinken-on-a-palestinian-state-israel-hamas-gaza-432a12b6
2025-08-17-16-54-00 +0000,wsj,Opinion | The AI Export Tax Won’t Fly,https://www.wsj.com/opinion/the-ai-export-tax-wont-fly-trump-nvidia-constitution-80fa9c9d
2025-08-17-16-31-35 +0000,nyt,Trump and Putin Find Common Ground on One Issue: Biden,https://www.nytimes.com/2025/08/17/us/politics/trump-putin-common-ground-biden.html
2025-08-17-16-30-00 +0000,nypost,Want to beat the next big Coinbase listing? Here’s how savvy traders do it,https://nypost.com/business/next-big-crypto-coinbase-listings/
2025-08-17-16-19-12 +0000,nypost,Rubio declares Russia has to ‘get something’ from peace deal as Putin demands Ukraine’s Donetsk region,https://nypost.com/2025/08/17/us-news/rubio-declares-russia-has-get-something-from-peace-deal-as-putin-demands-ukraines-donetsk-region/
