pubdate,source,title,link
2025-12-21-08-00-09 +0000,nyt,"Guns from the United States are Pouring into Canada, Fueling a Spike in Gun Violence",https://www.nytimes.com/2025/12/21/world/americas/canada-gun-violence-us.html
2025-12-21-07-48-23 +0000,bbc,"Takeaway owner delivers 1,000 gifts to children",https://www.bbc.com/news/articles/cpq4pynypqro?at_medium=RSS&at_campaign=rss
2025-12-21-07-42-39 +0000,bbc,Survivors 'nervous and sceptical' about release of remaining Epstein files,https://www.bbc.com/news/articles/c14vy02847vo?at_medium=RSS&at_campaign=rss
2025-12-21-06-05-14 +0000,bbc,How Israel's grassroots hostage families group became a powerful international force,https://www.bbc.com/news/articles/cm20ppy0rreo?at_medium=RSS&at_campaign=rss
2025-12-21-06-03-30 +0000,nyt,"Robert Mnuchin, Stock Trader Turned Art Dealer, Dies at 92",https://www.nytimes.com/2025/12/20/arts/design/robert-mnuchin-dead.html
2025-12-21-05-01-15 +0000,nyt,The Pompidou Center Has Been Emptied of Its Art. We Watched It Happen.,https://www.nytimes.com/2025/12/21/world/europe/pompidou-empty-renovation-art.html
2025-12-21-05-01-07 +0000,nyt,How China Tried to Dismantle a Major Underground Church,https://www.nytimes.com/2025/12/21/world/asia/china-christian-zion-church-raid.html
2025-12-21-05-00-09 +0000,nyt,A Neighborhood in India Fears Being Blamed for a Distant Atrocity,https://www.nytimes.com/2025/12/21/world/asia/india-muslims-emigration-australia.html
2025-12-21-04-52-11 +0000,nyt,U.S. Coast Guard Boards Tanker Carrying Venezuelan Oil,https://www.nytimes.com/2025/12/20/us/politics/us-coast-guard-venezuela-oil-tanker.html
2025-12-21-04-16-39 +0000,nypost,Australian PM defies calls for broad independent probe of Bondi Beach massacre,https://nypost.com/2025/12/20/world-news/australian-pm-defies-calls-for-broad-independent-investigation-of-bondi-beach-massacre/
2025-12-21-04-00-00 +0000,wsj,Trump’s Evangelist in Israel Won’t Let MAGA Rift Divert Him,https://www.wsj.com/world/middle-east/trumps-evangelist-in-israel-wont-let-maga-rift-divert-him-4c716115
2025-12-21-03-42-31 +0000,missionlocal,Waymo halts service during massive S.F. blackout after causing traffic jams,https://missionlocal.org/2025/12/sf-waymo-halts-service-blackout/
2025-12-21-03-42-00 +0000,wsj,Five Takeaways From the Newly Released Epstein Files,https://www.wsj.com/politics/policy/five-takeaways-from-the-newly-released-epstein-files-936dd5a1
2025-12-21-03-38-18 +0000,nyt,6 Takeaways From the First Batch of the Epstein Files,https://www.nytimes.com/2025/12/19/us/politics/epstein-files-takeaways.html
2025-12-21-03-15-53 +0000,nypost,Why CNN staffers should be careful what they wish for in Warner’s Netflix merger,https://nypost.com/2025/12/20/business/cnn-staffers-are-reportedly-loathing-a-potential-paramount-skydance-takeover-but-dont-expect-the-ellisons-to-kill-the-news-agency/
2025-12-21-03-00-00 +0000,wsj,California Cuts Back on Costly Immigrant Healthcare,https://www.wsj.com/politics/policy/california-cuts-back-on-costly-immigrant-healthcare-70f2794d
2025-12-21-02-38-23 +0000,nyt,How Venezuela Went From U.S. Ally to Trump Target,https://www.nytimes.com/2025/12/19/us/politics/venezuela-united-states-history.html
2025-12-21-02-13-28 +0000,nyt,‘Where’s the Humanity?’ Bondi Attack Leaves Suspects’ Neighborhood Stunned.,https://www.nytimes.com/2025/12/20/world/australia/australia-bondi-attack-suspect.html
2025-12-21-01-59-17 +0000,wapo,Coast Guard boards oil tanker leaving Venezuela amid Trump’s blockade,https://www.washingtonpost.com/national-security/2025/12/20/venezuela-boats-coast-guard/
2025-12-21-01-51-22 +0000,latimes,"Holiday S.F. power outage disrupts trains, leaves Waymos stalled on darkened streets",https://www.latimes.com/california/story/2025-12-20/san-francisco-power-outage-bart-muni
2025-12-21-01-50-00 +0000,wsj,29 Shots in 24 Seconds: How a Killing Was Cast as Self-Defense,https://www.wsj.com/us-news/scott-spivey-killing-self-defense-law-9e8a1f7c
2025-12-21-01-18-23 +0000,bbc,India express train kills seven elephants crossing tracks,https://www.bbc.com/news/articles/c9qe2yln2nlo?at_medium=RSS&at_campaign=rss
2025-12-21-01-18-15 +0000,bbc,The 'winners and losers' in Universal UK's plan to rival Disneyland Paris,https://www.bbc.com/news/articles/cg4npgy1ngdo?at_medium=RSS&at_campaign=rss
2025-12-21-01-03-23 +0000,missionlocal,PG&E outage leaves 1/3 of San Francisco without power,https://missionlocal.org/2025/12/sf-power-outage-pge-electricity/
2025-12-21-01-00-00 +0000,wsj,Trump World Is Picking Sides in the Battle for Warner Bros.,https://www.wsj.com/business/media/trump-world-is-picking-sides-in-the-battle-for-warner-bros-f281b426?mod=pls_whats_news_us_business_f
2025-12-21-01-00-00 +0000,wsj,Millions of homeowners are still locked into ultralow mortgage rates they don’t want to give up,https://www.wsj.com/economy/housing/mortgage-rates-homeowners-08a609eb
2025-12-21-00-59-01 +0000,bbc,How a Reddit tipster cracked the Brown University shooting case,https://www.bbc.com/news/articles/ckg9l1j9wxno?at_medium=RSS&at_campaign=rss
2025-12-21-00-53-13 +0000,missionlocal,To do,https://missionlocal.org/2025/12/sf-photos-to-do/
2025-12-21-00-52-00 +0000,wsj,How the Journal Reported Its Latest Findings on the Scott Spivey Killing,https://www.wsj.com/us-news/spivey-killing-methodology-36465060
2025-12-21-00-35-29 +0000,nyt,Turning Point’s Annual Gathering Turns Into a Gripefest,https://www.nytimes.com/2025/12/20/us/politics/turning-points-americafest-ben-shapiro.html
2025-12-21-00-30-34 +0000,bbc,Comedian Bowen Yang announces Saturday Night Live exit,https://www.bbc.com/news/articles/clyz01l98vjo?at_medium=RSS&at_campaign=rss
2025-12-21-00-29-00 +0000,wsj,U.S. Seizes Second Oil Tanker Near Venezuela,https://www.wsj.com/world/americas/u-s-seizes-second-oil-tanker-near-venezuela-386def53
2025-12-21-00-25-22 +0000,bbc,Neither Russia nor France: One West African country walks a diplomatic tightrope,https://www.bbc.com/news/articles/c4gp4v32z0lo?at_medium=RSS&at_campaign=rss
2025-12-21-00-25-03 +0000,bbc,Why British Jews are experiencing their biggest change in 60 years,https://www.bbc.com/news/articles/c5ye91zxqv5o?at_medium=RSS&at_campaign=rss
2025-12-20-23-46-42 +0000,latimes,Long Beach police suspect domestic violence 'murder-suicide' in shootings,https://www.latimes.com/california/story/2025-12-20/long-beach-police-domestic-violence-murder-suicide-shootings
2025-12-20-23-14-28 +0000,nypost,Over 200 Indian nationals recruited to fight in Ukraine War,https://nypost.com/2025/12/20/world-news/over-200-indian-nationals-recruited-to-fight-in-ukraine-war-as-foreign-ministry-tries-to-secure-their-freedom/
2025-12-20-23-13-41 +0000,wapo,"Trump says Venezuela stole U.S. oil, land and assets. Here’s the history.",https://www.washingtonpost.com/world/2025/12/20/venezuela-oil-nationalization-expropriation/
2025-12-20-22-58-58 +0000,bbc,This billionaire tested China's limits. It cost him his freedom,https://www.bbc.com/news/articles/c5yqr485d84o?at_medium=RSS&at_campaign=rss
2025-12-20-22-36-28 +0000,nypost,Anti-Zionist Mamdani celebrates Hanukkah with Jewish actor Mandy Patinkin,https://nypost.com/2025/12/20/us-news/anti-zionist-mamdani-celebrates-hanukkah-with-jewish-actor-mandy-patinkin/
2025-12-20-22-35-27 +0000,cbc,Russian strike kills 8 in Ukraine's Odesa as Kremlin envoy heads to U.S. for truce talks,https://www.cbc.ca/news/world/odesa-strike-russia-ukraine-peace-talks-miami-9.7024296?cmp=rss
2025-12-20-22-20-15 +0000,nypost,Trump endorses Bruce Blakeman for NY governor — a day after GOP Rep. Elise Stefanik dropped out of race,https://nypost.com/2025/12/20/us-news/trump-endorses-bruce-blakeman-for-ny-governor-a-day-after-gop-rep-elise-stefanik-dropped-out-of-race/
2025-12-20-22-18-20 +0000,nypost,"Kushner, Witkoff draft $112B proposal to develop Gaza into ‘smart city’ with luxury resorts — and US footing $60B",https://nypost.com/2025/12/20/world-news/kushner-witkoff-draft-112b-proposal-to-develop-gaza-into-futuristic-smart-city-report/
2025-12-20-22-07-00 +0000,wsj,Industry titans and Trump allies are weighing in during the final days of a sharp-elbowed campaign to succeed Jerome Powell as chair of the Fed.,https://www.wsj.com/politics/policy/the-fight-over-the-next-fed-chair-is-spilling-out-across-d-c-and-wall-street-14761d86
2025-12-20-21-54-56 +0000,latimes,"Chaotic night on L.A. roads: Ambulance chase, Porsche crash, 210 ejection death",https://www.latimes.com/california/story/2025-12-20/ambulance-chase-porsche-crash-210-death
