pubdate,source,title,link
2025-12-21-21-45-48 +0000,nypost,Pilot reports ‘silver cannister’ UFO feet from his plane during ‘creepy’ air traffic control call: ‘Good luck with the aliens’,https://nypost.com/2025/12/21/us-news/pilot-reports-silver-cannister-ufo-to-air-traffic-control-told-good-luck-with-the-aliens/
2025-12-21-21-39-38 +0000,cbc,Nigeria says remaining 130 abducted students have now been released,https://www.cbc.ca/news/world/abducted-students-nigeria-9.7024653?cmp=rss
2025-12-21-21-30-47 +0000,nypost,"Elon Musk’s failed SpaceX launch left airliners in danger after rocket suddenly exploded, report finds",https://nypost.com/2025/12/21/us-news/elon-musks-failed-spacex-launch-left-airliners-in-danger-after-rocket-suddenly-exploded-report-finds/
2025-12-21-21-25-48 +0000,nyt,Blanche Says Mentions of Trump in Epstein Files Won’t Be Removed,https://www.nytimes.com/2025/12/21/us/politics/todd-blanche-epstein-files-trump-redactions.html
2025-12-21-21-23-17 +0000,bbc,US reportedly pursuing third oil tanker linked to Venezuela,https://www.bbc.com/news/articles/c99722j4lkgo?at_medium=RSS&at_campaign=rss
2025-12-21-21-22-32 +0000,nyt,The Sibling Bond,https://www.nytimes.com/2025/12/21/world/siblings-shape-lives-venezuela-tanker-bondi.html
2025-12-21-21-20-10 +0000,nyt,Immigration Crackdown Creates Fault Lines Among Baptists,https://www.nytimes.com/2025/12/21/us/southern-baptists-immigration-trump.html
2025-12-21-21-19-44 +0000,nyt,"In a First, a Wheelchair User Joins a Short Flight to Space",https://www.nytimes.com/2025/12/21/us/spacex-blue-origin-wheelchair-user.html
2025-12-21-21-19-00 +0000,nypost,Cops raid 2 more NYC knock-off markets — scaring off absolutely no one: ‘I’m not afraid’,https://nypost.com/2025/12/21/us-news/cops-raid-2-more-nyc-knock-off-markets-scaring-off-no-one/
2025-12-21-21-16-12 +0000,wapo,"U.S. pursuing third tanker off Venezuelan coast, official says",https://www.washingtonpost.com/world/2025/12/21/venezuela-us-tanker-intercept-vessel-seized/
2025-12-21-21-14-42 +0000,bbc,At least 13 photos removed from justice department Epstein files website,https://www.bbc.com/news/articles/c208y2wxxeno?at_medium=RSS&at_campaign=rss
2025-12-21-21-10-31 +0000,nypost,LA junkie accused of gunning down ‘American Idol’ exec and her husband committed to state hospital ahead of trial for murder,https://nypost.com/2025/12/21/us-news/la-junkie-accused-of-gunning-down-american-idol-exec-and-her-husband-committed-to-state-hospital-ahead-of-trial-for-murder/
2025-12-21-21-05-02 +0000,nypost,Cellphone-less Cuban agents guard Venezuelan President Nicolas Maduro as US boards a third oil tanker,https://nypost.com/2025/12/21/us-news/cellphone-less-cuban-agents-guard-venezuelan-president-nicolas-maduro-as-us-boards-a-third-oil-tanker/
2025-12-21-20-52-29 +0000,latimes,"Demand surges for Airbnbs during the World Cup in L.A., with prices jumping 56%",https://www.latimes.com/california/story/2025-12-21/prices-jump-56-for-airbnbs-in-la-during-world-cup
2025-12-21-20-52-26 +0000,nypost,"Epstein seen kissing, cuddling little girls in stomach-turning new photos released by DOJ",https://nypost.com/2025/12/21/us-news/epstein-seen-kissing-cuddling-little-girls-in-stomach-turning-new-photos-released-by-doj/
2025-12-21-20-46-05 +0000,nypost,Tucker Carlson named ‘Antisemite of the Year’ by prominent Jewish organization after alarming interviews,https://nypost.com/2025/12/21/us-news/tucker-carlson-named-antisemite-of-the-year-by-jewish-organization/
2025-12-21-20-45-23 +0000,cbc,Pizzeria staffed by those on autism spectrum thrives in Italy,https://www.cbc.ca/player/play/9.7024634?cmp=rss
2025-12-21-20-41-00 +0000,wsj,Opinion | The EU Fights Carbon and Loses,https://www.wsj.com/opinion/the-eu-fights-carbon-and-loses-a5d445fb
2025-12-21-20-40-12 +0000,nypost,Cops discover pair of crocodiles during routine bust in Westchester,https://nypost.com/2025/12/21/us-news/cops-discover-pair-of-crocs-during-routine-bust-in-yonkers/
2025-12-21-20-37-09 +0000,nypost,Prime chunk of Midtown becoming ‘fun’ locale — here are some of the destinations to discover,https://nypost.com/2025/12/21/business/prime-chunk-of-midtown-becoming-fun-locale/
2025-12-21-20-37-00 +0000,wsj,Opinion | The SEC May Make Wall Street Analysts Corrupt Again,https://www.wsj.com/opinion/the-sec-may-make-wall-street-analysts-corrupt-again-79effdf4
2025-12-21-20-25-48 +0000,nypost,High-flying exec raped me in ‘Mad Men’ office horror show: lawsuit,https://nypost.com/2025/12/21/us-news/high-flying-exec-raped-me-in-mad-men-office-horror-show-lawsuit/
2025-12-21-20-20-16 +0000,nypost,"JD Vance wades into MAGA civil war at AmericaFest, criticizes conservatives for ‘canceling each other’",https://nypost.com/2025/12/21/us-news/jd-vance-wades-into-maga-civil-war-decries-conservatives-canceling-each-other/
2025-12-21-20-20-00 +0000,wsj,"Before Charlie Kirk was fatally shot, he was readying for JD Vance to become the next president of the United States. Now, Erika Kirk is determined to make that happen.",https://www.wsj.com/politics/policy/charlie-kirks-empire-is-lining-up-behind-a-jd-vance-presidential-bid-cedeb9cc
2025-12-21-20-17-00 +0000,wsj,Opinion | The History of Hubristic U.S. Ethanol Policy,https://www.wsj.com/opinion/the-history-of-hubristic-u-s-ethanol-policy-tech-5ca2c1b0?mod=pls_whats_news_us_business_f
2025-12-21-20-16-00 +0000,wsj,Opinion | Why Should Europe Let Putin Have His Loot?,https://www.wsj.com/opinion/why-should-europe-let-putin-have-his-loot-eu-loan-736a5dea
2025-12-21-20-10-45 +0000,nypost,"Trump’s No. 2 at DOJ Todd Blanche emphatic Epstein file redactions ‘absolutely, positively not’ made for political reasons",https://nypost.com/2025/12/21/us-news/trumps-no-2-at-doj-emphatic-epstein-file-redactions-absolutely-positively-not-made-for-political-reasons/
2025-12-21-20-05-59 +0000,nypost,Lindsey Graham warns Trump that Putin is acting like ‘Lucy with the football’ in Ukraine talks,https://nypost.com/2025/12/21/us-news/lindsey-graham-warns-president-trump-that-vladimir-putin-is-acting-like-lucy-with-the-football-in-ukraine-talks/
2025-12-21-20-03-14 +0000,nypost,"FBI mum on whether homeless tipster will get $50K reward for cracking Brown University, MIT shooting case",https://nypost.com/2025/12/21/us-news/fbi-wont-say-whether-homeless-tipster-will-get-50k-reward-for-cracking-brown-mit-shooting-case/
2025-12-21-19-58-07 +0000,nypost,Bruce Blakeman reveals one issue ‘off the table’ in NY governor race as he slams Hochul’s ‘green energy scam’,https://nypost.com/2025/12/21/us-news/bruce-blakeman-reveals-one-issue-off-the-table-in-ny-governor-race/
2025-12-21-19-56-02 +0000,nyt,U.S. Coast Guard Is Chasing an Oil Tanker Linked to Venezuela,https://www.nytimes.com/2025/12/21/us/politics/us-coast-guard-venezuela-oil-tankers.html
2025-12-21-19-56-00 +0000,wsj,A top Justice Department official said Sunday that the agency temporarily removed some newly public Jeffrey Epstein files to address complaints from victims about redacting their images or information,https://www.wsj.com/politics/policy/justice-department-official-says-it-pulled-some-epstein-files-to-redact-victims-1b1bfb2b
2025-12-21-19-53-00 +0000,wsj,Opinion | Why the Affordability Crisis Is Most Severe in California,https://www.wsj.com/opinion/why-the-affordability-crisis-is-most-severe-in-california-e1b43f1c
2025-12-21-19-42-20 +0000,nypost,Twisted ‘time-out’ box in NY classroom for ‘special needs students’ spurs outrage: ‘This is sick’,https://nypost.com/2025/12/21/us-news/twisted-time-out-box-in-ny-classroom-spurs-outrage-this-is-sick/
2025-12-21-19-37-55 +0000,nypost,"Dave Chappelle criticzes Israel, eviscerates Bill Maher in new Netflix special: ‘F–k that guy’",https://nypost.com/2025/12/21/us-news/dave-chappelle-hits-out-at-bill-maher-israel-in-new-netflix-special/
2025-12-21-19-35-43 +0000,latimes,"Nick Reiner was prescribed schizophrenia medication before killings of Rob, Michele Reiner, sources say",https://www.latimes.com/california/story/2025-12-21/nick-reiner-was-prescribed-schizophrenia-medication-before-killings-of-rob-michele-reiner-sources-say
2025-12-21-19-35-00 +0000,nyt,Michele Singer Reiner: A Life Rooted in Activism and Listening to Others,https://www.nytimes.com/2025/12/21/us/michele-singer-reiner.html
2025-12-21-19-33-59 +0000,bbc,King's Foundation chair and nominee peer admits 'misleading' doctorate claim,https://www.bbc.com/news/articles/cnv299l3zrno?at_medium=RSS&at_campaign=rss
2025-12-21-19-33-17 +0000,nypost,Bloomberg LP renews lease at 120 Park Ave.,https://nypost.com/2025/12/21/business/bloomberg-lp-renews-lease-at-120-park-ave/
2025-12-21-19-28-29 +0000,nyt,Heavy Rains in Washington State Prompt Warnings About Toilet Rats,https://www.nytimes.com/2025/12/21/us/washington-flooding-toilet-rats.html
2025-12-21-19-18-08 +0000,nypost,Nicki Minaj makes surprise appearance with Erika Kirk at TPUSA’s America Fest — urges young men to be more like Trump,https://nypost.com/2025/12/21/us-news/nicki-minaj-makes-surprise-appearance-with-erika-kirk-at-tpusa-event/
2025-12-21-19-12-05 +0000,bbc,Labour MSP to quit Holyrood over links to sex offender,https://www.bbc.com/news/articles/cq5q1xd21w3o?at_medium=RSS&at_campaign=rss
2025-12-21-18-48-53 +0000,bbc,Who and what are in the Epstein files?,https://www.bbc.com/news/articles/c8r38ne1x2mo?at_medium=RSS&at_campaign=rss
2025-12-21-18-48-05 +0000,missionlocal,"PG&E outage: 15,000 still without power in S.F. — no timeline for restoration",https://missionlocal.org/2025/12/sf-richmond-power-outage-pge-blackout/
2025-12-21-18-43-43 +0000,nyt,Australia Mourns Bondi Beach Shooting Victims,https://www.nytimes.com/2025/12/21/world/asia/australia-mourns-bondi-beach-shooting-victims.html
2025-12-21-18-41-29 +0000,nypost,Trans Muslim killer tries to skip sentencing for executing parents — then makes excuse for murdering them,https://nypost.com/2025/12/21/us-news/trans-muslim-woman-mia-bailey-sentenced-to-life-for-killing-her-parents-in-utah/
2025-12-21-18-40-44 +0000,nyt,"Epstein Files Photos Disappear From Government Website, Including One of Trump",https://www.nytimes.com/2025/12/20/us/politics/trump-epstein-files-government-website.html
2025-12-21-18-37-23 +0000,nyt,‘Avatar’ Sequel Is Neither Fire Nor Ash at North American Box Office,https://www.nytimes.com/2025/12/21/business/avatar-fire-and-ash-opening-weekend.html
2025-12-21-18-12-58 +0000,nyt,How Much More Can the U.S. Travel Industry Take?,https://www.nytimes.com/2025/12/19/travel/us-travel-tourism-visas.html
2025-12-21-18-11-00 +0000,wsj,Third ‘Avatar’ Movie Off to Slower Box Office Start Than Predecessor,https://www.wsj.com/business/media/third-avatar-movie-off-to-slower-box-office-start-than-predecessor-9b099bd0?mod=pls_whats_news_us_business_f
2025-12-21-17-59-47 +0000,nyt,How the Supreme Court’s Mail-In Ballot Ruling Could Affect Voters,https://www.nytimes.com/2025/12/21/us/politics/supreme-court-mail-in-ballots-election-day.html
2025-12-21-17-57-50 +0000,latimes,"'Avatar: Fire and Ash' heats up the box office, grossing $88 million domestically",https://www.latimes.com/entertainment-arts/business/story/2025-12-21/avatar-fire-ash-heats-up-box-office
2025-12-21-17-56-14 +0000,latimes,"More than 20,000 still without power after massive San Francisco blackout",https://www.latimes.com/california/story/2025-12-21/san-francisco-blackout-power-restored
2025-12-21-17-40-00 +0000,wsj,Opinion | Japan Walks Back to Normalcy,https://www.wsj.com/opinion/bank-of-japan-interest-rates-monetary-normalization-a8d8409c
2025-12-21-17-37-00 +0000,wsj,Opinion | Jews Face Horrors With Humor,https://www.wsj.com/opinion/jews-face-horrors-with-humor-c0fd5057
2025-12-21-17-36-00 +0000,wsj,"Opinion | Tariffs Are a Discipline, Not a Press Release",https://www.wsj.com/opinion/tariffs-are-a-discipline-not-a-press-release-4022e09e
2025-12-21-17-34-16 +0000,nypost,Amy Schumer proudly lights Hanukkah candles — noting she learned who her ‘real friends’ were after Oct. 7,https://nypost.com/2025/12/21/entertainment/amy-schumer-lights-hanukkah-candles-says-she-learned-who-real-friends-were-after-oct-7/
2025-12-21-17-33-41 +0000,nypost,Trio of Long Island pals provide belly laughs with kooky annual mall Santa photos: ‘They love it so much’,https://nypost.com/2025/12/21/us-news/trio-provides-belly-laughs-with-kooky-annual-mall-santa-photos-in-li-nj/
2025-12-21-17-30-56 +0000,nyt,9 Killed in Mass Shooting at Tavern in South Africa,https://www.nytimes.com/2025/12/21/world/africa/mass-shooting-tavern-south-africa.html
2025-12-21-17-30-34 +0000,nypost,US military targeting third tanker off coast of Venezuela allegedly carrying black market oil,https://nypost.com/2025/12/21/world-news/us-military-targeting-third-tanker-off-coast-of-venezuela-allegedly-carrying-black-market-oil/
2025-12-21-17-21-20 +0000,nypost,"Cops took over 20 hours to enter woman’s home, find her dead after chilling 911 call",https://nypost.com/2025/12/21/world-news/cops-took-over-20-hours-to-enter-slain-tatiana-dokhotarus-home-after-chilling-911-call/
2025-12-21-17-00-00 +0000,wsj,FAO Schwarz Entices Toy Shoppers With the One Thing They Can’t Get Online,https://www.wsj.com/business/retail/fao-schwarz-personal-shopper-6801c453?mod=pls_whats_news_us_business_f
2025-12-21-16-28-56 +0000,nypost,Bernie Sanders blasted for tanking bill to help pediatric cancer patients: ‘For leverage’,https://nypost.com/2025/12/21/us-news/bernie-sanders-blasted-for-tanking-bill-to-help-pediatric-cancer-patients-for-leverage/
2025-12-21-16-17-01 +0000,wapo,U.S. tariffs take a bite out of Germany’s iconic nutcracker industry,https://www.washingtonpost.com/world/2025/12/21/us-tariffs-take-bite-out-germanys-iconic-nutcracker-industry/
2025-12-21-16-08-05 +0000,nypost,Russia claims talks on US peace plan for Ukraine ‘are proceeding constructively’ — despite recent strikes,https://nypost.com/2025/12/21/world-news/russia-claims-that-talks-on-us-plan-for-peace-in-ukraine-are-proceeding-constructively/
2025-12-21-15-56-08 +0000,nyt,"‘It’s Just Us’: The Firefighter, His Son and a Treacherous Choice",https://www.nytimes.com/2025/12/21/us/wildfires-firefighters-immigration.html
2025-12-21-15-56-05 +0000,bbc,Trail hunting to be banned as part of new animal welfare strategy,https://www.bbc.com/news/articles/c4g9y20j259o?at_medium=RSS&at_campaign=rss
2025-12-21-15-45-49 +0000,bbc,US seizes second oil tanker off Venezuela's coast,https://www.bbc.com/news/articles/c0mpy1ynnzzo?at_medium=RSS&at_campaign=rss
2025-12-21-15-34-30 +0000,nyt,Power Restored for Most of San Francisco After Widespread Outage,https://www.nytimes.com/2025/12/20/us/san-francisco-electricity-out.html
2025-12-21-15-29-21 +0000,nyt,Mamdani Inauguration to Usher in ‘New Era’ With Broadway Block Party,https://www.nytimes.com/2025/12/21/nyregion/nyc-zohran-mamdani-inauguration-block-party.html
2025-12-21-15-25-49 +0000,bbc,Gunmen kill nine in South Africa tavern attack,https://www.bbc.com/news/articles/c79xyxdpzrxo?at_medium=RSS&at_campaign=rss
2025-12-21-14-58-54 +0000,nypost,"FBI was warned that Jeffrey Epstein was into child porn — but ignored it for 10 years, docs show",https://nypost.com/2025/12/21/us-news/fbi-ignored-jeffrey-epstein-child-porn-warning-for-10-years-docs-show/
2025-12-21-14-56-01 +0000,nyt,"Move Aside, Snowflake: ‘Theater Kid’ Is the New Go-To Political Insult",https://www.nytimes.com/2025/12/21/us/politics/theater-kid-insult-politics.html
2025-12-21-14-50-13 +0000,nypost,"9 dead, 10 wounded after multiple gunman open fire in South African pub",https://nypost.com/2025/12/21/world-news/9-dead-10-wounded-after-multiple-gunman-open-fire-in-south-african-pub/
2025-12-21-14-38-12 +0000,bbc,Israel approves 19 new settlements in occupied West Bank,https://www.bbc.com/news/articles/cqjg18xe0wwo?at_medium=RSS&at_campaign=rss
2025-12-21-14-26-59 +0000,nyt,‘Orwellian Climate of Fear’: How China Cracks Down on Critics in the U.S.,https://www.nytimes.com/2025/12/21/world/asia/chinese-dissidents-protest-art.html
2025-12-21-14-17-00 +0000,wsj,The SpaceX Explosion That Put Flights in Danger,https://www.wsj.com/business/airlines/the-spacex-explosion-that-put-flights-in-danger-016a79c0
2025-12-21-14-16-52 +0000,nypost,"Kash Patel says FBI boosting AI use ‘key component’ to countering domestic, global threats",https://nypost.com/2025/12/21/us-news/kash-patel-says-fbi-boosting-ai-use-to-counter-domestic-global-threats/
2025-12-21-14-00-00 +0000,missionlocal,York greenery,https://missionlocal.org/2025/12/sf-photos-york-greenery/
2025-12-21-13-14-31 +0000,nypost,Over $2.6M raised for Bondi Beach hero who disarmed terrorist during massacre,https://nypost.com/2025/12/21/world-news/over-2-6m-raised-for-bondi-beach-hero-who-disarmed-terrorist/
2025-12-21-13-12-58 +0000,bbc,"No evidence Reform broke electoral law, watchdog says",https://www.bbc.com/news/articles/cx2dv17g0r3o?at_medium=RSS&at_campaign=rss
2025-12-21-13-00-00 +0000,wsj,Can a Hemorrhoid Cream Be Cool?,https://www.wsj.com/style/fashion/norms-hemorrhoid-cream-3666a4e8?mod=pls_whats_news_us_business_f
2025-12-21-12-08-10 +0000,bbc,Rights groups condemn new record number of executions in Saudi Arabia,https://www.bbc.com/news/articles/cg5m49j14pyo?at_medium=RSS&at_campaign=rss
2025-12-21-12-01-52 +0000,bbc,Charity welcomes living wage rise in January,https://www.bbc.com/news/articles/c3v12rnxe52o?at_medium=RSS&at_campaign=rss
2025-12-21-12-00-00 +0000,missionlocal,Making cocktail-sized chiles rellenos for the holidays,https://missionlocal.org/2025/12/making-cocktail-sized-chile-rellenos/
2025-12-21-12-00-00 +0000,latimes,Arellano: Shea Serrano's 'Expensive Basketball' headlines remarkable year for Latino sports books,https://www.latimes.com/sports/story/2025-12-21/shea-serranos-book-headlines-great-year-for-latino-sports-books
2025-12-21-12-00-00 +0000,wsj,When the Lights Went Out in the ‘Christmas Capital’,https://www.wsj.com/us-news/the-christmas-capital-fights-to-recover-after-storms-devastate-peak-season-022fabcd
2025-12-21-11-36-11 +0000,bbc,Cricket-themed bar chain Sixes goes into administration,https://www.bbc.com/news/articles/c5yqz5we58jo?at_medium=RSS&at_campaign=rss
2025-12-21-11-20-24 +0000,bbc,Minute's silence held to remember Bondi Beach attack victims,https://www.bbc.com/news/articles/cre3l2xq9nzo?at_medium=RSS&at_campaign=rss
2025-12-21-11-01-08 +0000,nypost,Defiant sister of slain Bondi Beach rabbi — who battles Jew hate in her own Brooklyn nabe — says  ‘We’re not afraid’,https://nypost.com/2025/12/21/world-news/defiant-sister-of-slain-bondi-beach-rabbi-who-battles-jew-hate-in-her-own-nyc-nabe-says-were-not-afraid/
2025-12-21-11-00-27 +0000,wapo,Market-savvy Treasury chief Scott Bessent emerges as unlikely MAGA warrior,https://www.washingtonpost.com/business/2025/12/21/treasury-bessent-trump-politics/
2025-12-21-11-00-26 +0000,wapo,"In deadly D.C. plane crash, city lights may have played a role. See how.",https://www.washingtonpost.com/investigations/interactive/2025/dca-crash-cause-lights/
2025-12-21-11-00-24 +0000,wapo,Is Gen Z the key to a manufacturing revival? Fall River thinks so.,https://www.washingtonpost.com/business/2025/12/21/falls-river-manufacturing-young-workers/
2025-12-21-11-00-00 +0000,latimes,Do I have to transfer my 401(k) money when I retire?,https://www.latimes.com/business/story/2025-12-21/do-i-have-to-transfer-my-401k-money-when-i-retire
2025-12-21-11-00-00 +0000,wsj,Cleveland Fed President Beth Hammack said she doesn’t see any need to change interest rates for several months in an interview with The Wall Street Journal,https://www.wsj.com/economy/central-banking/feds-hammack-is-inflation-wary-and-prefers-holding-rates-steady-into-the-spring-7c07f5d8
2025-12-21-11-00-00 +0000,latimes,Barabak: She went to jail for Trump's Big Lie. He's trying to get her sprung,https://www.latimes.com/politics/story/2025-12-21/trump-tina-peters-phony-pardon-colorado-election-fraud-conviction
2025-12-21-10-30-00 +0000,wsj,Canada’s $1 Billion Question: Do Property Rights Still Exist in British Columbia?,https://www.wsj.com/world/americas/canadas-1-billion-question-do-property-rights-still-exist-in-british-columbia-6e38df2a
2025-12-21-10-30-00 +0000,wsj,U.S. Oil Blockade of Venezuela Pushes Cuba Toward Collapse,https://www.wsj.com/world/americas/u-s-oil-blockade-of-venezuela-pushes-cuba-toward-collapse-75289b5b
2025-12-21-10-30-00 +0000,wsj,How Ford Failed to Bottle Tesla’s EV Magic,https://www.wsj.com/business/autos/how-ford-failed-to-bottle-teslas-ev-magic-7ce04df5?mod=pls_whats_news_us_business_f
2025-12-21-10-30-00 +0000,wsj,Makers of Everyday Essentials Once Offered Investors Safety. Do They Still?,https://www.wsj.com/finance/stocks/makers-of-everyday-essentials-once-offered-investors-safety-do-they-still-b4132195?mod=pls_whats_news_us_business_f
2025-12-21-10-30-00 +0000,wsj,The Private-Credit Party Turns Ugly for Individual Investors,https://www.wsj.com/finance/investing/the-private-credit-party-turns-ugly-for-individual-investors-287356f9?mod=rss_markets_main
2025-12-21-10-01-46 +0000,nyt,Sydney Sweeney’s Offscreen Image Contrasts With Progressive Onscreen Roles,https://www.nytimes.com/2025/12/21/movies/sydney-sweeney-offscreen-image-movie-roles.html
2025-12-21-10-01-39 +0000,nyt,"Freed From a Belarus Prison, a Nobel Peace Laureate Experiences ‘Oxygen Intoxication’",https://www.nytimes.com/2025/12/21/world/europe/belarus-sanctions-potash-ales-bialiatski.html
2025-12-21-10-00-54 +0000,nyt,How Many Toys Will Parents Buy for Their Kids This Christmas?,https://www.nytimes.com/2025/12/21/business/mattel-ynon-kreiz-toys-tariffs.html
2025-12-21-10-00-51 +0000,nyt,Trump Takes America’s ‘Imperial Presidency’ to a New Level,https://www.nytimes.com/2025/12/21/us/politics/trump-imperial-presidency.html
2025-12-21-10-00-48 +0000,nyt,"When Something Goes Wrong With Your Flight, These People Take Charge",https://www.nytimes.com/2025/12/21/business/american-airlines-operations-hub.html
2025-12-21-10-00-30 +0000,wapo,Why investing in a Trump Account could complicate your taxes,https://www.washingtonpost.com/business/2025/12/22/trump-account-taxes-irs/
2025-12-21-10-00-25 +0000,nyt,Sikh Truckers Found Refuge In Trucking Until The Trump Administration’s Crackdown,https://www.nytimes.com/2025/12/21/business/sikhs-truckers-trump-crackdown.html
2025-12-21-10-00-09 +0000,wapo,"In the Year of the Snake, China is charmed by ‘Zootopia 2’ pit viper Gary",https://www.washingtonpost.com/world/2025/12/21/disney-zootopia-2-china-success/
2025-12-21-10-00-00 +0000,wapo,Pakistan’s military chief consolidates power unseen in years,https://www.washingtonpost.com/world/2025/12/21/syed-asim-munir-pakistan-army-power/
2025-12-21-10-00-00 +0000,wapo,Angela Alsobrooks on first Senate year: The mission was ‘crystal clear.’,https://www.washingtonpost.com/dc-md-va/2025/12/21/angela-alsobrooks-maryland-senator/
2025-12-21-10-00-00 +0000,wapo,These boomers tried caring for parents. Now they’re tidying up to spare their kids.,https://www.washingtonpost.com/health/2025/12/21/elder-care-aging-plan-seniors/
2025-12-21-09-52-21 +0000,nypost,"Australian PM Albanese booed, heckled as he sits stone-faced at Sydney terror attack memorial: ‘Blood on your hands!’",https://nypost.com/2025/12/21/world-news/australian-prime-minister-anthony-albanese-heckled-at-bondi-vigil-week-after-hanukkah-terrorist-attack/
2025-12-21-09-48-39 +0000,bbc,Australian PM announces intelligence review as country mourns Bondi attack,https://www.bbc.com/news/articles/c5ydzl0nwqeo?at_medium=RSS&at_campaign=rss
2025-12-21-09-40-06 +0000,nyt,"Sydney Shooting Suspects Met Muslim Leaders in Philippines, Officials Say",https://www.nytimes.com/2025/12/21/world/asia/sydney-philippines-akram.html
2025-12-21-09-22-19 +0000,bbc,Postcode glitch freezes pensioners out of winter heating benefit,https://www.bbc.com/news/articles/cx231pv2km4o?at_medium=RSS&at_campaign=rss
2025-12-21-09-17-58 +0000,nyt,"Long Before Bondi Massacre, Australian Jews Lived With a Sense of Peril",https://www.nytimes.com/2025/12/21/world/australia/bondi-massacre-jewish-australians.html
2025-12-21-09-15-13 +0000,bbc,Why is Afcon taking place in December?,https://www.bbc.com/sport/football/articles/cx2e1gexypxo?at_medium=RSS&at_campaign=rss
2025-12-21-09-00-25 +0000,cbc,"Somalis say foreign ships are stealing their fish, and it's fuelling a piracy resurgence",https://www.cbc.ca/news/world/illegal-fishing-somalia-piracy-9.7018340?cmp=rss
2025-12-21-09-00-00 +0000,cbc,"'Too much regulation, not enough action': Carney rebuffs Trudeau's climate policies",https://www.cbc.ca/news/politics/carney-canada-climate-policies-9.7024255?cmp=rss
2025-12-21-09-00-00 +0000,cbc,"In the trades, apprentices are increasing, but not enough are making it to certification",https://www.cbc.ca/news/canada/apprenticeships-registrations-certifications-9.7021768?cmp=rss
2025-12-21-08-25-14 +0000,bbc,Trio ejected as Eagles beat Commanders to win title,https://www.bbc.com/sport/american-football/articles/cq5q1ygnl42o?at_medium=RSS&at_campaign=rss
2025-12-21-08-12-45 +0000,bbc,Imran Khan and wife given further jail terms after state gift fraud case,https://www.bbc.com/news/articles/c62vx2pgl0eo?at_medium=RSS&at_campaign=rss
2025-12-21-08-06-23 +0000,bbc,Who are the contenders to win Afcon?,https://www.bbc.com/sport/football/videos/clyde53vkjro?at_medium=RSS&at_campaign=rss
2025-12-21-08-00-32 +0000,nyt,NYC Holiday Markets Offer Profit and Peril for Small-Business Owners,https://www.nytimes.com/2025/12/21/nyregion/nyc-holiday-markets-small-business.html
