pubdate,source,title,link
2025-12-16-16-24-07 +0000,nypost,Clueless tourist vacationing in Philippines unknowingly handles world’s deadliest octopus,https://nypost.com/2025/12/16/world-news/man-vacationing-in-the-philippines-unknowingly-handled-the-worlds-deadliest-octopus/
2025-12-16-16-18-00 +0000,wsj,DAZN in Advanced Talks for Stake in Broadcaster Main Street Sports,https://www.wsj.com/business/media/dazn-in-advanced-talks-for-stake-in-broadcaster-main-street-sports-ff9afcfa?mod=pls_whats_news_us_business_f
2025-12-16-16-15-03 +0000,nyt,Dashcam Footage Shows Couple Confronting a Suspected Bondi Beach Gunman,https://www.nytimes.com/2025/12/16/world/australia/bondi-beach-shooting-dashcam-video-boris-sofia-gurman.html
2025-12-16-16-04-54 +0000,bbc,"Eight killed in latest strikes on alleged drug boats, US military says",https://www.bbc.com/news/articles/c3e0wd7110vo?at_medium=RSS&at_campaign=rss
2025-12-16-16-01-38 +0000,nypost,Marco Rubio rules out 2028 run if JD Vance seeks Republican nomination,https://nypost.com/2025/12/16/us-news/marco-rubio-rules-out-2028-run-if-jd-vance-seeks-republican-nomination/
2025-12-16-15-56-15 +0000,nypost,Thousands flock to Tokyo zoo to see the last 2 pandas in Japan before their return to China,https://nypost.com/2025/12/16/world-news/thousands-flock-to-a-tokyo-zoo-to-see-the-last-2-pandas-in-japan-before-their-return-to-china/
