pubdate,source,title,link
2025-08-01-10-50-18 +0000,nyt,Live Updates: Markets Drop After Trump Announces New Tariffs on Dozens of Nations,https://www.nytimes.com/live/2025/07/31/business/tariffs-trump-trade
2025-08-01-10-49-57 +0000,nyt,ISIS Militant Sentenced to Life for Role in Burning Pilot Alive in Syria,https://www.nytimes.com/2025/07/31/world/europe/isis-pilot-burning-sentenced-stockholm.html
2025-08-01-10-49-37 +0000,bbc,Five things more expensive in Canada due to tariffs,https://www.bbc.com/news/articles/c1w8jq88xzlo?at_medium=RSS&at_campaign=rss
2025-08-01-10-49-18 +0000,nyt,"Exxon Chief Says Demand for Oil Remains ‘Very, Very Strong.’",https://www.nytimes.com/2025/08/01/business/energy-environment/exxon-profit-oil-price.html
2025-08-01-10-45-57 +0000,bbc,Trump presses ahead with 30% tariff on South Africa,https://www.bbc.com/news/articles/cr74v1dzzxdo?at_medium=RSS&at_campaign=rss
2025-08-01-10-40-21 +0000,bbc,Zelensky demands tougher sanctions after Russian strikes kill 31 in Kyiv,https://www.bbc.com/news/articles/c5ypdxnz6k2o?at_medium=RSS&at_campaign=rss
2025-08-01-10-40-20 +0000,nyt,Trump Envoy Witkoff Is Set to Visit Gaza as Aid Crisis Deepens,https://www.nytimes.com/2025/08/01/world/middleeast/witkoff-gaza-aid-trump-us.html
2025-08-01-10-39-00 +0000,wsj,Stock Market Today: Stocks Fall on Trump's Tariff Blitz; Jobs Report Due,https://www.wsj.com/livecoverage/jobs-report-today-stock-market-08-01-2025?mod=rss_markets_main
2025-08-01-10-37-00 +0000,wsj,AXA Shares Slide After Currency Fluctuations Bite,https://www.wsj.com/business/earnings/axa-posts-net-profit-below-estimates-on-currency-hit-7469cdac?mod=pls_whats_news_us_business_f
2025-08-01-10-33-00 +0000,wsj,Exxon Sees M&A Possibilities as Oil Giants Post Lower Profits,https://www.wsj.com/business/energy-oil/exxon-chevron-oil-earnings-q2-2025-9d8c3bbe?mod=pls_whats_news_us_business_f
2025-08-01-10-30-00 +0000,wsj,Why Amazon’s Massive Retail Business Is No Longer Enough,https://www.wsj.com/tech/ai/why-amazons-massive-retail-business-is-no-longer-enough-4802743b?mod=rss_markets_main
2025-08-01-10-23-46 +0000,nypost,Idaho murder victim Ethan Chapin’s family releases tragic statement after skipping Bryan Kohberger’s sentencing,https://nypost.com/2025/08/01/us-news/family-of-idaho-murder-victim-ethan-chapin-speaks-out-following-killer-bryan-kohbergers-life-sentence/
2025-08-01-10-08-47 +0000,bbc,"Civil service interns must be working class, government says",https://www.bbc.com/news/articles/c3ez3v9v8jqo?at_medium=RSS&at_campaign=rss
2025-08-01-10-06-25 +0000,bbc,Carney 'disappointed' as Trump increases tariffs on Canada to 35%,https://www.bbc.com/news/articles/c8deqejdrmro?at_medium=RSS&at_campaign=rss
2025-08-01-10-06-11 +0000,nypost,Desperate Democrats are finally embracing crypto and backing Trump bills to win back voters,https://nypost.com/2025/08/01/business/democrats-embracing-crypto-trump-bills-to-win-back-voters/
2025-08-01-10-00-45 +0000,wapo,The champion English women’s soccer team is scoring new fans — even men,https://www.washingtonpost.com/world/2025/08/01/england-womens-soccer-champions-football/
2025-08-01-10-00-39 +0000,wapo,Trump is remaking the global trade system even as some see trouble ahead,https://www.washingtonpost.com/business/2025/08/01/trump-trade-policy-us-tariffs-global-economy/
2025-08-01-10-00-38 +0000,wapo,The former private prison exec behind ICE’s immigrant detention surge,https://www.washingtonpost.com/business/2025/08/01/ice-david-venturella-geo-immigration-detention/
2025-08-01-10-00-37 +0000,bbc,Rhino horns turned radioactive to fight poachers in South Africa,https://www.bbc.com/news/articles/cyvn3264q01o?at_medium=RSS&at_campaign=rss
2025-08-01-10-00-05 +0000,wapo,What humans can learn from some of history’s greatest zoo escapes,https://www.washingtonpost.com/business/interactive/2025/what-zoo-escapes-can-teach-humans/
2025-08-01-10-00-03 +0000,wapo,"Labor market expected to soften in July, as employers exercise caution",https://www.washingtonpost.com/business/2025/08/01/jobs-report-july-unemployment/
2025-08-01-10-00-00 +0000,latimes,'This fire could have been prevented': How utilities fought removal of old power lines,https://www.latimes.com/environment/story/2025-08-01/this-fire-could-have-been-prevented-how-utilities-fought-removal-of-old-powerlines
2025-08-01-10-00-00 +0000,latimes,Intel used to be the most valuable U.S. chipmaker. How it fell far behind Nvidia,https://www.latimes.com/business/story/2025-08-01/intel-used-to-be-the-most-valuable-u-s-chipmaker-how-it-fell-behind-nvidia
2025-08-01-10-00-00 +0000,wsj,Buying a Swiss Watch in America Is About to Get a Lot More Expensive,https://www.wsj.com/business/retail/swiss-watch-tariff-impact-omega-rolex-f9507bbe?mod=pls_whats_news_us_business_f
2025-08-01-10-00-00 +0000,wsj,"Etsy Turns From TV Ads Toward Search, With AI as the Wild Card",https://www.wsj.com/articles/etsy-turns-from-tv-ads-toward-search-with-ai-as-the-wild-card-aeb6a297?mod=pls_whats_news_us_business_f
2025-08-01-10-00-00 +0000,wsj,Perella Weinberg Strikes Deal for Advisory Firm Specializing in Red-Hot Market,https://www.wsj.com/finance/investing/perella-weinberg-strikes-deal-for-advisory-firm-specializing-in-red-hot-market-81fe2c29?mod=rss_markets_main
2025-08-01-10-00-00 +0000,wapo,"Medicare, Medicaid plans to experiment with covering weight loss drugs",https://www.washingtonpost.com/health/2025/08/01/medicare-medicaid-weight-loss-drugs/
2025-08-01-10-00-00 +0000,latimes,She faced $500 daily HOA fines for an unapproved door in her home. A new state law saved her,https://www.latimes.com/california/story/2025-08-01/its-a-gamechanger-in-a-surprising-twist-hoa-fees-are-now-capped-at-100
2025-08-01-10-00-00 +0000,latimes,"Bear trouble in Sierra Madre: After the Eaton fire, home invasions rise sharply",https://www.latimes.com/environment/story/2025-08-01/sierra-madre-bears-home-invasions-spike-in-june
2025-08-01-10-00-00 +0000,latimes,"Long Beach man gets 358-year sentence for killing 17-year-old girl, shooting at four other minors",https://www.latimes.com/california/story/2025-08-01/man-sentenced-358-years-murder-17-year-old-girl
2025-08-01-10-00-00 +0000,latimes,The energy source that could survive Trump's attack on California's green ambitions,https://www.latimes.com/environment/story/2025-08-01/avina-hydrogen-project-trump-attack-on-california-green-energy
2025-08-01-10-00-00 +0000,latimes,"Chabria: Kamala Harris hints at a 2028 re-run, raising the question: Can a woman win?",https://www.latimes.com/california/story/2025-08-01/kamala-harris-hints-at-a-2028-re-run-heres-the-question-we-need-to-ask
2025-08-01-10-00-00 +0000,latimes,Contributor: The left should stop harping on men. That drives them to Trump,https://www.latimes.com/opinion/story/2025-08-01/democrats-alienating-men
2025-08-01-09-58-09 +0000,bbc,Labour MP Tulip Siddiq to face trial in Bangladesh,https://www.bbc.com/news/articles/czjmd2dw3glo?at_medium=RSS&at_campaign=rss
2025-08-01-09-54-17 +0000,nyt,Here is the latest.,https://www.nytimes.com/live/2025/07/31/business/tariffs-trump-trade/here-is-the-latest
2025-08-01-09-53-21 +0000,nyt,"With New 40% Tariff, Trump Takes Aim at U.S. Dependence on China’s Factories",https://www.nytimes.com/2025/08/01/business/trump-tariffs-china-transshipment.html
2025-08-01-09-46-00 +0000,wsj,"Eurozone Inflation Holds Steady at Target, Leaving ECB in ‘Good Place’",https://www.wsj.com/economy/eurozone-inflation-holds-steady-reinforcing-ecb-rate-hold-views-eee44878
2025-08-01-09-30-00 +0000,wsj,Why the Latest Meme Stock Craze Won’t Take Down the Overall Market,https://www.wsj.com/finance/stocks/meme-stock-market-impact-outlook-5df71ee5?mod=rss_markets_main
2025-08-01-09-29-14 +0000,nyt,"Switzerland Is Stunned by 39% U.S. Tariff, Among the Highest in the World",https://www.nytimes.com/2025/08/01/business/economy/switzerland-trump-tariffs.html
2025-08-01-09-17-35 +0000,nyt,U.S. Tariffs Land on Taiwan Amid Tension With Washington,https://www.nytimes.com/2025/08/01/business/taiwan-tariffs-trump-us-chips.html
2025-08-01-09-13-50 +0000,nypost,"Chicago, Minneapolis smothered with worst air quality in world as Canadian wildfire smoke returns",https://nypost.com/2025/08/01/us-news/chicago-minneapolis-smothered-with-worst-air-quality-in-world-as-canadian-wildfire-smoke-returns/
2025-08-01-09-02-30 +0000,nyt,Manhattan Has More Secure Buildings Than Most Cities. That Wasn’t Enough.,https://www.nytimes.com/2025/08/01/business/manhattan-shooting-building-security.html
2025-08-01-09-01-58 +0000,nyt,Virginia Education Board Could Oust George Mason’s President,https://www.nytimes.com/2025/08/01/us/george-masons-president-gregory-washington-republicans-diversity.html
2025-08-01-09-01-54 +0000,nyt,Corruption Scandal Puts Mexico’s President on Defense Against Trump,https://www.nytimes.com/2025/08/01/world/americas/mexico-corruption-trump.html
2025-08-01-09-01-37 +0000,nyt,Where Human Labor Meets ‘Digital Labor’,https://www.nytimes.com/2025/08/01/business/ai-digital-labor.html
2025-08-01-09-00-50 +0000,nyt,The Changing Politics of Masks,https://www.nytimes.com/2025/08/01/style/masks-ice-meaning.html
2025-08-01-09-00-28 +0000,nyt,"In Delhi and New York, Hindu Right Wing Lines Up Against Mamdani",https://www.nytimes.com/2025/08/01/world/asia/mamdani-india-hindu-muslims-modi-new-york-mayor.html
2025-08-01-09-00-19 +0000,nyt,"Fleeing Domestic Violence, and the Russian Advance",https://www.nytimes.com/2025/08/01/world/europe/ukraine-russia-women-sumy.html
2025-08-01-09-00-08 +0000,nyt,Harm or Help? Why Companies Are Battling Tariffs Meant to Benefit Them.,https://www.nytimes.com/2025/08/01/business/economy/harm-or-help-why-companies-are-battling-tariffs-meant-to-benefit-them.html
2025-08-01-09-00-07 +0000,wapo,"China wants you to buy Labubu dolls, not Lafufus",https://www.washingtonpost.com/world/2025/08/01/labubu-lafufu-china-counterfeit-crackdown/
2025-08-01-08-50-00 +0000,bbc,Car loan scandal payouts row - what's it about?,https://www.bbc.com/news/articles/c2l9vvj097lo?at_medium=RSS&at_campaign=rss
2025-08-01-08-40-25 +0000,wapo,"Looting, chaos and Israeli gunfire prevent aid from reaching Gazans",https://www.washingtonpost.com/world/2025/08/01/gaza-food-israel-chaos/
2025-08-01-08-37-31 +0000,nypost,Eerie moment Devil’s Den murder suspect Andrew James McGann is arrested mid-haircut for allegedly killing married couple: ‘He looked soulless’,https://nypost.com/2025/08/01/us-news/devils-den-state-park-murder-suspect-andrew-james-mcgann-arrested-in-arkansas-lupitas-beauty-salon/
2025-08-01-08-30-00 +0000,wsj,"In a Country Trump Says Nobody’s Heard Of, Tariffs Bring Chaos",https://www.wsj.com/world/africa/lesotho-tariffs-state-of-disaster-87c17f46?mod=pls_whats_news_us_business_f
2025-08-01-08-30-00 +0000,wsj,"President Trump promised Africa that trade would replace aid, but in one of the world’s poorest countries his administration is slashing both",https://www.wsj.com/world/africa/lesotho-tariffs-state-of-disaster-87c17f46
2025-08-01-08-14-07 +0000,nyt,Kamala Harris Tells Colbert She Wants a Break From Public Office,https://www.nytimes.com/2025/08/01/us/politics/kamala-harris-stephen-colbert-interview.html
2025-08-01-08-00-00 +0000,cbc,Close monitoring of Hockey Canada to continue as condition of federal funding,https://www.cbc.ca/news/politics/government-monitoring-hockey-canada-1.7599033?cmp=rss
2025-08-01-07-56-01 +0000,nyt,How the Threat of Trump’s Highest Tariff Derailed an African Nation,https://www.nytimes.com/2025/08/01/world/africa/lesotho-tariffs-textile-industry.html
2025-08-01-07-50-00 +0000,wsj,Asia Manufacturing Outlook Marks Five-Year Low as Tariff Concerns Linger,https://www.wsj.com/economy/asia-manufacturing-outlook-marks-five-year-low-as-tariff-concerns-linger-249cc404
2025-08-01-07-16-05 +0000,nypost,Flight attendants sue Boeing over MAX 9 panel blowout incident: report,https://nypost.com/2025/08/01/us-news/alaska-airlines-flight-attendants-sue-boeing-for-mid-air-cabin-panel-blowout/
2025-08-01-07-11-22 +0000,bbc,Watch: 'UFO' spotted in Australian skies identified as Chinese rocket,https://www.bbc.com/news/videos/cnv738l2qm9o?at_medium=RSS&at_campaign=rss
2025-08-01-06-55-25 +0000,nypost,Celebrity Florida hairstylist Ryan Pearl accused of sexually preying on 15-year-old client,https://nypost.com/2025/08/01/us-news/celebrity-florida-hairstylist-ryan-pearl-accused-of-sexually-preying-on-15-year-old-client/
2025-08-01-06-48-41 +0000,bbc,Car finance compensation landmark ruling due,https://www.bbc.com/news/articles/c8j1jkyjl1xo?at_medium=RSS&at_campaign=rss
2025-08-01-06-42-56 +0000,nyt,5 Missing After Deadly Mine Collapse in Chile,https://www.nytimes.com/2025/08/01/world/americas/chile-mine-collapse.html
2025-08-01-06-35-49 +0000,nyt,"Some Kenyan Runners See Doping as a Path to Glory, and a Daily Meal",https://www.nytimes.com/2025/07/29/world/africa/kenya-runners-doping.html
2025-08-01-06-31-37 +0000,bbc,Ballet and bioluminescence: Africa's top shots,https://www.bbc.com/news/articles/cx29vvn1px4o?at_medium=RSS&at_campaign=rss
2025-08-01-06-22-00 +0000,wsj,"Trump Should Get Nobel Peace Prize for Brokering Cease-Fire Deal, Cambodian Deputy PM Says",https://www.wsj.com/world/asia/trump-should-get-nobel-peace-prize-for-brokering-cease-fire-deal-cambodian-deputy-pm-says-36355ba1
2025-08-01-06-00-52 +0000,wapo,Concern mounts in India as Trump lashes out and trade talks stall,https://www.washingtonpost.com/world/2025/08/01/india-us-trump-modi-trade-tariffs/
2025-08-01-05-56-08 +0000,nyt,"El Salvador Changes Constitution, Ending Term Limits for Nayib Bukele",https://www.nytimes.com/2025/08/01/world/americas/el-salvador-bukele-term-limits.html
2025-08-01-05-48-01 +0000,nyt,Cambodia Agrees to a Reduced Tariff and Breathes a Sigh of Relief,https://www.nytimes.com/2025/08/01/business/economy/cambodia-tariffs-trump.html
2025-08-01-05-44-24 +0000,nypost,Kamala Harris complains ‘the system’ is ‘broken’ in Stephen Colbert interview after spending $1B on failed presidential campaign  – suggests she won’t run in 2028,https://nypost.com/2025/08/01/us-news/kamala-harris-complains-the-system-is-broken-in-stephen-colbert-interview-after-spending-1b-on-failed-presidential-campaign-suggests-she-wont-run-in-2028/
2025-08-01-05-38-00 +0000,wsj,President Trump’s tariff rollout has taken numerous twists and turns since launching earlier this year. Here’s a roundup of where things stand.,https://www.wsj.com/economy/trade/trump-tariffs-countries-trade-explained-7f826419
2025-08-01-05-37-57 +0000,nypost,"Drunk Wyoming traveler Kevin Sinning steals golf cart, goes on destructive joyride at Buffalo Niagara International Airport: police",https://nypost.com/2025/08/01/us-news/drunk-wyoming-traveler-kevin-sinning-steals-golf-cart-goes-on-destructive-joyride-at-buffalo-niagara-international-airport-police/
2025-08-01-05-29-54 +0000,nypost,Sen. Elizabeth Warren falls on Senate floor as Republicans offer bipartisan assistance during Israel vote,https://nypost.com/2025/08/01/us-news/warren-tumbles-on-senate-floor-during-israel-resolution-vote/
2025-08-01-05-26-14 +0000,nyt,Air Traffic Controllers Urged Safety Changes Years Before D.C. Crash,https://www.nytimes.com/2025/07/31/us/politics/ntsb-dc-airport-crash-air-traffic.html
2025-08-01-05-12-48 +0000,nyt,Trump Gives Mexico a Reprieve but Slams Canada With Higher Tariffs,https://www.nytimes.com/2025/08/01/world/canada/canada-tariffs-trump.html
2025-08-01-05-09-57 +0000,nypost,"Father of Miami sailing camper, 13, reveals final words with ‘perfect daughter’ before deadly boat crash",https://nypost.com/2025/08/01/us-news/father-of-miami-sailing-camper-erin-ko-han-reveals-final-words-with-perfect-daughter-before-deadly-boat-crash/
2025-08-01-05-09-39 +0000,nyt,"Judge Extends Protections for Migrants From Nepal, Honduras and Nicaragua",https://www.nytimes.com/2025/08/01/us/politics/tps-immigrants-nepal-honduras-venezuela.html
2025-08-01-05-07-45 +0000,wapo,El Salvador approves changes to let Bukele extend presidency indefinitely,https://www.washingtonpost.com/world/2025/08/01/bukele-el-salvador-president-constitution-power/
2025-08-01-05-07-20 +0000,bbc,Two girls shot in Gaza - BBC pieces together what happened and looks at dozens more child shootings,https://www.bbc.com/news/videos/cjelp738zd7o?at_medium=RSS&at_campaign=rss
2025-08-01-04-42-31 +0000,nypost,"Palestinian Islamic Jihad releases video of frail Israeli hostage Rom Braslavski, leaving family reeling: ‘They broke my boy’",https://nypost.com/2025/08/01/world-news/palestinian-islamic-jihad-releases-video-of-frail-israeli-hostage-rom-braslavski-leaving-family-reeling/
2025-08-01-04-30-05 +0000,nyt,Friday Briefing: Trump’s Tariff Day,https://www.nytimes.com/2025/08/01/briefing/trump-tariff-day-arab-league-hamas-disarm-ukraine-russia.html
2025-08-01-04-27-56 +0000,nyt,"Cécile Dionne, Who Found Fame and Despair as a Quintuplet, Dies at 91",https://www.nytimes.com/2025/07/31/world/canada/cecile-dionne-dead.html
2025-08-01-04-26-44 +0000,bbc,Six things that may cost Americans more after Trump's tariffs,https://www.bbc.com/news/articles/cvgpvq20qmdo?at_medium=RSS&at_campaign=rss
2025-08-01-04-09-40 +0000,nyt,David Nabarro Dies at 75; Grappled Globally With Ebola and Covid,https://www.nytimes.com/2025/07/31/us/politics/david-nabarro-dead.html
2025-08-01-04-07-54 +0000,nyt,E.U. Did Not Retain Texts Sought by Journalists on Covid Vaccine Deal,https://www.nytimes.com/2025/08/01/world/europe/eu-texts-covid-new-york-times.html
2025-08-01-04-01-05 +0000,nyt,A French Beach Town’s Plea to Tourists: Keep Your Clothes On,https://www.nytimes.com/2025/08/01/world/europe/france-beach-town-tourist-fines.html
2025-08-01-04-00-34 +0000,startribune,Bust of Suni Lee near Lake Phalen reported stolen,https://www.startribune.com/bust-of-suni-lee-near-lake-phalen-reported-stolen/601447370
2025-08-01-04-00-00 +0000,wapo,The world cares about the two-state solution again. Is it too late?,https://www.washingtonpost.com/world/2025/08/01/two-state-solution-israel-gaza-netanyahu-france-canada/
2025-08-01-03-55-24 +0000,bbc,What tariffs has Trump announced and why?,https://www.bbc.com/news/articles/cn93e12rypgo?at_medium=RSS&at_campaign=rss
2025-08-01-03-52-55 +0000,nypost,Daily Beast apologizes and retracts article alleging a Melania Trump-Jeffrey Epstein link,https://nypost.com/2025/07/31/us-news/daily-beast-apologizes-and-retracts-article-alleging-a-melania-trump-jeffrey-epstein-link/
2025-08-01-03-52-13 +0000,latimes,"Trump freezes $200 million in UCLA science and medical research funding, citing antisemitism",https://www.latimes.com/california/story/2025-07-31/trump-freezes-nih-nsf-funding-ucla
2025-08-01-03-29-23 +0000,startribune,Bevy of moves at MLB trade deadline put Twins in unprecedented territory,https://www.startribune.com/bevy-of-moves-at-mlb-trade-deadline-put-twins-in-unprecedented-territory/601447255
2025-08-01-03-29-07 +0000,nyt,"Trump Sharpens Sanctions Threat on Russia, While Admitting It May Not Work",https://www.nytimes.com/2025/07/31/us/politics/trump-russia-putin-sanctions.html
2025-08-01-03-28-25 +0000,nyt,Why Did Such a Powerful Earthquake Generate Such a Weak Tsunami?,https://www.nytimes.com/2025/07/30/science/russia-earthquake-tsunami-physics.html
2025-08-01-03-24-29 +0000,nypost,Long Island swimmers set to make waves against cancer for ‘Swim Across America’ event,https://nypost.com/2025/07/31/sports/long-island-swimmers-set-to-make-waves-against-cancer-for-swim-across-america-event/
2025-08-01-03-21-15 +0000,latimes,"It would begin with a first date and end with him pinning, raping his victims",https://www.latimes.com/california/story/2025-07-31/rapist-who-used-dating-apps-and-social-media-to-meet-his-victims-is-sentenced
2025-08-01-03-06-45 +0000,nypost,"New Mexico man fatally shoots black bear that broke into his trailer home: ‘Came in, I f–king killed him’",https://nypost.com/2025/07/31/us-news/new-mexico-man-kills-black-bear-that-broke-into-his-trailer-home/
2025-08-01-03-00-00 +0000,wsj,How a Youth-Led Backlash Pushed Zelensky to His Biggest U-Turn Yet,https://www.wsj.com/world/europe/how-a-youth-led-backlash-pushed-zelensky-to-his-biggest-u-turn-yet-416699c7
2025-08-01-02-58-41 +0000,latimes,"Harris tells Colbert, in first interview out of office, that the U.S. system is 'broken'",https://www.latimes.com/politics/story/2025-07-31/kamala-harris-in-first-interview-since-leaving-office-says-american-system-is-broken
2025-08-01-02-53-49 +0000,nyt,"Trump, Term-Limited, Amasses $200 Million War Chest for Political Ambitions",https://www.nytimes.com/2025/07/31/us/politics/maga-inc-trump-fundraising.html
2025-08-01-02-53-35 +0000,nypost,"Minnesota maniac, who aspired to become ‘a mass murderer,’ laughed while recounting near-fatal stabbing of homeless woman: complaint",https://nypost.com/2025/07/31/us-news/minnesota-maniac-who-aspired-to-become-a-mass-murderer-laughed-while-recounting-near-fatal-stabbing-of-homeless-woman-complaint/
2025-08-01-02-48-17 +0000,nyt,Police in Tennessee Seek Man They Say Killed 4 in Case Linked to Abandoned Baby,https://www.nytimes.com/2025/07/31/us/tennessee-abandoned-baby-suspect.html
2025-08-01-02-48-05 +0000,nypost,"Wild tattoos of 2,500-year-old Siberian ‘ice mummy’ revealed for first time",https://nypost.com/2025/07/31/world-news/wild-tattoos-of-2500-year-old-siberian-ice-mummy-revealed-for-first-time/
2025-08-01-02-35-53 +0000,bbc,"Shock, chaos and a hollow win: What it's like to do a tariff deal with Trump",https://www.bbc.com/news/articles/cger99z0yp9o?at_medium=RSS&at_campaign=rss
2025-08-01-02-34-00 +0000,wsj,"Lawmakers have introduced bills targeting China, a reminder of Capitol Hill’s deep-seated desire to punish Beijing over human rights even as President Trump gives priority to a trade deal",https://www.wsj.com/politics/policy/congress-looks-to-punish-china-while-trump-pursues-trade-deal-e0c1cfe3
2025-08-01-02-24-52 +0000,latimes,"Mom visited her kid at juvenile hall and brought fentanyl along, authorities say",https://www.latimes.com/california/story/2025-07-31/fentanyl-youth-facility-mother
2025-08-01-02-24-38 +0000,nyt,"‘Clinton Plan’ Emails Were Likely Made by Russian Spies, Declassified Report Shows",https://www.nytimes.com/2025/07/31/us/politics/trump-clinton-emails-russia-investigation.html
2025-08-01-02-23-00 +0000,wsj,China’s Manufacturing Activity Tumbles Into Contraction,https://www.wsj.com/economy/chinas-manufacturing-activity-tumbles-into-contraction-65e4e513
2025-08-01-02-18-41 +0000,wapo,Trump puts trade deal in doubt after Canada backs Palestinian state,https://www.washingtonpost.com/politics/2025/07/31/trump-canada-trade-tariffs-palestinian-statehood/
2025-08-01-02-18-25 +0000,nyt,Trump to Impose Sweeping New Tariffs on Much of the World,https://www.nytimes.com/2025/07/31/us/politics/deadline-trump-tariffs.html
2025-08-01-02-18-22 +0000,bbc,"Lindsay Lohan on motherhood, acting again and the Freaky Friday sequel",https://www.bbc.com/news/articles/c707ewljqv5o?at_medium=RSS&at_campaign=rss
2025-08-01-02-17-25 +0000,nypost,Russian woman beaten in viral Cincinnati brawl returns home as attacker’s family claims race is driving national outrage,https://nypost.com/2025/07/31/us-news/russian-woman-beaten-in-cincinnati-brawl-returns-home-attackers-family-claims-race-driving-outrage/
2025-08-01-02-17-15 +0000,nypost,Vile footage shows man slap woman for refusing to give up seat at Colombian airport terminal: ‘Get up or I’ll get you up’,https://nypost.com/2025/07/31/world-news/vile-footage-shows-man-slap-woman-for-refusing-to-give-up-seat-at-colombian-airport-terminal-get-up-or-ill-get-you-up/
2025-08-01-02-14-19 +0000,nyt,"White House Unveils Plan for $200 Million Ballroom, Trump’s Long-Sought Imprint",https://www.nytimes.com/2025/07/31/us/politics/white-house-ballroom-trump.html
2025-08-01-02-13-00 +0000,wsj,Salvadoran Legislators Clear Way for Bukele’s Unlimited Re-Election,https://www.wsj.com/world/americas/salvadoran-legislators-clear-way-for-bukeles-unlimited-re-election-9c0c0d1f
2025-08-01-02-07-33 +0000,nyt,Trump Imposes 35% Tariff on Canada and Grants Mexico a 90-Day Extension,https://www.nytimes.com/2025/07/31/us/politics/trump-tariffs-mexico-extension.html
2025-08-01-02-06-57 +0000,nyt,"Amazon Reports Strong Retail Demand, but Says Future Is Less Clear",https://www.nytimes.com/2025/07/31/business/amazon-earnings-second-quarter.html
2025-08-01-01-54-32 +0000,bbc,Authorities jail 108 members of Imran Khan's party,https://www.bbc.com/news/articles/c4gzj4p7p64o?at_medium=RSS&at_campaign=rss
2025-08-01-01-53-00 +0000,wsj,Community Callout: What Would You Ask a Mega-Millionaire About Money?,https://www.wsj.com/finance/investing/community-callout-what-would-you-ask-a-mega-millionaire-about-money-b7b1a39d?mod=rss_markets_main
2025-08-01-01-37-17 +0000,wapo,"Derk Sauer, an independent force in Russian media, dies at 72",https://www.washingtonpost.com/obituaries/2025/07/31/derk-sauer-dead-moscow-times/
2025-08-01-01-31-46 +0000,nyt,"Smithsonian Removes Reference to Trump’s Impeachments, but Says It Will Return",https://www.nytimes.com/2025/07/31/us/politics/smithsonian-trump-impeachments-exhibit.html
2025-08-01-01-23-42 +0000,nypost,"Octopus attacks 6-year-old boy at Texas aquarium, mom claims: ‘We started yelling for help’",https://nypost.com/2025/07/31/us-news/octopus-attacks-6-year-old-boy-at-texas-aquarium-mom-claims/
2025-08-01-01-22-29 +0000,latimes,Gov. Newsom seeks to raise $18 billion to shore up state wildfire fund,https://www.latimes.com/environment/story/2025-07-31/governor-wants-another-18-billion-to-shore-up-state-wildfire-fund
