pubdate,source,title,link
2025-12-16-22-39-14 +0000,bbc,Downing Street insists negotiations over US-UK tech deal still live,https://www.bbc.com/news/articles/c79x54dprngo?at_medium=RSS&at_campaign=rss
2025-12-16-22-38-00 +0000,wsj,Opinion | Can Congress Finally Reform NEPA?,https://www.wsj.com/opinion/nepa-permitting-reform-bill-congress-jared-golden-bruce-westerman-1acd481a
2025-12-16-22-33-46 +0000,cbc,Canadian military intelligence operative accused of leaking secrets was trying to help Ukraine: sources,https://www.cbc.ca/news/politics/canadian-military-intelligence-ukraine-charges-9.7018645?cmp=rss
2025-12-16-22-29-02 +0000,nypost,Trump adding 5 new countries to travel ban – imposes restrictions on 15 others,https://nypost.com/2025/12/16/us-news/trump-adding-5-new-countries-to-travel-ban-and-imposes-restrictions-on-15-others/
2025-12-16-22-28-08 +0000,nyt,"MIT Professor Nuno Loureiro Is Fatally Shot in His Brookline, Mass., Home",https://www.nytimes.com/2025/12/16/us/mit-professor-shot-brookline-nuno-loureiro.html
2025-12-16-22-26-55 +0000,nyt,"Remixing Trump’s Economy Speech, Vance Strikes a Different Tone",https://www.nytimes.com/2025/12/16/us/politics/vance-trump-economy-speech.html
2025-12-16-22-25-14 +0000,nypost,Jeffrey Epstein kept Bear Stearns job despite lying on résumé — while he was dating boss’s daughter: report,https://nypost.com/2025/12/16/business/jeffrey-epstein-kept-bear-stearns-job-after-resume-lie-while-dating-bosss-daughter/
2025-12-16-22-24-23 +0000,nypost,Bari Weiss’ town hall with Erika Kirk saw ratings plummet as CBS News editor-in-chief debuts on-screen,https://nypost.com/2025/12/16/media/bari-weiss-town-hall-with-erika-kirk-takes-ratings-dive/
2025-12-16-22-17-34 +0000,bbc,MIT professor shot at his Massachusetts home dies,https://www.bbc.com/news/articles/cly08y25688o?at_medium=RSS&at_campaign=rss
2025-12-16-22-13-03 +0000,nypost,Zelensky thinks US would tighten screws on Russia if Moscow rejects Trump’s peace plan,https://nypost.com/2025/12/16/world-news/us-could-issue-russian-sanctions-send-kyiv-weapons-if-kremlin-rejects-trump-peace-plan-zelensky/
2025-12-16-22-13-00 +0000,wsj,Trump’s Renovation Spree Is Spreading to More Washington Landmarks,https://www.wsj.com/politics/policy/trump-dc-renovation-demolition-7d3ab3dc
2025-12-16-22-11-00 +0000,wsj,E.W. Scripps Rejects Sinclair’s Acquisition Offer,https://www.wsj.com/business/media/e-w-scripps-rejects-sinclairs-acquisition-offer-c19204be?mod=pls_whats_news_us_business_f
2025-12-16-22-09-56 +0000,nyt,"France Passes Welfare Budget Law, Giving Government Rare Win",https://www.nytimes.com/2025/12/16/world/europe/france-budget-law-lecornu-macron.html
2025-12-16-22-02-05 +0000,latimes,California sues Trump administration for 50th time. This one is over EV charger network money,https://www.latimes.com/environment/story/2025-12-16/california-sues-trump-administration-for-50th-time-this-one-is-over-ev-charger-network-money
2025-12-16-22-01-27 +0000,bbc,Fifa announces small number of £45 World Cup tickets after criticism of prices,https://www.bbc.com/sport/football/articles/c157xenkg24o?at_medium=RSS&at_campaign=rss
2025-12-16-22-01-00 +0000,wsj,"The U.S. unemployment rate rose to 4.6% in November, its highest in more than four years, fueling questions about the American economy’s underlying strength",https://www.wsj.com/economy/jobs/jobs-report-october-november-2025-unemployment-economy-7f6eea90
2025-12-16-21-59-00 +0000,wsj,Health Care Roundup: Market Talk,https://www.wsj.com/business/health-care-roundup-market-talk-dca7e5e0?mod=rss_markets_main
2025-12-16-21-58-00 +0000,wsj,Opinion | Rob Reiner and the Plight of the Nepo Baby,https://www.wsj.com/opinion/rob-reiner-and-the-plight-of-the-nepo-baby-82cfc0ca
2025-12-16-21-57-13 +0000,cbc,Mikaela Shiffrin wins 4th straight slalom of Olympic season as rivals falter in night race,https://www.cbc.ca/sports/olympics/winter/alpine-skiing/shiffrin-victory-slalom-women-courcheval-france-9.7018542?cmp=rss
2025-12-16-21-57-00 +0000,wsj,Dow Falls After Jobs Data Shows Rising Unemployment Rate,https://www.wsj.com/finance/investing/dow-falls-after-jobs-data-shows-rising-unemployment-rate-5fffc0e9?mod=rss_markets_main
2025-12-16-21-56-00 +0000,wsj,Opinion | The West Needs to Open Its Eyes to Honor Killing,https://www.wsj.com/opinion/the-west-needs-to-open-its-eyes-to-honor-killing-747e8ca1
2025-12-16-21-55-50 +0000,latimes,White House defends Chief of Staff Susie Wiles after tell-all,https://www.latimes.com/politics/story/2025-12-16/white-house-defends-chief-of-staff-wiles-after-tell-all-profile
2025-12-16-21-55-00 +0000,wsj,Opinion | Donald Trump’s Affordability Failures Will Cost Him,https://www.wsj.com/opinion/donald-trumps-affordability-failures-will-cost-him-598489c3
2025-12-16-21-54-00 +0000,wsj,Opinion | Notable & Quotable: ‘Anti-Jewish Republicans’,https://www.wsj.com/opinion/notable-quotable-anti-jewish-republicans-0320fe47
2025-12-16-21-47-00 +0000,wsj,Opinion | Another Warner Bros. Travesty?,https://www.wsj.com/opinion/another-warner-bros-travesty-b8e5b1b0?mod=pls_whats_news_us_business_f
2025-12-16-21-45-50 +0000,latimes,"Barabak: In disparaging Reiner, Trump shows the shriveled heart of an us-versus-them presidency",https://www.latimes.com/politics/story/2025-12-16/trump-reiner-fanning-americas-division
2025-12-16-21-37-00 +0000,wsj,Europe Reverses Course on Combustion-Engine Ban,https://www.wsj.com/business/autos/europe-reverses-course-on-combustion-engine-ban-444aee3e
2025-12-16-21-36-25 +0000,nypost,Warner Bros. Discovery likely to reject Paramount Skydance’s $108B hostile bid: report,https://nypost.com/2025/12/16/media/warner-bros-discovery-likely-to-reject-paramount-skydances-108b-hostile-bid-report/
2025-12-16-21-34-21 +0000,nyt,"Ukraine Plan Calls For Enhanced Military, With U.S. and European Backup",https://www.nytimes.com/2025/12/16/world/europe/ukraine-security-guarantees-talks.html
2025-12-16-21-33-00 +0000,wsj,Warner Preparing to Tell Shareholders to Reject Paramount Offer,https://www.wsj.com/business/media/warner-preparing-to-tell-shareholders-to-reject-paramount-offer-38f069ae?mod=pls_whats_news_us_business_f
2025-12-16-21-28-52 +0000,latimes,SpaceX eyes possible record IPO.  What's behind the hype,https://www.latimes.com/business/story/2025-12-16/spacex-plans-blockbuster-public-offering-amid-ai-data-center-boom
2025-12-16-21-26-11 +0000,nypost,Judge rejects emergency bid to block Trump’s White House ballroom after Secret Service cites security,https://nypost.com/2025/12/16/us-news/secret-service-warns-that-stopping-trumps-wh-ballroom-poses-substantial-national-security-concerns/
2025-12-16-21-22-38 +0000,cbc,"Trump expands U.S. travel ban to 5 more countries and Palestinian Authority, toughens limits on others",https://www.cbc.ca/news/world/trump-travel-ban-five-more-9.7018374?cmp=rss
2025-12-16-21-21-27 +0000,nyt,"At Many Top Law Schools, Black Student Enrollment Continues to Drop",https://www.nytimes.com/2025/12/16/us/law-school-black-student-enrollment.html
2025-12-16-21-17-00 +0000,wsj,Invictus Growth Partners Acquires AI-Based Fraud Detection Company,https://www.wsj.com/articles/invictus-growth-partners-acquires-ai-based-fraud-detection-company-efe52047?mod=rss_markets_main
2025-12-16-21-15-21 +0000,latimes,Rob Reiner's son Nick charged with murder in parents' deaths,https://www.latimes.com/california/story/2025-12-16/rob-reiner-son-nick-murder-charges
2025-12-16-21-13-11 +0000,nyt,Wrong Turns and Long Nights: Inside the Search for the Brown University Attacker,https://www.nytimes.com/2025/12/16/us/brown-university-attack-timeline.html
2025-12-16-21-09-00 +0000,wsj,"Opinion | Dublin, We Have a Problem",https://www.wsj.com/opinion/dublin-we-have-a-problem-ireland-city-council-renaming-park-e9d7f79e
2025-12-16-21-05-32 +0000,nypost,Australia opposition party launches new antisemitism task force in wake of Bondi Beach shooting after ‘warnings were not heeded’,https://nypost.com/2025/12/16/world-news/australia-opposition-party-launches-new-antisemitism-taskforce-after-warnings-were-not-heeded-in-wake-of-bondi-beach-shooting/
2025-12-16-21-03-40 +0000,bbc,"Government addicted to making announcements, says PM's enforcer",https://www.bbc.com/news/articles/cz0ngzg51p3o?at_medium=RSS&at_campaign=rss
2025-12-16-21-02-28 +0000,bbc,Watch: Drone footage shows extent of flooding in Washington state,https://www.bbc.com/news/videos/c0r9jrqxndxo?at_medium=RSS&at_campaign=rss
2025-12-16-20-52-22 +0000,nypost,"Bessent says Americans will feel relief during ‘bountiful’ 2026 as inflation falls, real wages rise",https://nypost.com/2025/12/16/business/bessent-says-americans-will-feel-relief-during-bountiful-2026-as-inflation-falls-real-wages-rise/
2025-12-16-20-51-56 +0000,nyt,"In a Remote Jungle, the Gruesome Poaching of Rare Elephants",https://www.nytimes.com/2025/12/16/world/asia/borneo-elephants-poaching-beheading.html
2025-12-16-20-47-00 +0000,wsj,Russia-Ukraine Peace Efforts Send Crude to Near 5-Year Low,https://www.wsj.com/business/oil-falls-amid-prospects-of-russia-ukraine-peace-deal-0db8e69c?mod=rss_markets_main
2025-12-16-20-33-18 +0000,cbc,Trump's chief of staff gives rare interview: Here are 5 things we learned,https://www.cbc.ca/news/world/trump-chief-of-staff-susie-wiles-interview-9.7018286?cmp=rss
2025-12-16-20-33-08 +0000,nyt,White House Dismisses Rise in Unemployment,https://www.nytimes.com/2025/12/16/us/politics/trump-administration-unemployment-rate-economy.html
2025-12-16-20-33-00 +0000,wsj,"In a two-part series published in Vanity Fair, Susie Wiles called Elon Musk an “avowed ketamine [user]” and said Vice President JD Vance has been “a conspiracy theorist for a decade”",https://www.wsj.com/politics/policy/susie-wiles-vanity-fair-takeaways-44847fa2
2025-12-16-20-26-21 +0000,nyt,Jobs Report Could Provide Overdue Clarity on Uncertain Economy,https://www.nytimes.com/2025/12/16/business/economy/jobs-report-unemployment-november.html
2025-12-16-20-17-10 +0000,nypost,"Megyn Kelly helped arrange meeting between Erika Kirk and Candace Owens, hoping for ‘detente’",https://nypost.com/2025/12/16/media/megyn-kelly-says-she-arranged-detente-between-erika-kirk-candace-owens/
2025-12-16-20-17-09 +0000,latimes,Doctor sentenced to house arrest for supplying ketamine used by Matthew Perry,https://www.latimes.com/california/story/2025-12-16/mark-chavez-matthew-perry-sentencing
2025-12-16-20-13-52 +0000,wapo,"Brown shooting victims were aspiring brain surgeon, talented musician",https://www.washingtonpost.com/nation/2025/12/15/brown-university-shooting-victims/
2025-12-16-20-10-45 +0000,bbc,Second doctor sentenced in Matthew Perry overdose death,https://www.bbc.com/news/articles/cj691n02g8ko?at_medium=RSS&at_campaign=rss
2025-12-16-20-05-59 +0000,cbc,'Buy Canadian' policy comes into effect for federal projects worth over $25M,https://www.cbc.ca/news/politics/buy-canadian-policy-takes-effect-today-9.7018300?cmp=rss
2025-12-16-20-05-51 +0000,nyt,"Rome’s New Subway Stops Are Part Museum, Part Station",https://www.nytimes.com/2025/12/16/world/europe/rome-subway-stations-museum-archaeology.html
2025-12-16-20-04-00 +0000,wsj,U.S. Dollar Ticks Lower After Data,https://www.wsj.com/finance/currencies/asian-currencies-mixed-ahead-of-u-s-employment-report-986edddb?mod=rss_markets_main
2025-12-16-20-03-00 +0000,wsj,"The Pentagon won’t release the full, unedited video of a lethal Sept. 2 strike on alleged drug traffickers, said Defense Secretary Pete Hegseth",https://www.wsj.com/politics/national-security/pete-hegseth-boat-strike-video-no-release-28feb869
2025-12-16-19-58-48 +0000,nyt,Mark Carney Caught in Canada’s British Spelling Debate,https://www.nytimes.com/2025/12/16/world/canada/carney-british-spelling.html
2025-12-16-19-56-00 +0000,wsj,Freddie Mac Names Kenny M. Smith as Next Chief Executive,https://www.wsj.com/finance/banking/freddie-mac-names-kenny-m-smith-as-next-chief-executive-10da3aeb?mod=rss_markets_main
2025-12-16-19-53-32 +0000,nypost,"Mark Zuckerberg’s Meta allows rampant scam ads from China while raking in billions, explosive report says",https://nypost.com/2025/12/16/business/mark-zuckerbergs-meta-allows-rampant-scam-ads-from-china-while-raking-in-billions-report/
2025-12-16-19-43-54 +0000,nypost,Thailand works to bring home thousands stranded at Cambodia border crossing amid brutal fighting,https://nypost.com/2025/12/16/world-news/thailand-works-to-bring-home-thousands-stranded-at-cambodia-border-crossing-amid-brutal-fighting/
2025-12-16-19-41-40 +0000,bbc,"Only some US lawmakers to see full video of controversial boat strike, Hegseth says",https://www.bbc.com/news/articles/cdxwglkpdw7o?at_medium=RSS&at_campaign=rss
2025-12-16-19-37-31 +0000,bbc,Foreign interference in UK politics to be investigated after jailing of ex-Welsh Reform leader,https://www.bbc.com/news/articles/c87l5nq93wno?at_medium=RSS&at_campaign=rss
2025-12-16-19-37-20 +0000,bbc,Former chancellor George Osborne joins OpenAI,https://www.bbc.com/news/articles/cd6xz1jv4ezo?at_medium=RSS&at_campaign=rss
2025-12-16-19-37-14 +0000,nypost,Kevin Hassett regains lead over Kevin Warsh on prediction markets in neck-and-neck Fed chairman race,https://nypost.com/2025/12/16/business/hassett-regains-lead-over-warsh-on-prediction-markets-in-neck-and-neck-race-for-fed-chairman/
2025-12-16-19-36-00 +0000,nyt,"Susie Wiles, Trump’s Chief of Staff, Criticizes Bondi and Vance in Candid Interviews",https://www.nytimes.com/2025/12/16/us/politics/trump-susie-wiles.html
2025-12-16-19-34-36 +0000,nypost,"Rome opens breathtaking Colosseum subway station, displaying ancient artifacts",https://nypost.com/2025/12/16/world-news/rome-opens-breathtaking-colosseum-subway-station-displaying-ancient-artifacts/
2025-12-16-19-28-36 +0000,bbc,EU waters down plans to end new petrol and diesel car sales by 2035,https://www.bbc.com/news/articles/crk78y7k8ezo?at_medium=RSS&at_campaign=rss
2025-12-16-19-27-35 +0000,nyt,Trump and Top Aides Publicly Defend Susie Wiles After Explosive Interviews,https://www.nytimes.com/2025/12/16/us/politics/susie-wiles-vanity-fair.html
2025-12-16-19-25-00 +0000,wsj,"President Trump is set to interview another candidate for Federal Reserve chair, governor Christopher Waller, on Wednesday",https://www.wsj.com/economy/central-banking/trump-set-to-interview-feds-christopher-waller-for-chair-a732faff
2025-12-16-19-17-06 +0000,bbc,US designates Colombian cocaine gang a terrorist group,https://www.bbc.com/news/articles/cpq4wgle4x5o?at_medium=RSS&at_campaign=rss
2025-12-16-19-17-01 +0000,nypost,Trump thinks Russia’s Putin wants all of Ukraine: WH staff chief Susie Wiles,https://nypost.com/2025/12/16/world-news/trump-thinks-russias-putin-wants-all-of-ukraine-wh-chief-susie-wiles/
2025-12-16-19-11-38 +0000,nyt,Ruth Kiew Dies at 79; Botanist Made Discoveries in Remote Forests,https://www.nytimes.com/2025/12/16/science/earth/ruth-kiew-dead.html
2025-12-16-19-07-34 +0000,nyt,Rwanda-Backed Militia Says It Will Withdraw From Key City in Congo,https://www.nytimes.com/2025/12/16/world/africa/congo-rebels-withdraw-rwanda.html
2025-12-16-19-05-48 +0000,nypost,Trump stands by chief of staff Susie Wiles after bombshell Vanity Fair interviews — admits he has ‘alcoholic’s personality’,https://nypost.com/2025/12/16/us-news/trump-stands-by-chief-of-staff-susie-wiles-after-bombshell-vanity-fair-interviews-admits-he-has-alcoholics-personality/
2025-12-16-19-01-00 +0000,wsj,Attorneys General Sue Trump Administration Over EV Charger Funding Freeze,https://www.wsj.com/articles/attorneys-general-sue-trump-administration-over-ev-charger-funding-cuts-d1306036?mod=pls_whats_news_us_business_f
2025-12-16-19-01-00 +0000,wsj,A group of state attorneys general are suing the Trump administration in an effort to reclaim billions in funds to expand electric vehicle charging infrastructure,https://www.wsj.com/articles/attorneys-general-sue-trump-administration-over-ev-charger-funding-cuts-d1306036
2025-12-16-19-00-16 +0000,nyt,Europe May Roll Back Combustion Engine Ban,https://www.nytimes.com/2025/12/16/business/economy/europe-auto-emissions-ban.html
2025-12-16-18-57-29 +0000,nyt,Senators Investigate Role of A.I. Data Centers in Rising Electricity Costs,https://www.nytimes.com/2025/12/16/business/energy-environment/senate-democrats-electricity-prices-data-centers.html
2025-12-16-18-55-33 +0000,nyt,Netflix Adds Podcasts in Deal With iHeartMedia,https://www.nytimes.com/2025/12/16/business/media/netflix-iheartmedia-video-podcasts.html
2025-12-16-18-52-04 +0000,cbc,Ban on gas car sales walked back by EU,https://www.cbc.ca/news/climate/eu-2035-gas-car-ban-evs-9.7018046?cmp=rss
2025-12-16-18-47-00 +0000,wsj,JPMorgan’s Private-Equity Group Raises Over $1.4 Billion for Fund Investments,https://www.wsj.com/articles/jpmorgans-private-equity-group-raises-over-1-4-billion-for-fund-investments-f0b91ee7?mod=rss_markets_main
2025-12-16-18-44-31 +0000,cbc,FIFA slashes price of some World Cup tickets after global fan backlash,https://www.cbc.ca/sports/soccer/fifa-world-cup-ticket-prices-slashed-9.7018163?cmp=rss
2025-12-16-18-44-10 +0000,wapo,Just got laid off? What you should do on this social network to get noticed,https://www.washingtonpost.com/business/2025/12/15/layoff-linkedin-tips/
2025-12-16-18-34-00 +0000,wsj,Ben & Jerry’s Co-founder Says New Owner Aims to Dismantle Social Mission,https://www.wsj.com/business/ben-jerrys-co-founder-says-new-owner-aims-to-dismantle-social-mission-61f738ad?mod=pls_whats_news_us_business_f
2025-12-16-18-33-27 +0000,cbc,Bills pushed through Commons at last minute won't be studied by Senate until February,https://www.cbc.ca/news/politics/c4-c12-senate-break-9.7017813?cmp=rss
2025-12-16-18-31-08 +0000,nyt,New York Accuses UPS of Seasonal Worker Wage Theft,https://www.nytimes.com/2025/12/16/business/ups-seasonal-worker-lawsuit-new-york.html
2025-12-16-18-27-02 +0000,bbc,Employment Rights Bill clears last parliamentary hurdle,https://www.bbc.com/news/articles/c2dz16jxjp1o?at_medium=RSS&at_campaign=rss
2025-12-16-18-24-17 +0000,nyt,Trump Stymied on Prosecutors as G.O.P. Refuses to Defy Democrats,https://www.nytimes.com/2025/12/16/us/politics/trump-prosecutors-senate-blue-slips.html
2025-12-16-18-24-03 +0000,nypost,"FBI did not believe it had probable cause to raid Mar-a-Lago for classified documents, bombshell files show",https://nypost.com/2025/12/16/us-news/fbi-did-not-believe-it-had-probable-cause-to-raid-mar-a-lago-for-classified-documents-bombshell-files-show/
2025-12-16-18-22-19 +0000,bbc,'Lost Canadians' citizenship bill now in place,https://www.bbc.com/news/articles/cvgkj8gpkgwo?at_medium=RSS&at_campaign=rss
2025-12-16-18-20-00 +0000,wsj,White House Sends Angry Message to Israel Over Killing of Hamas Commander,https://www.wsj.com/world/middle-east/white-house-sends-angry-message-to-israel-over-killing-of-hamas-commander-7ea41fef
2025-12-16-18-17-21 +0000,bbc,BBC says it will defend Trump defamation lawsuit over Panorama speech edit,https://www.bbc.com/news/articles/cpvd81470v1o?at_medium=RSS&at_campaign=rss
2025-12-16-18-15-55 +0000,latimes,Newsom trolls Trump with website tracking president's 'criminal cronies',https://www.latimes.com/politics/story/2025-12-16/newsom-trolls-trump-with-website-tracking-presidents-criminal-cronies
2025-12-16-18-02-12 +0000,cbc,Inside the Detroit warehouse where America's 'fast and furious' tariffs are enforced,https://www.cbc.ca/news/canada/windsor/tariffs-windsor-detroit-cbp-customs-border-automotive-9.7014275?cmp=rss
2025-12-16-18-00-00 +0000,missionlocal,What have San Francisco police been doing at 16th and Mission?,https://missionlocal.org/2025/12/sf-16th-street-mission-daily-crime/
2025-12-16-17-57-00 +0000,wsj,Panama Ports Deal Hits Impasse as China Makes New Demands for Its Approval,https://www.wsj.com/business/logistics/panama-ports-deal-hits-impasse-as-china-makes-new-demands-for-its-approval-ff741523
2025-12-16-17-55-15 +0000,nypost,Volkswagen shutters a German plant for first time ever as Trump tariffs squeeze car giant,https://nypost.com/2025/12/16/business/volkswagen-shutters-historic-german-plant-as-trump-tariffs-bite/
2025-12-16-17-55-05 +0000,nypost,Letitia James case may be Trump’s ‘one retribution’ for taking $500M ‘of his money’: Susie Wiles,https://nypost.com/2025/12/16/us-news/letitia-james-prosecution-may-be-trumps-one-retribution-wh-chief-susie-wiles/
2025-12-16-17-51-04 +0000,bbc,Government rolls back nature protections to boost housing,https://www.bbc.com/news/articles/c3r7zp418p8o?at_medium=RSS&at_campaign=rss
2025-12-16-17-45-18 +0000,latimes,Powerball jackpot jumps to second highest this year after no winners Monday night,https://www.latimes.com/california/story/2025-12-16/powerball-jackpot-jumps
2025-12-16-17-44-02 +0000,bbc,Watch: Hundreds of skiing Santas hit the slopes,https://www.bbc.com/news/videos/cx2583edw1go?at_medium=RSS&at_campaign=rss
2025-12-16-17-42-00 +0000,wapo,"Unemployment rate rises, signaling weakness in the economy",https://www.washingtonpost.com/business/2025/12/16/jobs-report-unemployment-rate/
2025-12-16-17-37-15 +0000,nypost,Australian PM Albanese gives muted response to antisemitism spike as predecessor slams him for gun control deflection,https://nypost.com/2025/12/16/world-news/australian-pm-anthony-albanese-gives-lackluster-response-to-antisemitism-spike-as-predecessor-slams-him-for-deflecting-with-gun-reform/
2025-12-16-17-32-07 +0000,bbc,Thousands of drivers wrongly fined for speeding since 2021,https://www.bbc.com/news/articles/c70rk80p9eqo?at_medium=RSS&at_campaign=rss
2025-12-16-17-31-39 +0000,nyt,The Timing of Trump’s $10 Billion Lawsuit Against the BBC Is Significant,https://www.nytimes.com/2025/12/16/us/politics/trump-bbc-lawsuit-timing.html
2025-12-16-17-29-00 +0000,48hills,Turbulence around Gaming Developers Conference rebrand reflects changing industry,https://48hills.org/2025/12/turbulence-around-gaming-developers-conference-rebrand-reflects-changing-industry/
2025-12-16-17-27-47 +0000,nypost,"Congress floor debate turns violent as Mexican lawmakers filmed pulling hair, shoving each other",https://nypost.com/2025/12/16/world-news/congress-floor-debate-turns-violent-as-mexican-lawmakers-filmed-pulling-hair-shoving-each-other/
2025-12-16-17-20-37 +0000,nypost,Former NFL sideline reporter Michele Tafoya weighs run for Senate from Minnesota,https://nypost.com/2025/12/16/us-news/former-nfl-sideline-reporter-michele-tafoya-weighs-run-for-senate-from-minnesota/
2025-12-16-17-17-37 +0000,wapo,Trump sues BBC ‘for putting words in my mouth’,https://www.washingtonpost.com/business/2025/12/15/trump-bbc-lawsuit-defamation/
2025-12-16-17-12-31 +0000,bbc,Rebels say they will withdraw from key DR Congo city at US request,https://www.bbc.com/news/articles/c87l528ljeyo?at_medium=RSS&at_campaign=rss
2025-12-16-17-10-42 +0000,nyt,Takeaways From Susie Wiles’s Vanity Fair Interviews Describing Trump World,https://www.nytimes.com/2025/12/16/us/politics/susie-wiles-takeaways-trump.html
2025-12-16-17-08-51 +0000,bbc,Scotland's justice secretary to face no confidence vote in grooming gangs row,https://www.bbc.com/news/articles/c0je59p3zeqo?at_medium=RSS&at_campaign=rss
2025-12-16-17-06-00 +0000,wsj,Opinion | The Example Pete Hegseth Sets,https://www.wsj.com/opinion/the-example-pete-hegseth-sets-79ffac44
2025-12-16-17-04-43 +0000,48hills,Under the Stars: Karl Denson’s ‘Sexy 69th’ is your post-holiday treat,https://48hills.org/2025/12/under-the-stars-karl-densons-sexy-69th-is-your-post-holiday-treat/
2025-12-16-17-04-00 +0000,wsj,"Pepsi Worked to Keep Prices Higher at Retailers to Protect Walmart, FTC Found",https://www.wsj.com/business/retail/pepsi-worked-to-keep-prices-higher-at-retailers-to-protect-walmarts-prices-ftc-found-e2c46883?mod=pls_whats_news_us_business_f
2025-12-16-17-02-52 +0000,bbc,Former Oxfam boss to sue charity over dismissal,https://www.bbc.com/news/articles/cgex8w9930wo?at_medium=RSS&at_campaign=rss
2025-12-16-17-00-00 +0000,wsj,The Factory Workers Who Build the Power Grid by Hand,https://www.wsj.com/business/the-factory-workers-who-build-the-power-grid-by-hand-4a846658?mod=pls_whats_news_us_business_f
2025-12-16-17-00-00 +0000,wsj,"Bitcoin Keeps Sliding, and the True Believers Keep Buying",https://www.wsj.com/finance/currencies/bitcoin-keeps-sliding-and-the-true-believers-keep-buying-b3c03b1b?mod=rss_markets_main
2025-12-16-16-58-26 +0000,nyt,What to know about the report.,https://www.nytimes.com/live/2025/12/16/business/jobs-report-economy/what-to-know-about-the-report
2025-12-16-16-49-23 +0000,cbc,"Damaged homes collapsing in Gaza, trapping families under rubble following winter storm",https://www.cbc.ca/news/world/winter-storm-aftermath-gaza-buildings-collapse-floods-9.7017580?cmp=rss
2025-12-16-16-47-36 +0000,nyt,Zelensky Expresses Wary Optimism About Russia-Ukraine Peace Plan,https://www.nytimes.com/2025/12/16/world/europe/zelensky-ukraine-peace-talks.html
2025-12-16-16-45-38 +0000,latimes,"Rob Reiner's final weekend: Conan O'Brien's party, the Obamas, unthinkable violence, a frantic manhunt",https://www.latimes.com/california/story/2025-12-16/reiner-slayings-son-nick-reiner-arrested
2025-12-16-16-43-25 +0000,cbc,"3 Russians barred from luge World Cup in Lake Placid, N.Y., amid neutrality concerns",https://www.cbc.ca/sports/olympics/winter/luge/russian-luge-athletes-world-cup-lake-placid-9.7017895?cmp=rss
2025-12-16-16-37-31 +0000,bbc,PSG ordered to pay Mbappe 60m euros,https://www.bbc.com/sport/football/articles/cd0k3m1xzr8o?at_medium=RSS&at_campaign=rss
2025-12-16-16-36-32 +0000,nypost,Bondi Beach hero Ahmed el Ahmed speaks out from his hospital bed — despite being ‘riddled with bullets’,https://nypost.com/2025/12/16/world-news/bondi-beach-hero-ahmed-el-ahmed-speaks-out-from-hospital-bed/
