pubdate,source,title,link
2025-08-01-01-22-06 +0000,nypost,"26-year-old creep with violent past caught abducting girl, 3, from mall on disturbing video",https://nypost.com/2025/07/31/us-news/creep-with-violent-past-caught-abducting-girl-3-from-mall-video/
2025-08-01-01-15-00 +0000,wsj,"U.S. Envoy Steve Witkoff to Visit Gaza as Trump, Under Pressure, Seeks Aid Plan",https://www.wsj.com/world/middle-east/u-s-envoy-steve-witkoff-to-visit-gaza-as-trump-under-pressure-seeks-aid-plan-b0c057cf
2025-08-01-01-10-11 +0000,bbc,Three top officials were asleep or out of town when deadly Texas floods hit,https://www.bbc.com/news/articles/czernwez4epo?at_medium=RSS&at_campaign=rss
2025-08-01-01-10-01 +0000,nyt,Andrea Lucas Confirmed to Equal Employment Opportunity Commission,https://www.nytimes.com/2025/07/31/us/politics/andrea-lucas-equal-employment-opportunity-commission.html
2025-08-01-01-06-00 +0000,wsj,"South Korea’s Exports Accelerate, Fueled by Chip Demand",https://www.wsj.com/economy/trade/south-koreas-exports-accelerate-fueled-by-chip-demand-959c7167
2025-08-01-01-00-42 +0000,bbc,Heathrow Airport's expansion plans to cost £49bn,https://www.bbc.com/news/articles/cj6yz77nlw4o?at_medium=RSS&at_campaign=rss
2025-08-01-01-00-00 +0000,wsj,Why Ford’s Made-in-America Strategy Hurts It in Trump’s Trade War,https://www.wsj.com/business/autos/ford-trump-tariffs-made-in-america-df94b933?mod=pls_whats_news_us_business_f
2025-08-01-01-00-00 +0000,wsj,Here is how judges questioned President Trump’s claim of emergency power to junk the tariff schedule enacted by Congress,https://www.wsj.com/politics/policy/the-rough-day-in-court-for-trumps-tariffs-8f039448
2025-08-01-00-49-00 +0000,wsj,"President Trump says he has averted a half-dozen wars and deserves the Nobel Peace Prize, yet he has made scant headway with two of the world’s most intractable conflicts",https://www.wsj.com/politics/policy/trumps-vow-to-be-president-of-peace-falls-short-in-ukraine-and-gaza-27b8731e
2025-08-01-00-43-17 +0000,bbc,Should teen sex be a crime?  Indian woman lawyer mounts challenge,https://www.bbc.com/news/articles/ckgely5d84jo?at_medium=RSS&at_campaign=rss
2025-08-01-00-37-39 +0000,nypost,Israel’s top ministers say now is the time to annex the West Bank,https://nypost.com/2025/07/31/world-news/israels-top-ministers-say-now-is-the-time-to-annex-the-west-bank/
2025-08-01-00-33-27 +0000,bbc,Flooded streets and subway systems as storms slam US East Coast,https://www.bbc.com/news/videos/c2enxm0zr8ko?at_medium=RSS&at_campaign=rss
2025-08-01-00-33-05 +0000,wapo,Trump says sharper tariffs to take effect in a week; 35% for Canada starts Friday,https://www.washingtonpost.com/business/2025/07/31/trump-tariffs-face-legal-challenge/
2025-08-01-00-29-57 +0000,nypost,Nancy Mace gubernatorial run rumors reach fever pitch with apparent slip-up days before ‘special announcement’,https://nypost.com/2025/07/31/us-news/nancy-mace-gubernatorial-run-rumors-reach-fever-pitch-with-apparent-slip-up/
2025-08-01-00-25-04 +0000,bbc,Destination: Africa - Is it legal for US to deport foreign criminals to the continent?,https://www.bbc.com/news/articles/cpwqwp89kjpo?at_medium=RSS&at_campaign=rss
2025-08-01-00-06-08 +0000,bbc,White House unveils plans for new $200m ballroom,https://www.bbc.com/news/articles/c2l7dey54zjo?at_medium=RSS&at_campaign=rss
2025-08-01-00-02-28 +0000,nypost,John Thune says recess appointments are ‘on the table’ as battle for Trump confirmations drags on,https://nypost.com/2025/07/31/us-news/john-thune-says-recess-appointments-are-on-the-table-as-battle-for-trump-confirmations-drags-on/
2025-07-31-23-59-44 +0000,latimes,Know your rights: An immigration resource guide for L.A.,https://www.latimes.com/california/story/2025-07-31/know-your-rights-a-resource-guide
2025-07-31-23-55-00 +0000,wsj,"President Trump is building a Mar-a-Lago style ballroom at the White House, a $200 million addition to the East Wing that marks the former builder’s latest and most ambitious makeover of the complex",https://www.wsj.com/politics/policy/trump-ballroom-white-house-1db772f4
2025-07-31-23-54-14 +0000,nyt,Palm Beach Billionaires Battle for Oceanfront Land,https://www.nytimes.com/2025/07/30/style/palm-beach-billionaires-battle-for-oceanfront-land.html
2025-07-31-23-44-33 +0000,nypost,White House releases new tariff rates for dozens of countries after months of negotiations,https://nypost.com/2025/07/31/us-news/white-house-releases-new-tariff-rates-for-dozens-of-countries/
2025-07-31-23-33-23 +0000,nypost,MTA project to modernize subway line could be millions over budget and years late: report,https://nypost.com/2025/07/31/us-news/mta-project-to-modernize-subway-line-could-be-millions-over-budget-and-years-late-report/
2025-07-31-23-31-23 +0000,latimes,Newsom provides new details about his plan for redistricting fight with Trump,https://www.latimes.com/california/story/2025-07-31/newsom-provides-new-details-about-high-stakes-redistricting-fight-with-trump
2025-07-31-23-27-00 +0000,wsj,Figma Shares Jump 250% in Their Stock-Market Debut,https://www.wsj.com/finance/stocks/figma-shares-jump-over-200-in-stock-market-debut-605f6212?mod=rss_markets_main
2025-07-31-23-25-11 +0000,wapo,Top Trump officials to visit Gaza as hunger crisis draws outrage,https://www.washingtonpost.com/national-security/2025/07/31/trump-gaza-witkoff-huckabee/
2025-07-31-23-22-45 +0000,nypost,Kamala Harris’ new book is sure to be another self-congratulatory look at how she lost — please unburden us,https://nypost.com/2025/07/31/opinion/kamala-harris-new-book-is-a-sure-to-be-another-self-congratulatory-look-at-how-she-lost-please-unburden-us/
2025-07-31-23-18-16 +0000,latimes,"With surge in customers, Cole's French Dip delays closing date",https://www.latimes.com/food/story/2025-07-31/coles-french-dip-extends-closing-date
2025-07-31-23-15-34 +0000,nyt,Bipartisan Pair of Senators Seeks $54.6 Billion in New Aid for Ukraine,https://www.nytimes.com/2025/07/31/us/politics/senators-new-aid-ukraine.html
2025-07-31-23-07-00 +0000,wsj,How Figma Made Design Everyone’s Business,https://www.wsj.com/articles/how-figma-made-design-everyones-business-23ddae63?mod=pls_whats_news_us_business_f
2025-07-31-23-03-52 +0000,bbc,Do you feel lucky plank? Meet the new 'bulletproof' wood,https://www.bbc.com/news/articles/c0rvzdd1drpo?at_medium=RSS&at_campaign=rss
2025-07-31-23-03-02 +0000,startribune,"Amid financial turmoil, UnitedHealth Group brings in new chief financial officer",https://www.startribune.com/unitedhealth-group-brings-in-outsider-as-new-chief-financial-officer/601447408
2025-07-31-23-01-04 +0000,bbc,Trump's global tariffs 'victory' may well come at a high price,https://www.bbc.com/news/articles/c0l6g13rlwko?at_medium=RSS&at_campaign=rss
2025-07-31-23-00-27 +0000,wapo,"Prisoner can be executed without turning off pacemaker, Tennessee high court rules",https://www.washingtonpost.com/nation/2025/07/31/execution-heart-implant-pacemaker-tennessee/
2025-07-31-23-00-10 +0000,nypost,Trump struck huge trade deals — but tariffs are about to go up on a huge swath of imports as Liberation Day tariffs hit,https://nypost.com/2025/07/31/us-news/dozens-of-countries-scramble-to-make-trade-deals-before-trumps-tariff-crackdown/
2025-07-31-22-58-32 +0000,startribune,Viral Banana Ball World Tour slides into CHS Field,https://www.startribune.com/viral-banana-ball-world-tour-slides-into-chs-field/601446642
2025-07-31-22-58-24 +0000,nyt,"Massachusetts Governor Proposes $400 Million for Colleges, Citing Federal ‘Uncertainty’",https://www.nytimes.com/2025/07/31/us/politics/massachusetts-healey-trump-funding.html
2025-07-31-22-47-53 +0000,wapo,Texas lawmakers fault Kerr County officials on response to deadly floods,https://www.washingtonpost.com/nation/2025/07/31/kerrville-texas-flooding-legislative-hearing/
2025-07-31-22-41-44 +0000,nyt,"Fed Up With Netanyahu and Handling of Gaza War, Democrats Rebuke Israel",https://www.nytimes.com/2025/07/31/us/politics/democrats-israel-gaza-netanyahu.html
2025-07-31-22-39-03 +0000,latimes,"Entire bank heist crew was nabbed — except for him; then he went and blew up an ATM, prosecutors say",https://www.latimes.com/california/story/2025-07-31/fugitive-linked-to-south-american-bank-robbery-crew-arrested-after-atm-bombing
2025-07-31-22-38-36 +0000,bbc,"Iran drives out 1.5 million Afghans, with some branded spies for Israel",https://www.bbc.com/news/articles/ckglp8epg11o?at_medium=RSS&at_campaign=rss
2025-07-31-22-29-52 +0000,nypost,"Amazon shares fall on weak cloud growth while rivals Google, Microsoft thrive: ‘Very disappointing’",https://nypost.com/2025/07/31/business/amazon-posts-weak-cloud-growth-while-rivals-google-microsoft-thrive/
2025-07-31-22-27-28 +0000,wapo,"Tower failed to warn plane of Black Hawk’s path before D.C. crash, FAA says",https://www.washingtonpost.com/business/2025/07/31/ntsb-hearing-dc-plane-crash-reagan-national-airport/
2025-07-31-22-26-15 +0000,nypost,Trump signs executive order re-establishing Presidential Fitness Test: ‘MAKE AMERICA FIT AGAIN!’,https://nypost.com/2025/07/31/us-news/trump-signs-executive-order-re-establishing-presidential-fitness-test-make-america-fit-again/
2025-07-31-22-24-06 +0000,nyt,Trump Demands That Drugmakers Lower Some of Their U.S. Prices by September,https://www.nytimes.com/2025/07/31/health/drug-prices-trump.html
2025-07-31-22-21-48 +0000,nypost,Trump rakes in $1.4B as president to boost GOP in 2026 midterms,https://nypost.com/2025/07/31/us-news/trump-rakes-in-1-4b-post-2024-win-to-boost-gop-in-2026-midterms/
2025-07-31-22-19-57 +0000,bbc,Radioactive wasp nest found at old US nuclear weapons site,https://www.bbc.com/news/articles/c3dpxr85228o?at_medium=RSS&at_campaign=rss
2025-07-31-22-13-39 +0000,nypost,Crypto world and Tyler Winklevoss are in an uproar over ‘concerning’ Quintenz email reveal,https://nypost.com/2025/07/31/business/crypto-world-and-tyler-winklevoss-are-in-an-uproar-over-concerning-quintenz-email-reveal/
2025-07-31-22-11-51 +0000,nypost,"Biden’s longtime aide Mike Donilon says Dems ‘overreacted’ to disastrous, fumbling 2024 debate",https://nypost.com/2025/07/31/us-news/president-bidens-longtime-aide-mike-donilon-says-dems-overreacted-to-disastrous-debate/
2025-07-31-22-11-00 +0000,wsj,Opinion | The Big Beautiful Bill’s Healthcare Opportunity,https://www.wsj.com/opinion/the-big-beautiful-bills-healthcare-opportunity-4c8078e1
2025-07-31-22-10-54 +0000,cbc,"Trump administration to burn $13M worth of female contraceptives, despite NGO's offer to take them",https://www.cbc.ca/radio/asithappens/usaid-13m-contraceptives-1.7598749?cmp=rss
2025-07-31-22-10-32 +0000,nypost,Apple blows past sales forecasts as customers snapped up iPhones ahead of Trump’s tariffs,https://nypost.com/2025/07/31/business/apple-profit-revenue-beats-forecasts-as-iphone-sales-soar-ahead-of-trumps-tariffs/
2025-07-31-22-10-00 +0000,wsj,Opinion | A Nixonian Trump Offer to China?,https://www.wsj.com/opinion/donald-trump-china-trade-russia-scott-bessent-3529bac6
2025-07-31-22-08-00 +0000,wsj,Opinion | A Rough Day in Court for Tariffs,https://www.wsj.com/opinion/donald-trump-tariffs-ieepa-appeals-court-brett-shumate-7a840297
2025-07-31-22-04-22 +0000,nyt,Apple Surprises Investors Worried That It Had Lost Its Touch,https://www.nytimes.com/2025/07/31/business/apple-earning-iphone-sales.html
2025-07-31-22-04-00 +0000,wsj,Opinion | Alcoa: The Tariff Damage in Profile,https://www.wsj.com/opinion/alcoa-aluminum-donald-trump-tariffs-bill-oplinger-edf1c6ff?mod=pls_whats_news_us_business_f
2025-07-31-22-01-55 +0000,nypost,Billionaire Ray Dalio sells remaining stake in Bridgewater — firm he founded 50 years ago,https://nypost.com/2025/07/31/business/billionaire-ray-dalio-sells-remaining-stake-in-bridgewater-firm-he-founded-50-years-ago/
2025-07-31-22-01-39 +0000,wapo,Here are countries that recognize a Palestinian state — or may do so soon,https://www.washingtonpost.com/world/2025/07/31/palestinian-state-recognition-countries-list/
2025-07-31-22-00-48 +0000,bbc,A sinkhole revives debate about migrant workers' rights in Singapore,https://www.bbc.com/news/articles/c0l6w3n50k0o?at_medium=RSS&at_campaign=rss
2025-07-31-22-00-31 +0000,nyt,County Emergency Official Says He Was Ill and Sleeping as Texas Floods Hit,https://www.nytimes.com/2025/07/31/us/politics/texas-floods-hearing.html
2025-07-31-22-00-00 +0000,wsj,Opinion | Novo Nordisk’s Weight Loss Lesson,https://www.wsj.com/opinion/novo-nordisk-ozempic-weight-loss-drug-pharma-547351e5?mod=rss_markets_main
2025-07-31-21-58-06 +0000,nyt,Arab States Call for Hamas to Disarm Amid Push for a Palestinian State,https://www.nytimes.com/2025/07/31/world/middleeast/hamas-arab-states-palestinians.html
2025-07-31-21-57-00 +0000,wsj,Opinion | A DEI Showdown at George Mason,https://www.wsj.com/opinion/george-mason-university-gregory-washington-dei-hiring-23005915
2025-07-31-21-56-00 +0000,wsj,Young men moved dramatically toward President Trump in November. Ask them how he’s doing now and they say it’s complicated.,https://www.wsj.com/politics/policy/we-asked-young-men-who-voted-for-trump-to-grade-him-heres-what-they-said-c7a30b9c
2025-07-31-21-44-51 +0000,startribune,Minneapolis candidate suggests council member was elected based on ethnicity,https://www.startribune.com/minneapolis-council-candidate-becka-thompson-says-incumbents-elected-on-ethnicity/601447059
2025-07-31-21-43-00 +0000,wsj,Apple’s iPhone Sales Blow Past Estimates as Customers Raced to Beat Tariffs,https://www.wsj.com/business/earnings/apple-earnings-q3-2025-aapl-stock-6ddd867b?mod=pls_whats_news_us_business_f
2025-07-31-21-42-54 +0000,startribune,Allen not concerned about taking stage at NFL Hall of Fame enshrinement,https://www.startribune.com/minnesota-vikings-jared-allen-hall-of-fame-ceremony/601438349
2025-07-31-21-42-46 +0000,nyt,Here’s What to Know About Trump’s 50% Tariffs on Brazil,https://www.nytimes.com/2025/07/31/world/americas/trump-brazil-tariffs-lula.html
2025-07-31-21-40-00 +0000,wsj,Texas Lawmakers Criticize Local Officials Over Deadly Hill Country Floods,https://www.wsj.com/us-news/texas-lawmakers-criticize-local-officials-over-deadly-hill-country-floods-ea21f671
2025-07-31-21-38-08 +0000,bbc,Lib Dems call for cap on SEND school profits,https://www.bbc.com/news/articles/cx2qye8j0g4o?at_medium=RSS&at_campaign=rss
2025-07-31-21-31-00 +0000,wsj,"Geico, Berkshire Hathaway’s Car Insurer, Is on Recovery Road",https://www.wsj.com/business/geico-berkshire-hathaways-car-insurer-is-on-recovery-road-64ce2eeb?mod=pls_whats_news_us_business_f
2025-07-31-21-27-59 +0000,wapo,"After Trump’s Ukraine pivot, Senate panel moves to fund more military aid",https://www.washingtonpost.com/national-security/2025/07/31/trump-ukraine-aid-congress/
2025-07-31-21-26-19 +0000,startribune,Union blasts decision by Allina Health to close four medical clinics,https://www.startribune.com/allina-health-closing-four-clinics-including-another-loss-on-nicollet-mall-in-minneapolis/601447073
2025-07-31-21-20-00 +0000,wsj,Opinion | Haredim Are in the Israeli Army Now,https://www.wsj.com/opinion/haredim-are-in-the-israeli-army-now-hamas-gaza-middle-east-428ead0a
2025-07-31-21-19-39 +0000,bbc,Young Ukrainians get their way as Zelensky overturns law to defuse crisis,https://www.bbc.com/news/articles/cpv0n0ky4xro?at_medium=RSS&at_campaign=rss
2025-07-31-21-17-23 +0000,nyt,A Trump Ally Pressed for a Mexican Citizen’s Release From ICE Custody,https://www.nytimes.com/2025/07/31/us/politics/ice-marine-wife-senator-kennedy.html
2025-07-31-21-16-18 +0000,cbc,"Canada 'disappointed' by Trump boosting tariffs to 35%, says Carney",https://www.cbc.ca/news/world/trump-tariffs-canada-deadline-1.7598480?cmp=rss
2025-07-31-21-15-54 +0000,nyt,Witkoff Plans Visit to Gaza to See Hunger Crisis,https://www.nytimes.com/2025/07/31/world/middleeast/witkoff-israel-gaza-trump.html
2025-07-31-21-13-54 +0000,latimes,Run for president? Start a podcast? Tackle AI? Kamala Harris' options are wide open,https://www.latimes.com/california/story/2025-07-31/run-for-president-start-a-podcast-take-up-painting-kamala-harris-options-are-wide-open
2025-07-31-21-07-14 +0000,wapo,"More than 1,000 National Guard troops leave Los Angeles, Pentagon says",https://www.washingtonpost.com/nation/2025/07/31/los-angeles-national-guard-troops/
2025-07-31-21-06-59 +0000,nypost,"Mass circumcision ‘initiation ceremony’ kills 39 boys, mutilates dozens in Africa",https://nypost.com/2025/07/31/lifestyle/mass-circumcision-initiation-ceremony-kills-39-boys-mutilates-dozens-in-africa/
2025-07-31-21-04-49 +0000,nypost,Marco Rubio airs frustration about sluggish pace of Russian peace talks: ‘We’ve not seen any progress’,https://nypost.com/2025/07/31/us-news/rubio-frustrated-about-sluggish-pace-of-russian-peace-talks/
2025-07-31-20-58-50 +0000,nyt,Figma’s $20 Billion Sale Died. It Came Back to Go Public.,https://www.nytimes.com/2025/07/31/technology/figma-ipo.html
2025-07-31-20-57-00 +0000,wsj,Coinbase’s Profit Jumps on Crypto Investment Gains,https://www.wsj.com/business/earnings/coinbase-coin-q2-earnings-report-2025-074cfb1e?mod=pls_whats_news_us_business_f
2025-07-31-20-51-13 +0000,nyt,"Canada’s Measles Cases Surpass U.S., Alberta Officials Push for State of Emergency",https://www.nytimes.com/2025/07/30/world/canada/canada-alberta-measles-outbreak.html
2025-07-31-20-51-00 +0000,wsj,"Tariffs, Economic Concerns Drag Down Stocks",https://www.wsj.com/finance/stocks/tariffs-economic-concerns-drag-down-stocks-c28871dc?mod=rss_markets_main
2025-07-31-20-50-00 +0000,wsj,"Ray Dalio Sells Last Stake in Bridgewater, the Hedge Fund That Made Him a Billionaire",https://www.wsj.com/finance/investing/ray-dalio-sells-last-of-his-stake-in-bridgewater-52376c4d?mod=rss_markets_main
2025-07-31-20-47-24 +0000,nypost,"Panama says it could take over ports as it threatens to upend $20B deal with BlackRock, MSC",https://nypost.com/2025/07/31/business/panama-says-state-could-take-over-ports-as-it-threatens-to-upend-20b-deal-with-blackrock-msc/
2025-07-31-20-45-00 +0000,wsj,"President Trump’s popular policy will cut taxes on overtime pay for millions of workers, but the deduction excludes airline and railroad employees, among other groups",https://www.wsj.com/politics/policy/no-tax-overtime-trump-bill-df3a6cf2
2025-07-31-20-35-36 +0000,latimes,"After 'American Idol' exec killing and other recent break-ins, Encino residents demand LAPD action",https://www.latimes.com/california/story/2025-07-31/encino-neighbors-crime
2025-07-31-20-34-08 +0000,bbc,Thousands of police officers line NYC streets to honour slain colleague,https://www.bbc.com/news/videos/cy85y50m5ldo?at_medium=RSS&at_campaign=rss
2025-07-31-20-32-01 +0000,nyt,Dozens Killed in Protests Over Gas Prices in Angola,https://www.nytimes.com/2025/07/31/world/africa/angola-fuel-protests-killed.html
2025-07-31-20-28-00 +0000,wsj,Opinion | A Few Questions for Aspiring Federal Reserve Chiefs,https://www.wsj.com/opinion/a-few-questions-for-aspiring-federal-reserve-chiefs-0b8b969a?mod=rss_markets_main
2025-07-31-20-22-39 +0000,wapo,ICE detains police officer even after DHS system approved him for work,https://www.washingtonpost.com/nation/2025/07/31/ice-dhs-police-officer-arrested/
2025-07-31-20-21-15 +0000,nypost,Trump announces $200M White House ballroom construction starting in September,https://nypost.com/2025/07/31/us-news/construction-on-200-million-white-house-ballroom-to-begin-in-september/
2025-07-31-20-10-09 +0000,wapo,Teacher charged in killing of couple hiking with daughters in Arkansas park,https://www.washingtonpost.com/nation/2025/07/31/arkansas-devils-den-park-killings/
2025-07-31-20-10-04 +0000,nypost,"Megyn Kelly, other MAGA stars are questioning US support for Israel as Gaza war rages: ‘Made itself the villain of the world’",https://nypost.com/2025/07/31/world-news/megyn-kelly-other-maga-stars-are-starting-to-question-us-support-for-israel-over-gaza-war/
2025-07-31-20-09-48 +0000,nyt,Legal Watchdog Files Bar Complaints Against Justice Dept. Lawyers,https://www.nytimes.com/2025/07/31/us/politics/justice-department-lawyers-complaint.html
2025-07-31-20-08-11 +0000,latimes,"Irvine man charged with hate crimes against Latino men, accused of racial slurs and throwing hot coffee",https://www.latimes.com/california/story/2025-07-31/irvine-man-charged-with-hate-crimes-against-hispanic-men-including-throwing-coffee-on-one-and-racial-slurs
2025-07-31-20-06-32 +0000,nyt,Nashville Is a ‘Tough Place to Tunnel.’ Musk Is Digging Anyway.,https://www.nytimes.com/2025/07/31/us/politics/nashville-tunnel-musk.html
2025-07-31-20-03-00 +0000,wsj,New Yorkers Suffer Second Subway Meltdown in a Week,https://www.wsj.com/us-news/nyc-mta-train-delays-interruptions-734ccb0e
2025-07-31-20-00-00 +0000,wsj,"WisdomTree to Buy Ceres Partners, in Expansion Into Private Markets",https://www.wsj.com/finance/investing/wisdomtree-to-buy-ceres-partners-in-expansion-into-private-markets-6b03252f?mod=rss_markets_main
2025-07-31-19-59-44 +0000,wapo,"In move to lift Argentina visa restrictions, Trump rewards Milei’s friendship",https://www.washingtonpost.com/world/2025/07/30/argentina-trump-milei-visa-waiver-program-kristi-noem/
2025-07-31-19-52-29 +0000,startribune,"Mayo breached worker’s religious rights with mandatory COVID shot, federal suit claims",https://www.startribune.com/mayo-breached-workers-religious-rights-with-mandatory-covid-shot-federal-suit-claims/601447203
2025-07-31-19-52-23 +0000,latimes,7 dogs suddenly died and 11 more fell ill in Venice Canals: Neighbors clamor for answers,https://www.latimes.com/california/story/2025-07-31/6-dogs-die-12-fall-ill-venice-canals-mystery
2025-07-31-19-35-19 +0000,nypost,"Trump envoy Steve Witkoff, Mike Huckabee to visit Gaza aid sites as hunger crisis grows",https://nypost.com/2025/07/31/us-news/trump-envoy-steve-witkoff-mike-huckabee-to-visit-gaza-as-hunger-crisis-grows/
2025-07-31-19-32-05 +0000,bbc,US to deny visas to Palestinian officials,https://www.bbc.com/news/articles/c8ryjpjrvddo?at_medium=RSS&at_campaign=rss
2025-07-31-19-31-06 +0000,nyt,"Russian Missile and Drone Attack Pummels Kyiv, Killing at Least 7",https://www.nytimes.com/2025/07/31/world/europe/ukraine-russia-attack-kyiv.html
2025-07-31-19-21-02 +0000,nypost,Uber says over 100 sexual assault accusers submitted fake receipts,https://nypost.com/2025/07/31/business/uber-says-over-100-sexual-assault-accusers-submitted-fake-receipts/
2025-07-31-19-20-34 +0000,nyt,A.I. Researchers Are Negotiating $250 Million Pay Packages. Just Like NBA Stars.,https://www.nytimes.com/2025/07/31/technology/ai-researchers-nba-stars.html
2025-07-31-19-18-00 +0000,wsj,KKR Gets Boost From Asset-Based Lending Push,https://www.wsj.com/articles/kkr-gets-boost-from-asset-based-lending-push-9a5e6341?mod=rss_markets_main
2025-07-31-19-14-46 +0000,cbc,"Trump's EPA wants to reverse course on dangers of GHG emissions, disrupting industries, climate goals",https://www.cbc.ca/news/science/epa-trump-greenhouse-gas-emissions-1.7598717?cmp=rss
2025-07-31-19-12-10 +0000,nyt,Appeals Court Hears Legal Challenge to Trump Tariffs as Trade War Widens,https://www.nytimes.com/2025/07/31/business/trump-tariffs-lawsuit-court-appeal.html
2025-07-31-19-10-18 +0000,latimes,UTA and MediaLink founder end legal fight over acquisition,https://www.latimes.com/entertainment-arts/business/story/2025-07-31/uta-medialink-michael-kassan-drop-lawsuits-merger
2025-07-31-19-05-14 +0000,bbc,"US envoy to visit Gaza, as hospital says dozens killed seeking food",https://www.bbc.com/news/articles/c74d82pdxjzo?at_medium=RSS&at_campaign=rss
2025-07-31-18-58-47 +0000,bbc,Justin Timberlake reveals Lyme disease diagnosis,https://www.bbc.com/news/articles/cy4dpn85318o?at_medium=RSS&at_campaign=rss
2025-07-31-18-58-33 +0000,latimes,"Attempted burglary at home of Dodgers' Yoshinobu Yamamoto, the latest break-in for athletes and celebs",https://www.latimes.com/california/story/2025-07-31/attempted-burglary-at-home-of-dodgers-yoshinobu-yamamoto-the-latest-break-in-for-athletes-and-celebs
2025-07-31-18-56-08 +0000,nypost,Judges bombard Trump admin over president using emergency powers for tariff spree,https://nypost.com/2025/07/31/us-news/judges-skeptical-of-trump-using-emergency-powers-for-tariff-spree/
2025-07-31-18-44-00 +0000,wsj,MPLX to Buy Northwind Midstream for $2.38 Billion,https://www.wsj.com/articles/mplx-to-buy-northwind-midstream-for-2-38-billion-6ebeea38?mod=rss_markets_main
2025-07-31-18-42-53 +0000,nyt,Kavanaugh Defends Supreme Court’s Terse Emergency Orders,https://www.nytimes.com/2025/07/31/us/politics/kavanaugh-supreme-court-emergency.html
2025-07-31-18-32-18 +0000,nypost,"eBay, Etsy warn Trump’s surprise move to end ‘de minimis’ duty-free rule hurts sellers",https://nypost.com/2025/07/31/business/ebay-etsy-warn-trumps-surprise-move-to-end-de-minimis-duty-free-rule-hurts-sellers/
2025-07-31-18-30-11 +0000,nyt,Unnoticed Whistle-Blower Document Alarms Justice Department Veterans,https://www.nytimes.com/2025/07/31/us/politics/emil-bove-whistle-blower.html
2025-07-31-18-26-00 +0000,wsj,Figma Is Largest VC-Backed American Tech Company IPO in Years,https://www.wsj.com/articles/figma-is-largest-vc-backed-american-tech-company-ipo-in-years-a143c9c5?mod=rss_markets_main
2025-07-31-18-24-08 +0000,nyt,"Thailand and Cambodia Reach Trump Trade Deals, U.S. Official Says",https://www.nytimes.com/2025/07/31/business/thailand-cambodia-trump-tariffs.html
2025-07-31-18-20-06 +0000,nypost,"FBI never probed ‘confidential’ talks between DNC, Clinton campaign and George Soros group, bombshell intel files show",https://nypost.com/2025/07/31/us-news/fbi-never-probed-confidential-talks-between-dnc-clinton-campaign-george-soros-group-bombshell-intel-files-show/
