pubdate,source,title,link
2025-07-31-18-14-00 +0000,wsj,American Eagle’s Male-Geared Sydney Sweeney Ads Have Gen Z Women Scratching Their Heads,https://www.wsj.com/articles/american-eagles-male-geared-sydney-sweeney-ads-have-gen-z-women-scratching-their-heads-3c116d82?mod=pls_whats_news_us_business_f
2025-07-31-18-08-53 +0000,nyt,How India Became One of the Biggest Buyers of Russian Oil,https://www.nytimes.com/2025/07/31/business/india-russia-oil-trump.html
2025-07-31-18-07-39 +0000,bbc,Gazan boy first to be treated in UK for war injuries,https://www.bbc.com/news/articles/cvgn6979n59o?at_medium=RSS&at_campaign=rss
2025-07-31-18-02-00 +0000,wsj,"Opinion | Left to Rebuild, Hamas Will",https://www.wsj.com/opinion/left-to-rebuild-hamas-will-382ff85c
2025-07-31-17-57-00 +0000,wsj,"U.S.-Canada Trade Talks Dealing With Aluminum-Tariff Levels, Bessent Says",https://www.wsj.com/economy/trade/u-s-canada-trade-talks-dealing-with-aluminum-tariff-levels-bessent-says-3f8989a7
2025-07-31-17-53-24 +0000,nypost,Google loses appeal in lawsuit filed by ‘Fortnite’ maker Epic Games as app store verdict upheld,https://nypost.com/2025/07/31/business/google-loses-appeal-in-suit-filed-by-fortnite-maker-epic-games-as-app-store-verdict-upheld/
2025-07-31-17-47-40 +0000,nyt,"In Yosemite, Falling Tree Branches Kill a Young Hiker in ‘Freak Accident’",https://www.nytimes.com/2025/07/31/us/yosemite-tuolumne-grove-hiker-killed.html
2025-07-31-17-40-48 +0000,startribune,How St. Paul residents can protect against theft following the city’s cyberattack,https://www.startribune.com/how-st-paul-residents-can-protect-against-theft-following-the-citys-cyberattack/601447167
2025-07-31-17-38-28 +0000,nypost,Robo trucks haul cargo along the dark Texas highways — and can react faster than drivers,https://nypost.com/2025/07/31/business/robo-trucks-take-major-step-forward-for-tech-in-texas/
2025-07-31-17-37-23 +0000,wapo,‘Bienvenidos al infierno’: La mega cárcel donde EE. UU. deportó a migrantes,https://www.washingtonpost.com/world/2025/07/31/venezuelans-deported-us-el-salvador-prison-cecot-2/
2025-07-31-17-33-55 +0000,nypost,Microsoft joins $4T market-cap club after blowout earnings,https://nypost.com/2025/07/31/business/microsoft-joins-4t-market-cap-club-after-blowout-earnings/
2025-07-31-17-31-00 +0000,wsj,Logistics Giant DSV Hits Pause on U.S.-Mexico Investments,https://www.wsj.com/articles/logistics-giant-dsv-hits-pause-on-u-s-mexico-investments-dea40a96?mod=pls_whats_news_us_business_f
2025-07-31-17-27-00 +0000,wsj,Trump’s Tariffs Questioned by Appeals Court,https://www.wsj.com/us-news/law/trumps-tariff-authority-is-tested-in-court-as-deadline-on-trade-deals-looms-09b323f1
2025-07-31-17-25-32 +0000,nyt,"Brazil’s President Lula Speaks On Trump’s 50% Tariff Threat, Bolsonaro’s Trial",https://www.nytimes.com/video/world/americas/100000010309751/in-conversation-with-brazils-president-lula.html
2025-07-31-17-21-53 +0000,latimes,"More than 1,000 National Guard troops leaving L.A. Newsom says Trump's 'political theater backfired'",https://www.latimes.com/california/story/2025-07-31/national-guard-troops-leaving-la
2025-07-31-17-16-49 +0000,nyt,"After Backlash, Ukraine Votes to Restore Watchdogs’ Powers",https://www.nytimes.com/2025/07/31/world/europe/ukraine-corruption-agencies-parliament.html
2025-07-31-17-11-01 +0000,nyt,A Short History of Awkward Gift Giving Between U.S. and U.K. Leaders,https://www.nytimes.com/2025/07/31/world/europe/uk-us-leader-gifts.html
2025-07-31-17-10-53 +0000,nyt,Robbery of U.K. Royal Family’s Items Leads to $4 Million Insurance Payment,https://www.nytimes.com/2025/07/31/arts/design/uk-royal-family-robbery-insurance-payment.html
2025-07-31-17-10-40 +0000,nyt,Virginia Giuffre’s Family Responds to Trump’s Claim That Epstein ‘Stole’ Her,https://www.nytimes.com/2025/07/31/us/politics/virginia-giuffre-family-trump-epstein.html
2025-07-31-17-07-35 +0000,bbc,Passengers urged to check flights after disruption,https://www.bbc.com/news/articles/cd9jn1ydx9lo?at_medium=RSS&at_campaign=rss
2025-07-31-17-06-24 +0000,bbc,Councillor resigns so wife can enter flower show,https://www.bbc.com/news/articles/c07p9jz21v1o?at_medium=RSS&at_campaign=rss
2025-07-31-17-01-29 +0000,nyt,Bad Weather Delays Launch of Astronauts to Space Station,https://www.nytimes.com/2025/07/31/science/nasa-astronauts-spacex.html
2025-07-31-16-59-00 +0000,wsj,Opinion | Trump’s Trade Deals Make America European Again,https://www.wsj.com/opinion/trumps-trade-deals-make-america-european-again-5b0675f2?mod=rss_markets_main
2025-07-31-16-58-48 +0000,bbc,Barcelona agree shirt sponsorship deal with war-torn DR Congo,https://www.bbc.com/news/articles/ckgyzn61krko?at_medium=RSS&at_campaign=rss
2025-07-31-16-55-36 +0000,nypost,JPMorgan CEO Jamie Dimon’s icy relationship with Trump thaws with reported visits to White House,https://nypost.com/2025/07/31/business/jpmorgan-ceo-jamie-dimons-icy-relationship-with-trump-thaws-with-reported-visits-to-white-house/
2025-07-31-16-54-14 +0000,nypost,US toy makers are getting slammed by China tariffs — and have dire warnings if the mess isn’t fixed soon,https://nypost.com/2025/07/31/business/us-toy-makers-are-getting-slammed-by-china-tariffs-and-have-dire-warnings-if-the-mess-isnt-fixed-soon/
2025-07-31-16-49-04 +0000,wapo,"16 dead in Kyiv, including 6-year-old, after overnight Russian strikes",https://www.washingtonpost.com/world/2025/07/31/ukraine-kyiv-russian-drone-missile-children-killed/
2025-07-31-16-49-01 +0000,nyt,South Korea Reaches Trade Deal With Trump,https://www.nytimes.com/2025/07/30/business/economy/trump-tariffs-south-korea.html
2025-07-31-16-42-21 +0000,nyt,Lithuania’s Prime Minister Steps Down,https://www.nytimes.com/2025/07/31/world/europe/lithuania-prime-minister-steps-down.html
2025-07-31-16-38-51 +0000,latimes,"After multiple foreshocks, a 4.3 quake near Rialto rattles Southern California",https://www.latimes.com/california/story/2025-07-31/earthquake-4-5-quake-felt-in-rialto-calif
2025-07-31-16-38-10 +0000,wapo,Ukraine adopts new anti-corruption law as protests force Zelensky to retreat,https://www.washingtonpost.com/world/2025/07/31/ukraine-anticorruption-law-zelensky-protests/
2025-07-31-16-35-49 +0000,nyt,Trump Announces Health Care Records System for Consumers,https://www.nytimes.com/2025/07/30/us/politics/trump-health-records-system.html
2025-07-31-16-29-39 +0000,bbc,"Small boats crossings hit 25,000 for the year",https://www.bbc.com/news/articles/c74wkzpz717o?at_medium=RSS&at_campaign=rss
2025-07-31-16-29-38 +0000,latimes,New Trump tariffs on Mexico delayed 90 days as trade talks continue,https://www.latimes.com/world-nation/story/2025-07-31/tariffs-on-mexico-delayed-90-days
2025-07-31-16-25-00 +0000,wsj,What’s Ahead for Food,https://www.wsj.com/business/retail/whats-ahead-for-food-60ebcf8e?mod=pls_whats_news_us_business_f
2025-07-31-16-22-47 +0000,nyt,Murky Pledges of Investment Cast Shadow on Trump’s Trade Deals,https://www.nytimes.com/2025/07/31/business/trump-japan-south-korea-investment.html
2025-07-31-16-15-46 +0000,bbc,"EU-US tariff deal not finished yet, say Europeans unhappy with Trump's terms",https://www.bbc.com/news/articles/cvgp5q4x4nzo?at_medium=RSS&at_campaign=rss
2025-07-31-16-12-01 +0000,nyt,"Key Inflation Measure Rose in June, Adding to Pressure on Fed",https://www.nytimes.com/2025/07/31/business/pce-inflation-fed.html
2025-07-31-16-09-59 +0000,nyt,The U.S. imposed visa bans on Palestinian officials.,https://www.nytimes.com/live/2025/07/31/us/trump-news/palestinian-visa-bans
2025-07-31-16-09-52 +0000,nyt,Major Study on Transgender Youth Health Care to Begin in U.K.,https://www.nytimes.com/2025/07/31/world/europe/transgender-children-health-study-uk-nhs.html
2025-07-31-16-05-26 +0000,nyt,China Summons Nvidia Over ‘Backdoor Security’ Risks of A.I. Chips,https://www.nytimes.com/2025/07/31/business/china-nvidia-h20-chips.html
2025-07-31-16-04-53 +0000,nyt,White House Urges ‘Pro-Innovation Mindset’ to Crypto In New Report,https://www.nytimes.com/2025/07/30/technology/white-house-crypto.html
2025-07-31-16-00-14 +0000,wapo,"The Fed’s preferred measure of inflation is running hot, buoyed by tariffs",https://www.washingtonpost.com/business/2025/07/31/inflation-hotter-powell-fed-trump/
2025-07-31-15-58-50 +0000,nyt,Trump Taps Climate Skeptics to Attack Science on Global Warming,https://www.nytimes.com/2025/07/31/climate/trump-climate-skeptics-science-report.html
2025-07-31-15-53-57 +0000,bbc,Virginia Giuffre's family asks Trump not to pardon Maxwell,https://www.bbc.com/news/articles/cvg40gj07k2o?at_medium=RSS&at_campaign=rss
2025-07-31-15-53-26 +0000,nyt,Aftershocks From 8.8-Magnitude Quake Rattle North Pacific,https://www.nytimes.com/2025/07/31/world/asia/aftershocks-russia-earthquake.html
2025-07-31-15-51-03 +0000,nyt,"More Than 150,000 Federal Workers Accepted Trump’s Resignation Incentives",https://www.nytimes.com/2025/07/31/us/politics/firings-federal-workers-trump-administration.html
2025-07-31-15-44-00 +0000,cbc,Canadian aid part of Gaza airdrop after Israel loosens restrictions,https://www.cbc.ca/news/politics/canadian-aid-gaza-1.7598476?cmp=rss
2025-07-31-15-43-00 +0000,wsj,Someone has to pay the skyrocketing tariffs the U.S. is collecting on imports—and companies say some of the burden will fall on consumers,https://www.wsj.com/economy/trade/trump-tariff-main-street-business-impact-866cc403
2025-07-31-15-42-55 +0000,nypost,"Fox acquires 33% stake in IndyCar owner Penske Entertainment, extends media rights deal",https://nypost.com/2025/07/31/media/fox-acquires-33-stake-in-indycar-owner-penske-entertainment/
2025-07-31-15-32-28 +0000,nyt,A New Border Wall in Arizona Would Block a Key Wildlife Corridor,https://www.nytimes.com/2025/07/31/climate/arizona-border-wall-wildlife-migration-jaguars.html
2025-07-31-15-31-50 +0000,nyt,Modi’s ‘True Friend’ Trump Deals India a Big Blow With Tariff Threats,https://www.nytimes.com/2025/07/31/world/asia/modi-trump-india-tariffs.html
2025-07-31-15-31-00 +0000,wsj,President Trump’s tighter deadline for Russia to reach peace with Ukraine and his threat against Russia’s energy customers contrast with a lighter approach to Russia elsewhere,https://www.wsj.com/politics/policy/trumps-russia-sanctions-strategy-runs-hot-and-cold-ed2527c1
2025-07-31-15-25-46 +0000,bbc,Why did the air traffic control outage cause so much havoc?,https://www.bbc.com/news/articles/clyv75g60ejo?at_medium=RSS&at_campaign=rss
2025-07-31-15-24-42 +0000,nypost,"US and Mexico agree to 90-day extension ahead of tariff deadline, Trump says",https://nypost.com/2025/07/31/us-news/us-and-mexico-agree-to-90-day-extension-ahead-of-tariff-deadline-trump-says/
2025-07-31-15-24-06 +0000,bbc,Big firms could be fined for paying suppliers late,https://www.bbc.com/news/articles/c4gq204x4v2o?at_medium=RSS&at_campaign=rss
2025-07-31-15-20-26 +0000,latimes,Navy F-35 jet crashes outside California air base after pilot safely ejects,https://www.latimes.com/california/story/2025-07-31/f35-crash-air-station-lemorre
2025-07-31-15-13-21 +0000,nyt,"On Canada’s Top Stage, Macbeth and Annie Are Talking to Americans",https://www.nytimes.com/2025/07/31/theater/canada-stratford-theater-festival.html
2025-07-31-15-09-05 +0000,nyt,What’s a Potato? A Nine-Million-Year-Old Tomato,https://www.nytimes.com/2025/07/31/science/evolution-agriculture-tomatoes-potatoes.html
2025-07-31-15-08-49 +0000,nyt,The California Governor’s Race Was in Limbo. Now It’s Wide Open.,https://www.nytimes.com/2025/07/31/us/harris-california-governors-race.html
2025-07-31-15-08-12 +0000,nyt,Nvidia Chips Are Front and Center in China at Crucial Moment in the A.I. Race,https://www.nytimes.com/2025/07/31/technology/china-ai-nvidia-chips.html
2025-07-31-14-58-24 +0000,bbc,Relative of hostage responds to declarations of Palestinian statehood,https://www.bbc.com/news/videos/c8jp9emk029o?at_medium=RSS&at_campaign=rss
2025-07-31-14-56-26 +0000,nyt,U.S. Hits Brazil With 50% Tariffs and Sanctions in Sharp Escalation,https://www.nytimes.com/2025/07/30/world/americas/trump-sanctions-brazil-judge-bolsonaro.html
2025-07-31-14-52-54 +0000,nypost,Nancy Pelosi blows up at Jake Tapper over insider trading allegations,https://nypost.com/2025/07/31/us-news/nancy-pelosi-blows-up-at-jake-tapper-over-insider-trading-allegations/
2025-07-31-14-45-09 +0000,bbc,Hotel tycoon reveals Heathrow expansion proposal,https://www.bbc.com/news/articles/cd6nvzjvwgqo?at_medium=RSS&at_campaign=rss
2025-07-31-14-40-08 +0000,nypost,Australian airline wins approval to carry pets on flights — behind all the cuddly details,https://nypost.com/2025/07/31/lifestyle/virgin-australia-wins-approval-to-carry-pets-on-flights/
2025-07-31-14-38-00 +0000,wsj,"EU Expects Spirits, Wine to Be Hit With 15% U.S. Tariff",https://www.wsj.com/world/europe/eu-expects-spirits-wine-to-be-hit-with-15-u-s-tariff-acec2c85
2025-07-31-14-21-51 +0000,nypost,Kamala Harris says she’s writing a book about ‘the shortest presidential campaign in modern history’,https://nypost.com/2025/07/31/us-news/unemployed-kamala-harris-says-shes-writing-a-book-about-the-shortest-presidential-campaign-in-modern-history/
2025-07-31-14-16-00 +0000,wsj,Why Microsoft and Meta Are Soaring After Earnings,https://www.wsj.com/tech/ai/meta-ai-spending-budget-zuckerberg-c3dae6aa?mod=rss_markets_main
2025-07-31-14-15-09 +0000,nypost,Read the documents that prove Hillary Clinton OK’d plan to ‘smear’ Trump with Russia collusion,https://nypost.com/2025/07/31/us-news/hillary-clinton-approved-plan-hatched-by-campaign-aides-to-smear-trump-with-russia-collusion-declassified-docs/
2025-07-31-14-15-00 +0000,wsj,"A Media Giant Leans on People, a 50-Year-Old Brand, to Confront the AI Age",https://www.wsj.com/business/media/dotdash-meredith-people-inc-4259f9d7?mod=pls_whats_news_us_business_f
2025-07-31-14-01-26 +0000,bbc,Minister says lawyers missing the point on Palestinian recognition,https://www.bbc.com/news/articles/c78z69x61e6o?at_medium=RSS&at_campaign=rss
2025-07-31-14-01-19 +0000,nypost,Fed’s preferred inflation gauge ticks up as tariffs lift prices — casting cloud on September rate cut,https://nypost.com/2025/07/31/business/feds-preferred-inflation-gauge-ticks-up-as-tariffs-lift-prices-casting-cloud-on-september-rate-cut/
2025-07-31-14-00-33 +0000,bbc,Cost of living plan renewed for another year,https://www.bbc.com/news/articles/czr63nrmlrko?at_medium=RSS&at_campaign=rss
2025-07-31-13-58-00 +0000,wsj,South Africa’s central bank cut its main repo rate by a quarter percentage point as inflation remains low in the midst of continuing global uncertainty,https://www.wsj.com/articles/south-african-reserve-bank-cuts-main-repo-rate-to-7-8445ab28
2025-07-31-13-52-00 +0000,wsj,"Comcast Posts Revenue Growth, With Theme Park and Xfinity Mobile Gains",https://www.wsj.com/business/earnings/comcast-cmcsa-q2-earnings-report-2025-stock-627db08e?mod=pls_whats_news_us_business_f
2025-07-31-13-51-46 +0000,bbc,Senior Tories turn out for Norman Tebbit's funeral,https://www.bbc.com/news/articles/cvgnmev44vgo?at_medium=RSS&at_campaign=rss
2025-07-31-13-38-52 +0000,bbc,US dentist jailed for murder after poisoning wife's protein shakes,https://www.bbc.com/news/articles/cdj2gy317ngo?at_medium=RSS&at_campaign=rss
2025-07-31-13-18-18 +0000,nyt,"Trump Tells Russian Official to ‘Watch His Words,’ but He Bites Back Instead",https://www.nytimes.com/2025/07/31/world/europe/trump-medvedev-russia.html
2025-07-31-13-15-00 +0000,wsj,Opinion | Job Openings Declining at Small Firms,https://www.wsj.com/opinion/job-openings-declining-at-small-firms-a69be335?mod=pls_whats_news_us_business_f
2025-07-31-13-13-17 +0000,bbc,'Like a sci-fi movie': US baby born from 30-year-old frozen embryo breaks record,https://www.bbc.com/news/articles/c3wne86ex9qo?at_medium=RSS&at_campaign=rss
2025-07-31-13-09-34 +0000,nyt,Ancient Gems Linked to Buddha Are Returned to India,https://www.nytimes.com/2025/07/31/arts/buddha-jewels-piprahwa-india-return.html
2025-07-31-13-05-05 +0000,bbc,Swedish jihadist jailed for life over IS murder of Jordanian pilot in Syria,https://www.bbc.com/news/articles/czd04nn7q75o?at_medium=RSS&at_campaign=rss
2025-07-31-13-00-05 +0000,nyt,Bess Wohl’s ‘Liberation’ Is Heading to Broadway This Fall,https://www.nytimes.com/2025/07/31/theater/bess-wohl-liberation-broadway.html
2025-07-31-13-00-00 +0000,wsj,Fox Takes Stake in IndyCar Owner Penske Entertainment,https://www.wsj.com/business/media/fox-takes-stake-in-indycar-owner-penske-entertainment-c6087402?mod=pls_whats_news_us_business_f
2025-07-31-12-52-30 +0000,cbc,"Canada's economy contracted by 0.1% in May, but showed signs of a rebound",https://www.cbc.ca/news/business/may-gdp-1.7598287?cmp=rss
2025-07-31-12-52-05 +0000,nyt,"Amid Scramble for Food, Prices in Gaza Reach Extraordinary Heights",https://www.nytimes.com/2025/07/31/world/middleeast/gaza-market-prices-flour.html
2025-07-31-12-47-52 +0000,cbc,"Turbulence injures 25 passengers on Delta flight, forces plane to land",https://www.cbc.ca/news/world/turbulence-delta-injuries-1.7598288?cmp=rss
2025-07-31-12-44-09 +0000,nypost,Trump insists Hamas surrender will end Gaza humanitarian crisis: ‘RELEASE THE HOSTAGES!’,https://nypost.com/2025/07/31/world-news/trump-urges-hamas-to-surrender-to-end-gaza-humanitarian-crisis/
2025-07-31-12-00-00 +0000,wsj,"Buffalo Can Be Hard to Love. For These Former Residents, It Was Harder to Stay Away.",https://www.wsj.com/real-estate/buffalo-can-be-hard-to-love-for-these-former-residents-it-was-harder-to-stay-away-49f58b3b
2025-07-31-11-56-52 +0000,nyt,Meta and Microsoft Investors Cheer an A.I. Spending Bonanza,https://www.nytimes.com/2025/07/31/business/dealbook/meta-microsoft-ai-spending-shares.html
2025-07-31-11-53-57 +0000,nyt,Trump’s Fight With the Fed Won’t End With Rate Cuts,https://www.nytimes.com/2025/07/31/business/trump-fed-interest-rate-cuts.html
2025-07-31-11-53-36 +0000,nyt,Anger Over Starvation in Gaza Leaves Israel Increasingly Isolated,https://www.nytimes.com/2025/07/31/world/middleeast/gaza-starvation-aid-israel-netanyahu.html
2025-07-31-11-52-11 +0000,nyt,Delta Pilot Arrested in Cockpit Faces 24 Felonies in Child Sex Case,https://www.nytimes.com/2025/07/30/us/delta-pilot-child-sex-abuse-charges.html
2025-07-31-11-30-00 +0000,cbc,Can the UK child-proof the internet?,https://www.cbc.ca/radio/frontburner/can-the-uk-child-proof-the-internet-1.7597758?cmp=rss
2025-07-31-11-23-48 +0000,bbc,More migrant arrivals expected at ex-RAF station,https://www.bbc.com/news/articles/c890xxll4pjo?at_medium=RSS&at_campaign=rss
2025-07-31-11-23-40 +0000,wapo,‘Welcome to hell’: Inside the megaprison where the U.S. deported migrants,https://www.washingtonpost.com/world/2025/07/31/venezuelans-deported-us-el-salvador-prison-cecot/
2025-07-31-11-23-04 +0000,bbc,More than 30 killed in nursing home hit by Beijing floods,https://www.bbc.com/news/articles/c8e1wd7l811o?at_medium=RSS&at_campaign=rss
2025-07-31-11-00-01 +0000,startribune,What languages are most spoken in Minnesota homes?,https://www.startribune.com/top-languages-spoken-at-home-in-minnesota-spanish-hmong-somali/601368610
2025-07-31-10-58-50 +0000,bbc,Watch: Huge stick insect discovered in Australia,https://www.bbc.com/news/videos/cy98ql1v8wdo?at_medium=RSS&at_campaign=rss
