pubdate,source,title,link
2026-01-11-13-06-14 +0000,nyt,How a Puzzling 401(k) Plan Changed One Woman’s Life,https://www.nytimes.com/2026/01/11/business/401k-heb-eryn-schultz-personal-finances.html
2026-01-11-13-00-00 +0000,nypost,"After Marine vet Trevor Reed was freed from a Russian prison, he sought revenge by fighting for Ukraine",https://nypost.com/2026/01/11/world-news/marine-vet-was-freed-from-russian-prison-fought-for-ukraine/
2026-01-11-13-00-00 +0000,wapo,"With young adults less likely to go to the dentist, doctors get creative",https://www.washingtonpost.com/nation/2026/01/11/dentists-gen-z-skipping-dental-care/
2026-01-11-12-20-57 +0000,bbc,Potholes map rates council road repair progress,https://www.bbc.com/news/articles/ckgj1m1ze8go?at_medium=RSS&at_campaign=rss
2026-01-11-12-00-00 +0000,missionlocal,"Abuelitas de la Misión: María Alicia Catalán, a poet who’s lived in the Mission 55 years",https://missionlocal.org/2026/01/abuelitas-de-la-mision-maria-alicia-catalan-a-poet-whos-lived-in-the-mission-55-years/
2026-01-11-12-00-00 +0000,startribune,Twin Cities suburb fights over personal freedom — to choose a trash hauler,https://www.startribune.com/anoka-reconsiders-organized-garbage-collection/601558851
2026-01-11-11-47-09 +0000,bbc,"Epstein kept me 'separate' from his sexual side because I'm gay, Mandelson tells BBC",https://www.bbc.com/news/articles/cd9el4dw0z3o?at_medium=RSS&at_campaign=rss
2026-01-11-11-00-13 +0000,nyt,"How Mississippi Schools, Like Hazlehurst Elementary, Transformed itself From Worst to Best",https://www.nytimes.com/2026/01/11/us/mississippi-schools-transformation.html
2026-01-11-11-00-00 +0000,latimes,"While celebrating Maduro's capture, Venezuelan immigrants worry about deportation",https://www.latimes.com/politics/story/2026-01-11/while-celebrating-maduros-capture-venezuelan-immigrants-worry-about-deportation
2026-01-11-11-00-00 +0000,latimes,"Deadly ICE shooting in Minnesota, affordability stir up California gubernatorial forums",https://www.latimes.com/california/story/2026-01-11/gubernatorial-candidates-address-immigration-affordability-homelessness
2026-01-11-11-00-00 +0000,latimes,Arellano: Citizens are finally getting it: No one's safe from Trump's deportation ambitions,https://www.latimes.com/california/story/2026-01-11/citizens-arent-safe-from-ice-border-patrol
2026-01-11-11-00-00 +0000,latimes,Why California is keeping this unusual solar plant running when both Trump and Biden wanted it closed,https://www.latimes.com/environment/story/2026-01-11/trump-biden-both-want-this-california-solar-facility-to-close-state-has-other-plans
2026-01-11-11-00-00 +0000,latimes,The rise and fall of the Sprinkles empire that made cupcakes cool,https://www.latimes.com/business/story/2026-01-11/rise-fall-of-sprinkles-empire-that-made-cupcakes-cool
2026-01-11-11-00-00 +0000,latimes,Barabak: Trump can be hard to take. But his tariffs keep this fisherman afloat,https://www.latimes.com/politics/story/2026-01-11/trumps-america-louisiana-shrimp-fisherman-prospers-tariffs
2026-01-11-11-00-00 +0000,startribune,UCare CEO salary topped $1M as the health insurer foundered,https://www.startribune.com/ucare-ceo-salary-topped-1m-as-the-health-insurer-foundered/601548209
2026-01-11-11-00-00 +0000,startribune,Roper: ICE tactics threaten to unravel trust with local law enforcement,https://www.startribune.com/ice-mpd-law-enforcement-minnesota/601560440
2026-01-11-11-00-00 +0000,startribune,The ‘Bob Ross of the bike industry’ retires from YouTube,https://www.startribune.com/the-bob-ross-of-the-bike-industry-retires-from-youtube/601559113
2026-01-11-11-00-00 +0000,latimes,"Trump's first-year actions sparked a fiery legal war, and stunning rebukes from judges",https://www.latimes.com/politics/story/2026-01-11/trumps-first-year-actions-sparked-fiery-legal-war-stunning-rebukes-from-judges
2026-01-11-10-30-00 +0000,wsj,Meet the 92-Year-Old Judge Presiding Over the Trial of Venezuela’s Nicolás Maduro,https://www.wsj.com/us-news/law/alvin-hellerstein-maduro-judge-946f846e
2026-01-11-10-30-00 +0000,wsj,How Insurance Led Two L.A. Communities to Take Different Paths After the Fires,https://www.wsj.com/us-news/how-insurance-led-two-l-a-communities-to-take-different-paths-after-the-fires-d699ef3a
2026-01-11-10-30-00 +0000,wsj,The Dream of a Florida Retirement Is Fading for the Middle Class,https://www.wsj.com/real-estate/luxury-homes/the-dream-of-a-florida-retirement-is-fading-for-the-middle-class-a29a5687
2026-01-11-10-30-00 +0000,wsj,AI Is Causing a Memory Shortage. Why Producers Aren’t Rushing to Make a Lot More.,https://www.wsj.com/tech/ai-is-causing-a-memory-shortage-why-producers-arent-rushing-to-make-a-lot-more-8dd15194?mod=pls_whats_news_us_business_f
2026-01-11-10-30-00 +0000,wsj,It’s a Weird Time to Be a Democrat in Silicon Valley,https://www.wsj.com/politics/policy/its-a-weird-time-to-be-a-democrat-in-silicon-valley-7c4d9f84?mod=pls_whats_news_us_business_f
2026-01-11-10-30-00 +0000,wsj,"Silicon Valley has long been something of an ATM for Democrats, yet a fracturing of the once-hot romance has threatened that, writes the WSJ’s Tim Higgins",https://www.wsj.com/politics/policy/its-a-weird-time-to-be-a-democrat-in-silicon-valley-7c4d9f84
2026-01-11-10-16-31 +0000,nyt,Trump Shakes up Latin American Politics,https://www.nytimes.com/2026/01/11/world/americas/trump-latin-america-politics.html
2026-01-11-10-02-09 +0000,nyt,Are You Fat Enough to Play in This Soccer League?,https://www.nytimes.com/2026/01/11/us/dallas-fat-soccer.html
2026-01-11-10-01-59 +0000,nyt,Trump Threats and Venezuela Strike Leave Mexico Agonizing Over How to Respond,https://www.nytimes.com/2026/01/11/world/americas/mexico-trump-cartels.html
2026-01-11-10-01-49 +0000,nyt,Latin America Reacts to Trump’s Interventionism,https://www.nytimes.com/video/world/100000010629368/latin-america-reacts-to-trumps-interventionism.html
2026-01-11-10-00-37 +0000,wapo,Two congressmen watched an ICE shooting video. Only one is sure of what he saw.,https://www.washingtonpost.com/politics/2026/01/11/ice-shooting-renee-good-reactions/
2026-01-11-10-00-36 +0000,nyt,Schools in Occupied Ukraine Aim to Turn Children Into Russian Nationalists,https://www.nytimes.com/2026/01/11/world/europe/occupied-ukraine-russia-schools-indoctrination.html
2026-01-11-10-00-26 +0000,nyt,Trump Wants Greenland — but He’s Not Alone in the Arctic Tug of War,https://www.nytimes.com/2026/01/11/world/europe/svalbard-norway-arctic-control.html
2026-01-11-10-00-18 +0000,nyt,Trump’s ‘Superstar’ Appellate Judges Have Voted 133 to 12 in His Favor,https://www.nytimes.com/2026/01/11/us/politics/trumps-appeals-court-judges.html
2026-01-11-10-00-00 +0000,wapo,This new crash test dummy could keep women safer in car accidents,https://www.washingtonpost.com/transportation/2026/01/11/female-crash-test-dummy/
2026-01-11-10-00-00 +0000,wsj,President Trump’s proposals for the housing market aim to give buyers more purchasing power but don’t address the shortage at the root of the affordability crisis,https://www.wsj.com/economy/housing/trumps-new-housing-strategy-is-all-about-boosting-buyers-now-f6a3f6a6
2026-01-11-09-20-05 +0000,nyt,"Australia Wildfires Burn Nearly 900,000 Acres",https://www.nytimes.com/2026/01/11/world/australia/australia-victoria-wildfires.html
2026-01-11-09-00-00 +0000,cbc,The apprenticeship of Prince George,https://www.cbc.ca/news/world/prince-george-camilla-royal-year-ahead-princess-anne-patronage-9.7039777?cmp=rss
2026-01-11-09-00-00 +0000,cbc,The NDP leadership race is a nail-biter. But is anyone paying attention?,https://www.cbc.ca/news/politics/ndp-leadership-race-front-runners-9.7040374?cmp=rss
2026-01-11-09-00-00 +0000,cbc,Carney wants to 'recalibrate' Canada-China relations with visit: PM's parliamentary aide,https://www.cbc.ca/news/politics/carney-canada-china-trip-canola-tariffs-9.7041086?cmp=rss
2026-01-11-08-42-38 +0000,nypost,Bride and groom among 8 killed in gas cylinder blast at wedding in Pakistan’s capital,https://nypost.com/2026/01/11/world-news/bride-and-groom-among-8-killed-in-gas-cylinder-blast-at-wedding-in-pakistans-capital/
2026-01-11-07-58-10 +0000,nypost,Nobel Institute shuts down talk of Venezuelan opposition leader sharing Peace Prize with Trump,https://nypost.com/2026/01/11/world-news/nobel-institute-shuts-down-talk-of-venezuelas-maria-corina-machado-giving-nobel-peace-prize-to-trump/
2026-01-11-07-53-49 +0000,bbc,Winners and Sinners: What to expect from the Golden Globes,https://www.bbc.com/news/articles/c338d55p0k6o?at_medium=RSS&at_campaign=rss
2026-01-11-07-27-11 +0000,nypost,Iran warns US troops and Israel will be targets if America strikes over protests as death toll rises to 500,https://nypost.com/2026/01/11/world-news/iran-warns-us-troops-and-israel-will-be-targets-if-america-strikes-over-protests-as-death-toll-rises/
2026-01-11-05-02-55 +0000,wapo,Trump officials consider military options as Iranian protests spread,https://www.washingtonpost.com/world/2026/01/10/iran-protests-khamenei-tehran-mashhad/
2026-01-11-04-52-33 +0000,bbc,Last Kurdish forces leave Aleppo after ceasefire deal reached,https://www.bbc.com/news/articles/cx2p84xleg2o?at_medium=RSS&at_campaign=rss
2026-01-11-04-00-00 +0000,wsj,North Korea Is Obsessed With World Domination—in Girls Soccer,https://www.wsj.com/world/asia/north-korea-kim-jong-un-girls-soccer-1e7b00c4
2026-01-11-03-57-21 +0000,nyt,Trump Is Briefed on Options for Striking Iran as Protests Continue,https://www.nytimes.com/2026/01/10/us/politics/trump-iran-strikes.html
2026-01-11-03-35-47 +0000,nypost,Paramount Skydance now playing the waiting game to upend Netflix’s bid for Warner Bros. Discovery: sources,https://nypost.com/2026/01/10/business/paramount-skydance-playing-the-waiting-game-to-upend-netflixs-bid-for-warner-bros-discovery-sources/
2026-01-11-03-13-45 +0000,missionlocal,‘We’re here to create something positive’: Pop-up at 16th St. BART seeks to activate plaza,https://missionlocal.org/2026/01/were-here-to-create-something-positive-pop-up-at-16th-street-bart-seeks-to-activate-the-plazas/
2026-01-11-03-00-10 +0000,bbc,"Bob Weir, Grateful Dead co-founder, dies aged 78",https://www.bbc.com/news/articles/cly95x9qe4ko?at_medium=RSS&at_campaign=rss
2026-01-11-03-00-00 +0000,wsj,Inside Ukraine’s Quest to Build a Missile to Strike Deep in Russian Territory,https://www.wsj.com/world/inside-ukraines-quest-to-build-a-missile-to-strike-deep-in-russian-territory-c267df7a
2026-01-11-02-57-02 +0000,cbc,"U.S. attack in Venezuela creates risk, opportunity for guerrilla groups",https://www.cbc.ca/news/world/guerilla-venezuela-colombia-9.7041252?cmp=rss
2026-01-11-02-54-00 +0000,wsj,"Iran Toughens Crackdown, as U.S. Sketches Out Military Options",https://www.wsj.com/world/middle-east/iran-toughens-crackdown-as-death-toll-grows-a2200bda
2026-01-11-02-21-11 +0000,bbc,The FTSE 100 has hit a record high. Is now the time to start investing?,https://www.bbc.com/news/articles/cy0958w1y1go?at_medium=RSS&at_campaign=rss
2026-01-11-02-18-18 +0000,nyt,Judge Pauses Trump Policy Ending Family Reunification for Some Migrants,https://www.nytimes.com/2026/01/10/us/family-reunification-judge.html
2026-01-11-02-00-00 +0000,wsj,Hedge Funds Get Ready for the ‘Donroe Doctrine’ Trade,https://www.wsj.com/finance/investing/hedge-funds-get-ready-for-the-donroe-doctrine-trade-522fdac2
2026-01-11-02-00-00 +0000,wsj,Trump’s Oil Grab Is a Big Problem for the OPEC Cartel,https://www.wsj.com/business/energy-oil/trumps-oil-grab-is-a-big-problem-for-the-opec-cartel-5012013d?mod=pls_whats_news_us_business_f
2026-01-11-02-00-00 +0000,wsj,"A Con Artist, a Music-Industry Legend and the Feud Over a Masterpiece",https://www.wsj.com/arts-culture/fine-art/con-artist-art-fraud-courbet-doyle-landau-49cd3fcd?mod=pls_whats_news_us_business_f
2026-01-11-01-58-29 +0000,bbc,'I had no electricity for six months': US families struggle with soaring energy prices,https://www.bbc.com/news/articles/c1dz0dz0zkvo?at_medium=RSS&at_campaign=rss
2026-01-11-01-50-00 +0000,bbc,"US military strikes Islamic State group targets in Syria, officials say",https://www.bbc.com/news/articles/cly9597r4qpo?at_medium=RSS&at_campaign=rss
2026-01-11-01-26-18 +0000,bbc,The real impact of roadworks on the country - and why they're set to get worse,https://www.bbc.com/news/articles/c23e3d1r17go?at_medium=RSS&at_campaign=rss
2026-01-11-01-25-00 +0000,wsj,Inside Minneapolis’s Sprawling Network of ICE Watchers,https://www.wsj.com/us-news/inside-minneapoliss-sprawling-network-of-ice-watchers-2c286b6d
2026-01-11-01-22-31 +0000,nyt,Venezuela’s New Leader Enlists U.S. Troops to Bring a Rogue Ship Back,https://www.nytimes.com/2026/01/10/world/americas/venezuela-oil-tanker-us.html
