pubdate,source,title,link
2026-01-12-01-10-59 +0000,nypost,Federal Reserve Chair Jerome Powell under investigation over headquarters renovation: report,https://nypost.com/2026/01/11/business/federal-reserve-chair-jerome-powell-under-investigation-over-headquarters-renovation-report/
2026-01-12-01-06-20 +0000,wapo,Justice Department opens a criminal investigation of Fed chair,https://www.washingtonpost.com/business/2026/01/11/jerome-powell-criminal-investigation/
2026-01-12-01-06-06 +0000,nypost,Teen allegedly set home on fire as family of 4 slept inside in plot to kill friend: cops,https://nypost.com/2026/01/11/us-news/teen-allegedly-set-home-on-fire-as-family-of-4-slept-inside-in-plot-to-kill-friend-cops/
2026-01-12-01-00-32 +0000,nyt,Federal Prosecutors Are Said to Have Opened Inquiry Into Fed Chair Powell,https://www.nytimes.com/2026/01/11/us/politics/jerome-powell-fed-inquiry-trump.html
2026-01-12-01-00-00 +0000,wsj,Asian Currencies Mixed; Fading Fed Rate-Cut Prospects May Weigh,https://www.wsj.com/finance/currencies/asian-currencies-mixed-fading-fed-rate-cut-prospects-may-weigh-98a58f2c?mod=rss_markets_main
2026-01-12-00-54-42 +0000,startribune,"Gophers women’s basketball beats No. 21 USC, ends 36-game slide against ranked opponents",https://www.startribune.com/gophers-womens-basketball-beats-no-21-usc-ends-36-game-slide-against-ranked-opponents/601549992
2026-01-12-00-51-55 +0000,nyt,"As Death Toll Surges in Iran, Leaders Take Tough Line Against Protesters",https://www.nytimes.com/2026/01/11/world/middleeast/iran-president-protests-economy-response.html
2026-01-12-00-49-27 +0000,nyt,Trump Says Civil Rights Led to White People Being ‘Very Badly Treated’,https://www.nytimes.com/2026/01/11/us/politics/trump-interview-white-people-discrimination.html
2026-01-12-00-45-34 +0000,bbc,"Meta blocks 550,000 accounts under Australia's social media ban",https://www.bbc.com/news/articles/cpqye2yygl4o?at_medium=RSS&at_campaign=rss
2026-01-12-00-40-09 +0000,nyt,Allegiant to Buy Sun Country Airlines in $1.5 Billion Deal,https://www.nytimes.com/2026/01/11/business/allegiant-sun-country-airlines.html
2026-01-12-00-38-44 +0000,bbc,"Himalayas bare and rocky after reduced winter snowfall, scientists warn",https://www.bbc.com/news/articles/clyndv7zd20o?at_medium=RSS&at_campaign=rss
2026-01-12-00-36-13 +0000,nyt,Why Are Iranians Protesting? What to Know About the Unrest.,https://www.nytimes.com/article/iran-protests-inflation-currency.html
2026-01-12-00-36-02 +0000,latimes,U-Haul truck hits protesters during demonstration in Westwood against Iran government,https://www.latimes.com/california/story/2026-01-11/la-me-uhaul-westwood-protest
2026-01-12-00-35-12 +0000,nypost,US Energy secretary has challenge for American companies to revamp Venezuelan oil industry,https://nypost.com/2026/01/11/world-news/us-energy-secretary-has-challenge-for-american-companies-to-revamp-venezuelan-oil-industry/
2026-01-12-00-30-00 +0000,wsj,The Fed received grand jury subpoenas from the Justice Department on Friday that threaten a criminal indictment relating to Chair Powell’s testimony last summer about the central bank’s building renovation project,https://www.wsj.com/economy/central-banking/federal-reserve-received-justice-department-subpoena-threatening-criminal-indictment-e9e3f84d
2026-01-12-00-28-44 +0000,nyt,‘I Think We Don’t Like Them’: Trump Says MAGA Has No Room for Antisemites,https://www.nytimes.com/2026/01/11/us/politics/trump-maga-republicans-antisemitism.html
2026-01-12-00-26-24 +0000,nyt,"Two Hours, Scores of Questions, 23,000 Words: Our Interview With President Trump",https://www.nytimes.com/2026/01/11/us/politics/trump-interview-transcript.html
2026-01-12-00-14-48 +0000,nyt,How Gen Z Investors Went from Meme Stocks to Index Funds,https://www.nytimes.com/2026/01/11/business/gen-z-meme-stocks-investors.html
2026-01-12-00-12-29 +0000,nyt,Thousands March in New York to Protest ICE Killing and Denounce Trump,https://www.nytimes.com/2026/01/11/us/politics/ice-protest-nyc-trump.html
2026-01-12-00-11-30 +0000,nypost,"Bus lane along one of NYC’s busiest streets to be extended nearly 20 blocks, DOT commissioner announces",https://nypost.com/2026/01/11/us-news/dot-commissioner-mike-flynn-announces-bus-lane-extension-on-nycs-madison-avenue/
2026-01-12-00-04-18 +0000,bbc,He once criticised African leaders who cling to power. Now he wants a seventh term,https://www.bbc.com/news/articles/cr7jep39eg4o?at_medium=RSS&at_campaign=rss
2026-01-12-00-03-00 +0000,wsj,Iran Tensions Fuel Worries in Oil Market,https://www.wsj.com/finance/commodities-futures/oil-rises-amid-middle-east-tensions-a6a26e8a?mod=rss_markets_main
2026-01-12-00-02-08 +0000,bbc,Why luxury carmakers are now building glitzy skyscrapers,https://www.bbc.com/news/articles/clyenj18vvxo?at_medium=RSS&at_campaign=rss
2026-01-11-23-49-00 +0000,wsj,Gold Rises Amid Geopolitical Risks,https://www.wsj.com/finance/commodities-futures/gold-rises-amid-geopolitical-risks-56dafafe?mod=rss_markets_main
2026-01-11-23-19-09 +0000,nypost,Wild video shows spooked NYC carriage horse running into Midtown traffic: ‘Reckless endangerment’,https://nypost.com/2026/01/11/us-news/wild-video-shows-spooked-nyc-carriage-horse-running-into-midtown-traffic/
2026-01-11-23-16-14 +0000,nyt,Podcasts Hit the Golden Globes: Nominees Include ‘Call Her Daddy’ and More,https://www.nytimes.com/2026/01/11/business/media/golden-globes-podcasts.html
2026-01-11-23-12-04 +0000,nypost,"NRCC honcho ‘very bullish’ Republicans will hold the House in 2026, despite historical headwinds",https://nypost.com/2026/01/11/us-news/nrcc-honcho-very-bullish-republicans-will-hold-the-house-in-2026-despite-historical-headwinds/
2026-01-11-23-12-02 +0000,nypost,Allegiant to acquire Sun Country Airlines for $1.5B,https://nypost.com/2026/01/11/business/allegiant-to-acquire-sun-country-airlines-for-1-5b/
2026-01-11-23-08-05 +0000,nypost,Dog attack at buzzy NYC bakery Birdee sparks debate about pooches in restaurants: ‘Dog park with pastries’,https://nypost.com/2026/01/11/us-news/dog-attack-at-buzzy-nyc-bakery-birdee-sparks-debate-about-pooches-in-restaurants/
2026-01-11-23-02-19 +0000,nypost,"NYC rock den Bowery Electric to close, rebrand as small theater",https://nypost.com/2026/01/11/us-news/nyc-rock-den-bowery-electric-to-close-rebrand-as-small-theater/
2026-01-11-22-50-00 +0000,wsj,Allegiant Travel to Buy Sun Country Airlines for About $1.1 Billion,https://www.wsj.com/business/airlines/allegiant-to-buy-sun-country-for-around-1-billion-f5340b61?mod=pls_whats_news_us_business_f
2026-01-11-22-49-53 +0000,nypost,Hamas prepared to dissolve Gaza government if cease-fire deal sticks,https://nypost.com/2026/01/11/world-news/hamas-prepared-to-dissolve-gaza-government-if-cease-fire-deal-sticks/
2026-01-11-22-46-41 +0000,wapo,Suspect arrested after fire damages Mississippi’s largest synagogue,https://www.washingtonpost.com/nation/2026/01/11/mississippi-arson-arrest-synagogue-fire/
2026-01-11-22-41-15 +0000,nyt,Famed Nigerian Author Blames Death of Toddler Son on Negligent Care,https://www.nytimes.com/2026/01/11/world/africa/nigeria-adichie-son-death-blame.html
2026-01-11-22-39-27 +0000,nyt,Deposed Shah’s Son Hopes Trump Will Put Iran Regime ‘Down for Good’,https://www.nytimes.com/2026/01/11/world/europe/iran-protests-shah-son-trump.html
2026-01-11-22-37-17 +0000,nypost,"NYC anti-ICE protest draws 2,000 in latest unrest since shooting death of Renee Nicole Good",https://nypost.com/2026/01/11/us-news/nyc-anti-ice-protest-draws-2000-in-latest-unrest-since-shooting-death-of-renee-nicole-good/
2026-01-11-22-27-37 +0000,nyt,India’s Ties With Bangladesh Fray as Elections Loom,https://www.nytimes.com/2026/01/11/world/asia/india-bangladesh-tensions.html
2026-01-11-22-26-00 +0000,wsj,Opinion | The Debt of Saks Fifth Avenue,https://www.wsj.com/opinion/the-debt-of-saks-fifth-avenue-a9acc060
2026-01-11-22-23-34 +0000,wapo,Hundreds of Iranian protesters feared killed; U.S. considers military strikes,https://www.washingtonpost.com/world/2026/01/11/iran-protests-death-toll/
2026-01-11-22-23-00 +0000,wsj,Opinion | About That ‘Disappearing’ Middle Class,https://www.wsj.com/opinion/about-that-disappearing-middle-class-54948a18
2026-01-11-22-21-02 +0000,bbc,"More federal agents to be sent to Minnesota, Trump administration says",https://www.bbc.com/news/articles/cpv7knz8e8mo?at_medium=RSS&at_campaign=rss
2026-01-11-22-18-49 +0000,bbc,"Iran warns it will retaliate if US attacks, as hundreds killed in protests",https://www.bbc.com/news/articles/cm2jek15m8no?at_medium=RSS&at_campaign=rss
2026-01-11-22-17-47 +0000,nyt,Israeli Police Question Top Netanyahu Aide Over Leaked Document Case,https://www.nytimes.com/2026/01/11/world/middleeast/israel-police-netanyahu-aide-tzachi-braverman.html
2026-01-11-22-13-46 +0000,nypost,"Zohran Mamdani’s team treating NYC businesses as ‘the enemy’ in early goings, top leader says",https://nypost.com/2026/01/11/us-news/zohran-mamdanis-team-treating-nyc-businesses-as-the-enemy-in-early-goings-top-leader-says/
2026-01-11-22-13-00 +0000,wsj,Opinion | Breads Lines in Mamdani’s New York,https://www.wsj.com/opinion/breads-lines-in-mamdanis-new-york-4532ba80
2026-01-11-22-11-00 +0000,wsj,Opinion | Alaska Dumps Some Trial Lawyers,https://www.wsj.com/opinion/alaska-dumps-some-trial-lawyers-583f69d3
2026-01-11-22-09-05 +0000,nypost,Top Minnesota GOP rep. hopes Tim Walz ‘leaves office in cuffs’ over swirling fraud scandal,https://nypost.com/2026/01/11/us-news/top-minnesota-gop-rep-hopes-tim-walz-leaves-office-in-cuffs-over-swirling-fraud-scandal/
2026-01-11-22-00-33 +0000,bbc,"UK can legally stop shadow fleet tankers, ministers believe",https://www.bbc.com/news/articles/cy8pn7jgy3no?at_medium=RSS&at_campaign=rss
2026-01-11-22-00-05 +0000,bbc,Guantanamo detainee paid 'substantial' compensation by UK to settle torture complicity case,https://www.bbc.com/news/articles/cx2gelrxxr0o?at_medium=RSS&at_campaign=rss
2026-01-11-21-56-14 +0000,startribune,Minnesota’s Sun Country Airlines to be acquired by Allegiant in $1.5B deal,https://www.startribune.com/sun-country-allegiant-air-acquisition-purchase-minnesota/601562251
2026-01-11-21-55-03 +0000,nyt,Trump Says Cuba Will No Longer Get ‘Oil or Money’ From Venezuela,https://www.nytimes.com/2026/01/11/us/politics/trump-venezuela-oil-cuba.html
2026-01-11-21-50-14 +0000,nypost,Slow release of security video in  Christmas Day slay of Long Island CVS worker prompts proposed law,https://nypost.com/2026/01/11/us-news/slow-release-of-security-video-in-christmas-day-slay-of-long-island-cvs-worker-prompts-proposed-law/
2026-01-11-21-49-00 +0000,wsj,Opinion | The Justices Can Rein In Rogue State Courts,https://www.wsj.com/opinion/the-justices-can-rein-in-rogue-state-courts-7fa5e9f7
2026-01-11-21-43-04 +0000,nypost,2 NYC teens arrested after 17-year-old fatally stabbed in neck: ‘What a sin’,https://nypost.com/2026/01/11/us-news/nyc-teen-arrested-after-17-year-old-stabbed-in-neck-killed-on-the-street/
2026-01-11-21-39-00 +0000,wsj,Opinion | Trump Captivates the Globe,https://www.wsj.com/opinion/trump-captivates-the-globe-85d7c0a9
2026-01-11-21-39-00 +0000,wsj,Opinion | Affirmative Action Is Finally Waning,https://www.wsj.com/opinion/affirmative-action-is-finally-waning-28463fda
2026-01-11-21-35-05 +0000,bbc,Thousands of tourists stranded in Lapland as cold grounds flights,https://www.bbc.com/news/articles/c74vnxlvl40o?at_medium=RSS&at_campaign=rss
2026-01-11-21-35-00 +0000,wsj,"More Than 500 Killed in Iran Unrest, Rights Group Says",https://www.wsj.com/world/middle-east/iran-warns-it-could-hit-u-s-bases-as-trump-weighs-military-options-7fd57ba1
2026-01-11-21-19-19 +0000,nypost,"Teacher accused of raping boy, 14, in car in Walmart parking lot — while two other teens sat in the back",https://nypost.com/2026/01/11/us-news/teacher-accused-of-raping-boy-14-in-car-in-walmart-parking-lot/
2026-01-11-21-17-33 +0000,nyt,Mass Protests in Iran and Trump’s Threats,https://www.nytimes.com/2026/01/11/world/mass-protests-iran-trump-venezuela.html
2026-01-11-21-13-25 +0000,nypost,"Dar Global, Trump Organization to launch $10B Saudi developments",https://nypost.com/2026/01/11/business/dar-global-trump-organization-to-launch-10b-saudi-developments/
2026-01-11-21-08-03 +0000,nypost,Guard at Winter Olympic construction site dies due to cold temperatures,https://nypost.com/2026/01/11/world-news/guard-at-winter-olympic-construction-site-dies-due-to-cold-temperatures/
2026-01-11-21-07-00 +0000,wsj,Opinion | Is Mexico Slouching Toward Venezuela?,https://www.wsj.com/opinion/is-mexico-slouching-toward-venezuela-36ed9042
2026-01-11-21-07-00 +0000,wsj,Opinion | Go Around and Strangle Things,https://www.wsj.com/opinion/go-around-and-strangle-things-57f790d4?mod=pls_whats_news_us_business_f
2026-01-11-21-05-16 +0000,nyt,"Once Again, Oldest Mississippi Synagogue is Attacked With Fire",https://www.nytimes.com/2026/01/11/us/mississippi-synagogue-arson-attack-suspect.html
2026-01-11-21-04-27 +0000,nypost,Michael Rapaport eyes 2029 NYC mayoral run after calling mayor ‘Zoron the Moron’,https://nypost.com/2026/01/11/us-news/michael-rapaport-eyes-2029-nyc-mayoral-run-after-calling-mayor-zoron-the-moron/
2026-01-11-20-55-32 +0000,nypost,Long Island school rallies for hoops coach’s 2-year-old daughter with rare illness that ‘attacks’ organs,https://nypost.com/2026/01/11/us-news/long-island-school-rallies-for-hoops-coachs-2-year-old-daughter-with-rare-illness-that-attacks-organs/
2026-01-11-20-53-42 +0000,nypost,Liberal NYC pols’ plans to give themselves 16% raises squashed –but they’re not giving up yet,https://nypost.com/2026/01/11/us-news/liberal-nyc-pols-plans-to-give-themselves-16-raises-squashed-but-theyre-not-giving-up-yet/
2026-01-11-20-47-15 +0000,nyt,Thiel Gives $3 Million to Group Seeking to Block California Wealth Tax,https://www.nytimes.com/2026/01/11/us/politics/peter-thiel-california-wealth-tax.html
2026-01-11-20-47-00 +0000,nypost,Landlords buzzing about 150 William St. after nearby building sold for residential conversion,https://nypost.com/2026/01/11/business/landlords-buzzing-about-150-william-st-after-nearby-building-sold-for-residential-conversion/
2026-01-11-20-27-56 +0000,latimes,'West Wing' actor Timothy Busfield accused of child sex abuse in New Mexico,https://www.latimes.com/entertainment-arts/story/2026-01-11/timothy-busfield-accused-child-sex-abuse-new-mexico-cleaning-lady
2026-01-11-20-12-17 +0000,nyt,Trump Regrets Not Seizing Voting Machines After 2020 Election,https://www.nytimes.com/2026/01/11/us/trump-voting-machines-2020-election.html
2026-01-11-20-09-51 +0000,nypost,Trump threatens Cuba to ‘make a deal’ with the US before ‘it is too late’,https://nypost.com/2026/01/11/us-news/trump-threatens-cuba-to-make-a-deal-with-the-us-before-it-is-too-late/
2026-01-11-20-04-29 +0000,nypost,Quirky 257 Bowery gallery building up for sale,https://nypost.com/2026/01/11/business/quirky-257-bowery-gallery-building-up-for-sale/
2026-01-11-20-01-02 +0000,nypost,"Minnesota ICE operation continues, netting 10 killers, violent child rapists — but lefty pols want agents out",https://nypost.com/2026/01/11/us-news/minnesota-ice-operation-continues-netting-10-killers-violent-child-rapists-but-lefty-pols-want-agents-out/
2026-01-11-19-55-16 +0000,nypost,Ukraine strikes Russian oil rigs in Caspian Sea after Moscow’s intense drone bombardment,https://nypost.com/2026/01/11/world-news/ukraine-strikes-russian-oil-rigs-in-caspian-sea-after-moscows-intense-drone-bombardment/
2026-01-11-19-38-01 +0000,wapo,"In a Venezuelan home, a father grieves ‘hero’ son killed in U.S. raid",https://www.washingtonpost.com/world/2026/01/11/venezuela-united-states-raid-killed/
2026-01-11-19-28-26 +0000,nyt,Malaysia and Indonesia Block Access to Grok Because of Sexually Explicit Content,https://www.nytimes.com/2026/01/11/world/asia/malaysia-indonesia-grok-ban.html
2026-01-11-19-22-45 +0000,nyt,Glenn Youngkin Says JD Vance Would Be a ‘Great’ Republican Nominee in 2028,https://www.nytimes.com/2026/01/11/us/politics/glenn-youngkin-jd-vance-2028-president.html
2026-01-11-19-20-46 +0000,nyt,‘Hundreds More’ Federal Agents to be Deployed to Minneapolis After ICE Shooting,https://www.nytimes.com/2026/01/11/us/politics/federal-agents-minnesota-ice-shooting.html
2026-01-11-19-17-31 +0000,nyt,A Russian Videographer Reveals How Putin Shapes the Next Generation,https://www.nytimes.com/2026/01/11/world/europe/putin-documentary-russia-propoganda.html
2026-01-11-19-14-17 +0000,cbc,"Residents, 1st responders enter devastated Syrian city Aleppo after days of deadly fighting",https://www.cbc.ca/news/world/residents-return-aleppo-syria-kurds-fighting-9.7041492?cmp=rss
2026-01-11-19-13-27 +0000,nypost,"Americans urged to leave Venezuela as paramilitaries hunt US citizens, officials warn",https://nypost.com/2026/01/11/world-news/americans-urged-to-leave-venezuela-as-paramilitaries-hunt-us-citizens-officials-warn/
2026-01-11-19-10-21 +0000,nypost,Musician wrongly branded a sex offender by Google AI summary wants to sue over canceled concerts,https://nypost.com/2026/01/11/world-news/musician-wrongly-branded-a-sex-offender-by-google-ai-summary-wants-to-sue-over-canceled-concerts/
2026-01-11-19-05-09 +0000,nypost,PayPal signs big lease at Hudson Square,https://nypost.com/2026/01/11/business/paypal-signs-big-lease-at-hudson-square/
2026-01-11-18-57-40 +0000,nyt,A Look at Iran’s Antigovernment Protests,https://www.nytimes.com/video/world/middleeast/100000010627398/a-look-at-irans-antigovernment-protests.html
2026-01-11-18-56-39 +0000,nypost,"Ilhan Omar urges public to film ICE, chides agent who shot Renee Good for getting ‘in front of moving car’",https://nypost.com/2026/01/11/us-news/ilhan-omar-urges-public-to-film-ice-agents-chides-agent-who-shot-renee-good-for-getting-in-front-of-moving-car/
2026-01-11-18-52-41 +0000,nypost,"‘Massacre’ unfolding in Iran as protest death toll triples to over 500, rights group warns",https://nypost.com/2026/01/11/world-news/iran-protest-death-toll-more-than-triples-as-trump-admin-weighs-military-strikes/
2026-01-11-18-47-26 +0000,nypost,Mississippi arsonist arrested for setting blaze at synagogue once bombed by KKK: report,https://nypost.com/2026/01/11/us-news/mississippi-arsonist-arrested-for-setting-blaze-at-synagogue-once-bombed-by-kkk-report/
2026-01-11-18-43-25 +0000,latimes,Could this mysterious news site influence California's 2026 election?,https://www.latimes.com/california/story/2026-01-11/will-mysterious-california-news-site-influence-2026-election
2026-01-11-18-41-40 +0000,nypost,India proposes forcing smartphone makers to share source code in security overhaul,https://nypost.com/2026/01/11/business/india-proposes-forcing-smartphone-makers-to-share-source-code-in-security-overhaul/
2026-01-11-18-40-50 +0000,nyt,"After Minnesota Shooting, ICE Again Limits Congressional Visits",https://www.nytimes.com/2026/01/11/us/politics/minnesota-shooting-immigration-facilities-congressional-visits.html
2026-01-11-18-39-00 +0000,wsj,U.S. Steps Up Planning for Possible Action in Iran,https://www.wsj.com/world/middle-east/major-trump-briefing-on-iran-options-planned-for-tuesday-5827429f
2026-01-11-18-25-23 +0000,nypost,"US invasion of Greenland would trigger ‘end of NATO,’ spark war with Europe, Dems warn",https://nypost.com/2026/01/11/us-news/us-invasion-of-greenland-would-trigger-end-of-nato-war-with-europe-dems-warn/
2026-01-11-18-24-38 +0000,nypost,Ex-NY Gov. Andrew Cuomo in talks to host weekly radio show on John Catsimatidis’s station after mayoral loss to Mamdani,https://nypost.com/2026/01/11/us-news/ex-ny-gov-andrew-cuomo-in-talks-to-host-weekly-radio-show-on-john-catsimatidiss-station/
2026-01-11-18-19-04 +0000,wapo,Iran’s protests seem different this time. Is the regime on the brink?,https://www.washingtonpost.com/world/2026/01/11/iran-protests-regime-change-different-history/
2026-01-11-18-08-22 +0000,nyt,Guantánamo Prison Enters 25th Year,https://www.nytimes.com/2026/01/11/us/politics/guantanamo-prison-25th-anniversary.html
2026-01-11-18-08-02 +0000,startribune,Live: Noem says more immigration agents heading to Minnesota in wake of fatal shooting,https://www.startribune.com/ice-raids-minnesota/601546426
2026-01-11-18-00-00 +0000,wsj,Why This Billionaire Holds a Family Meeting About Money Once a Quarter,https://www.wsj.com/business/flexjet-kenn-ricci-family-money-meeting-624c84e7?mod=pls_whats_news_us_business_f
2026-01-11-17-50-02 +0000,bbc,Sudan's government returns to capital after nearly 3 years of war,https://www.bbc.com/news/articles/ckgn5g90lggo?at_medium=RSS&at_campaign=rss
2026-01-11-17-38-59 +0000,nyt,Senate Democrat Says a U.S. Strike on Iran Risks Strengthening Its Government,https://www.nytimes.com/2026/01/11/us/politics/us-iran-strike-protests-warner.html
2026-01-11-17-21-26 +0000,bbc,Thousands march and dozens arrested in Minneapolis protests against ICE,https://www.bbc.com/news/articles/cvgpnwnqygro?at_medium=RSS&at_campaign=rss
2026-01-11-17-00-00 +0000,wsj,Russian Flags Proliferate Over Shadow Fleet of Oil Tankers,https://www.wsj.com/politics/national-security/russian-flags-proliferate-over-shadow-fleet-of-oil-tankers-41b0bed4
2026-01-11-17-00-00 +0000,wsj,Polymarket users can now bet on median home values in major metros like Miami and Los Angeles,https://www.wsj.com/economy/housing/what-a-new-betting-market-for-housing-prices-means-for-home-buyers-and-sellers-a4985234
2026-01-11-16-59-00 +0000,wsj,Opinion | The U.S. Could Make 2026 Even Worse for Putin Than 2025,https://www.wsj.com/opinion/the-u-s-could-make-2026-even-worse-for-putin-than-2025-611f9b8f
2026-01-11-16-38-56 +0000,nyt,$100 Billion to Revive Venezuela’s Energy Industry? Oil Executives Are Not So Sure,https://www.nytimes.com/2026/01/10/business/dealbook/oil-executives-trump-venezuela.html
2026-01-11-16-33-10 +0000,bbc,"Trump tells Cuba to 'make a deal, before it is too late'",https://www.bbc.com/news/articles/cx2kv2gn62vo?at_medium=RSS&at_campaign=rss
2026-01-11-16-29-40 +0000,cbc,"Trump says no more Venezuelan oil or money to go to Cuba, pushes for deal",https://www.cbc.ca/news/world/trump-says-no-more-venezuelan-oil-or-money-to-go-to-cuba-pushes-for-deal-9.7041441?cmp=rss
2026-01-11-16-28-00 +0000,wsj,"South Africa Risks Angering Trump by Hosting Navies of Iran, Russia, China",https://www.wsj.com/world/africa/south-africa-risks-angering-trump-by-hosting-navies-of-iran-russia-china-f55067a4
2026-01-11-16-03-25 +0000,nyt,Death Toll Grows as Nationwide Protests Rock Iran for a Third Night,https://www.nytimes.com/2026/01/10/world/middleeast/iran-protests-death-toll.html
2026-01-11-15-55-43 +0000,nypost,Kristi Noem clashes with CNN’s Jake Tapper over Minneapolis ICE shooting: ‘You don’t get to change the facts’,https://nypost.com/2026/01/11/us-news/kristi-noem-clashes-with-cnns-jake-tapper-over-minneapolis-ice-shooting/
2026-01-11-15-35-21 +0000,bbc,"Trump won't take Greenland by force, Mandelson says",https://www.bbc.com/news/articles/cp9j1d3zgvgo?at_medium=RSS&at_campaign=rss
2026-01-11-15-28-03 +0000,startribune,"In Minnesota’s most conservative county, GOP governor hopefuls weigh in on ICE shooting, criticize Walz",https://www.startribune.com/minnesota-republican-governor-forum-morrison-county-gop-little-falls-10-candidates-walz-fraud/601561243
2026-01-11-15-26-54 +0000,nyt,Syrian Military Takes Aleppo Neighborhoods After Clashes With Kurds,https://www.nytimes.com/2026/01/11/world/middleeast/syria-military-aleppo.html
2026-01-11-15-10-46 +0000,bbc,Tories would ban under-16s from social media,https://www.bbc.com/news/articles/cx2wyeqw3gpo?at_medium=RSS&at_campaign=rss
2026-01-11-15-05-16 +0000,nyt,Somalis Fled Civil War and Built a Community. Now They Are a Target.,https://www.nytimes.com/2026/01/11/us/somalis-fled-civil-war-and-built-a-community-now-they-are-a-target.html
2026-01-11-15-03-00 +0000,nypost,Trump suggests Marco Rubio could soon get another job — president of Cuba,https://nypost.com/2026/01/11/us-news/trump-suggests-marco-rubio-could-soon-get-another-job-president-of-cuba/
2026-01-11-15-00-00 +0000,wsj,Walmart Expanding Drone Delivery to Hundreds More Stores,https://www.wsj.com/articles/walmart-expanding-drone-delivery-to-hundreds-more-stores-696165f7?mod=pls_whats_news_us_business_f
2026-01-11-14-57-36 +0000,startribune,Behind Tim Walz’s decision to drop out of the governor’s race,https://www.startribune.com/behind-tim-walzs-decision-to-drop-out-of-the-governors-race/601559952
2026-01-11-14-30-46 +0000,cbc,"More than 1,000 Kyiv apartment blocks still without heat after Russian strike",https://www.cbc.ca/news/world/apartment-buildings-without-power-kyiv-9.7041367?cmp=rss
2026-01-11-14-18-04 +0000,bbc,One person dead and 300 buildings destroyed in Australia bushfires,https://www.bbc.com/news/articles/c75xdg2p36lo?at_medium=RSS&at_campaign=rss
2026-01-11-14-00-00 +0000,missionlocal,Parking instructions,https://missionlocal.org/2026/01/parking-instructions/
2026-01-11-13-53-57 +0000,nypost,Human remains found during Australia’s raging bushfires,https://nypost.com/2026/01/11/world-news/human-remains-found-during-australia-bushfires/
2026-01-11-13-34-57 +0000,bbc,"Tories will channel anger at Labour, vows Badenoch",https://www.bbc.com/news/articles/c0jvz020zzyo?at_medium=RSS&at_campaign=rss
2026-01-11-13-20-29 +0000,wapo,A powerful force has been holding back the housing market. It’s finally easing.,https://www.washingtonpost.com/business/2026/01/11/mortgage-lock-in-effect/
2026-01-11-13-17-19 +0000,bbc,Bride and groom killed by gas explosion day after Pakistan wedding,https://www.bbc.com/news/articles/c4gr7nlx421o?at_medium=RSS&at_campaign=rss
