score,pubdate,source,title,link
28,2025-12-08-15-40-27 +0000,nypost,New Zealand reporter bloodied by flying bird in the middle of news segment,https://nypost.com/2025/12/08/world-news/new-zealand-reporter-hit-by-flying-bird-leaving-her-bloodied/
28,2025-12-08-18-14-20 +0000,nypost,Porn star Bonnie Blue faces up to 15 years in jail after being detained over ‘Bangbus’ stunt in Bali,https://nypost.com/2025/12/08/world-news/bonnie-blue-faces-up-to-15-years-in-jail-after-being-detained-in-bali/
28,2025-12-09-05-14-59 +0000,bbc,"Goa nightclub owners fled to Thailand hours after deadly fire, police say",https://www.bbc.com/news/articles/c23e7p40y04o?at_medium=RSS&at_campaign=rss
28,2025-12-08-21-55-39 +0000,nypost,CBS News’ Adriana Diaz and Kelly O’Grady poised to become next hosts of ‘CBS Saturday Morning:’ sources,https://nypost.com/2025/12/08/media/cbs-news-adriana-diaz-and-kelly-ogrady-poised-to-become-next-hosts-of-cbs-saturday-morning-sources/
27,2025-12-08-22-07-45 +0000,nyt,Russian Court Sentences 4 Soldiers to Prison for Killing Texan,https://www.nytimes.com/2025/12/08/world/europe/russia-soldiers-sentence-murder-texas.html
27,2025-12-09-05-17-35 +0000,nypost,In-N-Out burger chain removes ‘67’ from its ordering system to keep away annoying pranksters after viral ‘6-7’ meme,https://nypost.com/2025/12/09/us-news/in-n-out-removes-67-from-its-ordering-system-after-viral-6-7-meme/
27,2025-12-08-16-37-28 +0000,nyt,The U.S. Gave Mexico a List of Russian Spies. Mexico Let Them Stay.,https://www.nytimes.com/2025/12/08/world/americas/mexico-russia-spies.html
26,2025-12-08-22-34-39 +0000,nyt,Obamacare Users Will Be Asked to Pay More for Plans That Cover Less,https://www.nytimes.com/2025/12/08/health/obamacare-deductibles-premiums-health-insurance.html
26,2025-12-08-16-05-47 +0000,bbc,Israel's PM says second phase of Gaza peace plan is close,https://www.bbc.com/news/articles/c0r90gkzkezo?at_medium=RSS&at_campaign=rss
26,2025-12-08-15-35-45 +0000,cbc,"Liberals to open new fast track to permanent residency for 5,000 foreign doctors",https://www.cbc.ca/news/politics/diab-foreign-doctors-permanent-residency-9.7006937?cmp=rss
26,2025-12-08-20-33-04 +0000,startribune,Cause under investigation of fire that severely damaged mosque and school in Prior Lake,https://www.startribune.com/cause-under-investigation-of-fire-that-severely-damaged-mosque-and-school-in-prior-lake/601542019
26,2025-12-09-08-47-00 +0000,wsj,"BAT Sets Out $1.73 Billion Share Buyback, Backs 2025 Targets",https://www.wsj.com/business/earnings/bat-sets-out-1-73-billion-share-buyback-backs-2025-targets-3c9311e3?mod=pls_whats_news_us_business_f
26,2025-12-09-06-10-08 +0000,nypost,"Florida Gov. Ron DeSantis designates Muslim Brotherhood, CAIR as ‘foreign terrorist organizations’, follows Texas’ lead",https://nypost.com/2025/12/09/us-news/florida-gov-ron-desantis-designates-muslim-brotherhood-cair-as-foreign-terrorist-organizations-follows-texas-lead/
26,2025-12-09-00-58-53 +0000,nypost,Islanders alum to face off against cast of hit hockey show ‘Shoresy’,https://nypost.com/2025/12/08/us-news/islanders-alum-to-face-off-against-cast-of-hit-hockey-show-shoresy/
26,2025-12-09-06-30-26 +0000,nypost,California mom Cherie Townsend convicted of killing 66-year-old retired nurse in botched robbery to fund daughter’s cheerleading trip,https://nypost.com/2025/12/09/us-news/california-mom-cherie-townsend-convicted-of-killing-66-year-old-retired-nurse-in-botched-robbery-to-fund-daughters-cheerleading-trip/
26,2025-12-09-08-10-00 +0000,wsj,Dollar Steady as Fed Expected to Cut Rates With Cautious Messaging,https://www.wsj.com/finance/currencies/perky-australian-dollar-looks-to-extend-gains-ca2f5e9e?mod=rss_markets_main
25,2025-12-08-14-41-42 +0000,bbc,Tories set out plans for judge-led grooming gang inquiry,https://www.bbc.com/news/articles/cly09v90vevo?at_medium=RSS&at_campaign=rss
25,2025-12-09-05-00-10 +0000,nyt,"Between Pakistan and Afghanistan, a Trade War With No End in Sight",https://www.nytimes.com/2025/12/09/world/asia/afghanistan-pakistan-trade.html
25,2025-12-09-01-25-00 +0000,wsj,Markets Eye China Economic Summit for Clues on 2026 Policy Plans,https://www.wsj.com/economy/markets-eye-china-economic-summit-for-clues-on-2026-policy-plans-5c36bcd5
25,2025-12-09-00-03-00 +0000,wsj,Republicans have yet to coalesce around a healthcare strategy just days before an expected vote on extending enhanced Obamacare subsidies,https://www.wsj.com/politics/policy/the-gop-cant-agree-on-a-healthcare-plan-some-republicans-are-panicking-76b6d89e
25,2025-12-09-00-32-26 +0000,nypost,"NY Archdiocese will negotiate global sex abuse settlement, raise $300M for 1,300 victims",https://nypost.com/2025/12/08/us-news/ny-archdiocese-will-negotiate-global-sex-abuse-settlement-raise-300m-for-1300-victims/
24,2025-12-09-10-00-00 +0000,wapo,Whether you shopped on Black Friday may depend on how much you make,https://www.washingtonpost.com/business/2025/12/09/holiday-shopping-economy-black-friday/
24,2025-12-09-04-00-00 +0000,wsj,Gaza Sits Under 68 Million Tons of Rubble. A Look at the Daunting Task Ahead.,https://www.wsj.com/world/middle-east/gaza-rubble-reconstruction-israel-war-85f12cfa
24,2025-12-08-19-29-17 +0000,nypost,‘Quiet’ millionaires reveal how they were able to build their under-the-radar wealth: ‘Not a question of luck’,https://nypost.com/2025/12/08/business/quiet-millionaires-reveal-how-they-were-able-to-build-their-under-the-radar-wealth/
24,2025-12-09-00-09-32 +0000,nyt,"Jasmine Crockett Enters U.S. Senate Race in Texas, Reshaping Democratic Primary",https://www.nytimes.com/2025/12/08/us/colin-allred-senate-texas-primary.html
24,2025-12-09-10-15-47 +0000,nyt,"In Thailand and Cambodia, Taking Shelter (Again) as Fighting Reignites",https://www.nytimes.com/2025/12/09/world/asia/thailand-cambodia-border-conflict-evacuation.html
24,2025-12-09-10-44-02 +0000,nyt,Another Front in the War in Ukraine: Who Gets to Claim a Famed Artist?,https://www.nytimes.com/2025/12/09/world/europe/ukraine-malevich-artist.html
23,2025-12-09-10-30-00 +0000,wsj,"Now Cracker Barrel Diehards Think the Food Isn’t Up to Scratch, Either",https://www.wsj.com/business/earnings/cracker-barrel-earnings-q1-2026-stock-d8c49dad?mod=pls_whats_news_us_business_f
23,2025-12-08-23-25-23 +0000,nypost,"Nick Fuentes may be racist, but relies on Nigeria and India to fuel his ‘popularity’ online",https://nypost.com/2025/12/08/world-news/nick-fuentes-may-be-racist-but-relies-on-nigeria-and-india-to-fuel-his-popularity-online/
23,2025-12-08-22-25-45 +0000,nypost,‘Criminal illegal alien’ mom of Karoline Leavitt’s nephew set to be released from ICE detention,https://nypost.com/2025/12/08/us-news/bruna-caroline-ferreira-mom-of-karoline-leavitts-nephew-to-be-released-from-ice-custody/
23,2025-12-08-22-41-00 +0000,wsj,Opinion | Let Warner’s Shareholders Decide,https://www.wsj.com/opinion/warner-bros-discovery-acquisition-netflix-paramount-donald-trump-antitrust-69eefac6
23,2025-12-08-19-13-12 +0000,bbc,Here's what Canadian provinces are doing with all the US liquor they pulled off shelves,https://www.bbc.com/news/articles/cwyp9g7p5p9o?at_medium=RSS&at_campaign=rss
23,2025-12-09-07-15-57 +0000,nyt,7.6-Magnitude Earthquake Near Japan Triggers Tsunami Warning,https://www.nytimes.com/2025/12/08/world/asia/japan-earthquake-tsunami.html
23,2025-12-08-11-50-49 +0000,wapo,"He’s tiny, fuzzy and pink. Indonesia hails its first local panda cub.",https://www.washingtonpost.com/world/2025/12/08/indonesia-panda-first-cub-born/
23,2025-12-08-19-03-40 +0000,nyt,A.I. Videos Have Flooded Social Media. No One Was Ready.,https://www.nytimes.com/2025/12/08/technology/ai-slop-sora-social-media.html
23,2025-12-08-20-53-27 +0000,bbc,Israel to review reports that troops killed three-year-old in Gaza,https://www.bbc.com/news/articles/cqxqz4227x7o?at_medium=RSS&at_campaign=rss
23,2025-12-08-21-17-00 +0000,wsj,Opinion | The Problem With Taking Narco-Traffickers to Court,https://www.wsj.com/opinion/the-problem-with-taking-narco-traffickers-to-court-9cc58e9c
22,2025-12-08-11-00-00 +0000,latimes,"After Eaton fire, Altadena's Christmas Tree Lane provides an emotional return to normalcy",https://www.latimes.com/lifestyle/story/2025-12-08/altadena-christmas-tree-lane-after-eaton-fire
22,2025-12-08-23-12-23 +0000,startribune,"Minneapolis council considers $46K raise for Frey, may hike their own pay in two years",https://www.startribune.com/minneapolis-council-considers-giving-mayor-46000-raise-and-themselves-raises-in-2-years/601541213
22,2025-12-09-04-10-27 +0000,nyt,"Massachusetts Church Keeps Anti-ICE Nativity Scene, Defying Diocese Leaders",https://www.nytimes.com/2025/12/08/us/massachusetts-church-ice-nativity-scene.html
22,2025-12-08-21-24-26 +0000,nypost,Firebrand Texas Rep. Jasmine Crockett launches run for Senate,https://nypost.com/2025/12/08/us-news/firebrand-texas-rep-jasmine-crockett-launches-run-for-senate/
22,2025-12-09-10-55-00 +0000,wsj,Bank of Japan Governor Sees Little Danger of Rapid Pickup in Inflation,https://www.wsj.com/articles/bank-of-japan-governor-sees-little-danger-of-rapid-pickup-in-inflation-cd0fdff3
22,2025-12-09-10-20-19 +0000,bbc,Why are Thailand and Cambodia fighting at the border?,https://www.bbc.com/news/articles/cdjxje2pje1o?at_medium=RSS&at_campaign=rss
22,2025-12-08-14-52-57 +0000,bbc,"50,000 new apprenticeships promised in youth employment push",https://www.bbc.com/news/articles/cvgkpzpy1zno?at_medium=RSS&at_campaign=rss
22,2025-12-09-09-00-00 +0000,nypost,Coinbase listings: the real playbook for spotting new coins,https://nypost.com/business/new-coinbase-listings-how-to-find-and-trade/
22,2025-12-08-15-14-14 +0000,nyt,"The early Federal Trade Commission fielded complaints over cigars, soap and even nose shapers.",https://www.nytimes.com/live/2025/12/08/us/trump-supreme-court-presidential-power/the-early-federal-trade-commission-fielded-complaints-over-cigars-soap-and-even-nose-shapers
22,2025-12-08-12-01-00 +0000,missionlocal,"The District 4 supervisor race will be nasty, brutish — and short",https://missionlocal.org/2025/12/sunset-election-d4-upzoning-great-highway-alan-wong-natalie-gee-david-lee/
22,2025-12-08-11-00-00 +0000,nypost,Harvard hit with federal complaint over ‘race-restricted’ scholarship program: ‘Enough is enough’,https://nypost.com/2025/12/08/us-news/harvard-hit-with-fed-complaint-over-race-restricted-scholarship/
22,2025-12-08-15-39-53 +0000,bbc,Hunt under way for Benin coup plotters as two hostages reportedly freed,https://www.bbc.com/news/articles/cgex2d3y3dxo?at_medium=RSS&at_campaign=rss
22,2025-12-08-21-30-16 +0000,startribune,Augsburg president decries ICE detention of a student on private campus,https://www.startribune.com/augsburg-president-decries-illegal-ice-detention-of-a-student-on-private-campus/601540404
21,2025-12-09-02-00-00 +0000,wsj,The Curriculum Flowchart That Has Texas Professors Up in Arms,https://www.wsj.com/us-news/education/texas-tech-college-curriculum-flowchart-race-gender-7888880f
21,2025-12-09-00-40-36 +0000,nypost,DC pipe-bomb suspect Brian Cole Jr. has secret online life obsessing over ‘My Little Pony’,https://nypost.com/2025/12/08/us-news/brian-cole-jr-has-secret-online-obsession-with-my-little-pony/
21,2025-12-09-03-52-00 +0000,wsj,Australia Central Bank Keeps Rates on Hold But Makes Hawkish Tilt,https://www.wsj.com/articles/australia-central-bank-keeps-rates-on-hold-but-makes-hawkish-tilt-87430327
21,2025-12-08-23-13-12 +0000,latimes,Holiday shipping deadlines: When to ship your gifts this year so they arrive on time,https://www.latimes.com/california/story/2025-12-08/holiday-shipping-deadlines-when-to-ship-your-gifts-so-they-arrive-on-time
21,2025-12-09-09-16-20 +0000,bbc,CCTV shows Matisse heist suspects making off with artworks on foot,https://www.bbc.com/news/videos/c0jeq519222o?at_medium=RSS&at_campaign=rss
21,2025-12-09-01-38-00 +0000,bbc,Dozens injured after magnitude 7.5 quake strikes northern Japan,https://www.bbc.com/news/articles/c7091k5pg31o?at_medium=RSS&at_campaign=rss
21,2025-12-08-17-19-51 +0000,nypost,Elon Musk calls for abolition of European Union after it hit X with $140M ‘bulls–t’ fine,https://nypost.com/2025/12/08/business/elon-musk-calls-for-abolition-of-european-union-after-it-hit-x-with-140m-bulls-t-fine/
21,2025-12-09-09-13-18 +0000,bbc,Ukrainians raise flag to show BBC the fight goes on in city claimed by Russia,https://www.bbc.com/news/articles/cd6x3vv7y60o?at_medium=RSS&at_campaign=rss
21,2025-12-09-10-00-00 +0000,wapo,How tariffs hit the brakes on America’s booming e-bike industry,https://www.washingtonpost.com/business/2025/12/06/ebike-rad-power-tariffs/
21,2025-12-08-15-42-22 +0000,startribune,"Former UnitedHealth CEO McGuire to join health care talks between Fairview, U of M",https://www.startribune.com/former-unitedhealth-ceo-mcguire-to-join-health-care-talks-between-fairview-u-of-m/601541957
20,2025-12-08-16-26-19 +0000,bbc,Police assess claims Reform overspent on Farage election campaign,https://www.bbc.com/news/articles/cy4xrn0z0r0o?at_medium=RSS&at_campaign=rss
20,2025-12-08-14-03-00 +0000,wsj,Nvidia Takes Top Spot in the List of Best-Managed Companies of 2025,https://www.wsj.com/business/c-suite/nvidia-wins-best-managed-companies-ranking-2025-2297969d?mod=pls_whats_news_us_business_f
20,2025-12-09-00-21-12 +0000,bbc,"Sudan air force bombing of towns, markets and schools has killed hundreds, report says",https://www.bbc.com/news/articles/cd0k7g202l2o?at_medium=RSS&at_campaign=rss
20,2025-12-09-00-53-35 +0000,nypost,Saudi Arabia begins selling alcohol to non-Muslim residents — but only if they’re rich enough,https://nypost.com/2025/12/08/world-news/saudi-arabia-begins-selling-alcohol-to-non-muslim-residents-but-only-if-theyre-rich-enough/
20,2025-12-08-18-47-07 +0000,bbc,Sweaty Betty in new dispute over ad slogans,https://www.bbc.com/news/articles/cj9yz0xmvk2o?at_medium=RSS&at_campaign=rss
20,2025-12-09-08-33-00 +0000,wsj,German Exports Inched Up in October Despite U.S. Weakness,https://www.wsj.com/economy/trade/german-exports-inched-up-in-october-828fc14a
20,2025-12-09-03-01-25 +0000,nypost,Arkansas mom orchestrated staged kidnapping of mentally disabled daughter to teach her bizarre lesson,https://nypost.com/2025/12/08/us-news/arkansas-mom-orchestrated-staged-kidnapping-of-mentally-disabled-daughter-to-teach-her-bizarre-lesson/
20,2025-12-08-16-04-44 +0000,nypost,Vornado’s Midtown tower more than 90% leased after signing new tenants,https://nypost.com/2025/12/08/business/vornados-midtown-tower-more-than-90-leased-after-signing-new-tenants/
20,2025-12-09-02-21-03 +0000,cbc,The moment a Hawaii volcano's eruption knocked out a remote camera,https://www.cbc.ca/player/play/9.7008233?cmp=rss
20,2025-12-09-01-42-31 +0000,nypost,Swing district Republicans brace for political fallout if health care subsidies expire,https://nypost.com/2025/12/08/us-news/swing-district-republicans-brace-for-political-fallout-if-health-care-subsidies-expire/
20,2025-12-08-19-18-35 +0000,nyt,China’s Weak Currency Is Powering Its Exports and Drawing Criticism,https://www.nytimes.com/2025/12/07/business/china-rmb-currency.html
20,2025-12-08-11-26-00 +0000,wsj,Hong Kong Election Draws Tepid Turnout After Deadly Fire,https://www.wsj.com/world/asia/hong-kong-election-draws-tepid-turnout-after-deadly-fire-ba32ef7d
19,2025-12-08-23-04-47 +0000,nyt,One Hundred Schoolchildren Released After Kidnapping in Nigeria,https://www.nytimes.com/2025/12/08/world/africa/one-hundred-schoolchildren-released-after-kidnapping-in-nigeria.html
19,2025-12-08-22-32-37 +0000,nyt,"App That Tracks ICE Raids Sues U.S., Saying Officials Pressured Apple to Remove It",https://www.nytimes.com/2025/12/08/business/apple-iceblock-lawsuit.html
19,2025-12-08-12-12-00 +0000,wsj,"Investors Remain Exposed to Potential Dollar Losses, Bank for International Settlements Says",https://www.wsj.com/finance/currencies/investors-remain-exposed-to-potential-dollar-losses-bank-for-international-settlements-says-ab3994e5?mod=rss_markets_main
19,2025-12-08-11-00-00 +0000,wapo,ACLU claims Cuban detainees were beaten for refusing removal to Mexico,https://www.washingtonpost.com/business/2025/12/08/ice-detainees-abuse-aclu-fort-bliss/
19,2025-12-08-17-21-12 +0000,bbc,I lost £13k after my second-hand EV turned out to be a clone car,https://www.bbc.com/news/articles/cwyvee57xz5o?at_medium=RSS&at_campaign=rss
19,2025-12-08-15-52-21 +0000,bbc,DiCaprio's One Battle After Another leads Golden Globe nominations,https://www.bbc.com/news/articles/cly312nyq49o?at_medium=RSS&at_campaign=rss
19,2025-12-08-15-53-18 +0000,nyt,Why Thailand and Cambodia Are Fighting,https://www.nytimes.com/2025/12/08/world/asia/thailand-cambodia-border-fighting-strikes.html
19,2025-12-09-09-42-00 +0000,wsj,Eni Makes Gas Discovery in Indonesia,https://www.wsj.com/world/asia/eni-makes-gas-discovery-in-indonesia-49b6f3e9
19,2025-12-09-03-19-48 +0000,nypost,Ohio man accidentally sent meth through tube at bank drive-thru: police,https://nypost.com/2025/12/08/us-news/ohio-man-accidentally-sent-meth-through-tube-at-bank-drive-thru-police/
19,2025-12-09-08-58-00 +0000,wsj,Gold Flat as Investors Await Fed Signals on 2026 Rate Path,https://www.wsj.com/finance/commodities-futures/gold-edges-higher-focus-on-fed-rate-decision-de203ee1?mod=rss_markets_main
19,2025-12-09-04-34-07 +0000,nypost,Runaway horse ‘Sundance’ dashes down highways near JFK Airport before safe capture: wild footage,https://nypost.com/2025/12/08/us-news/runaway-horse-sundance-dashes-down-highways-near-jfk-airport-before-safe-capture-wild-footage/
19,2025-12-08-20-16-00 +0000,wsj,Precious Metals Slip Ahead of Fed Decision,https://www.wsj.com/finance/commodities-futures/gold-gains-on-fed-rate-cut-expectations-8b34f40d?mod=rss_markets_main
19,2025-12-09-10-00-00 +0000,wapo,What religious leaders think is behind a growing group of young and very devout adults,https://www.washingtonpost.com/nation/2025/12/09/young-adults-religion-campuses-kirk/
19,2025-12-08-11-10-30 +0000,bbc,Thousands flee Thai-Cambodia border after deadly clashes,https://www.bbc.com/news/articles/cr7l0rjz05eo?at_medium=RSS&at_campaign=rss
18,2025-12-08-21-35-00 +0000,wsj,"Why the SEC’s Top Accountant Is Weighing Changes to Audit Inspections, Conflict-of-Interest Rules",https://www.wsj.com/articles/why-the-secs-top-accountant-is-weighing-changes-to-audit-inspections-conflict-of-interest-rules-a3a51336?mod=pls_whats_news_us_business_f
18,2025-12-08-22-28-38 +0000,bbc,Australia's social media ban for children has left big tech scrambling,https://www.bbc.com/news/articles/ce86381p70eo?at_medium=RSS&at_campaign=rss
18,2025-12-08-21-52-33 +0000,nyt,Social Security at 70? Why the Gold Standard Advice Works for Only a Few,https://www.nytimes.com/2025/12/07/business/social-security-70-retirement.html
18,2025-12-09-02-57-46 +0000,nypost,Winter coat saves NYC tourist from serious stab injury in wild Times Square attack,https://nypost.com/2025/12/08/us-news/coat-saves-nyc-tourist-from-stab-injury-in-times-square-attack/
18,2025-12-08-17-25-02 +0000,48hills,Drama Masks: A visceral crawl through our wild moment in ‘weird inkling’,https://48hills.org/2025/12/drama-masks-a-visceral-crawl-through-our-wild-moment-at-weird-inkling/
18,2025-12-08-17-17-08 +0000,nyt,"At the Kennedy Center Honors, Little Glitz and One Striking Accessory",https://www.nytimes.com/2025/12/08/style/melania-trump-kennedy-center-honors-style.html
18,2025-12-08-14-49-50 +0000,bbc,How much have Europe and the US given to Ukraine?,https://www.bbc.com/news/articles/crew8y7pwd5o?at_medium=RSS&at_campaign=rss
18,2025-12-08-13-26-46 +0000,bbc,Who has been called up for Afcon 2025?,https://www.bbc.com/sport/football/articles/cy7vnn5rg5jo?at_medium=RSS&at_campaign=rss
18,2025-12-08-12-19-21 +0000,bbc,Elon Musk's X bans European Commission from making ads after €120m fine,https://www.bbc.com/news/articles/c0589g0dqq7o?at_medium=RSS&at_campaign=rss
18,2025-12-09-07-21-55 +0000,bbc,How India's largest airline lost control and threw air travel into chaos,https://www.bbc.com/news/articles/cn985l2px20o?at_medium=RSS&at_campaign=rss
18,2025-12-09-02-30-37 +0000,latimes,"Activists paint Westwood crosswalk to improve safety. Police shut down effort, cite volunteer for vandalism",https://www.latimes.com/california/story/2025-12-08/lapd-cite-activists-for-painting-westwood-crosswalk-to-improve-safety
17,2025-12-09-10-00-00 +0000,wapo,"Deported from the U.S. in 2018, he’s trying to help others survive exile",https://www.washingtonpost.com/world/2025/12/10/trump-cambodia-vietnam-laos-deported-immigrants/
17,2025-12-08-11-59-00 +0000,wsj,JPMorganChase Snags Todd Combs From Berkshire Hathaway,https://www.wsj.com/articles/jpmorganchase-snags-todd-combs-from-berkshire-hathaway-86f9359e?mod=rss_markets_main
17,2025-12-09-09-00-09 +0000,bbc,"UN environment report 'hijacked' by US and others over fossil fuels, top scientist says",https://www.bbc.com/news/articles/c1w9ge93w9po?at_medium=RSS&at_campaign=rss
17,2025-12-09-01-31-22 +0000,nypost,Beloved 57-year-old NYC diner physically relocated from Brooklyn neighborhood to Steiner Studios for movie set,https://nypost.com/2025/12/08/us-news/beloved-wythe-diner-physically-relocated-from-longtime-nyc-neighborhood-to-steiner-studios-for-movie-set/
17,2025-12-09-02-36-48 +0000,nypost,"RFK Jr. shuns The Post’s questions about Olivia Nuzzi affair, glares at reporter",https://nypost.com/2025/12/08/us-news/rfk-jr-shuns-the-posts-questions-about-olivia-nuzzi-affair-glares-at-reporter/
17,2025-12-08-20-49-00 +0000,wsj,Opinion | World Trade Grows Without the U.S.,https://www.wsj.com/opinion/world-trade-grows-without-the-u-s-28c83f4c
17,2025-12-09-00-13-40 +0000,nyt,Dogs in Kimonos: Japan Reinvents a Children’s Holiday With Pets in Mind,https://www.nytimes.com/2025/12/08/world/asia/japan-pets-festival.html
17,2025-12-09-06-14-42 +0000,startribune,Takeaways: Timberwolves stumble against Suns as five-game winning streak ends,https://www.startribune.com/takeaways-timberwolves-stumble-against-suns-as-five-game-winning-streak-ends/601476293
17,2025-12-09-05-55-28 +0000,nypost,"Wandering black bear crashes Christmas parade in Tennessee, stunning spectators: video",https://nypost.com/2025/12/09/us-news/wandering-black-bear-crashes-christmas-parade-in-tennessee-stunning-spectators-video/
17,2025-12-08-22-18-00 +0000,wsj,"Tech, Media & Telecom Roundup: Market Talk",https://www.wsj.com/business/tech-media-telecom-roundup-market-talk-49aac3a2?mod=pls_whats_news_us_business_f
17,2025-12-08-14-41-00 +0000,wsj,"The Journal is inviting subscribers to submit questions about the U.S. economy, markets and political landscape",https://www.wsj.com/economy/central-banking/live-q-a-the-feds-rate-decisionwe-answer-your-questions-on-the-economy-markets-and-more-2f3342a7
16,2025-12-09-05-47-40 +0000,startribune,Takeaways: Wild end road trip with 4-1 victory at Seattle,https://www.startribune.com/takeaways-wild-end-road-trip-with-4-1-victory-at-seattle/601524300
16,2025-12-08-23-39-55 +0000,nyt,Marooned Off the English Coast: Lots of Bananas,https://www.nytimes.com/2025/12/08/world/europe/uk-cargo-ship-container-bananas-sussex-beach.html
16,2025-12-09-06-29-38 +0000,bbc,AI tools transform Christmas gifting as shoppers turn to chatbots,https://www.bbc.com/news/articles/c8xd8prjvj0o?at_medium=RSS&at_campaign=rss
16,2025-12-09-09-36-00 +0000,wsj,TotalEnergies to Partner with Galp Energia on Mopane Discovery in Namibia,https://www.wsj.com/business/energy-oil/totalenergies-to-partner-with-galp-energia-on-mopane-discovery-in-namibia-04320f9f?mod=pls_whats_news_us_business_f
16,2025-12-08-11-00-00 +0000,nypost,"Diners flocking to happy hour,  ordering appetizers and skimping on entrees as affordability hits US restaurants nationwide",https://nypost.com/2025/12/08/business/diners-flocking-to-happy-hour-ordering-appetizers-and-skimping-on-entrees-as-affordability-hits-us-restaurants-nationwide/
16,2025-12-09-01-33-09 +0000,bbc,The dog trained to sniff out smuggled small boats,https://www.bbc.com/news/articles/cx25pyxnnnwo?at_medium=RSS&at_campaign=rss
16,2025-12-08-15-46-31 +0000,bbc,Drop in cream sales at dairy as shoppers cut back,https://www.bbc.com/news/articles/cm208423dmro?at_medium=RSS&at_campaign=rss
16,2025-12-08-21-54-49 +0000,latimes,The country's largest all-electric hospital is about to open in Orange County,https://www.latimes.com/environment/story/2025-12-08/countrys-largest-all-electric-hospital-is-about-to-open-in-orange-county
16,2025-12-09-06-12-53 +0000,nyt,Jeremy O. Harris Is Released From Custody in Japan,https://www.nytimes.com/2025/12/09/theater/jeremy-harris-japan-released.html
16,2025-12-08-15-31-44 +0000,48hills,"Win tickets to Dillinger Escape Plan, Tape B, Ranger Trucco, MYD",https://48hills.org/2025/12/win-tickets-to-dillinger-escape-plan-tape-b-ranger-trucco-myd/
16,2025-12-09-02-39-53 +0000,nyt,"DeSantis Designates CAIR, Muslim Advocacy Group, a ‘Terrorist Organization’",https://www.nytimes.com/2025/12/08/us/desantis-cair-muslim-terrorism-florida.html
16,2025-12-09-08-31-08 +0000,bbc,"Ben & Jerry's brand could be destroyed under Magnum, says co-founder",https://www.bbc.com/news/articles/cdxw2ny2e27o?at_medium=RSS&at_campaign=rss
16,2025-12-09-09-00-00 +0000,cbc,Can Carney still put together a credible climate plan? Does it matter?,https://www.cbc.ca/news/politics/carney-climate-guilbeault-analysis-9.7007724?cmp=rss
16,2025-12-08-20-35-41 +0000,nyt,FBI Agents Sue Patel After Being Fired Over Kneeling at George Floyd Protest,https://www.nytimes.com/2025/12/08/us/politics/kash-patel-fbi-lawsuit-george-floyd-protest.html
16,2025-12-08-21-39-04 +0000,nyt,G.O.P. Senators Push Health Care Options as Vote Looms,https://www.nytimes.com/2025/12/08/us/politics/obamacare-subsidy-vote-aca.html
