score,pubdate,source,title,link
113,2025-07-30-01-39-32 +0000,nypost,Senate confirms Trump lawyer Emil Bove for federal appeals court judge spot — pushing past whistleblower claims,https://nypost.com/2025/07/29/us-news/senate-confirms-trump-lawyer-emil-bove-for-federal-appeals-court-judge-spot-pushing-past-whistleblower-claims/
109,2025-07-30-14-30-00 +0000,wsj,"The Senate confirmed former Trump defense attorney Emil Bove to a federal appeals court, clinching a lifetime judicial appointment over the objections of Democrats",https://www.wsj.com/politics/policy/trumps-former-lawyer-emil-bove-confirmed-to-federal-appeals-court-246fb2c1
104,2025-07-29-22-00-59 +0000,nyt,"Trump Says Gaza Will Get More Aid, but Israel Will Distribute It",https://www.nytimes.com/2025/07/29/us/politics/trump-says-gaza-will-get-more-aid-but-israel-will-distribute-it.html
103,2025-07-30-02-05-07 +0000,cbc,"U.S. Senate confirms former Trump lawyer Emil Bove as federal judge, despite whistleblower concerns",https://www.cbc.ca/news/world/trump-lawyer-emil-bove-judge-approved-1.7597010?cmp=rss
101,2025-07-29-21-42-41 +0000,nypost,"Top Zelensky official praises Trump for giving Putin 10 days to end Ukraine invasion: ‘When America is serious, Russia backs down’",https://nypost.com/2025/07/29/us-news/top-zelensky-official-praises-trump-for-giving-putin-10-days-to-end-ukraine-invasion-when-america-is-serious-russia-backs-down/
99,2025-07-30-16-33-22 +0000,bbc,Trump to hit India with 25% tariffs - plus 'penalty' for trade with Russia,https://www.bbc.com/news/articles/cz71w1dgl84o?at_medium=RSS&at_campaign=rss
98,2025-07-30-04-27-30 +0000,latimes,Senate votes to confirm Trump's defense lawyer Emil Bove to a U.S. appeals court,https://www.latimes.com/politics/story/2025-07-29/senate-emil-bove
95,2025-07-30-14-54-00 +0000,wsj,President Trump’s tariff rollout has taken numerous twists and turns since launching earlier this year. Here’s a roundup of where things stand.,https://www.wsj.com/economy/trade/trump-tariffs-countries-trade-explained-7f826419
95,2025-07-30-18-33-31 +0000,nyt,Trump’s Mideast Envoy Heads to Israel Amid Global Fury Over Gaza Hunger,https://www.nytimes.com/2025/07/30/world/middleeast/trump-envoy-israel-gaza.html
90,2025-07-30-17-13-25 +0000,nyt,Brazil’s President Lula Voices Frustration With Trump Amid Tariff Battle,https://www.nytimes.com/2025/07/30/world/americas/brazil-president-lula-trump-tariffs.html
90,2025-07-30-03-19-00 +0000,wsj,The Trump administration halted and then restarted billions in new research grants flowing from the National Institutes of Health,https://www.wsj.com/politics/policy/trump-administration-puts-new-chokehold-on-billions-in-health-research-funding-19660215
87,2025-07-30-01-52-23 +0000,wapo,Trump softens stance on China amid trade talks and summit push,https://www.washingtonpost.com/national-security/2025/07/29/china-trade-ai-taiwan-trump/
87,2025-07-30-14-05-03 +0000,nypost,Trump threatens India with 25% tariff — plus ‘penalty’ for buying Russian energy,https://nypost.com/2025/07/30/us-news/trump-threatens-india-with-25-tariff-plus-penalty-for-buying-russian-energy/
86,2025-07-30-18-33-24 +0000,nyt,"Trump Threatens India With Steep Tariffs, Including Penalty Over Russian Oil",https://www.nytimes.com/2025/07/30/us/politics/india-tariffs-trump-russia.html
85,2025-07-30-00-37-54 +0000,bbc,"No deal on China tariffs until Trump agrees, says Bessent",https://www.bbc.com/news/articles/cdxyv2y48nzo?at_medium=RSS&at_campaign=rss
85,2025-07-30-02-12-08 +0000,nypost,"Trump tells Sen. Chuck Grassley to ‘step up,’ get rid of ‘ridiculous custom’ holding up judicial appointments",https://nypost.com/2025/07/29/us-news/trump-tells-sen-chuck-grassley-to-step-up-get-rid-of-ridiculous-custom-holding-up-judicial-appointments/
85,2025-07-29-20-43-00 +0000,wsj,President Trump’s four-day trip to Scotland combined two of his passions: golf and dealmaking,https://www.wsj.com/politics/policy/trump-in-scotland-mixes-presidential-diplomacy-with-family-business-1cb3fb31
84,2025-07-30-17-02-02 +0000,bbc,"Who is Emil Bove, Trump's former lawyer and pick for lifetime judge?",https://www.bbc.com/news/articles/c4g2n74lv00o?at_medium=RSS&at_campaign=rss
84,2025-07-29-20-13-48 +0000,nyt,Top Generals Nominated for New Positions Must Now Meet With Trump,https://www.nytimes.com/2025/07/29/us/politics/generals-trump.html
83,2025-07-30-16-09-15 +0000,nypost,Grassley rips Trump demands to force judicial nominees through Senate: ‘I was offended’,https://nypost.com/2025/07/30/us-news/grassley-rips-trump-demands-to-force-judicial-nominees-through-senate-i-was-offended/
83,2025-07-29-19-13-54 +0000,nypost,Trump confirms Epstein ‘stole’ women from Mar-a-Lago spa: ‘Taking people that work for me is bad’,https://nypost.com/2025/07/29/us-news/trump-confirms-epstein-stole-women-from-mar-a-lago-spa/
82,2025-07-30-18-42-26 +0000,bbc,Fed holds interest rates steady despite Trump pressure,https://www.bbc.com/news/articles/cvg40knxe9wo?at_medium=RSS&at_campaign=rss
81,2025-07-30-16-30-05 +0000,nyt,Trump has reshaped global trade. What does that mean for the U.S. economy?,https://www.nytimes.com/live/2025/07/30/business/federal-reserve-interest-rates/trump-has-reshaped-global-trade-what-does-that-mean-for-the-us-economy
80,2025-07-30-11-58-22 +0000,nyt,"President Lula on His Feud With Trump, Brazil’s Tariff Strategy and More",https://www.nytimes.com/2025/07/30/world/americas/brazil-president-lula-trump-feud-tariffs.html
79,2025-07-30-16-03-01 +0000,nyt,Tensions Between Trump and Powell at Tipping Point Ahead of Fed Meeting,https://www.nytimes.com/2025/07/30/business/trump-powell-fed-tensions.html
79,2025-07-30-17-00-06 +0000,nyt,Why the Fed’s renovations have drawn such ire from President Trump.,https://www.nytimes.com/live/2025/07/30/business/federal-reserve-interest-rates/why-the-feds-renovations-have-drawn-such-ire-from-president-trump
78,2025-07-30-11-51-39 +0000,startribune,"Sen. Cory Booker, Klobuchar clash on Senate floor over policing bills, how to take on Trump",https://www.startribune.com/sen-cory-booker-klobuchar-clash-on-senate-floor-over-policing-bills-how-to-take-on-trump/601446281
78,2025-07-30-00-24-41 +0000,nyt,Trump Admits Financial Penalties on Russia ‘May or May Not’ Work,https://www.nytimes.com/2025/07/29/us/politics/trump-sanctions-ukraine-russia.html
78,2025-07-30-03-40-50 +0000,nyt,Trump Prosecutor in L.A. Seeks to Drop Two High-Profile Criminal Cases,https://www.nytimes.com/2025/07/29/us/politics/trump-prosecutor-wiederhorn-kirk.html
78,2025-07-29-21-13-01 +0000,nyt,"Trump’s Tariff Deals With E.U., U.K. and Japan Are a Blow to Canada’s Car Industry",https://www.nytimes.com/2025/07/29/world/canada/canada-automobile-tariffs-trump-trade.html
76,2025-07-29-22-02-09 +0000,nyt,Countries Scramble to Strike Trade Deals With Trump as Deadline Nears,https://www.nytimes.com/2025/07/29/us/politics/trump-tariffs-trade-deals.html
76,2025-07-29-23-11-20 +0000,latimes,"As Trump's EPA reverses landmark climate policy, California could lead a resistance",https://www.latimes.com/environment/story/2025-07-29/trump-epa-greenhouse-gas-endangerment-finding-reversal-california-resistence
76,2025-07-30-00-34-00 +0000,latimes,Feds move to drop charges in controversial cases as Trump re-ups L.A. prosecutor,https://www.latimes.com/california/story/2025-07-29/charges-dropped-essayli-cases
76,2025-07-29-23-51-52 +0000,nypost,Kai Trump teases the president in video promoting Accelerator energy drink: ‘Sorry grandpa’,https://nypost.com/2025/07/29/sports/kai-trump-teases-the-president-in-video-promoting-accelerator-energy-drink/
75,2025-07-29-22-57-24 +0000,bbc,Trump says Epstein 'stole' young women from his Mar-a-Lago spa,https://www.bbc.com/news/articles/cyvn7ee3539o?at_medium=RSS&at_campaign=rss
74,2025-07-30-18-22-00 +0000,wsj,U.S. Sanctions Brazilian Judge Overseeing Case Against Trump Ally Bolsonaro,https://www.wsj.com/world/americas/u-s-sanctions-brazilian-judge-overseeing-case-against-trump-ally-bolsonaro-0d731a37
73,2025-07-30-15-11-30 +0000,bbc,Watch: Eric Trump not ruling out White House family 'dynasty',https://www.bbc.com/news/articles/ckgjrwe3ry0o?at_medium=RSS&at_campaign=rss
73,2025-07-30-13-07-50 +0000,nyt,Trump’s Tax Bill Expands Farm Subsidies. Not All Farmers Will Benefit.,https://www.nytimes.com/2025/07/30/us/trump-tax-policy-bill-farmers.html
73,2025-07-29-22-28-22 +0000,nyt,Harvard Will Share Employee Forms With Trump Administration,https://www.nytimes.com/2025/07/29/us/politics/harvard-employee-forms-trump-administration.html
72,2025-07-29-22-05-36 +0000,nyt,Trump Says Epstein ‘Stole’ Underage Victim from Mar-a-Lago Spa,https://www.nytimes.com/2025/07/29/us/politics/trump-epstein-virginia-giuffre-mar-a-lago.html
72,2025-07-29-22-31-20 +0000,nypost,"NY pols push IRS to probe nonprofit ‘sanctuary’ groups helping defy Trump, federal immigration laws",https://nypost.com/2025/07/29/us-news/ny-pols-push-irs-to-probe-nonprofit-sanctuary-groups-helping-defy-trump-federal-immigration-laws/
72,2025-07-30-13-13-39 +0000,bbc,Tsunami warning sparks evacuations in Japan and US after powerful Russia earthquake,https://www.bbc.com/news/articles/c987dwrdl0zo?at_medium=RSS&at_campaign=rss
71,2025-07-30-09-58-24 +0000,nyt,Trump Administration Told Taiwan’s President to Avoid U.S. Stopover,https://www.nytimes.com/2025/07/30/world/asia/trump-taiwan-china.html
71,2025-07-30-00-44-35 +0000,nyt,Trump Bypasses Congress to Keep Interim Prosecutors in California and Nevada,https://www.nytimes.com/2025/07/29/us/politics/trump-us-attorneys-california-nevada.html
71,2025-07-30-01-45-42 +0000,cbc,"Japan, Hawaii and Russia downgrade tsunami warnings after powerful earthquake",https://www.cbc.ca/news/world/japan-tsunami-alert-russia-quake-1.7597026?cmp=rss
70,2025-07-30-04-38-58 +0000,bbc,Watch: Major earthquake off Russia triggers widespread tsunami warnings,https://www.bbc.com/news/videos/cwy01l5kgxno?at_medium=RSS&at_campaign=rss
70,2025-07-30-18-30-32 +0000,wapo,"Tsunami live updates: Waves reach Hawaii, California after 8.8-magnitude Russia quake",https://www.washingtonpost.com/world/2025/07/29/tsunami-west-coast-japan-87-quake-russia/
69,2025-07-30-00-27-24 +0000,nyt,Booker Accuses Democrats of Being ‘Complicit’ With Trump in Heated Exchange,https://www.nytimes.com/2025/07/29/us/politics/cory-booker-democrats-trump-senate.html
69,2025-07-30-16-45-05 +0000,nyt,Who Pays in Trump’s Trade War?,https://www.nytimes.com/2025/07/30/business/trade-tariffs-who-pays.html
69,2025-07-29-23-04-39 +0000,nyt,States Sue to Block Trump Law Defunding Planned Parenthood,https://www.nytimes.com/2025/07/29/us/politics/abortion-lawsuit-trump-planned-parenthood.html
69,2025-07-29-21-10-41 +0000,latimes,Apple Manufacturing Academy opens in Detroit amid Trump pressure on U.S. production,https://www.latimes.com/business/story/2025-07-29/apple-manufacturing-facility-in-detroit-opens
67,2025-07-30-11-00-00 +0000,wsj,Trump Sees Emergencies Everywhere. Judges Are Considering Whether to Rein Him In.,https://www.wsj.com/us-news/law/trump-sees-emergencies-everywhere-judges-are-considering-whether-to-rein-him-in-2ffb2c76
67,2025-07-30-18-24-23 +0000,nyt,"Texas Republicans Unveil Gerrymandered House Map, Trying to Please Trump",https://www.nytimes.com/2025/07/30/us/politics/texas-republican-redistricting.html
65,2025-07-30-12-30-27 +0000,nyt,Hawaii Declares Emergency After Earthquake Off Russia Causes Tsunami,https://www.nytimes.com/2025/07/29/us/hawaii-tsunami-emergency-earthquake.html
65,2025-07-29-19-52-56 +0000,nyt,"UK Will Recognize Palestinian Statehood In September, Unless Israel-Hamas Cease-Fire is Reached",https://www.nytimes.com/2025/07/29/world/europe/uk-palestine-state-starmer-gaza-israel.html
64,2025-07-30-17-43-00 +0000,wsj,Tsunami Waves Reach U.S. After Powerful Russia Quake Forces Pacific Evacuations,https://www.wsj.com/world/tsunami-watch-warning-japan-us-west-coast-bd815b56
64,2025-07-30-01-25-19 +0000,nyt,Trump Administration Freezes $108 Million in Funds to Duke University,https://www.nytimes.com/2025/07/29/us/politics/trump-duke-university-frozen-funding-discrimination.html
61,2025-07-30-10-04-11 +0000,nyt,Russia’s Far East Suffers Some Damage From Earthquake and Tsunami,https://www.nytimes.com/2025/07/30/world/asia/russia-far-east-earthquake.html
60,2025-07-30-16-23-00 +0000,wsj,Two top Senate Republicans laid out a plan Wednesday to allow allies to finance donations of U.S. weapons and military equipment to Ukraine,https://www.wsj.com/politics/policy/us-weapons-ukraine-europe-funds-be3096c2
59,2025-07-29-19-50-55 +0000,wapo,Starmer vows to recognize Palestinian state unless Israel shifts Gaza policy,https://www.washingtonpost.com/world/2025/07/29/keir-starmer-israel-gaza-palestinian/
59,2025-07-30-11-15-57 +0000,bbc,"Trump deserves Open at Turnberry, says son",https://www.bbc.com/sport/golf/articles/c70x49kzwkyo?at_medium=RSS&at_campaign=rss
57,2025-07-29-20-09-36 +0000,nyt,How the E.U. Wooed Trump With Flashy but Flimsy Numbers,https://www.nytimes.com/2025/07/29/world/europe/europe-us-trade-deal-investments.html
57,2025-07-29-21-04-00 +0000,wsj,Opinion | Mergers Test ‘Madman’ Trump,https://www.wsj.com/opinion/mergers-test-madman-trump-railroad-5dd59d85?mod=pls_whats_news_us_business_f
56,2025-07-30-00-49-48 +0000,latimes,"Modest tsunami waves arrive on California coast, damaging Crescent City dock",https://www.latimes.com/california/story/2025-07-29/tsunami-warning-issued-california-coast-massive-russian-earthquake
55,2025-07-30-16-09-03 +0000,bbc,Why did Russian mega earthquake not cause more tsunami damage?,https://www.bbc.com/news/articles/c0l6pj7kjg7o?at_medium=RSS&at_campaign=rss
55,2025-07-30-17-05-45 +0000,nyt,Why Did Such a Powerful Earthquake Generate Such a Weak Tsunami?,https://www.nytimes.com/2025/07/30/science/russia-earthquake-tsunami-physics.html
55,2025-07-29-23-29-20 +0000,nypost,"Zohran Mamdani’s NYC election rivals have little chance — even if they team up, stunning new poll finds",https://nypost.com/2025/07/29/us-news/zohran-mamdanis-nyc-election-rivals-have-little-chance-even-if-they-team-up-stunning-new-poll-finds/
54,2025-07-30-04-18-58 +0000,latimes,What to expect along California coast when tsunami waves arrive,https://www.latimes.com/california/story/2025-07-29/la-me-coast-tsunami-forecast
53,2025-07-30-16-06-00 +0000,wsj,Any further Bank of Canada rate reduction depends on the extent of tariff-fueled economic weakness and whether price gains from trade disruptions are contained,https://www.wsj.com/articles/bank-of-canada-stands-pat-on-rates-signals-cut-could-materialize-if-conditions-warrant-346832f2
52,2025-07-30-01-10-54 +0000,nypost,New York Times stunningly rolls back claims about viral photo of starving Gaza boy,https://nypost.com/2025/07/29/media/new-york-times-stunningly-rolls-back-claims-about-viral-photo-of-starving-gaza-boy/
52,2025-07-29-19-33-47 +0000,bbc,"More than 60,000 people killed in Gaza during Israel offensive, Hamas-run health ministry says",https://www.bbc.com/news/articles/cwyeg5x3nj0o?at_medium=RSS&at_campaign=rss
52,2025-07-30-14-22-45 +0000,nypost,Tsunami warnings fading after one of the largest earthquakes ever recorded — here’s what to know,https://nypost.com/2025/07/30/world-news/tsunami-warnings-fading-after-one-of-the-largest-earthquakes-ever-recorded/
51,2025-07-30-18-57-00 +0000,wsj,Fed Meeting Today: Federal Reserve Leaves Rates Unchanged; Two Fed Governors Dissent,https://www.wsj.com/livecoverage/fed-meeting-interest-rate-decision-07-30-2025?mod=rss_markets_main
51,2025-07-30-17-33-47 +0000,nypost,"Bessent tells countries don’t ‘panic’ if trade deals aren’t made before tariff deadline, insists US has leverage over China",https://nypost.com/2025/07/30/us-news/bessent-tells-countries-dont-panic-if-trade-deals-arent-made-before-aug-1-insists-us-has-leverage-over-china/
50,2025-07-30-05-36-39 +0000,latimes,"Along California coast, waiting for tsunami waves with concern, curiosity, comedy",https://www.latimes.com/california/story/2025-07-29/earthquake-tsunami-alerts-coastal-residents-reaction
50,2025-07-30-12-23-00 +0000,wsj,Amazon to Pay New York Times at Least $20 Million a Year in AI Deal,https://www.wsj.com/business/media/amazon-to-pay-new-york-times-at-least-20-million-a-year-in-ai-deal-66db8503?mod=pls_whats_news_us_business_f
50,2025-07-30-09-30-00 +0000,wsj,"The shake-up for charitable giving inside the “one big, beautiful bill” is expected to alter Americans’ giving patterns when it takes full effect next year",https://www.wsj.com/politics/policy/trump-tax-spending-bill-charitable-donation-rules-bbc2f0e2
49,2025-07-30-01-47-18 +0000,cbc,'Stay elevated': Tsunami warnings triggered flood of evacuations across Pacific region,https://www.cbc.ca/news/world/tsunami-evacuation-alerts-1.7597175?cmp=rss
49,2025-07-30-14-00-33 +0000,nypost,Tsunami panic as cruise ships abandon passengers at dock following 8.8-magnitude earthquake,https://nypost.com/2025/07/30/lifestyle/cruise-ships-fearing-tsunami-abandon-passengers-at-dock-following-earthquake/
49,2025-07-30-15-31-32 +0000,nyt,Powerful Earthquake Rattles Russia’s Far East But Causes Little Damage,https://www.nytimes.com/2025/07/30/world/europe/russia-earthquake-kamchatka.html
49,2025-07-30-14-45-29 +0000,nyt,Oprah Opens Maui Road to Help Residents Flee After Hawaii Tsunami Warning,https://www.nytimes.com/2025/07/30/us/oprah-winfrey-road-hawaii-tsunami-maui.html
48,2025-07-30-13-51-11 +0000,cbc,Bank of Canada holds interest rate at 2.75% as economy shows resilience in the face of tariffs,https://www.cbc.ca/news/business/boc-july-decision-1.7597146?cmp=rss
48,2025-07-29-22-26-05 +0000,nypost,"Qatar, Saudi Arabia, Egypt join calls for Hamas to disarm and exit Gaza to end war with Israel",https://nypost.com/2025/07/29/world-news/qatar-saudi-arabia-egypt-join-calls-for-hamas-to-disarm-and-exit-gaza-to-end-war-with-israel/
46,2025-07-30-17-01-29 +0000,wapo,NYC mass killing raises new security concerns for corporate America,https://www.washingtonpost.com/business/2025/07/30/building-security-nyc-shooting-luigi-mangione/
45,2025-07-29-19-24-21 +0000,bbc,Israeli settler accused of killing Palestinian involved in Oscar-winning West Bank film,https://www.bbc.com/news/articles/c776x78517po?at_medium=RSS&at_campaign=rss
45,2025-07-30-09-25-31 +0000,nyt,8.8-Magnitude Earthquake Off Russia Could Be One of the Largest on Record,https://www.nytimes.com/2025/07/29/world/asia/earthquake-russia-record.html
45,2025-07-30-10-07-57 +0000,nyt,Tsunami Warning Issued for Northern California,https://www.nytimes.com/2025/07/30/us/tsunami-warning-california.html
45,2025-07-30-13-24-23 +0000,wapo,Earthquake off Russia’s coast is among strongest ever recorded,https://www.washingtonpost.com/world/2025/07/30/strongest-tsunami-earthquake-records-russia/
44,2025-07-30-01-05-31 +0000,latimes,"Tsunami warning, advisory for California: What we know, how to prepare",https://www.latimes.com/california/story/2025-07-29/la-me-tsunami-explainer
44,2025-07-30-15-23-38 +0000,startribune,New details emerge in Delta pilot’s arrest on jet from Twin Cities on child sex charges,https://www.startribune.com/new-details-emerge-behind-delta-pilots-arrest-in-sf-on-jet-from-twin-cities-on-child-sex-charges/601446290
44,2025-07-30-16-02-46 +0000,bbc,"Top finance executive, 'hero' officer among four killed in NYC  shooting",https://www.bbc.com/news/articles/cx29l8dw8d2o?at_medium=RSS&at_campaign=rss
44,2025-07-30-09-01-04 +0000,bbc,Japan's Fukushima plant workers evacuate after tsunami warning,https://www.bbc.com/news/articles/c2l79p7x589o?at_medium=RSS&at_campaign=rss
43,2025-07-30-01-00-00 +0000,wsj,How Did a Lone Gunman Breach One of New York’s Most Secure Skyscrapers?,https://www.wsj.com/us-news/nyc-shooting-office-security-breach-17071dc3?mod=pls_whats_news_us_business_f
43,2025-07-30-13-05-09 +0000,nypost,Incredible footage shows Russian doctors calmly perform surgery during powerful earthquake,https://nypost.com/2025/07/30/world-news/russian-doctors-perform-surgery-during-kamchatka-peninsula-earthquake/
43,2025-07-29-21-28-49 +0000,bbc,UK to recognise Palestinian state unless Israel meets conditions,https://www.bbc.com/news/articles/cpdjvn1eeplo?at_medium=RSS&at_campaign=rss
42,2025-07-30-18-06-00 +0000,wsj,Two Fed officials dissented the central bank’s decision to hold rates steady,https://www.wsj.com/economy/central-banking/fed-holds-rates-steady-but-two-officials-back-a-cut-6fc17c67
42,2025-07-29-23-16-46 +0000,nypost,Massacre at Park Avenue office tower by deranged Shane Tamura casts dark cloud on NYC’s premiere business corridor,https://nypost.com/2025/07/29/business/massacre-at-park-avenue-office-tower-by-deranged-shane-tamura-casts-dark-cloud-on-nycs-premiere-business-corridor/
42,2025-07-30-18-16-59 +0000,startribune,Workers sue Hormel alleging violations of Minnesota’s new sick and safe time law,https://www.startribune.com/workers-sue-hormel-foods-over-minnesota-sick-and-safe-time-esst-compliance/601445184
42,2025-07-29-22-12-04 +0000,nypost,NYC business leaders eye offering active shooter training to rattled workers after Shane Tamura massacre,https://nypost.com/2025/07/29/business/nyc-business-leaders-eye-offering-active-shooter-training-to-rattled-workers-after-shane-tamura-massacre/
41,2025-07-30-17-12-23 +0000,bbc,Tsunami warnings downgraded as threat to North America recedes,https://www.bbc.com/news/articles/c8ryl02p8ngo?at_medium=RSS&at_campaign=rss
41,2025-07-29-21-30-24 +0000,nypost,Ukrainian mom-to-be expecting first child after multiple miscarriages killed in Russian strike at hospital ward: report,https://nypost.com/2025/07/29/world-news/ukrainian-mom-to-be-expecting-first-child-after-multiple-miscarriages-killed-in-russian-strike-at-hospital-ward-report/
41,2025-07-29-21-02-54 +0000,bbc,"A mistaken elevator, frantic emails and a run for help - how New York shooting unfolded",https://www.bbc.com/news/articles/cy85737235go?at_medium=RSS&at_campaign=rss
41,2025-07-30-01-02-00 +0000,wsj,Possible dissents this week by Christopher Waller and Michelle Bowman would mark the first time in three decades that more than one Federal Reserve governor dissented at a policy meeting,https://www.wsj.com/economy/central-banking/fed-interest-rates-dissent-powell-trump-83f4f49e
40,2025-07-30-01-38-21 +0000,nyt,"Senate, Rejecting Whistle-Blower Alarms, Confirms Bove to Appeals Court",https://www.nytimes.com/2025/07/29/us/politics/emil-bove-confirmed-appeals-judge.html
40,2025-07-30-16-46-54 +0000,nyt,Senate Democrats Try to Force Release of Epstein Files With Little-Known Law,https://www.nytimes.com/2025/07/30/us/politics/democrats-trump-epstein-files.html
40,2025-07-30-18-13-51 +0000,nypost,Fed keeps rates unchanged — but two vote against Powell’s ‘wait-and-see’ approach,https://nypost.com/2025/07/30/business/fed-keeps-rates-unchanged-but-two-vote-against-wait-and-see-approach/
40,2025-07-30-15-55-13 +0000,nyt,"NISAR, a NASA-India Collaboration, Will Study Earth With Radar. Here’s How to Watch the Launch.",https://www.nytimes.com/2025/07/29/science/nisar-nasa-india.html
40,2025-07-30-15-56-06 +0000,nyt,Israeli Far-Right Minister Promotes Plan for Jewish Resettlement in Gaza,https://www.nytimes.com/2025/07/29/world/middleeast/israel-gaza-jewish-resettlement.html
40,2025-07-30-13-01-26 +0000,nypost,"Taxpayers on hook for $163B in project overruns, including $1.4B for NYC rail junction, Senate report shows",https://nypost.com/2025/07/30/us-news/taxpayers-on-hook-for-163-billion-worth-of-project-overruns-including-controversial-fed-renovations-senate-report-shows/
39,2025-07-30-18-05-16 +0000,nypost,Mom allegedly gunned down her children’s dad while he picked kids up at day care: ‘Let the monster die’,https://nypost.com/2025/07/30/us-news/mom-allegedly-gunned-down-her-childrens-dad-at-fl-day-care/
39,2025-07-30-18-31-33 +0000,wapo,NTSB hearing live updates: Army helicopter crew had trouble hearing air tower before D.C. plane crash,https://www.washingtonpost.com/business/2025/07/30/ntsb-dc-plane-crash-reagan-national-airport/
38,2025-07-30-04-28-33 +0000,bbc,Bowen: UK move to recognise Palestinian state is a diplomatic crowbar to revive peace process,https://www.bbc.com/news/articles/c8deme846mro?at_medium=RSS&at_campaign=rss
38,2025-07-30-16-13-23 +0000,nyt,"Pro-Palestinian Group Can Appeal U.K. Ban, Judge Rules, Citing Free Speech",https://www.nytimes.com/2025/07/30/world/europe/palestine-action-uk-ban-terrorist-court.html
38,2025-07-30-12-53-59 +0000,bbc,Lammy hopes plan to recognise Palestinian state 'will get ceasefire',https://www.bbc.com/news/articles/c23p8gl05r2o?at_medium=RSS&at_campaign=rss
38,2025-07-29-21-36-53 +0000,bbc,"New Brazil development law risks Amazon deforestation, UN expert warns",https://www.bbc.com/news/articles/cy98jqr4p0xo?at_medium=RSS&at_campaign=rss
37,2025-07-29-22-45-04 +0000,nypost,US Open to give fans an early taste of new dining options prepared by award-winning chefs,https://nypost.com/2025/07/29/business/tennis-fans-to-get-sneak-peak-on-dining-options-at-us-open/
37,2025-07-30-17-28-27 +0000,nypost,"NYC, LA suffer largest loss of workers as they flee to low-cost cities in South",https://nypost.com/2025/07/30/business/la-nyc-suffer-largest-losses-of-workers-heres-where-theyre-fleeing/
37,2025-07-30-17-30-00 +0000,wsj,European Recognition of a Palestinian State Would Leave Israel More Isolated,https://www.wsj.com/world/middle-east/european-recognition-of-a-palestinian-state-would-leave-israel-more-isolated-f1335c93
36,2025-07-30-14-00-00 +0000,startribune,"New Twin Cities area restaurant offers a fresh take on Italian food, cocktails",https://www.startribune.com/liliana-new-italian-food-restaurant-woodbury-suburbs-estelle-mario-saint-dinette/601440719
