score,pubdate,source,title,link
9,2026-04-10-05-16-41 +0000,bbc,How families can get crisis support to heat homes,https://www.bbc.com/news/articles/cy814p86gd4o?at_medium=RSS&at_campaign=rss
9,2026-04-09-19-58-00 +0000,wsj,Argentina’s Milei Eases Glacier Protections to Unlock Copper Investments,https://www.wsj.com/world/americas/argentinas-milei-eases-glacier-protections-to-unlock-copper-investments-da2ce39e?mod=pls_whats_news_us_business_f
8,2026-04-10-10-00-00 +0000,wsj,"In This Critical Part of Audits, the Accountant’s Role Is Shrinking Fast",https://www.wsj.com/cfo-journal/in-this-critical-part-of-audits-the-accountants-role-is-shrinking-fast-69c7f2bc?mod=pls_whats_news_us_business_f
8,2026-04-09-17-00-00 +0000,wsj,Dr. Bronner’s Is Still Standing on a Soapbox—and Sales Are Booming,https://www.wsj.com/business/dr-bronners-is-still-standing-on-a-soapboxand-sales-are-booming-0f413cae?mod=pls_whats_news_us_business_f
7,2026-04-09-17-39-08 +0000,nyt,I.U.C.N. Red List Moves Emperor Penguins to “Endangered”,https://www.nytimes.com/2026/04/09/climate/emperor-penguins-iucn-red-list.html
7,2026-04-10-09-02-29 +0000,nyt,This Hungarian Town Explains Why Orban Could Lose on Sunday,https://www.nytimes.com/2026/04/10/world/europe/hungary-corruption-orban-magyar-election.html
7,2026-04-09-15-50-00 +0000,wsj,Americans are paying more than ever to homeowners associations,https://www.wsj.com/economy/housing/housing-affordability-hoa-fees-d02902af
7,2026-04-09-12-55-00 +0000,wsj,U.S. Jobless Claims Rose More Than Expected Last Week,https://www.wsj.com/economy/jobs/u-s-jobless-claims-rose-more-than-expected-last-week-9918e2fd
7,2026-04-09-12-40-20 +0000,nyt,Rosamund Pike to Star in ‘Inter Alia’ on Broadway,https://www.nytimes.com/2026/04/09/theater/rosamund-pike-inter-alia-broadway.html
7,2026-04-10-06-11-34 +0000,bbc,'We should not be at the mercy of events abroad' - Starmer,https://www.bbc.com/news/articles/cly7d9rv4nro?at_medium=RSS&at_campaign=rss
5,2026-04-09-23-06-25 +0000,bbc,TV for dogs booms but are they watching?,https://www.bbc.com/news/articles/cq59leg3gp5o?at_medium=RSS&at_campaign=rss
5,2026-04-10-09-00-33 +0000,nyt,Many Venezuelans Want to Go Home. But They Can’t Get Passports.,https://www.nytimes.com/2026/04/10/world/americas/venezuelans-return-passports-trump.html
5,2026-04-09-18-56-00 +0000,wsj,Opinion | Mexico Makes Us the Villain,https://www.wsj.com/opinion/mexcio-makes-us-the-villain-a6c8375c
4,2026-04-09-13-00-00 +0000,missionlocal,As seen on the MV Cape Hudson,https://missionlocal.org/2026/04/as-seen-on-the-mv-cape-hudson/
4,2026-04-09-18-58-00 +0000,wsj,Opinion | Liquidity Isn’t Guaranteed,https://www.wsj.com/opinion/liquidity-isnt-guaranteed-76f36530?mod=rss_markets_main
3,2026-04-09-21-51-00 +0000,wsj,Opinion | The Truth About Medicare Advantage,https://www.wsj.com/opinion/medicare-advantage-trump-cms-democrats-insurance-551a7f11
3,2026-04-09-21-52-00 +0000,wsj,Opinion | In Gut We Trust?,https://www.wsj.com/opinion/in-gut-we-trust-dde164b6
3,2026-04-10-07-59-50 +0000,nyt,How Iranians Feel Now,https://www.nytimes.com/2026/04/09/world/iran-voices-vietnam-rice-artemis-nigerian-erotica.html
3,2026-04-09-14-37-33 +0000,48hills,How to catch a crab,https://48hills.org/2026/04/how-to-catch-a-crab/
