score,pubdate,source,title,link
20,2026-04-09-21-12-00 +0000,wsj,Forever Stamp Prices to Rise 5% This Summer,https://www.wsj.com/business/logistics/forever-stamp-prices-to-rise-5-this-summer-8c50744b?mod=pls_whats_news_us_business_f
20,2026-04-10-10-00-00 +0000,latimes,'The wheels are falling off the bus.' Parents scrambling as LAUSD strike date nears,https://www.latimes.com/california/story/2026-04-10/lausd-strike-threat-frustrates-parents-scrambling-for-daycare-amid-schedule-uncertainty-lost-learning
19,2026-04-09-20-26-52 +0000,nypost,"Personal assistant pleads guilty to stealing $10M from elderly Salomon Bros. exec to buy Louis Vuitton, Gucci",https://nypost.com/2026/04/09/business/personal-assistant-pleads-guilty-to-stealing-10m-from-elderly-salomon-bros-exec-to-buy-louis-vuitton-gucci/
19,2026-04-09-21-07-00 +0000,wsj,Auto & Transport Roundup: Market Talk,https://www.wsj.com/business/auto-transport-roundup-market-talk-8c614529?mod=pls_whats_news_us_business_f
19,2026-04-09-22-03-15 +0000,bbc,Hot in the city: Energy crisis tests Singapore's air-con addiction,https://www.bbc.com/news/articles/c80mxrdvkpjo?at_medium=RSS&at_campaign=rss
19,2026-04-10-00-03-43 +0000,nyt,Judge Rejects Hegseth’s Second Attempt to Restrict Reporters at Pentagon,https://www.nytimes.com/2026/04/09/business/media/judge-hegseth-pentagon-reporters-rules.html
19,2026-04-09-15-39-42 +0000,startribune,Jurors convict man for twice lobbing firebombs at Minneapolis ice cream shop displaying Pride flag,https://www.startribune.com/jurors-convict-man-for-twice-lobbing-firebombs-at-minneapolis-ice-cream-shop-within-15-hours/601663895
19,2026-04-09-23-52-22 +0000,latimes,Armored vehicle runs over detective's suspected killer as standoff comes to bizarre end,https://www.latimes.com/california/story/2026-04-09/detective-killed-in-porterville-barricade-shootout
19,2026-04-09-21-09-00 +0000,wsj,Basic Materials Roundup: Market Talk,https://www.wsj.com/business/basic-materials-roundup-market-talk-ef87fc19?mod=rss_markets_main
19,2026-04-09-22-33-48 +0000,bbc,Russia and Ukraine agree to truce for Orthodox Easter,https://www.bbc.com/news/articles/cn0wkkwev2vo?at_medium=RSS&at_campaign=rss
19,2026-04-10-07-36-00 +0000,wsj,Gold Set for Volatile Near Term But Long-Term Outlook Holds Firm,https://www.wsj.com/finance/commodities-futures/gold-edges-lower-amid-lingering-inflation-concerns-9c8555af?mod=rss_markets_main
19,2026-04-10-08-11-13 +0000,nypost,Chicago dad Alexander Kazanowski beaten to death outside bar — as police search for 4 persons of interest,https://nypost.com/2026/04/10/us-news/chicago-dad-alexander-kazanowski-beaten-to-death-outside-bar-as-police-search-for-4-persons-of-interest/
18,2026-04-09-20-09-22 +0000,nyt,Top Regent Defends Firing of Wisconsin University Leader,https://www.nytimes.com/2026/04/09/us/wisconsin-university-president-rothman-fired-testimony.html
18,2026-04-09-12-49-00 +0000,wsj,Meta Removes Law-Firm Ads Recruiting Clients to Sue It,https://www.wsj.com/tech/meta-removes-law-firm-ads-recruiting-clients-to-sue-them-50e4baef
18,2026-04-09-11-29-35 +0000,bbc,Lidl begins building its first ever pub,https://www.bbc.com/news/articles/cy814qd9j95o?at_medium=RSS&at_campaign=rss
18,2026-04-10-01-00-00 +0000,wsj,Why Gulf Nations Would Bear the Brunt of Hormuz Tolls,https://www.wsj.com/world/middle-east/why-gulf-nations-would-bear-the-brunt-of-hormuz-tolls-9df1f28a?mod=rss_markets_main
18,2026-04-10-09-00-00 +0000,wsj,"Insurers Take Bigger Risks Than Before 2008-09 Crisis, Report Warns",https://www.wsj.com/finance/insurers-take-bigger-risks-than-before-2008-09-crisis-report-warns-dfc611a0?mod=rss_markets_main
18,2026-04-09-16-17-24 +0000,nypost,UK teen jailed for gun threat over wrong sauce at chicken shop,https://nypost.com/2026/04/09/world-news/uk-teen-jailed-for-gun-threat-over-wrong-sauce-at-chicken-shop/
18,2026-04-09-16-12-42 +0000,wapo,"In Texas, a state hearing on social studies becomes a clash of religions",https://www.washingtonpost.com/nation/2026/04/09/texas-muslims-terrorism-education/
18,2026-04-09-22-19-00 +0000,nypost,How antisemitic professors — including Mayor Zohran Mamdani’s father — have ‘poisoned’ Columbia University,https://nypost.com/2026/04/09/world-news/how-antisemitic-professors-have-poisoned-columbia-university/
18,2026-04-09-22-30-42 +0000,latimes,"'Grappler' deployed in high-speed pursuit through Inland Empire that ended in crash, possible suicide",https://www.latimes.com/california/story/2026-04-09/theft-suspect-dies-after-jurupa-valley-chase-grappler-attempt
18,2026-04-09-18-57-51 +0000,nypost,California gov candidates pile on as Eric Swalwell misconduct rumors swirl,https://nypost.com/2026/04/09/us-news/dems-pile-on-as-eric-swalwell-misconduct-rumors-swirl/
18,2026-04-09-15-01-19 +0000,nyt,America’s Furniture Stores Struggle to Survive a Frozen Housing Market,https://www.nytimes.com/2026/04/09/business/furniture-stores-housing-market-crisis.html
18,2026-04-09-15-05-15 +0000,bbc,French far-right leader romantically linked to Italian princess,https://www.bbc.com/news/articles/clye1288l8no?at_medium=RSS&at_campaign=rss
18,2026-04-10-09-03-31 +0000,nyt,Democrats Eying 2028 Presidential Runs Court Black Voters,https://www.nytimes.com/2026/04/10/us/politics/eying-2028-ambitious-democrats-court-black-voters.html
18,2026-04-09-17-03-02 +0000,nyt,5 Takeaways From the U.S. Push Against the Far Left,https://www.nytimes.com/2026/04/09/us/politics/5-takeaways-trump-antifa.html
18,2026-04-09-13-25-00 +0000,wsj,Why Green Energy Makes More Sense With Each Price Shock,https://www.wsj.com/business/energy-oil/why-green-energy-makes-more-sense-with-each-price-shock-ab7d95ce?mod=pls_whats_news_us_business_f
17,2026-04-09-11-39-56 +0000,bbc,Al Jazeera condemns killing of journalist in Israeli strike in Gaza,https://www.bbc.com/news/articles/cg40nqzvwq2o?at_medium=RSS&at_campaign=rss
17,2026-04-10-01-32-00 +0000,wsj,Bank of Korea Keeps Rates Unchanged as Mideast Uncertainty Persists,https://www.wsj.com/economy/central-banking/bank-of-korea-keeps-interest-rates-unchanged-as-mideast-uncertainty-persists-ad37e343
17,2026-04-09-16-27-06 +0000,latimes,Woman stabbed to death in Sylmar; suspect in custody,https://www.latimes.com/california/story/2026-04-09/woman-stabbed-to-death-in-sylmar-killer-remains-at-large
17,2026-04-09-15-42-26 +0000,nyt,F.B.I. Arrests Ex-Fort Bragg Employee Accused of Leaking Classified Information to Journalist,https://www.nytimes.com/2026/04/09/us/army-leaker-fbi-arrest-courtney-williams.html
17,2026-04-09-21-26-11 +0000,latimes,Karen Bass seeks council approval of $360-million allocation for affordable housing,https://www.latimes.com/california/story/2026-04-09/karen-bass-seeks-city-council-approval-for-360-million-affordable-housing-using-mansion-tax-funding
17,2026-04-10-08-00-00 +0000,cbc,What to expect ahead of Artemis II’s splashdown,https://www.cbc.ca/news/science/artemisii-return-splashdown-9.7157857?cmp=rss
17,2026-04-09-11-00-05 +0000,nyt,The First Race of the L.A. Olympics: Buying Tickets,https://www.nytimes.com/2026/04/09/us/the-first-race-of-the-la-olympics-buying-tickets.html
17,2026-04-09-13-56-14 +0000,bbc,Four people die trying to board boat in Channel crossing attempt,https://www.bbc.com/news/articles/cgmenyllyz7o?at_medium=RSS&at_campaign=rss
17,2026-04-09-19-18-44 +0000,nypost,"Amazon generating $15B in AI revenue, CEO Andy Jassy says",https://nypost.com/2026/04/09/business/amazon-generating-15b-in-ai-revenue-ceo-andy-jassy-says/
17,2026-04-09-10-39-00 +0000,wsj,Value or Growth Aren’t Your Only Options,https://www.wsj.com/finance/stocks/value-or-growth-arent-your-only-options-3519006d?mod=rss_markets_main
17,2026-04-09-22-57-33 +0000,nyt,"3 Russian Submarines Detected Near Britain Were Spying, U.K. Says",https://www.nytimes.com/2026/04/09/world/europe/uk-russia-submarines-cables.html
17,2026-04-09-23-00-00 +0000,cbc,Artemis II in photos: around the moon and inside Orion,https://www.cbc.ca/news/science/artemis-ii-mission-best-photographs-9.7158039?cmp=rss
16,2026-04-09-18-45-00 +0000,wsj,6 of the Best Financial Advisor Companies: Well-Known Fiduciary Investment Firms to Consider,https://www.wsj.com/buyside/personal-finance/financial-advisors/best-financial-advisors?mod=rss_markets_main
16,2026-04-09-19-28-00 +0000,wsj,Crude Futures End Volatile Session Higher,https://www.wsj.com/finance/commodities-futures/oil-rises-on-renewed-supply-disruption-concerns-bebf8664?mod=rss_markets_main
16,2026-04-10-08-36-35 +0000,nypost,"USPS is set to suspend pension contributions, seeks 4-cent stamp price hike",https://nypost.com/2026/04/10/us-news/usps-set-to-suspend-pension-contributions-seeks-4-cent-stamp-price-hike/
16,2026-04-10-07-44-37 +0000,startribune,"Twins sweep four-game series from Tigers behind Mick Abel’s pitching, Brooks Lee’s hitting",https://www.startribune.com/minnesota-twins-beat-detroit-tigers-brooks-lee-mick-abel-josh-bell-home-run/601637762
16,2026-04-09-18-00-44 +0000,nyt,Supreme Court Secrecy Includes Reasons for Recusal,https://www.nytimes.com/2026/04/09/us/the-docket-recusals-rap-battles.html
16,2026-04-10-09-30-00 +0000,wsj,WSJ Readers Share Their Top Tips for Switching to an EV,https://www.wsj.com/business/autos/wsj-readers-share-their-top-tips-for-switching-to-an-ev-4dfe3a16?mod=pls_whats_news_us_business_f
16,2026-04-09-13-12-45 +0000,bbc,"Amazon to end support for older Kindles, prompting user outcry",https://www.bbc.com/news/articles/c98k91yy4z4o?at_medium=RSS&at_campaign=rss
16,2026-04-09-11-00-00 +0000,wsj,Why Tubi Is Betting on AI to Win Over Gen Z Viewers,https://www.wsj.com/cio-journal/why-tubi-is-betting-on-ai-to-win-over-gen-z-viewers-778b07fc?mod=pls_whats_news_us_business_f
16,2026-04-09-14-12-00 +0000,wsj,Royal Bank to Launch Canadian Growth Fund,https://www.wsj.com/finance/investing/royal-bank-to-launch-canadian-growth-fund-2fd5f0f3?mod=rss_markets_main
16,2026-04-10-08-00-00 +0000,cbc,Saab dangles sovereign data centre in Montreal to undercut F-35 fighter contract,https://www.cbc.ca/news/politics/saab-lockheed-martin-fighters-data-defence-9.7157673?cmp=rss
16,2026-04-09-22-28-09 +0000,nyt,Florida Attorney General Investigates OpenAI and ChatGPT Over F.S.U. Shooting,https://www.nytimes.com/2026/04/09/us/florida-openai-chatgpt-fsu-shooting-investigation.html
15,2026-04-09-15-02-00 +0000,wsj,BlackBerry Looks Beyond Automotive to Power Growth Ambitions,https://www.wsj.com/business/earnings/blackberry-signals-fy27-revenue-expansion-07c18b36?mod=pls_whats_news_us_business_f
15,2026-04-09-14-20-42 +0000,bbc,US warns citizens to reconsider Nigeria travel on safety grounds,https://www.bbc.com/news/articles/c5ylq03evjzo?at_medium=RSS&at_campaign=rss
15,2026-04-09-14-24-00 +0000,wsj,Dollar Extends Losses Slightly After Key U.S. Data,https://www.wsj.com/finance/currencies/asian-currencies-consolidate-amid-fragile-u-s-iran-cease-fire-8a264ac8?mod=rss_markets_main
15,2026-04-10-06-56-00 +0000,wsj,Raiffeisen Takeover Target Addiko Gets Higher Offer From Slovenia’s NLB,https://www.wsj.com/finance/banking/raiffeisen-takeover-target-addiko-gets-higher-offer-from-slovenias-nlb-c4cca391?mod=rss_markets_main
15,2026-04-09-19-12-55 +0000,nyt,Michigan Man Is Arrested in Disappearance of Wife in Bahamas,https://www.nytimes.com/2026/04/09/world/americas/missing-woman-husband-overboard-bahamas.html
15,2026-04-09-17-58-02 +0000,nyt,"No, Britain Is Not Having a Christian Revival",https://www.nytimes.com/2026/04/09/world/europe/britain-christian-revival-survey.html
15,2026-04-09-13-00-00 +0000,wsj,American Is the Latest Airline to Raise Baggage Fees,https://www.wsj.com/business/airlines/american-is-the-latest-airline-to-raise-baggage-fees-e2c0b896?mod=pls_whats_news_us_business_f
15,2026-04-09-22-33-19 +0000,48hills,Why is the City Attorney’s Office ‘investigating’ a leaked document? It’s unprecedented and alarming,https://48hills.org/2026/04/why-is-the-city-attorneys-office-investigating-a-leaked-document-its-unprecedented-and-alarming/
15,2026-04-09-22-23-30 +0000,nyt,Strained Postal Service Proposes Price Increases and Delays Retirement Funds,https://www.nytimes.com/2026/04/09/us/politics/postal-service-prices-retirement-funds.html
15,2026-04-09-21-30-00 +0000,startribune,What you need to know about Michelin and its Minneapolis debut,https://www.startribune.com/what-you-need-to-know-about-michelin-and-its-minneapolis-debut/601663532
15,2026-04-10-00-11-18 +0000,nyt,Intelligence Court Renews Section 702 Surveillance Program,https://www.nytimes.com/2026/04/09/us/politics/section-702-surveillance-fisa.html
15,2026-04-09-20-48-42 +0000,latimes,Lego heist foiled: $1 million in stolen bricks recovered en route to Riverside County,https://www.latimes.com/california/story/2026-04-09/1m-in-stolen-lego-intercepted-en-route-to-riverside-county-3-arrested
15,2026-04-09-20-09-35 +0000,nyt,A Maker of Pet Toys in Ukraine Turns to Killer Drones,https://www.nytimes.com/2026/04/09/world/europe/ukraine-defense-technology-companies.html
15,2026-04-09-23-07-36 +0000,latimes,"Small plane crashes on Catalina Island; both aboard are killed, officials say",https://www.latimes.com/california/story/2026-04-09/plane-crash-lands-on-catalina-island-killing-2-officials-say
14,2026-04-09-13-52-43 +0000,bbc,Hawaii doctor found guilty of trying to kill wife on hike,https://www.bbc.com/news/articles/cx2we6733jvo?at_medium=RSS&at_campaign=rss
14,2026-04-09-12-38-00 +0000,wsj,Inside the Race to Protect Submarine Cables From Sabotage,https://www.wsj.com/tech/inside-the-race-to-protect-submarine-cables-from-sabotage-c90ba18c
14,2026-04-10-10-00-00 +0000,nypost,How Silicon Valley is testing employees’ AI usage,https://nypost.com/2026/04/10/business/how-silicon-valley-is-testing-employees-ai-usage/
14,2026-04-10-02-22-00 +0000,wsj,U.K. Retail Sales Growth Miss Estimates,https://www.wsj.com/economy/u-k-retail-sales-growth-miss-estimates-9f27b192
14,2026-04-10-01-10-00 +0000,wsj,Justice Department Opens Investigation Into NFL,https://www.wsj.com/sports/football/nfl-investigation-justice-department-8835a936?mod=pls_whats_news_us_business_f
14,2026-04-09-18-05-00 +0000,wsj,Sazerac Eyes Deal With Jack Daniel’s Maker Brown-Forman,https://www.wsj.com/business/sazerac-eyes-deal-with-jack-daniels-maker-brown-forman-26458c8b?mod=pls_whats_news_us_business_f
14,2026-04-10-08-00-00 +0000,cbc,"Immigration Department informing some 30,000 applicants they may be ineligible for refugee hearings",https://www.cbc.ca/news/politics/immigration-thirty-thousand-ineligible-asylum-9.7158489?cmp=rss
14,2026-04-09-16-42-34 +0000,bbc,Greens launch local election campaign with focus on housing,https://www.bbc.com/news/articles/cj0v1qdd45no?at_medium=RSS&at_campaign=rss
14,2026-04-09-18-18-25 +0000,cbc,"Floor-crossers support core Liberal values, Carney says",https://www.cbc.ca/news/politics/carney-floor-crossers-values-9.7157849?cmp=rss
14,2026-04-10-09-52-39 +0000,bbc,Airport issues travel guidance as Irish fuel protests continue,https://www.bbc.com/news/articles/cy814wypp5go?at_medium=RSS&at_campaign=rss
14,2026-04-09-16-26-57 +0000,nyt,"David B. Cornstein, Envoy Who Built U.S. Ties to Orban, Dies at 87",https://www.nytimes.com/2026/04/09/us/politics/david-cornstein-dead.html
14,2026-04-10-00-07-00 +0000,wsj,"When Bill Ackman Vented Over $2 Million, Fellow Billionaires Rushed to Commiserate",https://www.wsj.com/articles/bill-ackman-x-elon-musk-trump-dei-cf9d9dc0?mod=pls_whats_news_us_business_f
14,2026-04-10-08-26-28 +0000,nypost,"Chick-fil-A worker, 18, finds $10K in restaurant bathroom and returns it to its owner",https://nypost.com/2026/04/10/us-news/north-carolina-chick-fil-a-worker-18-finds-10k-in-restroom-and-returns-it/
14,2026-04-09-10-41-00 +0000,wsj,Ares Management to Buy Whitestone REIT in $1.7 Billion Deal,https://www.wsj.com/business/deals/ares-management-to-buy-whitestone-reit-in-1-7-billion-deal-5d44464d?mod=pls_whats_news_us_business_f
13,2026-04-10-02-26-47 +0000,nypost,William Floyd’s Vidal Macchia chasing best of both worlds in tennis and running,https://nypost.com/2026/04/09/sports/william-floyds-vidal-macchia-chasing-best-of-both-worlds-in-tennis-and-running/
13,2026-04-09-13-12-00 +0000,wsj,U.K. Says It Foiled Secret Russian Submarine Operation,https://www.wsj.com/world/europe/u-k-says-it-foiled-secret-russian-submarine-operation-774cc794
13,2026-04-09-23-04-32 +0000,bbc,EU fingerprint and photo travel rules come into force,https://www.bbc.com/news/articles/c39rkpe8mj2o?at_medium=RSS&at_campaign=rss
13,2026-04-09-22-38-23 +0000,nypost,Who is eligible for the draft? Everything to know about the US’ proposed military plans,https://nypost.com/us-news/us-military-draft-enlistment-explained/
13,2026-04-09-17-14-05 +0000,latimes,"Woodland Hills couple stabbed by their son, LAPD says",https://www.latimes.com/california/story/2026-04-09/woodland-hills-couple-stabbed-by-their-son-lapd-says
13,2026-04-09-17-49-38 +0000,nyt,137-Year-Old Piece of Eiffel Tower to Be Auctioned in Paris,https://www.nytimes.com/2026/04/09/world/europe/eiffel-tower-auction.html
13,2026-04-09-17-34-22 +0000,missionlocal,Bayview Buzz: How to drink wine and meet D10’s would-be supervisors,https://missionlocal.org/2026/04/bayview-buzz-new-gym/
13,2026-04-09-14-51-15 +0000,nyt,San Quentin Uses Sports as Rehabilitation. It Could Soon Be a Model Elsewhere.,https://www.nytimes.com/2026/04/09/us/california-team-sports-prison.html
13,2026-04-10-07-44-48 +0000,startribune,Wild likely to start playoffs on road after blowing third-period lead in 5-4 loss at Dallas,https://www.startribune.com/wild-appear-set-to-start-playoffs-on-road-after-blowing-third-period-lead-in-5-4-loss-at-dallas/601637382
13,2026-04-09-16-50-50 +0000,nypost,Woke Canadian lawmaker ridiculed for casually dropping absurd ‘MMIWG2SLGBTQQIA+’ acronym,https://nypost.com/2026/04/09/world-news/woke-canadian-pol-ridiculed-for-dropping-mmiwg2slgbtqqia-acronym/
12,2026-04-09-16-47-07 +0000,nypost,Anthropic loses bid to temporarily block Pentagon blacklisting,https://nypost.com/2026/04/09/business/anthropic-loses-bid-to-temporarily-block-pentagon-blacklisting/
12,2026-04-10-08-56-00 +0000,wsj,Taiwan Exports Accelerate Sharply in March Despite Mideast Tensions,https://www.wsj.com/economy/trade/taiwan-exports-accelerate-sharply-in-march-despite-mideast-tensions-25fb58fd
12,2026-04-09-15-58-00 +0000,wsj,"‘Euphoria,’ HBO’s Gen Z Wasteland, Is Back After Four Years. Everything Has Changed.",https://www.wsj.com/arts-culture/television/euphoria-hbos-teenage-wasteland-is-back-after-four-years-everything-has-changed-3f788d99?mod=pls_whats_news_us_business_f
12,2026-04-10-09-02-28 +0000,nyt,Masked Men in San Francisco Offer Cash for Signatures on Ballot Initiatives,https://www.nytimes.com/2026/04/10/us/san-francisco-ballot-signatures-california-masks.html
12,2026-04-09-18-00-00 +0000,cbc,Nuclear heat keeps people warm in many countries. Why not ours?,https://www.cbc.ca/news/climate/what-on-earth-nuclear-district-heating-9.7157291?cmp=rss
12,2026-04-09-22-42-59 +0000,latimes,L.A. officials raise alarms over crippling Olympic costs: 'Bankruptcy cannot be the legacy',https://www.latimes.com/california/story/2026-04-09/los-angeles-officials-raise-alarms-over-crippling-summer-olympics-costs
12,2026-04-10-01-27-44 +0000,nyt,What to Know About the U.S. Military Draft Pool and Automatic Registration,https://www.nytimes.com/2026/04/09/us/us-military-draft-automatic-registration-war.html
12,2026-04-10-10-00-00 +0000,latimes,How thousands of sensitive LAPD files got leaked online — and what happens next,https://www.latimes.com/california/story/2026-04-10/lapd-sensitive-files-leak-explained
12,2026-04-10-10-00-00 +0000,latimes,"SoCal in for a windy, rainy weekend, with possible dust storms at Coachella",https://www.latimes.com/california/story/2026-04-10/southern-california-weather-wind-rain-dust-storms-coachella
12,2026-04-09-21-45-09 +0000,nypost,Finance chief exits xAI in wake of SpaceX merger,https://nypost.com/2026/04/09/business/finance-chief-exits-xai-in-wake-of-spacex-merger/
12,2026-04-09-12-24-32 +0000,bbc,Caf president would welcome corruption investigation,https://www.bbc.com/sport/football/articles/cwyk7rk097yo?at_medium=RSS&at_campaign=rss
12,2026-04-09-21-46-00 +0000,wsj,"Opinion | U.S. Fiscal Reality: Medicaid Rises 10%, Defense Only 4%",https://www.wsj.com/opinion/donald-trump-budget-spending-medicaid-defense-cbo-e4241d33
11,2026-04-09-17-58-52 +0000,nyt,Volkswagen to End E.V. Production at Tennessee Plant,https://www.nytimes.com/2026/04/09/business/volkswagen-electric-vehicles-id4-chattanooga.html
11,2026-04-10-04-59-37 +0000,startribune,"Review: Despite illness, Lady Gaga wows with maximalist spectacle in St. Paul",https://www.startribune.com/lady-gaga-michael-polansky-grand-casino-arena/601658652
11,2026-04-10-09-02-37 +0000,nyt,"Consumer Spending, Engine of the U.S. Economy, Is Under Strain",https://www.nytimes.com/2026/04/10/business/economy/consumer-spending-economy.html
11,2026-04-09-17-05-35 +0000,nyt,At Least One Dead After Parking Garage Partially Collapses in Philadelphia,https://www.nytimes.com/2026/04/09/us/garage-collapse-philadelphia.html
11,2026-04-09-19-18-32 +0000,nyt,Questions About N.C. Stabbing Suspect’s Mental Illness Loom Over Case,https://www.nytimes.com/2026/04/09/us/charlotte-rail-stabbing-decarlos-brown-iryna-zarutska.html
11,2026-04-10-07-55-01 +0000,nyt,Here’s the latest.,https://www.nytimes.com/live/2026/04/10/world/iran-war-trump-israel-lebanon/heres-the-latest
11,2026-04-09-21-19-00 +0000,wsj,Opinion | Religion Belongs in American History Class,https://www.wsj.com/opinion/religion-belongs-in-american-history-class-a7533e72
11,2026-04-10-00-25-29 +0000,startribune,Red Lake Nation College receives ‘transformational’ $7M grant from MacKenzie Scott,https://www.startribune.com/red-lake-nation-college-mackenzie-scott-7-million-gift-endowment-seven-generations/601664391
11,2026-04-10-00-30-13 +0000,nyt,"Rodolfo Acuña, 93, Forthright Scholar at Forefront of Chicano Studies, Dies",https://www.nytimes.com/2026/04/09/us/rodolfo-acuna-dead.html
11,2026-04-09-15-32-44 +0000,nyt,The Hit Erotica Writers Outwitting Nigeria’s Religious Censors,https://www.nytimes.com/2026/04/09/world/africa/nigeria-erotica-writers-censors.html
11,2026-04-10-09-02-43 +0000,nyt,TSA Lines Are Shorter. The World Cup and a Lengthy Shutdown Could Change That.,https://www.nytimes.com/2026/04/10/travel/tsa-lines-shutdown-pay-world-cup.html
10,2026-04-09-23-02-13 +0000,bbc,Spreading Islamist insurgency dominates Benin's presidential campaign,https://www.bbc.com/news/articles/c75k1631e75o?at_medium=RSS&at_campaign=rss
10,2026-04-09-21-36-00 +0000,wsj,Opinion | Don’t Renew a Sanctions Break for Russia,https://www.wsj.com/opinion/russia-oil-sanctions-treasury-scott-bessent-iran-energy-prices-3c083ec0?mod=pls_whats_news_us_business_f
10,2026-04-09-12-00-00 +0000,missionlocal,People We Meet: Nigel Poor’s prison-life podcast is coming to S.F.,https://missionlocal.org/2026/04/sf-nigel-poor-prison-life-podcast-toni-rembe/
10,2026-04-09-23-44-51 +0000,nyt,Cannes Film Festival Lineup Spotlights Almodóvar and Other Heavyweights,https://www.nytimes.com/2026/04/09/movies/cannes-film-festival-lineup.html
10,2026-04-10-05-14-37 +0000,bbc,"Furniture poverty on the rise, charity says",https://www.bbc.com/news/articles/cp8d5mn8gyeo?at_medium=RSS&at_campaign=rss
10,2026-04-09-21-13-31 +0000,48hills,Screen Grabs: Balboa Theater hits 100—and honors a costuming legend,https://48hills.org/2026/04/screen-grabs-balboa-theater-hits-100-and-honors-a-costuming-legend/
10,2026-04-09-10-35-30 +0000,bbc,Key Indian state polls begin in test for Modi's party,https://www.bbc.com/news/articles/c5yv8p4zvd0o?at_medium=RSS&at_campaign=rss
10,2026-04-10-09-24-00 +0000,wsj,"Sodexo Shares Tumble on Earnings Miss, Lowered Outlook",https://www.wsj.com/business/retail/sodexo-shares-tumble-on-earnings-miss-lowered-outlook-bef6eb88?mod=pls_whats_news_us_business_f
10,2026-04-09-11-00-00 +0000,wsj,Behind a Former Hartbeat CEO’s Bet on BuzzFeed Channels,https://www.wsj.com/cmo-today/behind-a-former-hartbeat-ceos-bet-on-buzzfeed-channels-adee1205?mod=pls_whats_news_us_business_f
10,2026-04-09-10-52-23 +0000,bbc,Argentina passes bill loosening protection of its glaciers,https://www.bbc.com/news/articles/c5y72e6x554o?at_medium=RSS&at_campaign=rss
10,2026-04-10-04-31-09 +0000,bbc,Shoppers feel crunch as price of produce climbs,https://www.bbc.com/news/articles/c4gxp0mjpl8o?at_medium=RSS&at_campaign=rss
9,2026-04-10-09-02-45 +0000,nyt,Why Beauty and Ugliness Go Hand in Hand,https://www.nytimes.com/2026/04/10/arts/beauty-ugliness-renaissance-bozar-center-for-fine-arts.html
9,2026-04-09-18-00-00 +0000,wsj,The Secret to Getting More Women to Play Golf,https://www.wsj.com/sports/golf/women-in-golf-business-networking-f8916ed0?mod=pls_whats_news_us_business_f
9,2026-04-09-15-00-00 +0000,wsj,The Case for Investing in Emerging Markets,https://www.wsj.com/finance/investing/investing-emerging-markets-76f3a78c?mod=rss_markets_main
9,2026-04-09-21-48-00 +0000,wsj,Opinion | Sonia Sotomayor Profiles Brett Kavanaugh,https://www.wsj.com/opinion/sonia-sotomayor-brett-kavanaugh-professionals-supreme-court-35b0456d
9,2026-04-09-21-46-35 +0000,nyt,Zelensky Sees Small Window for Peace,https://www.nytimes.com/2026/04/09/world/europe/ukraine-russia-war-peace-talks.html
9,2026-04-10-09-03-38 +0000,nyt,"To Fill Air Traffic Controller Shortage, F.A.A. Turns to Gamers",https://www.nytimes.com/2026/04/10/us/politics/air-traffic-controller-gamer.html
9,2026-04-10-00-50-21 +0000,bbc,"Hip-hop pioneer, Afrika Bambaataa,  dies aged 68",https://www.bbc.com/news/articles/c2evppm30p7o?at_medium=RSS&at_campaign=rss
9,2026-04-10-06-28-20 +0000,nypost,Stony Brook women’s lacrosse team looking to make more history,https://nypost.com/2026/04/10/sports/stony-brook-womens-lacrosse-team-looking-to-make-more-history/
