score,pubdate,source,title,link
36,2025-07-29-19-04-30 +0000,nyt,Israeli Settler Kills Palestinian Activist Included in Oscar-Winning Documentary,https://www.nytimes.com/2025/07/29/world/middleeast/israeli-settler-palestinian-killed.html
36,2025-07-30-06-31-56 +0000,nyt,Here is what the different tsunami alerts mean.,https://www.nytimes.com/2025/07/30/world/asia/tsunami-alerts-meaning.html
35,2025-07-30-18-12-44 +0000,nyt,See How Often Two Fed Governors Have Dissented on a Rate Change Vote,https://www.nytimes.com/2025/07/30/business/economy/fed-rate-dissent-powell.html
35,2025-07-30-18-55-00 +0000,wsj,"The U.S. economy returned to growth in the second quarter, but signs of weakness emerged in the first half of the year",https://www.wsj.com/economy/us-gdp-q2-2025-359c022b
34,2025-07-29-23-53-32 +0000,nyt,U.S. and China Fail to Reach Immediate Deal to Prolong Trade Truce,https://www.nytimes.com/2025/07/29/world/europe/us-china-trade-deal-talks-tariffs.html
34,2025-07-29-21-18-56 +0000,wapo,"More than 60,000 people killed in Gaza war, local health officials say",https://www.washingtonpost.com/world/2025/07/29/gaza-death-toll-60000/
34,2025-07-29-21-45-05 +0000,nyt,Ghislaine Maxwell Lawyer Says She Will Only Testify for Immunity or Clemency,https://www.nytimes.com/2025/07/29/us/politics/ghislaine-maxwell-epstein-testimony.html
34,2025-07-30-02-10-29 +0000,latimes,California's top prosecutor floats pathway to boost Democrats in Congress,https://www.latimes.com/politics/story/2025-07-29/california-democrats-new-congressional-maps-november-ballot-special-election-bonta-newsom-trump
34,2025-07-30-15-22-12 +0000,nypost,Grim new allegations detail how Melina Frattolin’s dad hid her body after drowning her,https://nypost.com/2025/07/30/us-news/grim-new-allegations-detail-how-melina-frattolins-dad-hid-her-body-after-drowning-her/
33,2025-07-30-18-17-39 +0000,nypost,DoorDash driver saves Blackstone employee from NYC shooter Shane Tamura’s rampage,https://nypost.com/2025/07/30/us-news/doordash-driver-saves-blackstone-employee-from-shane-tamuras-midtown-shooting/
33,2025-07-29-23-04-33 +0000,bbc,What will the new banknotes look like?,https://www.bbc.com/news/articles/ckgy7j02xzro?at_medium=RSS&at_campaign=rss
33,2025-07-30-15-19-05 +0000,bbc,The delicate politics behind the UK's move on Palestinian statehood,https://www.bbc.com/news/articles/cp8z7pnp892o?at_medium=RSS&at_campaign=rss
33,2025-07-30-11-07-36 +0000,wapo,What to do if there’s a tsunami warning,https://www.washingtonpost.com/nation/2025/07/30/russia-earthquake-tsunami-warning-advice/
33,2025-07-30-09-27-00 +0000,wsj,Eurozone Economy Shows Signs of Resilience Even as Tariffs Bite,https://www.wsj.com/economy/french-economy-picks-up-pace-in-fresh-sign-of-europes-resilience-576f7bf9
32,2025-07-30-18-21-52 +0000,bbc,"Seven more die from malnutrition in Gaza, Hamas-run ministry says",https://www.bbc.com/news/articles/cx2x813jm0zo?at_medium=RSS&at_campaign=rss
32,2025-07-30-04-35-38 +0000,nyt,Wednesday Briefing: U.K. May Recognize a Palestinian State,https://www.nytimes.com/2025/07/30/briefing/britain-palestinian-state-gaza-us-tsunami-warning-ukraine-russia-trump.html
32,2025-07-30-11-12-27 +0000,nypost,Thousands of Ozzy Osbourne fans line the streets of Birmingham ahead of Black Sabbath star’s funeral procession,https://nypost.com/2025/07/30/world-news/thousands-of-ozzy-osbourne-fans-line-the-streets-of-birmingham-ahead-of-black-sabbath-stars-funeral-procession/
32,2025-07-29-20-07-00 +0000,wsj,U.K. Gives Israel Ultimatum on Palestinian State Recognition,https://www.wsj.com/world/middle-east/u-k-gives-israel-ultimatum-on-palestinian-state-recognition-c2418bcc
32,2025-07-29-21-01-26 +0000,nyt,Wednesday Briefing: The U.K. May Recognize a Palestinian State,https://www.nytimes.com/2025/07/29/briefing/britain-palestinian-state-china-us-trade.html
31,2025-07-30-16-22-47 +0000,cbc,Israeli minister hints at annexing parts of Gaza as hunger-related deaths mount,https://www.cbc.ca/news/world/gaza-israeli-minister-hunger-deaths-1.7597359?cmp=rss
31,2025-07-30-17-48-20 +0000,nypost,Nebraska plant explosion killed 2 girls and an employee as firefighters continue to battle flames a day later,https://nypost.com/2025/07/30/us-news/nebraska-plant-explosion-killed-2-girls-and-an-employee-as-firefighters-continue-to-battle-flames-a-day-later/
31,2025-07-30-18-14-31 +0000,nyt,U.S. Economy Slowed in First Half of 2025 as Tariffs Scrambled Data,https://www.nytimes.com/2025/07/30/business/us-economy-grew-in-second-quarter-as-tariffs-scrambled-data.html
31,2025-07-29-20-46-00 +0000,wsj,S&P 500 Breaks Winning Streak After U.S.-China Meeting Ends Without a Deal,https://www.wsj.com/finance/stocks/s-p-500-breaks-winning-streak-after-u-s-china-meeting-ends-without-a-deal-2b46423c?mod=rss_markets_main
30,2025-07-29-21-51-43 +0000,bbc,BBC presses UK foreign secretary on timing of recognising Palestinian state,https://www.bbc.com/news/videos/c9d0lj9q9j6o?at_medium=RSS&at_campaign=rss
30,2025-07-30-17-50-07 +0000,nypost,"Epilepsy, depression meds found at home of NYC shooter Shane Tamura: sources",https://nypost.com/2025/07/30/us-news/epilepsy-depression-meds-found-at-home-of-nyc-shooter-shane-tamura-sources/
30,2025-07-29-21-34-00 +0000,wsj,The New ‘Perfect Combination’: The Reese’s Oreo Cup? The Oreo Reese’s Cookie?,https://www.wsj.com/business/retail/the-new-perfect-combination-the-reeses-oreo-cup-the-oreo-reeses-cookie-99624045?mod=pls_whats_news_us_business_f
30,2025-07-30-06-20-00 +0000,wsj,What to Know About the Tsunami Warnings,https://www.wsj.com/us-news/what-to-know-about-the-tsunami-warnings-dd0ddfd1
29,2025-07-30-13-25-48 +0000,wapo,"Gaza airdrops deliver a fraction of what trucks could, aid groups warn",https://www.washingtonpost.com/world/2025/07/31/gaza-airdrop-aid-trucks-food-humanitarian/
29,2025-07-29-21-37-34 +0000,nypost,Two ‘treasured’ Barbie designers killed in head-on crash in Italy,https://nypost.com/2025/07/29/world-news/top-barbie-designers-killed-in-italy-car-crash/
29,2025-07-29-19-46-33 +0000,bbc,Watch: How did Gaza get to the brink of starvation?,https://www.bbc.com/news/videos/cjey0v4xjz9o?at_medium=RSS&at_campaign=rss
29,2025-07-29-20-40-55 +0000,latimes,Deal allows Metro to move forward on subway car plans ahead of Olympics,https://www.latimes.com/california/story/2025-07-29/metro-can-move-forward-on-subway-car-plans-ahead-of-olympics-after-deal
29,2025-07-30-17-30-37 +0000,nyt,Ozzy Osbourne’s Coffin Is Taken Through His Hometown’s Streets Before Funeral,https://www.nytimes.com/2025/07/30/arts/music/ozzy-osbourne-funeral-procession-birmingham.html
29,2025-07-30-18-02-04 +0000,wapo,Fed keeps rates steady but warns about slowing economic growth,https://www.washingtonpost.com/business/2025/07/30/fed-rates-hold-steady/
29,2025-07-30-18-54-47 +0000,startribune,Live: Cyberattacks like the one in St. Paul cost U.S. cities millions of dollars,https://www.startribune.com/st-paul-mn-cyber-attack/601446327
29,2025-07-30-13-55-03 +0000,nyt,What to Know About the Pacific Tsunami,https://www.nytimes.com/2025/07/30/us/tsunami-what-where-damage.html
28,2025-07-30-13-24-25 +0000,nyt,"A Seaside Refuge in Gaza, Torn Apart by an Israeli Strike",https://www.nytimes.com/2025/07/30/world/middleeast/gaza-cafe-strike.html
28,2025-07-30-18-19-04 +0000,latimes,California's economy is already getting hit by immigration raids,https://www.latimes.com/business/story/2025-07-30/people-reporting-to-work-in-private-sector-in-california-down-after-raids-report-says
28,2025-07-30-11-52-13 +0000,nyt,The First Soda in Space: When NASA Got Caught Up in the Cola Wars,https://www.nytimes.com/2025/07/29/science/coke-pepsi-nasa-space-shuttle.html
28,2025-07-30-04-00-46 +0000,nyt,"Ozzy Osbourne Funeral Procession to Be Held in His Hometown on Wednesday, City Says",https://www.nytimes.com/2025/07/29/arts/music/ozzy-osbourne-funeral-procession.html
27,2025-07-30-04-00-41 +0000,wapo,Leading genocide scholars see a genocide happening in Gaza,https://www.washingtonpost.com/world/2025/07/30/israel-genocide-gaza-scholars-historians/
27,2025-07-30-18-20-31 +0000,nyt,"Horst Mahler, 89, Dies; Voice of the German Far Left, Then the Far Right",https://www.nytimes.com/2025/07/30/world/europe/horst-mahler-dead.html
27,2025-07-29-21-08-26 +0000,nyt,Republicans Unveil Aviation Safety Bill Before D.C. Crash Hearings,https://www.nytimes.com/2025/07/29/us/politics/aviation-safety-bill-dca-crash-hearings.html
26,2025-07-30-17-56-01 +0000,nypost,This NYC neighborhood the most plagued by puppy poop in 2025: ‘Getting out of hand’,https://nypost.com/2025/07/30/lifestyle/the-nyc-neighborhood-is-the-most-plagued-by-puppy-poop-in-2025/
26,2025-07-29-20-39-34 +0000,nypost,Starbucks still struggling as coffee giant’s same-store sales drop for 6th straight quarter,https://nypost.com/2025/07/29/business/starbucks-posts-steeper-than-expected-drop-in-global-sales-on-tepid-demand/
26,2025-07-30-10-00-50 +0000,wapo,"Germany, long tightfisted, goes on a spending spree with new budget",https://www.washingtonpost.com/world/2025/07/30/germany-long-tightfisted-goes-spending-spree-with-new-budget/
26,2025-07-29-22-59-52 +0000,latimes,Shooting at Granada Hills day care wounds 2 women; suspect arrested,https://www.latimes.com/california/story/2025-07-29/shooter-fires-at-granada-hills-daycare-2-adults-transported-to-hospital
26,2025-07-29-21-26-10 +0000,latimes,SoCal residents visiting Reno for bachelor party were among victims of mass shooting,https://www.latimes.com/california/story/2025-07-29/socal-residents-among-victims-reno-mass-shooting
26,2025-07-30-15-31-26 +0000,nypost,US economy rebounds more than expected — with GDP growing 3% despite tariffs,https://nypost.com/2025/07/30/business/gdp-grew-at-surprising-3-rate-in-second-quarter/
26,2025-07-30-14-49-23 +0000,bbc,Family and fans give Ozzy Osbourne emotional send-off,https://www.bbc.com/news/articles/cn5ew3x3963o?at_medium=RSS&at_campaign=rss
26,2025-07-30-10-40-25 +0000,nyt,"In Kamchatka, Epicenter of the Russian Earthquake, Seismic Activity Is Common",https://www.nytimes.com/2025/07/30/world/asia/kamchatka-earthquake.html
25,2025-07-30-13-28-48 +0000,nyt,What Would Recognizing a Palestinian State Mean?,https://www.nytimes.com/2025/07/29/world/middleeast/palestinian-statehood-israel.html
25,2025-07-30-18-22-00 +0000,wsj,Opinion | The Specter of Chaos in New York,https://www.wsj.com/opinion/the-specter-of-chaos-in-new-york-mamdani-luigi-trial-case-protest-8e160b86
25,2025-07-30-14-58-14 +0000,startribune,Exclusive Duluth country club hopes to build more than two dozen members-only homes,https://www.startribune.com/duluth-northland-country-club-build-homes-bed-and-breakfast-for-members-only-minnesota/601444994
25,2025-07-29-23-51-00 +0000,wsj,A routine move to pass bipartisan policing bills turned into a heated exchange between Democrats,https://www.wsj.com/politics/policy/cory-booker-accuses-democratic-colleagues-of-being-complicit-in-trump-agenda-637c3249
24,2025-07-30-12-35-18 +0000,nyt,Starbucks Earnings Show Same-Store Sales Slid Amid Turnaround Effort,https://www.nytimes.com/2025/07/29/business/starbucks-earnings-turnaround.html
24,2025-07-29-21-15-36 +0000,nypost,"KPMG shuts office, tells staff to stay home after deadly Midtown shooting",https://nypost.com/2025/07/29/business/kpmg-shuts-office-tells-staff-to-stay-home-after-deadly-midtown-shooting/
24,2025-07-29-19-09-37 +0000,nypost,Wegovy maker Novo’s profit warning wipes out $70B in market value after shares plunge 30%,https://nypost.com/2025/07/29/business/wegovy-maker-novos-profit-warning-wipes-out-70b-in-market-value-after-shares-plunge-30/
24,2025-07-29-19-40-00 +0000,wsj,Ghislaine Maxwell Says She’d Answer Congress’s Questions if She Gets Immunity or Clemency,https://www.wsj.com/politics/policy/epstein-ghislaine-maxwell-congress-testimony-response-c6a89bbb
23,2025-07-30-18-12-15 +0000,bbc,What does recognising a Palestinian state mean?,https://www.bbc.com/news/articles/cvgp5z1vvj5o?at_medium=RSS&at_campaign=rss
23,2025-07-30-08-00-00 +0000,wsj,China Politburo Holds off on Further Stimulus,https://www.wsj.com/world/china/china-politburo-holds-off-on-further-stimulus-bfeeccbe
23,2025-07-30-16-15-43 +0000,nyt,Confirmation Slowdown Forces a Senate Showdown,https://www.nytimes.com/2025/07/30/us/senate-confirmation-slowdown.html
23,2025-07-30-18-11-30 +0000,nypost,Washington Post editorial slams Obama judge for blocking ‘fair and square’ GOP defunding of Planned Parenthood,https://nypost.com/2025/07/30/media/washington-post-slams-judge-for-blocking-trump-from-defunding-of-planned-parenthood/
23,2025-07-30-15-27-46 +0000,bbc,"Palestine Action can challenge UK ban, court rules",https://www.bbc.com/news/articles/cqlerg1n67no?at_medium=RSS&at_campaign=rss
23,2025-07-30-16-01-11 +0000,nyt,"What the Fed’s Rate Decision Means for Loans, Credit Cards, Mortgages and More",https://www.nytimes.com/2025/07/30/business/fed-interest-rate-loans-mortgages.html
23,2025-07-30-17-36-13 +0000,nypost,Arizona political battle over border rages as local governments choose whether to cooperate with ICE,https://nypost.com/2025/07/30/us-news/border-county-republicans-say-trump-policies-improve-security-while-democrats-cite-cruelty/
23,2025-07-30-18-23-00 +0000,wsj,Opinion | Gaza Starvation Photos Tell a Thousand Lies,https://www.wsj.com/opinion/gaza-starvation-photos-tell-a-thousand-lies-palestine-israel-aid-1d689cc8?mod=pls_whats_news_us_business_f
23,2025-07-30-11-00-01 +0000,startribune,It’s not just you. Here’s why Twin Cities road work is ‘more intense’ this summer.,https://www.startribune.com/its-not-just-you-heres-why-twin-cities-road-work-is-more-intense-this-summer/601445148
23,2025-07-30-10-52-13 +0000,nyt,Mercedes and Porsche Squeezed by U.S. Tariffs and Slowdown in China,https://www.nytimes.com/2025/07/30/business/mercedes-porsche-tariffs.html
23,2025-07-29-23-12-02 +0000,latimes,'We'll see you in court': L.A. County wants to bar ICE agents from concealing identity,https://www.latimes.com/california/story/2025-07-29/well-see-you-in-court-l-a-county-plans-to-bar-federal-immigration-agents-from-concealing-their-identity
23,2025-07-29-19-48-18 +0000,bbc,Can Starmer's Palestinian pledge be more than symbolic gesture?,https://www.bbc.com/news/articles/ckgd0y1yknmo?at_medium=RSS&at_campaign=rss
23,2025-07-30-11-00-00 +0000,wsj,"Women Now Occupy Almost a Fifth of Top Venture Roles, Study Finds",https://www.wsj.com/articles/women-now-occupy-almost-a-fifth-of-top-venture-roles-study-finds-8339aadb?mod=pls_whats_news_us_business_f
22,2025-07-30-10-00-00 +0000,latimes,"Who is Kim Yo Jong, sister and 'right hand' of North Korean leader Kim Jong Un?",https://www.latimes.com/world-nation/story/2025-07-30/who-is-kim-yo-jong-the-younger-sister-and-so-called-right-hand-of-north-korean-leader-kim-jong-un
22,2025-07-30-12-48-31 +0000,bbc,"Russian missile hits Ukrainian training unit, killing and wounding servicemen",https://www.bbc.com/news/articles/cwyeg1l00rno?at_medium=RSS&at_campaign=rss
22,2025-07-30-15-28-47 +0000,nypost,"Zohran Mamdani, back from Uganda, dodges questions after meeting with slain NYPD cop Didarul Islam’s family",https://nypost.com/2025/07/30/us-news/zohran-mamdani-back-from-uganda-dodges-questions-after-meeting-with-slain-nypd-cop-didarul-islams-family/
22,2025-07-30-16-13-11 +0000,nypost,Risky raccoon leaps for life into Reno floodwaters in fur-raising footage: ‘Don’t let it die!’,https://nypost.com/2025/07/30/us-news/risky-raccoon-leaps-for-life-into-reno-floodwaters-in-fur-raising-footage-dont-let-it-die/
22,2025-07-29-21-45-00 +0000,wsj,Top Justice Department Antitrust Officials Fired Amid Internal Feud,https://www.wsj.com/us-news/law/top-justice-department-antitrust-officials-fired-amid-internal-feud-0c98d57c
22,2025-07-29-23-32-00 +0000,wsj,Shane Tamura’s Descent From High-School Football Standout to Gunman,https://www.wsj.com/us-news/shane-tamura-new-york-shooting-suspect-1b10aeb4
22,2025-07-30-09-00-45 +0000,wapo,"60,000 Gazans have been killed. 18,500 were children. These are their names.",https://www.washingtonpost.com/world/interactive/2025/israel-gaza-war-children-death-toll/
22,2025-07-29-23-13-56 +0000,nyt,Union Pacific to Buy Norfolk Southern in $85 Billion Railroad Deal,https://www.nytimes.com/2025/07/29/business/union-pacific-norfolk-southern-merger.html
22,2025-07-30-18-31-33 +0000,wapo,"During a public hearing on July 30, the National Transportation Safety Board released an animation of...",https://www.washingtonpost.com
22,2025-07-30-03-00-00 +0000,wsj,Stronger Than Fentanyl: A Drug You’ve Never Heard of Is Killing Hundreds Every Year,https://www.wsj.com/health/healthcare/nitazenes-opioid-drug-crisis-ded1a3b9
22,2025-07-30-16-30-37 +0000,nyt,Why Airdrops in Gaza Are Seen as a Risky Last Resort,https://www.nytimes.com/2025/07/29/world/middleeast/gaza-airdrops.html
22,2025-07-30-16-09-16 +0000,nyt,N.C. Republicans Push Through Contested Agenda on ‘Veto Override Day’,https://www.nytimes.com/2025/07/29/us/politics/veto-overrides-north-carolina.html
22,2025-07-30-17-26-51 +0000,nyt,House Democrats Sue ICE for Barring Them From Detention Facilities,https://www.nytimes.com/2025/07/30/us/politics/house-democrats-ice-lawsuit.html
21,2025-07-30-04-20-00 +0000,wsj,Singapore’s Central Bank Stands Pat as U.S. Tariffs Loom,https://www.wsj.com/economy/central-banking/singapores-central-bank-leaves-monetary-policy-untouched-as-tariffs-loom-2dffceb9
21,2025-07-30-16-33-33 +0000,wapo,"Birmingham lays to rest Ozzy Osbourne, hard-rocking, bat-biting, native son",https://www.washingtonpost.com/world/2025/07/30/ozzy-osbourne-birmingham-funeral-black-sabbath/
21,2025-07-29-20-29-05 +0000,nypost,EPA chief Lee Zeldin to repeal ‘holy grail’ Obama-era emissions finding that hiked energy costs for years,https://nypost.com/2025/07/29/us-news/epa-chief-lee-zeldin-to-repeal-holy-grail-obama-era-emissions-finding-that-hiked-energy-costs-for-years/
21,2025-07-30-00-27-54 +0000,nyt,Senate Confirms Susan Monarez as C.D.C. Director,https://www.nytimes.com/2025/07/29/us/politics/susan-monarez-cdc-director.html
21,2025-07-30-10-00-00 +0000,wapo,More Americans are car poor as they misjudge trade-in math and pile on debt,https://www.washingtonpost.com/business/2025/07/30/underwater-car-loans-new-record-q2/
21,2025-07-29-23-00-19 +0000,bbc,Russian soldiers scammed and robbed of war cash on return from Ukraine,https://www.bbc.com/news/articles/cr5rm41g34qo?at_medium=RSS&at_campaign=rss
20,2025-07-29-21-19-48 +0000,nyt,NYC Gunman Brings Issue of C.T.E. to NFL’s Door,https://www.nytimes.com/2025/07/29/us/nyc-shooting-gunman-nfl-cte.html
20,2025-07-30-16-53-51 +0000,nypost,"DOJ teases details about Jeffrey Epstein, Ghislaine Maxwell testimony it wants released",https://nypost.com/2025/07/30/us-news/doj-urges-release-of-jeffrey-epstein-ghislaine-maxwell-grand-jury-testimony/
20,2025-07-30-18-02-21 +0000,nypost,Virginia city councilman set on fire by maniac who dumped 5-gallon bucket of gas on him,https://nypost.com/2025/07/30/us-news/virginia-city-councilman-lee-vogler-set-on-fire-by-maniac-who-dumped-5-gallon-bucket-of-gas-on-him/
20,2025-07-30-16-27-18 +0000,nyt,"Laura Dahlmeier, Gold Medal-Winning German Biathlete, Dies in Rockfall",https://www.nytimes.com/2025/07/30/world/asia/laura-dahlmeier-olympian-died-accident-pakistan.html
20,2025-07-30-17-05-17 +0000,nyt,U.S. Imposes Sanctions on Brazilian Judge Overseeing Bolsonaro Coup Case,https://www.nytimes.com/2025/07/30/world/americas/trump-sanctions-brazil-judge-bolsonaro.html
20,2025-07-30-13-31-00 +0000,wsj,KKR Pushes Further Into Healthcare With Deal for Pharma Royalty Business,https://www.wsj.com/business/deals/kkr-deal-hcrx-healthcare-royalty-partners-3ec04516?mod=pls_whats_news_us_business_f
20,2025-07-30-16-57-37 +0000,nyt,Pilots for Army Black Hawk Discussed Changing Course Before Crash,https://www.nytimes.com/2025/07/30/us/politics/black-hawk-reagan-crash-transcripts.html
20,2025-07-30-16-04-18 +0000,nyt,"Key Hurricane-Monitoring Data Will Stay Online, Officials Say",https://www.nytimes.com/2025/07/30/climate/hurricane-monitoring-data-defense-department.html
20,2025-07-30-12-55-37 +0000,bbc,Air India watchdog audit reveals 51 safety violations,https://www.bbc.com/news/articles/c93d7115l31o?at_medium=RSS&at_campaign=rss
20,2025-07-30-10-17-24 +0000,nyt,University of California Settles With Jewish Students Over U.C.L.A. Protests,https://www.nytimes.com/2025/07/29/us/ucla-jewish-students-settlement.html
19,2025-07-30-16-12-55 +0000,wapo,"U.S. economy posts strong second quarter, growing at 3% pace",https://www.washingtonpost.com/business/2025/07/30/gdp-q2-economy-tariffs/
19,2025-07-30-01-07-38 +0000,nyt,Grassley Spurns Whistle-Blowers in Bove Confirmation Fight,https://www.nytimes.com/2025/07/29/us/politics/grassley-whistle-blowers-emil-bove.html
19,2025-07-30-01-00-00 +0000,wsj,Why Israel and Hamas Won’t Stop Fighting,https://www.wsj.com/world/middle-east/israel-hamas-gaza-war-86a119f3
19,2025-07-29-22-45-00 +0000,wsj,"Inside the Nightmare at 345 Park Avenue, a Manhattan Office Tower Under Attack",https://www.wsj.com/us-news/inside-the-nightmare-at-345-park-avenue-a-manhattan-office-tower-under-attack-ed85c878
19,2025-07-30-16-02-47 +0000,nypost,"Chile returns $125,000 in luxury watches stolen from Keanu Reeves by South America-based crime ring",https://nypost.com/2025/07/30/world-news/chile-hands-luxury-watches-stolen-from-keanu-reeves-over-to-the-fbi/
19,2025-07-29-21-18-00 +0000,wsj,Midtown Shooting Suspect Leaves Suicide Note Targeting NFL,https://www.wsj.com/us-news/nyc-midtown-shooting-nypd-investigation-shane-tamura-3b8f5393
19,2025-07-30-17-34-17 +0000,nyt,"Canada’s Measles Cases Surpass U.S., Alberta Officials Push for State of Emergency",https://www.nytimes.com/2025/07/30/world/canada/canada-alberta-measles-outbreak.html
19,2025-07-30-16-36-49 +0000,bbc,More than a dozen children die because of food shortages in Sudan camp - medics,https://www.bbc.com/news/articles/c2en72kvy00o?at_medium=RSS&at_campaign=rss
19,2025-07-30-10-44-00 +0000,bbc,Adidas to raise prices as US tariffs costs rise by €200m,https://www.bbc.com/news/articles/cjey0zv1pkqo?at_medium=RSS&at_campaign=rss
19,2025-07-30-15-30-57 +0000,nypost,Democrat Mikie Sherrill holds single-digit lead over Jack Ciattarelli in NJ gov race: poll,https://nypost.com/2025/07/30/us-news/democrat-mikie-sherrill-holds-single-digit-lead-over-jack-ciattarelli-in-nj-gov-race-poll/
19,2025-07-29-21-35-00 +0000,wsj,Palo Alto Networks Nears Over $20 Billion Deal for Cybersecurity Firm CyberArk,https://www.wsj.com/business/deals/palo-alto-networks-nears-over-20-billion-deal-for-cybersecurity-firm-cyberark-046aa047?mod=pls_whats_news_us_business_f
18,2025-07-30-18-17-38 +0000,nypost,Tragic cause of death revealed for 9-year-old girl who died at Hersheypark wave pool,https://nypost.com/2025/07/30/us-news/tragic-cause-of-death-revealed-for-9-year-old-girl-who-died-at-hersheypark-wave-pool/
18,2025-07-30-16-17-55 +0000,nyt,Delta Pilot Arrested in Cockpit Faces 24 Felonies in Child Sex Case,https://www.nytimes.com/2025/07/30/us/delta-pilot-child-sex-abuse-charges.html
18,2025-07-29-23-16-59 +0000,latimes,"Tasmanian devils arrive at L.A. Zoo: Danny Zuko and Crush have ferocious bite, bad table manners",https://www.latimes.com/california/story/2025-07-29/two-tasmanian-devils-arrive-at-los-angeles-zoo
18,2025-07-30-08-23-00 +0000,wsj,Global Markets Mixed as Investors Digest Tariff Impact on Earnings,https://www.wsj.com/finance/global-markets-mixed-as-investors-digest-tariff-impact-on-earnings-f24c009b?mod=rss_markets_main
18,2025-07-30-14-48-30 +0000,startribune,Twins shortstop Carlos Correa could be on trade market despite obstacles,https://www.startribune.com/twins-shortstop-carlos-correa-mlb-trade-deadline/601446324
18,2025-07-29-22-18-58 +0000,nyt,Arkansas Police Release Photo of ‘Person of Interest’ in Killing of Couple,https://www.nytimes.com/2025/07/29/us/person-of-interest-killing-devils-den-arkansas.html
18,2025-07-30-06-20-49 +0000,bbc,Football coach Priestman 'felt unsafe' in Canada after spying ban,https://www.bbc.com/sport/football/articles/c207ne1g705o?at_medium=RSS&at_campaign=rss
17,2025-07-29-21-48-00 +0000,wsj,Opinion | Keir Starmer Has Conditions for Israel,https://www.wsj.com/opinion/keir-starmer-palestinian-state-israel-hamas-labour-party-u-k-b842a601
17,2025-07-29-21-27-59 +0000,bbc,Watch: Fighter jet swerves dramatically to avoid birds near packed beach,https://www.bbc.com/news/videos/clyr2qx0y87o?at_medium=RSS&at_campaign=rss
17,2025-07-29-22-03-18 +0000,nyt,Satellite Image Shows Gazans Mobbing Aid Trucks,https://www.nytimes.com/2025/07/29/world/middleeast/gaza-satellite-aid-truck-famine.html
17,2025-07-30-10-00-11 +0000,wapo,NASA workforce cuts raise fears about safety for space missions,https://www.washingtonpost.com/business/2025/07/30/nasa-cuts-safety-concerns-spacex/
17,2025-07-29-23-40-59 +0000,nypost,"Jasmine Crockett blasts AOC, Bernie Sanders for self-serving ‘Fighting Oligarchy’ tour: ‘Oh, it’s about them’",https://nypost.com/2025/07/29/us-news/jasmine-crockett-blasts-aoc-and-bernie-sanders-fighting-oligarchy-tour-as-self-serving/
17,2025-07-30-12-42-45 +0000,bbc,India and US launch 'first-of-its-kind' satellite,https://www.bbc.com/news/articles/cy98jnreqvvo?at_medium=RSS&at_campaign=rss
17,2025-07-30-11-13-15 +0000,nyt,In Conversation with Brazil’s President Lula,https://www.nytimes.com/video/world/americas/100000010309751/in-conversation-with-brazils-president-lula.html
17,2025-07-30-12-30-21 +0000,bbc,Millions of Americans advised to stay indoors due to triple-digit heatwave,https://www.bbc.com/news/articles/c80dl731pk1o?at_medium=RSS&at_campaign=rss
17,2025-07-30-03-00-00 +0000,wsj,How China Is Girding for an AI Battle With the U.S.,https://www.wsj.com/tech/ai/how-china-is-girding-for-an-ai-battle-with-the-u-s-5b23af51
