score,pubdate,source,title,link
36,2026-04-10-10-00-00 +0000,nypost,Mamdani’s viral campaign promises sputter out in first 100 days: ‘Big difference between campaigning and governing’,https://nypost.com/2026/04/10/us-news/mamdanis-viral-campaign-promises-sputter-out-in-first-100-days-big-difference-between-campaigning-governing/
36,2026-04-09-20-58-00 +0000,wsj,Stocks Climb After Cease-Fire Optimism Builds,https://www.wsj.com/finance/stocks/stocks-climb-after-cease-fire-optimism-builds-a4dfc3b5?mod=rss_markets_main
35,2026-04-09-20-51-00 +0000,wsj,CarMax Will Add Two Board Members After Talks With Activist Investor Starboard,https://www.wsj.com/business/retail/carmax-will-add-two-board-members-after-talks-with-activist-investor-starboard-f7882e20?mod=pls_whats_news_us_business_f
35,2026-04-09-13-54-13 +0000,cbc,K-pop supergroup BTS kick off world tour in South Korea after 4-year hiatus,https://www.cbc.ca/news/entertainment/bts-world-tour-begins-9.7157375?cmp=rss
35,2026-04-10-08-53-17 +0000,nyt,Xi Meets Taiwan Opposition Leader for First Time in a Decade,https://www.nytimes.com/2026/04/10/world/asia/taiwan-china-xi-cheng.html
34,2026-04-09-16-45-24 +0000,nypost,"First of 3 novels from showbiz vet Rob Shuter — who once repped Diddy, JLo — set to come out this month",https://nypost.com/2026/04/09/media/first-of-3-novels-from-showbiz-vet-rob-shuter-who-once-repped-diddy-jlo-set-to-come-out-this-month/
34,2026-04-10-10-00-00 +0000,nypost,CFTC chair Michael Selig is all-in on prediction markets — but warns there has to be aggressive protection against ‘insider trading’,https://nypost.com/2026/04/10/business/cftc-chair-michael-selig-on-prediction-markets/
34,2026-04-10-02-32-27 +0000,bbc,White House staff told not to place bets on prediction markets,https://www.bbc.com/news/articles/cgld65x396go?at_medium=RSS&at_campaign=rss
34,2026-04-09-23-00-00 +0000,wsj,"When Gas Prices Rise, They’re Hard to Bring Down. Here’s Why.",https://www.wsj.com/finance/commodities-futures/when-gas-prices-rise-theyre-hard-to-bring-down-heres-why-23e23bc1?mod=rss_markets_main
34,2026-04-09-11-54-46 +0000,bbc,Will UK petrol and diesel prices start going down?,https://www.bbc.com/news/articles/c20zgjzz0e4o?at_medium=RSS&at_campaign=rss
33,2026-04-09-15-48-41 +0000,startribune,Report: Rep. Kelly Morrison’s late disclosure of trades put her in violation of Stock Act,https://www.startribune.com/rep-kelly-morrisons-late-disclosure-of-millions-in-trades-puts-her-in-violation-of-stock-act/601663554
33,2026-04-09-15-45-16 +0000,bbc,Jo Malone hopes 'sense will prevail' in lawsuit over her name,https://www.bbc.com/news/articles/c7471n0lm2vo?at_medium=RSS&at_campaign=rss
33,2026-04-09-16-05-18 +0000,nypost,American Airlines to raise checked bag fees: Here’s what you need to know,https://nypost.com/2026/04/09/business/american-airlines-raises-checked-bag-fees-trims-economy-perks-amid-soaring-fuel-prices/
33,2026-04-09-19-52-33 +0000,nypost,Ex-Sen. Ben Sasse on the ‘nasty drug’ for Stage 4 cancer that makes him ‘bleed out of a whole bunch of parts’,https://nypost.com/2026/04/09/health/ex-sen-ben-sasse-opens-up-about-life-with-stage-4-cancer/
33,2026-04-09-20-07-08 +0000,bbc,Petrol and diesel prices rise again as concerns grow over ceasefire,https://www.bbc.com/news/articles/cq6j0rnvlzeo?at_medium=RSS&at_campaign=rss
32,2026-04-09-20-36-41 +0000,bbc,OpenAI pauses UK data centre deal over energy costs and regulation,https://www.bbc.com/news/articles/clyd032ej70o?at_medium=RSS&at_campaign=rss
32,2026-04-09-20-54-05 +0000,nyt,White House and Crypto Industry Fight Bank Lobby Over Stablecoin Income,https://www.nytimes.com/2026/04/09/business/white-house-crypto-stablecoins-interest.html
32,2026-04-09-22-07-49 +0000,startribune,Frey says he’ll veto Minneapolis City Council’s ouster of public safety commissioner,https://www.startribune.com/minneapolis-council-reject/601661742
32,2026-04-10-06-09-11 +0000,nypost,Texas beauty queen’s death at 17 blamed on influencer’s ‘unreasonably dangerous’ energy drink: lawsuit,https://nypost.com/2026/04/10/us-news/texas-beauty-queen-larissa-rodriguezs-death-blamed-on-alani-nu-energy-drink-lawsuit/
31,2026-04-09-15-22-40 +0000,wapo,USDA secretary’s ‘He is Risen’ Easter email unnerves some staff members,https://www.washingtonpost.com/politics/2026/04/09/usda-easter-email/
31,2026-04-10-06-41-40 +0000,bbc,This coat cost $248 in illegal tariffs. Will he ever get the money back?,https://www.bbc.com/news/articles/ckgr67kgvdko?at_medium=RSS&at_campaign=rss
31,2026-04-09-23-56-38 +0000,wapo,"Pentagon violated court order to restore press access, judge rules",https://www.washingtonpost.com/business/2026/04/09/judge-pentagon-press-access/
31,2026-04-10-02-17-23 +0000,nypost,Mayor’s shocking blackmail texts to major school district trustees over his $200M-a-year signature policy,https://nypost.com/2026/04/09/us-news/mayors-shocking-blackmail-texts-to-major-school-district-trustees-over-his-200m-a-year-signature-policy/
31,2026-04-10-10-00-00 +0000,latimes,Chabria: Wipe out a 'civilization'? Minor stuff compared with what just happened in AI,https://www.latimes.com/california/story/2026-04-10/chabria-column-anthropic-claude-mythos-preview
30,2026-04-10-09-08-00 +0000,wsj,Xi Hosts Taiwan Opposition Leader to Draw Island Closer to China,https://www.wsj.com/world/china/xi-hosts-taiwan-opposition-leader-to-draw-island-closer-to-china-3a0282e6
30,2026-04-09-22-37-56 +0000,nyt,"Student Hit by Projectile During ‘No Kings’ Protest Lost an Eye, Lawyer Says",https://www.nytimes.com/2026/04/09/us/usc-student-loses-eye-no-kings-protest.html
30,2026-04-09-22-01-32 +0000,nyt,Venezuela Approves New Law to Open Mining to Foreign Investors,https://www.nytimes.com/2026/04/09/world/americas/venezuela-mining-us.html
30,2026-04-10-01-43-20 +0000,cbc,U.K. military deployed to deter threat to undersea cables amid Russian sub presence,https://www.cbc.ca/news/world/russian-submarines-britain-military-vessels-9.7158613?cmp=rss
30,2026-04-09-21-03-14 +0000,nypost,George Santos will become a parent next year: ‘Big deal for us’,https://nypost.com/2026/04/09/us-news/george-santos-will-become-a-parent-next-year-big-deal-for-us/
30,2026-04-10-04-01-08 +0000,nyt,South African Writer Mfundi Vundla Gets Personal in His New Play,https://www.nytimes.com/2026/04/10/world/africa/south-africa-theater-generations-mfundi-vundla.html
30,2026-04-10-04-36-20 +0000,nypost,Embattled Labor Secretary Lori Chavez-DeRemer hit with discrimination complaints over response to husband’s alleged sexual misconduct,https://nypost.com/2026/04/10/us-news/embattled-labor-secretary-lori-chavez-deremer-hit-with-discrimination-complaints-over-response-to-husbands-alleged-sexual-misconduct/
30,2026-04-09-18-43-46 +0000,nypost,DOJ plots huge reality check for woke LA school policy that allegedly sparked student’s suicide,https://nypost.com/2026/04/09/us-news/justice-department-investigates-woke-la-school-policies-around-gender-secrecy/
30,2026-04-10-09-00-44 +0000,wapo,‘Crossing guard diva’ with remarkable past is a social media star in her 80s,https://www.washingtonpost.com/lifestyle/2026/04/10/crossing-guard-diva-paulette-dorflaufer/
30,2026-04-09-14-52-17 +0000,nypost,Justice Department launches bombshell NFL probe that could blow up antitrust exemption,https://nypost.com/2026/04/09/business/justice-department-probes-nfl-over-antitrust-concerns-amid-shift-to-streaming-report/
29,2026-04-09-12-26-54 +0000,nyt,How the Strait of Hormuz Stifled a Market Rally,https://www.nytimes.com/2026/04/09/business/dealbook/strait-hormuz-cease-fire-markets.html
29,2026-04-10-02-26-00 +0000,wsj,Seeing Queen Elizabeth II as the Fashion Influencer of Her Time,https://www.wsj.com/world/uk/seeing-queen-elizabeth-ii-as-the-fashion-influencer-of-her-time-42c1e840
29,2026-04-09-17-35-34 +0000,nypost,"Tesla secretly working on new, smaller, cheaper electric SUV: report",https://nypost.com/2026/04/09/business/tesla-secretly-working-on-new-smaller-cheaper-electric-suv-report/
29,2026-04-09-16-01-35 +0000,nyt,"Half of Gen Z Uses AI, but Their Feelings Are Souring, Study Shows",https://www.nytimes.com/2026/04/09/style/gen-z-ai-gallup-study.html
28,2026-04-10-00-11-00 +0000,wsj,"Middle East Conflict Testing Asia’s Economic Mettle, ADB Says",https://www.wsj.com/economy/middle-east-conflict-testing-asias-economic-mettle-adb-says-a85ec595
28,2026-04-09-14-40-00 +0000,wsj,IMF Chief Expects Slowdown on Global Economic Growth Even if Peace Is ‘Durable’,https://www.wsj.com/economy/global/imf-chief-expects-slowdown-on-global-economic-growth-even-if-peace-is-durable-e061bee2
28,2026-04-09-22-14-00 +0000,wsj,See Which Ships Are Slipping Through the Strait of Hormuz,https://www.wsj.com/business/logistics/see-which-ships-are-slipping-through-the-strait-of-hormuz-24eb931d?mod=pls_whats_news_us_business_f
28,2026-04-09-22-12-00 +0000,wapo,"U.S. fertility rate hits a new low as teenage births fall, CDC says",https://www.washingtonpost.com/nation/2026/04/09/fertility-birth-rate-low/
27,2026-04-09-18-59-00 +0000,wsj,Opinion | New Data Centers Won’t Be Draining Us Dry,https://www.wsj.com/opinion/new-data-centers-wont-be-draining-us-dry-e4dd7808?mod=pls_whats_news_us_business_f
27,2026-04-10-10-00-00 +0000,nypost,Jail boss reveals eerie trait that sets apart Gilgo Beach killer from other infamous inmates like John Gotti,https://nypost.com/2026/04/10/us-news/jail-boss-reveals-eerie-trait-that-sets-apart-gilgo-beach-killer-from-other-infamous-inmates-like-john-gotti/
27,2026-04-09-19-24-55 +0000,missionlocal,Meet the S.F. school board candidates: What is your No. 1 priority?,https://missionlocal.org/2026/04/sf-school-board-meet-the-candidates/
27,2026-04-09-14-13-23 +0000,nypost,TV news anchor who just split from journo husband given ‘ridiculous’ explanation for firing: lawyer,https://nypost.com/2026/04/09/media/tv-news-anchor-was-told-she-was-fired-because-of-her-behavior-in-the-newsroom-lawyer/
27,2026-04-10-00-13-23 +0000,bbc,Co-leader McIlroy's golf does the talking after busy Masters build-up,https://www.bbc.com/sport/golf/articles/cx24pn55dg9o?at_medium=RSS&at_campaign=rss
27,2026-04-09-10-32-37 +0000,nypost,Daughter of British billionaire killed after being thrown off motorcyle during Vietnam trip,https://nypost.com/2026/04/09/world-news/british-billionaire-andrew-wates-daughter-orla-wates-killed-after-being-thrown-of-motorcyle-during-vietnam-trip/
27,2026-04-10-09-00-08 +0000,nyt,State Judges Turn to Guns in New Era of Judicial Threats,https://www.nytimes.com/2026/04/10/us/state-judges-threats.html
26,2026-04-10-09-05-06 +0000,nyt,See You in Pyongyang: Russia Pushes Its People to Embrace North Korea,https://www.nytimes.com/2026/04/10/world/europe/russia-north-korea.html
26,2026-04-09-19-21-24 +0000,nypost,"Google’s AI Overviews spew millions of false answers per hour, bombshell study reveals",https://nypost.com/2026/04/09/business/googles-ai-overviews-spew-out-millions-of-false-answers-per-hour-bombshell-study/
26,2026-04-10-09-30-00 +0000,wsj,Meta Banks on AI to Clear the Smoke of Social-Media Lawsuits,https://www.wsj.com/tech/meta-banks-on-ai-to-clear-the-smoke-of-social-media-lawsuits-902263dc?mod=rss_markets_main
26,2026-04-10-03-14-47 +0000,nyt,Labor Secretary Faces Civil Rights Complaints From Department Staff,https://www.nytimes.com/2026/04/09/business/economy/labor-secretary-misconduct-complaints.html
26,2026-04-09-19-37-58 +0000,nypost,DOJ seeks death penalty for three MS-13 gang members indicted for murdering FBI informant,https://nypost.com/2026/04/09/us-news/doj-seeks-death-penalty-for-three-ms-13-gang-members-indicted-for-murdering-fbi-informant/
26,2026-04-09-21-00-25 +0000,bbc,Canada's Carney welcomes another defector to Liberals as he nears majority,https://www.bbc.com/news/articles/c98k9wd254xo?at_medium=RSS&at_campaign=rss
25,2026-04-09-22-33-15 +0000,missionlocal,Excelsior Buzz: New cannabis dispensary coming to Persia Triangle,https://missionlocal.org/2026/04/excelsior-buzz-cannabis-dispensary/
25,2026-04-09-18-25-02 +0000,nypost,"This sleepy, rural county has the highest gas prices in the US: Here’s why",https://nypost.com/2026/04/09/business/this-sleepy-county-has-the-highest-gas-prices-in-the-us-heres-why/
25,2026-04-10-07-09-00 +0000,wsj,Porsche Deliveries Drop in First Months of Year,https://www.wsj.com/business/autos/porsche-deliveries-drop-in-first-months-of-year-e5913481?mod=pls_whats_news_us_business_f
25,2026-04-09-16-40-38 +0000,nypost,Shocking video shows moment tour guide is killed in speedboat explosion at exotic tourist spot,https://nypost.com/2026/04/09/world-news/tour-guide-killed-after-speedboat-explodes-at-popular-thailand-tourist-spot/
25,2026-04-09-17-24-50 +0000,nypost,"Meta boots law firm ads seeking clients to sue over alleged Facebook, Instagram addiction",https://nypost.com/2026/04/09/business/meta-boots-law-firm-ads-looking-for-clients-to-sue-over-alleged-facebook-instagram-addiction/
25,2026-04-09-19-12-36 +0000,nypost,Fight brewing as controversial bill to let California state workers stay remote advances,https://nypost.com/2026/04/09/us-news/bill-to-let-california-state-workers-stay-remote-advances/
25,2026-04-09-12-23-00 +0000,wsj,More BP Investors Demand Proof That Fossil-Fuel Pivot Will Benefit Shareholders,https://www.wsj.com/pro/sustainable-business/more-bp-investors-demand-proof-that-fossil-fuel-pivot-will-benefit-shareholders-aaecea48?mod=pls_whats_news_us_business_f
25,2026-04-09-14-36-34 +0000,bbc,Payments for children and 100 new GPs in Plaid election manifesto,https://www.bbc.com/news/articles/c5y70z1q0k3o?at_medium=RSS&at_campaign=rss
25,2026-04-10-09-01-53 +0000,nyt,Soaring Fuel Prices Squeeze China’s Frugal Truckers,https://www.nytimes.com/video/world/asia/100000010809735/china-truckers-oil-fuel-prices.html
25,2026-04-10-05-09-23 +0000,bbc,SNP pledges 'first refusal' for tenants to buy private rental homes,https://www.bbc.com/news/articles/cx2e54vk0jvo?at_medium=RSS&at_campaign=rss
25,2026-04-09-21-34-52 +0000,latimes,In-N-Out owner says no to automated ordering,https://www.latimes.com/business/story/2026-04-09/in-n-out-owner-says-no-to-automated-ordering
25,2026-04-09-12-00-00 +0000,latimes,"Rebuilding permits in Altadena have picked up, but construction lags and financial woes loom",https://www.latimes.com/california/story/2026-04-09/rebuilding-permits-in-altadena-have-picked-up-but-construction-lags-financial-woes-loom
24,2026-04-09-22-19-17 +0000,nypost,Here are the companies that have fled California — including the company that’s tracking the exodus,https://nypost.com/2026/04/09/us-news/these-companies-have-shifted-their-headquarters-out-of-california/
24,2026-04-10-00-10-11 +0000,latimes,"Former SoCal school board trustee messaged teen boys, called them 'sexy,' prosecutors say",https://www.latimes.com/california/story/2026-04-09/ex-brea-olinda-unified-school-district-board-trustee-charged-with-molesting-minors
24,2026-04-09-13-32-00 +0000,wsj,Uniqlo Owner Raises Guidance Despite Middle East Disruption,https://www.wsj.com/business/earnings/uniqlo-owner-raises-guidance-despite-middle-east-disruption-3ebae7ae?mod=pls_whats_news_us_business_f
24,2026-04-09-21-04-00 +0000,wsj,"Tech, Media & Telecom Roundup: Market Talk",https://www.wsj.com/business/tech-media-telecom-roundup-market-talk-ad3cd239?mod=rss_markets_main
24,2026-04-09-23-16-02 +0000,latimes,Malibu race car driver and Porsche fanatic Doug Baron killed in Camarillo car accident,https://www.latimes.com/california/story/2026-04-09/malibu-race-car-driver-doug-baron-killed-in-camarillo-car-accident
24,2026-04-09-22-59-21 +0000,latimes,Iconic L.A. venue the Magic Castle set to reopen following roof fire,https://www.latimes.com/california/story/2026-04-09/iconic-la-venue-magic-castle-set-to-reopen-following-roof-fire
24,2026-04-09-19-49-57 +0000,cbc,'Throw them out' of Parliament: Poilievre in favour of recall petition for floor-crossers,https://www.cbc.ca/news/politics/poilievre-floor-crossing-recall-petitions-9.7157900?cmp=rss
24,2026-04-09-11-27-57 +0000,bbc,Husband arrested over disappearance of Michigan woman in Bahamas,https://www.bbc.com/news/articles/c7471lzklyko?at_medium=RSS&at_campaign=rss
24,2026-04-09-17-50-54 +0000,nyt,Lebanon Mourns After Israeli Onslaught Kills More Than 300 People,https://www.nytimes.com/2026/04/09/world/middleeast/lebanon-israel-iran-war-airstrikes.html
24,2026-04-09-18-25-17 +0000,missionlocal,"S.F. supe Matt Dorsey says he’d have deserved to be evicted for drug-use, as his legislation now proposes",https://missionlocal.org/2026/04/sf-matt-dorsey-evict-drug-use/
23,2026-04-09-22-09-11 +0000,startribune,Judge gives federal government three weeks to turn over evidence from Renee Good’s killing,https://www.startribune.com/judge-gives-federal-government-three-weeks-to-turn-over-evidence-from-renee-goods-killing/601664161
23,2026-04-10-09-22-53 +0000,nypost,Supreme Court blocks candidate after alleged GOP infiltration scheme exposed,https://nypost.com/2026/04/10/us-news/supreme-court-rejects-ohio-congressional-hopeful-samuel-ronan-from-running-as-republican/
23,2026-04-10-09-00-14 +0000,nyt,How Airlines Turned First-Class Seats From Freebies to a Profit Engine,https://www.nytimes.com/2026/04/10/business/airlines-first-class-seats-tickets-upgrades.html
23,2026-04-09-16-00-45 +0000,wapo,First major Atlantic hurricane season outlook calls for below-average activity,https://www.washingtonpost.com/weather/2026/04/09/hurricane-season-forecast-el-nino-2026/
23,2026-04-09-21-00-29 +0000,nyt,"Victim in ICE Shooting Suffered at Least Six Wounds, His Lawyer Says",https://www.nytimes.com/2026/04/09/us/ice-shooting-california-victim-wounds.html
23,2026-04-09-23-49-23 +0000,cbc,Poilievre challenges PM Carney to defend private property rights in B.C. in wake of Cowichan decision,https://www.cbc.ca/news/canada/british-columbia/pierre-poilievre-conservatives-cowichan-decision-9.7158000?cmp=rss
23,2026-04-10-10-00-00 +0000,latimes,GOP's best shot at California governor's office in decades mired in angry internal debate,https://www.latimes.com/california/story/2026-04-10/republicans-angrily-vie-for-best-shot-at-governors-office-in-decades
22,2026-04-09-17-09-57 +0000,bbc,UK says Russia ran submarine operation over cables and pipelines,https://www.bbc.com/news/articles/cre13qn9z7do?at_medium=RSS&at_campaign=rss
22,2026-04-09-19-01-49 +0000,startribune,Lakeville hotel that lost its Hampton Inn contract during ICE surge sold at discount,https://www.startribune.com/hotel-sold-at-discount-lost-hampton-inn-flag-during-ice-surge/601664022
22,2026-04-09-10-39-00 +0000,wsj,"Mercedes-Benz Car Sales Fall on China, Macroeconomic Challenges",https://www.wsj.com/business/autos/mercedes-benz-car-sales-fall-on-china-macroeconomic-challenges-2033b208?mod=pls_whats_news_us_business_f
22,2026-04-09-21-15-56 +0000,nyt,Greece Plans to Block Social Media for Children Under 15,https://www.nytimes.com/2026/04/08/world/europe/greece-social-media-teens.html
22,2026-04-09-20-49-00 +0000,wsj,Opinion | New England Considers the Nuclear Option,https://www.wsj.com/opinion/new-england-considers-the-nuclear-option-e046d33c?mod=pls_whats_news_us_business_f
22,2026-04-09-22-50-59 +0000,nyt,A Mexican Cartel Leader and Ex-Partner to El Mencho Pleads Guilty in U.S.,https://www.nytimes.com/2026/04/09/world/americas/mexico-cartels-el-85-guilty-plea-us.html
22,2026-04-09-19-46-38 +0000,nypost,"Trio of Russian spy submarines detected near Britain, UK says",https://nypost.com/2026/04/09/world-news/trio-of-russian-spy-submarines-detected-near-britain-uk-says/
22,2026-04-09-13-00-00 +0000,latimes,"California may be in path of a 'super' El Niño. It could bring rain, floods, coastal erosion",https://www.latimes.com/california/story/2026-04-09/california-could-get-super-el-nino-heres-what-that-means
22,2026-04-09-12-00-00 +0000,missionlocal,"S.F. to close 3 health clinics amid budget cuts, including longtime youth centers",https://missionlocal.org/2026/04/dph-cuts-sf-youth-clinics-huckleberry-larkin/
22,2026-04-10-10-00-00 +0000,latimes,"A baby uses 3,000 diapers a year. Why a state lawmaker wants parents to know how they're made",https://www.latimes.com/california/story/2026-04-10/bill-might-make-it-easier-to-know-what-your-babys-diaper-is-made-of
22,2026-04-09-13-59-24 +0000,bbc,BTS battle torrential rain to kick off $1bn world tour,https://www.bbc.com/news/articles/cq59qzzg93jo?at_medium=RSS&at_campaign=rss
22,2026-04-09-15-39-27 +0000,nyt,Brown University Keeps Police Chief Who Took Over After Shooting,https://www.nytimes.com/2026/04/09/us/brown-university-police-chief.html
22,2026-04-09-16-56-27 +0000,nypost,Gold locket gifted by Queen Victoria to her granddaughter in 1896 set to fetch over $3K,https://nypost.com/2026/04/09/world-news/gold-locket-gifted-by-queen-victoria-to-granddaughter-set-to-sell-for-over-3k-at-auction/
21,2026-04-09-12-02-28 +0000,bbc,Kenya disputes UN report on rape allegations against its Haiti personnel,https://www.bbc.com/news/articles/c1d9zrl2z03o?at_medium=RSS&at_campaign=rss
21,2026-04-10-06-01-30 +0000,nypost,"Florida woman who posed as nurse and treated more than 4,400 patients without a license avoids jail time",https://nypost.com/2026/04/10/us-news/florida-woman-autumn-bardisa-who-posed-as-nurse-and-treated-more-than-4400-patients-avoids-jail-time/
21,2026-04-09-20-00-00 +0000,latimes,"Three unions unite in massive LAUSD strike threat: What's at stake for workers, families",https://www.latimes.com/california/story/2026-04-09/three-unions-unite-in-massive-lausd-strike-threat-whats-at-stake-for-workers-families
21,2026-04-10-00-49-00 +0000,wsj,Judge Rejects Pentagon’s Revised Press Policy,https://www.wsj.com/politics/national-security/judge-rejects-pentagons-revised-press-policy-fb6d44c5?mod=pls_whats_news_us_business_f
21,2026-04-10-07-55-55 +0000,bbc,Taiwan opposition leader meets Xi Jinping in Beijing,https://www.bbc.com/news/articles/cj94y87k2ljo?at_medium=RSS&at_campaign=rss
21,2026-04-09-16-39-00 +0000,wsj,Volkswagen to End U.S. Production of Its Only American-Made EV,https://www.wsj.com/business/autos/volkswagen-to-end-u-s-production-of-id-4-its-lone-american-made-ev-b77aa7bb?mod=pls_whats_news_us_business_f
21,2026-04-10-06-48-55 +0000,bbc,Bronny James sets up father LeBron in Lakers win,https://www.bbc.com/sport/basketball/articles/cn431d7ee11o?at_medium=RSS&at_campaign=rss
21,2026-04-09-13-36-00 +0000,wsj,"7-Eleven Owner Projects Lower Annual Profit, Delays North American Unit IPO",https://www.wsj.com/business/earnings/7-eleven-owner-projects-lower-annual-profit-delays-north-american-unit-ipo-5ac76b8d?mod=pls_whats_news_us_business_f
21,2026-04-10-10-00-00 +0000,wapo,"After record highs, Colorado’s legal pot market faces a sobering gut check",https://www.washingtonpost.com/nation/2026/04/10/colorado-pot-market-decline/
21,2026-04-09-21-18-08 +0000,nypost,Amazon contractors clash with Teamsters at raucous NYC Council hearing on controversial delivery legislation,https://nypost.com/2026/04/09/business/amazon-contractors-clash-with-teamsters-at-raucous-nyc-council-hearing-on-controversial-delivery-legislation/
21,2026-04-09-20-59-00 +0000,wsj,Financial Services Roundup: Market Talk,https://www.wsj.com/business/financial-services-roundup-market-talk-0603e101?mod=rss_markets_main
20,2026-04-10-08-28-12 +0000,bbc,"US has let in 4,499 refugees since October - all but three were South African",https://www.bbc.com/news/articles/c4g89kkvenqo?at_medium=RSS&at_campaign=rss
20,2026-04-09-12-12-24 +0000,nypost,Pastor charged after grandfather of 7 drowns during baptism — and said she saw him ‘dancing with Jesus’,https://nypost.com/2026/04/09/world-news/grandfather-of-7-drowned-during-baptism-with-pastor-saying-she-saw-him-dancing-with-jesus/
20,2026-04-10-10-00-00 +0000,nypost,"Artemis II to return home Friday in nail-biting, 14-minute journey through Earth’s atmosphere",https://nypost.com/2026/04/10/us-news/artemis-ii-to-return-home-friday-in-14-minute-journey-through-earths-atmosphere/
20,2026-04-10-00-14-54 +0000,nyt,"In Germany’s East, the Far Right Could Soon Take Power. This Is Its Plan.",https://www.nytimes.com/2026/04/09/world/europe/afd-germany-saxony-anhalt-plan.html
20,2026-04-10-06-35-42 +0000,nypost,Man kicked off Malaysia Airlines flight for allegedly groping a flight attendant,https://nypost.com/2026/04/10/world-news/man-kicked-off-malaysia-airlines-flight-for-allegedly-groping-flight-attendant/
20,2026-04-10-09-09-07 +0000,nypost,Newly appointed Arkansas police chief resigns after slapping man in wheelchair in viral video,https://nypost.com/2026/04/10/us-news/newly-appointed-arkansas-police-chief-robert-ephlin-resigns-after-viral-video-caught-him-slapping-man-in-wheelchair-putting-him-in-headlock/
20,2026-04-09-16-23-15 +0000,nypost,Southwest limiting popular travel device to one per passenger as safety concerns mount,https://nypost.com/2026/04/09/business/southwest-limiting-each-passenger-to-one-portable-charger-per-flight/
20,2026-04-09-14-31-57 +0000,bbc,Canada's Mark Carney 'so proud' of astronauts in call to Artemis II,https://www.bbc.com/news/videos/cwykpw99ed2o?at_medium=RSS&at_campaign=rss
20,2026-04-09-22-33-05 +0000,nypost,Detroit offering significant cash incentives to attract newcomers and spark growth in city,https://nypost.com/2026/04/09/business/detroit-offering-significant-cash-incentives-to-attract-newcomers-and-spark-growth-in-city/
20,2026-04-09-21-40-06 +0000,nyt,A Newspaper Is Raided and a Rights Group Outlawed Amid Kremlin Crackdown,https://www.nytimes.com/2026/04/09/world/europe/russia-newspaper-rights-group-crackdown.html
20,2026-04-10-00-32-17 +0000,missionlocal,Mission District shooting leaves victim in critical condition after ‘big fight’,https://missionlocal.org/2026/04/shooting-big-fight-mission/
