score,pubdate,source,title,link
23,2026-05-06-21-23-00 +0000,wsj,"Elon Musk Wanted Tesla to Take Over OpenAI, Romantic Partner Testifies in Court",https://www.wsj.com/tech/ai/elon-musks-romantic-partner-testifies-about-her-role-on-openais-board-1fc6d89b
23,2026-05-06-20-58-20 +0000,nyt,F.B.I. Director Kash Patel Criticizes How Nancy Guthrie Case Was Handled,https://www.nytimes.com/2026/05/06/us/kash-patel-nancy-guthrie-arizona.html
23,2026-05-07-03-08-19 +0000,nypost,NJ widow accuses cemetery of burying ‘proud American’ husband in wrong grave: lawsuit,https://nypost.com/2026/05/06/us-news/nj-widow-accuses-cemetery-of-burying-proud-american-husband-in-wrong-grave-lawsuit/
22,2026-05-06-10-51-33 +0000,nyt,What We Know About ‘Project Freedom’ in the Strait of Hormuz,https://www.nytimes.com/2026/05/05/world/middleeast/trump-strait-hormuz-plan-project-freedom-iran.html
22,2026-05-06-22-28-02 +0000,nyt,Michigan’s Combative Democratic Senate Primary Heats Up,https://www.nytimes.com/2026/05/06/us/politics/michigan-senate-primary-democrats.html
22,2026-05-06-23-52-48 +0000,bbc,The no-nonsense judge calling the shots in Musk v Altman trial,https://www.bbc.com/news/articles/cx214rnlpn7o?at_medium=RSS&at_campaign=rss
22,2026-05-07-07-50-21 +0000,nypost,"Teen boy, woman shot and killed in Michigan after dispute over soccer game",https://nypost.com/2026/05/07/us-news/michigan-teen-boy-woman-killed-in-shooting-by-18-year-old-over-soccer-game-dispute/
21,2026-05-06-11-59-44 +0000,bbc,Robot wars - what an operation in Ukraine tells us about the battlefield of the near future,https://www.bbc.com/news/articles/c9d35v126vyo?at_medium=RSS&at_campaign=rss
21,2026-05-06-19-52-00 +0000,nyt,Higher Gas Prices Are Hitting Lower-Income Americans the Hardest,https://www.nytimes.com/2026/05/06/business/economy/gas-prices-inequality-lower-income-consumers.html
21,2026-05-07-06-57-35 +0000,nypost,Florida woman allegedly lured victim to luxury Miami condo — then robbed him with 2 accomplices,https://nypost.com/2026/05/07/us-news/florida-woman-nicole-cano-allegedly-lured-man-to-luxury-miami-condo-to-rob-him/
21,2026-05-07-04-50-18 +0000,bbc,Looksmaxxing influencer Clavicular charged over alleged alligator shooting,https://www.bbc.com/news/articles/c62ex04n876o?at_medium=RSS&at_campaign=rss
21,2026-05-06-22-53-55 +0000,nyt,JPMorgan Tried to Settle Harassment Accusations Against Executive,https://www.nytimes.com/2026/05/06/business/jpmorgan-rana-hajdini-harassment-lawsuit.html
21,2026-05-07-01-51-43 +0000,nypost,PETA activists encase feet in cement in protest of NY PepsiCo headquarters over bull abuse claims,https://nypost.com/2026/05/06/us-news/peta-activists-encase-feet-in-cement-in-protest-of-ny-pepsico-headquarters-over-bull-abuse-claims/
21,2026-05-07-00-39-03 +0000,missionlocal,S.F. to shutter 46-year-old school program catering to Spanish-speaking immigrant students,https://missionlocal.org/2026/05/sfusd-shuts-down-mission-education-center-newcomer-program/
21,2026-05-06-22-18-00 +0000,wsj,Warner Bros. Discovery Logs $2.92 Billion Loss Tied to Netflix Termination Fee,https://www.wsj.com/business/media/warner-bros-discovery-earnings-q1-2026-wbd-stock-07f83bc0?mod=pls_whats_news_us_business_f
21,2026-05-06-21-44-00 +0000,wsj,Basic Materials Roundup: Market Talk,https://www.wsj.com/business/basic-materials-roundup-market-talk-4819ce73?mod=rss_markets_main
21,2026-05-07-06-00-00 +0000,wsj,Henkel Sales Rise Amid Flurry of Deals,https://www.wsj.com/business/retail/henkel-sales-rise-amid-flurry-of-deals-e226d0db?mod=pls_whats_news_us_business_f
21,2026-05-07-06-25-00 +0000,wsj,"BAE Systems Backs 2026 Guidance, Citing Higher Defense Spending, Opportunities Ahead",https://www.wsj.com/business/earnings/bae-systems-backs-2026-guidance-citing-higher-defense-spending-opportunities-ahead-2705e234?mod=pls_whats_news_us_business_f
21,2026-05-06-18-50-01 +0000,startribune,Federal government turns over evidence from the shooting death of Renee Good,https://www.startribune.com/federal-government-turns-over-evidence-from-the-shooting-death-of-renee-good-for-court-review/601837483
21,2026-05-06-14-33-00 +0000,wsj,"Restaurants Show Resilience as Bloomin’, Dine Brands Post Revenue Gains",https://www.wsj.com/business/retail/restaurants-show-resilience-as-bloomin-dine-brands-post-revenue-gains-e42f5597?mod=pls_whats_news_us_business_f
20,2026-05-06-15-06-12 +0000,nypost,"2 teens arrested after Australian tourist allegedly stabbed, robbed of thousands in Thailand",https://nypost.com/2026/05/06/world-news/two-teens-arrested-after-tourist-allegedly-stabbed-robbed-in-thailand/
20,2026-05-06-19-44-01 +0000,nypost,"Famed NYC hotel reopens, shedding migrant shelter past for Times Square tourists",https://nypost.com/2026/05/06/us-news/famed-nyc-hotel-reopens-shedding-migrant-shelter-past-for-times-square-tourists/
20,2026-05-06-16-35-39 +0000,bbc,Hedge fund founder hits back at Mamdani's 'creepy' wealth tax video,https://www.bbc.com/news/articles/c9wepldnl7po?at_medium=RSS&at_campaign=rss
20,2026-05-06-12-54-37 +0000,nyt,Modi’s Triumph in West Bengal Elections Puts Him Closer to an Opposition-Free India,https://www.nytimes.com/2026/05/05/world/asia/india-modi-congress-west-bengal-elections.html
20,2026-05-06-21-39-32 +0000,bbc,"Postal vote error leaves 1,300 people without ballot papers ahead of Senedd election",https://www.bbc.com/news/articles/cdjpy3xk3v2o?at_medium=RSS&at_campaign=rss
20,2026-05-07-00-41-21 +0000,bbc,German tourist wins payout after losing sun lounger race,https://www.bbc.com/news/articles/c5y72g09d7jo?at_medium=RSS&at_campaign=rss
20,2026-05-07-00-00-00 +0000,wsj,U.S. and China Pursue Guardrails to Stop AI Rivalry From Spiraling Into Crisis,https://www.wsj.com/world/china/u-s-and-china-pursue-guardrails-to-stop-ai-rivalry-from-spiraling-into-crisis-4c50bd70
20,2026-05-06-20-17-09 +0000,cbc,Apple argues Liberals' lawful access bill could put users’ personal data at risk,https://www.cbc.ca/news/politics/apple-argues-liberals-lawful-access-bill-could-put-users-personal-data-at-risk-9.7190092?cmp=rss
20,2026-05-07-01-57-48 +0000,nyt,Susan Collins Says She Has Long Had a Benign Tremor,https://www.nytimes.com/2026/05/06/us/politics/susan-collins-tremor-maine-senate-race.html
19,2026-05-07-04-01-07 +0000,nyt,Starmer Faces a Major Test in a Set of UK Elections: What to Know,https://www.nytimes.com/2026/05/07/world/europe/uk-local-elections-starmer.html
19,2026-05-06-10-00-00 +0000,latimes,Double the vote. Students push for increased power on UC Regents board,https://www.latimes.com/california/story/2026-05-06/uc-students-push-for-aca-18-adding-a-second-voting-member-to-regents-board
19,2026-05-06-16-31-55 +0000,nypost,Gold watch used to ‘buy a spot on a Titanic lifeboat’ set to sell for $68K at auction,https://nypost.com/2026/05/06/world-news/gold-watch-used-to-buy-a-spot-on-a-titanic-lifeboat-set-to-sell-for-68k/
19,2026-05-07-09-14-51 +0000,nyt,"In Hungary, Voters Exposed the Limits of China’s Ties to Orban",https://www.nytimes.com/2026/05/07/world/europe/hungary-orban-china-fidesz-magyar.html
19,2026-05-06-12-00-25 +0000,bbc,Massive Alaska megatsunami was second largest ever recorded,https://www.bbc.com/news/articles/c1m253033m4o?at_medium=RSS&at_campaign=rss
19,2026-05-06-11-06-00 +0000,wsj,"Rubio grabs the mic, the message and the moment. Read more in today’s WSJ Politics newsletter:",https://www.wsj.com/politics/rubio-grabs-the-mic-the-message-and-the-moment-cedc5c28
19,2026-05-07-08-03-55 +0000,bbc,Top BJP leader's aide shot dead in violence after Indian state election,https://www.bbc.com/news/articles/ce8pjz7dv7ro?at_medium=RSS&at_campaign=rss
19,2026-05-07-03-04-04 +0000,nyt,Howard Lutnick Grilled by Lawmakers Over Epstein Ties,https://www.nytimes.com/2026/05/06/us/politics/howard-lutnick-jeffrey-epstein-house-oversight.html
19,2026-05-07-09-02-01 +0000,nyt,Tony Leung Doesn’t Want a Challenge. He Wants a Compatible Director.,https://www.nytimes.com/2026/05/07/movies/tony-leung-in-the-mood-for-love-silent-friend.html
18,2026-05-06-11-48-01 +0000,bbc,Which airlines are cancelling flights to the UK - and what can you do?,https://www.bbc.com/news/articles/cr41yel6v4eo?at_medium=RSS&at_campaign=rss
18,2026-05-06-17-32-42 +0000,nypost,How Burger King’s turnaround is taking a bite out of McDonald’s,https://nypost.com/2026/05/06/business/how-burger-kings-turnaround-is-taking-a-bite-out-of-mcdonalds/
18,2026-05-06-16-58-42 +0000,nypost,"US issues travel warning for gorgeous vacation destination as crime, unrest rise",https://nypost.com/2026/05/06/world-news/us-issues-travel-warning-for-gorgeous-vacation-destination-as-crime-unrest-rise/
18,2026-05-07-05-33-50 +0000,nypost,Violent teens clash with cops at NJ carnival — prompting officials to cancel beloved yearly event,https://nypost.com/2026/05/07/us-news/nj-teens-clash-with-cops-at-maple-shade-carnival-forcing-officials-to-cancel-event/
18,2026-05-07-01-16-48 +0000,nyt,The Boxing Match That Killed a Police Recruit,https://www.nytimes.com/2026/05/06/us/massachusetts-state-troopers-charged-boxing-match-death.html
18,2026-05-06-23-07-00 +0000,wsj,"DoorDash Revenue, Orders Rise as Customer Base Grows",https://www.wsj.com/business/earnings/doordash-profit-ticks-down-despite-higher-revenue-e9f65aec?mod=pls_whats_news_us_business_f
18,2026-05-07-02-15-15 +0000,nyt,Judge Says F.B.I. Can Keep 2020 Election Records Seized From Georgia,https://www.nytimes.com/2026/05/06/us/politics/judge-says-fbi-can-keep-2020-election-records-seized-from-georgia.html
18,2026-05-06-23-23-10 +0000,missionlocal,"San Francisco has almost borrowed as much money as it can, report says",https://missionlocal.org/2026/05/san-francisco-city-debt-capacity/
18,2026-05-07-00-11-00 +0000,wsj,Judge Unseals Purported Epstein Suicide Note,https://www.wsj.com/us-news/judge-unseals-purported-epstein-suicide-note-d4317ba4
18,2026-05-07-09-01-12 +0000,nyt,What Are ‘Teen Takeovers’ and Why Are Police Struggling to Stop Them?,https://www.nytimes.com/2026/05/07/us/teen-takeovers.html
17,2026-05-06-10-30-00 +0000,wsj,CVS’s Results Add to Positive Momentum for Health-Insurance Industry,https://www.wsj.com/business/earnings/cvs-health-cvs-earnings-q1-2026-61e2dea8?mod=pls_whats_news_us_business_f
17,2026-05-06-17-27-53 +0000,nypost,Berkshire Hathaway’s nearly $400B in cash reserves turn heads on Wall Street,https://nypost.com/2026/05/06/business/berkshire-hathaways-nearly-400b-in-cash-reserves-turn-heads-on-wall-street/
17,2026-05-06-18-11-14 +0000,nyt,Argentine Fans Are Struggling to Afford This World Cup,https://www.nytimes.com/video/world/americas/100000010825941/argentine-fans-are-struggling-to-afford-this-world-cup.html
17,2026-05-06-17-06-12 +0000,48hills,‘Real Bay Shit’: Nonprofit hardcore shows are planting the seeds of change,https://48hills.org/2026/05/bay-area-nonprofit-hardcore-shows-are-planting-the-seeds-of-change/
17,2026-05-06-20-25-21 +0000,nyt,"Jack Bass, Dean of South Carolina Political Journalism, Dies at 91",https://www.nytimes.com/2026/05/06/us/politics/jack-bass-dead.html
17,2026-05-07-05-15-08 +0000,bbc,The AI fitness instructors selling unreal gains,https://www.bbc.com/sport/articles/c5ye7dnxv86o?at_medium=RSS&at_campaign=rss
17,2026-05-07-09-30-00 +0000,wsj,America’s Weight-Loss Drug Boom Is Going Global,https://www.wsj.com/health/pharma/americas-weight-loss-drug-boom-is-going-global-31274935?mod=rss_markets_main
17,2026-05-06-22-41-32 +0000,nyt,"Kendall Myers, American Spy for Cuba, Dies at 88",https://www.nytimes.com/2026/05/06/us/kendall-myers-dead.html
17,2026-05-07-02-00-30 +0000,nyt,Office of Virginia State Senator Louise Lucas Searched by F.B.I. Agents,https://www.nytimes.com/2026/05/06/us/politics/louise-lucas-fbi-raid.html
17,2026-05-06-11-04-06 +0000,bbc,Vivek Ramaswamy wins Republican nomination for Ohio governor,https://www.bbc.com/news/articles/c4g0xe4qlzxo?at_medium=RSS&at_campaign=rss
17,2026-05-06-14-28-54 +0000,nypost,"Wannabe influencer gunned down at home in front of her 4 kids, shooter on the run",https://nypost.com/2026/05/06/world-news/wannabe-influencer-gunned-down-at-home-in-front-of-her-4-kids/
17,2026-05-07-05-31-00 +0000,wsj,Swiss Re Net Profit Gets Boost From Lower Natural-Catastrophe Losses,https://www.wsj.com/business/earnings/swiss-re-net-profit-gets-boost-from-lower-natural-catastrophe-losses-4835600d?mod=pls_whats_news_us_business_f
17,2026-05-06-18-51-02 +0000,nyt,Clavicular Charged With Shooting at Alligator While Livestreaming,https://www.nytimes.com/2026/05/06/us/clavicular-alligator-shooting-charges-florida.html
17,2026-05-06-21-33-00 +0000,wsj,Opinion | The Deal With the Iranian Regime,https://www.wsj.com/opinion/iran-deal-nuclear-dismantlement-donald-trump-iaea-8f507d06
17,2026-05-07-02-28-48 +0000,latimes,Push to limit traffic stops passes City Council — but LAPD policy not changing yet,https://www.latimes.com/california/story/2026-05-06/lapd-police-pretext-stops-la-city-council
17,2026-05-06-18-57-06 +0000,cbc,Why the Lebanon-Israel ceasefire is 'in name only',https://www.cbc.ca/news/world/lebanon-israel-hezbollah-ceasefire-analysis-9.7188159?cmp=rss
17,2026-05-06-15-14-00 +0000,wsj,U.S. Crude Oil Stockpiles Fall for Second Straight Week,https://www.wsj.com/business/energy-oil/u-s-crude-oil-stockpiles-fall-for-second-straight-week-544de9b7?mod=pls_whats_news_us_business_f
17,2026-05-06-10-00-00 +0000,latimes,"While ICE cracked down on L.A. protests, Marines were told to use force as 'last resort'",https://www.latimes.com/politics/story/2026-05-06/ice-protests-marines-immigration-los-angeles-use-of-force
17,2026-05-06-20-27-55 +0000,nyt,GameStop’s CEO Ryan Cohen Baffles Fans With eBay Bid,https://www.nytimes.com/2026/05/06/business/ebay-gamestop-deal-ryan-cohen.html
17,2026-05-06-19-46-44 +0000,cbc,Airbus secures 150-plane order with AirAsia in multi-billion dollar boon for Quebec aviation,https://www.cbc.ca/news/canada/montreal/carney-quebec-frechette-airasia-airbus-9.7189816?cmp=rss
16,2026-05-06-10-00-00 +0000,latimes,Tom Steyer tries to sell voters on his own personal change,https://www.latimes.com/politics/story/2026-05-06/tom-steyer-tries-to-sell-voters-on-his-own-personal-change
16,2026-05-06-12-09-05 +0000,bbc,Why did Paddington Bear need a police escort?,https://www.bbc.com/videos/cn8p9j1p3qeo?at_medium=RSS&at_campaign=rss
16,2026-05-07-01-09-53 +0000,nyt,Anthropic’s C.E.O. Says It Could Grow by 80 Times This Year,https://www.nytimes.com/2026/05/06/technology/anthropic-ceo-ai-growth.html
16,2026-05-07-00-17-39 +0000,startribune,Minnesota’s director of Missing and Murdered Indigenous Relatives Office fired,https://www.startribune.com/minnesotas-director-of-missing-and-murdered-indigenous-relatives-office-fired/601837910
16,2026-05-06-23-21-57 +0000,nyt,Justice Department Sues Colorado Over Gun Law,https://www.nytimes.com/2026/05/06/us/politics/doj-colorado-lawsuit-guns.html
16,2026-05-07-02-20-48 +0000,nypost,Illegal immigrant ID’d as attempted carjacker gunned down by Texas dad protecting his family of 8,https://nypost.com/2026/05/06/us-news/illegal-immigrant-idd-as-attempted-carjacker-gunned-down-by-texas-dad-protecting-his-family-of-8/
16,2026-05-06-21-25-05 +0000,bbc,Starmer tells civil servants to speak 'truth to power' after vetting row,https://www.bbc.com/news/articles/c5y09gl1282o?at_medium=RSS&at_campaign=rss
16,2026-05-06-21-01-55 +0000,missionlocal,"Queer politicos blast S.F. congressional candidate, Lurie ally Marie Hurabiell for homophobia",https://missionlocal.org/2026/05/sf-marie-hurabiell-connectedsf-homophobia/
16,2026-05-06-20-34-00 +0000,wsj,Opinion | The U.N. Will Make Airfares More Expensive,https://www.wsj.com/opinion/the-u-n-will-make-airfares-more-expensive-d1b2a66e
16,2026-05-06-15-00-11 +0000,nyt,Artifacts from the Titanic May Soon Be Auctioned,https://www.nytimes.com/2026/05/06/us/titanic-artifacts-auction-sale.html
16,2026-05-06-18-04-42 +0000,latimes,Where is Kristin Smart? Search warrant served at property of killer's mother after remains detected,https://www.latimes.com/california/story/2026-05-06/kristin-smart-search-resumes-slo-county
16,2026-05-06-10-37-33 +0000,bbc,Campaigners call for ban on use of weedkiller glyphosate at harvest time,https://www.bbc.com/news/articles/cvgz420ee0zo?at_medium=RSS&at_campaign=rss
15,2026-05-07-09-24-59 +0000,nyt,Meditating or Rebooting? A Robot Buddhist Monk Comes to South Korea.,https://www.nytimes.com/2026/05/06/technology/robot-monk-buddhist-seoul.html
15,2026-05-06-15-11-00 +0000,wsj,The Opaque Private-Lending Deals That Left HSBC With a $400 Million Hole,https://www.wsj.com/finance/the-opaque-private-lending-deals-that-left-hsbc-with-a-400-million-hole-1e270530?mod=rss_markets_main
15,2026-05-06-15-05-00 +0000,wsj,Apollo to Give Investors Daily Pricing on Private Credit By September,https://www.wsj.com/finance/investing/apollo-to-give-investors-daily-pricing-on-private-credit-by-september-44a2c84b?mod=rss_markets_main
15,2026-05-06-23-32-01 +0000,latimes,A full-grown mountain lion hides under a pickup in a SoCal apartment complex,https://www.latimes.com/california/story/2026-05-06/mountain-lion-wanders-near-socal-homes-crawls-under-vehicle
15,2026-05-06-23-13-47 +0000,48hills,Screen Grabs: CAAMFest eye-openers include ‘the Godfather of Silicon Valley’s Indian Mafia’,https://48hills.org/2026/05/screen-grabs-caamfest-eye-openers-include-the-godfather-of-silicon-valleys-indian-mafia/
15,2026-05-06-21-58-00 +0000,wsj,Apollo Seeks an Edge With Credit Fund Transparency Push,https://www.wsj.com/pro/private-equity/apollo-global-management-swings-to-loss-f9db3cb7?mod=rss_markets_main
15,2026-05-06-21-00-46 +0000,nyt,U.S. Troops in Middle East Wait for the Next Big Moment,https://www.nytimes.com/2026/05/06/us/politics/us-troops-iran.html
15,2026-05-06-20-36-00 +0000,wsj,"Opinion | To End Racial Gerrymandering, Congress Needs to Act",https://www.wsj.com/opinion/to-end-racial-gerrymandering-congress-needs-to-act-7f69c716
15,2026-05-06-14-22-00 +0000,wsj,Opinion | ‘Circling Back’ to the Corporate Jargon Debate,https://www.wsj.com/opinion/circling-back-to-the-corporate-jargon-debate-625c8205?mod=pls_whats_news_us_business_f
15,2026-05-06-18-56-04 +0000,latimes,Deputy fatally shoots homeowner's dog while investigating stolen vehicle in San Bernardino,https://www.latimes.com/california/story/2026-05-06/deputy-fatally-shoots-dog-during-investigation-in-san-bernardino
15,2026-05-07-01-17-04 +0000,nyt,A Times reporter in L.A. explains an unusual race.,https://www.nytimes.com/live/2026/05/06/us/california-governor-debate/a-times-reporter-in-la-explains-an-unusual-race
14,2026-05-06-17-09-00 +0000,wsj,Memory Makers Are the Hottest Thing in Tech. Are They Making Too Much Money?,https://www.wsj.com/tech/memory-makers-are-the-hottest-thing-in-tech-are-they-making-too-much-money-bad375da?mod=rss_markets_main
14,2026-05-07-09-23-40 +0000,bbc,Major rail disruption in South of England due to radio fault,https://www.bbc.com/news/articles/ckgp8yjllx1o?at_medium=RSS&at_campaign=rss
14,2026-05-06-11-05-07 +0000,nyt,"Justin Wolfers, Cable’s Favorite Economist, Joins the Creator Economy",https://www.nytimes.com/2026/05/06/business/dealbook/justin-wolfers-media-company.html
14,2026-05-06-10-00-00 +0000,wsj,How AB InBev Stopped Its Three-Year Slide,https://www.wsj.com/cmo-today/how-ab-inbev-stopped-its-three-year-slide-a72154ec?mod=pls_whats_news_us_business_f
14,2026-05-06-19-32-05 +0000,nyt,Guido Reichstadter Comes Down From Frederick Douglass Memorial Bridge After 6 Days,https://www.nytimes.com/2026/05/06/us/guido-reichstadter-frederick-douglass-memorial-bridge.html
14,2026-05-07-02-17-00 +0000,nypost,Dark secrets of Fresno biolab revealed as Chinese national convicted in nationwide scheme,https://nypost.com/2026/05/06/us-news/dark-secrets-of-fresno-biolab-revealed-as-chinese-national-convicted-in-nationwide-scheme/
14,2026-05-07-09-01-45 +0000,nyt,"Help! We Got to the Gate in the Nick of Time, but Missed Our Flight.",https://www.nytimes.com/2026/05/07/travel/british-airways-seats-missed-flight.html
13,2026-05-07-01-45-19 +0000,nyt,A Hotel in Venezuela’s Capital Has Become the U.S. Embassy’s De Facto Headquarters,https://www.nytimes.com/2026/05/06/world/americas/venezuela-caracas-us-embassy-marriott-hotel.html
13,2026-05-06-10-38-17 +0000,bbc,Sudan accuses Ethiopia and UAE of orchestrating drone attacks on airport,https://www.bbc.com/news/articles/clype712r3qo?at_medium=RSS&at_campaign=rss
13,2026-05-06-10-00-00 +0000,latimes,Contributor: Xavier Becerra shows that his loyalty lies with fossil fuels,https://www.latimes.com/opinion/story/2026-05-06/xavier-becerra-california-governor-big-oil-donations
13,2026-05-06-13-09-00 +0000,wsj,6 of the Best Financial Advisor Companies: Well-Known Fiduciary Investment Firms to Consider,https://www.wsj.com/buyside/personal-finance/financial-advisors/best-financial-advisors?mod=rss_markets_main
13,2026-05-07-06-54-00 +0000,wsj,Coca-Cola HBC Sales Grow on Caffeine Consumption Spike,https://www.wsj.com/business/retail/coca-cola-hbc-sales-grow-on-caffeine-consumption-spike-5df86a45?mod=pls_whats_news_us_business_f
13,2026-05-07-08-55-30 +0000,nyt,Australian Women and Children Linked to ISIS Fighters Return Home,https://www.nytimes.com/2026/05/07/world/asia/australia-isis-women-children-syria.html
13,2026-05-07-08-18-00 +0000,wsj,Campari Shares Tumble After Aperol Maker Misses Analysts’ Estimates,https://www.wsj.com/business/earnings/campari-shares-tumble-after-aperol-maker-misses-analysts-estimates-45213133?mod=pls_whats_news_us_business_f
13,2026-05-06-13-10-21 +0000,nyt,Japan’s Takaichi Pitches Strength and Stability in Visits to Australia and Vietnam,https://www.nytimes.com/2026/05/06/world/asia/japan-takaichi-australia-vietnam.html
13,2026-05-06-10-00-00 +0000,latimes,"RFK Jr. clears path for minors' use of tanning beds, much to the dismay of dermatologists",https://www.latimes.com/science/story/2026-05-06/rfk-hands-major-win-to-indoor-tanning-industry-to-dermatologists-dismay
13,2026-05-06-10-00-00 +0000,latimes,"Yosemite ditches reservations, drawing huge crowds in a free-for-all",https://www.latimes.com/california/story/2026-05-06/yosemite-ditches-reservations-drawing-huge-crowds-in-free-for-all
13,2026-05-07-09-30-00 +0000,wsj,The Fight to Free Hundreds of Beagles From a Rural Wisconsin Research Lab,https://www.wsj.com/us-news/the-fight-to-free-hundreds-of-beagles-from-a-rural-wisconsin-research-lab-3c3a49ff
13,2026-05-06-17-56-41 +0000,nyt,Tricked Into Fighting for Russia,https://www.nytimes.com/2026/05/04/world/africa-russia-ukraine-war-attacks-strait-hormuz.html
13,2026-05-07-01-03-00 +0000,nyt,"Watercraft Slams Into Gray Whale Near Vancouver, Injuring Driver",https://www.nytimes.com/2026/05/06/world/canada/jet-ski-hits-grey-whale-vancouver.html
12,2026-05-06-22-58-01 +0000,bbc,From ego-ridden team to complete package - why PSG pose ultimate test,https://www.bbc.com/sport/football/articles/cx218q541lvo?at_medium=RSS&at_campaign=rss
12,2026-05-06-12-19-00 +0000,wsj,"Nvidia to Invest $500 Million in Corning, Expand Fiber Optic Manufacturing",https://www.wsj.com/tech/nvidia-corning-form-partnership-to-expand-fiber-optic-manufacturing-17f525de?mod=pls_whats_news_us_business_f
12,2026-05-06-11-23-57 +0000,bbc,Two people arrested after BBC asylum investigation,https://www.bbc.com/news/articles/cg7p09p2evxo?at_medium=RSS&at_campaign=rss
12,2026-05-06-21-27-00 +0000,wsj,FanDuel Chief Executive Amy Howe Departs Company,https://www.wsj.com/business/media/fanduel-chief-executive-amy-howe-departs-company-b41e538e?mod=pls_whats_news_us_business_f
12,2026-05-07-05-19-53 +0000,bbc,'How loan shark threats keep victims like me silent',https://www.bbc.com/news/articles/cgrllw41dl4o?at_medium=RSS&at_campaign=rss
11,2026-05-06-23-53-34 +0000,cbc,"Carney government planning changes to speed approvals for pipelines, resource projects",https://www.cbc.ca/news/politics/carney-pipelines-projects-changes-mou-9.7190522?cmp=rss
11,2026-05-07-08-06-52 +0000,bbc,Islamic State-linked women arrive home in Australia from Syria,https://www.bbc.com/news/articles/czj2emlv2kjo?at_medium=RSS&at_campaign=rss
11,2026-05-07-09-00-18 +0000,nyt,"After Stumbles, Technology Meant for Self-Driving Cars Finds a Second Act",https://www.nytimes.com/2026/05/07/business/autonomous-vehicles-technology-other-uses.html
11,2026-05-06-18-26-14 +0000,nypost,Radical pol wants to limit nursing home residents to 2.8 ounces of beef a week — less than a Big Mac,https://nypost.com/2026/05/06/world-news/danish-pol-defends-guidelines-limiting-nursing-home-residents-to-2-8oz-of-beef-a-week/
11,2026-05-06-16-14-32 +0000,nyt,American Factories Lag in Adopting A.I. This Drugmaker Is an Exception.,https://www.nytimes.com/2026/05/06/business/ai-bristol-myers-squibb-drugs.html
11,2026-05-06-20-49-23 +0000,cbc,Carney to 'take into account' advice on Senate appointments from Trudeau-era committee,https://www.cbc.ca/news/politics/carney-senate-appointment-process-committee-9.7190198?cmp=rss
11,2026-05-07-07-37-00 +0000,wsj,"Samsung Pulling TVs, Home Appliances From China",https://www.wsj.com/business/samsung-pulling-tvs-home-appliances-from-china-c17fa504?mod=pls_whats_news_us_business_f
11,2026-05-07-08-13-36 +0000,bbc,Driver arrested after chasing down child cyclist on footpath,https://www.bbc.com/news/videos/c9wep78epz8o?at_medium=RSS&at_campaign=rss
10,2026-05-06-11-30-00 +0000,missionlocal,SFMTA promises faster transit on Ocean Ave. Businesses aren’t happy.,https://missionlocal.org/2026/05/sfmta-ocean-avenue-red-tranit-lane/
10,2026-05-06-20-46-00 +0000,wsj,Opinion | India’s Ruling Party Beats the Odds,https://www.wsj.com/opinion/indias-ruling-party-beats-the-odds-b840a6c7
10,2026-05-06-10-00-00 +0000,latimes,Arellano: How I learned to stop worrying about noncitizens voting in L.A. elections,https://www.latimes.com/california/story/2026-05-06/noncitizens-voting-la-elections
