score,pubdate,source,title,link
17,2025-07-30-18-41-09 +0000,nyt,"Virginia City Councilman Is Set on Fire in Attack, Police Say",https://www.nytimes.com/2025/07/30/us/lee-vogler-fire-attack-showcase-magazine-virginia.html
17,2025-07-30-02-35-21 +0000,latimes,"After push from L.A., Newsom plans to weaken state duplex law in wildfire areas",https://www.latimes.com/homeless-housing/story/2025-07-29/after-push-from-l-a-newsom-plans-to-weaken-state-duplex-law-in-wildfire-areas
16,2025-07-30-18-38-00 +0000,wsj,Opinion | The Senate Nominations Showdown,https://www.wsj.com/opinion/the-senate-nominations-showdown-b020e481
16,2025-07-30-04-01-52 +0000,nyt,Reno Shooting Shatters Lives at a Bachelor Party,https://www.nytimes.com/2025/07/30/us/reno-casino-shooting-bachelor-party.html
16,2025-07-30-15-35-33 +0000,nyt,Economists Are Struggling to Find Jobs. It’s an Ominous Sign for The Economy.,https://www.nytimes.com/2025/07/28/business/economics-jobs-hiring.html
16,2025-07-30-13-33-10 +0000,nyt,Who are the witnesses at Wednesday’s crash hearing?,https://www.nytimes.com/live/2025/07/30/us/dc-plane-crash-hearing/who-are-the-witnesses-at-wednesdays-crash-hearing
16,2025-07-30-11-40-07 +0000,nyt,Top F.D.A. Official Resigns Under Pressure,https://www.nytimes.com/2025/07/29/health/vinay-prasad-fda-resigns-loomer.html
16,2025-07-30-15-30-41 +0000,nypost,Illegal migrant allegedly murdered teen who tried to stop him raping his mom,https://nypost.com/2025/07/30/us-news/illegal-migrant-allegedly-murdered-teen-who-tried-to-stop-him-raping-his-mom/
16,2025-07-30-18-01-37 +0000,nypost,"MTA set to hike fares in latest crunch on subway, LIRR and Metro-North riders",https://nypost.com/2025/07/30/us-news/mta-set-to-hike-fares-in-latest-crunch-on-subway-lirr-and-metro-north-riders/
15,2025-07-30-10-56-00 +0000,wsj,"Adidas Shares Tumble After Sales Miss, Guidance Confirmation",https://www.wsj.com/business/earnings/adidas-backs-outlook-as-tariff-burden-lingers-7632ece9?mod=pls_whats_news_us_business_f
15,2025-07-29-23-08-36 +0000,latimes,Hiker in Yosemite sequoia grove killed by falling tree branch,https://www.latimes.com/california/story/2025-07-29/yosemite-sequoia-hiker-killed-falling-branch
15,2025-07-30-10-00-00 +0000,latimes,"Pandemic aged our brains faster, whether or not we got COVID, study says",https://www.latimes.com/california/story/2025-07-30/pandemic-aged-our-brains-faster-whether-we-got-covid-or-not-study-says
15,2025-07-30-16-14-27 +0000,nypost,Mattel slaps political podcast ‘Coffee with Ken’ with bizarre lawsuit — insisting it could be confused with Barbie’s boyfriend,https://nypost.com/2025/07/30/business/mattel-slaps-political-podcast-coffee-with-ken-with-bizarre-lawsuit/
15,2025-07-30-10-55-55 +0000,nypost,Ted Cruz is latest to defend Sydney Sweeney’s American Eagle ad ripped as ‘Nazi propaganda’,https://nypost.com/2025/07/30/us-news/ted-cruz-defends-sydney-sweeney-american-eagle-jean-spot-called-nazi-propaganda/
15,2025-07-30-14-19-52 +0000,cbc,Migrant worker calls proposed spike in housing cost payroll deduction 'wickedness',https://www.cbc.ca/news/canada/windsor/migrant-worker-call-spike-housing-payroll-1.7597202?cmp=rss
15,2025-07-29-19-59-00 +0000,latimes,"UCLA violated Jewish students' civil rights with 'deliberate indifference,' feds say",https://www.latimes.com/california/story/2025-07-29/ucla-settles-lawsuit-jewish-students
15,2025-07-30-18-34-54 +0000,nypost,Celsius energy drink cans recalled because they accidentally contain a boozy surprise,https://nypost.com/2025/07/30/us-news/celsius-energy-drink-cans-recalled-because-they-accidentally-contain-a-boozy-surprise/
15,2025-07-30-04-40-18 +0000,bbc,Starbucks ditches pickup-only stores as they 'lack warmth',https://www.bbc.com/news/articles/cy8jnj7ewgqo?at_medium=RSS&at_campaign=rss
14,2025-07-30-09-02-24 +0000,nyt,"In Massachusetts, a Work Stoppage Forces Judges to Dismiss Criminal Cases",https://www.nytimes.com/2025/07/30/us/massachusetts-public-defender-lawyers-criminal-cases.html
14,2025-07-29-21-54-55 +0000,nyt,"Ziad Rahbani, Composer Who Defined a Tragic Era in Lebanon, Dies at 69",https://www.nytimes.com/2025/07/27/world/middleeast/ziad-rahbani-dead.html
14,2025-07-30-01-24-49 +0000,bbc,YouTube to be included in Australia's teen social media ban,https://www.bbc.com/news/articles/cpv0zkxx0njo?at_medium=RSS&at_campaign=rss
14,2025-07-29-23-00-43 +0000,bbc,"Up to 40,000 homes to be built on disused railway land",https://www.bbc.com/news/articles/cgqny1jw7peo?at_medium=RSS&at_campaign=rss
14,2025-07-30-12-38-01 +0000,nyt,The Biggest Unanswered Questions About the Reagan Airport Crash,https://www.nytimes.com/2025/07/30/us/politics/reagan-airport-crash-questions.html
14,2025-07-30-18-44-55 +0000,nyt,What to know about the Fed decision.,https://www.nytimes.com/live/2025/07/30/business/federal-reserve-interest-rates/fed-meeting-july-what-to-watch
14,2025-07-30-17-28-02 +0000,bbc,Tanzania's ban on foreigners operating small businesses sparks Kenyan backlash,https://www.bbc.com/news/articles/cdxyvzjpxe2o?at_medium=RSS&at_campaign=rss
14,2025-07-30-16-22-07 +0000,nypost,NY cops hunt for stolen horse they worry might break its diet — with deadly consequences,https://nypost.com/2025/07/30/us-news/cops-launch-search-for-horse-with-special-dietary-needs-named-koda-stolen-from-upstate-ny-farm/
14,2025-07-29-22-22-00 +0000,wsj,"Starbucks Abandons Mobile Order, Pickup-Only Stores",https://www.wsj.com/business/earnings/starbucks-earnings-q3-sbux-stock-382db7ae?mod=pls_whats_news_us_business_f
14,2025-07-30-09-30-00 +0000,wsj,What Is CTE? The Football-Connected Brain Disease Cited by the Manhattan Shooter,https://www.wsj.com/sports/football/gunman-who-targeted-nfl-cited-grievances-over-football-connected-brain-disease-ee735278
14,2025-07-30-06-49-53 +0000,nyt,"Thailand and Cambodia Stepped Back From War, but Their Temple Fight Remains",https://www.nytimes.com/2025/07/30/world/asia/thailand-cambodia-temples.html
13,2025-07-30-10-00-01 +0000,wapo,"Desperate for power, modern AI firms lean on a geriatric American nuclear fleet",https://www.washingtonpost.com/business/2025/07/30/ai-nuclear-power-energy/
13,2025-07-29-20-59-00 +0000,wsj,Opinion | A Peace Deal for Armenia and Azerbaijan,https://www.wsj.com/opinion/a-peace-deal-for-armenia-and-azerbaijan-99373485?mod=pls_whats_news_us_business_f
13,2025-07-30-12-32-00 +0000,wsj,"In This Frothy Market, It’s Boom Times for Brokers Like Robinhood",https://www.wsj.com/finance/in-this-market-its-good-to-be-a-broker-14c1953b?mod=rss_markets_main
13,2025-07-30-04-00-08 +0000,nyt,How a Chinese Brand Reshaped Hong Kong’s Food Delivery Scene,https://www.nytimes.com/2025/07/30/business/meituan-keeta-deliveroo-hong-kong.html
13,2025-07-29-21-18-05 +0000,latimes,Palmer Luckey's Anduril leads second quarter surge for venture capital in greater L.A.,https://www.latimes.com/entertainment-arts/business/story/2025-07-29/anduril-defense-tech-aerospace-venture-capital-los-angeles
13,2025-07-30-17-52-52 +0000,cbc,"Crown attorneys' group accuses politicians, media of 'attacks' on justice system",https://www.cbc.ca/news/canada/ottawa/crown-attorneys-group-accuses-politicians-media-of-attacks-on-justice-system-1.7597529?cmp=rss
12,2025-07-29-20-00-11 +0000,nyt,"St. Paul Hobbled by Cyberattack, Prompting National Guard Response",https://www.nytimes.com/2025/07/29/us/st-paul-cyberattack-walz.html
12,2025-07-30-18-13-26 +0000,nyt,Criss-crossing routes in D.C. airspace leave little room for error.,https://www.nytimes.com/live/2025/07/30/us/dc-plane-crash-hearing/criss-crossing-routes-in-dc-airspace-leave-little-room-for-error
12,2025-07-29-19-53-30 +0000,cbc,"Hong Kong has issued a warrant for his arrest, but this Vancouverite isn't worried",https://www.cbc.ca/news/canada/british-columbia/victor-ho-hong-kong-arrest-warrant-1.7596560?cmp=rss
12,2025-07-30-01-17-42 +0000,latimes,"Scientist and green-card holder detained at SFO for more than a week, lawyer says",https://www.latimes.com/california/story/2025-07-29/korean-scientist-green-card-detained-san-francisco
12,2025-07-30-13-56-17 +0000,nyt,"Gary Karr, Virtuoso Who Elevated the Double-Bass, Dies at 83",https://www.nytimes.com/2025/07/29/arts/music/gary-karr-dead.html
12,2025-07-30-14-20-48 +0000,nyt,Palm Beach Billionaires Battle for Oceanfront Land,https://www.nytimes.com/2025/07/30/style/palm-beach-billionaires-battle-for-oceanfront-land.html
12,2025-07-29-21-42-00 +0000,wsj,Opinion | Can Syria’s President Control His Troops?,https://www.wsj.com/opinion/can-syrias-president-control-his-troops-sharaa-middle-east-5d3ceb4b
11,2025-07-30-11-00-06 +0000,nyt,TikTok Asks Users to Help Police Misinformation,https://www.nytimes.com/2025/07/30/business/tiktok-footnotes-fact-checking.html
11,2025-07-30-06-58-01 +0000,nyt,What is the Pacific ‘Ring of Fire’?,https://www.nytimes.com/article/ring-of-fire-earthquake-tsunami-volcano.html
11,2025-07-30-11-55-52 +0000,nyt,What Does It Cost to Keep Workers Safe?,https://www.nytimes.com/2025/07/30/business/dealbook/park-avenue-shooting-workplace-safety.html
11,2025-07-30-13-35-30 +0000,bbc,Taylor Wimpey's profits wiped out by fixing cladding,https://www.bbc.com/news/articles/c3dpemev493o?at_medium=RSS&at_campaign=rss
11,2025-07-30-10-01-32 +0000,bbc,Dating safety app Tea suspends messaging after hack,https://www.bbc.com/news/articles/cd0dgkjgzvjo?at_medium=RSS&at_campaign=rss
11,2025-07-30-17-33-47 +0000,nyt,Senators grill Agriculture Dept. deputy over the agency’s reorganization plan.,https://www.nytimes.com/live/2025/07/30/us/trump-news/senators-grill-agriculture-dept-deputy-over-the-agencys-reorganization-plan
11,2025-07-30-00-46-25 +0000,bbc,Outcry after German zoo culled baboons due to overcrowding,https://www.bbc.com/news/articles/clyr2gzlvdeo?at_medium=RSS&at_campaign=rss
10,2025-07-29-20-14-23 +0000,nyt,"Morton Mintz, Muckraking Crusader for Consumers, Dies at 103",https://www.nytimes.com/2025/07/29/books/morton-mintz-dead.html
10,2025-07-30-15-00-05 +0000,bbc,Streeting invites doctors for fresh talks next week,https://www.bbc.com/news/articles/cdrkdp3xy17o?at_medium=RSS&at_campaign=rss
10,2025-07-30-18-41-38 +0000,bbc,Angola's petrol protest death toll rises as medics overwhelmed,https://www.bbc.com/news/articles/clyvjeexn85o?at_medium=RSS&at_campaign=rss
10,2025-07-30-17-12-59 +0000,nyt,"Katy Perry and Justin Trudeau Get a Table for 2, Inviting a Serving of Speculation",https://www.nytimes.com/2025/07/29/world/canada/katy-perry-justin-trudeau-dinner.html
10,2025-07-29-23-00-28 +0000,bbc,Greece warns of 'invasion' as it halts asylum on Med route,https://www.bbc.com/news/articles/cvgp5rexnk2o?at_medium=RSS&at_campaign=rss
10,2025-07-29-21-49-00 +0000,wsj,Opinion | Climate Regulation Liberation Day,https://www.wsj.com/opinion/epa-endangerment-finding-repeal-greenhouse-gases-obama-trump-steve-koonin-67fcb2ce
9,2025-07-30-09-30-00 +0000,wsj,UnitedHealth Faces Long Road to Recovery,https://www.wsj.com/health/healthcare/unitedhealth-faces-long-road-to-recovery-3572ebf2?mod=rss_markets_main
9,2025-07-30-10-00-00 +0000,latimes,How ICE is using the LAPD to track down immigrants for deportation,https://www.latimes.com/california/story/2025-07-30/ice-raids-lapd-special-order-40
9,2025-07-30-17-46-07 +0000,nyt,Here’s the latest.,https://www.nytimes.com/live/2025/07/30/us/dc-plane-crash-hearing/ntsb-hearings-dc-plane-crash
9,2025-07-30-16-12-00 +0000,wsj,Opinion | The Weirdest GDP Report Ever,https://www.wsj.com/opinion/gdp-report-economy-consumers-donald-trump-tariffs-d9879d98
9,2025-07-30-15-57-19 +0000,bbc,What are my rights if my flight is cancelled or delayed?,https://www.bbc.com/news/articles/c9qxnyengdjo?at_medium=RSS&at_campaign=rss
9,2025-07-30-02-01-19 +0000,bbc,'I was a shopping addict - it needs to be taken more seriously',https://www.bbc.com/news/articles/c625xkyxzkeo?at_medium=RSS&at_campaign=rss
9,2025-07-30-09-30-00 +0000,wsj,Why America Is Rallying to Save 400 Canadian Ostriches,https://www.wsj.com/world/americas/universal-ostrich-farm-canada-jfk-oz-f6548a6a
9,2025-07-30-18-37-46 +0000,bbc,Airlines warn of delays after air traffic glitch,https://www.bbc.com/news/articles/c4glxypwwx0o?at_medium=RSS&at_campaign=rss
9,2025-07-29-21-42-37 +0000,nyt,The Familiar Suicide and Final Wish of the N.Y.C. Gunman,https://www.nytimes.com/2025/07/29/us/nfl-cte-suicides-violence.html
9,2025-07-30-16-00-00 +0000,startribune,Get to know the British Isles’ easy-drinking style of brewing with these 9 beers,https://www.startribune.com/minnesota-brewery-summit-padraigs-town-hall-english-pale-ale-porter-scottish-ale/601429623
9,2025-07-30-16-25-43 +0000,bbc,Three charged with assault in connection with viral Cincinnati brawl,https://www.bbc.com/news/articles/cly422520k8o?at_medium=RSS&at_campaign=rss
8,2025-07-29-20-58-00 +0000,wsj,Spotify Gains Subscribers but Posts Loss,https://www.wsj.com/business/earnings/spotify-spot-q2-earnings-report-2025-3b85cdbe?mod=pls_whats_news_us_business_f
8,2025-07-30-11-00-00 +0000,wapo,"Shoppers are stressed, but some brands are raising prices anyway",https://www.washingtonpost.com/business/2025/07/30/retailers-price-hike-tariffs/
8,2025-07-30-15-32-00 +0000,wsj,Pending Home Sales Fell Unexpectedly in June,https://www.wsj.com/economy/housing/pending-home-sales-fell-unexpectedly-in-june-a35402a3
8,2025-07-30-15-00-00 +0000,wsj,Why So Many People Get Financial Advice That Is Wrong for Them,https://www.wsj.com/finance/investing/financial-advice-investments-personalization-fea73e95?mod=rss_markets_main
8,2025-07-30-16-48-03 +0000,nyt,Flights Are Disrupted at Airports Across U.K. After Radar Problem,https://www.nytimes.com/2025/07/30/world/europe/uk-flights-london-heathrow-airport-grounded.html
8,2025-07-29-21-49-00 +0000,wsj,Opinion | A Railroad Merger Test for the Feds,https://www.wsj.com/opinion/union-pacific-norfolk-southern-railroad-merger-trump-administration-7fd2e551?mod=pls_whats_news_us_business_f
8,2025-07-30-11-00-16 +0000,wapo,"Supplies of matcha are dwindling, thanks to lattes and TikTok videos",https://www.washingtonpost.com/business/2025/07/30/matcha-shortage-global-price-japan/
8,2025-07-30-13-56-08 +0000,bbc,Olympic star Dahlmeier dead after climbing accident,https://www.bbc.com/sport/articles/cdj237ly4g9o?at_medium=RSS&at_campaign=rss
7,2025-07-29-21-26-00 +0000,wsj,Boeing Takes Slow Approach to Expansion,https://www.wsj.com/business/airlines/boeing-ba-2q-earnings-report-2025-14367be3?mod=pls_whats_news_us_business_f
7,2025-07-29-19-59-32 +0000,nyt,Gazans Are Dying of Starvation,https://www.nytimes.com/2025/07/24/world/middleeast/gaza-starvation.html
7,2025-07-30-16-29-00 +0000,nyt,UNICEF Employees Held Hostage For 3 Weeks in Haiti,https://www.nytimes.com/2025/07/29/us/haiti-unicef-hostages-gangs.html
7,2025-07-30-18-51-00 +0000,wsj,Opinion | Macron’s View of Palestine Fits the Progressive Model,https://www.wsj.com/opinion/macrons-view-of-palestine-fits-the-progressive-model-d2d08c33
6,2025-07-30-05-29-09 +0000,bbc,Belfast man missing after disappearing from Paris airport,https://www.bbc.com/news/articles/c23p848m28mo?at_medium=RSS&at_campaign=rss
6,2025-07-29-23-00-12 +0000,bbc,Why plane turbulence is becoming more frequent - and more severe,https://www.bbc.com/news/articles/ckgy7jx082ro?at_medium=RSS&at_campaign=rss
6,2025-07-30-15-08-41 +0000,bbc,Standards watchdog investigates Nigel Farage,https://www.bbc.com/news/articles/ckgjrp2ln74o?at_medium=RSS&at_campaign=rss
6,2025-07-30-05-06-06 +0000,bbc,Pea shortage fears over earliest harvest in years,https://www.bbc.com/news/articles/c9dg2ll5172o?at_medium=RSS&at_campaign=rss
6,2025-07-30-13-29-54 +0000,bbc,"Migration fuels population jump, figures suggest",https://www.bbc.com/news/articles/c207nzgrz3vo?at_medium=RSS&at_campaign=rss
5,2025-07-30-09-00-55 +0000,nyt,How Conservative Christians Cracked the Johnson Amendment,https://www.nytimes.com/2025/07/30/us/johnson-amendment-church-free-speech.html
4,2025-07-30-00-53-04 +0000,nyt,What Happened to the MAGA Instant Pot?,https://www.nytimes.com/2025/07/28/us/politics/trump-maga-instant-pot.html
4,2025-07-30-11-00-01 +0000,startribune,What are the best views in Minnesota?,https://www.startribune.com/what-are-the-best-views-in-minnesota/601341602
3,2025-07-30-18-54-00 +0000,wsj,Opinion | Who Is Going to Miss NPR?,https://www.wsj.com/opinion/who-is-going-to-miss-npr-00669eed?mod=pls_whats_news_us_business_f
