score,pubdate,source,title,link
170,2026-01-30-11-18-12 +0000,cbc,Trump names former Fed official turned critic Kevin Warsh as his pick for next chair,https://www.cbc.ca/news/world/trump-federal-reserve-announcement-9.7067718?cmp=rss
165,2026-01-30-17-24-50 +0000,nypost,Gold and silver plunge after news Trump will nominate Kevin Warsh as Fed chair,https://nypost.com/2026/01/30/business/gold-silver-plunge-after-news-trump-will-nominate-kevin-warsh-as-fed-chair/
150,2026-01-30-21-08-13 +0000,nyt,"Kevin Warsh, Trump’s Choice for Fed Chair Could Find It Difficult to Deliver",https://www.nytimes.com/2026/01/30/business/trump-kevin-warsh-fed-rates.html
148,2026-01-30-19-01-53 +0000,nyt,Trump Picks Kevin Warsh as Next Fed Chair,https://www.nytimes.com/2026/01/30/us/politics/trump-fed-chair-kevin-warsh.html
147,2026-01-30-16-20-00 +0000,wsj,"Kevin Warsh, a central-bank insider-turned-critic, is Trump’s choice to succeed Jerome Powell as Federal Reserve chair",https://www.wsj.com/economy/central-banking/the-long-campaign-of-kevin-warsh-e5bd26d6
144,2026-01-30-14-39-53 +0000,nyt,"Who Is Kevin Warsh, Trump’s Pick to Lead the Fed?",https://www.nytimes.com/2026/01/30/us/politics/who-is-kevin-warsh-fed-chair.html
144,2026-01-31-02-00-00 +0000,wsj,"Trump’s fed pick came down to the “two Kevins,” but Wall Street lobbying helped Warsh seal the deal.",https://www.wsj.com/politics/policy/how-warsh-won-fed-job-ff9d02bc
143,2026-01-30-17-43-17 +0000,nyt,Trump Is Expected to Announce Kevin Warsh as Fed Chair,https://www.nytimes.com/2026/01/29/business/trump-fed-chair-kevin-warsh.html
142,2026-01-30-16-51-40 +0000,wapo,Trump taps Fed critic Kevin Warsh to succeed Jerome Powell as chairman,https://www.washingtonpost.com/business/2026/01/30/kevin-warsh-fed-nomination/
139,2026-01-30-12-03-46 +0000,nypost,Trump announces Kevin Warsh as pick to be next Federal Reserve chair,https://nypost.com/2026/01/30/us-news/president-donald-trump-announces-kevin-warsh-as-pick-to-be-next-fed-chair/
131,2026-01-30-19-56-00 +0000,wsj,Kevin Warsh’s nomination to lead the Federal Reserve marks a triumphant return to the central bank for a former Fed official who has long angled for the Fed’s top job,https://www.wsj.com/economy/central-banking/who-is-kevin-warsh-trumps-fed-chair-pick-a77dc602
126,2026-01-30-13-50-06 +0000,nyt,Will Kevin Warsh Do What Trump Wants?,https://www.nytimes.com/2026/01/30/business/dealbook/warsh-fed-trump.html
125,2026-01-30-22-15-36 +0000,bbc,Will Trump's pick to lead US central bank get him the change he wants?,https://www.bbc.com/news/articles/czx1qrx5jgzo?at_medium=RSS&at_campaign=rss
125,2026-01-30-21-52-37 +0000,nyt,Who Is Trump’s New Fed Chair Pick?,https://www.nytimes.com/video/business/economy/100000010629457/who-is-trumps-new-fed-chair-pick.html
121,2026-01-30-16-22-59 +0000,bbc,Trump picks Kevin Warsh to lead the US Federal Reserve,https://www.bbc.com/news/articles/c2d7yddrl2xo?at_medium=RSS&at_campaign=rss
119,2026-01-30-22-10-00 +0000,latimes,"Granderson: Even as Trump shreds the Constitution, keep your eye on the Epstein files",https://www.latimes.com/opinion/story/2026-01-30/don-lemon-arrest-alex-pretti-gun-rights-2nd-amendment
111,2026-01-30-15-25-00 +0000,wsj,Trump’s Fed Chair Nomination Stabilizes Dollar But Risks Remain,https://www.wsj.com/finance/currencies/asian-currencies-consolidate-ongoing-u-s-iran-tensions-may-weigh-536f96e9?mod=rss_markets_main
107,2026-01-30-23-10-46 +0000,nyt,Feds Release Document of Tips Mentioning Trump and Epstein,https://www.nytimes.com/2026/01/30/us/trump-epstein-tips-fed.html
106,2026-01-30-13-46-23 +0000,bbc,Ukraine sees quieter night as Trump says Putin will not attack its cities,https://www.bbc.com/news/articles/c4g4yj92kwro?at_medium=RSS&at_campaign=rss
106,2026-01-30-14-59-56 +0000,bbc,Trump tells Iran to drop nuclear aims and stop killing protesters to avoid military action,https://www.bbc.com/news/articles/c394ymdpjwvo?at_medium=RSS&at_campaign=rss
105,2026-01-31-01-00-00 +0000,wsj,Trump’s Armada Is Getting in Place. Now He Must Decide What to Do With Iran.,https://www.wsj.com/world/middle-east/trumps-armada-is-getting-in-place-now-he-must-decide-what-to-do-with-iran-93007d5a
104,2026-01-30-12-30-00 +0000,wsj,Panama High Court Gives Trump a Win Over Canal by Ousting Hong Kong Port Operator,https://www.wsj.com/business/logistics/panamas-high-court-rules-against-hong-kong-firm-running-canal-ports-714c23c8
104,2026-01-31-01-49-02 +0000,wapo,Trump taps career staffer to lead statistics agency whose chief he fired,https://www.washingtonpost.com/business/2026/01/30/trump-nominates-matsumoto-bls/
103,2026-01-30-13-42-41 +0000,cbc,Trump's latest tariff threat has targeted Canada's aviation industry. Here's how reaction unfolded,https://www.cbc.ca/news/world/livestory/trump-bombardier-tariffs-9.7067835?cmp=rss
103,2026-01-30-10-00-49 +0000,wapo,"At India’s main energy summit, signs of a new world order without Trump",https://www.washingtonpost.com/world/2026/01/30/india-energy-week-trump-canada-oil/
103,2026-01-30-14-31-26 +0000,nyt,Iran Rules Out Talks With U.S. Until Trump’s Threats Stop,https://www.nytimes.com/2026/01/30/world/europe/iran-trump-us-threats-turkey.html
102,2026-01-30-21-34-01 +0000,nypost,"Russia spares Ukraine’s energy grid after Trump push — but only until Sunday, Kremlin says",https://nypost.com/2026/01/30/world-news/russia-spares-ukraines-energy-grid-after-trump-push/
101,2026-01-30-21-43-51 +0000,bbc,"Iran wants to make deal rather than face military action, Trump says",https://www.bbc.com/news/articles/cd9ew2kwj0lo?at_medium=RSS&at_campaign=rss
101,2026-01-30-09-14-25 +0000,bbc,Trump says 'very dangerous' for UK to do business with China as Starmer lands in Shanghai,https://www.bbc.com/news/articles/c0keyyeyr41o?at_medium=RSS&at_campaign=rss
100,2026-01-30-14-07-00 +0000,wsj,Trump Faces High-Stakes Choice as Final Nuclear Pact With Russia Expires,https://www.wsj.com/politics/national-security/trump-faces-high-stakes-choice-as-final-nuclear-pact-with-russia-expires-6dedebb1
98,2026-01-30-22-47-21 +0000,nyt,Trump Moves to Cut All Oil to Cuba as U.S. Targets Its Government,https://www.nytimes.com/2026/01/30/world/americas/trump-oil-cuba-government.html
97,2026-01-30-10-29-21 +0000,nyt,Trump Tells U.K. and Canada That Boosting Trade With China Is ‘Dangerous’,https://www.nytimes.com/2026/01/30/world/asia/trump-starmer-china-canada-trade.html
96,2026-01-30-18-49-38 +0000,wapo,Trump says he’s reopening Venezuelan airspace and Americans may visit,https://www.washingtonpost.com/world/2026/01/30/trump-reopens-venezuela-airspace/
95,2026-01-31-00-14-09 +0000,latimes,Don Lemon's arrest escalates Trump's clashes with journalists,https://www.latimes.com/entertainment-arts/business/story/2026-01-30/don-lemon-arrest-escalates-trump-clashes-with-journalists-ice
95,2026-01-31-01-40-00 +0000,wsj,"President Trump plans to nominate economist Brett Matsumoto to head the Bureau of Labor Statistics, according to people familiar with the matter",https://www.wsj.com/economy/trump-bls-brett-matsumoto-f728acde
95,2026-01-30-20-31-55 +0000,wapo,"Trump says U.S. will decertify Canadian-made planes, threatens 50% tariff",https://www.washingtonpost.com/politics/2026/01/30/us-trump-canada-aircraft-tariff/
95,2026-01-30-17-45-00 +0000,nypost,Trump says Iran has deadline ‘only they know’ to make a deal with the US,https://nypost.com/2026/01/30/us-news/trump-says-iran-has-deadline-only-they-know-to-make-a-deal-with-the-us/
94,2026-01-30-13-00-38 +0000,nypost,Hispanic Republicans breathe sigh of relief over Trump immigration crackdown course correction in Minnesota,https://nypost.com/2026/01/30/us-news/hispanic-republicans-breathe-sigh-of-relief-over-trump-course-correction-in-minnesota/
94,2026-01-31-02-57-30 +0000,nyt,Protesters Denounce Trump Immigration Tactics in ‘National Shutdown’,https://www.nytimes.com/2026/01/30/us/minnesota-ice-protests-trump-immigration.html
93,2026-01-30-22-11-08 +0000,latimes,"Trump administration's climate skepticism effort violated federal law, judge rules",https://www.latimes.com/environment/story/2026-01-30/trump-administrations-climate-skepticism-effort-violated-federal-law-judge-rules
93,2026-01-30-14-58-31 +0000,wapo,Russia reveals Ukraine energy ceasefire pushed by Trump is nearly over,https://www.washingtonpost.com/world/2026/01/30/ukraine-russia-trump-energy-ceasefire/
92,2026-01-31-01-02-32 +0000,nyt,Trump Names ‘Data Nerd’ to Lead Labor Statistics Agency,https://www.nytimes.com/2026/01/30/business/trump-bureau-of-labor-statistics-brett-matsumoto.html
92,2026-01-30-12-11-53 +0000,nyt,"Trump Repeats Claims Against Alex Pretti, Casting Slain Nurse as ‘Agitator’",https://www.nytimes.com/2026/01/30/us/trump-alex-pretti-agitator-minneapolis-shooting-ice.html
92,2026-01-30-11-07-35 +0000,nypost,Ukraine bracing for brutal weather as Trump says Putin agreed to halt power grid attacks,https://nypost.com/2026/01/30/world-news/ukraine-is-bracing-for-brutal-weather-as-trump-says-putin-agreed-to-halt-power-grid-attacks/
90,2026-01-30-21-32-19 +0000,nyt,Minnesota and Immigration Dominate 9 Mayors’ Discussion Over Safety and Trust Under Trump,https://www.nytimes.com/2026/01/30/us/us-mayors-minnesota-ice-trump.html
89,2026-01-30-14-03-00 +0000,wsj,"Trump Sues Treasury Department, IRS Over Tax Return Leak",https://www.wsj.com/politics/policy/trump-sues-treasury-department-irs-over-tax-return-leak-b96f5f9f
89,2026-01-30-15-11-18 +0000,nypost,Panama court axes Chinese-linked control at canal in victory for Trump,https://nypost.com/2026/01/30/business/panama-court-axes-chinese-linked-control-at-canal-in-victory-for-trump/
87,2026-01-30-10-35-16 +0000,bbc,'She's done a great job' - Donald Trump praises Melania's film,https://www.bbc.com/news/videos/cvgnqgl57p2o?at_medium=RSS&at_campaign=rss
87,2026-01-30-15-27-26 +0000,nyt,War Threats and Ambiguous Evidence: Trump Again Confronts Iran,https://www.nytimes.com/2026/01/29/us/politics/trump-iran-israel-intel.html
87,2026-01-30-22-07-39 +0000,nyt,Some Republicans Lament the Spending Deal Trump Has Blessed,https://www.nytimes.com/2026/01/30/us/politics/senate-republicans-trump-spending-bill.html
87,2026-01-31-06-19-29 +0000,nypost,LA Olympics boss Casey Wasserman’s racy emails with Ghislaine Maxwell while he was married revealed in Epstein files,https://nypost.com/2026/01/31/us-news/la-olympics-boss-casey-wassermans-racy-emails-with-ghislaine-maxwell-while-he-was-married-revealed-in-epstein-files/
87,2026-01-30-17-09-33 +0000,nypost,Trump orders IndyCar race on streets of Washington for America 250 celebration,https://nypost.com/2026/01/30/us-news/trump-to-order-indycar-race-on-streets-of-washington-for-america-250-celebration/
86,2026-01-31-02-22-06 +0000,nyt,Trump Officials Bypass Congress to Push Billions in Weapons Aid to Israel,https://www.nytimes.com/2026/01/30/us/politics/trump-congress-weapons-aid-israel.html
86,2026-01-30-20-57-00 +0000,wsj,Trump Administration Expands Investigation of Pretti Killing,https://www.wsj.com/us-news/fbi-takes-the-lead-in-pretti-shooting-investigation-be2e35f8
86,2026-01-30-22-47-23 +0000,nyt,Trump’s Immigration Push Fractures Republican Party,https://www.nytimes.com/2026/01/30/us/politics/immigration-news-trump-gop.html
85,2026-01-30-18-34-00 +0000,wsj,"Fed Policymakers Will Find Kevin Warsh Persuasive, Governor Stephen Miran Says",https://www.wsj.com/economy/central-banking/fed-policymakers-will-find-kevin-warsh-persuasive-governor-stephen-miran-says-c1f8c7c9
85,2026-01-30-23-34-17 +0000,nyt,Judge Weighs Trump’s Removal of Slavery Markers From George Washington’s House,https://www.nytimes.com/2026/01/30/us/politics/washington-slavery-philadelphia-lawsuit.html
85,2026-01-31-00-36-27 +0000,nyt,Trump Officials Move to Double Number of H-2B Guest Visas This Year,https://www.nytimes.com/2026/01/30/us/politics/h2b-visas.html
85,2026-01-30-22-06-22 +0000,nyt,"6 Takeaways from ‘Melania,’ the Melania Trump Documentary",https://www.nytimes.com/2026/01/30/movies/melania-documentary-movie-takeaways-trump.html
83,2026-01-31-02-45-20 +0000,nyt,Trump Called for ‘De-Escalation’ in Minneapolis. It Didn’t Last Long.,https://www.nytimes.com/2026/01/30/us/politics/trump-minneapolis-dueling-messages.html
83,2026-01-30-22-33-18 +0000,nyt,Trump’s Lawsuit Against I.R.S. Creates ‘Enormous Conflict of Interest’,https://www.nytimes.com/2026/01/30/us/politics/trump-lawsuit-irs-taxes.html
82,2026-01-30-20-12-57 +0000,nyt,Trump Says Putin Agreed to a Weeklong Pause in Attacks Amid Extreme Cold,https://www.nytimes.com/2026/01/29/us/politics/trump-putin-ceasefire-cold.html
82,2026-01-30-10-03-44 +0000,nyt,Fact-Checking Trump Officials on Minnesota After Shootings by Federal Agents,https://www.nytimes.com/2026/01/30/us/politics/minneapolis-trump-renee-good-alex-pretti.html
81,2026-01-30-16-36-57 +0000,wapo,"Trump tightens screws on Cuba, threatening tariffs on oil suppliers",https://www.washingtonpost.com/national-security/2026/01/29/cuba-trump-rubio-oil-executive-order/
81,2026-01-31-01-25-43 +0000,bbc,Former CNN host Don Lemon charged in anti-ICE protest at Minnesota church,https://www.bbc.com/news/articles/c24gm3dz36po?at_medium=RSS&at_campaign=rss
81,2026-01-31-05-07-00 +0000,wsj,"The Senate passed a bipartisan deal Friday to fully fund most of the federal government, but congressional action came too late to head off a partial government shutdown that started Saturday morning",https://www.wsj.com/politics/policy/senate-set-to-vote-on-deal-ahead-of-partial-government-shutdown-7bc3968b
80,2026-01-30-13-19-45 +0000,cbc,"Trump aviation threats that would affect Bombardier, Gulfstream and others: What we know",https://www.cbc.ca/news/business/trump-threats-bombardier-gulfstream-planes-9.7067766?cmp=rss
80,2026-01-30-21-10-59 +0000,nyt,Stock Market Takes Kevin Warsh’s Fed Nomination in Stride,https://www.nytimes.com/live/2026/01/30/us/trump-news/stock-market-kevin-warsh-fed
80,2026-01-31-06-31-13 +0000,latimes,"Latest Epstein files include emails between Ghislaine Maxwell, LA28 Olympics head Casey Wasserman",https://www.latimes.com/california/story/2026-01-30/epstein-files-show-emails-between-la28-olympics-head-ghislaine-maxwell
80,2026-01-30-09-44-29 +0000,nyt,"How His Duel With Trump Boosted Emmanuel Macron, France’s Embattled President",https://www.nytimes.com/2026/01/29/world/europe/macron-france-trump-sunglasses-boost.html
80,2026-01-30-21-03-00 +0000,wsj,Opinion | Donald J. Trump: My Tariffs Have Brought America Back,https://www.wsj.com/opinion/donald-j-trump-my-tariffs-have-brought-america-back-2248391b
80,2026-01-30-21-06-12 +0000,nyt,Why Trump Is Going After Iran Now,https://www.nytimes.com/video/world/middleeast/100000010675129/why-trump-is-going-after-iran-now.html
80,2026-01-30-17-21-13 +0000,nyt,F.B.I. Search in Georgia Shows Trump’s Willingness to Pursue 2020 Grievances,https://www.nytimes.com/2026/01/30/us/politics/georgia-trump-election.html
79,2026-01-31-06-40-36 +0000,nypost,"Jeffrey Epstein was permanently banned from Xbox Live due to Microsoft-NY sex offender policy, new files reveal",https://nypost.com/2026/01/31/us-news/jeffrey-epstein-was-banned-from-xbox-live-due-to-microsoft-ny-sex-offender-policy-new-files-reveal/
79,2026-01-30-15-29-35 +0000,nyt,Is the ‘Influencer Right’ at Odds With Trump Over Minnesota?,https://www.nytimes.com/2026/01/30/style/maga-trump-base-minnesota.html
78,2026-01-30-17-52-43 +0000,nypost,New Ghislaine Maxwell mugshot revealed in latest Epstein files dump,https://nypost.com/2026/01/30/us-news/new-ghislaine-maxwell-mugshot-revealed-in-epstein-files/
77,2026-01-30-12-24-48 +0000,nypost,How Trump’s Donroe Doctrine rewrote US foreign aid playbook,https://nypost.com/2026/01/30/us-news/trumps-state-department-makes-foreign-aid-america-first-official/
74,2026-01-30-19-49-14 +0000,nypost,Who is Kevin Warsh? Here’s what you need to know about his path to the Fed,https://nypost.com/2026/01/30/business/kevin-warshs-path-to-the-fed-wall-street-the-2008-crash-and-trump/
73,2026-01-31-05-01-07 +0000,nyt,How Europe Is Moving to Reduce Dependence on Trump,https://www.nytimes.com/2026/01/31/world/europe/eu-trump-greenland-europe.html
71,2026-01-30-17-00-24 +0000,nypost,Hochul takes direct hit at Bruce Blakeman with new anti-ICE proposal — but denies playing politics,https://nypost.com/2026/01/30/us-news/kathy-hochul-hits-at-bruce-blakeman-with-anti-ice-proposal-but-denies-playing-politics/
70,2026-01-31-04-03-13 +0000,eltecolote,"Students, teachers walk out as San Francisco joins national protest against ICE",https://eltecolote.org/content/en/ice-walkout-san-francisco/
69,2026-01-31-01-20-08 +0000,nypost,Anti-ICE protesters clash with fed agents outside DTLA federal building,https://nypost.com/2026/01/30/us-news/anti-ice-protesters-clash-with-fed-agents-outside-dtla-federal-building/
64,2026-01-30-22-27-00 +0000,wsj,Wall Street Can’t Decide Whether Kevin Warsh Will Be a Friend or Foe,https://www.wsj.com/finance/investing/wall-street-cant-decide-whether-kevin-warsh-will-be-a-friend-or-foe-3d344c67?mod=rss_markets_main
63,2026-01-31-02-15-44 +0000,nypost,Andrew Mountbatten-Windsor appears to be crouching over woman in creepy photos from DOJ’s latest Epstein files dump,https://nypost.com/2026/01/30/us-news/andrew-mountbatten-windsor-appears-to-be-crouching-over-woman-in-creepy-photos-from-dojs-latest-epstein-files-dump/
63,2026-01-31-04-39-30 +0000,nypost,"Giants owner Steve Tisch admits to emailing Epstein about ‘adult women,’ but insists he never accepted ‘any of his invitations’",https://nypost.com/2026/01/30/us-news/giants-owner-steve-tisch-admits-to-emailing-epstein-about-adult-women-but-insists-he-never-accepted-any-of-his-invitations/
62,2026-01-30-19-15-07 +0000,nyt,Car Hits High School Student in Nebraska During an Anti-ICE Protest,https://www.nytimes.com/2026/01/30/us/high-school-student-ice-protes-nebraska.html
62,2026-01-30-22-41-00 +0000,wsj,Opinion | Kevin Warsh on the Fed’s Mistakes and the Consequences,https://www.wsj.com/opinion/kevin-warsh-on-the-feds-mistakes-and-the-consequences-7922f46f?mod=rss_markets_main
60,2026-01-30-22-45-00 +0000,wsj,Hochul Seeks to End New York Law-Enforcement Agreements With ICE,https://www.wsj.com/politics/policy/hochul-seeks-to-end-new-york-law-enforcement-agreements-with-ice-97ab31bb
59,2026-01-30-13-51-49 +0000,bbc,"China lifts sanctions on MPs and peers, as Starmer says he hopes Xi will visit UK",https://www.bbc.com/news/articles/clyel3z9xxno?at_medium=RSS&at_campaign=rss
59,2026-01-31-01-17-03 +0000,nypost,Illegal immigrant gets four years for hurling Molotov cocktail at officers during LA anti-ICE protest,https://nypost.com/2026/01/30/us-news/illegal-immigrant-busted-for-anti-ice-riot-violence/
56,2026-01-30-16-02-25 +0000,cbc,Former CNN anchor Don Lemon arrested after protest inside Minneapolis church,https://www.cbc.ca/news/world/minnesota-arrest-don-lemon-9.7067848?cmp=rss
56,2026-01-30-11-00-00 +0000,nypost,New $65K private school uses AI to teach students in just two hours a day — in Silicon Valley bid to shake up US education,https://nypost.com/2026/01/30/business/new-65k-private-school-uses-ai-to-teach-students-in-just-two-hours-a-day-in-silicon-valley-bid-to-shake-up-us-education/
56,2026-01-31-03-38-41 +0000,nyt,"Musk and Epstein Exchanged Emails About Visiting One Another, Documents Show",https://www.nytimes.com/2026/01/30/us/elon-musk-epstein-emails.html
56,2026-01-31-02-12-35 +0000,nyt,Senate Passes Deal to Fund Government and Negotiate ICE Limits,https://www.nytimes.com/2026/01/30/us/politics/senate-vote-shutdown-ice.html
55,2026-01-31-04-27-58 +0000,bbc,US cities hold anti-ICE protests during nationwide day of action,https://www.bbc.com/news/articles/c78vgnz3z6eo?at_medium=RSS&at_campaign=rss
55,2026-01-30-18-01-42 +0000,nyt,How The Times Is Covering the Latest Release of Epstein Files,https://www.nytimes.com/2026/01/30/us/how-the-times-is-covering-the-latest-release-of-epstein-files.html
55,2026-01-30-16-15-04 +0000,nypost,Deputy AG Todd Blanche says DOJ releasing 3.5 million Epstein files,https://nypost.com/2026/01/30/us-news/deputy-ag-todd-blanche-says-doj-releasing-3-5-million-epstein-files-pages/
55,2026-01-30-22-40-00 +0000,wsj,Justice Department Releasing More Than 3 Million Pages of Epstein Files,https://www.wsj.com/us-news/law/justice-department-releasing-more-than-3-million-pages-of-epstein-files-9c931a43
54,2026-01-30-19-58-00 +0000,wsj,Kevin Warsh has been preparing to lead the Federal Reserve for more than a decade,https://www.wsj.com/economy/central-banking/kevin-warsh-a-fed-critic-is-now-poised-to-lead-it-7f447414
54,2026-01-31-04-36-00 +0000,wsj,What We Know So Far About the Latest Release of Epstein Files,https://www.wsj.com/us-news/law/what-we-know-so-far-about-the-latest-release-of-epstein-files-260dafba
52,2026-01-30-23-53-14 +0000,nyt,"‘Don’t hang yourself,’ Epstein’s cellmate told him, according to prosecutor’s handwritten notes.",https://www.nytimes.com/live/2026/01/30/us/epstein-files-release/dont-hang-yourself-epsteins-cellmate-told-him-according-to-prosecutors-handwritten-notes
52,2026-01-31-00-36-44 +0000,nyt,"Epstein Offered Prince Andrew a Meeting With a Russian Woman, Emails Show",https://www.nytimes.com/2026/01/30/us/politics/epstein-prince-andrew.html
52,2026-01-31-02-09-07 +0000,nypost,Mamdani still will only force homeless NYers off the streets ‘as last resort’ – even as deep freeze death toll rises to 13,https://nypost.com/2026/01/30/us-news/mamdani-still-will-only-force-homeless-nyers-off-the-streets-as-last-resort-even-as-deep-freeze-death-toll-rises-to-13/
51,2026-01-31-02-22-32 +0000,nyt,Google co-founder had long relationship with Maxwell and visited Epstein’s island.,https://www.nytimes.com/live/2026/01/30/us/epstein-files-release/epstein-maxwell-google-sergey-brin
51,2026-01-31-03-41-47 +0000,nyt,Draft Epstein Indictment Accused Him of Crimes Against More Than a Dozen Girls,https://www.nytimes.com/2026/01/30/us/politics/epstein-2007-draft-indictment.html
51,2026-01-30-17-07-38 +0000,wapo,What a new Fed chair could mean for the economy,https://www.washingtonpost.com/business/2026/01/30/kevin-warsh-fed-nomination-interest-rates/
50,2026-01-31-02-08-01 +0000,nyt,"Release of Three Million Epstein Pages Falls Short, Survivors Say",https://www.nytimes.com/2026/01/30/us/politics/epstein-files-release.html
50,2026-01-31-03-42-57 +0000,latimes,'We want a change to happen.' L.A. County students walk out over ICE raids,https://www.latimes.com/california/story/2026-01-30/los-angeles-school-students-walkout-ice-immigration-protests
49,2026-01-30-23-30-03 +0000,bbc,"Luigi Mangione will not face death penalty if convicted, judge rules",https://www.bbc.com/news/articles/c78egdg3r0po?at_medium=RSS&at_campaign=rss
49,2026-01-31-02-03-46 +0000,nyt,Emails Show Warm Relationship Between Epstein and Richard Branson,https://www.nytimes.com/2026/01/30/us/politics/epstein-emails-richard-branson.html
49,2026-01-30-20-55-00 +0000,wsj,"Fed Pick Pushes Longer-Term Treasury Yields Up, Short-Term Down",https://www.wsj.com/finance/jgb-futures-edge-higher-tracking-price-gains-in-u-s-treasury-market-7c0e31e6?mod=rss_markets_main
49,2026-01-30-20-31-56 +0000,missionlocal,San Francisco joins nationwide anti-ICE walkouts with Dolores Park rally,https://missionlocal.org/2026/01/sf-ice-out-protest-strike-walkout/
49,2026-01-31-00-16-45 +0000,startribune,"The latest: Protests in Minneapolis, across country Friday as ICE pushback mounts",https://www.startribune.com/ice-raids-minnesota/601546426
49,2026-01-30-20-20-49 +0000,missionlocal,Lawsuit that halted ICE courthouse arrests in Northern California could go national,https://missionlocal.org/2026/01/california-lawsuit-ice-courthouse-arrests-detention-nationwide/
48,2026-01-31-08-42-28 +0000,bbc,Takeaways from the millions of newly released Epstein files,https://www.bbc.com/news/articles/cevnmxyy4wjo?at_medium=RSS&at_campaign=rss
48,2026-01-30-14-43-05 +0000,nyt,The Netherlands Is Getting a New Government. Will It Last?,https://www.nytimes.com/2026/01/30/world/europe/netherlands-government-rob-jetten.html
47,2026-01-30-20-06-20 +0000,bbc,"Epstein sent £10,000 to Mandelson's partner, released emails show",https://www.bbc.com/news/articles/c2lgqd2n9w2o?at_medium=RSS&at_campaign=rss
47,2026-01-30-23-30-19 +0000,nypost,"Jeffrey Epstein gifted ex-Obama lawyer $9,400 Hermes bag, spa at Four Seasons: ‘Needs some pampering’",https://nypost.com/2026/01/30/us-news/jeffrey-epstein-gifted-ex-obama-counsel-9400-hermes-bag-spa-trip-at-four-seasons/
45,2026-01-30-23-12-35 +0000,nypost,Disney CEO Bob Iger plans to step down before contract expires at end of year: report,https://nypost.com/2026/01/30/business/disney-ceo-bob-iger-plans-to-step-down-before-contract-expires-at-end-of-year-report/
45,2026-01-31-01-05-20 +0000,nyt,"Epstein contacted women for Steve Tisch, co-owner of the Giants.",https://www.nytimes.com/live/2026/01/30/us/epstein-files-release/epstein-giants-steve-tisch
44,2026-01-30-17-11-07 +0000,nyt,"Algae Growth on Greenland’s Ice Contributes to Melting, Studies Show",https://www.nytimes.com/2026/01/30/climate/greenland-algae-melting-icesheet.html
44,2026-01-31-00-20-26 +0000,nyt,Here’s What to Know About the Millions of Pages of Epstein Documents,https://www.nytimes.com/2026/01/30/us/what-to-know-epstein-files.html
44,2026-01-31-00-16-48 +0000,nyt,"After ICE Took Liam Conejo Ramos, 2 Students From Same School Enter Detention",https://www.nytimes.com/2026/01/30/us/valley-view-elementary-minnesota-children-ice-detention.html
44,2026-01-30-21-47-00 +0000,wsj,Iger Has Told Associates He Plans to Leave CEO Role Before Contract Expires,https://www.wsj.com/business/media/iger-has-told-associates-he-plans-to-leave-ceo-role-before-contract-expires-35406a7b?mod=pls_whats_news_us_business_f
