score,pubdate,source,title,link
94,2026-05-10-13-12-05 +0000,nypost,"Iran tests cease-fire yet again with drone strikes on Gulf states, cargo ship as Trump awaits peace proposal response",https://nypost.com/2026/05/10/world-news/iran-continues-to-test-cease-fire-with-drone-strikes-on-gulf-states-and-cargo-ship/
92,2026-05-11-01-12-30 +0000,bbc,Oil prices jump after Trump dismisses Iran proposal to end war,https://www.bbc.com/news/articles/ckgp4ev4yg4o?at_medium=RSS&at_campaign=rss
91,2026-05-11-01-55-13 +0000,bbc,Trump calls Iran response to US proposal to end war 'totally unacceptable',https://www.bbc.com/news/articles/clypgz9e5pmo?at_medium=RSS&at_campaign=rss
79,2026-05-11-06-52-00 +0000,wsj,Oil Climbs as Trump Rejects Iran’s Response to U.S. Peace Proposal,https://www.wsj.com/finance/commodities-futures/oil-rises-amid-signs-of-ongoing-middle-east-tensions-6528c9c6?mod=rss_markets_main
78,2026-05-11-05-39-00 +0000,wsj,U.S. Treasury Yields Rise as Trump Dismisses Iran’s Response to Peace Proposal,https://www.wsj.com/finance/investing/jgb-futures-edge-lower-weighed-by-worries-over-higher-inflation-44755ed6?mod=rss_markets_main
71,2026-05-11-00-48-30 +0000,nyt,Trump Says Iran’s Response to Latest U.S. Proposal ‘Totally Unacceptable’,https://www.nytimes.com/2026/05/10/us/politics/iran-war-us-peace-proposal-response.html
65,2026-05-10-12-51-58 +0000,cbc,Trump calls ceasefire counter-proposal from Iran 'totally unacceptable',https://www.cbc.ca/news/world/iran-us-ceasefire-drone-attacks-9.7194290?cmp=rss
64,2026-05-11-03-00-00 +0000,wsj,The U.S. Tied His Bank to Iran Proxies. Now He’s Trump’s Choice to Run Iraq.,https://www.wsj.com/world/middle-east/the-u-s-tied-his-bank-to-iran-proxies-now-hes-trumps-choice-to-run-iraq-ea6117ae
64,2026-05-11-00-39-36 +0000,nyt,Trump and Netanyahu Say Iran War Is Not Over,https://www.nytimes.com/2026/05/10/us/politics/trump-netanyahu-iran-war.html
59,2026-05-10-19-50-47 +0000,nypost,"Kennedy scion Jack Schlossberg opposes military support for Israel, claims US already lost war in Iran",https://nypost.com/2026/05/10/us-news/jack-schlossberg-opposes-military-support-for-israel/
58,2026-05-10-15-52-28 +0000,nypost,"Trump vows to confiscate Iran’s nuclear material, says it’s monitored by Space Force",https://nypost.com/2026/05/10/us-news/trump-vows-to-confiscate-irans-nuclear-material/
56,2026-05-10-18-47-00 +0000,nypost,British army drops paratroopers onto remote Atlantic island to help hantavirus-infected cruise ship passenger,https://nypost.com/2026/05/10/world-news/british-army-uses-paratroopers-help-hantavirus-infected-cruise-ship-passenger/
54,2026-05-10-23-00-00 +0000,wsj,Iran War Hangs Over China Summit,https://www.wsj.com/world/trump-xi-meeting-iran-war-409c4ea1
53,2026-05-10-19-08-42 +0000,nypost,"Trump admin open to pausing gas tax, Energy secretary says — here’s how much it would save drivers",https://nypost.com/2026/05/10/us-news/trump-admin-open-to-pausing-gas-tax-energy-secretary-says/
52,2026-05-11-07-47-02 +0000,nyt,Oil Prices Rise as Prospects for U.S.-Iran Peace Deal Fizzle,https://www.nytimes.com/2026/05/10/business/oil-stocks-iran-war.html
52,2026-05-10-09-00-00 +0000,wapo,Iran war threatens the dream of a post-oil economy in the Gulf,https://www.washingtonpost.com/business/2026/05/10/iran-war-oil-gulf-economies/
52,2026-05-11-05-39-27 +0000,bbc,Trump and Xi are set to meet. Where do US-China tariffs stand?,https://www.bbc.com/news/articles/c3rz75rgn8zo?at_medium=RSS&at_campaign=rss
49,2026-05-10-19-52-44 +0000,nyt,"Trump Administration Is Considering Pausing the Federal Gas Tax to Lower Prices, Energy Secretary Says",https://www.nytimes.com/2026/05/10/us/politics/energy-secretary-federal-gas-tax.html
49,2026-05-10-15-41-02 +0000,nypost,Iran refuses to address nuclear program in latest peace deal response to US,https://nypost.com/2026/05/10/world-news/iran-refuses-to-address-nuclear-program-in-latest-peace-deal-response-to-us/
47,2026-05-10-21-13-47 +0000,bbc,BBC speaks with civilians inside Iran struggling with impact of war,https://www.bbc.com/news/videos/c2429dq0j4mo?at_medium=RSS&at_campaign=rss
47,2026-05-11-07-13-41 +0000,bbc,Modi urges Indians to work from home and limit foreign travel as Iran war continues,https://www.bbc.com/news/articles/c8r8e2ne1v6o?at_medium=RSS&at_campaign=rss
44,2026-05-10-18-31-24 +0000,nypost,"Trump’s top economic adviser predicts explosive 6% annual GDP growth, nearly triple most forecasts",https://nypost.com/2026/05/10/us-news/trumps-top-economic-adviser-predicts-explosive-6-annual-gdp-growth-nearly-triple-most-forecasts/
44,2026-05-10-22-25-00 +0000,wsj,"Iran’s Supreme Leader Is MIA, Just When Negotiators Need Him Most",https://www.wsj.com/world/middle-east/irans-supreme-leader-is-mia-just-when-negotiators-need-him-most-eb4bdc56
43,2026-05-11-06-42-00 +0000,wsj,Dollar Rises on Worries Over Renewed Iran War Tensions,https://www.wsj.com/finance/currencies/yen-mostly-weakens-amid-mild-risk-on-sentiment-a64abcde?mod=rss_markets_main
43,2026-05-10-10-00-00 +0000,latimes,Taiwan fears Trump will speak off-script on its fate in Beijing,https://www.latimes.com/politics/story/2026-05-10/taiwan-fears-trump-will-speak-off-script-on-its-fate-in-beijing
43,2026-05-11-07-40-17 +0000,wsj,Stock Market Today: Oil Climbs as U.S.-Iran Diplomacy Yields Little Progress,https://www.wsj.com/livecoverage/stock-market-today-dow-sp-500-nasdaq-05-11-2026?mod=rss_markets_main
42,2026-05-11-01-42-50 +0000,nyt,"Why the Trump-Xi Summit Matters, Even if Little Seems to Come of It",https://www.nytimes.com/2026/05/09/world/asia/trump-xi-china-us-summit.html
42,2026-05-11-07-26-00 +0000,wsj,Gold Falls 1% as U.S.-Iran Deadlock Fuels Oil-Driven Inflation Fears,https://www.wsj.com/finance/commodities-futures/gold-falls-on-renewed-inflation-concerns-b40dcaa2?mod=rss_markets_main
42,2026-05-10-21-29-56 +0000,bbc,What comes next for US passengers evacuated from hantavirus-hit cruise ship,https://www.bbc.com/news/articles/cn4pq1y1zjgo?at_medium=RSS&at_campaign=rss
42,2026-05-10-16-58-38 +0000,nypost,Trump still wants to crack open Fort Knox to personally confirm $700B gold cache has not been stolen,https://nypost.com/2026/05/10/us-news/trump-still-wants-to-crack-open-fort-knox-to-personally-confirm-700b-gold-cache-has-not-been-stolen/
42,2026-05-10-17-45-28 +0000,bbc,Trump touts 'American Flag Blue' paint job on Lincoln Memorial Reflecting Pool,https://www.bbc.com/news/articles/c2l2kpyk717o?at_medium=RSS&at_campaign=rss
40,2026-05-11-03-29-58 +0000,bbc,French national shows symptoms on return from hantavirus-hit ship,https://www.bbc.com/news/articles/c3r2p70jdy7o?at_medium=RSS&at_campaign=rss
40,2026-05-10-22-27-58 +0000,nyt,Cruise Ship Linked to Hantavirus Outbreak Arrives in Spain’s Canary Islands for Disembarking,https://www.nytimes.com/2026/05/10/world/europe/hantavirus-cruise-ship-canary-islands.html
39,2026-05-10-16-37-00 +0000,wsj,Hantavirus Cruise Passengers Head for Home Countries After Ship Reaches Port,https://www.wsj.com/world/hantavirus-cruise-ship-arrives-as-passengers-prepare-for-repatriation-1bbf8528
39,2026-05-11-03-33-52 +0000,nypost,"1 American returning from hantavirus-stricken cruise showing symptoms, another US passenger postive: HHS",https://nypost.com/2026/05/10/us-news/1-american-returning-from-hantavirus-stricken-cruise-showing-symptoms-another-postive-hhs/
39,2026-05-11-04-01-08 +0000,nyt,What Middle Powers Fear from the Trump-Xi Summit,https://www.nytimes.com/2026/05/11/world/asia/trump-xi-china-summit-iran.html
38,2026-05-10-11-00-00 +0000,wsj,"China is increasingly dominating high-tech industries, while the low-value manufacturing sectors that powered the country’s rise are becoming less important economic drivers",https://www.wsj.com/world/asia/the-factory-town-known-as-chinas-furniture-capital-is-fighting-to-survive-0875bc99
38,2026-05-11-04-11-00 +0000,wsj,China’s Factory-Gate Price Growth Beats Expectations as Mideast War Fuels Inflation,https://www.wsj.com/economy/china-factory-gate-prices-rise-for-second-straight-month-3a2acbb2
38,2026-05-11-02-48-20 +0000,nypost,French national suffering symptoms on return trip from hantavirus-striken cruise,https://nypost.com/2026/05/10/world-news/french-national-suffering-symptoms-on-return-trip-from-hantavirus-hit-cruise/
38,2026-05-11-02-05-37 +0000,nypost,State senator demands California escalate war with State Farm by hitting it where it hurts most,https://nypost.com/2026/05/10/us-news/state-senator-demands-california-escalate-war-with-state-farm-by-hitting-it-where-it-hurts-most/
37,2026-05-10-20-56-12 +0000,latimes,"Californian exposed to hantavirus aboard cruise ship resides in Bay Area, officials say",https://www.latimes.com/california/story/2026-05-10/californian-exposed-to-hantavirus-lives-in-bay-area-officials-say
36,2026-05-10-11-00-00 +0000,wsj,We Asked a Church Group to Weigh In on Trump. Here’s What They Said.,https://www.wsj.com/us-news/we-asked-a-church-group-to-weigh-in-on-trump-heres-what-they-said-df0809fa
35,2026-05-10-20-02-00 +0000,wsj,Opinion | The Stakes of the Trump-Xi Summit,https://www.wsj.com/opinion/the-stakes-of-the-trump-xi-summit-97131c0c
35,2026-05-10-19-51-01 +0000,nyt,Vance or Rubio? Trump Muses on Successor as the ‘Kids’ Fill Bigger Roles.,https://www.nytimes.com/2026/05/10/us/politics/vance-rubio-trump-succession.html
35,2026-05-11-05-28-28 +0000,nyt,What to Know About the Hantavirus Outbreak on an Atlantic Cruise Ship,https://www.nytimes.com/article/hantavirus-cruise-ship-outbreak-hondius.html
34,2026-05-11-06-55-06 +0000,nypost,50-year-old missing persons cold case cracked after remains of San Francisco woman found in Texas ID’d,https://nypost.com/2026/05/11/us-news/missing-persons-cold-case-cracked-after-remains-of-san-francisco-woman-found-in-texas-idd-as-cheryl-lanier/
34,2026-05-11-02-00-00 +0000,wsj,"Women are playing a bigger role in the American labor market. Occupations with heavily male workforces have been losing jobs, and the share of men working has flatlined.",https://www.wsj.com/economy/jobs/a-changing-job-market-leans-against-men-ec4d6d68
33,2026-05-10-13-26-57 +0000,nyt,"Which Trump Tariffs Are in Place, in the Works or Ruled Illegal",https://www.nytimes.com/2026/05/09/business/economy/trump-tariff-timeline.html
33,2026-05-10-09-01-27 +0000,nyt,Mass Layoffs in Iran as Businesses Buckle Under Wartime Pressures,https://www.nytimes.com/2026/05/10/world/middleeast/iran-economy-layoffs.html
32,2026-05-10-12-35-46 +0000,nyt,"After Capturing Maduro, Trump Celebrated Victory. Did It Bring Venezuelans Home?",https://www.nytimes.com/2026/05/10/world/americas/venezuela-maduro-trump-migration.html
32,2026-05-10-22-19-24 +0000,wapo,Trump administration moves to make fertility benefits easier to access,https://www.washingtonpost.com/business/2026/05/10/trump-administration-fertility-ivf-benefits/
32,2026-05-11-07-38-00 +0000,wsj,European Gas Prices Rise on Stalled Peace Talks But LNG Transits Limit Gains,https://www.wsj.com/finance/commodities-futures/european-gas-prices-rise-on-stalled-peace-talks-but-lng-transits-limit-gains-d58e7a57?mod=rss_markets_main
32,2026-05-10-15-02-51 +0000,bbc,Army parachutes onto remote island to help Briton with suspected hantavirus,https://www.bbc.com/news/articles/cvgzv77ldpdo?at_medium=RSS&at_campaign=rss
31,2026-05-11-00-40-45 +0000,bbc,Ailing Iran Nobel laureate given bail and hospital transfer,https://www.bbc.com/news/articles/c1j257w87neo?at_medium=RSS&at_campaign=rss
30,2026-05-11-00-30-56 +0000,bbc,Chris Mason: Another crunch moment for Starmer as he pleads with Labour MPs not to topple him,https://www.bbc.com/news/articles/cevp4kr79e4o?at_medium=RSS&at_campaign=rss
30,2026-05-11-03-10-52 +0000,nyt,Thailand’s Thaksin Shinawatra Is Out of Prison. What Will He Do Now?,https://www.nytimes.com/2026/05/10/world/asia/thailand-thaksin-shinawatra-released-prison.html
30,2026-05-10-23-32-40 +0000,bbc,"This couple lost £1,000 after their flight was cancelled - here is what to check so you don't",https://www.bbc.com/news/articles/cx215yldr13o?at_medium=RSS&at_campaign=rss
30,2026-05-10-20-05-53 +0000,bbc,Tourist hotspot at 'end of the world' denies causing hantavirus outbreak,https://www.bbc.com/news/articles/cx21ej471g2o?at_medium=RSS&at_campaign=rss
29,2026-05-10-10-35-13 +0000,nyt,"Punch, the Lonely Monkey Who Drew Crowds to a Small Japan Zoo, Is Growing Up. He’s Still a Star.",https://www.nytimes.com/2026/05/09/world/asia/punch-baby-monkey-japan-zoo.html
29,2026-05-11-01-15-17 +0000,48hills,San Francisco could tax the rich—locally—and avoid brutal cuts to city services. Here’s how,https://48hills.org/2026/05/san-francisco-could-tax-the-rich-and-avoid-brutal-cuts-to-city-services-heres-how/
29,2026-05-10-13-49-01 +0000,nyt,British Paratroopers Deliver Aid to Remote Islands With Possible Hantavirus Case,https://www.nytimes.com/2026/05/10/world/europe/britain-parachute-hantavirus-hondius-tristan.html
29,2026-05-10-19-56-45 +0000,bbc,His father had just been buried. Then West Bank settlers forced him to dig up the body,https://www.bbc.com/news/articles/cjrpnjpl39po?at_medium=RSS&at_campaign=rss
29,2026-05-10-20-03-24 +0000,nypost,Biden advisor points out huge hypocrisy in supporters of Tom Steyer for California governor,https://nypost.com/2026/05/10/us-news/biden-aide-points-out-hypocrisy-in-supporters-of-tom-steyer-for-calif-governor/
28,2026-05-10-21-01-17 +0000,bbc,Iranian activist tells BBC how fear of war restarting intensifies trauma of repression,https://www.bbc.com/news/articles/c1m2ee3jxvro?at_medium=RSS&at_campaign=rss
28,2026-05-11-00-35-41 +0000,latimes,'Extremely scary': Specter of an all-GOP governor's race spurs push to remake open primary,https://www.latimes.com/politics/story/2026-05-10/push-to-change-california-open-primary
28,2026-05-10-10-06-32 +0000,nypost,"NYPD captain’s transfer after viral rant bashing Mamdani shows City Hall has two sets of rules for Dems, Republicans: critics",https://nypost.com/2026/05/10/us-news/nypd-captains-transfer-after-viral-rant-shows-city-hall-has-two-sets-of-rules-for-dems-and-republicans-critics/
27,2026-05-10-16-00-00 +0000,wsj,The Simple Fix Small-Town Schools Are Using to Keep Teens Out of Dead-End Jobs,https://www.wsj.com/personal-finance/the-simple-fix-small-town-schools-are-using-to-keep-teens-out-of-dead-end-jobs-89383278
27,2026-05-11-05-23-56 +0000,nypost,Owner of eatery that created the Philly cheesesteak will cook at Long Island pizzeria in Knicks gear after losing bet,https://nypost.com/2026/05/11/us-news/owner-of-eatery-that-created-the-philly-cheesesteak-will-cook-at-long-island-pizzeria-in-knicks-gear-after-losing-bet/
26,2026-05-10-22-51-17 +0000,nypost,Knicks fans score against hapless Philly even at Sixers’ arena: ‘All you can see is blue and orange’,https://nypost.com/2026/05/10/us-news/knicks-fans-score-against-hapless-philly-even-at-sixers-arena/
26,2026-05-10-22-41-44 +0000,nypost,"Massive 5-pound, 11,000-carat rare ruby discovered by miners in war-torn Myanmar",https://nypost.com/2026/05/10/world-news/massive-5-pound-11000-carat-rare-ruby-discovered-by-miners-in-war-torn-myanmar/
26,2026-05-11-06-24-22 +0000,nyt,American Passengers Exposed to Hantavirus Are Flying Back to the U.S.,https://www.nytimes.com/2026/05/10/us/americans-hantavirus-ship-return-nebraska.html
26,2026-05-10-10-00-00 +0000,latimes,Barabak: This is the most compelling California governor's race in ages. Really.,https://www.latimes.com/politics/story/2026-05-10/california-governors-race-elitism-snobbery-voter-disconnect
25,2026-05-11-03-12-54 +0000,nypost,Pennsylvania creep allegedly sparked house fire that left Army vet dead after resident ‘rejected’ his advances,https://nypost.com/2026/05/10/us-news/pennsylvania-man-allegedly-sparked-deadly-house-fire-after-resident-rejected-his-advances/
25,2026-05-11-01-22-31 +0000,nypost,Moment Frontier Airlines plane strikes person on Denver runway seen in horrifying new video,https://nypost.com/2026/05/10/us-news/moment-frontier-airlines-plane-strikes-person-on-denver-runway-seen-in-new-video/
25,2026-05-11-07-27-45 +0000,nypost,Terrifying videos show Frontier Airlines passengers fleeing smoke-filled cabin after jet strikes person on Denver runway,https://nypost.com/2026/05/11/us-news/terrifying-videos-show-frontier-airlines-passengers-fleeing-smoke-filled-cabin-after-jet-strikes-person-on-denver-runway/
25,2026-05-11-01-00-00 +0000,wsj,"Xi’s China: Dazzling Technology, Military Muscle—and an Economic Mess",https://www.wsj.com/world/china/xi-china-technology-military-economy-mess-10eb1e22
25,2026-05-10-10-00-44 +0000,wapo,N.J. World Cup games will be in a county that bans most shopping on Sundays,https://www.washingtonpost.com/nation/2026/05/10/bergen-county-blue-laws-world-cup/
24,2026-05-10-18-26-07 +0000,latimes,"Three dead, four injured in two-car crash in San Bernardino County",https://www.latimes.com/california/story/2026-05-10/three-dead-four-hurt-in-two-car-crash-in-san-bernardino-county
24,2026-05-11-00-07-29 +0000,nypost,Subway ridership surges as gas prices cripple SoCal but service cuts are coming,https://nypost.com/2026/05/10/us-news/subway-ridership-surges-as-gas-prices-cripple-socal-but-service-cuts-are-coming/
24,2026-05-10-16-51-58 +0000,nypost,Kamala’s cash crisis: Big donors turn their backs on Harris as 2028 bid already hangs by a thread,https://nypost.com/2026/05/10/us-news/big-donors-turn-their-backs-on-kamala-harris-as-2028-bid/
24,2026-05-10-19-09-51 +0000,nyt,Democratic Angst Could Lead California to Change Primary Rules,https://www.nytimes.com/2026/05/10/us/california-primary-rules-change-democrats.html
24,2026-05-11-07-30-06 +0000,bbc,US national on repatriation flight tests positive for hantavirus,https://www.bbc.com/news/articles/cjep78l5835o?at_medium=RSS&at_campaign=rss
24,2026-05-10-12-48-53 +0000,bbc,Sarwar says he will 'absolutely' stay on as Labour leader,https://www.bbc.com/news/articles/clypgg10p83o?at_medium=RSS&at_campaign=rss
23,2026-05-10-23-21-26 +0000,latimes,Amazon halts high-speed e-bike sales in California following fatal crashes,https://www.latimes.com/california/story/2026-05-10/amazon-removes-high-speed-e-bikes-following-fatal-collisions
23,2026-05-10-21-03-01 +0000,nypost,"Remains of US soldier who fell off cliff in Morocco recovered, 2nd soldier still missing",https://nypost.com/2026/05/10/world-news/remains-of-us-soldier-who-fell-off-cliff-in-morocco-recovered-2nd-soldier-still-missing/
23,2026-05-10-16-00-00 +0000,wsj,Israel’s Clandestine War Base in Iraq,https://www.wsj.com/world/middle-east/israels-clandestine-war-base-in-iraq-ca9a864c
23,2026-05-10-10-21-00 +0000,wsj,Saudi Aramco Profit Jumps Despite War Disrupting Shipping Routes,https://www.wsj.com/business/earnings/saudi-aramco-q1-2026-earnings-1c35f91c?mod=pls_whats_news_us_business_f
23,2026-05-10-12-30-00 +0000,nypost,California DA tears into Gavin Newsom for letting convicted rapist and murderer walk free,https://nypost.com/2026/05/10/us-news/california-da-tears-into-gavin-newsom-for-letting-convicted-rapist-and-murderer-walk-free/
23,2026-05-10-21-00-00 +0000,wsj,Retail Media Networks Are In Their ‘Gangly Teenager’ Phase. They’re Trying to Grow Up.,https://www.wsj.com/cmo-today/retail-media-networks-are-in-their-gangly-teenager-phase-theyre-trying-to-grow-up-15ddd9ea?mod=pls_whats_news_us_business_f
23,2026-05-10-13-11-55 +0000,nypost,AOC says her ‘ambition is way bigger than’ becoming president in dramatic response to 2028 question,https://nypost.com/2026/05/10/us-news/aoc-says-her-ambition-is-way-bigger-than-becoming-president-after-2028-question/
22,2026-05-11-00-38-34 +0000,nypost,"‘Quiet Place 3’ in NYC’s Chinatown causes chaos as Mamdani, City Hall blamed for ruining Mother’s Day",https://nypost.com/2026/05/10/us-news/quiet-place-3-in-nycs-chinatown-causes-chaos-as-city-hall-blamed-for-ruining-mothers-day/
22,2026-05-10-11-57-46 +0000,nyt,Kristin Smart Search Ends Without Recovery of Remains at California Property,https://www.nytimes.com/2026/05/09/us/kristin-smart-search-no-remains-recovered-california-property.html
22,2026-05-10-13-56-43 +0000,bbc,Putin says he thinks Ukraine conflict 'coming to an end',https://www.bbc.com/news/articles/cn8p4j2jzwwo?at_medium=RSS&at_campaign=rss
22,2026-05-10-13-20-13 +0000,nypost,North Korean constitution now requires nuclear missile strike if Kim Jong Un is killed by foreign power,https://nypost.com/2026/05/10/world-news/north-korean-constitution-now-requires-nuclear-missile-strike-if-kim-jong-un-is-killed-or-loses-power/
21,2026-05-10-20-07-30 +0000,bbc,Body of US soldier who went missing in Morocco has been found and identified,https://www.bbc.com/news/articles/cvgz7p5ggg7o?at_medium=RSS&at_campaign=rss
21,2026-05-11-04-33-07 +0000,nypost,Long Island cops fatally shoot son accused of stabbing disabled mom on Mother’s Day,https://nypost.com/2026/05/11/us-news/long-island-cops-fatally-shoot-son-accused-of-stabbing-disabled-mom-on-mothers-day/
21,2026-05-10-21-42-44 +0000,nyt,"Keir Starmer Says No, He Won’t Resign",https://www.nytimes.com/2026/05/10/world/europe/starmer-west-resign.html
21,2026-05-10-17-50-12 +0000,eltecolote,Feeling like you can’t do it all? How to rethink being the ‘ideal’ mother,https://eltecolote.org/content/en/perfect-mom-advice/
21,2026-05-10-14-37-16 +0000,bbc,Australia's right-wing One Nation party scores historic parliamentary win,https://www.bbc.com/news/articles/cwy2e4z4npro?at_medium=RSS&at_campaign=rss
20,2026-05-10-15-53-16 +0000,cbc,"Despite strained ties, U.S. senator says Canada should be cautious of making deals with China",https://www.cbc.ca/news/politics/chinese-evs-canada-united-states-china-cusma-free-trade-deal-9.7194402?cmp=rss
20,2026-05-10-11-29-29 +0000,nyt,U.S.-China Rivalry Reaches South American Skies,https://www.nytimes.com/2026/05/10/world/americas/us-china-telescope-argentina-chile.html
20,2026-05-10-11-00-00 +0000,wsj,The Factory Town Known as China’s Furniture Capital Is Fighting to Survive,https://www.wsj.com/world/asia/the-factory-town-known-as-chinas-furniture-capital-is-fighting-to-survive-0875bc99?mod=pls_whats_news_us_business_f
20,2026-05-11-07-49-00 +0000,wsj,India Asks Locals to Pause Gold Buying in Bid to Shore Up FX Defenses,https://www.wsj.com/economy/india-asks-locals-to-pause-gold-buying-in-bid-to-shore-up-fx-defenses-9da22889
20,2026-05-10-15-59-00 +0000,wsj,Opinion | The California Democratic Party’s Unappetizing Buffet,https://www.wsj.com/opinion/the-california-democratic-partys-unappetizing-buffet-7fb70b5a
19,2026-05-11-05-56-21 +0000,bbc,Haggling prices and chasing debts - tradespeople hit with cost of living headache,https://www.bbc.com/news/articles/c4gd4nl23rro?at_medium=RSS&at_campaign=rss
19,2026-05-11-07-14-52 +0000,nypost,Hegseth says Pentagon will review Mark Kelly’s public statements about classified briefing amid ongoing feud,https://nypost.com/2026/05/11/us-news/hegseth-says-pentagon-will-review-mark-kellys-public-statements-about-classified-briefing-amid-ongoing-feud/
19,2026-05-10-15-00-00 +0000,wsj,A Blunt Judge and Two Star Litigators: The Legal Players in Musk’s OpenAI Suit,https://www.wsj.com/us-news/law/a-blunt-judge-and-two-star-litigators-the-legal-players-in-musks-openai-suit-6833811a
19,2026-05-10-11-52-00 +0000,nyt,How China’s Leader Lost Faith in His Generals,https://www.nytimes.com/2026/05/09/world/asia/china-military-generals.html
19,2026-05-10-18-17-14 +0000,bbc,Rayner issues 'last chance' warning to Starmer and backs Burnham to return,https://www.bbc.com/news/articles/c5yekp5j36zo?at_medium=RSS&at_campaign=rss
19,2026-05-10-14-26-49 +0000,bbc,Plaid Cymru's Rhun ap Iorwerth willing to 'take the fight' to Keir Starmer,https://www.bbc.com/news/articles/c62rnglzv2eo?at_medium=RSS&at_campaign=rss
19,2026-05-10-14-00-00 +0000,wsj,This Family Business Was Already Old When the U.S. Was Born,https://www.wsj.com/business/entrepreneurship/family-business-longevity-lessons-0bc84f1b?mod=pls_whats_news_us_business_f
19,2026-05-10-15-25-49 +0000,nypost,Sen. John Fetterman admits to being ‘lonely’ as moderate Dem willing to break party ranks,https://nypost.com/2026/05/10/us-news/john-fetterman-admits-to-being-lonely-as-moderate-dem-willing-to-break-party-ranks/
19,2026-05-10-19-11-13 +0000,nypost,Ohio gov candidate Vivek Ramaswamy sounds alarm about Medicaid fraud — after 288 companies found registered to same address,https://nypost.com/2026/05/10/us-news/ohio-gov-candidate-vivek-ramaswamy-sounds-alarm-about-medicaid-fraud-after-288-companies-found-registered-to-same-address/
19,2026-05-10-15-58-05 +0000,nyt,"After Virginia Redistricting Map Is Tossed, Democrats Search Desperately for a Response",https://www.nytimes.com/2026/05/10/us/politics/democrats-virginia-plans-gerrymandering.html
18,2026-05-10-21-50-51 +0000,nyt,How Nebraska’s ‘Blue Dot’ Roiled a Democratic House Primary,https://www.nytimes.com/2026/05/10/us/politics/nebraska-blue-dot-democrats-house.html
18,2026-05-11-03-47-00 +0000,wsj,China Exports More EVs Than Traditional Cars for First Time in April,https://www.wsj.com/business/autos/china-exports-more-evs-than-traditional-cars-for-first-time-in-april-e43cccbb?mod=pls_whats_news_us_business_f
18,2026-05-10-09-00-19 +0000,wapo,"Fulfilling a lifelong dream, 72-year-old will graduate from medical school",https://www.washingtonpost.com/lifestyle/2026/05/10/grandmother-medical-school-graduate-residency/
18,2026-05-10-11-00-00 +0000,missionlocal,Meet the Candidates: San Francisco’s District 4 supervisor race,https://missionlocal.org/2026/05/sf-election-district-4-sunset-candidates/
18,2026-05-10-12-00-00 +0000,missionlocal,Newly signed Valkyries star Gabby Williams was once a Mission Rec Rebel,https://missionlocal.org/2026/05/valkyries-gabby-williams-mission-rec-rebel/
