score,pubdate,source,title,link
18,2026-06-11-15-15-44 +0000,nyt,How Tesla’s Stock Listing in 2010 Enabled SpaceX’s I.P.O.,https://www.nytimes.com/2026/06/11/business/spacex-tesla-ipo-elon-musk.html
18,2026-06-10-16-32-00 +0000,wsj,Opinion | The Term ‘West Bank’ Erases Judea and Samaria’s History,https://www.wsj.com/opinion/the-term-west-bank-erases-judea-and-samarias-history-5ed2f2b0
18,2026-06-11-09-57-52 +0000,bbc,Nigeria evacuates citizens from South Africa as anti-migrant sentiment rises,https://www.bbc.com/news/articles/cq512vgyzl9o?at_medium=RSS&at_campaign=rss
18,2026-06-10-17-11-55 +0000,bbc,"Belfast knife attack disorder 'destabilising', says terror adviser",https://www.bbc.com/news/articles/cm2r0783x4go?at_medium=RSS&at_campaign=rss
18,2026-06-11-10-30-00 +0000,startribune,Souhan: Twins season looks hopeless. Next season might be canceled. Time to look ahead to 2028?,https://www.startribune.com/minnesota-twins-future-byron-buxton-mlb-lockout-jim-souhan-column/601854550
18,2026-06-11-10-03-25 +0000,bbc,Pope Leo visits Canary Islands to highlight perilous journeys of migrants,https://www.bbc.com/news/articles/cn59w6p3vd0o?at_medium=RSS&at_campaign=rss
18,2026-06-10-16-39-22 +0000,nypost,"Bari Weiss physically isolated from staff, hunkered down in locked office suite after ‘60 Minutes’ bloodbath: report",https://nypost.com/2026/06/10/media/bari-weiss-isolated-bunkered-down-in-locked-office-after-60-minutes-bloodbath-report/
17,2026-06-11-09-59-00 +0000,startribune,"Opinion | We’re spending more on youth sports, yet are producing worse athletes",https://www.startribune.com/fifa-world-cup-opening-match-2026-north-america/601854761
17,2026-06-11-11-00-01 +0000,startribune,Last call for deck drinks: Minneapolis brewery forced to demolish patio on Xcel Energy land,https://www.startribune.com/last-call-for-deck-drinks-minneapolis-brewery-forced-to-demolish-patio-on-xcel-energy-land/601855026
17,2026-06-11-10-37-00 +0000,wsj,How Wild the Market’s Bet on AI Really Is,https://www.wsj.com/finance/stocks/how-wild-the-markets-bet-on-ai-really-is-8be0e29a?mod=rss_markets_main
17,2026-06-11-15-47-26 +0000,startribune,Live: Vance Boelter pleads guilty to Hortman assassination,https://www.startribune.com/vance-boelter-plea-melissa-hortman/601855749
17,2026-06-11-15-00-00 +0000,wsj,See the VCs and Family Offices at the Core of the Mega IPO Wave,https://www.wsj.com/tech/see-the-vcs-and-family-offices-at-the-core-of-the-mega-ipo-wave-cbe96faa?mod=rss_markets_main
17,2026-06-10-18-48-32 +0000,nypost,Scientists discover deep whale graveyard with bones dating over 5 million years old,https://nypost.com/2026/06/10/science/scientists-discover-deep-whale-graveyard-with-bones-dating-over-5-million-years-old/
17,2026-06-11-13-26-00 +0000,wsj,AHS Properties Buys Dubai’s Shangri-La Hotel for $300 Million,https://www.wsj.com/real-estate/commercial/ahs-properties-buys-dubais-shangri-la-hotel-for-300-million-42835e2b?mod=rss_markets_main
17,2026-06-10-21-52-09 +0000,bbc,Fireworks illuminate Barcelona's Sagrada Família during Pope visit,https://www.bbc.com/news/videos/ce95gmdlp98o?at_medium=RSS&at_campaign=rss
17,2026-06-11-13-25-00 +0000,wsj,SpaceX Satellites Are Creating an Accidental Geoengineering Experiment,https://www.wsj.com/science/environment/spacex-satellites-are-creating-an-accidental-geoengineering-experiment-f9b7b7d6?mod=pls_whats_news_us_business_f
17,2026-06-10-21-41-00 +0000,wsj,Opinion | An Inflation Silver Lining,https://www.wsj.com/opinion/inflation-prices-oil-interest-rates-federal-reserve-ec3c1659
17,2026-06-11-15-48-00 +0000,wsj,"The Pentagon issued a shelter-in-place order because of a “hazardous material incident,” officials said Thursday.",https://www.wsj.com/politics/national-security/parts-of-pentagon-are-locked-down-because-of-a-hazardous-materials-incident-5c7f2e6f
17,2026-06-10-21-00-36 +0000,nyt,Southern Baptists Move to Strengthen Ban on Women Pastors,https://www.nytimes.com/2026/06/10/us/sbc-southern-baptist-convention.html
17,2026-06-11-14-25-28 +0000,nypost,Disturbing details emerge after Canoga Park dad executed twin sons in bedroom — as adorable boys are pictured,https://nypost.com/2026/06/11/us-news/disturbing-details-emerge-after-canoga-park-dad-executed-twin-sons-in-bedroom-as-adorable-boys-are-pictured/
17,2026-06-11-16-12-00 +0000,nypost,"Everything is bigger in Texas — including its economy, as residents get richer, population booms",https://nypost.com/2026/06/11/us-news/everything-is-bigger-in-texas-including-its-economy-as-residents-get-richer-population-booms/
17,2026-06-10-21-27-00 +0000,wsj,Former Exxon CEO Lee Raymond Dies at 87,https://www.wsj.com/articles/former-exxon-ceo-lee-raymond-dies-at-87-bc8d49c8?mod=pls_whats_news_us_business_f
17,2026-06-11-14-00-00 +0000,nypost,Look inside Santa Monica TMNT Pizzeria paying tribute to mutant crime-fighting turtles,https://nypost.com/2026/06/11/business/tmnt-pizzeria-opening-on-santa-monicas-third-street-promenade/
16,2026-06-10-18-24-09 +0000,bbc,Whale graveyard dating back five million years discovered,https://www.bbc.com/news/articles/c75ylx4xn10o?at_medium=RSS&at_campaign=rss
16,2026-06-11-13-47-00 +0000,wsj,U.S. Natural Gas Futures Retreat Ahead of Storage Data,https://www.wsj.com/finance/commodities-futures/u-s-natural-gas-futures-retreat-ahead-of-storage-data-b676b6ed?mod=rss_markets_main
16,2026-06-10-18-29-26 +0000,latimes,Deputies called after juveniles ride e-bikes through Walmart aisles in Orange County,https://www.latimes.com/california/story/2026-06-10/deputies-called-after-e-bike-riders-zip-through-walmart-aisles-in-orange-county
16,2026-06-10-19-48-17 +0000,nyt,‘X-Men’ Actor Tyler Mane Says He Has Breast Cancer,https://www.nytimes.com/2026/06/10/us/tyler-mane-male-breast-cancer.html
16,2026-06-11-09-13-06 +0000,bbc,Ryanair investigated over charging parents to sit with children,https://www.bbc.com/news/articles/czj87rvx349o?at_medium=RSS&at_campaign=rss
16,2026-06-11-04-19-40 +0000,bbc,"Facing a seismic by-election, the people of Makerfield tell us what matters to them",https://www.bbc.com/news/articles/ckg4dywykjeo?at_medium=RSS&at_campaign=rss
16,2026-06-11-15-57-04 +0000,bbc,Deadly Sudan drone strike targets funeral procession,https://www.bbc.com/news/articles/c70yeee2jvqo?at_medium=RSS&at_campaign=rss
16,2026-06-11-15-53-24 +0000,bbc,Pentagon floors on lockdown after 'hazardous materials' incident,https://www.bbc.com/news/articles/c74y55dezxlo?at_medium=RSS&at_campaign=rss
15,2026-06-11-11-12-44 +0000,bbc,What we know about US sea drone used in helicopter crew rescue mission,https://www.bbc.com/news/articles/cx2xvnd5eqwo?at_medium=RSS&at_campaign=rss
15,2026-06-11-10-00-00 +0000,latimes,"At Riverside's Mission Inn, former owner departs with historic art — and locals are outraged",https://www.latimes.com/travel/story/2026-06-11/riverside-mission-inn-kelly-roberts-art-controversy
15,2026-06-11-11-47-58 +0000,nyt,Two Men Sentenced to Death for 2015 Bangkok Bombing,https://www.nytimes.com/2026/06/11/world/asia/2015-bangkok-bombing-death-sentence.html
15,2026-06-11-14-55-58 +0000,nyt,U.S. Officials Told Colombia to Cancel President’s Meeting With Mamdani,https://www.nytimes.com/2026/06/10/world/americas/mamdani-petro-new-york-colombia-trump.html
15,2026-06-10-21-48-16 +0000,nyt,"Pope Leo Is Blessing the Sagrada Familia in Barcelona. To Some, the Church Is a Curse.",https://www.nytimes.com/2026/06/10/world/europe/pope-leo-sagrada-familia-barcelona-visit.html
15,2026-06-11-13-26-24 +0000,bbc,"El Niño under way and threatens weather extremes, scientists say",https://www.bbc.com/news/articles/c75ylx7g00xo?at_medium=RSS&at_campaign=rss
15,2026-06-10-23-04-46 +0000,bbc,Mike Ashley's Frasers offers £1.73bn to buy all of Hugo Boss,https://www.bbc.com/news/articles/c07y92gplmyo?at_medium=RSS&at_campaign=rss
15,2026-06-10-23-09-25 +0000,bbc,Olivia Rodrigo sings about heartbreak but she's already chosen her wedding song,https://www.bbc.com/news/articles/cly83elvz70o?at_medium=RSS&at_campaign=rss
15,2026-06-11-11-55-27 +0000,bbc,Defence Secretary John Healey's resignation letter in full,https://www.bbc.com/news/articles/cgjx64yl7z9o?at_medium=RSS&at_campaign=rss
15,2026-06-11-01-00-00 +0000,wsj,Hundreds of Billions in Loans Didn’t Make a Dent in Global Poverty,https://www.wsj.com/finance/banking/poverty-microfinancing-loans-entrepreneurs-de458ee8?mod=rss_markets_main
15,2026-06-10-21-32-18 +0000,bbc,"Who is Steve Hilton, the California governor candidate?",https://www.bbc.com/news/articles/c77yl1p0vvxo?at_medium=RSS&at_campaign=rss
14,2026-06-11-15-08-53 +0000,nyt,Why It’s Nearly Impossible to Build a Robot Without China,https://www.nytimes.com/2026/06/11/business/china-robots-humanoid.html
14,2026-06-10-21-04-43 +0000,latimes,OnlyFans creator gets prison after fetish session turns deadly for customer,https://www.latimes.com/california/story/2026-06-10/onlyfans-creator-prison-sentence-deadly-session-recording
14,2026-06-10-23-42-13 +0000,nyt,Democrats Try to Move Past ‘Cultural Pandering’ to Latinos for Midterm Elections,https://www.nytimes.com/2026/06/10/us/politics/latino-voters-democrats-elections.html
14,2026-06-11-12-40-00 +0000,wsj,Best Pet Insurance Companies of 2026,https://www.wsj.com/buyside/personal-finance/pet-insurance/best-pet-insurance
14,2026-06-10-23-48-08 +0000,nyt,"Hot Cars and Stolen Crypto: A Canadian Teen Pocketed Millions, Prosecutors Say",https://www.nytimes.com/2026/06/10/world/canada/canada-crypto-fraud.html
14,2026-06-11-11-54-31 +0000,nyt,Can SpaceX Defy A.I. Gravity?,https://www.nytimes.com/2026/06/11/business/dealbook/spacex-ipo-ai-spending.html
14,2026-06-11-15-00-00 +0000,wsj,Students Are Using a ‘Backdoor’ to Attend Their Dream Schools,https://www.wsj.com/us-news/education/college-admissions-alternative-enrollment-programs-community-online-87c10b03
14,2026-06-11-01-00-00 +0000,wsj,Jared Kushner’s $5 Billion Albanian Reality Check,https://www.wsj.com/real-estate/jared-kushner-albania-fb5dbcc0
14,2026-06-11-09-00-00 +0000,wapo,Shrinking congregations are reimagining their buildings as affordable housing,https://www.washingtonpost.com/nation/2026/06/11/construction-religious-buildings-is-rising-most-everything-else-stalls/
14,2026-06-11-07-26-00 +0000,wsj,"Hugo Boss Targeted for Takeover, Boosting Shares",https://www.wsj.com/business/deals/hugo-boss-shares-jump-after-frasers-group-takeover-proposal-a22eebbb?mod=pls_whats_news_us_business_f
14,2026-06-11-05-07-05 +0000,bbc,Parents find lifeline in 50p kids' clothes shop,https://www.bbc.com/news/articles/cx2klxdpv51o?at_medium=RSS&at_campaign=rss
13,2026-06-11-09-00-53 +0000,nyt,"Sex, Lies and Secrets: A Federal Judge’s Trysts Go Public",https://www.nytimes.com/2026/06/11/us/eleanor-ross-judge-sex-misconduct.html
13,2026-06-11-01-09-00 +0000,nyt,Burning Cross Is Found in Downtown Chicago Park,https://www.nytimes.com/2026/06/10/us/burning-cross-chicago-grant-park.html
13,2026-06-10-17-06-00 +0000,bbc,Vets advise ban on over the counter flea treatment for pets,https://www.bbc.com/news/articles/cp9pd4d3m5ko?at_medium=RSS&at_campaign=rss
13,2026-06-11-09-30-00 +0000,wsj,You Have No Idea What a Trillion Dollars Is—and We Have Proof,https://www.wsj.com/business/trillions-game-spacex-first-trillionaire-elon-musk-75cfbf1b?mod=pls_whats_news_us_business_f
13,2026-06-10-17-30-00 +0000,wsj,Best Small-Business Loans in June 2026,https://www.wsj.com/buyside/personal-finance/business-loans/best-small-business-loans?mod=pls_whats_news_us_business_f
13,2026-06-11-01-06-28 +0000,48hills,An Oakland union researcher wrote a book. Her characters brought class into it,https://48hills.org/2026/06/an-oakland-union-researcher-wrote-a-book-her-characters-brought-class-into-it/
13,2026-06-10-21-00-06 +0000,missionlocal,Anti-housing message wasn’t enough to dislodge Stephen Sherrill in District 2,https://missionlocal.org/2026/06/san-francisco-stephen-sherrill-housing-district-2-yimby/
13,2026-06-11-15-01-56 +0000,nyt,"In the Protein Era, Even He-Man Is Hawking Supplements",https://www.nytimes.com/2026/06/11/business/he-man-mattel-marketing-protein-supplements.html
13,2026-06-11-14-51-57 +0000,nyt,Israel Set to Rapidly Expand West Bank Settlement,https://www.nytimes.com/2026/06/11/world/middleeast/israel-west-bank-settlements.html
13,2026-06-10-21-00-00 +0000,wsj,Opinion | Graham Platner and Ken Paxton: When Ugliness Is the Point,https://www.wsj.com/opinion/graham-planter-and-ken-paxton-when-ugliness-is-the-point-54a08678
13,2026-06-10-20-47-26 +0000,nyt,University of Florida Chooses Stuart Bell for President Over Some Conservative Criticism,https://www.nytimes.com/2026/06/10/us/university-florida-president-stuart-bell.html
13,2026-06-10-23-03-00 +0000,wsj,Taiwan Test-Fires U.S.-Supplied Missile Launcher Toward China,https://www.wsj.com/world/china/taiwan-test-fires-u-s-supplied-missile-launcher-toward-china-c23b4f44
13,2026-06-11-13-56-35 +0000,bbc,Dozens of crisis payments handed out by council,https://www.bbc.com/news/articles/c8e2wrneeg6o?at_medium=RSS&at_campaign=rss
13,2026-06-11-12-47-46 +0000,nyt,These Young Politicians Want to Fix America’s Housing Problems,https://www.nytimes.com/2026/06/11/us/politics/gen-z-politicians-housing-costs.html
13,2026-06-11-13-22-27 +0000,bbc,Paper plant closure fears spark community protest,https://www.bbc.com/news/articles/c4gyl04ek7mo?at_medium=RSS&at_campaign=rss
13,2026-06-11-13-14-03 +0000,bbc,Chris Mason: Healey's resignation is a devastating critique of Starmer's government,https://www.bbc.com/news/articles/cm20vznj2p2o?at_medium=RSS&at_campaign=rss
12,2026-06-10-20-47-55 +0000,bbc,"Changing visa rules for care workers is wrong, says Rayner",https://www.bbc.com/news/articles/cddl0nz4v5vo?at_medium=RSS&at_campaign=rss
12,2026-06-11-15-43-04 +0000,nyt,American Farms Rely More Than Ever on the Troubled H-2A Visa Program,https://www.nytimes.com/2026/06/04/business/economy/farms-h2a-visas-migrant-workers.html
12,2026-06-10-22-10-08 +0000,nyt,"Souleymane Diallo Dies at 80; Daring, Mocking Journalist in Guinea",https://www.nytimes.com/2026/06/10/world/africa/souleymane-diallo-dead.html
12,2026-06-10-20-47-05 +0000,nyt,At Least 12 Dead After Shooting by Multiple Attackers in Johannesburg,https://www.nytimes.com/2026/06/10/world/africa/johannesburg-shooting-south-africa.html
12,2026-06-11-11-00-00 +0000,missionlocal,"What immigrants in S.F. need to know now: court locations, asylum fees and procedures",https://missionlocal.org/2026/06/san-francisco-immigrants-what-to-know/
12,2026-06-10-23-10-11 +0000,bbc,The furious dispute over what caused Air India flight 171 to crash,https://www.bbc.com/news/articles/cwyk9exxp2qo?at_medium=RSS&at_campaign=rss
12,2026-06-11-08-29-57 +0000,bbc,French singer Patrick Bruel under formal investigation for rape,https://www.bbc.com/news/articles/c3ey8d3jwglo?at_medium=RSS&at_campaign=rss
12,2026-06-11-10-00-00 +0000,latimes,L.A. voters stayed with the status quo in City Hall,https://www.latimes.com/california/story/2026-06-11/la-voters-are-stuck-with-status-quo-in-city-hall
12,2026-06-11-05-13-55 +0000,bbc,How do locals feel about the Makerfield by-election?,https://www.bbc.com/news/videos/cqx1wy8jrdqo?at_medium=RSS&at_campaign=rss
12,2026-06-10-17-51-00 +0000,wsj,Jeanine Pirro’s Prosecutors Probe Big Banks for Alleged ‘Debanking’,https://www.wsj.com/finance/regulation/jeanine-pirros-prosecutors-probe-big-banks-for-alleged-debanking-13568e9b?mod=rss_markets_main
11,2026-06-11-09-30-00 +0000,wsj,Meta’s Subscription Push Exposes Its Weak Hand in AI,https://www.wsj.com/tech/ai/metas-subscription-push-exposes-its-weak-hand-in-ai-2fad4680?mod=rss_markets_main
11,2026-06-11-09-00-10 +0000,nyt,Conor McGregor’s Comeback: A Tale of Banned Drugs and a Famous Doctor,https://www.nytimes.com/2026/06/11/us/politics/conor-mcgregor-ufc-drugs.html
11,2026-06-10-19-27-22 +0000,48hills,"Ciao bella! Pasta, puppets, parade drew revelers to Festa Italiana in North Beach",https://48hills.org/2026/06/ciao-bella-pasta-puppets-parade-drew-revelers-to-festa-italiana-in-north-beach/
11,2026-06-10-19-39-08 +0000,latimes,The FBI serves a search warrant at the Garden Grove chemical plant,https://www.latimes.com/business/story/2026-06-10/fbi-serves-search-warrant-at-garden-grove-chemical-plant
11,2026-06-11-12-16-46 +0000,bbc,Vendee Globe winner Dalin dies aged 42,https://www.bbc.com/sport/sailing/articles/cr5j64pn3jyo?at_medium=RSS&at_campaign=rss
11,2026-06-11-11-56-06 +0000,bbc,Thousands march in Pakistan-administered Kashmir as clashes kill at least 15,https://www.bbc.com/news/articles/cdxdyn5716xo?at_medium=RSS&at_campaign=rss
11,2026-06-11-13-32-10 +0000,nyt,"U.K. Defense Secretary Resigns, in a Blow to Starmer",https://www.nytimes.com/2026/06/11/world/europe/uk-defense-secretary-resigns-healey-starmer.html
11,2026-06-10-21-40-00 +0000,wsj,Opinion | Democrats and the Platner Standard,https://www.wsj.com/opinion/graham-platner-maine-democrats-donald-trump-bernie-sanders-20ff7e50
11,2026-06-10-22-17-09 +0000,bbc,An Everest guide's miraculous survival raises questions for tourism industry,https://www.bbc.com/news/articles/c1ly4p25jyvo?at_medium=RSS&at_campaign=rss
10,2026-06-10-17-49-54 +0000,nyt,ActBlue C.E.O. Invokes Fifth Amendment Repeatedly in Testimony to Congress,https://www.nytimes.com/2026/06/10/us/politics/actblue-fifth-amendment-congress.html
10,2026-06-11-08-13-00 +0000,wsj,Halma Shares Drop After Guidance Disappoints,https://www.wsj.com/business/halma-shares-drop-after-guidance-disappoints-f4744c3d?mod=pls_whats_news_us_business_f
10,2026-06-11-04-12-41 +0000,missionlocal,Where are the card-playing seniors of Portsmouth Square?,https://missionlocal.org/2026/06/seniors-portsmouth-square-renovation/
10,2026-06-10-17-48-13 +0000,nyt,"Indonesia Landslides Devastated Endangered Orangutans, Study Finds",https://www.nytimes.com/2026/06/10/climate/indonesia-floods-organgutans.html
10,2026-06-11-12-00-00 +0000,missionlocal,Anthropic and OpenAI are going public. What does this mean for San Francisco?,https://missionlocal.org/2026/06/san-francisco-anthropic-openai-chatgpt-ipo/
10,2026-06-10-20-14-04 +0000,nyt,Mace Defeat Heralds an Exodus of Rabble-Rousers From Congress,https://www.nytimes.com/2026/06/10/us/politics/nancy-mace-congress-south-carolina.html
10,2026-06-11-07-24-34 +0000,nyt,Why Complete Election Results in Maine Could Take More Than a Week,https://www.nytimes.com/2026/06/10/us/politics/maine-slow-vote-count.html
10,2026-06-10-20-13-27 +0000,nyt,He has one goooooal.,https://www.nytimes.com/live/2026/us/fifa-world-cup/he-has-one-goooooal
9,2026-06-10-19-00-00 +0000,wsj,The Debate-Loving German Telecom Exec Plotting a Blockbuster Merger,https://www.wsj.com/business/telecom/t-mobile-deutsche-telekom-merger-4fdc8eba?mod=pls_whats_news_us_business_f
9,2026-06-11-11-00-00 +0000,startribune,Why Target is a Pride sponsor in NYC but not Minneapolis,https://www.startribune.com/target-pride/601854773
9,2026-06-11-10-26-59 +0000,bbc,Vance says Israeli PM Netanyahu 'has got some things wrong',https://www.bbc.com/news/articles/c9q2lq3vv7zo?at_medium=RSS&at_campaign=rss
9,2026-06-10-16-34-00 +0000,wsj,Opinion | A ‘Millionaire’s Tax’ Is a Tax on Main Street,https://www.wsj.com/opinion/a-millionaires-tax-is-a-tax-on-main-street-8a63d103?mod=pls_whats_news_us_business_f
9,2026-06-11-11-00-00 +0000,startribune,6 things that surprised me about Minnesota’s restaurant scene,https://www.startribune.com/6-things-that-surprised-me-about-minnesotas-restaurant-scene/601849511
9,2026-06-11-07-40-38 +0000,bbc,Mahomes to become NFL's first $500m player,https://www.bbc.com/sport/american-football/articles/cly927klgkvo?at_medium=RSS&at_campaign=rss
9,2026-06-11-02-48-51 +0000,48hills,"Some hard, factual truth about the needless brutality of the Lurie budget",https://48hills.org/2026/06/some-hard-factual-truth-about-the-needless-brutality-of-the-lurie-budget/
8,2026-06-11-16-07-05 +0000,nyt,Here’s the latest.,https://www.nytimes.com/live/2026/06/11/world/iran-war-trump-us-israel/heres-the-latest
8,2026-06-10-19-01-14 +0000,nyt,"U.S. Ebola Unit Sparks Fury, Protests and a Political Crisis in Kenya",https://www.nytimes.com/2026/06/10/world/africa/ebola-kenya-us-protests.html
8,2026-06-11-09-48-40 +0000,bbc,Code of conduct complaint for council leader over libraries plan,https://www.bbc.com/news/articles/cwyd9yn0870o?at_medium=RSS&at_campaign=rss
8,2026-06-11-08-23-00 +0000,wsj,Bullion Outlook Likely Supported by Monetary-Hedge Demand,https://www.wsj.com/finance/commodities-futures/gold-declines-amid-inflation-fears-interest-rate-expectations-b60eea63?mod=rss_markets_main
8,2026-06-10-21-22-00 +0000,wsj,The WSJ Dollar Index Rises 0.07% to 96.58,https://www.wsj.com/finance/currencies/asian-currencies-weaken-against-u-s-dollar-ahead-of-cpi-data-9e112c11?mod=rss_markets_main
7,2026-06-11-09-04-17 +0000,nyt,How to File a Travel Insurance Claim,https://www.nytimes.com/2026/06/11/travel/how-to-file-a-travel-insurance-claim.html
6,2026-06-10-18-00-09 +0000,nyt,Why the Real A.I. Threat Is in the Back Office,https://www.nytimes.com/2026/06/10/business/economy/back-office-workers-ai.html
6,2026-06-10-20-59-00 +0000,wsj,Opinion | From Marilyn Monroe to UFC Freedom 250,https://www.wsj.com/opinion/from-marilyn-monroe-to-ufc-freedom-250-68886ece
6,2026-06-11-11-49-00 +0000,wsj,Lovesac Tempers Outlook as Loss Widens,https://www.wsj.com/business/earnings/lovesac-tempers-outlook-as-loss-widens-974f4d38?mod=pls_whats_news_us_business_f
6,2026-06-11-14-09-53 +0000,startribune,"In the fine print, a hint at Klobuchar’s governing style",https://www.startribune.com/amy-klobuchar-mn-governor-campaign-angie-craig-tom-emmer-delegation-walz-resign/601855485
6,2026-06-11-12-52-00 +0000,wsj,U.S. Jobless Claims Rose Last Week,https://www.wsj.com/economy/jobs/u-s-jobless-claims-rose-last-week-70b53ca9
6,2026-06-11-12-35-00 +0000,wsj,Euro Falls After ECB Decision,https://www.wsj.com/finance/currencies/asian-currencies-consolidate-may-be-weighed-by-risk-off-sentiment-da16097b?mod=rss_markets_main
6,2026-06-10-16-33-00 +0000,wsj,Opinion | Jill Biden’s Memoir Fails to Convince Readers,https://www.wsj.com/opinion/jill-bidens-memoir-fails-to-convince-readers-02747137?mod=pls_whats_news_us_business_f
6,2026-06-11-15-20-56 +0000,nyt,"A.I. Chatbot Helps a $100 Thrift Store Painting Sell for Over $250,000",https://www.nytimes.com/2026/06/10/arts/design/ai-gemini-thrift-store-painting-sale.html
6,2026-06-10-16-31-00 +0000,wsj,Opinion | The Jevons Paradox and AI,https://www.wsj.com/opinion/the-jevons-paradox-and-ai-d2cc0321?mod=rss_markets_main
5,2026-06-10-20-04-00 +0000,wsj,Opinion | Victoria’s Secret’s Sexy Rebranding,https://www.wsj.com/opinion/victorias-secrets-sexy-rebranding-53c2b930?mod=rss_markets_main
5,2026-06-11-14-40-50 +0000,nyt,Boston Symphony in Crisis Over Dismissal of Andris Nelsons,https://www.nytimes.com/2026/06/11/arts/music/boston-symphony-andris-nelsons-chad-smith.html
5,2026-06-10-20-05-00 +0000,wsj,"Opinion | A Simple, Unified Theory of Antisemitism",https://www.wsj.com/opinion/a-simple-unified-theory-of-antisemitism-cf84eceb
5,2026-06-10-20-59-00 +0000,wsj,Opinion | Scott Pelley’s Idea of Journalism,https://www.wsj.com/opinion/scott-pelleys-idea-of-journalism-4f10d8f5
1,2026-06-11-13-00-00 +0000,missionlocal,Tutuhuahua,https://missionlocal.org/2026/06/tutuhuahua/
