score,pubdate,source,title,link
170,2025-12-08-15-28-04 +0000,nypost,Paramount Skydance launches hostile bid for Warner Bros. Discovery — as Trump warns Netflix deal ‘could be a problem’,https://nypost.com/2025/12/08/business/paramount-skydance-launches-hostile-bid-for-warner-bros-discovery-as-trump-warns-netflix-deal-could-be-a-problem/
142,2025-12-08-14-53-40 +0000,latimes,"Paramount launches hostile $78-billion bid for Warner Bros., with backing from Trump's son-in-law",https://www.latimes.com/business/story/2025-12-08/paramount-goes-hostile-in-bid-for-warner-bros-challenging-72-billion-bid-by-netflix
127,2025-12-08-14-06-59 +0000,nyt,Trump Looms Over Netflix’s Deal for Warner Bros. Discovery,https://www.nytimes.com/2025/12/08/business/dealbook/trump-effect-netflix-warner-bros.html
118,2025-12-08-13-20-35 +0000,nypost,‘Disappointed’ Trump claims Zelensky ‘hasn’t yet read’ peace proposal — as prez’s son suggests he may walk away from Ukraine,https://nypost.com/2025/12/08/world-news/disappointed-trump-declared-zelensky-hasnt-yet-read-peace-proposal/
112,2025-12-09-01-21-00 +0000,wsj,Behind Paramount’s Relentless Campaign to Woo Warner Discovery and President Trump,https://www.wsj.com/business/media/paramount-netflix-warner-bros-battle-ellisons-a86fe15c?mod=pls_whats_news_us_business_f
111,2025-12-08-18-35-25 +0000,nypost,Supreme Court justices sympathetic to Trump saying ‘You’re fired!’ in FTC case on presidential power,https://nypost.com/2025/12/08/us-news/supreme-court-signals-it-will-back-trumps-firing-of-independent-federal-agency-board-members/
111,2025-12-08-22-13-40 +0000,nyt,Supreme Court Seems Poised to Give Trump More Power to Fire Independent Officials,https://www.nytimes.com/2025/12/08/us/politics/supreme-court-trump-presidential-power.html
108,2025-12-09-01-07-00 +0000,wsj,"President Trump backed away from a vow to release video of a Sept. 2 attack on an alleged drug boat in the Caribbean, saying he would leave the decision to Defense Secretary Pete Hegseth",https://www.wsj.com/politics/national-security/trump-backs-away-from-pledge-to-release-boat-strike-video-5e9eeb55
107,2025-12-08-18-36-24 +0000,latimes,Supreme Court sounds ready to give Trump power to oust officials of independent agencies,https://www.latimes.com/politics/story/2025-12-08/supreme-court-sounds-ready-to-give-trump-power-to-oust-officials-of-independent-agencies
104,2025-12-08-19-33-49 +0000,bbc,US Supreme Court appears poised to expand Trump's power to fire federal officials,https://www.bbc.com/news/articles/c3e073pglvzo?at_medium=RSS&at_campaign=rss
103,2025-12-08-19-24-10 +0000,nyt,"Despite Trump’s Tariffs, China’s Trade Surplus Climbs Past $1 Trillion for First Time",https://www.nytimes.com/2025/12/07/business/china-trade-surplus.html
103,2025-12-08-15-21-21 +0000,nyt,Trump Says Netflix Takeover of Warner Bros. ‘Could Be a Problem’,https://www.nytimes.com/2025/12/08/us/politics/trump-netflix-warner-bros-antitrust.html
101,2025-12-08-22-26-00 +0000,wsj,The Trump administration announced $12 billion in aid to struggling U.S. farmers as the agriculture sector grapples with the fallout from the president’s far-reaching tariffs,https://www.wsj.com/politics/policy/trump-to-unveil-12-billion-bailout-for-farmers-064eb1de
100,2025-12-09-00-18-55 +0000,wapo,"Paramount launches hostile bid for Warner Bros., challenging Netflix deal",https://www.washingtonpost.com/business/2025/12/08/paramount-launches-hostile-bid-warner-bros-challenging-netflix-deal/
100,2025-12-08-15-11-38 +0000,wapo,Trump peace deal falters as Thailand and Cambodia resume border clashes,https://www.washingtonpost.com/world/2025/12/07/trump-thailand-cambodia-peace-deal-under-threat/
99,2025-12-08-21-12-44 +0000,nyt,Trump Criticizes Zelensky as Ukraine Peace Talks Drag On With European Leaders,https://www.nytimes.com/2025/12/08/world/europe/zelensky-ukraine-war-peace-talks-europe-london.html
99,2025-12-09-00-29-40 +0000,nypost,Trump gives green light to Nvidia to ship powerful AI chips to China despite national security fears,https://nypost.com/2025/12/08/business/trump-gives-green-light-to-nvidia-to-ship-powerful-ai-chips-to-china/
98,2025-12-08-20-32-22 +0000,wapo,"Despite Trump tariffs, China’s global trade surplus tops $1 trillion",https://www.washingtonpost.com/world/2025/12/08/china-trade-surplus-record/
95,2025-12-09-02-35-00 +0000,wsj,"Trump Says U.S. Will Allow Nvidia H200 Chip Sales to China, Get 25% Cut",https://www.wsj.com/tech/nvidia-china-exports-h2000-chips-5943aa48
95,2025-12-09-02-27-06 +0000,nyt,Trump Plans $12 Billion Bailout to Aid Farmers Hit by Tariffs,https://www.nytimes.com/2025/12/08/us/politics/trump-farmers-aid-bailout.html
94,2025-12-08-21-38-00 +0000,wsj,Paramount Makes $77.9 Billion Hostile Bid for Warner After Netflix Struck Deal,https://www.wsj.com/business/media/paramount-skydance-warner-bros-hostile-takeover-bid-f03c6f3f?mod=pls_whats_news_us_business_f
91,2025-12-09-02-13-58 +0000,bbc,Trump gives Nvidia green light to sell advanced AI chips to China,https://www.bbc.com/news/articles/ckg9q635q6po?at_medium=RSS&at_campaign=rss
89,2025-12-08-20-26-00 +0000,wsj,Trump’s Top New Jersey Prosecutor Alina Habba Steps Down,https://www.wsj.com/us-news/law/trumps-top-new-jersey-prosecutor-alina-habba-steps-down-d3cfe7b9
88,2025-12-09-03-33-11 +0000,nypost,"Trump will hit the 2026 campaign trail for Republicans, top aide says: ‘Like it’s 2024 again’",https://nypost.com/2025/12/08/us-news/trump-will-hit-the-2026-campaign-trail-for-republicans-top-aide-says-like-its-2024-again/
87,2025-12-08-17-29-17 +0000,nypost,Trump-brokered truce under threat as Thailand-Cambodia fighting reignites,https://nypost.com/2025/12/08/world-news/trump-brokered-truce-under-threat-as-thailand-cambodia-fighting-reignites/
87,2025-12-08-19-22-16 +0000,nypost,Why Paramount Skydance may not have to go ‘hostile’ to thwart Warner Bros. Discovery’s merger with Netflix,https://nypost.com/2025/12/08/media/paramount-skydance-may-not-have-to-go-hostile-to-thwart-warner-bros-discoverys-merger-with-netflix/
86,2025-12-08-22-36-22 +0000,nyt,"Alina Habba, a Trump Loyalist, Resigns as U.S. Attorney in New Jersey",https://www.nytimes.com/2025/12/08/nyregion/alina-habba-nj-us-attorney-resigns.html
86,2025-12-08-20-37-34 +0000,nyt,Trump Stands in the Middle as Netflix and Paramount Vie for a Megadeal,https://www.nytimes.com/2025/12/08/business/media/trump-netflix-paramount-deal.html
86,2025-12-09-00-05-39 +0000,wapo,"Zelensky rules out ceding land to Russia, refusing to bow to Putin or Trump",https://www.washingtonpost.com/world/2025/12/08/europe-ukraine-leaders-trump-plan/
86,2025-12-08-23-05-12 +0000,wapo,Trump says Hegseth will decide whether to release boat strike video,https://www.washingtonpost.com/national-security/2025/12/08/trump-boat-strike-video/
85,2025-12-08-11-51-00 +0000,wsj,President Trump has three big decisions to make about affordability in the coming days and weeks. Read more in today’s WSJ Politics newsletter:,https://www.wsj.com/politics/policy/trump-faces-big-decisions-as-voters-turn-on-him-over-affordability-a8589828
84,2025-12-09-02-30-03 +0000,nyt,Trump Insists Tariffs Will Buoy the Economy and Ease Cost Concerns,https://www.nytimes.com/2025/12/08/us/politics/trump-trade-affordability.html
84,2025-12-08-21-28-33 +0000,latimes,Trump says '60 Minutes' is 'worse' under new ownership following Marjorie Taylor Greene interview,https://www.latimes.com/entertainment-arts/business/story/2025-12-08/trump-lashes-out-60-minutes-cbs-new-ownership-marjorie-taylor-greene-interview
84,2025-12-09-03-06-45 +0000,bbc,Trump unveils $12bn farm aid package to help farmers who faced 'unjustified trade actions',https://www.bbc.com/news/articles/cjrj58qed2wo?at_medium=RSS&at_campaign=rss
83,2025-12-08-23-09-00 +0000,wsj,Paramount Made a Hostile Bid for Warner After Netflix Deal. What Happens Next?,https://www.wsj.com/business/media/paramount-made-a-hostile-bid-for-warner-after-netflix-deal-what-happens-next-ebf11d66?mod=pls_whats_news_us_business_f
81,2025-12-09-07-22-59 +0000,nypost,Trump threatens 5 percent tariff on Mexico over water treaty violations affecting Texas farmers,https://nypost.com/2025/12/09/us-news/trump-threatens-5-percent-tariff-on-mexico-over-water-treaty-violations-affecting-texas-farmers/
81,2025-12-08-22-30-02 +0000,nyt,Trump Clears Sale of More Powerful Nvidia A.I. Chips to China,https://www.nytimes.com/2025/12/08/business/trump-nvidia-chips-china.html
80,2025-12-08-15-11-41 +0000,nyt,Does Trump need a reason to fire leaders of independent agencies?,https://www.nytimes.com/live/2025/12/08/us/trump-supreme-court-presidential-power/trump-fire-independent-agency-leaders
79,2025-12-08-21-18-03 +0000,nyt,Paramount Makes Hostile Bid for Warner Bros. Discovery,https://www.nytimes.com/2025/12/08/business/paramount-warner-bros-discovery-netflix.html
79,2025-12-09-09-39-56 +0000,bbc,Ukraine prepares new peace plan as Zelensky rules out giving up land,https://www.bbc.com/news/articles/cg7vdd115vjo?at_medium=RSS&at_campaign=rss
79,2025-12-09-04-00-00 +0000,wsj,China’s Manufacturing Is Booming Despite Trump’s Tariffs,https://www.wsj.com/world/china/chinas-manufacturing-is-booming-despite-trumps-tariffs-911fbcbe
78,2025-12-09-02-08-44 +0000,nyt,Trump Again Threatens Tariffs on Mexico Over Long-Running Water Dispute,https://www.nytimes.com/2025/12/08/us/politics/trump-tariffs-mexico-water.html
78,2025-12-08-16-14-22 +0000,nypost,Trump to issue ‘one rulebook’ AI executive order after Congress fails to curb ‘bad actor’ states,https://nypost.com/2025/12/08/us-news/president-trump-teases-executive-order-to-limit-state-regulations-on-ai/
77,2025-12-08-11-00-00 +0000,latimes,"In first year in Senate, Schiff pushes legislation, party message and challenges to Trump",https://www.latimes.com/politics/story/2025-12-08/in-first-year-in-senate-schiff-pushes-legislation-party-message-challenges-to-trump
76,2025-12-08-21-28-39 +0000,nyt,Trump’s Birthday Becomes Free National Park Day as MLK Day and Juneteenth Are Cut,https://www.nytimes.com/2025/12/08/travel/trump-birthday-mlk-juneteenth-free-national-park.html
75,2025-12-08-15-28-52 +0000,nyt,A Scholar’s ‘Bombshell’ Questioned Trump’s Power to Fire Officials,https://www.nytimes.com/2025/12/08/us/politics/supreme-court-constitution-originalist-trump.html
75,2025-12-08-21-19-07 +0000,bbc,Why has Paramount launched a hostile bid for Warner Bros Discovery?,https://www.bbc.com/news/articles/cm21z4zgkx7o?at_medium=RSS&at_campaign=rss
75,2025-12-08-20-44-30 +0000,nypost,Treasury Secretary Bessent predicts 3% GDP growth as Trump preps economy tour: ‘We’re fixing it’,https://nypost.com/2025/12/08/us-news/treasury-secretary-bessent-predicts-3-gdp-growth-as-trump-preps-economy-tour/
75,2025-12-08-22-26-00 +0000,wsj,Trump Unveils $12 Billion Bailout for Farmers,https://www.wsj.com/politics/policy/trump-to-unveil-12-billion-bailout-for-farmers-064eb1de?mod=pls_whats_news_us_business_f
73,2025-12-08-16-30-41 +0000,bbc,Watch: President Trump hosts the Kennedy Center Honors,https://www.bbc.com/news/videos/c5yjevjqn5xo?at_medium=RSS&at_campaign=rss
73,2025-12-08-19-44-11 +0000,wapo,Trump says he has ‘solved’ 8 conflicts. Here’s what to know about them.,https://www.washingtonpost.com/world/2025/08/20/trump-peace-seven-conflicts-wars/
73,2025-12-08-21-14-41 +0000,bbc,Paramount launches rival bid for Warner Bros Discovery,https://www.bbc.com/news/articles/cj69xzpzrdyo?at_medium=RSS&at_campaign=rss
72,2025-12-09-05-40-34 +0000,wapo,Honduras issues arrest warrant for ex-president pardoned by Trump,https://www.washingtonpost.com/world/2025/12/09/hernandez-honduras-warrant-trump-pardon/
72,2025-12-08-20-08-00 +0000,wsj,Maker of ICE-Tracking App Says Trump Officials Violated Free-Speech Rights,https://www.wsj.com/politics/policy/maker-of-ice-tracking-app-says-trump-officials-violated-free-speech-rights-c8378c1a
71,2025-12-08-17-37-33 +0000,nypost,Vance hilariously recalls Trump questioning team on size of certain body part: ‘Can tell a lot about a man’,https://nypost.com/2025/12/08/us-news/vance-hilariously-recalls-trump-questioning-team-on-shoe-size/
71,2025-12-08-19-27-40 +0000,nyt,Jared Kushner Is Part of Paramount’s Bid for Warner Bros. Discovery,https://www.nytimes.com/2025/12/08/business/media/jared-kushner-paramount-bid-warner-bros-discovery.html
70,2025-12-09-05-13-00 +0000,startribune,Trump looms large over Minnesota’s GOP race for governor,https://www.startribune.com/debate-to-offer-early-look-at-minnesotas-gop-race-for-governor/601539548
69,2025-12-09-02-15-21 +0000,latimes,Federal judge strikes down Trump's order blocking development of wind energy,https://www.latimes.com/environment/story/2025-12-08/federal-judge-strikes-down-trumps-order-blocking-development-of-wind-energy
68,2025-12-08-21-52-50 +0000,nyt,Trump Backtracks on Releasing Video of Boat Strike,https://www.nytimes.com/2025/12/08/us/politics/trump-boat-strike-video-hegseth.html
67,2025-12-08-23-43-06 +0000,nypost,Zelensky says he still has one big unanswered question in Ukraine-Russia peace deal,https://nypost.com/2025/12/08/world-news/zelensky-still-has-one-big-unanswered-question-in-ukraine-russia-peace-deal/
67,2025-12-09-01-17-52 +0000,nyt,Federal Judge Finds Trump’s Halt on Wind Energy Is Illegal,https://www.nytimes.com/2025/12/08/climate/trump-offshore-wind-federal-judge.html
66,2025-12-08-16-11-17 +0000,nypost,Trump announces $12B in fresh economic assistance for farmers,https://nypost.com/2025/12/08/us-news/trump-to-announce-12b-in-economic-assistance-for-farmers/
66,2025-12-08-22-49-10 +0000,nyt,Trump Promises Executive Order to Block State AI Regulations,https://www.nytimes.com/2025/12/08/us/politics/trump-executive-order-ai-laws.html
63,2025-12-08-21-09-00 +0000,wsj,Supreme Court Appears Ready to Give President More Power to Fire Government Officials,https://www.wsj.com/politics/policy/supreme-court-appears-poised-to-give-president-more-power-to-fire-government-officials-d36a0302
60,2025-12-08-17-11-00 +0000,wsj,Opinion | The Netflix-Warner Bros. Deal Could Revive Hollywood,https://www.wsj.com/opinion/the-netflix-warner-bros-deal-could-revive-hollywood-1ba826b5?mod=pls_whats_news_us_business_f
60,2025-12-08-22-17-29 +0000,bbc,Alina Habba resigns after court disqualified her from being New Jersey's top prosecutor,https://www.bbc.com/news/articles/cj69x814dkyo?at_medium=RSS&at_campaign=rss
58,2025-12-08-22-34-38 +0000,latimes,Netflix shares drop after Paramount launches hostile takeover bid,https://www.latimes.com/entertainment-arts/business/story/2025-12-08/la-fi-warner-brothers-discovery-wbd-netflix-analyst-concerns
57,2025-12-08-22-39-00 +0000,wsj,Opinion | Introducing the ‘Trump Corollary’,https://www.wsj.com/opinion/introducing-the-trump-corollary-b2b0d4ad
57,2025-12-08-22-44-00 +0000,wsj,Opinion | A Trump Doctrine of Contradictions,https://www.wsj.com/opinion/donald-trump-national-security-strategy-russia-china-iran-0b811811
53,2025-12-08-21-25-54 +0000,bbc,Five takeaways from the blockbuster Netflix-Warner Brothers deal,https://www.bbc.com/news/articles/cx25039ddlro?at_medium=RSS&at_campaign=rss
49,2025-12-08-19-11-13 +0000,nyt,"Planes, Trade and Nuclear Energy: Supreme Court Weighs Fate of Independent Regulators",https://www.nytimes.com/2025/12/08/business/supreme-court-independent-regulators.html
49,2025-12-09-02-35-32 +0000,nypost,Ukraine’s Zelensky refuses to give up land to Russia: ‘Precisely what we are fighting for’,https://nypost.com/2025/12/08/world-news/zelensky-refuses-to-give-up-land-to-russia-what-we-are-fighting-for/
46,2025-12-08-19-23-51 +0000,nypost,China’s trade surplus hits $1 trillion for first time — even as US exports plunge 29%,https://nypost.com/2025/12/08/business/chinas-trade-surplus-hits-1-trillion-for-first-time-even-as-us-exports-plunge/
45,2025-12-09-02-06-00 +0000,wsj,BHP to Sell Stake in Western Australia Power Infrastructure to BlackRock in $2 Billion Deal,https://www.wsj.com/business/deals/bhp-to-sell-stake-in-western-australia-power-infrastructure-to-blackrock-in-2-billion-deal-3ed5afba?mod=pls_whats_news_us_business_f
45,2025-12-08-11-58-44 +0000,cbc,Ukraine's Zelenskyy says a revised peace plan will be shared with U.S. on Tuesday,https://www.cbc.ca/news/world/ukraine-zelenskyy-london-brussels-talks-9.7006690?cmp=rss
45,2025-12-08-15-27-00 +0000,wsj,What Netflix Gains From Buying Warner Bros.,https://www.wsj.com/business/media/netflix-warner-bros-deal-charts-490d4797?mod=pls_whats_news_us_business_f
44,2025-12-09-03-53-58 +0000,bbc,Zohran Mamdani confirms he will live in historic Gracie Mansion as New York mayor,https://www.bbc.com/news/articles/cy95n8e9lx7o?at_medium=RSS&at_campaign=rss
43,2025-12-08-23-19-57 +0000,nypost,"RFK Jr., Sean Duffy have pull-up competition while touting $1B bid to add mini-gyms, healthier food options at airports",https://nypost.com/2025/12/08/us-news/rfk-jr-duffy-have-pull-up-competition-at-dca-while-touting-1b-bid-to-add-mini-gyms-and-healthier-food-options-at-airports/
42,2025-12-08-14-46-23 +0000,nyt,There are other cases that will test presidential power at the court.,https://www.nytimes.com/live/2025/12/08/us/trump-supreme-court-presidential-power/there-are-other-cases-that-will-test-presidential-power-at-the-court
41,2025-12-08-15-07-31 +0000,nyt,These Independent Agencies Could Be Affected by a Supreme Court Case,https://www.nytimes.com/2025/12/08/us/politics/agencies-independent-boards.html
41,2025-12-08-15-09-53 +0000,nypost,Wealthy nepo baby called dad to ask for lawyer as his girlfriend lay dying after he stabbed and choked her: court,https://nypost.com/2025/12/08/world-news/wealthy-student-joshua-michals-called-dad-to-ask-for-lawyer-as-his-girlfriend-lay-dying-court/
41,2025-12-08-20-49-00 +0000,wsj,Europe Scrambles for Influence in U.S.-Led Peace Talks on War in Ukraine,https://www.wsj.com/world/europe/zelensky-rallies-european-leaders-as-u-s-piles-pressure-on-peace-process-efcaacc6
40,2025-12-09-08-32-37 +0000,wsj,Stock Market Today: S&P 500 Futures Inch Up Ahead of JOLTS Data; Nvidia in Focus,https://www.wsj.com/livecoverage/stock-market-today-dow-sp-500-nasdaq-12-09-2025?mod=rss_markets_main
39,2025-12-08-17-45-01 +0000,nyt,Golden Globe Nominations Confirm the Allure of Warner Bros.,https://www.nytimes.com/2025/12/08/business/media/golden-globes-nominations-2026.html
39,2025-12-09-10-04-01 +0000,nyt,A Key Question for the Supreme Court: What About the Fed?,https://www.nytimes.com/2025/12/09/us/supreme-court-fed.html
38,2025-12-08-11-59-00 +0000,wsj,BNP Paribas Increases Stake in Belgian Insurer Ageas as Part of $3.5 Billion Deal,https://www.wsj.com/finance/investing/bnp-paribas-increases-stake-in-belgian-insurer-ageas-as-part-of-3-5-billion-deal-c18ed9d3?mod=pls_whats_news_us_business_f
38,2025-12-09-10-03-35 +0000,nyt,Supreme Court Is Asked to Take Another Ax to Campaign Finance Limits,https://www.nytimes.com/2025/12/09/us/politics/supreme-court-campaign-finance.html
37,2025-12-08-20-00-28 +0000,bbc,"Critical moment to ramp up support for Ukraine, European allies say",https://www.bbc.com/news/articles/c2k4z9nwz4yo?at_medium=RSS&at_campaign=rss
37,2025-12-09-08-46-00 +0000,wsj,"Oil Slips With Ukraine Peace Talks, Supply Surplus in Focus",https://www.wsj.com/finance/commodities-futures/oil-prices-fall-ukraine-russia-peace-talks-fed-meeting-in-focus-dfe254d6?mod=pls_whats_news_us_business_f
37,2025-12-08-17-05-06 +0000,nypost,"Berkshire Hathaway’s Todd Combs, also CEO of Geico, leaves for JPMorgan ahead of Buffett’s departure",https://nypost.com/2025/12/08/business/berkshire-hathaways-todd-combs-also-ceo-of-geico-leaves-for-jpmorgan-ahead-of-buffetts-departure/
36,2025-12-08-14-56-20 +0000,nypost,"7.2-magnitude earthquake strikes off Japan’s coast, triggers tsunami alert",https://nypost.com/2025/12/08/world-news/7-2-magnitude-earthquake-strikes-off-japans-coast-triggers-tsunami-alert/
36,2025-12-09-01-12-02 +0000,nypost,LA do-gooder claims he collected 100K pounds of trash from streets — blames city for slow collection: ‘Just do your job’,https://nypost.com/2025/12/08/us-news/la-do-gooder-claims-he-collected-100k-pounds-of-trash-from-streets-blames-city-for-slow-collection/
36,2025-12-08-20-02-21 +0000,nyt,Thai Jets Bomb Cambodia as at Least 5 Die in New Wave of Fighting,https://www.nytimes.com/2025/12/08/world/asia/thailand-cambodia-f16-jets.html
34,2025-12-08-21-42-03 +0000,nypost,CBS News taps ABC News journalist Matt Gutman for ‘major role’ after being ‘relentlessly pursued’ by Bari Weiss: sources,https://nypost.com/2025/12/08/media/cbs-news-taps-matt-gutman-for-major-role-at-48-hours-contributor-to-60-minutes-sources/
34,2025-12-09-03-51-19 +0000,nypost,"Maryland middle school’s Transgender Awareness Week lesson gave kids as young as 11 ‘binding’ tips, ‘coming out’ advice",https://nypost.com/2025/12/08/us-news/maryland-middle-schools-transgender-awareness-week-lesson-gave-kids-binding-tips-coming-out-advice/
34,2025-12-08-16-51-49 +0000,cbc,Anti-hate bill stalled after Fraser’s office brokered deal without PMO approval: sources,https://www.cbc.ca/news/politics/liberals-anti-hate-bill-stalled-9.7007038?cmp=rss
33,2025-12-08-17-01-30 +0000,bbc,European leaders walk tightrope between backing Ukraine and keeping US on board,https://www.bbc.com/news/articles/c8r3v5mmyp8o?at_medium=RSS&at_campaign=rss
33,2025-12-08-16-45-10 +0000,nyt,How Japan Built a Rare-Earth Supply Chain Without China,https://www.nytimes.com/2025/12/08/business/japan-rare-earths-lynas.html
33,2025-12-09-10-30-00 +0000,wsj,Fed Chair Jerome Powell is expected to push for an interest-rate cut this week and signal a higher bar for further easing,https://www.wsj.com/economy/central-banking/federal-reserve-interest-rate-cut-ef7118b8
33,2025-12-08-22-22-27 +0000,nypost,ABC makes Jimmy Kimmel contract decision after yanking him off air over Charlie Kirk comments,https://nypost.com/2025/12/08/business/abc-makes-jimmy-kimmel-contract-decision/
33,2025-12-09-06-00-00 +0000,wsj,Ford and Renault Team Up in Europe to Compete Against Low-Price Chinese Cars,https://www.wsj.com/business/autos/ford-and-renault-team-up-in-europe-to-compete-against-low-price-chinese-cars-7b0c5c61?mod=pls_whats_news_us_business_f
33,2025-12-08-22-06-00 +0000,wsj,Berkshire’s Geico Boss Todd Combs Leaves for JPMorgan Ahead of Buffett Retirement,https://www.wsj.com/business/c-suite/berkshire-hathaway-shuffles-top-ranks-in-runup-to-warren-buffetts-retirement-6ab1eaeb?mod=pls_whats_news_us_business_f
33,2025-12-08-14-52-51 +0000,cbc,Japan lifts tsunami advisories after powerful earthquake off northern coast,https://www.cbc.ca/news/world/livestory/japan-earthquake-tsunami-9.7006849?cmp=rss
33,2025-12-09-09-34-00 +0000,wsj,Global Stocks Trade in Narrow Range Ahead of Key Fed Meeting,https://www.wsj.com/finance/investing/global-stocks-trade-in-narrow-range-ahead-of-key-fed-meeting-64f5867a?mod=rss_markets_main
33,2025-12-08-23-24-19 +0000,nypost,Alex Karp’s Palantir launches new ‘neurodivergent fellowship’ after exec’s on-stage fidgeting goes viral,https://nypost.com/2025/12/08/business/alex-karps-palantir-launches-new-neurodivergent-fellowship-after-execs-on-stage-fidgeting-goes-viral/
32,2025-12-09-08-01-00 +0000,latimes,"High schools bullying is up, attendance down as ICE raids sow 'climate of distress,' study says",https://www.latimes.com/california/story/2025-12-09/ice-raids-translate-to-bullying-missing-class-academic-struggles
32,2025-12-09-00-06-07 +0000,nyt,Jimmy Kimmel’s ABC Deal Is Extended Through May 2027,https://www.nytimes.com/2025/12/08/business/media/jimmy-kimmel-extension-abc.html
32,2025-12-09-04-06-43 +0000,missionlocal,S.F. taps outside firm to find out what led to killing of social worker Alberto Rangel,https://missionlocal.org/2025/12/sf-hospital-stabbing-security-review/
32,2025-12-08-11-45-00 +0000,wsj,Magnum Ice Cream Hits $9 Billion Market Capitalization on Trading Debut,https://www.wsj.com/business/retail/shares-in-magnum-ice-cream-rise-on-euronext-debut-b8103de1?mod=pls_whats_news_us_business_f
32,2025-12-08-16-19-57 +0000,nyt,What will the court’s ruling mean for the Federal Reserve Board?,https://www.nytimes.com/live/2025/12/08/us/trump-supreme-court-presidential-power/supreme-court-ruling-federal-reserve-board
31,2025-12-08-13-27-00 +0000,wsj,IBM Strikes $11 Billion Deal for Confluent,https://www.wsj.com/business/deals/ibm-nears-roughly-11-billion-deal-for-confluent-276f52d8?mod=pls_whats_news_us_business_f
31,2025-12-08-17-37-23 +0000,nypost,"Hamas grows ranks to 20,000 terrorists, fills coffers with tariffs — as Israel questions whether peacekeepers can disarm them",https://nypost.com/2025/12/08/world-news/hamas-grows-ranks-to-20000-terrorists-fills-coffers-with-tariffs/
31,2025-12-08-23-25-01 +0000,cbc,Minister signals go-slow approach to removing 2nd-generation cut-off from Indian Act,https://www.cbc.ca/news/politics/minister-consultations-changes-first-nations-status-eligibility-9.7007961?cmp=rss
30,2025-12-08-16-39-54 +0000,nyt,Supreme Court’s Conservatives Have Already Narrowed the 1935 Precedent,https://www.nytimes.com/2025/12/08/us/politics/scotus-independent-agencies-precedent-1935-trump.html
29,2025-12-08-22-50-00 +0000,wsj,"PepsiCo to Cut Costs, Lower Food Prices in Deal With Activist",https://www.wsj.com/business/retail/pepsico-to-cut-costs-lower-food-prices-in-deal-with-activist-fb1e3c9a?mod=pls_whats_news_us_business_f
29,2025-12-09-02-57-32 +0000,nyt,Todd Combs Leaves Berkshire Hathaway for JPMorgan Chase as Buffett Nears Retirement,https://www.nytimes.com/2025/12/08/business/dealbook/berkshire-todd-combs-jpmorgan.html
29,2025-12-09-00-40-38 +0000,nypost,"Hamas not committed to peace plan or disarming, Israeli foreign minister says",https://nypost.com/2025/12/08/world-news/hamas-not-committed-to-peace-plan-or-disarming-israeli-foreign-minister/
