score,pubdate,source,title,link
108,2026-03-28-18-34-16 +0000,cbc,Anger over Iran war adds fuel to anti-Trump 'No Kings' protests across U.S.,https://www.cbc.ca/news/world/no-kings-protest-u-s-trump-9.7145895?cmp=rss
86,2026-03-29-00-15-00 +0000,wsj,Hundreds of thousands of demonstrators are taking to the streets across the nation for a day of “No Kings” rallies Saturday in opposition to President Trump,https://www.wsj.com/us-news/crowds-gather-across-u-s-for-no-kings-rallies-to-oppose-trump-0d3a380d
84,2026-03-28-18-49-00 +0000,latimes,'No Kings' protesters pack city streets across the nation as crowds lash out against Trump,https://www.latimes.com/california/story/2026-03-28/no-kings-rallies-draw-millions-protesting-trump-globally
73,2026-03-29-04-11-27 +0000,bbc,No Kings protesters across the US rally against Donald Trump,https://www.bbc.com/news/articles/cq8wy7g1gd1o?at_medium=RSS&at_campaign=rss
70,2026-03-29-15-13-13 +0000,nypost,Fetishist ‘No Kings’ protester in mask drags ‘Trump’ and ‘JD Vance’ behind her wheelchair,https://nypost.com/2026/03/29/us-news/atlanta-no-kings-protest-takes-turn-for-weird-as-masked-wheelchair-using-leftist-walks-trump-lookalike-on-leash/
69,2026-03-28-23-41-58 +0000,nypost,Tens of thousands of ‘No Kings’ protestors rally in Manhattan against Trump,https://nypost.com/2026/03/28/us-news/no-kings-tens-of-thousands-of-protestors-rally-in-manhattan-against-trump/
67,2026-03-28-23-24-03 +0000,startribune,The latest: Flagship ‘No Kings’ rally at the State Capitol celebrated Minnesota while taking on Trump,https://www.startribune.com/live-flagship-no-kings-protest-puts-national-spotlight-on-minnesota/601616035
66,2026-03-28-19-05-10 +0000,nyt,Is Iran a Political Problem for Trump? Tell Me How Long the War Lasts.,https://www.nytimes.com/2026/03/28/upshot/iran-war-trump-popularity.html
63,2026-03-29-15-53-00 +0000,wsj,"Iran warns the U.S. after a unit of U.S. Marines arrives in the Middle East, and the stock market shows signs of resilience despite the war. Read more in today’s What’s News newsletter:",https://www.wsj.com/world/iran-warns-u-s-against-ground-invasion-592621d2
61,2026-03-29-15-35-02 +0000,nyt,‘No Kings’ Protests Decry Trump and His Agenda,https://www.nytimes.com/2026/03/28/us/no-kings-trump-iran-immigration-minnesota.html
57,2026-03-28-20-51-57 +0000,bbc,Iran-backed Houthis join war with attack against Israel,https://www.bbc.com/news/articles/cd6l5n8jv4yo?at_medium=RSS&at_campaign=rss
56,2026-03-29-03-29-40 +0000,nypost,Pentagon preparing for weeks of ground operations in Iran — after Trump warned regime to ‘get serious’ about peace deal: report,https://nypost.com/2026/03/28/world-news/pentagon-preparing-for-weeks-of-ground-operations-in-iran-report/
56,2026-03-29-13-10-10 +0000,nypost,Pope Leo issues strong rebuke on ‘atrocious’ Iran war in Palm Sunday message: ‘Hands are full of blood’,https://nypost.com/2026/03/29/world-news/pope-leo-issues-strong-rebuke-on-atrocious-iran-war-in-palm-sunday-message/
55,2026-03-28-23-16-41 +0000,wapo,"No Kings protests fill streets at over 3,300 rallies in all 50 states, a record number",https://www.washingtonpost.com/nation/2026/03/28/no-kings-protests-marches-record-turnout/
53,2026-03-29-16-59-27 +0000,nyt,Iran War Live Updates: Israel Strikes Tehran as Regional Diplomats Gather in Pakistan,https://www.nytimes.com/live/2026/03/29/world/iran-war-trump-israel-oil
52,2026-03-29-09-36-07 +0000,nyt,No Kings Protests Held Across the U.S.: Photos and Videos,https://www.nytimes.com/2026/03/28/us/no-kings-protest-photos-videos.html
52,2026-03-29-16-29-28 +0000,nyt,The Oil Shocks of the ’70s Changed the World. Will the Iran War Do the Same?,https://www.nytimes.com/2026/03/28/business/oil-shocks-1970s-iran-war.html
51,2026-03-29-12-28-00 +0000,missionlocal,Photos: No Kings in San Francisco brings out thousands,https://missionlocal.org/2026/03/no-kings-san-francisco/
49,2026-03-29-09-01-31 +0000,nyt,5 Takeaways From the ‘No Kings’ Rallies as the Midterms Heat Up,https://www.nytimes.com/2026/03/29/us/politics/no-kings-rallies-takeaways.html
49,2026-03-29-02-38-00 +0000,wsj,How Pakistan Wooed Trump and Styled Itself as a Peace Broker in Iran Conflict,https://www.wsj.com/world/middle-east/pakistan-trump-iran-war-84b8248e
49,2026-03-28-20-02-09 +0000,wapo,Iranian-backed Houthis in Yemen attack Israel for first time in war,https://www.washingtonpost.com/world/2026/03/28/iran-us-war-yemen-trump/
48,2026-03-29-00-03-45 +0000,startribune,Justin: The five most magical music moments from the Twin Cities 'No Kings' rally,https://www.startribune.com/neal-justin-no-kings-st-paul-music-review-springsteen-baez-maggie-rogers-larry-long-venus-de-mars/601645122
48,2026-03-29-13-34-49 +0000,nypost,Sen. Chris Murphy roasted for posing with Jimmy Kimmel at No Kings protest thousands of miles from home state,https://nypost.com/2026/03/29/us-news/chris-murphy-roasted-for-pics-with-jimmy-kimmel-thousands-of-miles-from-home-state/
47,2026-03-29-00-02-46 +0000,bbc,Jeremy Bowen: Trump is waging war based on instinct and it isn't working,https://www.bbc.com/news/articles/c5y969pnxgvo?at_medium=RSS&at_campaign=rss
47,2026-03-29-03-29-36 +0000,nyt,"A Challenge for ‘No Kings’ Protests, the Third Time Around",https://www.nytimes.com/2026/03/28/us/politics/no-kings-protests-trump-organizers.html
47,2026-03-29-09-00-54 +0000,nyt,Why the Iran War May Force Countries to Rely Less on Natural Gas,https://www.nytimes.com/2026/03/29/business/energy-environment/iran-war-natural-gas.html
47,2026-03-29-10-00-00 +0000,latimes,California farmers were already struggling. Then came the Iran war,https://www.latimes.com/business/story/2026-03-29/california-farmers-were-already-struggling-then-came-iran-war
46,2026-03-29-10-00-00 +0000,latimes,Dozens arrested after authorities fire tear gas at 'No Kings' protesters,https://www.latimes.com/california/story/2026-03-29/demonstrators-arrested-tear-gassed-at-no-kings-protest
46,2026-03-28-23-00-00 +0000,wsj,"President Trump’s tax cuts are delivering bigger refunds and smaller tax bills to high-income, Democratic-leaning regions that didn’t vote for him",https://www.wsj.com/politics/policy/trump-salt-tax-deduction-democratic-states-c419b8a4
45,2026-03-28-20-21-04 +0000,nyt,Castro Heirs Emerge Across Cuba’s Political Scene Amid Energy Crisis and Trump Threats,https://www.nytimes.com/2026/03/28/world/americas/castro-family-cuba-energy-crisis-trump.html
45,2026-03-29-09-30-00 +0000,wsj,Fed policymakers suggest interest rates could go up or down. The most probable path may be no move at all.,https://www.wsj.com/economy/central-banking/fed-officials-signal-that-rate-cuts-may-be-over-76891741
43,2026-03-29-10-00-00 +0000,latimes,Barabak: Will or won't he? A lot rides on a Trump endorsement in California governor's race,https://www.latimes.com/politics/story/2026-03-29/trump-california-governors-race-republican-endorsement
42,2026-03-29-14-35-49 +0000,nypost,Air Canada flight attendant who was ejected during LGA crash seen in hospital for first time — as daughter describes horrific injuries,https://nypost.com/2026/03/29/world-news/air-canada-flight-attendant-who-was-ejected-during-lga-crash-seen-in-hospital-for-first-time/
41,2026-03-29-15-24-54 +0000,bbc,Two Australian states offer free public transport as war pushes up fuel prices,https://www.bbc.com/news/articles/c937n0yxggeo?at_medium=RSS&at_campaign=rss
40,2026-03-29-13-48-46 +0000,nypost,Border czar Tom Homan reveals when TSA will start getting paid again following Trump’s executive order,https://nypost.com/2026/03/29/us-news/tom-homan-reveals-when-tsa-will-start-getting-paid-again-following-trumps-executive-order/
40,2026-03-29-08-15-36 +0000,nypost,Travelers reveal who they blame for miles-long Houston airport lines as Trump rescues TSA pay,https://nypost.com/2026/03/29/us-news/houston-airport-travelers-reveal-who-they-blame-for-tsa-lines/
39,2026-03-29-16-10-03 +0000,startribune,Pope Leo XIV rejects claims that God justifies war in Palm Sunday Mass message,https://www.startribune.com/pope-leo-xiv-opens-holy-week-with-palm-sunday-that-recalls-final-days-of-pope-francis-life/601645927
38,2026-03-29-10-00-00 +0000,latimes,Trump's approval ratings just hit a new low. A Latino voter shift could reshape the midterms,https://www.latimes.com/politics/story/2026-03-29/trumps-approval-ratings-just-hit-new-low-latino-voter-shift-could-reshape-midterms
37,2026-03-28-19-53-21 +0000,nyt,Ukraine Finalizes Air Defense Deals With Gulf Nations Amid War in Mideast,https://www.nytimes.com/2026/03/28/world/europe/ukraine-air-defense-deal-qatar-saudi-arabia.html
35,2026-03-29-13-39-17 +0000,wapo,How a year of Trump policies and tariff threats has remade global trade,https://www.washingtonpost.com/business/2026/03/29/tariffs-trump-liberation-day/
34,2026-03-29-08-00-00 +0000,cbc,"Amid Iran conflict, combative neighbours Armenia and Azerbaijan try to stay above the fray",https://www.cbc.ca/news/world/armenia-azerbaijan-iran-war-9.7142936?cmp=rss
32,2026-03-29-03-00-00 +0000,wsj,Voices of War: Five Lives Caught in the Middle East Conflict,https://www.wsj.com/world/middle-east/voices-of-war-five-lives-caught-in-the-middle-east-conflict-1fa8842a
31,2026-03-29-09-00-00 +0000,wsj,Birthright Citizenship Case Pushes Trump’s Relationship With Supreme Court to Brink,https://www.wsj.com/us-news/law/trump-supreme-court-relationship-birthright-citizenship-db72ff70
30,2026-03-28-19-05-29 +0000,nypost,Iran shuts down popular coffee chain over cups supposedly celebrating Khamenei’s death: report,https://nypost.com/2026/03/28/world-news/iran-shuts-down-popular-coffee-chain-over-cups-supposedly-celebrating-khameneis-death-report/
30,2026-03-29-08-16-54 +0000,nyt,A Toothless Iran? Missile and Drone Strikes Show It Can Still Inflict Pain.,https://www.nytimes.com/2026/03/29/world/middleeast/iran-missiles-war.html
30,2026-03-29-14-00-00 +0000,wsj,Why Russia Is Stepping Up Its Support for an Embattled Iran,https://www.wsj.com/world/why-russia-is-stepping-up-its-support-for-an-embattled-iran-e3dcf8ee
29,2026-03-28-19-48-25 +0000,nypost,"Mounting concerns about Iran ‘sleeper cells’ after 1,500 stopped at border",https://nypost.com/2026/03/28/world-news/mounting-concerns-about-iran-sleeper-cells-after-1500-stopped-at-border/
29,2026-03-29-07-58-36 +0000,nyt,Here’s What Happened in the War in the Middle East on Saturday,https://www.nytimes.com/2026/03/28/world/middleeast/iran-israel-united-states-war-recap.html
29,2026-03-29-09-30-00 +0000,wsj,Three Reasons the Stock Market Can Endure the War,https://www.wsj.com/finance/stocks/three-reasons-the-stock-market-can-endure-the-war-23c5f966?mod=rss_markets_main
28,2026-03-29-00-22-02 +0000,wapo,Pentagon prepares for weeks of ground operations in Iran,https://www.washingtonpost.com/national-security/2026/03/28/trump-iran-ground-troops-marines/
28,2026-03-29-16-23-26 +0000,nypost,Lawyer for LI creep accused of kidnapping 4-year-old from laundromat gives bizarre excuse as judge cuts him loose,https://nypost.com/2026/03/29/us-news/lawyer-for-li-creep-accused-of-kidnapping-4-year-old-from-laundromat-gives-bizarre-excuse-as-judge-cuts-him-loose/
28,2026-03-28-21-40-39 +0000,nyt,G.O.P. Rift Leaves Congress With No Clear Path to End the Shutdown,https://www.nytimes.com/2026/03/28/us/gop-rift-leaves-no-clear-shutdown-off-ramp.html
27,2026-03-28-19-52-22 +0000,nyt,"On Iran’s Rugged Frontier, Kurds Yearn to Join the Fight",https://www.nytimes.com/2026/03/28/world/europe/iran-kurds-iraq-fighters.html
27,2026-03-29-16-47-48 +0000,nyt,Hundreds Gather for Funeral of 3 Lebanese Killed in Israeli Strike,https://www.nytimes.com/2026/03/29/world/middleeast/funerals-lebanese-killed-israeli-strike.html
27,2026-03-29-07-51-04 +0000,bbc,"Three Lebanese journalists killed in Israeli strike, say broadcasters",https://www.bbc.com/news/articles/cgme1j70294o?at_medium=RSS&at_campaign=rss
27,2026-03-29-09-00-44 +0000,nyt,He Was Supposed to Break Up Kraft and Heinz. He Changed His Mind.,https://www.nytimes.com/2026/03/29/business/kraft-heinz-steve-cahillane.html
27,2026-03-29-14-01-09 +0000,cbc,Avi Lewis wins NDP leadership race in decisive first-ballot victory,https://www.cbc.ca/news/politics/livestory/federal-ndp-announces-leader-9.7146267?cmp=rss
26,2026-03-29-10-42-53 +0000,nypost,"Texas oil heir Charles Brooks Jr. ordered to pay historic $1.1B after brutally attacking toddler stepson, putting him in wheelchair",https://nypost.com/2026/03/29/us-news/texas-oil-heir-charles-brooks-jr-ordered-to-pay-historic-1-1b-in-child-abuse-case/
26,2026-03-28-23-37-16 +0000,nypost,JD Vance wins 2028 CPAC GOP presidential straw poll — but Marco Rubio closes ground,https://nypost.com/2026/03/28/us-news/rubio-cuts-into-vances-lead-as-2028-gop-race-tightens-at-cpac/
26,2026-03-28-22-22-12 +0000,nyt,"In Dubai, a famed horse race goes on, despite the war.",https://www.nytimes.com/live/2026/03/29/world/iran-war-trump-israel-oil/in-dubai-a-famed-horse-race-goes-on-despite-the-war
26,2026-03-28-19-02-40 +0000,bbc,"Tears and defiance as Lebanese family bury child, 11, killed in Israeli strike",https://www.bbc.com/news/articles/c62lx8ek9x9o?at_medium=RSS&at_campaign=rss
26,2026-03-29-16-01-00 +0000,bbc,Canada's New Democratic Party elects Avi Lewis as its leader,https://www.bbc.com/news/articles/czd74q2nqp0o?at_medium=RSS&at_campaign=rss
25,2026-03-29-15-20-44 +0000,bbc,Hundreds in Beirut mourn journalists killed in Israeli strike,https://www.bbc.com/news/videos/ce354d73v2ko?at_medium=RSS&at_campaign=rss
25,2026-03-29-15-36-52 +0000,nypost,$270M E-3 Sentry spy plane demolished by Iranian attack at Saudi air base: photos,https://nypost.com/2026/03/29/us-news/270m-e-3-sentry-spy-plane-demolished-by-iranian-attack-at-saudi-air-base/
24,2026-03-29-08-00-00 +0000,cbc,Air traffic controller’s 'I messed up' highlights human limits — but experts urge caution,https://www.cbc.ca/news/world/air-traffic-control-air-canada-laguardia-crash-9.7142788?cmp=rss
23,2026-03-29-11-35-08 +0000,nypost,LI 4-year-old rescued after creep allegedly kidnapped her from under mom’s nose at laundromat,https://nypost.com/2026/03/29/us-news/4-year-old-rescued-after-long-island-laundromat-kidnapping/
23,2026-03-28-20-11-02 +0000,nypost,"Up to 1,000 Iranian ‘sleeper’ agents embedded in Canada: Gov’t official",https://nypost.com/2026/03/28/world-news/up-to-1000-iranian-sleeper-agents-embedded-in-canada-govt-official/
22,2026-03-29-16-42-36 +0000,cbc,The NDP has a new leader. What does Avi Lewis's arrival mean for the party?,https://www.cbc.ca/news/politics/ndp-new-leader-avi-lewsi-9.7146004?cmp=rss
22,2026-03-29-15-37-54 +0000,nyt,Can Canada’s Left Regroup? A New Leader Will Try.,https://www.nytimes.com/2026/03/29/world/americas/canada-new-democrats-party-leader-avi-lewis.html
22,2026-03-28-19-24-06 +0000,nypost,Heartbreaking video shows gang rape victim Noelia Castillo’s father cheering her on as she tried to walk after suicide attempt,https://nypost.com/2026/03/28/world-news/newly-emerged-video-shows-noelia-castillos-father-cheering-her-on-as-she-tried-to-walk/
22,2026-03-29-00-00-00 +0000,wsj,"Investigators searched the office of a FEMA contractor as they investigate a network of aides put in place by former DHS Secretary Kristi Noem and adviser Corey Lewandowski, according to people familiar with the matter",https://www.wsj.com/politics/national-security/investigators-examine-contractor-installed-at-fema-under-kristi-noem-f6f0029d
22,2026-03-28-19-46-33 +0000,nypost,Heiress-backed Dem’s vile race and sex slurs exposed as he runs for Congress,https://nypost.com/2026/03/28/us-news/dem-candidate-lobbed-n-word-in-resurfaced-social-media-posts/
21,2026-03-28-21-50-32 +0000,nyt,"Vance Wins CPAC Straw Poll, but Rubio Gains Steam Among MAGA Faithful",https://www.nytimes.com/2026/03/28/us/politics/vance-rubio-cpac-straw-poll.html
21,2026-03-29-09-57-41 +0000,nypost,NY socialist pols want free childcare for infants to 12-year-olds — with taxpayers footing $13B annual tab,https://nypost.com/2026/03/29/us-news/ny-socialist-pols-want-free-childcare-for-infants-to-12-yr-olds-with-taxpayers-footing-13b-annual-tab/
21,2026-03-29-00-00-00 +0000,wsj,"Private credit is fast-growing, opaque and intertwined with banks but lacks the scale and leverage that cashiered the economy in 2007, @greg_ip writes",https://www.wsj.com/economy/is-another-financial-crisis-lurking-in-private-credit-cad379b1
21,2026-03-28-21-48-26 +0000,nypost,Russian drone strikes destroy Ukraine maternity hospital full of newborns: ‘This was pure terror’,https://nypost.com/2026/03/28/world-news/russian-drone-strikes-destroy-ukraine-maternity-hospital-full-of-newborns-this-was-pure-terror/
21,2026-03-29-13-32-49 +0000,bbc,Iranian attacks across Gulf continue as major industrial sites hit,https://www.bbc.com/news/articles/cp86yrq5jy7o?at_medium=RSS&at_campaign=rss
20,2026-03-28-18-27-20 +0000,nypost,‘Flying Rodent’ photo of lynx ready to eat his prey wins Wildlife Photographer of the Year award,https://nypost.com/2026/03/28/world-news/flying-rodent-photo-of-lynx-ready-to-eat-his-prey-wins-wildlife-photographer-of-the-year-award/
20,2026-03-29-13-00-00 +0000,missionlocal,"‘I want to see her back:’ District 9 closes ranks around Jackie Fielder, wary of mayoral pick",https://missionlocal.org/2026/03/sf-jackie-fielder-district-9-resignation/
20,2026-03-29-16-42-17 +0000,bbc,Israeli police block Latin Patriarch from Palm Sunday mass in Jerusalem,https://www.bbc.com/news/articles/cvg0128z41eo?at_medium=RSS&at_campaign=rss
20,2026-03-29-12-57-52 +0000,nypost,FBI offers new reward for missing cruise passenger Amy Lynn Bradley — 28 years after she vanished without a trace,https://nypost.com/2026/03/29/us-news/new-reward-offered-in-amy-lynn-bradley-case/
20,2026-03-29-15-33-36 +0000,bbc,Three arrested in Paris after attempted bomb attack outside Bank of America,https://www.bbc.com/news/articles/cd9v234j2v7o?at_medium=RSS&at_campaign=rss
19,2026-03-29-16-22-08 +0000,nyt,"ICE May Remain at Airports Even After T.S.A. Pay Resumes, Border Czar Says",https://www.nytimes.com/2026/03/29/us/ice-tsa-airports-homan-trump-shutdown.html
19,2026-03-28-20-11-54 +0000,nyt,"Kaela Berg, a Flight Attendant, Runs for Congress One Layover at a Time",https://www.nytimes.com/2026/03/28/us/politics/kaela-berg-minnesota-congress-democrat.html
18,2026-03-29-12-00-00 +0000,startribune,"Byron Buxton, Twins players honor Derek Shelton after first managerial victory of season",https://www.startribune.com/byron-buxton-twins-players-honor-derek-shelton-after-first-managerial-victory-of-season/601645255
18,2026-03-29-10-30-00 +0000,startribune,Minnesota’s first state park campground for off-roaders and their rigs opens this summer,https://www.startribune.com/mn-state-parks-add-atv-campground/601640216
18,2026-03-29-00-31-38 +0000,nypost,Mystery surrounds welfare of socialist San Francisco supervisor as city investigates leaked memo,https://nypost.com/2026/03/28/us-news/san-francisco-supervisor-jackie-fielder-hospitalized-after-leak/
18,2026-03-28-19-14-03 +0000,nyt,"Israeli Strike Kills 3 Journalists in Southern Lebanon, Officials Say",https://www.nytimes.com/2026/03/28/world/middleeast/lebanon-journalists-killed-israeli-strike.html
18,2026-03-29-07-10-45 +0000,nypost,North Korea conducts engine test for missile capable of targeting US mainland,https://nypost.com/2026/03/29/world-news/north-korea-conducts-engine-test-for-missile-capable-of-targeting-us-mainland/
18,2026-03-29-00-00-05 +0000,bbc,Think Love Island is bad? Wait until you see the AI fruit version,https://www.bbc.com/news/articles/ckgr35y26q7o?at_medium=RSS&at_campaign=rss
17,2026-03-29-13-34-58 +0000,cbc,North Korea conducts engine test for missile capable of targeting U.S.,https://www.cbc.ca/news/world/north-korea-missile-test-9.7146183?cmp=rss
17,2026-03-29-16-27-50 +0000,nyt,"The Air Canada Crash: Before and After the Frantic Call to ‘Stop, Stop, Stop’",https://www.nytimes.com/2026/03/29/nyregion/laguardia-air-canada-crash-reconstruction.html
17,2026-03-29-15-28-34 +0000,nypost,NYC credit downgrade under Mamdani could cost more than $14B: analysis,https://nypost.com/2026/03/29/us-news/nyc-credit-downgrade-under-mamdani-could-cost-more-than-14b-analysis/
17,2026-03-29-09-00-42 +0000,nyt,"At CPAC, Texas Shows Love for Ken Paxton and Boos for an Absent John Cornyn",https://www.nytimes.com/2026/03/29/us/cpac-texas-ken-paxton-john-cornyn.html
17,2026-03-29-01-57-21 +0000,nypost,Mayor Mamdani’s budget mess is creating chaos in the NYC bond market,https://nypost.com/2026/03/28/business/mayor-mamdanis-budget-mess-is-creating-chaos-in-the-nyc-bond-market/
16,2026-03-29-16-00-00 +0000,wsj,Harvard economist Claudia Goldin helped WNBA players win a nearly 400% pay raise,https://www.wsj.com/economy/wnba-players-had-an-ace-up-their-sleeve-in-pay-negotiations-a-nobel-laureate-c5040a28
16,2026-03-29-16-26-25 +0000,nypost,"Crimson-clad clown flings shredded Quran at NYC mosque, smears feces on building: cops",https://nypost.com/2026/03/29/us-news/crimson-clad-clown-flings-shredded-quran-at-nyc-mosque-smears-feces-on-building-cops/
16,2026-03-28-19-49-59 +0000,nypost,"‘Viva Cuba!’ activists, pols turn CUNY conference  into anti-American hatefest",https://nypost.com/2026/03/28/us-news/viva-cuba-activists-pols-turn-cuny-conference-on-commie-country-into-anti-american-hatefest/
16,2026-03-28-18-06-29 +0000,nyt,Yemen’s Houthis Fire at Israel and Vow Further Attacks,https://www.nytimes.com/2026/03/28/world/middleeast/yemen-houthis-attack-israel-war.html
16,2026-03-28-19-27-59 +0000,nyt,Man in Paris Accused of Attempted Attack on Bank of America,https://www.nytimes.com/2026/03/28/world/europe/paris-attack-bank-of-america.html
16,2026-03-29-13-15-57 +0000,nypost,5 killed after freight train hits van at railroad crossing in rural Mississippi,https://nypost.com/2026/03/29/us-news/5-killed-after-freight-train-hits-van-in-rural-mississippi/
16,2026-03-29-11-00-00 +0000,startribune,Lawmakers may allow some school suspensions after growing concerns over violent elementary students,https://www.startribune.com/lawmakers-may-allow-some-school-suspensions-after-growing-concerns-over-violent-elementary-students/601630673
15,2026-03-29-08-29-19 +0000,nypost,"Several injured after driver hits pedestrians in UK’s Derby city, police say",https://nypost.com/2026/03/29/world-news/uk-city-derby-car-crash-leaves-several-injured-as-driver-hits-pedestrians/
15,2026-03-29-14-40-03 +0000,nyt,"Inside La Paz, the California Mountain Compound Led by Cesar Chavez",https://www.nytimes.com/2026/03/29/us/cesar-chavez-la-paz.html
15,2026-03-29-01-00-00 +0000,wsj,The Venezuelan First Lady’s Other Job: Tending a Family Crime Dynasty,https://www.wsj.com/world/americas/venezuelan-first-lady-drug-trafficking-family-43cc6dd2
15,2026-03-28-19-08-30 +0000,bbc,Potential Houthi threat to Red Sea shipping could further damage global economy,https://www.bbc.com/news/articles/cwyvd5z1xjno?at_medium=RSS&at_campaign=rss
15,2026-03-29-00-01-15 +0000,bbc,One ant for $220: The new frontier of wildlife trafficking,https://www.bbc.com/news/articles/cg4g44zv37qo?at_medium=RSS&at_campaign=rss
15,2026-03-29-14-16-05 +0000,nypost,Chicago mayor renews reparations push for black residents despite city’s $150M budget deficit,https://nypost.com/2026/03/29/us-news/chicago-mayor-brandon-johnson-renews-reparations-push-despite-150m-budget-deficit/
15,2026-03-29-11-12-33 +0000,bbc,"Cut taxes on energy bills before giving bailouts, Badenoch says",https://www.bbc.com/news/articles/c1d941vw172o?at_medium=RSS&at_campaign=rss
15,2026-03-29-15-02-56 +0000,nyt,F.B.I. Said to Dig Up Old Investigative Files on Democratic Lawmaker,https://www.nytimes.com/2026/03/28/us/politics/trump-fbi-patel-eric-swalwell.html
15,2026-03-29-16-45-44 +0000,nypost,California gubernatorial candidates’ salaries revealed — and one’s way ahead of the rest,https://nypost.com/2026/03/29/us-news/california-gubernatorial-candidates-salaries-revealed/
14,2026-03-29-14-43-00 +0000,wsj,How Long Before Airport Security Lines Go Back to Normal?,https://www.wsj.com/lifestyle/travel/how-long-before-airport-security-lines-go-back-to-normal-a48d24f0?mod=pls_whats_news_us_business_f
14,2026-03-29-14-51-32 +0000,nypost,American-born IDF soldier killed in combat in Lebanon,https://nypost.com/2026/03/29/world-news/american-born-idf-soldier-moshe-yitzchak-hacohen-katz-killed-in-lebanon/
14,2026-03-28-22-02-34 +0000,bbc,Watch: Iconic global landmarks turn off lights for Earth Hour,https://www.bbc.com/news/videos/c4gx042nlezo?at_medium=RSS&at_campaign=rss
14,2026-03-29-15-24-24 +0000,nyt,Deaths in ICE Custody Are Growing. ‘They Let Him Rot in There.’,https://www.nytimes.com/2026/03/29/us/ice-detention-deaths-immigrants.html
14,2026-03-29-09-00-07 +0000,nyt,"Check Your Target-Date Fund, Especially if You Plan to Retire Soon",https://www.nytimes.com/2026/03/29/business/retirement-target-date-funds-401k.html
14,2026-03-29-08-00-00 +0000,cbc,Ottawa's big bet on world's largest cricket farm ran into a simple problem: the 'yuck factor',https://www.cbc.ca/news/canada/canada-aspire-food-cricket-farm-9.7136152?cmp=rss
13,2026-03-29-09-10-41 +0000,bbc,"Schools do not have enough staff to make SEND reforms work, union warns",https://www.bbc.com/news/articles/c15dzz8z153o?at_medium=RSS&at_campaign=rss
13,2026-03-29-13-40-08 +0000,bbc,"'I was naive,' says minister who quit over Labour Together claims",https://www.bbc.com/news/articles/cy8135ny182o?at_medium=RSS&at_campaign=rss
13,2026-03-29-13-53-17 +0000,bbc,Caf general secretary resigns amid Afcon final fallout,https://www.bbc.com/news/articles/cx2w8d1q70vo?at_medium=RSS&at_campaign=rss
