score,pubdate,source,title,link
39,2026-05-06-18-05-09 +0000,nypost,Last gambling resorts on California-Nevada border to close — and Primm employees told to vacate housing,https://nypost.com/2026/05/06/business/primm-valley-casino-resorts-to-permanently-close-july-4/
39,2026-05-06-20-09-42 +0000,nypost,US F/A-18 Super Hornet fighter jet fires on Iranian tanker that tried to break Strait of Hormuz blockade,https://nypost.com/2026/05/06/world-news/us-intercepts-iranian-flagged-tanker-attempting-to-break-blockade/
39,2026-05-06-23-43-54 +0000,latimes,Disney fans may soon get to order Disney-themed license plates that help children's hospitals,https://www.latimes.com/california/story/2026-05-06/disney-fans-will-soon-get-to-order-disney-themed-license-plates-that-help-childrens-hospitals
39,2026-05-07-00-37-54 +0000,latimes,Purported Jeffrey Epstein suicide note had echoes of messages he had sent earlier,https://www.latimes.com/politics/story/2026-05-06/purported-jeffrey-epstein-suicide-note-had-echoes-of-messages-he-had-sent-earlier
39,2026-05-07-08-59-26 +0000,nyt,Oil Prices Slide on Hopes for Renewed Peace Talks,https://www.nytimes.com/2026/05/07/business/oil-gas-price-iran.html
39,2026-05-06-21-33-14 +0000,nyt,"Rupert Murdoch, David Zaslav and More Media Moguls Remember Ted Turner, CNN’s Founder",https://www.nytimes.com/2026/05/06/business/media/ted-turner-death-cnn-media-reaction.html
39,2026-05-06-19-58-04 +0000,bbc,Israel strikes Beirut for first time since Hezbollah ceasefire,https://www.bbc.com/news/articles/crmpjjl02l2o?at_medium=RSS&at_campaign=rss
39,2026-05-06-18-09-54 +0000,latimes,Trump administration supports L.A. wildfire victims suing State Farm,https://www.latimes.com/business/story/2026-05-06/trump-administration-backs-wildfire-victims-suing-state-farm
38,2026-05-07-04-07-58 +0000,startribune,Mayor Frey will nominate Minneapolis Police Chief Brian O’Hara for another term,https://www.startribune.com/mayor-jacob-frey-nominate-police-chief-ohara/601838051
38,2026-05-06-15-22-58 +0000,bbc,Up to 150 former WHSmith high street stores to close,https://www.bbc.com/news/articles/clypzvqzqd7o?at_medium=RSS&at_campaign=rss
38,2026-05-07-05-45-00 +0000,wsj,Gold Fields Backs Guidance but Cites War-Induced Price Rises,https://www.wsj.com/business/energy-oil/gold-fields-backs-guidance-but-cites-war-induced-price-rises-d1db899a?mod=rss_markets_main
38,2026-05-06-21-26-17 +0000,nypost,"OpenAI CEO Sam Altman was dishonest, caused ‘chaos,’ ex-exec Mira Murati says in bombshell testimony",https://nypost.com/2026/05/06/business/openai-ceo-sam-altman-was-dishonest-caused-chaos-ex-exec-mira-murati-says-in-bombshell-testimony/
38,2026-05-06-21-20-00 +0000,cbc,Anthropic AI says deal struck to use SpaceX data centres,https://www.cbc.ca/news/science/anthropic-ai-deal-spacex-data-centres-9.7190201?cmp=rss
37,2026-05-07-02-53-04 +0000,nypost,Electrical fire will keep Broadway theater that hosts ‘The Book of Mormon’ closed through May 17,https://nypost.com/2026/05/06/us-news/electrical-fire-will-keep-broadway-theater-that-hosts-the-book-of-mormon-closed-through-may-17/
37,2026-05-06-14-39-07 +0000,wapo,"Ted Turner, cable TV visionary who created CNN, dies at 87",https://www.washingtonpost.com/obituaries/2026/05/06/ted-turner-dead-cnn/
37,2026-05-07-01-44-03 +0000,nyt,Polls in California Governor’s Race Reflect a Chaotic Field,https://www.nytimes.com/2026/05/06/us/politics/california-governor-polls.html
37,2026-05-07-06-04-00 +0000,wsj,Roche to Buy PathAI for Up to $1.05 Billion to Bolster AI Diagnostics Tools,https://www.wsj.com/business/deals/roche-to-buy-pathai-for-up-to-1-05-billion-to-bolster-ai-diagnostics-tools-0b4575ee?mod=pls_whats_news_us_business_f
37,2026-05-07-08-03-00 +0000,wsj,Malaysia Central Bank Holds Steady as It Gauges Mideast War Impact,https://www.wsj.com/economy/central-banking/malaysia-central-bank-holds-steady-as-it-gauges-impact-of-mideast-war-ddea0abe
37,2026-05-06-15-29-00 +0000,nypost,Bombshell new theory in Chiara Poggi case revives Italy’s infamous Garlasco murder mystery,https://nypost.com/2026/05/06/world-news/bombshell-new-theory-emerges-in-chiara-poggi-murder-case/
37,2026-05-07-02-59-37 +0000,nypost,California’s affordability crisis takes center stage in LA’s gubernatorial debate,https://nypost.com/2026/05/06/us-news/californias-affordability-crisis-takes-center-stage-in-las-gubernatorial-debate/
36,2026-05-06-18-00-00 +0000,wsj,"Selling Pot Is a Tough Business, but One California Company Is Beating the Odds",https://www.wsj.com/business/entrepreneurship/california-cannabis-dispensary-business-d11981eb?mod=pls_whats_news_us_business_f
36,2026-05-06-10-00-00 +0000,latimes,Commentary: Feel a bit crowded at the park? Why L.A. park spaces comes up short,https://www.latimes.com/california/story/2026-05-06/feel-bit-crowded-at-park-why-la-park-spaces-comes-up-short
36,2026-05-06-20-17-18 +0000,nyt,"Ted Turner, Creator of CNN and the 24-Hour News Cycle, Dies at 87",https://www.nytimes.com/2026/05/06/business/media/ted-turner-dead.html
36,2026-05-06-19-43-50 +0000,nypost,France deploys country’s sole aircraft carrier toward Strait of Hormuz as part of joint military effort,https://nypost.com/2026/05/06/world-news/france-deploys-its-sole-aircraft-carrier-toward-strait-of-hormuz/
36,2026-05-07-09-03-23 +0000,nyt,"Ted Turner’s Mark on Atlanta Lived On, Even After He Left the Spotlight",https://www.nytimes.com/2026/05/07/us/ted-turner-atlanta-legacy.html
36,2026-05-07-00-14-04 +0000,nyt,Here’s what to know about the California governor race.,https://www.nytimes.com/live/2026/05/06/us/california-governor-debate/heres-what-to-know-about-the-california-governor-race
36,2026-05-06-22-18-24 +0000,latimes,Suspect ran from Playa del Rey smash-up that killed toddler and uncle. Person now under arrest,https://www.latimes.com/california/story/2026-05-06/arrest-made-in-playa-del-rey-hit-and-run-that-killed-uncle-nephew
36,2026-05-06-13-21-40 +0000,cbc,"Canadian sues U.S. Homeland Security, which allegedly sought his Google data after critical social media posts",https://www.cbc.ca/news/world/us-dhs-aclu-lawsuit-canadian-john-doe-9.7187851?cmp=rss
36,2026-05-07-01-54-19 +0000,nypost,Rutgers axes graduation speaker after anti-Israel social media posts allegedly drew student backlash,https://nypost.com/2026/05/06/us-news/rutgers-axes-graduation-speaker-after-anti-israel-social-media-posts-allegedly-drew-student-backlash/
36,2026-05-06-21-33-00 +0000,wsj,Opinion | Trump’s Hollow Indiana Victory,https://www.wsj.com/opinion/donald-trump-gop-indiana-senators-redistricting-c3649902
36,2026-05-06-12-50-31 +0000,bbc,Former FedEx driver sentenced to death for killing seven-year-old Texas girl,https://www.bbc.com/news/articles/cp8pqz50l33o?at_medium=RSS&at_campaign=rss
35,2026-05-06-21-46-50 +0000,latimes,Feds sweep into MacArthur Park in operation against 'open-air drug market',https://www.latimes.com/california/story/2026-05-06/macarthur-park-federal-drug-market-operation
35,2026-05-06-14-39-49 +0000,nyt,The New York Times Passes 13 Million Subscribers,https://www.nytimes.com/2026/05/06/business/media/new-york-times-earnings.html
35,2026-05-07-04-55-10 +0000,latimes,Moorpark professor may avoid prison time in death of Jewish man at Thousand Oaks protest,https://www.latimes.com/california/story/2026-05-06/pro-palestinian-protester-may-avoid-prison-time-in-death-of-jewish-man
34,2026-05-06-10-44-00 +0000,wsj,Bayer to Buy Eye-Drug Developer Perfuse Therapeutics for Up to $2.45 Billion,https://www.wsj.com/health/pharma/bayer-to-buy-eye-drug-developer-perfuse-therapeutics-for-up-to-2-45-billion-59b848b2?mod=pls_whats_news_us_business_f
34,2026-05-06-11-01-00 +0000,wsj,Saudi Aramco Cuts Oil Price For June From Record High in May,https://www.wsj.com/world/middle-east/saudi-aramco-cuts-oil-price-for-june-from-record-high-in-may-2f93fbca?mod=pls_whats_news_us_business_f
34,2026-05-07-09-00-14 +0000,wapo,"Grain sales deepen wedge between Ukraine, Israel even as they fight allied enemies",https://www.washingtonpost.com/world/2026/05/07/israel-ukraine-grain-russia-iran/
34,2026-05-06-13-09-00 +0000,wsj,Best High-Yield Savings Accounts for May 2026: Up to 5.00%,https://www.wsj.com/buyside/personal-finance/banking/best-high-yield-savings-account
34,2026-05-06-21-58-32 +0000,nypost,London-based firm strikes $132.5M deal for stake in massive Minnesota iron ore project,https://nypost.com/2026/05/06/business/metals-royalty-to-buy-stake-in-minnesotas-mesabi-metallics-iron-ore-project/
34,2026-05-06-17-48-00 +0000,wsj,"Ted Turner, Who Shaped Cable TV and Launched CNN, Has Died at 87",https://www.wsj.com/business/media/ted-turner-who-shaped-cable-tv-and-launched-cnn-has-died-at-87-ed8a4deb?mod=pls_whats_news_us_business_f
34,2026-05-06-20-05-02 +0000,bbc,Former OpenAI board member says Elon Musk offered her sperm donations,https://www.bbc.com/news/articles/c33243j44p8o?at_medium=RSS&at_campaign=rss
34,2026-05-06-20-20-19 +0000,nypost,Italian PM Giorgia Meloni shares spicy AI photo of herself as she blasts misinfo — but admits it ‘improved me quite a bit’,https://nypost.com/2026/05/06/world-news/italian-prime-minister-shares-haters-sexy-ai-photo-of-her-it-improved-me-a-lot/
33,2026-05-07-01-41-08 +0000,nypost,Midterm handicapper unveils new House ratings for pivotal 2026 races across the US,https://nypost.com/2026/05/06/us-news/midterm-handicapper-unveils-new-house-ratings/
33,2026-05-06-20-26-00 +0000,wsj,Hantavirus Case in Switzerland Spurs Race to Trace Contacts,https://www.wsj.com/world/europe/hantavirus-case-in-switzerland-spurs-race-to-trace-contacts-60f21548
33,2026-05-06-19-49-09 +0000,nyt,Suspect Michael Marx Charged With Shooting at Secret Service Agents Near National Mall,https://www.nytimes.com/2026/05/06/us/politics/secret-service-agents-shooting-national-mall.html
33,2026-05-06-18-25-04 +0000,nyt,New Study Shows Risks of Amazon Deforestation. And Rewards of Protection.,https://www.nytimes.com/2026/05/06/climate/amazon-rain-forest-deforestation-climate.html
33,2026-05-07-06-57-17 +0000,wapo,Rubio visits Rome aiming to repair White House ties with Pope Leo,https://www.washingtonpost.com/world/2026/05/07/trump-pope-leo-rubio-rift/
33,2026-05-06-15-00-00 +0000,nypost,"Karen Bass and Nithya Raman trade blows over LA crime, homelessness in explosive mayoral debate",https://nypost.com/2026/05/06/us-news/karen-bass-and-nithya-raman-trade-blows-in-mayoral-debate/
33,2026-05-07-04-08-15 +0000,nypost,Popular Italian food brand accused of ‘tomato fraud’ in new lawsuit,https://nypost.com/2026/05/07/business/popular-italian-food-brand-accused-of-tomato-fraud-in-new-lawsuit/
32,2026-05-06-11-35-00 +0000,wsj,"On Eve of Proposed Cease-Fire, Russia Launches Huge Attack on Ukraine",https://www.wsj.com/world/on-eve-of-proposed-cease-fire-russia-launches-huge-attack-on-ukraine-9ada3daa
32,2026-05-07-08-31-34 +0000,bbc,'We had people come just to see it': Amazon delivers its first UK parcels by drone,https://www.bbc.com/news/articles/cx21k21vnmgo?at_medium=RSS&at_campaign=rss
32,2026-05-07-02-07-16 +0000,nypost,"Texas mother accused of abandoning children for over a month to attend out-of-town funeral, sending meals via Uber Eats",https://nypost.com/2026/05/06/us-news/texas-mother-accused-of-abandoning-children-for-over-a-month-sending-meals-via-uber-eats/
32,2026-05-07-02-00-19 +0000,latimes,California county discovers trove of unopened ballots from last election in a locked box,https://www.latimes.com/california/story/2026-05-06/california-county-discovers-trove-of-unopened-ballots-in-locked-box
32,2026-05-07-02-04-33 +0000,nypost,"Wild cone-shaped UFOs light up Canada skies, sparking panic as experts reveal the source",https://nypost.com/2026/05/06/world-news/wild-cone-shaped-ufos-light-up-canada-skies-sparking-widespread-panic/
32,2026-05-06-20-58-03 +0000,bbc,Gas tax: How beer fuelled a debate on Australia's energy giants,https://www.bbc.com/news/articles/cy02pzxd4y4o?at_medium=RSS&at_campaign=rss
31,2026-05-06-20-37-00 +0000,wsj,"While real estate far from big cities is cheaper, fueling up for long commutes has become painful",https://www.wsj.com/economy/consumers/high-gas-prices-wreak-havoc-on-americas-army-of-supercommuters-99ee6cc0
31,2026-05-06-13-51-00 +0000,wsj,Equinor’s Shares Slide as Oil Prices Drop,https://www.wsj.com/business/energy-oil/equinor-gets-earnings-boost-from-record-production-higher-prices-5bfef6eb?mod=pls_whats_news_us_business_f
31,2026-05-06-18-47-00 +0000,wsj,JPMorgan Offered $1 Million Settlement Before Sexual Assault Claims Went Viral,https://www.wsj.com/business/jpmorgan-offered-1-million-settlement-before-sexual-assault-claims-went-viral-1be296a9?mod=rss_markets_main
31,2026-05-06-18-13-32 +0000,cbc,"Russia fires dozens of drones at Ukraine in 'obvious spurning' of ceasefire, says Zelenskyy",https://www.cbc.ca/news/world/russia-ukraine-ceasefire-9.7189856?cmp=rss
30,2026-05-06-21-27-52 +0000,nyt,Justice Dept. Accuses U.C.L.A. Medical School of Bias Against White and Asian Applicants,https://www.nytimes.com/2026/05/06/us/politics/justice-department-ucla-medical-school-race-admissions.html
30,2026-05-06-14-28-13 +0000,cbc,"Ted Turner, founder of CNN, dead at 87",https://www.cbc.ca/news/entertainment/ted-turner-obituary-9.7189528?cmp=rss
30,2026-05-07-06-09-00 +0000,wsj,"Rheinmetall Posts Rise in Sales, Expects Higher Growth",https://www.wsj.com/business/earnings/rheinmetall-posts-rise-in-sales-expects-higher-growth-125e44af?mod=pls_whats_news_us_business_f
30,2026-05-06-16-40-00 +0000,nypost,Apple dealt blow by Supreme Court in long-running antitrust feud against ‘Fortnite’ maker,https://nypost.com/2026/05/06/business/apple-dealt-blow-by-supreme-court-in-long-running-antitrust-feud-against-fortnite-maker/
30,2026-05-06-15-02-05 +0000,nyt,Leo XIV Is the First Pope From the U.S. He’s Making That an Asset.,https://www.nytimes.com/2026/05/06/world/europe/leo-first-american-pope.html
29,2026-05-06-10-00-00 +0000,latimes,Another California baby gets measles. How can kids be protected?,https://www.latimes.com/california/story/2026-05-06/another-california-baby-gets-measles-how-can-kids-be-protected
29,2026-05-06-11-53-20 +0000,bbc,Russia ignores Ukraine's unilateral ceasefire and attacks kindergarten,https://www.bbc.com/news/articles/cpdpxdd5n6yo?at_medium=RSS&at_campaign=rss
29,2026-05-06-23-25-24 +0000,bbc,"Key bridge linking North Korea and Russia almost finished, satellite images show",https://www.bbc.com/news/articles/cwy2e3wwd55o?at_medium=RSS&at_campaign=rss
29,2026-05-06-13-41-22 +0000,bbc,Moment former FedEx driver sentenced to death for killing Athena Strand,https://www.bbc.com/news/videos/cwy2j93jkv2o?at_medium=RSS&at_campaign=rss
29,2026-05-07-08-55-15 +0000,nypost,American tourist plunges to her  death from 29th floor of Hong Kong hotel,https://nypost.com/2026/05/07/world-news/american-tourist-dies-after-plunging-from-29th-floor-of-hong-kong-hotel-seven-on-ground-injured/
28,2026-05-06-22-38-41 +0000,wapo,"Israel strikes Beirut suburbs, threatening already shaky ceasefire",https://www.washingtonpost.com/world/2026/05/06/israel-hezbollah-radwan-beirut-attack-haret-hreik/
28,2026-05-07-05-37-59 +0000,nypost,"Special Forces veteran Craig Berry accused of trying to kill wife found dead, ending massive Tennessee manhunt",https://nypost.com/2026/05/07/us-news/tennessee-army-special-forces-veteran-craig-berry-found-dead-after-trying-to-kill-wife/
28,2026-05-07-02-36-22 +0000,latimes,"Arellano: Two winners, one loser in L.A. mayor's debate",https://www.latimes.com/california/story/2026-05-06/la-mayors-race-skirball-center
28,2026-05-06-20-18-43 +0000,nypost,Spencer Pratt transforms into Batman in ‘amazing’ new video,https://nypost.com/2026/05/06/us-news/spencer-pratt-transforms-into-batman-in-amazing-new-video/
28,2026-05-06-21-37-00 +0000,wsj,"Tech, Media & Telecom Roundup: Market Talk",https://www.wsj.com/business/tech-media-telecom-roundup-market-talk-2e71e9b8?mod=pls_whats_news_us_business_f
27,2026-05-06-16-48-25 +0000,nypost,Ex-Biden official rips into Gavin Newsom allies’ governor candidate,https://nypost.com/2026/05/06/us-news/ex-biden-aide-rips-into-california-governor-candidate-xavier-becerra/
27,2026-05-06-17-00-05 +0000,latimes,"UCLA medical school illegally uses race in admissions, Justice Department investigation says",https://www.latimes.com/california/story/2026-05-06/ucla-medical-school-illegal-use-race-admissions-doj-investigation-findings
27,2026-05-07-06-32-10 +0000,nypost,Maine Sen. Susan Collins reveals ‘essential tremor’ diagnosis: ‘It’s had absolutely no impact’,https://nypost.com/2026/05/07/us-news/maine-sen-susan-collins-discloses-benign-essential-tremor-diagnosis-after-launching-re-election-campaign/
27,2026-05-06-16-02-00 +0000,wsj,Timothée Chalamet’s Latest Role? Back-Street Soccer Fanatic in an Adidas World Cup Ad,https://www.wsj.com/business/media/timothee-chalamets-latest-role-back-street-soccer-fanatic-in-an-adidas-world-cup-ad-780d7e6d?mod=pls_whats_news_us_business_f
27,2026-05-06-16-17-15 +0000,nypost,"CNN’s Abby Phillip, Van Jones clash over questions about Israel’s nuclear weapons",https://nypost.com/2026/05/06/media/cnns-abby-phillip-van-jones-clash-over-questions-about-israels-nuclear-weapons/
27,2026-05-06-18-43-09 +0000,nypost,Commerce Secretary Howard Lutnick found Epstein island lunch invite ‘unsettling’ – but went anyway,https://nypost.com/2026/05/06/us-news/commerce-secretary-howard-lutnick-found-epstein-island-lunch-invite-unsettling-but-went-anyway/
27,2026-05-07-02-11-15 +0000,nyt,Federal Agents and Los Angeles Police Arrest 18 in Drug Raid,https://www.nytimes.com/2026/05/06/us/federal-drug-raid-los-angeles.html
26,2026-05-06-18-27-00 +0000,wsj,Kraft Heinz CEO Pushes Value: ‘Consumers Are Literally Running Out of Money’,https://www.wsj.com/business/retail/kraft-heinz-ceo-pushes-value-consumers-are-literally-running-out-of-money-72b9b50f?mod=pls_whats_news_us_business_f
26,2026-05-06-10-41-00 +0000,latimes,"Disney's theme parks revenue holds steady, despite national economic concerns",https://www.latimes.com/entertainment-arts/business/story/2026-05-06/disney-q2-earnings-theme-parks-visitors-consumer-economy-prices
26,2026-05-06-14-21-44 +0000,nypost,Fiancé quizzed over death of NJ influencer Ashlee Jenae calls it an  ‘incomprehensible tragedy’,https://nypost.com/2026/05/06/world-news/nj-influencer-ashlee-jenaes-fiance-calls-her-zanzibar-death-an-incomprehensible-tragedy/
26,2026-05-07-07-58-03 +0000,nypost,"Dem representative admits to working with Mexico to sneak oil into Cuba, despite blockade",https://nypost.com/2026/05/07/us-news/dem-rep-pramila-jayapal-admits-to-working-with-mexico-to-sneak-oil-into-cuba/
26,2026-05-07-07-15-00 +0000,wsj,Catalyst Pharma to Be Acquired by Angelini Pharma in $4.1 Billion Deal,https://www.wsj.com/finance/investing/catalyst-pharma-to-be-acquired-by-angelini-pharma-in-4-1-billion-deal-0deadbc0?mod=rss_markets_main
26,2026-05-07-06-47-00 +0000,wsj,Shipping Giant Maersk Maintains Guidance Despite Rising Costs From Middle East Conflict,https://www.wsj.com/business/logistics/shipping-giant-maersk-maintains-guidance-despite-rising-costs-from-middle-east-conflict-d9a6fe72?mod=pls_whats_news_us_business_f
25,2026-05-06-17-47-12 +0000,nyt,How the Fight Over Israel Is Playing Out Inside MAGA,https://www.nytimes.com/2026/05/06/us/politics/israel-maga-republicans.html
25,2026-05-06-19-32-56 +0000,bbc,"Two Portuguese police chiefs detained as abuse scandal escalates, reports say",https://www.bbc.com/news/articles/c0r2zq9wg9xo?at_medium=RSS&at_campaign=rss
25,2026-05-06-19-38-06 +0000,missionlocal,"James Spingola, ex-S.F. nonprofit head charged with financial crimes, loses lawyer",https://missionlocal.org/2026/05/james-spingola-lawyer/
25,2026-05-07-03-25-53 +0000,missionlocal,‘Safety brothers:’ Larry Low tapped for S.F. police commission — brother of fire commissioner,https://missionlocal.org/2026/05/larry-low-sf-police-commission-allan-low/
25,2026-05-06-21-24-00 +0000,wsj,JPMorgan Tried to Settle Sexual-Assault Claims That Went Viral,https://www.wsj.com/business/jpmorgan-tried-to-settle-sexual-assault-claims-that-went-viral-ca354c5f?mod=pls_whats_news_us_business_f
25,2026-05-06-17-25-44 +0000,bbc,When will the elections results come in?,https://www.bbc.com/news/videos/cj4pn97qvlwo?at_medium=RSS&at_campaign=rss
25,2026-05-06-21-12-31 +0000,wapo,DOJ sues Colorado over high-capacity magazine ban passed after Aurora shooting,https://www.washingtonpost.com/nation/2026/05/06/colorado-lawsuit-high-capacity-magazines-doj/
25,2026-05-06-22-12-47 +0000,startribune,St. Paul police officer charged with repeatedly burglarizing Cub Foods,https://www.startribune.com/st-paul-police-officer-charged-with-repeatedly-burglarizing-cub-foods/601837828
24,2026-05-07-07-58-00 +0000,wsj,Gold Extends Gains as Falling Oil Eases Inflation Risk,https://www.wsj.com/finance/commodities-futures/gold-prices-steady-supported-by-lower-u-s-treasury-yields-bc2730e6?mod=rss_markets_main
24,2026-05-06-20-00-10 +0000,latimes,"Mattresses, clothes found in smoldering tunnel as investigators probe cause of fire under the 110",https://www.latimes.com/california/story/2026-05-06/caltrans-freeway-fire-investigation
24,2026-05-06-22-07-40 +0000,startribune,Judge declines bid by districts to temporarily block immigration agents from Minnesota schools,https://www.startribune.com/judge-declines-bid-by-districts-to-temporarily-block-immigration-agents-from-minnesota-schools/601837861
24,2026-05-06-16-09-50 +0000,nypost,"FBI raids office of powerful Virginia Democrat as part of major corruption, marijuana probe",https://nypost.com/2026/05/06/us-news/fbi-raids-office-of-powerful-virginia-democrat-as-part-of-major-corruption-marijuana-probe/
24,2026-05-07-01-53-22 +0000,missionlocal,S.F. judge denies DA Jenkins’ attempt to bar word ‘genocide’ from Palestine protest trial,https://missionlocal.org/2026/05/golden-gate-protesters-pretrial-motions/
24,2026-05-07-03-00-00 +0000,startribune,"Allen Eskens, ex-Star Tribune staffers among Minnesota Book Award winners",https://www.startribune.com/allen-eskens-sun-yung-shin-douglas-kearney-josephine-marcotty-dave-hage-kelly-foster-lindquist/601837657
24,2026-05-07-07-57-00 +0000,wsj,"Shell’s Earnings Surge, But Warns of Lower Production Due to Middle East Conflict",https://www.wsj.com/business/energy-oil/shells-earnings-surge-but-warns-of-lower-production-due-to-middle-east-conflict-06587524?mod=pls_whats_news_us_business_f
24,2026-05-06-21-48-00 +0000,wsj,Health Care Roundup: Market Talk,https://www.wsj.com/business/health-care-roundup-market-talk-b8615a07?mod=rss_markets_main
24,2026-05-06-21-45-00 +0000,wsj,Energy & Utilities Roundup: Market Talk,https://www.wsj.com/business/energy-utilities-roundup-market-talk-1433ad26?mod=pls_whats_news_us_business_f
24,2026-05-06-22-22-05 +0000,latimes,How to watch tonight's Los Angeles mayoral debate,https://www.latimes.com/california/story/2026-05-06/how-to-watch-los-angeles-mayoral-debate-bass-pratt-raman
24,2026-05-07-00-47-03 +0000,nyt,The sexual assault allegations against Eric Swalwell rattled the race.,https://www.nytimes.com/live/2026/05/06/us/california-governor-debate/the-sexual-assault-allegations-against-eric-swalwell-rattled-the-race
23,2026-05-07-05-02-12 +0000,bbc,Ukraine is a global surrogacy hub - but that could be about to end,https://www.bbc.com/news/articles/clyp4kp687go?at_medium=RSS&at_campaign=rss
23,2026-05-07-01-25-54 +0000,latimes,He took a Molotov cocktail to an ICE protest. Now the SoCal man is going to prison.,https://www.latimes.com/california/story/2026-05-06/socal-man-ice-protest-molotov-sentencing
23,2026-05-06-11-34-56 +0000,bbc,German police raid neo-Nazi criminal youth groups,https://www.bbc.com/news/articles/cgkpmy6l2deo?at_medium=RSS&at_campaign=rss
23,2026-05-06-21-40-00 +0000,wsj,Financial Services Roundup: Market Talk,https://www.wsj.com/business/financial-services-roundup-market-talk-c3b9006c?mod=rss_markets_main
23,2026-05-07-00-00-00 +0000,wsj,The Chip Craze Is Turning a Glass Company and a Toilet Maker Into AI Stocks,https://www.wsj.com/finance/stocks/the-chip-craze-is-turning-a-glass-company-and-a-toilet-maker-into-ai-stocks-67198276?mod=rss_markets_main
23,2026-05-06-18-55-56 +0000,nyt,World Cup Dynamic Ticket Pricing Drives Argentine Soccer Fans To Extremes,https://www.nytimes.com/2026/05/06/world/americas/2026-world-cup-ticket-prices-argentina.html
23,2026-05-07-05-41-30 +0000,nypost,"DOJ investigating woke, Soros-backed Virginia DA over ‘sweetheart’ deals given to illegal migrants",https://nypost.com/2026/05/07/us-news/doj-investigating-woke-soros-backed-virginia-da-over-sweetheart-deals-given-to-illegal-migrants/
23,2026-05-07-04-28-30 +0000,startribune,Live from Game 2: Timberwolves suffer worst loss in their playoff history as San Antonio cruises to 133-95 victory,https://www.startribune.com/minnesota-timberwolves-sanantonio-spurs-nba-playoffs-live-wemby-ant-ayo-dosunmu/601833708
23,2026-05-07-09-05-00 +0000,nypost,Bitcoin taxes: What you actually owe the IRS when you sell,https://nypost.com/business/crypto-bitcoin-taxes-guide/
23,2026-05-07-08-00-00 +0000,cbc,Mexico trade mission launches in Toronto as businesses seek to expand ties with Canada,https://www.cbc.ca/news/world/mexico-trade-mission-toronto-usmca-9.7190217?cmp=rss
23,2026-05-06-19-28-07 +0000,latimes,"If you're an iPhone user, you could get $95 from this Apple settlement",https://www.latimes.com/business/story/2026-05-06/if-youre-iphone-user-you-could-get-95-from-this-apple-settlement
23,2026-05-06-15-24-57 +0000,nyt,Disney Posts Strong Earnings Despite Slowdown in Park Visitors,https://www.nytimes.com/2026/05/06/business/media/disney-earnings.html
