score,pubdate,source,title,link
16,2025-12-09-00-57-23 +0000,latimes,Sick City Records tries to 'keep the music alive' as potential closure looms,https://www.latimes.com/delos/story/2025-12-08/sick-city-records-tries-to-keep-music-alive-as-potential-closure-looms
16,2025-12-08-20-08-26 +0000,cbc,"Government to soon have 'sharper view' on public servants' return to office, says Carney",https://www.cbc.ca/news/politics/return-to-office-rules-update-carney-9.7007430?cmp=rss
15,2025-12-09-01-35-42 +0000,nypost,Virginia football team loses state semis by 1 point as fugitive coach Travis Turner remains missing,https://nypost.com/2025/12/08/us-news/missing-coach-travis-turners-high-school-football-team-loses-in-state-semis-by-1-point/
15,2025-12-08-19-56-11 +0000,cbc,Carney delivers more details on $400M housing plan for Ottawa,https://www.cbc.ca/news/canada/ottawa/carney-sutcliffe-housing-funding-breakfast-ottawa-9.7007378?cmp=rss
15,2025-12-08-19-42-29 +0000,nyt,Instagram and Facebook Users in Europe Get Option of Sharing Less Data,https://www.nytimes.com/2025/12/08/business/instagram-facebook-eu-data.html
15,2025-12-08-21-47-00 +0000,wsj,Dow Falls as Investors Count Down to Fed Meeting,https://www.wsj.com/finance/stocks/global-stocks-markets-dow-news-12-08-2025-ef60519f?mod=rss_markets_main
15,2025-12-08-20-10-49 +0000,latimes,"Local appliance chain shuts without warning, leaving orders in limbo",https://www.latimes.com/business/story/2025-12-08/local-appliance-chain-shuts-without-warning-leaving-orders-in-limbo
15,2025-12-08-22-16-46 +0000,cbc,Heat point guard Terry Rozier pleads not guilty in sports betting case,https://www.cbc.ca/sports/basketball/nba/terry-rozier-not-guilty-plea-sports-betting-heat-nba-9.7007797?cmp=rss
15,2025-12-08-19-11-30 +0000,nypost,Alina Habba resigns as acting NJ US attorney,https://nypost.com/2025/12/08/us-news/alina-habba-resigns-as-acting-nj-us-attorney/
15,2025-12-08-18-32-43 +0000,nypost,Multiple Black Friday favorites on Amazon recalled due to a number of safety hazards,https://nypost.com/2025/12/08/business/multiple-black-friday-favorites-on-amazon-recalled-due-to-a-number-of-safety-hazards/
15,2025-12-08-20-02-15 +0000,nypost,Gavin Newsom’s gross response to The Post’s ‘testicle-crushing’ pose coverage backfires – sparking wave of memes,https://nypost.com/2025/12/08/us-news/gavin-newsoms-gross-response-to-the-posts-testicle-crushing-pose-coverage-backfires-sparking-wave-of-memes/
14,2025-12-09-10-02-20 +0000,nyt,"Kamala Harris on ’107 Days,’ 2028 and the Democratic Party’s Future",https://www.nytimes.com/2025/12/09/us/politics/kamala-harris-interview-107-days-book-2028.html
14,2025-12-08-20-13-00 +0000,wsj,Oil Futures Snap Three-Session Winning Streak,https://www.wsj.com/finance/commodities-futures/oil-flat-fed-rate-decision-in-focus-42c1fdeb?mod=pls_whats_news_us_business_f
14,2025-12-08-22-19-19 +0000,nyt,A Frustrated Congress Pushes the Pentagon to Produce Its Boat Strike Orders,https://www.nytimes.com/2025/12/08/us/politics/defense-bill-congress-boat-strikes.html
14,2025-12-08-15-05-14 +0000,bbc,"More than 100 people killed in attack on hospital in Sudan, WHO chief says",https://www.bbc.com/news/articles/c23e7kyl9myo?at_medium=RSS&at_campaign=rss
14,2025-12-08-17-05-31 +0000,nyt,"At a Democratic Governors Event, Hope, Nerves and Buzz for the Midterms and 2028 Election",https://www.nytimes.com/2025/12/08/us/politics/democratic-governors-midterms-2028-election.html
14,2025-12-08-18-30-00 +0000,nypost,Next 1000x crypto: How to find high-potential coins and presales,https://nypost.com/business/next-1000x-crypto/
13,2025-12-09-05-30-02 +0000,nyt,The Second ‘China Shock’,https://www.nytimes.com/2025/12/09/world/china-trade-asia-gaza-thailand-cambodia.html
13,2025-12-08-12-06-00 +0000,wsj,Prudential PLC Shares Rise After India JV Files IPO Prospectus,https://www.wsj.com/finance/prudential-plc-shares-rise-after-india-jv-files-for-ipo-prospectus-a28fd8ce?mod=rss_markets_main
13,2025-12-08-14-54-43 +0000,nyt,What Is the Federal Trade Commission?,https://www.nytimes.com/2025/12/08/us/politics/federal-trade-commission.html
13,2025-12-08-16-38-13 +0000,nyt,Why Russian Spies Are Using Mexico to Target the U.S.,https://www.nytimes.com/2025/12/08/world/americas/russian-spies-mexico.html
13,2025-12-08-17-38-55 +0000,nypost,Treasure hunter unearths 900-year-old figure of Jesus in windswept field,https://nypost.com/2025/12/08/world-news/treasure-hunter-unearths-900-year-old-figure-of-jesus-in-windswept-field/
13,2025-12-08-19-29-15 +0000,nyt,"Cora Weiss, Lifelong Champion of Social Justice, Dies at 91",https://www.nytimes.com/2025/12/08/us/politics/cora-weiss-dead.html
13,2025-12-09-08-00-10 +0000,nyt,"All 187,460 Miles of Road That Led to Rome, Mapped",https://www.nytimes.com/2025/12/09/science/archaeology-roman-empire-roads.html
13,2025-12-08-19-24-32 +0000,nyt,Jerusalem Authorities Raid UNRWA Compound and Raise Israeli Flag,https://www.nytimes.com/2025/12/08/world/middleeast/israel-jerusalem-unrwa-police-raid.html
13,2025-12-08-15-20-26 +0000,startribune,"Love, lies and the law intersect at Twin Cities trial over STD transmission, defamation",https://www.startribune.com/love-lies-and-the-law-intersect-at-twin-cities-trial-over-std-transmission-defamation/601537062
13,2025-12-08-16-09-11 +0000,wapo,Benin government says it has thwarted attempted military coup,https://www.washingtonpost.com/world/2025/12/07/benin-coup-attempt/
13,2025-12-09-10-02-28 +0000,nyt,These Travel Influencers Don’t Want Freebies. They’re A.I.,https://www.nytimes.com/2025/12/09/travel/ai-influencers.html
13,2025-12-09-10-06-42 +0000,bbc,Tanzania crackdown on planned protest leaves streets deserted,https://www.bbc.com/news/articles/cx2e3j819eqo?at_medium=RSS&at_campaign=rss
13,2025-12-08-22-23-00 +0000,wsj,Basic Materials Roundup: Market Talk,https://www.wsj.com/business/basic-materials-roundup-market-talk-ddbe92d2?mod=pls_whats_news_us_business_f
13,2025-12-08-22-21-00 +0000,wsj,Financial Services Roundup: Market Talk,https://www.wsj.com/business/financial-services-roundup-market-talk-189da03d?mod=pls_whats_news_us_business_f
13,2025-12-09-00-11-47 +0000,bbc,"'Living off grid is not a dream, it's a nightmare'",https://www.bbc.com/news/articles/cvgd9l8wxjpo?at_medium=RSS&at_campaign=rss
13,2025-12-09-00-10-31 +0000,bbc,Is AI in recruitment a 'race to the bottom'?,https://www.bbc.com/news/articles/ced6jv76091o?at_medium=RSS&at_campaign=rss
13,2025-12-08-23-56-18 +0000,48hills,‘Mood Swings’ crooner Mario: ‘San Francisco has always been supportive of R&B’,https://48hills.org/2025/12/mood-swings-crooner-mario-san-francisco-has-always-been-supportive-of-rb/
13,2025-12-08-23-14-28 +0000,nyt,Why Democratic Governors Argue They Are the Party’s Best Shot for 2028,https://www.nytimes.com/2025/12/08/us/politics/democratic-governors-dga-2028.html
12,2025-12-08-22-36-00 +0000,wsj,Toll Brothers Sounds Cautious Note for 2026 on Lagging Housing Demand,https://www.wsj.com/business/earnings/toll-brothers-gives-cautious-2026-outlook-as-housing-demand-remains-soft-24345e0d?mod=pls_whats_news_us_business_f
12,2025-12-08-21-26-00 +0000,wsj,100 Nigerian Students Freed After Kidnapping at Catholic School,https://www.wsj.com/world/africa/100-nigerian-students-freed-after-kidnapping-at-catholic-school-2eaa7307
12,2025-12-08-16-08-23 +0000,latimes,"After National Guard shooting, administration cracks down on legal immigration",https://www.latimes.com/politics/story/2025-12-08/after-national-guard-shooting-administration-cracks-down-on-legal-immigration
12,2025-12-09-00-04-41 +0000,startribune,"Souhan: Yes, I am comparing Vikings QB J.J. McCarthy to Hall of Famer Troy Aikman",https://www.startribune.com/minnesota-vikings-quarterback-jj-mccarthy-jim-souhan-column-troy-aikman-dallas-cowboys/601536987
12,2025-12-08-22-53-31 +0000,nypost,Piers Morgan slams Nick Fuentes for calling Hitler ‘f—king cool’: ‘What a crock of s—t’,https://nypost.com/2025/12/08/world-news/piers-morgan-slams-nick-fuentes-for-calling-hitler-fking-cool/
12,2025-12-08-22-50-00 +0000,wsj,Jamie Dimon Forms Adviser Supergroup for $1.5 Trillion American Resiliency Pledge,https://www.wsj.com/finance/banking/jamie-dimon-forms-adviser-supergroup-for-1-5-trillion-american-resiliency-pledge-781e3d58?mod=rss_markets_main
12,2025-12-09-06-38-00 +0000,wsj,Thyssenkrupp Swings to Net Profit But Warns Challenging Conditions Remain,https://www.wsj.com/business/earnings/thyssenkrupp-swings-to-net-profit-but-warns-challenging-conditions-remain-3721bf07?mod=pls_whats_news_us_business_f
12,2025-12-08-23-37-00 +0000,bbc,Thieves snatch eight Matisse artworks from library in Brazil,https://www.bbc.com/news/articles/c0mp4nevdz7o?at_medium=RSS&at_campaign=rss
12,2025-12-09-01-39-22 +0000,nyt,Nepal Charges Chinese Construction Firm for Corruption Over Airport,https://www.nytimes.com/2025/12/08/business/china-nepal-airport-corruption.html
12,2025-12-08-11-30-20 +0000,bbc,All you need to know about Afcon 2025,https://www.bbc.com/sport/football/articles/ce8gw6erjzlo?at_medium=RSS&at_campaign=rss
12,2025-12-08-11-30-00 +0000,wsj,Amazon Leads $81 Million Financing for Battery Startup Blue Current,https://www.wsj.com/articles/amazon-leads-81-million-financing-for-battery-startup-blue-current-c45c4b7b?mod=pls_whats_news_us_business_f
12,2025-12-08-16-28-57 +0000,48hills,"Fred Again surprised SF with ecstatic ‘USB002’ set—yes, in this economy",https://48hills.org/2025/12/fred-again-surprised-sf-with-usb002-set-yes-in-this-economy/
12,2025-12-08-16-47-12 +0000,nyt,Storm Bram’s Heavy Rain and Strong Winds Could Disrupt Travel Across Ireland and U.K.,https://www.nytimes.com/2025/12/08/weather/storm-bram-ireland-uk.html
12,2025-12-08-12-00-00 +0000,wapo,"Work Advice: Karla’s final performance review, part 1",https://www.washingtonpost.com/business/2025/12/08/work-advice-reader-roundup/
11,2025-12-08-19-36-09 +0000,nyt,Yemen’s Civil War Could Escalate Again. Here’s What to Know.,https://www.nytimes.com/2025/12/05/world/middleeast/yemen-separatism.html
11,2025-12-08-11-07-54 +0000,bbc,People in Benin felt 'total fear' at attempted coup,https://www.bbc.com/news/videos/c9qenv20lq5o?at_medium=RSS&at_campaign=rss
11,2025-12-08-21-44-30 +0000,bbc,Watch: Moment commuter train collides with vehicle in Illinois,https://www.bbc.com/news/videos/c8jwmgx8nvko?at_medium=RSS&at_campaign=rss
11,2025-12-08-23-20-31 +0000,startribune,Minnesota Yacht Club’s 2026 festival lineup coming Tuesday,https://www.startribune.com/minnesota-yacht-clubs-2026-festival-lineup-coming-tuesday/601542379
11,2025-12-08-22-29-38 +0000,nyt,University of Oklahoma Removes a Teacher It Says Urged Students to Protest,https://www.nytimes.com/2025/12/08/us/oklahoma-university-removes-instructor-protest-bible-gender.html
11,2025-12-08-21-04-17 +0000,nyt,Clerk in Murdaugh Trial Is Sentenced to Probation for Perjury and Other Charges,https://www.nytimes.com/2025/12/08/us/becky-hill-guilty-alex-murdaugh-clerk.html
11,2025-12-08-15-15-00 +0000,wsj,"Washington, D.C., Police Chief Pamela Smith to Resign",https://www.wsj.com/us-news/d-c-police-chief-pamela-smith-to-resign-6dd57f06
10,2025-12-08-16-25-51 +0000,nyt,8 Matisse Works Stolen From Library in Brazil,https://www.nytimes.com/2025/12/08/world/americas/matisse-robbery-sao-paulo.html
10,2025-12-09-09-49-51 +0000,bbc,Minister 'disgusted' after soldiers injured in Ajax exercise,https://www.bbc.com/news/articles/ckgmy14n0l0o?at_medium=RSS&at_campaign=rss
10,2025-12-09-09-07-20 +0000,nypost,"16,000 fossil footprints in central Bolivia reveal dinosaur behavior",https://nypost.com/2025/12/09/world-news/16000-fossil-footprints-in-central-bolivia-reveal-dinosaur-behavior/
10,2025-12-08-16-21-00 +0000,wsj,L’Oréal Doubles Stake in Swiss Skincare Company Galderma,https://www.wsj.com/business/deals/loreal-doubles-stake-in-swiss-skincare-company-galderma-616728ca?mod=pls_whats_news_us_business_f
10,2025-12-08-20-34-33 +0000,bbc,About 100 abducted schoolchildren released in Nigeria,https://www.bbc.com/news/articles/cvgjvg4ylwpo?at_medium=RSS&at_campaign=rss
10,2025-12-08-17-45-27 +0000,nyt,"With MaXhosa Africa, Laduma Ngxokolo Is Reweaving South Africa’s Story",https://www.nytimes.com/2025/12/07/style/the-man-reweaving-south-africas-story.html
10,2025-12-09-06-54-37 +0000,nyt,Honduras Issues Warrant for Juan Orlando Hernández,https://www.nytimes.com/2025/12/08/world/americas/honduras-hernandez-arrest-warrant.html
10,2025-12-08-20-49-00 +0000,wsj,U.S. Treasury Yields End Higher,https://www.wsj.com/finance/ten-year-jgb-yield-declines-after-lackluster-japan-gdp-data-1d2d1646?mod=rss_markets_main
10,2025-12-09-00-29-08 +0000,bbc,A wage for housework? India's sweeping experiment in paying women,https://www.bbc.com/news/articles/c5y9ez3kzrdo?at_medium=RSS&at_campaign=rss
10,2025-12-09-05-01-10 +0000,nyt,"With Cheap Tickets and Lax Etiquette, a Theater Builds an Older Fan Base",https://www.nytimes.com/2025/12/09/world/asia/skorea-aging-movies.html
10,2025-12-09-10-30-00 +0000,wsj,Consumer Loans Are Getting Harder to Tally—and the Risks Harder to Gauge,https://www.wsj.com/finance/banking/consumer-loans-are-getting-harder-to-tallyand-the-risks-harder-to-gauge-29bfeb90?mod=rss_markets_main
10,2025-12-08-22-07-27 +0000,nyt,Martin Parr Dies at 73; Photographed Britain’s Unvarnished Quirks,https://www.nytimes.com/2025/12/07/arts/design/martin-parr-dead.html
9,2025-12-08-16-37-01 +0000,nyt,Katy Perry Posts Photos With Justin Trudeau Amid Romance Rumors,https://www.nytimes.com/2025/12/07/world/canada/katy-perry-justin-trudeau-relationship-japan.html
9,2025-12-09-09-53-47 +0000,bbc,Nasa astronaut and Roscosmos cosmonauts return to Earth,https://www.bbc.com/news/videos/c93n0939q5yo?at_medium=RSS&at_campaign=rss
9,2025-12-08-19-13-07 +0000,nyt,"Attacks on Kindergarten and Hospital Kill 114 in Sudan, W.H.O. Says",https://www.nytimes.com/2025/12/08/world/africa/sudan-un-attack-rsf.html
9,2025-12-09-10-28-07 +0000,bbc,Rayner urges MPs not to 'blink or buckle' on employment rights,https://www.bbc.com/news/articles/c8r3vmvr0meo?at_medium=RSS&at_campaign=rss
9,2025-12-09-01-52-31 +0000,nyt,"Donald E. Petersen, 97, Who Rescued Ford Motor Co., Is Dead",https://www.nytimes.com/2025/12/08/obituaries/donald-e-petersen-dead.html
9,2025-12-09-02-36-16 +0000,48hills,SF fires immigrant advocate—and activists are confused and angry,https://48hills.org/2025/12/sf-fires-immigrant-advocate-and-activists-are-confused-and-angry/
9,2025-12-08-19-19-31 +0000,nyt,Syrians Celebrate Anniversary of Bashar al-Assad’s Fall,https://www.nytimes.com/2025/12/08/world/middleeast/syria-anniversary-assad-fall.html
8,2025-12-08-18-02-17 +0000,nyt,"For Martin Parr, ‘Showing Things as They Are’ Was Art",https://www.nytimes.com/2025/12/08/arts/martin-parr-photographer-appraisal.html
8,2025-12-08-22-37-00 +0000,wsj,"Opinion | To Sign or Not to Sign, That Is the Question",https://www.wsj.com/opinion/to-sign-or-not-to-sign-that-is-the-question-d1535ea8
8,2025-12-08-22-40-00 +0000,wsj,Opinion | The Decline of Europe in Gallic Profile,https://www.wsj.com/opinion/the-decline-of-europe-in-gallic-profile-af5fd1be
8,2025-12-09-10-41-00 +0000,wsj,U.S. Treasury Yields Could Have Room to Fall,https://www.wsj.com/articles/u-s-treasury-yields-mixed-amid-investor-caution-pre-fed-meeting-8cb3f155?mod=rss_markets_main
8,2025-12-08-16-15-23 +0000,bbc,Rebrand for golf course named after former prince Andrew,https://www.bbc.com/news/articles/cq8deqv8e74o?at_medium=RSS&at_campaign=rss
8,2025-12-08-19-35-26 +0000,nyt,"Boeing Completes Acquisition of Spirit AeroSystems, a Major Supplier",https://www.nytimes.com/2025/12/08/business/boeing-spirit-aerosystems.html
8,2025-12-09-07-50-52 +0000,nyt,Love Letters From a Chinese Jail,https://www.nytimes.com/video/world/asia/100000010535060/gao-zhen-china-artist-detained.html
8,2025-12-09-10-03-46 +0000,nyt,"Three Years After Dobbs, the State Divide Over Abortion Deepens",https://www.nytimes.com/2025/12/09/us/states-new-abortion-laws.html
7,2025-12-08-23-07-00 +0000,wsj,The WSJ Dollar Index Rises 0.15% to 96.56,https://www.wsj.com/finance/commodities-futures/singapore-dollar-consolidates-eyes-on-feds-rate-decision-06d57de5?mod=rss_markets_main
7,2025-12-08-15-13-44 +0000,bbc,Why Alonso's chances of survival at Real Madrid are slim,https://www.bbc.com/sport/football/articles/c3w75qv0v2no?at_medium=RSS&at_campaign=rss
7,2025-12-09-02-40-54 +0000,bbc,"US deports second group of Iranian nationals, officials say",https://www.bbc.com/news/articles/c23e77ln3d1o?at_medium=RSS&at_campaign=rss
7,2025-12-08-18-03-40 +0000,nyt,Collector Surrenders ‘Nude Emperor’ Statue Identified as Looted,https://www.nytimes.com/2025/12/08/arts/design/nude-emperor-statue-met-marble-head-turkey.html
7,2025-12-09-00-51-33 +0000,nyt,The Married Scientists Torn Apart by a Covid Bioweapon Theory,https://www.nytimes.com/2025/12/07/us/china-virologist-li-meng-yan-coronavirus.html
6,2025-12-09-10-00-31 +0000,nyt,Canada’s Northwest Territories Diamond Mines Are Closing,https://www.nytimes.com/2025/12/09/world/canada/canada-northwest-territories-diamond-mines.html
6,2025-12-09-08-19-36 +0000,bbc,Branding and logo for Great British Railways unveiled,https://www.bbc.com/news/articles/c4g9kx0je10o?at_medium=RSS&at_campaign=rss
6,2025-12-08-15-11-58 +0000,nyt,Who are the lawyers arguing the F.T.C. case?,https://www.nytimes.com/live/2025/12/08/us/trump-supreme-court-presidential-power/lawyers-ftc-supreme-court
6,2025-12-08-16-12-22 +0000,missionlocal,"What’s on now at San Francisco museums, December 2025",https://missionlocal.org/2025/12/whats-on-now-at-san-francisco-museums-december-2025/
5,2025-12-08-11-41-00 +0000,wsj,German Industrial Output Accelerates Again,https://www.wsj.com/world/europe/german-industrial-production-accelerates-further-d5ec849d
5,2025-12-08-17-26-11 +0000,nyt,Here’s the latest.,https://www.nytimes.com/2025/12/08/us/politics/heres-the-latest.html
5,2025-12-09-10-00-17 +0000,nyt,"In L.A., $750 a Month to Live in a Backyard Storage Unit",https://www.nytimes.com/2025/12/09/us/california-backyard-housing-rent-storage-unit.html
5,2025-12-08-22-43-00 +0000,wsj,Opinion | A Miami Republican’s Immigration Dissent,https://www.wsj.com/opinion/maria-elvira-salazar-immigration-trump-white-house-national-guard-shooting-9ae7f77e
4,2025-12-08-14-00-00 +0000,missionlocal,The garden is open,https://missionlocal.org/2025/12/sf-photos-the-garden-is-open/
4,2025-12-09-06-08-33 +0000,bbc,'Second home' pub opens as a warm space,https://www.bbc.com/news/articles/c14v7j0pzndo?at_medium=RSS&at_campaign=rss
4,2025-12-08-18-12-21 +0000,nyt,"U.S. Deports Second Planeload of Iranians, Officials Say",https://www.nytimes.com/2025/12/07/world/middleeast/us-deports-second-planeload-iranians.html
2,2025-12-08-14-02-25 +0000,nyt,Who Is Rebecca Slaughter?,https://www.nytimes.com/2025/12/08/us/politics/rebecca-slaughter.html
