score,pubdate,source,title,link
10,2026-05-07-09-02-33 +0000,nyt,Florida Creates a More Conservative Course to Rival A.P. History,https://www.nytimes.com/2026/05/07/us/florida-conservative-history-course-ap.html
10,2026-05-06-16-11-59 +0000,bbc,People urged not to cancel flights over fuel shortage fears,https://www.bbc.com/news/articles/cyv24v3mpdmo?at_medium=RSS&at_campaign=rss
10,2026-05-06-15-45-00 +0000,wsj,The Super Prime Credit Score Club Is Growing Rapidly,https://www.wsj.com/personal-finance/credit/the-super-prime-credit-score-club-is-growing-rapidly-a01de5ca?mod=rss_markets_main
10,2026-05-06-21-45-11 +0000,nyt,Air-Conditioning Is in Short Supply as Asia Swelters,https://www.nytimes.com/2026/05/06/world/asia/asia-heatwave-air-conditioning-fuel-crisis.html
10,2026-05-06-20-45-59 +0000,nyt,Khaled Sabsabi’s Rocky Road From Australia to the Biennale,https://www.nytimes.com/2026/05/06/arts/design/khaled-sabsabi-australia-venice-biennale.html
10,2026-05-06-21-32-00 +0000,wsj,Opinion | Mass Deportation and American Jobs,https://www.wsj.com/opinion/mass-deportation-american-jobs-nber-university-of-colorado-boulder-study-e06e26af
10,2026-05-06-12-00-00 +0000,missionlocal,Cuts could send S.F. veterans back to criminal court,https://missionlocal.org/2026/05/cuts-sf-veterans-court-counselors/
10,2026-05-06-09-49-00 +0000,wsj,ECB Tracker Points to Slower Wage Growth in 2026,https://www.wsj.com/economy/global/ecb-tracker-points-to-slower-wage-growth-in-2026-68af1ae5
10,2026-05-06-13-19-03 +0000,48hills,"Drama Masks: Get in, loser, we’re going to the theater",https://48hills.org/2026/05/drama-masks-mean-girls-ray-of-light-shades-shadows-magic-theatre-review/
10,2026-05-07-03-00-00 +0000,wsj,The Most Coveted Cosmetic Enhancement in Asia Right Now: Elf Ears,https://www.wsj.com/lifestyle/elf-ears-south-korea-asia-plastic-surgery-67c1bd8c
10,2026-05-07-03-00-00 +0000,wsj,India Is Increasingly Ruled by a Single Party—Modi’s,https://www.wsj.com/world/india/india-is-increasingly-ruled-by-a-single-partymodis-c6f616e9
9,2026-05-06-12-35-15 +0000,bbc,Orphaned baby hippo to be hand-reared by keepers at Kenya sanctuary,https://www.bbc.com/news/articles/c1e2zev6754o?at_medium=RSS&at_campaign=rss
9,2026-05-06-10-00-44 +0000,wapo,How college students are learning to socialize without cellphones,https://www.washingtonpost.com/education/2026/05/06/college-socializing-screen-free-zones/
9,2026-05-06-15-19-05 +0000,bbc,What could Reading's housing situation look like?,https://www.bbc.com/news/videos/cp8pvnmke3zo?at_medium=RSS&at_campaign=rss
9,2026-05-06-23-41-26 +0000,nyt,Conservative Group’s Connections at the State Department Raise Some Alarms,https://www.nytimes.com/2026/05/06/us/politics/conservative-groups-influence-inside-the-state-department-raises-alarms.html
9,2026-05-06-16-24-00 +0000,bbc,French professor investigated for awarding himself fake prize,https://www.bbc.com/news/articles/c4g8pwjdp6do?at_medium=RSS&at_campaign=rss
9,2026-05-06-21-10-00 +0000,startribune,Midwest’s largest salvage yard Bauer Brothers closes after 66 years,https://www.startribune.com/midwests-largest-salvage-yard-bauer-brothers-closes-after-60-years/601837813
9,2026-05-06-17-26-33 +0000,nyt,Why Is Gas So Much More Expensive in Some States Than Others?,https://www.nytimes.com/2026/05/06/business/energy-environment/gasoline-prices-states-iran-war.html
9,2026-05-06-13-27-34 +0000,wapo,Why the odds keep rising for the strongest El Niño in a century,https://www.washingtonpost.com/weather/2026/05/06/el-nino-record-weather-impacts/
8,2026-05-07-06-14-16 +0000,bbc,Wembanyama shines as Spurs and Knicks win in play-offs,https://www.bbc.com/sport/basketball/articles/cn7pvej7xmzo?at_medium=RSS&at_campaign=rss
8,2026-05-07-09-03-06 +0000,nyt,The ‘Perfect Storm’ Hanging Over Britain’s Public Debt,https://www.nytimes.com/2026/05/07/business/britain-bonds-gilt.html
8,2026-05-06-17-30-00 +0000,wsj,Airlines Are Cracking Down on Portable Power Banks,https://www.wsj.com/business/airlines/airlines-are-cracking-down-on-portable-power-banks-9735e4f2?mod=pls_whats_news_us_business_f
8,2026-05-07-00-55-38 +0000,nyt,A Scaled-Back Celebration for Public Servants ‘in Trauma’,https://www.nytimes.com/2026/05/06/us/politics/public-servants-awards.html
8,2026-05-06-21-30-00 +0000,wsj,The WSJ Dollar Index Falls 0.53% to 94.78,https://www.wsj.com/finance/currencies/asian-currencies-mostly-strengthen-amid-risk-on-sentiment-65942a7c?mod=rss_markets_main
8,2026-05-07-03-40-13 +0000,nyt,Here’s the latest.,https://www.nytimes.com/live/2026/05/06/us/california-governor-debate/what-to-know-and-how-to-watch
8,2026-05-06-16-17-45 +0000,nyt,Guy Goma’s Accidental BBC Interview Lives On After 20 Years,https://www.nytimes.com/2026/05/06/business/media/bbc-guy-goma-interview.html
7,2026-05-06-16-32-00 +0000,wsj,Burger King Sizzles as Popeyes Slumps,https://www.wsj.com/business/hospitality/burger-king-owner-restaurant-brands-sees-sales-grow-0ceaf650?mod=pls_whats_news_us_business_f
7,2026-05-06-20-34-00 +0000,wsj,Opinion | The GOP Defeats Itself in Indiana,https://www.wsj.com/opinion/the-gop-defeats-itself-in-indiana-1927c4cd
7,2026-05-06-16-34-03 +0000,nypost,IDF kills Hamas terrorists in northern Gaza airstrikes,https://nypost.com/2026/05/06/world-news/idf-kills-hamas-terrorists-in-northern-gaza-airstrikes/
7,2026-05-07-09-00-57 +0000,nyt,Is It an Art Gallery? A Museum? A Theater? A Dream?,https://www.nytimes.com/2026/05/07/theater/ministry-of-awe-philadelphia-immersive-theater.html
6,2026-05-06-14-24-00 +0000,wsj,Opinion | A Cautionary Tale From Across the Atlantic,https://www.wsj.com/opinion/a-cautionary-tale-from-across-the-atlantic-181b3063
5,2026-05-07-08-00-00 +0000,cbc,Why disarming Hezbollah is about much more than guns and rockets,https://www.cbc.ca/news/world/lebanon-hezbollah-disarm-9.7189327?cmp=rss
5,2026-05-06-21-32-00 +0000,wsj,Opinion | Mamdani and the Antisemites,https://www.wsj.com/opinion/new-york-antisemitism-protests-synagogue-zohran-mamdani-julie-menin-b4520c32
3,2026-05-07-01-00-00 +0000,missionlocal,Sunset view,https://missionlocal.org/2026/05/sunset-view/
2,2026-05-06-16-51-29 +0000,bbc,Who can I vote for in my area?,https://www.bbc.com/news/articles/c0ljrp76ywxo?at_medium=RSS&at_campaign=rss
