score,pubdate,source,title,link
183,2025-09-19-00-40-36 +0000,nypost,Jimmy Kimmel raged against Trump and his ‘MAGA mouth-breathers’ almost every night for a year before ABC pulled him off air,https://nypost.com/2025/09/18/us-news/jimmy-kimmel-raged-against-trump-almost-every-night-for-a-year-before-abc-pulled-him-off-air/
181,2025-09-18-15-10-04 +0000,nypost,Trump claims Jimmy Kimmel was taken off air for ‘bad ratings’ — and ‘said a horrible thing’ about Charlie Kirk,https://nypost.com/2025/09/18/us-news/trump-claims-jimmy-kimmel-was-fired-for-bad-ratings-and-for-saying-a-horrible-thing-about-charlie-kirk/
162,2025-09-18-21-50-35 +0000,nyt,What Jimmy Kimmel’s Suspension Says About the Trump Administration’s Crackdown Against Mainstream Media,https://www.nytimes.com/2025/09/18/business/media/trump-kimmel-cancel-culture-free-speech.html
159,2025-09-18-20-13-00 +0000,wsj,The Trump administration asked the Supreme Court to let it remove Fed governor Lisa Cook from the central bank’s board while a lawsuit challenging the president’s effort to fire her proceeds,https://www.wsj.com/politics/policy/trump-administration-asks-supreme-court-to-allow-fed-governors-removal-3329003d
154,2025-09-18-19-53-00 +0000,wsj,The Trump administration is putting the weight of the federal government behind a crackdown on political speech it deems objectionable following the fatal shooting of Charlie Kirk,https://www.wsj.com/politics/policy/jimmy-kimmel-trump-abc-disney-df61df48
149,2025-09-19-05-52-01 +0000,nypost,"Seth Meyers calls Trump a ‘visionary, innovator, great president, even better golfer’ in joke following ABC’s indefinite suspension of Kimmel",https://nypost.com/2025/09/19/entertainment/seth-meyers-slams-trump-crackdown-on-free-speech-day-after-abc-axing-of-friend-jimmy-kimmel/
147,2025-09-18-22-16-17 +0000,nypost,Rosie O’Donnell delivers unhinged tirade about Trump after ABC suspends ‘Jimmy Kimmel Live!’,https://nypost.com/2025/09/18/business/rosie-odonnell-caught-ranting-about-jimmy-kimmel-at-bar-in-northern-ireland/
142,2025-09-18-20-10-29 +0000,latimes,Behind the decision to bench Jimmy Kimmel: Trump FCC threats and charges of corporate cowardice,https://www.latimes.com/entertainment-arts/business/story/2025-09-18/hollywood-community-stunned-over-abcs-decision-to-bench-jimmy-kimmel
139,2025-09-18-20-39-09 +0000,startribune,Brooks: Trump administration won’t stop with Jimmy Kimmel,https://www.startribune.com/brooks-trump-administration-wont-stop-with-jimmy-kimmel/601476701
138,2025-09-18-10-33-53 +0000,nyt,Trump Hails Kimmel Suspension After Criticizing UK on Free Speech,https://www.nytimes.com/2025/09/18/world/europe/trump-kimmel-suspension-uk-free-speech.html
128,2025-09-19-04-51-51 +0000,nyt,ABC’s Suspension of Kimmel and Trump’s Chilling Effect on Late Night TV,https://www.nytimes.com/2025/09/18/arts/television/jimmy-kimmel.html
124,2025-09-18-10-45-28 +0000,nypost,"Vance describes ‘tough moment’ he broke news of Charlie Kirk’s assassination to Trump, Oval Office",https://nypost.com/2025/09/18/us-news/vance-describes-trump-oval-office-moment-after-charlie-kirk-assassination/
123,2025-09-18-20-48-39 +0000,nypost,UK cops show up at Trump-supporting cancer patient’s home to force her to apologize for ‘offensive’ Facebook post,https://nypost.com/2025/09/18/world-news/uk-cops-show-up-at-cancer-patients-home-over-offensive-post/
122,2025-09-18-18-12-38 +0000,nypost,Trump asks Supreme Court to let him fire Fed governor Lisa Cook,https://nypost.com/2025/09/18/us-news/trump-asks-supreme-court-to-let-him-fire-fed-governor-lisa-cook/
122,2025-09-18-15-15-02 +0000,nypost,Trump admits Putin ‘let me down’ on Ukraine peace talks as UK PM Keir Starmer says dictator ‘has shown his true face’,https://nypost.com/2025/09/18/us-news/trump-admits-putin-let-me-down-on-ukraine-peace-talks/
120,2025-09-19-01-10-58 +0000,nypost,AFT boss Randi Weingarten promotes her book suggesting Trump is a fascist in wake of Charlie Kirk’s assassination,https://nypost.com/2025/09/18/us-news/randi-weingarten-promotes-book-suggesting-trump-is-a-fascist-in-wake-of-charlie-kirks-assassination/
111,2025-09-18-13-55-08 +0000,nyt,ABC Pulls Jimmy Kimmel Off Air for Charlie Kirk Comments After F.C.C. Pressure,https://www.nytimes.com/2025/09/17/business/media/abc-jimmy-kimmel.html
111,2025-09-19-02-52-00 +0000,nypost,"Jimmy Kimmel digs in, refuses to apologize for Charlie Kirk comments after ABC pulls his show indefinitely",https://nypost.com/2025/09/18/media/jimmy-kimmel-digs-in-refuses-to-apologize-for-charlie-kirk-comments-after-abc-pulls-his-show-indefinitely/
111,2025-09-18-19-58-26 +0000,nypost,"Trump, Starmer sign $350B tech deal to spur AI, nuclear energy and quantum computing",https://nypost.com/2025/09/18/us-news/trump-starmer-sign-tech-prosperity-deal-to-spur-ai-nuclear-energy-and-quantum-computing-advances-as-part-of-350b-investment/
109,2025-09-19-00-32-02 +0000,wapo,"Threatened by Trump, Canada tries to make up, team up with Mexico",https://www.washingtonpost.com/world/2025/09/18/canada-mexico-trade-carney-sheinbaum-usmca/
109,2025-09-18-15-28-22 +0000,nypost,"Nvidia makes $5B bet on struggling Intel with stake, chip deal after Trump talks",https://nypost.com/2025/09/18/business/nvidia-makes-5b-bet-on-struggling-intel-with-stake-chip-deal-after-trump-talks/
107,2025-09-18-17-06-11 +0000,nypost,Jimmy Kimmel’s ratings were plummeting before ABC suspended him for Charlie Kirk comments,https://nypost.com/2025/09/18/media/jimmy-kimmels-ratings-were-slipping-before-abc-suspended-him-for-charlie-kirk-comments/
106,2025-09-18-14-58-31 +0000,nypost,Jimmy Kimmel’s ABC suspension sparks boycott calls against Disney: ‘Hit them where it hurts’,https://nypost.com/2025/09/18/media/jimmy-kimmel-suspension-from-abc-sparks-boycott-calls-against-disney/
105,2025-09-19-01-38-44 +0000,bbc,Canada and Mexico agree to deepen ties amid Trump trade war,https://www.bbc.com/news/articles/cwy8r042nx2o?at_medium=RSS&at_campaign=rss
105,2025-09-18-21-41-06 +0000,nyt,In Their Own Words: Trump and Top Officials Change Tone on Free Speech,https://www.nytimes.com/2025/09/18/us/politics/trump-free-speech.html
105,2025-09-18-16-31-15 +0000,latimes,Trump asks Supreme Court to uphold his firing of Federal Reserve Governor Lisa Cook,https://www.latimes.com/politics/story/2025-09-18/trump-appeals-to-supreme-court-seeking-to-fire-fed-governor-lisa-cook
104,2025-09-18-21-30-41 +0000,nypost,All about the business decision to suspend Jimmy Kimmel from ABC after his Charlie Kirk comments,https://nypost.com/2025/09/18/media/all-about-the-business-decision-to-suspend-jimmy-kimmel-from-abc-after-his-charlie-kirk-comments/
103,2025-09-18-21-23-45 +0000,bbc,Trump suggests Starmer could use military to control UK borders,https://www.bbc.com/news/articles/cpd91wjypj9o?at_medium=RSS&at_campaign=rss
103,2025-09-18-09-02-59 +0000,nyt,"At Windsor Castle, Melania Trump and Queen Camilla will view a 100-year-old royal dolls’ house.",https://www.nytimes.com/live/2025/09/18/world/trump-uk-visit/at-windsor-castle-melania-trump-and-queen-camilla-will-view-a-100-year-old-royal-dolls-house
101,2025-09-19-01-27-01 +0000,nyt,Trump Asks Supreme Court to Allow Removal of Fed Governor,https://www.nytimes.com/2025/09/18/us/politics/trump-supreme-court-fed.html
99,2025-09-19-01-05-00 +0000,wsj,Trump’s Trade War Split Canada and Mexico. Now They Want a United Front.,https://www.wsj.com/world/americas/canada-mexico-carney-sheinbaum-meeting-f913d0d7
98,2025-09-18-17-17-00 +0000,wsj,Tyler and Cameron Winklevoss are supporters of President Trump—but they have it out for one of his nominees,https://www.wsj.com/politics/policy/winklevoss-twins-bitcoin-trump-influence-a866efde
97,2025-09-18-10-51-36 +0000,nypost,Trump makes dig at Prince Harry after praising William as King Charles’ ‘remarkable son’ in state banquet speech,https://nypost.com/2025/09/18/world-news/trump-makes-dig-at-prince-harry-after-praising-william-as-king-charless-remarkable-son-in-state-banquet-speech/
97,2025-09-18-23-23-08 +0000,cbc,"Canada, Mexico agree to deepen ties in face of Trump's turbulent 2nd term",https://www.cbc.ca/news/politics/canada-mexico-agree-new-partnership-1.7637709?cmp=rss
97,2025-09-18-20-06-48 +0000,bbc,Sarah Smith: Trump visit showed UK's warm relations - and limited influence,https://www.bbc.com/news/articles/cgkn3key65do?at_medium=RSS&at_campaign=rss
96,2025-09-18-20-01-45 +0000,wapo,"Rate cut underscores limits of Trump’s influence on Fed independence, for now",https://www.washingtonpost.com/business/2025/09/18/fed-trump-independence-threat/
96,2025-09-19-01-00-00 +0000,wsj,"President Trump’s team is weighing a plan to spur the construction of factories and infrastructure, according to documents and people familiar with the discussions",https://www.wsj.com/politics/policy/trump-manufacturing-federal-land-ef3c02ba
96,2025-09-19-08-10-20 +0000,wapo,"Trump nixed $400 million in Taiwan military aid, pushing future arms sales",https://www.washingtonpost.com/national-security/2025/09/18/trump-taiwan-arms-sales-military-aid/
96,2025-09-18-20-30-00 +0000,wsj,"Nvidia to Invest $5 Billion in Intel, Furthering Trump’s Turnaround Plan",https://www.wsj.com/tech/ai/nvidia-intel-5-billion-investment-ad940533?mod=pls_whats_news_us_business_f
95,2025-09-18-11-15-06 +0000,bbc,In pictures: US President Donald Trump on second state to UK,https://www.bbc.com/news/articles/c4gqd70v496o?at_medium=RSS&at_campaign=rss
95,2025-09-18-19-41-34 +0000,nyt,Can Trump Actually Designate Antifa a Terrorist Group? Here Are the Facts.,https://www.nytimes.com/2025/09/18/us/politics/trump-antifa-terrorist-group.html
94,2025-09-18-10-00-00 +0000,latimes,"Trump administration increasingly places immigrants in solitary confinement, report finds",https://www.latimes.com/politics/story/2025-09-18/immigrants-are-increasingly-placed-in-solitary-confinement-report-finds
94,2025-09-18-10-00-00 +0000,latimes,Trump administration moves to make U.S. citizenship harder with revised civics test,https://www.latimes.com/politics/story/2025-09-18/trump-administration-moves-again-to-make-u-s-citizenship-test-harder
94,2025-09-18-13-04-32 +0000,nypost,"Local TV giant Sinclair demands Jimmy Kimmel make ‘direct apology’ to Charlie Kirk’s family, donate to TPUSA",https://nypost.com/2025/09/18/media/sinclair-demands-jimmy-kimmel-apologize-to-charlie-kirks-family/
94,2025-09-18-17-43-09 +0000,nyt,Trump Administration Stopping Efforts to Collect Scientific Data,https://www.nytimes.com/2025/09/18/climate/trump-federal-data-climate-change-health.html
94,2025-09-18-20-11-49 +0000,nyt,Warner Accuses Trump Administration of Undermining National Security,https://www.nytimes.com/2025/09/18/us/politics/mark-warner-national-security-warning.html
94,2025-09-18-18-49-00 +0000,wsj,Judge Stops Trump Administration From Deporting Guatemalan Children,https://www.wsj.com/us-news/law/trump-guatemala-children-deportation-blocked-621e63a2
92,2025-09-18-17-09-08 +0000,bbc,Key takeaways from Trump-Starmer news conference,https://www.bbc.com/news/articles/cre5nylyzd4o?at_medium=RSS&at_campaign=rss
92,2025-09-18-14-02-44 +0000,nyt,Trump Administration Reinstates More Difficult Citizenship Test,https://www.nytimes.com/2025/09/18/world/europe/us-citizenship-test.html
92,2025-09-18-21-14-17 +0000,nyt,"At U.K. Leader’s Country House, Trump’s State Visit Gets a Little More Political",https://www.nytimes.com/2025/09/17/world/europe/trump-uk-state-visit-photos.html
92,2025-09-19-08-54-11 +0000,nyt,How Xi Is Using a TikTok Tradeoff to Court Trump,https://www.nytimes.com/2025/09/19/world/asia/tiktok-xi-trump-china.html
91,2025-09-19-08-16-06 +0000,bbc,Minister rejects Trump's call for military to tackle illegal migration,https://www.bbc.com/news/articles/c04qre9l0v3o?at_medium=RSS&at_campaign=rss
91,2025-09-19-04-45-26 +0000,nyt,"Trump Pressures Broadcasters Over Critical Coverage, Escalating Attack on Speech",https://www.nytimes.com/2025/09/18/us/politics/trump-fcc-licenses.html
91,2025-09-18-16-40-49 +0000,nyt,The Trump Administration Is Dismantling Climate Policies,https://www.nytimes.com/2025/09/18/us/trump-climate-denial-banquet-kimmel.html
90,2025-09-18-16-34-00 +0000,wsj,"Trump, Starmer Paper Over Cracks Amid Royal Pageantry",https://www.wsj.com/world/uk/donald-trump-keir-starmer-uk-trip-8e56bcd7
90,2025-09-18-18-38-12 +0000,nyt,Democrats Pitch Bill to Protect Speech Targeted by Trump,https://www.nytimes.com/2025/09/18/us/politics/democrats-free-speech-bill-trump.html
90,2025-09-19-03-54-51 +0000,bbc,Trump says he didn't want London Mayor Sadiq Khan at state banquet,https://www.bbc.com/news/articles/cwyl01x9pllo?at_medium=RSS&at_campaign=rss
90,2025-09-19-08-21-16 +0000,bbc,Trump says TV networks opposed to him should 'maybe' lose licence,https://www.bbc.com/news/articles/cr4qe0rz2zvo?at_medium=RSS&at_campaign=rss
89,2025-09-18-20-03-56 +0000,latimes,"News Analysis: Trump, showered by British royalty, airs political grievances overseas",https://www.latimes.com/politics/story/2025-09-18/trump-regaled-by-royalty-brings-u-s-politics-overseas
89,2025-09-19-04-00-23 +0000,nyt,Trump and Xi Set to Finalize TikTok Deal,https://www.nytimes.com/2025/09/19/business/media/trump-and-xi-set-to-finalize-tiktok-deal.html
89,2025-09-18-16-36-57 +0000,bbc,'Was it worth it?' - BBC correspondents assess Trump's state visit,https://www.bbc.com/news/videos/ckgq6e9dqw1o?at_medium=RSS&at_campaign=rss
89,2025-09-18-23-00-35 +0000,nyt,Trump Has Threatened Broadcast Licenses. Here’s How They Work.,https://www.nytimes.com/2025/09/18/us/politics/trump-broadcast-licenses-fcc.html
89,2025-09-19-08-17-46 +0000,nyt,Taliban Rebuffs Trump’s Effort to Regain Air Base in Afghanistan,https://www.nytimes.com/2025/09/19/world/asia/trump-bagram-taliban.html
87,2025-09-19-08-02-42 +0000,wsj,Stock Market Today: Dow Futures Waver; Xi-Trump Call Expected,https://www.wsj.com/livecoverage/stock-market-today-dow-sp-500-nasdaq-09-19-2025?mod=rss_markets_main
87,2025-09-18-20-25-01 +0000,nyt,Trump and Starmer Acknowledge Divide Over Palestinian Statehood,https://www.nytimes.com/live/2025/09/18/world/trump-uk-visit
86,2025-09-18-10-10-00 +0000,latimes,Calmes: What came of Trump's Putin summit? Nothing good,https://www.latimes.com/opinion/story/2025-09-18/la-oe-calmes-russia
85,2025-09-18-17-29-39 +0000,bbc,What is Antifa and why is President Trump targeting it?,https://www.bbc.com/news/articles/ced5gqn0p6jo?at_medium=RSS&at_campaign=rss
85,2025-09-18-10-04-14 +0000,bbc,Trump clashes with Australian journalist over business deals in office,https://www.bbc.com/news/articles/c9qn0zzqxvxo?at_medium=RSS&at_campaign=rss
85,2025-09-18-20-12-00 +0000,nyt,Tiffany Trump’s Family Cruised the Mediterranean on an Oil Mogul's Yacht,https://www.nytimes.com/2025/09/18/world/europe/tiffany-trump-yacht-oil.html
85,2025-09-19-01-42-23 +0000,nyt,"Trump and Starmer, Skirting Differences, Praise Each Other in U.K.",https://www.nytimes.com/2025/09/18/world/europe/trump-starmer-britain.html
85,2025-09-18-14-31-16 +0000,nypost,Here’s the real reason ABC has suspended ‘Jimmy Kimmel Live!’,https://nypost.com/2025/09/18/media/heres-the-real-reason-abc-suspended-jimmy-kimmel-live/
85,2025-09-18-21-09-44 +0000,nyt,"Behind Castle Walls, the Rich and Powerful Celebrate Trump",https://www.nytimes.com/2025/09/17/world/europe/trump-uk-state-visit-banquet-royals.html
85,2025-09-19-01-56-12 +0000,bbc,Brendan Carr's emboldened FCC takes on Trump's media foes,https://www.bbc.com/news/articles/c4g921p3eq3o?at_medium=RSS&at_campaign=rss
84,2025-09-18-09-00-59 +0000,nyt,How Tiffany Trump’s Instagram Posts Led Us to an Oil Magnate’s Megayacht,https://www.nytimes.com/2025/09/18/world/europe/tiffany-trumps-instagram-posts-oil-billionaire.html
84,2025-09-19-03-34-27 +0000,latimes,Federal judge is 'inclined' to order Trump to restore $500 million in UCLA research grants,https://www.latimes.com/world-nation/story/2025-09-18/ucla-nih-grants-federal-judge-500-million
83,2025-09-18-17-57-10 +0000,nypost,ABC insiders rip network over ‘stupid’ Jimmy Kimmel monologue that led to suspension: ‘Should have known better’,https://nypost.com/2025/09/18/media/abc-insiders-rip-network-over-stupid-jimmy-kimmel-monologue-that-led-to-suspension/
83,2025-09-18-10-00-00 +0000,latimes,California isn't backing down on offshore wind power despite Trump cancellation,https://www.latimes.com/environment/story/2025-09-18/despite-federal-setbacks-california-is-staying-the-course-on-offshore-wind
83,2025-09-18-12-50-04 +0000,nyt,Diplomatic Coup or Abject Groveling? U.K. Debates Trump’s Royal Welcome,https://www.nytimes.com/2025/09/18/world/europe/uk-debates-trump-royal-welcome.html
83,2025-09-18-15-53-00 +0000,wsj,Disney Pulls Jimmy Kimmel’s Show After Kirk Remarks,https://www.wsj.com/business/media/disney-to-pull-jimmy-kimmels-show-after-kirk-remarks-47b4b400?mod=pls_whats_news_us_business_f
81,2025-09-18-10-49-38 +0000,nyt,U.K. to Formally Recognize Palestinian Statehood After Trump Departs,https://www.nytimes.com/2025/09/18/world/europe/uk-formally-recognize-palestinian-statehood.html
80,2025-09-19-01-55-13 +0000,latimes,"Protesters pack Hollywood over 'Jimmy Kimmel Live!' suspension, calling for an end to censorship",https://www.latimes.com/california/story/2025-09-18/protestors-flood-hollywood-over-kimmel-suspension
80,2025-09-18-17-43-48 +0000,bbc,Morgan reveals more reasons for Trump banquet refusal,https://www.bbc.com/news/articles/cy8rkd21m57o?at_medium=RSS&at_campaign=rss
80,2025-09-19-04-46-43 +0000,nyt,"Flattery and Flourish for Trump. For His U.K. Hosts, Relief at Avoiding Strife.",https://www.nytimes.com/2025/09/19/world/europe/trump-king-charles-keir-starmer.html
76,2025-09-18-12-27-41 +0000,nyt,The Business Decision Behind Taking Jimmy Kimmel Off Air,https://www.nytimes.com/2025/09/18/business/dealbook/kimmel-disney-abc.html
72,2025-09-18-22-43-00 +0000,wsj,Inside Disney’s Abrupt Decision to Suspend Jimmy Kimmel’s Show,https://www.wsj.com/business/media/jimmy-kimmel-decision-behind-the-scenes-e1ecbbf2?mod=pls_whats_news_us_business_f
70,2025-09-18-20-18-45 +0000,latimes,"Chabria: Wake up, Los Angeles. We are all Jimmy Kimmel",https://www.latimes.com/politics/story/2025-09-18/chabria-wake-up-los-angeles-we-are-all-jimmy-kimmel
68,2025-09-18-20-39-27 +0000,latimes,"Commentary: After Kimmel and Colbert, who's next in the war against free speech? Not Gutfeld",https://www.latimes.com/entertainment-arts/tv/story/2025-09-18/jimmy-kimmel-stephen-colbert-who-is-next-free-speech
65,2025-09-19-03-48-59 +0000,nyt,How Jimmy Kimmel Went From ‘The Man Show’ to MAGA Adversary,https://www.nytimes.com/2025/09/18/arts/television/jimmy-kimmel-host-timeline.html
64,2025-09-19-00-04-35 +0000,nyt,Disney Pulled Jimmy Kimmel as Pressure Built on Multiple Fronts,https://www.nytimes.com/2025/09/18/business/media/disney-abc-jimmy-kimmel.html
61,2025-09-18-22-42-00 +0000,wsj,Charlie Kirk Made Her a Star. Here’s How She Plans to Honor Him.,https://www.wsj.com/style/alex-clark-turning-point-usa-1ceb0b9f
59,2025-09-18-21-39-00 +0000,wsj,"Opinion | The FCC, Disney and Jimmy Kimmel",https://www.wsj.com/opinion/fcc-disney-jimmy-kimmel-brendan-carr-media-regulation-197bdf0a?mod=pls_whats_news_us_business_f
58,2025-09-18-18-45-00 +0000,latimes,Contributor: Jimmy Kimmel and the threat that comedy poses to autocrats,https://www.latimes.com/opinion/story/2025-09-18/jimmy-kimmel-comedy-democracy
58,2025-09-19-00-00-33 +0000,nypost,Billionaire Mets owner Steve Cohen emerges as one of top bidders for new NY casino — here’s who else has the best odds,https://nypost.com/2025/09/18/us-news/billionaire-mets-owner-steve-cohen-emerges-as-one-of-top-bidders-for-new-ny-casino-heres-who-else-has-the-best-odds/
55,2025-09-18-18-17-02 +0000,nypost,Charlie Kirk had ‘break-up’ with Candace Owens after she went ‘too down the rabbit holes’,https://nypost.com/2025/09/18/media/charlie-kirk-had-break-up-with-candace-owens-after-she-went-down-rabbit-holes/
55,2025-09-18-21-38-29 +0000,bbc,Ros Atkins on… What Kimmel's suspension means for free speech in the US,https://www.bbc.com/news/videos/crme42nr8exo?at_medium=RSS&at_campaign=rss
52,2025-09-18-18-59-08 +0000,bbc,"Two shot dead in attack near West Bank-Jordan crossing, Israeli military says",https://www.bbc.com/news/articles/cr5qv0qmgmjo?at_medium=RSS&at_campaign=rss
51,2025-09-18-17-27-43 +0000,nypost,Protests against Macron and new prime minister flood the streets of France,https://nypost.com/2025/09/18/world-news/protesters-against-macron-and-new-prime-minister-flood-the-streets-of-france/
49,2025-09-18-19-04-07 +0000,bbc,First migrant deported to France under 'one in one out' deal,https://www.bbc.com/news/articles/ckg653r06jgo?at_medium=RSS&at_campaign=rss
48,2025-09-18-22-06-01 +0000,latimes,Race to make smart glasses relevant heats up again with new tech from Meta and Snap,https://www.latimes.com/business/story/2025-09-18/meta-ahead-as-smart-glasses-race-heats-up
46,2025-09-18-09-04-02 +0000,nyt,A New Rate-Cut Cycle Could Be Fuel on the Stock Market Fire,https://www.nytimes.com/2025/09/18/business/stocks-fed-rate-cut.html
45,2025-09-18-11-58-35 +0000,cbc,"Internet, phone lines cut off across Gaza as Israeli ground operations expected to escalate",https://www.cbc.ca/news/world/gaza-telecoms-blackout-israeli-army-1.7636933?cmp=rss
45,2025-09-18-09-30-00 +0000,wsj,"Capital Account: Whatever probability you put on recession a few weeks ago, it should be lower now that the Federal Reserve has cut interest rates, the WSJ’s Greg Ip writes",https://www.wsj.com/economy/central-banking/the-fed-rolls-back-recession-risk-4e812cc3
43,2025-09-18-16-17-43 +0000,latimes,Teenager Celeste Rivas went missing a year ago. She was found dead in singer D4vd's Tesla in the Hollywood Hills,https://www.latimes.com/california/story/2025-09-18/teenage-girl-missing-found-dead-singers-tesla
43,2025-09-18-09-30-14 +0000,wapo,"For the first time, Bernie Sanders calls Israel’s war in Gaza a genocide",https://www.washingtonpost.com/politics/2025/09/18/bernie-sanders-gaza-genocide-israel-statement/
42,2025-09-18-11-10-00 +0000,wsj,"The Bank of England left its key interest rate unchanged, but scaled back a program designed to shrink its holdings of government bonds",https://www.wsj.com/economy/central-banking/bank-of-england-leaves-key-rate-on-hold-slows-quantitative-tightening-d760dcb6
42,2025-09-18-12-25-49 +0000,bbc,Facebook owner unveils new AI-powered smart glasses,https://www.bbc.com/news/articles/c5y599yz0l3o?at_medium=RSS&at_campaign=rss
40,2025-09-18-16-55-30 +0000,cbc,"Aid driver kills 2 Israeli military personnel at Jordan border crossing, authorities say",https://www.cbc.ca/news/world/israel-jordan-west-bank-border-crossing-1.7637227?cmp=rss
39,2025-09-18-09-26-01 +0000,bbc,Government to appeal against ruling blocking migrant deportation to France,https://www.bbc.com/news/articles/cj3yrrnydero?at_medium=RSS&at_campaign=rss
39,2025-09-18-18-35-31 +0000,cbc,Canada Post sending new offers to union after ban on flyer deliveries,https://www.cbc.ca/news/business/canada-post-union-new-global-offers-1.7637402?cmp=rss
39,2025-09-18-09-20-05 +0000,nyt,The Hottest New Defense Against Drones? Lasers,https://www.nytimes.com/2025/09/18/world/europe/drones-laser-weapons.html
36,2025-09-18-23-40-56 +0000,wapo,"Nvidia investing $5 billion in Intel, weeks after U.S. government takes stake",https://www.washingtonpost.com/business/2025/09/18/nvidia-intel-stake-chips/
36,2025-09-18-16-22-50 +0000,nypost,AmEx unveils Platinum card updates with new perks — and a whopping $895 fee,https://nypost.com/2025/09/18/business/amex-unveils-platinum-card-updates-with-new-perks-and-a-whopping-895-fee/
36,2025-09-18-13-45-05 +0000,nyt,Syria’s President Says Border Deal With Israel Could Come ‘Within Days’,https://www.nytimes.com/2025/09/18/world/middleeast/syria-israel.html
36,2025-09-18-21-14-58 +0000,nyt,Assailant Kills 2 Israeli Soldiers at West Bank-Jordan Border,https://www.nytimes.com/2025/09/18/world/middleeast/allenby-shooting-jordan-west-bank.html
36,2025-09-18-23-34-01 +0000,bbc,Why France is at risk of becoming the new sick man of Europe,https://www.bbc.com/news/articles/cvg9n6vr2eyo?at_medium=RSS&at_campaign=rss
36,2025-09-18-14-30-37 +0000,bbc,Class resumes at Utah Valley University after Charlie Kirk shooting,https://www.bbc.com/news/videos/c203nweed07o?at_medium=RSS&at_campaign=rss
35,2025-09-19-08-23-40 +0000,bbc,Migrant returned to France after government wins court challenge,https://www.bbc.com/news/articles/cx273vnkjpmo?at_medium=RSS&at_campaign=rss
35,2025-09-18-11-24-26 +0000,bbc,When will UK interest rates fall again?,https://www.bbc.com/news/articles/c3dky111m40o?at_medium=RSS&at_campaign=rss
35,2025-09-18-15-59-54 +0000,nypost,"Meta in talks with Fox Corp, News Corp, Axel Springer over AI content licensing: report",https://nypost.com/2025/09/18/business/meta-in-talks-with-fox-corp-news-corp-over-ai-content-licensing-report/
35,2025-09-18-11-36-29 +0000,nyt,Europe’s far-right and Charlie Kirk,https://www.nytimes.com/2025/09/17/briefing/europes-far-right-charlie-kirk-trump-uk-state-visit.html
35,2025-09-18-09-05-00 +0000,wsj,China Hardens Military Stance Against U.S. With Nuclear Weapons and Tough Talk,https://www.wsj.com/world/china/china-hardens-military-stance-against-u-s-with-nuclear-weapons-and-tough-talk-eca2ae89
35,2025-09-18-14-03-19 +0000,bbc,"UK 'not out of woods' on inflation, says Bank as rates held",https://www.bbc.com/news/articles/cge2q7wvyz3o?at_medium=RSS&at_campaign=rss
34,2025-09-18-12-00-00 +0000,wapo,"Growing number of Americans say U.S. supports Israel too much in Gaza war, poll shows",https://www.washingtonpost.com/world/2025/09/18/israel-gaza-us-support-poll/
