score,pubdate,source,title,link
44,2026-01-31-03-41-22 +0000,wapo,Protesters take to streets nationwide to decry ICE tactics in Minneapolis,https://www.washingtonpost.com/nation/2026/01/30/minneapolis-protests-ice/
44,2026-01-30-11-00-00 +0000,latimes,The shelter said the pit bull was sweet. He mauled his new owner,https://www.latimes.com/california/story/2026-01-30/shelter-said-pit-bull-was-sweet-he-mauled-his-new-owner
43,2026-01-30-20-20-02 +0000,nypost,"Scott Bessent takes X-rated jab at Gavin Newsom: ‘Well, he was mayor of San Francisco’",https://nypost.com/2026/01/30/us-news/treasury-secretary-scott-bessent-jabs-at-at-gavin-newsom-on-ruthless-podcast/
43,2026-01-30-23-26-00 +0000,latimes,Shutdown nears as lawmakers brace for next round of ICE negotiations,https://www.latimes.com/politics/story/2026-01-30/shutdown-senate-ice-negotiations
42,2026-01-30-14-21-00 +0000,wsj,Fed’s Waller Says ‘Weak’ Job Market Supported Rate Cut,https://www.wsj.com/economy/central-banking/feds-waller-says-weak-job-market-supported-rate-cut-00753e08
42,2026-01-31-04-45-59 +0000,nypost,Cardozo’s Ron Naclerio wins 973rd game to set New York state high school basketball record,https://nypost.com/2026/01/30/sports/cardozo-head-coach-ron-naclerio-wins-973rd-game-to-set-new-york-record/
42,2026-01-30-22-59-56 +0000,startribune,Minnesota law professors call arrests of journalists for documenting church protest an attack on free press,https://www.startribune.com/minnesota-law-professors-call-arrests-of-journalists-for-documenting-church-protest-an-attack-on-free-press/601574250
41,2026-01-30-16-02-21 +0000,nypost,"Lefty radicals storm Jewish temple and hurl obscenities, mock LI Dem Rep. Suozzi over his vote to boost ICE funding",https://nypost.com/2026/01/30/us-news/lefties-storm-jewish-temple-to-mock-li-rep-suozzi-over-ice/
41,2026-01-31-00-05-16 +0000,nypost,Senate passes $1.2 trillion spending bill — but partial government shutdown still takes effect,https://nypost.com/2026/01/30/us-news/senate-passes-1-2-trillion-spending-bill-but-partial-shutdown-appears-inevitable/
40,2026-01-30-14-15-15 +0000,latimes,Arrest of ex-CNN anchor Don Lemon in Beverly Hills raises 1st Amendment concerns,https://www.latimes.com/california/story/2026-01-30/don-lemon-arrest-los-angeles
40,2026-01-30-18-36-50 +0000,nyt,Federal Authorities Mapped Out Epstein’s Inner Circle,https://www.nytimes.com/2026/01/30/us/epstein-inner-circle.html
40,2026-01-31-02-47-36 +0000,nyt,Police Report Backs Activist’s Account in Clash With ICE Agent Near Chicago,https://www.nytimes.com/2026/01/30/us/ice-agent-assault-charge.html
39,2026-01-31-00-15-10 +0000,nyt,Epstein Notes Suggested Bill Gates Engaged in Extramarital Sex,https://www.nytimes.com/2026/01/30/us/bill-gates-epstein.html
39,2026-01-30-15-10-22 +0000,wapo,What video shows about Don Lemon’s activities at the church protest,https://www.washingtonpost.com/investigations/2026/01/23/don-lemon-minneapolis/
39,2026-01-31-02-53-40 +0000,nyt,ICE Expands Power of Agents to Arrest People Without Warrants,https://www.nytimes.com/2026/01/30/us/politics/ice-expands-power-agents-warrants.html
39,2026-01-30-20-05-50 +0000,nyt,Commerce Secretary Howard Lutnick Planned Trip to Epstein’s Island,https://www.nytimes.com/2026/01/30/us/howard-lutnick-epstein-island.html
39,2026-01-30-13-50-53 +0000,nyt,Syrian Government and Kurdish-Led Militia Seal a Deal to Merge Forces,https://www.nytimes.com/2026/01/30/world/middleeast/syria-kurd-sdf-agreement.html
39,2026-01-31-02-09-00 +0000,wsj,Don Lemon Arrested Over Church Protest,https://www.wsj.com/us-news/law/don-lemon-arrested-over-church-protest-942333ee
38,2026-01-30-18-00-00 +0000,missionlocal,"Sunset Buzz: 32-year-old cafe closes, night market returns, and theft at farmers’ market",https://missionlocal.org/2026/01/sf-sunset-buzz-squat-and-gobble/
38,2026-01-30-11-00-00 +0000,latimes,"Trust in ICE plummets, even when agents target serious criminals",https://www.latimes.com/california/story/2026-01-30/ice-finds-targeting-violent-criminals-increasingly-fraught-in-backlash-over-indiscriminate-sweeps
38,2026-01-30-16-05-32 +0000,cbc,"Prosecutors can't seek death penalty against Luigi Mangione, judge rules",https://www.cbc.ca/news/world/luigi-mangione-death-penalty-9.7068139?cmp=rss
37,2026-01-30-11-00-00 +0000,latimes,West Coast monarch butterfly populations hit historic low. This may be the 'new normal',https://www.latimes.com/environment/story/2026-01-30/monarch-butterfly-populations-at-historic-lows-across-west-coast-new-normal
37,2026-01-31-00-36-39 +0000,nypost,Hochul peeved by Mamdani’s ‘tax the rich’ demands as he claims NYC faces $12B budget hole: ‘Fabricated crisis’,https://nypost.com/2026/01/30/us-news/hochul-peeved-by-mamdanis-tax-the-rich-demands-as-he-claims-nyc-faces-12b-budget-hole/
37,2026-01-30-17-55-36 +0000,nyt,Epstein Documents Include Many Uncorroborated Tips,https://www.nytimes.com/2026/01/30/us/epstein-documents-uncorroborated-tips.html
37,2026-01-30-22-20-00 +0000,wsj,Verizon Posts Strong Subscriber Gains Under New CEO,https://www.wsj.com/business/telecom/verizon-vz-q4-earnings-report-2025-70b537de?mod=pls_whats_news_us_business_f
37,2026-01-30-18-32-00 +0000,wsj,Federal Judge Rules Out Death Penalty for Luigi Mangione,https://www.wsj.com/us-news/law/luigi-mangione-death-penalty-decision-b9279d24
37,2026-01-30-23-23-07 +0000,nyt,"Florida Universities Partnered With ICE, Stoking Anxiety Among Students",https://www.nytimes.com/2026/01/30/us/florida-universities-ice-cooperation.html
37,2026-01-30-14-00-00 +0000,wsj,The High Price You Pay to Get on Board Hot Companies Before They Go Public,https://www.wsj.com/finance/investing/the-high-price-you-pay-to-get-on-board-hot-companies-before-they-go-public-392353b9?mod=rss_markets_main
36,2026-01-31-02-31-23 +0000,latimes,Ex-Google engineer convicted of stealing AI trade secrets to benefit China,https://www.latimes.com/california/story/2026-01-30/ex-google-engineer-convicted-of-stealing-ai-trade-secrets-for-china
36,2026-01-31-03-16-39 +0000,nypost,Macaulay Culkin seen for first time since death of ‘Home Alone’ mom Catherine O’Hara,https://nypost.com/2026/01/30/us-news/macaulay-culkin-seen-for-first-time-since-death-of-home-alone-mom-catherine-ohara/
36,2026-01-30-12-42-37 +0000,bbc,Syrian government reaches deal with Kurdish-led forces,https://www.bbc.com/news/articles/cz0pj0n0yk3o?at_medium=RSS&at_campaign=rss
36,2026-01-31-06-09-39 +0000,bbc,'A vaccine against murder'? Israel split over return of death penalty,https://www.bbc.com/news/articles/clymp8v7ye2o?at_medium=RSS&at_campaign=rss
34,2026-01-30-10-03-38 +0000,nyt,International Companies Doing Business With ICE Are Taking Heat,https://www.nytimes.com/2026/01/30/world/americas/ice-immigration-enforcement-international-scrutiny-business.html
34,2026-01-30-12-58-53 +0000,cbc,Israel says Gaza's Rafah crossing with Egypt will reopen on Sunday,https://www.cbc.ca/news/world/israel-gaza-egypt-crossing-rafah-9.7067818?cmp=rss
33,2026-01-30-19-37-00 +0000,wsj,"Sen. Warren Seeks Warsh’s Position on Criminal Probes of Powell, Cook, Letter Says",https://www.wsj.com/politics/policy/sen-warren-seeks-warshs-position-on-criminal-probes-of-powell-cook-letter-says-3eb09809
33,2026-01-30-19-46-15 +0000,wapo,"ICE buys warehouses for mass detention network, rattling locals",https://www.washingtonpost.com/investigations/2026/01/30/ice-warehouse-detention-dhs-immigration/
33,2026-01-30-19-12-17 +0000,bbc,Labour peer who had sanctions lifted by China says it's 'meagre return' for UK,https://www.bbc.com/news/articles/c70lg4jr0xlo?at_medium=RSS&at_campaign=rss
32,2026-01-31-04-00-56 +0000,latimes,"Planned Parenthood, reproductive healthcare could receive $90 million in new state funding",https://www.latimes.com/california/story/2026-01-30/planned-parenthood-reproductive-healthcare-could-receive-90-million-in-new-state-funding
31,2026-01-31-02-00-00 +0000,wsj,Shifting views on the president’s immigration agenda threaten to turn one of his signature issues into a liability for Republicans in the coming midterm elections,https://www.wsj.com/politics/elections/the-trump-supporters-who-say-he-went-too-far-on-immigration-b03b2c56
31,2026-01-30-12-25-00 +0000,wsj,"Yen Rally Wasn’t Government-Engineered, Finance Ministry Data Show",https://www.wsj.com/finance/currencies/yen-rally-wasnt-government-engineered-finance-ministry-data-show-17365393
31,2026-01-30-19-24-59 +0000,nyt,Panamanian Court Strikes Down Hong Kong Firm’s Canal Contract,https://www.nytimes.com/2026/01/30/business/panama-canal-ck-hutchison.html
31,2026-01-30-20-58-00 +0000,wsj,"Opinion | Virginians Will Pay, and Keep Paying, for ‘Affordable’ Energy",https://www.wsj.com/opinion/virginians-will-pay-through-the-nose-for-affordable-energy-3f729161
31,2026-01-30-15-04-46 +0000,nypost,Wall Street traders show their hands with bets on Warner Bros. Discovery-Netflix deal,https://nypost.com/2026/01/30/media/wall-street-traders-show-hands-with-bets-on-warner-bros-discovery-netflix-deal/
31,2026-01-30-23-54-13 +0000,nyt,What to Know About the ‘Abortion Clinic’ Law Being Used to Charge Don Lemon,https://www.nytimes.com/2026/01/30/us/politics/face-act-lemon-explainer.html
31,2026-01-31-00-19-00 +0000,bbc,One wrong move and it could all go wrong - the men clearing deadly undersea Russian mines,https://www.bbc.com/news/articles/c70lgwprw7ko?at_medium=RSS&at_campaign=rss
30,2026-01-30-14-14-36 +0000,bbc,'We hope it's not the end': Firm behind Prince George's baby shoes warns it may close,https://www.bbc.com/news/articles/c78eyv1zdl3o?at_medium=RSS&at_campaign=rss
30,2026-01-30-20-30-36 +0000,nyt,How Did This Beloved Rock From Canada End Up in California?,https://www.nytimes.com/2026/01/30/us/missing-rock-portable-british-columbia-canada.html
30,2026-01-30-18-59-00 +0000,wsj,Fed’s Musalem Rejects Further Rate Cuts,https://www.wsj.com/economy/central-banking/feds-musalem-rejects-further-rate-cuts-6611cff8
30,2026-01-30-23-49-35 +0000,nyt,Macaulay Culkin And Others Pay Tribute to Catherine O’Hara After Her Death,https://www.nytimes.com/2026/01/30/arts/catherine-ohara-death-reactions.html
29,2026-01-30-14-44-39 +0000,nypost,Starbucks chief now gets to use the company jet for personal trips for free — and other CEOs are likely to demand the same perk,https://nypost.com/2026/01/30/business/starbucks-chief-now-gets-company-jet-for-personal-trips/
29,2026-01-30-16-18-36 +0000,nyt,"Who Is Georgia Fort, the Other Journalist Arrested Over a Church Protest?",https://www.nytimes.com/2026/01/30/us/who-is-georgia-fort-journalist-arrested-church-protest.html
29,2026-01-30-20-20-51 +0000,nyt,Children Were Arrested in Iran’s Brutal Crackdown on Protests,https://www.nytimes.com/2026/01/30/world/middleeast/iran-protests-children-arrested.html
29,2026-01-30-20-42-40 +0000,latimes,Border inspector finds protected birds in man's pants. Here's how he tried to explain it,https://www.latimes.com/california/story/2026-01-30/border-inspector-finds-birds-in-pants-of-man-how-did-he-explain-it
29,2026-01-31-05-10-27 +0000,bbc,US government partially shuts down despite last minute funding deal,https://www.bbc.com/news/articles/ce8rk33dpvmo?at_medium=RSS&at_campaign=rss
28,2026-01-30-10-22-47 +0000,bbc,Worried families in India urge return of crew on ship seized by Iran,https://www.bbc.com/news/articles/cdrenj55gdvo?at_medium=RSS&at_campaign=rss
28,2026-01-31-07-47-58 +0000,bbc,Ukrainians brace for -20C despite energy truce: 'It will be a catastrophe',https://www.bbc.com/news/articles/c75xg17rr1xo?at_medium=RSS&at_campaign=rss
28,2026-01-30-19-02-00 +0000,bbc,This tiny Australian town is up for sale - but the locals don't want to leave,https://www.bbc.com/news/articles/c3wz49z6gyyo?at_medium=RSS&at_campaign=rss
28,2026-01-30-12-00-00 +0000,wsj,The End of the Model S Is the Start of a New Tesla,https://www.wsj.com/business/autos/the-end-of-the-model-s-is-the-start-of-a-new-tesla-379cb74e?mod=pls_whats_news_us_business_f
28,2026-01-30-11-00-00 +0000,latimes,Law firm's contract hiked to nearly $7.5 million in L.A. homelessness case,https://www.latimes.com/california/story/2026-01-30/law-firms-contract-hiked-to-nearly-7-5-million-in-la-homelessness-case
28,2026-01-30-13-16-05 +0000,bbc,Panama voids Hong Kong-based firm's canal port contracts,https://www.bbc.com/news/articles/c338ygzl7meo?at_medium=RSS&at_campaign=rss
28,2026-01-31-02-58-19 +0000,nypost,‘Humble’ city councilman accused of steering $950k in public cash to wife’s firm — and putting her health insurance on taxpayer dime,https://nypost.com/2026/01/30/us-news/los-angeles-city-councilman-accused-of-steering-950k-in-public-cash-to-wifes-firm/
28,2026-01-30-23-07-08 +0000,nyt,Escape to Alcatraz: Coyote Swims a Mile in Search of New Turf,https://www.nytimes.com/2026/01/30/us/coyote-swims-alcatraz-san-francisco.html
28,2026-01-31-02-32-02 +0000,nypost,"Embattled Labor Secretary Lori Chavez-DeRemer’s old congressional office was hit with a $100,000 workplace discrimination claim",https://nypost.com/2026/01/30/us-news/labor-secretary-lori-chavez-deremers-old-congressional-office-was-hit-with-100k-workplace-discrimination-claim/
27,2026-01-30-22-58-00 +0000,wsj,Fed’s Bowman Says Policy Still Restrictive,https://www.wsj.com/economy/central-banking/feds-bowman-says-policy-still-restrictive-c0c53443
27,2026-01-30-16-54-30 +0000,nypost,White House celebrates Don Lemon’s arrest in X post,https://nypost.com/2026/01/30/us-news/white-house-celebrates-don-lemons-arrest-in-x-post/
27,2026-01-30-19-34-17 +0000,latimes,"Loose cannabis is like spilled beer, not open container in car, state Supreme Court rules",https://www.latimes.com/california/story/2026-01-30/cannabis-open-container-california-state-supreme-court-ruling
27,2026-01-30-21-38-44 +0000,bbc,Chris Mason: What Starmer's China reset tells us about his foreign policy,https://www.bbc.com/news/articles/c3r10n94jxro?at_medium=RSS&at_campaign=rss
27,2026-01-30-18-04-00 +0000,wsj,Uber Eats Ordered to Pay $3.5 Million Over NYC Delivery Worker Pay,https://www.wsj.com/business/uber-eats-ordered-to-pay-3-5-million-over-nyc-delivery-worker-pay-295908cb?mod=pls_whats_news_us_business_f
27,2026-01-31-07-38-26 +0000,nypost,Coast Guard searching for survivors after commercial fishing boat sinks off Massachusetts; 1 body recovered,https://nypost.com/2026/01/31/us-news/massachusetts-coast-guard-searching-for-survivors-after-commercial-fishing-boat-sinks/
27,2026-01-30-22-55-54 +0000,nypost,"Former Google software engineer convicted of AI espionage, trade secret theft",https://nypost.com/2026/01/30/business/former-google-software-engineer-convicted-of-ai-espionage-trade-secret-theft/
27,2026-01-30-22-31-27 +0000,bbc,"Labubu to open seven UK shops, after PM's China visit",https://www.bbc.com/news/articles/cgm4kyw482eo?at_medium=RSS&at_campaign=rss
27,2026-01-30-10-39-58 +0000,bbc,Syria's Kurds sense US betrayal as government forces push them back,https://www.bbc.com/news/articles/cvgrzd76p4lo?at_medium=RSS&at_campaign=rss
27,2026-01-31-03-18-46 +0000,latimes,Mistrial declared in trial of man accused of killing off-duty Monterey Park officer,https://www.latimes.com/california/story/2026-01-30/mistrial-declared-in-trial-of-man-accused-of-killing-off-duty-monterey-park-officer
26,2026-01-30-14-00-00 +0000,wsj,‘Nothing Random’ Review: He Was His Own Bestseller,https://www.wsj.com/arts-culture/books/nothing-random-review-he-was-his-own-best-seller-85422459?mod=pls_whats_news_us_business_f
26,2026-01-30-19-11-23 +0000,bbc,"Three reasons for the record rise in gold prices, and one why they are falling",https://www.bbc.com/news/articles/c87r2700dq8o?at_medium=RSS&at_campaign=rss
26,2026-01-30-19-41-55 +0000,nyt,"In a Bid to Kick-Start Growth, Britain Turns to China",https://www.nytimes.com/2026/01/30/business/uk-china-trade-business-starmer-xi.html
26,2026-01-31-07-24-40 +0000,nypost,Skeletal remains ID’d as 19-year-old Florida man reported missing nearly a decade ago,https://nypost.com/2026/01/31/us-news/florida-skeletal-remains-idd-as-jacob-lyon-nearly-a-decade-after-disappearance/
26,2026-01-30-10-25-56 +0000,bbc,"Scotland's first deputy first minister Lord Wallace dies, aged 71",https://www.bbc.com/news/articles/cx2l3dy0llro?at_medium=RSS&at_campaign=rss
26,2026-01-30-21-19-20 +0000,latimes,"'National shutdown' brings protests to L.A., across the nation; demonstrators clash with police",https://www.latimes.com/california/story/2026-01-30/national-shutdown-brings-protests-to-l-a-across-nation-calling-for-end-of-ice-violence
25,2026-01-30-15-50-27 +0000,nypost,Israel set to reopen Rafah Crossing under cease-fire agreement,https://nypost.com/2026/01/30/world-news/israel-to-reopen-rafah-crossing-under-ceasefire-framework/
25,2026-01-30-15-40-00 +0000,wsj,Poland’s Economy Set to Enter Global Top 20 Following Another Strong Year,https://www.wsj.com/world/europe/polands-economy-set-to-enter-global-top-20-following-another-strong-year-beea3a49
25,2026-01-30-16-43-36 +0000,nypost,DOJ Civil Rights Division is investigating Alex Pretti killing,https://nypost.com/2026/01/30/us-news/doj-civil-rights-division-is-investigating-alex-pretti-killing/
25,2026-01-31-06-14-17 +0000,wapo,U.S. approves almost $16 billion in arms sales to Israel and Saudi Arabia,https://www.washingtonpost.com/world/2026/01/30/us-israel-arms-sales-saudi-arabia/
25,2026-01-30-10-02-41 +0000,nyt,"For Some Americans, the End of Obamacare Subsidies Means Falling Off a Financial Cliff",https://www.nytimes.com/2026/01/30/upshot/obamacare-subsidies-financial-cliff.html
25,2026-01-30-20-24-36 +0000,startribune,"Border Patrol agent is arrested, accused of drunken driving in Twin Cities",https://www.startribune.com/federal-border-patrol-agent-is-arrested-accused-of-drunken-driving-in-twin-cities/601574032
25,2026-01-31-03-26-16 +0000,nyt,Justice Dept. Opens Civil Rights Inquiry Into Killing of Alex Pretti,https://www.nytimes.com/2026/01/30/us/politics/justice-dept-civil-rights-pretti.html
25,2026-01-31-02-51-00 +0000,wsj,"U.S. Approves $15.7 Billion in Potential Arms Sales for Saudi Arabia, Israel",https://www.wsj.com/politics/national-security/u-s-approves-15-7-billion-in-potential-arms-sales-for-saudi-arabia-israel-cffae615
24,2026-01-30-21-55-18 +0000,nypost,Katie Porter sends desperate text threat as Dem rival Matt Mahan enters governor’s race,https://nypost.com/2026/01/30/us-news/katie-porter-sends-desperate-text-as-matt-mahan-enters-governors-race/
24,2026-01-31-04-49-49 +0000,nypost,NYPD on hunt for sicko accused of raping 14-year-old girl in Manhattan building,https://nypost.com/2026/01/30/us-news/nypd-on-hunt-for-sicko-accused-of-raping-14-year-old-girl-in-nyc/
24,2026-01-31-02-00-00 +0000,wsj,How America First Risks Becoming America Alone,https://www.wsj.com/world/how-america-first-risks-becoming-america-alone-6592701a
24,2026-01-30-21-49-00 +0000,wsj,"Catherine O’Hara, One of Hollywood’s Most Beloved Comedic Actresses, Has Died at 71",https://www.wsj.com/arts-culture/television/catherine-o-hara-dies-actress-74b8505d
24,2026-01-30-17-17-36 +0000,nypost,Wells Fargo hikes CEO Charlie Scharf’s pay to $40M in 2025 — up from $31.2M,https://nypost.com/2026/01/30/business/wells-fargo-hikes-ceo-charlie-scharfs-pay-to-40m-in-2025/
24,2026-01-30-11-42-00 +0000,wsj,"Swatch Shares Jump After Return to Sales Growth, Upbeat Guidance",https://www.wsj.com/business/earnings/swatch-posts-2025-revenue-decline-despite-second-half-sales-recovery-42c8583e?mod=pls_whats_news_us_business_f
24,2026-01-30-20-25-00 +0000,wsj,Oil Posts Weekly Gains on U.S.-Iran Tensions,https://www.wsj.com/finance/commodities-futures/oil-prices-mixed-lingering-u-s-iran-tensions-may-support-397d3f64?mod=rss_markets_main
24,2026-01-31-01-39-57 +0000,nyt,6 Missing as Search Continues for Boat Off the Coast of Massachusetts,https://www.nytimes.com/2026/01/30/us/fishing-boat-missing-massachusetts.html
23,2026-01-30-13-19-30 +0000,bbc,"Government has duty to help pass assisted dying bill, says Leadbeater",https://www.bbc.com/news/articles/c17zy7jvxrgo?at_medium=RSS&at_campaign=rss
23,2026-01-30-17-14-40 +0000,startribune,Natural gas prices more than 15 times higher than expected due to frigid weather,https://www.startribune.com/natural-gas-prices-spiked-more-than-500-due-to-frigid-weather/601573359
23,2026-01-30-16-08-00 +0000,wsj,Shake-Up Elevates U.A.E. Crown Prince Into $260 Billion Sovereign Wealth Role,https://www.wsj.com/world/middle-east/shake-up-elevates-u-a-e-crown-prince-into-260-billion-sovereign-wealth-role-7a665fa0
23,2026-01-31-01-30-06 +0000,bbc,Schitt's Creek and Home Alone star Catherine O'Hara dies aged 71,https://www.bbc.com/news/articles/czr4jn4621lo?at_medium=RSS&at_campaign=rss
22,2026-01-30-11-58-00 +0000,wsj,Feeling dizzy? You might have a case of “Washington Whiplash.” Read more in today’s WSJ Politics Newsletter:,https://www.wsj.com/politics/policy/another-crisis-another-offramp-and-washington-chugs-along-382fa812
22,2026-01-30-12-00-00 +0000,missionlocal,S.F. opened a health clinic to tackle pollution in Bayview-Hunters Point — a long time coming,https://missionlocal.org/2026/01/sf-bayview-environmental-health-clinic/
22,2026-01-30-14-00-06 +0000,nyt,Your ‘Safe’ Stock Funds May Be Riskier Than You Think,https://www.nytimes.com/2026/01/30/business/stock-market-concentration-risk.html
22,2026-01-30-16-30-00 +0000,wsj,Canada GDP Remains Soft in Final Months of Last Year,https://www.wsj.com/economy/central-banking/canada-gdp-remains-soft-in-final-months-of-last-year-11fd9178
22,2026-01-30-16-43-27 +0000,wapo,"As D.C. faces snow woes, here’s how cities around the world plow ahead",https://www.washingtonpost.com/world/2026/01/30/washington-dc-snow-removal-japan-finland/
22,2026-01-30-19-05-51 +0000,nypost,DNI Tulsi Gabbard takes leading role on 2020 election fraud investigation,https://nypost.com/2026/01/30/us-news/dni-tulsi-gabbard-takes-leading-role-on-2020-election-fraud-investigation/
22,2026-01-30-20-30-12 +0000,nypost,Matt Mahan records huge surge in support California governor run,https://nypost.com/2026/01/30/us-news/san-jose-mayor-matt-mahan-surges-in-betting-odds-for-california-governor/
22,2026-01-30-10-17-00 +0000,wsj,Bosch Expects Market Challenges to Remain This Year,https://www.wsj.com/business/earnings/bosch-expects-market-challenges-to-remain-this-year-eaf62396?mod=pls_whats_news_us_business_f
22,2026-01-31-05-01-00 +0000,wsj,Q&A: How does a partial government shutdown work?,https://www.wsj.com/politics/policy/what-to-expect-in-a-partial-government-shutdown-d5f7a7b6
22,2026-01-30-21-39-57 +0000,bbc,A bomb cyclone will hit parts of the US - what is it?,https://www.bbc.com/news/videos/ce8elylj744o?at_medium=RSS&at_campaign=rss
22,2026-01-30-19-34-02 +0000,startribune,Twin Cities tiny homes on the market for budget-conscious buyers,https://www.startribune.com/tiny-home-condo-twin-cities-minnesota-small-house-affordable-budget-rental-for-sale-on-market-listed/601573090
22,2026-01-31-07-06-44 +0000,bbc,Canada's Poilievre re-elected Conservative party leader,https://www.bbc.com/news/articles/c14r1023yy6o?at_medium=RSS&at_campaign=rss
22,2026-01-30-11-04-11 +0000,bbc,Why Iran's response to a US attack could be different this time,https://www.bbc.com/news/articles/cn9z497g4vvo?at_medium=RSS&at_campaign=rss
22,2026-01-30-11-18-33 +0000,bbc,Millions to get £150 off energy bills for further five years,https://www.bbc.com/news/articles/cedw468e50wo?at_medium=RSS&at_campaign=rss
22,2026-01-31-04-34-35 +0000,startribune,St. Paul Police Department denies data requests about confrontation with protesters,https://www.startribune.com/st-paul-police-ice-protest-body-camera-chemicals-data-request-denied-investigation/601574402
22,2026-01-31-04-00-00 +0000,wsj,Why China Cares About Being Cool All of a Sudden,https://www.wsj.com/world/china/labubu-youtube-influencers-gen-z-7271596a
21,2026-01-30-22-25-53 +0000,nypost,Barneys scion Gene Pressman accused of vengefully smearing ex-exec in ‘score-settling’ book,https://nypost.com/2026/01/30/business/barneys-scion-gene-pressman-accused-of-smearing-ex-exec-in-score-settling-book/
21,2026-01-30-20-37-00 +0000,wsj,Why a Ruling Over CK Hutchison’s Panama Canal Ports Matters—and What’s Next,https://www.wsj.com/business/logistics/why-a-ruling-over-ck-hutchisons-panama-canal-ports-mattersand-whats-next-a2f09720
21,2026-01-30-20-04-40 +0000,nyt,California Crypto Billionaires Plan to Spend Tens of Millions on Moderate Candidates,https://www.nytimes.com/2026/01/30/us/politics/crypto-billionaires-try-to-build-a-moderate-counterforce-in-california-politics.html
21,2026-01-30-11-13-00 +0000,wsj,LG Electronics Reports First Net Loss in a Year,https://www.wsj.com/business/earnings/lg-electronics-reports-first-quarterly-net-loss-in-a-year-784ddcc8?mod=pls_whats_news_us_business_f
21,2026-01-31-02-23-48 +0000,bbc,Phone lines stay open as tax return deadline looms,https://www.bbc.com/news/articles/cwy10ye2030o?at_medium=RSS&at_campaign=rss
21,2026-01-30-12-46-27 +0000,nyt,"Born of a Factory Mistake, This Sad Toy Horse Captures China’s Mood",https://www.nytimes.com/2026/01/30/world/asia/crying-horse-toy-china.html
21,2026-01-30-19-23-45 +0000,bbc,Civil rights investigation opened into Alex Pretti shooting,https://www.bbc.com/news/articles/c5yvw89p3p1o?at_medium=RSS&at_campaign=rss
21,2026-01-31-01-05-03 +0000,nyt,Bruce Springsteen Takes the Stage as Minneapolis Residents Take to the Streets,https://www.nytimes.com/2026/01/30/us/minneapolis-ice-protests-bruce-springsteen-concert.html
21,2026-01-30-11-00-00 +0000,latimes,Dream of owning a flying car? This California company is already selling them,https://www.latimes.com/business/story/2026-01-30/dream-of-owning-flying-car-this-california-company-is-already-selling-them
