score,pubdate,source,title,link
11,2025-07-22-18-52-00 +0000,world,Food Aid Becomes Main Sticking Point in Gaza Cease-Fire Talks,https://www.wsj.com/world/middle-east/food-aid-becomes-main-sticking-point-in-gaza-cease-fire-talks-18f2c614
10,2025-07-22-01-00-00 +0000,world,How China Curbed Its Oil Addiction—and Blunted a U.S. Pressure Point,https://www.wsj.com/world/china/china-oil-demand-lower-b5ae15ed
9,2025-07-22-10-35-00 +0000,world,A Populist Party That Began on YouTube Helped Disrupt Japan’s Ruling Coalition,https://www.wsj.com/world/asia/a-populist-party-that-began-on-youtube-helped-disrupt-japans-ruling-coalition-361c4e58
9,2025-07-22-10-04-00 +0000,world,China’s Xi Gives Up Air Miles for More Time at Home,https://www.wsj.com/world/china/chinas-xi-gives-up-air-miles-for-more-time-at-home-42e6876f
8,2025-07-22-14-59-00 +0000,world,"U.K. Government Will Stick to Budget Rules, Treasury Chief Says",https://www.wsj.com/world/uk/u-k-government-will-stick-to-budget-rules-treasury-chief-says-386b7325
8,2025-07-22-03-00-00 +0000,world,"On Ukraine’s Front Line, a Sky Full of Killer Robots",https://www.wsj.com/world/ukraine-russia-drone-war-adef7e49
8,2025-07-22-10-51-00 +0000,world,U.S. Says Government Employee Blocked from Leaving China,https://www.wsj.com/world/china/u-s-says-government-employee-blocked-from-leaving-china-e196e312
7,2025-07-22-15-22-00 +0000,world,Ukraine Moves to Defang U.S.-Backed Anticorruption Agency,https://www.wsj.com/world/europe/ukraine-moves-to-defang-u-s-backed-anticorruption-agency-fbe7efe4
3,2025-07-21-21-41-00 +0000,world,Opinion | The Fallout From Syria’s Massacres,https://www.wsj.com/opinion/syria-sweida-massacres-druze-ahmed-al-sharaa-tom-barrack-e8190077
