score,pubdate,source,title,link
12,2026-04-03-20-57-49 +0000,latimes,"Springs fire: Evacuations, road closures, shelters",https://www.latimes.com/california/story/2026-04-03/springs-fire-evacuations-road-closures-shelters
12,2026-04-03-19-12-52 +0000,nypost,"Inside the Stablecoin stampede, as mainstream financial giants rush to cash in on the crypto coin",https://nypost.com/2026/04/03/business/mainstream-financial-giants-rush-to-cash-in-on-stablecoins/
12,2026-04-03-09-01-39 +0000,nyt,Skilled Foreign Workers Think About Leaving the U.S.,https://www.nytimes.com/video/business/100000010736378/h-1b-visa-program-trump-workers.html
12,2026-04-03-15-49-49 +0000,nyt,Why Is the Labor Market Stuck?,https://www.nytimes.com/video/business/100000010815978/why-is-the-labor-market-stuck.html
12,2026-04-03-14-59-02 +0000,nyt,"Cuba Says It Is Pardoning More Than 2,000 Prisoners",https://www.nytimes.com/2026/04/02/world/americas/cuba-prisoner-release.html
11,2026-04-03-11-00-01 +0000,startribune,Life Time’s embrace of ‘athletic country club’ approach is working,https://www.startribune.com/life-time-athletic-country-clubs-growth-higher-end-k-shaped-economy/601634290
11,2026-04-03-09-30-00 +0000,wsj,Harvard’s Push to Cap ‘A’ Grades Has Students Howling in Protest,https://www.wsj.com/us-news/education/harvard-grade-cap-a-proposal-gpa-7c921630
11,2026-04-03-15-42-10 +0000,nyt,Tesla Sales Rise as $4-a-Gallon Gas Revives Interest in E.V.s,https://www.nytimes.com/2026/04/02/business/tesla-sales-electric-vehicles.html
11,2026-04-03-09-43-00 +0000,wsj,U.S. Repatriates Chinese Drug Fugitive in a Sign of Stabilizing Ties,https://www.wsj.com/world/u-s-repatriates-chinese-drug-fugitive-in-a-sign-of-stabilizing-ties-96c9b899
11,2026-04-03-20-43-33 +0000,bbc,"Russia chose 'Easter escalation' over ceasefire, says Zelensky",https://www.bbc.com/news/articles/cew70wjvv9do?at_medium=RSS&at_campaign=rss
11,2026-04-03-16-47-27 +0000,startribune,Second of back-to-back storms poised to blanket northern Minn. with hefty snowfall; warnings issued,https://www.startribune.com/second-of-back-to-back-storms-poised-to-blanket-northern-minn-with-hefty-snowfall-warnings-issued/601659961
11,2026-04-03-16-54-35 +0000,bbc,"Rapper Gucci Mane kidnapped and robbed by fellow artist, prosecutors say",https://www.bbc.com/news/articles/c937kezj03vo?at_medium=RSS&at_campaign=rss
11,2026-04-03-20-45-54 +0000,latimes,"$500,000 in stolen catalytic converters seized in L.A. County theft ring bust",https://www.latimes.com/california/story/2026-04-03/1-800-stolen-catalytic-converters-seized-in-massive-bust
11,2026-04-03-20-37-04 +0000,nypost,"Illegal immigrant, accomplice get 5 years for murder in plea deal with progressive Virginia DA",https://nypost.com/2026/04/03/us-news/illegal-immigrant-accomplice-get-5-years-for-murder-in-plea-deal-with-progressive-virginia-da/
11,2026-04-03-13-12-04 +0000,nyt,"Biruté Galdikas, Champion of Endangered Orangutans, Dies at 79",https://www.nytimes.com/2026/04/02/science/earth/birute-galdikas-dead.html
11,2026-04-03-09-45-51 +0000,nypost,"Russia unleashes relentless wave of drone strikes on Ukraine, Kyiv says",https://nypost.com/2026/04/03/world-news/russia-unleashing-rolling-aerial-attack-on-ukraine-kyiv-says/
10,2026-04-03-04-05-00 +0000,wsj,Private-Equity Fundraising Falls to Slowest Pace in a Decade,https://www.wsj.com/pro/private-equity/private-equity-fundraising-falls-to-slowest-pace-in-a-decade-3b4cc8fd?mod=rss_markets_main
10,2026-04-03-20-42-56 +0000,bbc,How elite US teams tackle combat rescue missions,https://www.bbc.com/news/articles/c0le43jw8e9o?at_medium=RSS&at_campaign=rss
10,2026-04-03-21-58-10 +0000,nyt,Hershey’s Promises to Use Only Real Chocolate After Backlash,https://www.nytimes.com/2026/04/02/business/hershey-reeses-recipe-real-chocolate.html
10,2026-04-04-00-17-20 +0000,bbc,'We want a voice in our land' - the people evicted to build Nigeria's capital,https://www.bbc.com/news/articles/clyggr00x5vo?at_medium=RSS&at_campaign=rss
10,2026-04-03-09-00-55 +0000,nyt,How Democrats Are Embracing Dark Money,https://www.nytimes.com/2026/04/03/us/politics/dark-money-nonprofits-explainer.html
10,2026-04-03-17-45-55 +0000,nyt,Could There Be a Popular Uprising in Cuba?,https://www.nytimes.com/2026/04/03/world/americas/cuba-opposition-uprising.html
10,2026-04-03-22-30-20 +0000,nypost,Second thug accused of gunning down 7-month-old in horror NYC drive-by shooting nabbed,https://nypost.com/2026/04/03/us-news/second-thug-accused-of-gunning-down-7-month-old-in-horror-nyc-drive-by-shooting-nabbed/
9,2026-04-03-14-45-00 +0000,wsj,Opinion | Speed Bumps on the Road to Self-Driving Cars,https://www.wsj.com/opinion/speed-bumps-on-the-road-to-self-driving-cars-231e8756?mod=pls_whats_news_us_business_f
9,2026-04-03-20-56-30 +0000,startribune,Lynx lose Bridget Carleton and Maria Kliundikova in WNBA expansion draft,https://www.startribune.com/lynx-lose-bridget-carleton-and-maria-kliundikova-in-wnba-expansion-draft/601637776
9,2026-04-03-10-00-00 +0000,wsj,An Agent for ‘Bachelor’ Stars Has Thoughts for Taylor Frankie Paul’s Unaired Suitors,https://www.wsj.com/cmo-today/an-agent-for-bachelor-stars-has-thoughts-for-taylor-frankie-pauls-unaired-suitors-65cefc28?mod=pls_whats_news_us_business_f
8,2026-04-03-11-52-50 +0000,bbc,"Who is Christopher LaNeve, set to lead the US Army?",https://www.bbc.com/news/articles/clye2e85dwjo?at_medium=RSS&at_campaign=rss
8,2026-04-03-23-05-49 +0000,nyt,Here’s the latest.,https://www.nytimes.com/live/2026/04/03/world/iran-war-trump-oil/heres-the-latest
8,2026-04-03-15-49-00 +0000,wsj,A Grubhub Founder Wants to Change Your Flat Tire Now,https://www.wsj.com/business/hospitality/a-grubhub-founder-wants-to-change-your-flat-tire-now-ecf5b896?mod=pls_whats_news_us_business_f
8,2026-04-03-16-02-40 +0000,48hills,Brian McDonald’s waggish works key into an overstimulated world,https://48hills.org/2026/04/brian-mcdonalds-waggish-works-key-into-an-overstimulated-world/
8,2026-04-04-00-09-54 +0000,bbc,How Bombay went from a fort city to a bustling metropolis,https://www.bbc.com/news/articles/cj60k3x879ro?at_medium=RSS&at_campaign=rss
8,2026-04-04-00-33-21 +0000,startribune,HCMC administrator resigned over ‘micromanagement’ by Hennepin County commissioners,https://www.startribune.com/hcmc-administrator-resigned-over-micromanagement-by-hennepin-county-commissioners/601660133
8,2026-04-03-21-13-17 +0000,bbc,M&S boss calls for more action on crime and abuse of staff,https://www.bbc.com/news/articles/crk16j2j1ygo?at_medium=RSS&at_campaign=rss
8,2026-04-03-21-22-00 +0000,wsj,The WSJ Dollar Index Falls 0.15% This Week to 96.90,https://www.wsj.com/finance/currencies/asian-currencies-consolidate-as-traders-eye-middle-east-developments-d8f98279?mod=rss_markets_main
8,2026-04-03-17-56-00 +0000,wsj,Opinion | The ‘AI Detector’ as Defamation Machine,https://www.wsj.com/opinion/the-ai-detector-as-defamation-machine-8ba298f0?mod=pls_whats_news_us_business_f
8,2026-04-03-16-36-00 +0000,wsj,Best Business Debt Consolidation Loans in April 2026,https://www.wsj.com/buyside/personal-finance/business-loans/business-debt-consolidation-loans?mod=pls_whats_news_us_business_f
8,2026-04-03-13-28-59 +0000,nyt,Danish Warship Sunk by Britain’s Lord Nelson 225 Years Ago Is Found,https://www.nytimes.com/2026/04/02/world/europe/danish-warship-britain-nelson-copenhagen.html
8,2026-04-03-23-04-24 +0000,bbc,"After 16 years in power, can Viktor Orban finally be unseated?",https://www.bbc.com/news/articles/czd7y1n3jyjo?at_medium=RSS&at_campaign=rss
7,2026-04-03-04-38-08 +0000,nyt,The Race for the Future of the Moon,https://www.nytimes.com/2026/04/02/world/space-artemis-us-china-trump-iran-pam-bondi.html
7,2026-04-03-12-10-13 +0000,nyt,The Revival of the Fashion-Tech Love Affair,https://www.nytimes.com/2026/04/02/style/meta-lab-smartglasses-wearables.html
7,2026-04-03-20-50-08 +0000,missionlocal,Mission Buzz: Los Coyotes rides again,https://missionlocal.org/2026/04/mission-buzz-los-coyotes-rides-again/
7,2026-04-03-21-55-33 +0000,nyt,The F-15E Strike Eagle: What to Know,https://www.nytimes.com/2026/04/03/world/middleeast/f15e-strike-eagle.html
7,2026-04-03-20-58-14 +0000,missionlocal,S.F. D2 supervisor candidates knock on doors hoping for different answers,https://missionlocal.org/2026/04/sf-district-2-sherrill-brooke-canvassing/
6,2026-04-03-06-37-01 +0000,bbc,Researchers spent years interviewing 160 Bigfoot hunters - this is what they learnt,https://www.bbc.com/news/articles/cvg58ydn4jpo?at_medium=RSS&at_campaign=rss
6,2026-04-03-13-04-44 +0000,bbc,Italy and Gattuso 'mutually terminate' contract,https://www.bbc.com/sport/football/articles/cevk0mn93ejo?at_medium=RSS&at_campaign=rss
6,2026-04-03-16-22-45 +0000,bbc,US deports eight people 'of African origin' to Uganda,https://www.bbc.com/news/articles/c8ej43z8yw4o?at_medium=RSS&at_campaign=rss
6,2026-04-03-09-30-00 +0000,wsj,A Guide to the Gulf’s Trillions of Dollars of Sovereign Wealth,https://www.wsj.com/finance/a-guide-to-the-gulfs-trillions-of-dollars-of-sovereign-wealth-c17b505e
6,2026-04-03-12-20-28 +0000,bbc,France's Muslim gathering ban overturned by courts,https://www.bbc.com/news/articles/cwyjekvwww0o?at_medium=RSS&at_campaign=rss
6,2026-04-03-14-45-00 +0000,wsj,Opinion | The Blue State Exodus Enriches Red States,https://www.wsj.com/opinion/the-blue-state-exodus-enriches-red-states-618d5c74?mod=pls_whats_news_us_business_f
5,2026-04-03-21-19-00 +0000,wsj,Opinion | The Russian People Want the Internet Back,https://www.wsj.com/opinion/the-russian-people-want-the-internet-back-0667c2d3
5,2026-04-03-21-41-00 +0000,wsj,Opinion | Paring the Government Payroll,https://www.wsj.com/opinion/jobs-report-government-payroll-trump-administration-df2bec90
3,2026-04-03-21-42-00 +0000,wsj,Opinion | The ObamaCare Crisis That Isn’t,https://www.wsj.com/opinion/obamacare-enrollment-premiums-cms-pandemic-subsidies-10466983
3,2026-04-03-10-00-00 +0000,wsj,The Retailer That Welcomes Returns,https://www.wsj.com/cfo-journal/the-retailer-that-welcomes-returns-be378ed0?mod=pls_whats_news_us_business_f
1,2026-04-03-13-00-00 +0000,missionlocal,Remnants,https://missionlocal.org/2026/04/remnants/
