score,pubdate,source,title,link
144,2026-06-10-20-07-00 +0000,nyt,Oil Rises on Trump’s Iran Threats and New Strikes Across Middle East,https://www.nytimes.com/2026/06/10/business/oil-stocks-gas-prices-iran.html
140,2026-06-11-16-14-42 +0000,nyt,Iran War Live Updates: U.S.-Iran Strikes Risk Dangerous New Phase,https://www.nytimes.com/live/2026/06/11/world/iran-war-trump-us-israel
134,2026-06-10-19-31-00 +0000,wsj,"Consumer prices continued to rise quickly in May, as the run-up in energy costs from the war with Iran pushed up overall inflation",https://www.wsj.com/economy/cpi-inflation-report-may-2026-60db25fe
134,2026-06-10-21-48-11 +0000,nyt,Trump Shrugs Off High Prices Amid Iran War and Says ‘I Love the Inflation’,https://www.nytimes.com/2026/06/10/business/economy/trump-inflation-iran-war.html
131,2026-06-11-14-58-13 +0000,nyt,Oil Prices Fluctuate as Trump Issues New Threat to Strike Iran,https://www.nytimes.com/2026/06/10/business/oil-gas-price-iran.html
123,2026-06-10-23-14-53 +0000,wapo,"U.S. launches new strikes on Iran, hours after Trump issued warning",https://www.washingtonpost.com/world/2026/06/10/trump-threatens-iran-after-it-targets-us-assets-middle-east/
120,2026-06-11-12-46-03 +0000,nypost,"Trump says US ‘will be taking Kharg Island’ oil export hub, vows to hit Iran ‘very hard tonight’",https://nypost.com/2026/06/11/us-news/trump-says-us-will-be-taking-kharg-island-oil-export-hub-vows-to-hit-iran-very-hard-tonight/
118,2026-06-10-21-48-54 +0000,nypost,Trump warns Iran to make a deal or ‘we’ll bomb the s–t out of them tomorrow’ after latest strikes,https://nypost.com/2026/06/10/us-news/us-launches-new-strikes-on-multiple-targets-in-iran-centcom-says/
116,2026-06-10-21-36-00 +0000,wsj,Trump Says U.S. Will Launch New Attacks on Iran,https://www.wsj.com/world/middle-east/trump-warns-of-ramping-up-attacks-on-iran-after-exchange-of-strikes-ae2f7a67
116,2026-06-10-20-08-47 +0000,latimes,"Fresh strikes, surging inflation signal new phase of Iran war",https://www.latimes.com/politics/story/2026-06-10/fresh-strikes-surging-inflation-signal-new-phase-of-iran-war
111,2026-06-11-13-46-46 +0000,wapo,"Trump vows to hit Iran ‘very hard tonight,’ take over Kharg Island and oil industry",https://www.washingtonpost.com/world/2026/06/11/iran-targets-five-us-bases-raising-fears-return-all-out-war/
110,2026-06-11-13-30-00 +0000,wapo,"Iran war is the worst hit to the global economy since covid, World Bank says",https://www.washingtonpost.com/business/2026/06/11/world-bank-says-iran-war-is-worst-hit-global-economy-since-covid/
105,2026-06-10-21-47-00 +0000,wsj,Opinion | Trump Needs a New Iran Strategy,https://www.wsj.com/opinion/donald-trump-iran-middle-east-israel-strait-of-hormuz-a4e249ca
102,2026-06-11-15-47-00 +0000,wsj,"Trump Says U.S. Will Hit Iran Tonight, Threatens Seizure of Energy Markets",https://www.wsj.com/world/middle-east/trump-threatens-new-strikes-on-iran-says-u-s-will-seize-its-oil-and-gas-markets-38996e77
100,2026-06-10-18-24-42 +0000,nypost,Family of Long Island jeweler imprisoned in Iran urgently pleads with Trump for his release: ‘Every day matters’,https://nypost.com/2026/06/10/us-news/family-of-li-jeweler-imprisoned-in-iran-urgently-pleads-with-trump-for-his-release-every-day-matters/
98,2026-06-11-13-30-04 +0000,nyt,World Bank Warns Iran War Is Slowing Global Growth,https://www.nytimes.com/2026/06/11/business/economy/globa-economy-iran-war.html
96,2026-06-10-20-52-39 +0000,nyt,Trump’s ‘Secret Mission’ to Ferry Oil Past Iran Was Widely Disclosed,https://www.nytimes.com/2026/06/10/world/middleeast/trump-oil-iran-strait-hormuz.html
95,2026-06-11-09-00-00 +0000,wapo,New Fed chief may soon be forced to defy Trump and raise interest rates,https://www.washingtonpost.com/business/2026/06/11/kevin-warsh-early-test-will-new-fed-chief-defy-trump-raise-rates/
95,2026-06-10-16-32-58 +0000,wapo,"Inflation heats up to highest pace in three years, fueled by Iran war",https://www.washingtonpost.com/business/2026/06/10/inflation-hits-42-percent-first-time-three-years/
94,2026-06-10-21-16-42 +0000,nypost,Trump says US wants ‘right people’ entering the country as visa controversies dog World Cup,https://nypost.com/2026/06/10/us-news/trump-says-us-wants-right-people-entering-the-country-as-visa-controversies-dog-world-cup/
92,2026-06-10-18-53-56 +0000,nyt,"Trump Officials Say ICE Won’t Raid World Cup Games, but Fans Are Worried",https://www.nytimes.com/2026/06/10/us/world-cup-ice-immigration-enforcement.html
91,2026-06-10-22-33-58 +0000,nyt,"U.S. Strikes Iran for Second Day, as War Heats Back Up",https://www.nytimes.com/2026/06/10/world/middleeast/us-iran-strikes.html
87,2026-06-11-10-50-00 +0000,wsj,"The U.S. and Iran stumbled back into war, exchanging strikes for the second day in a row. Read more in today’s WSJ Politics Newsletter:",https://www.wsj.com/politics/policy/the-u-s-and-iran-stumble-back-into-war-ab024831
87,2026-06-11-11-01-47 +0000,nypost,Iran targets Gulf nations with missiles after Trump claimed Tehran asked him to stop US airstrikes,https://nypost.com/2026/06/11/world-news/iran-targets-gulf-nations-with-missiles-after-trump-claimed-tehran-asked-him-to-stop-us-airstrikes/
84,2026-06-11-14-40-00 +0000,wsj,"The House rejected Trump-backed FISA spying bill, putting key surveillance program at risk of first lapse in nearly 20 years",https://www.wsj.com/politics/policy/showdown-between-trump-and-congress-sinks-spying-bill-1dae3df8
81,2026-06-11-09-14-13 +0000,bbc,Trump says 'I love the inflation' as US prices rise at fastest rate in three years,https://www.bbc.com/news/articles/c0myzxjkw99o?at_medium=RSS&at_campaign=rss
81,2026-06-11-08-36-52 +0000,wsj,"Stock Market Today: Stocks Rise as Investors Shrug Off Iran Tensions, Oracle Earnings",https://www.wsj.com/livecoverage/stock-market-today-dow-sp-500-nasdaq-06-11-2026?mod=rss_markets_main
78,2026-06-10-19-31-12 +0000,latimes,L.A. is hosting free World Cup watch parties at county and city parks. Here's where to find them,https://www.latimes.com/california/story/2026-06-10/la-has-free-world-cup-watch-parties-heres-where-to-find-them
75,2026-06-10-21-18-56 +0000,nyt,"Drinking Water Facilities Hit by Strikes in Iran, State Media Reports",https://www.nytimes.com/2026/06/10/world/middleeast/drinking-water-facilities-hit-by-strikes-in-iran-state-media-reports.html
74,2026-06-10-22-02-34 +0000,nyt,FISA Surveillance Law May Expire After Trump Picks Bill Pulte for Intel Post,https://www.nytimes.com/2026/06/10/us/politics/trump-bill-pulte-spy-law.html
73,2026-06-11-12-09-44 +0000,bbc,US and Iran exchange strikes across Middle East for second day in a row,https://www.bbc.com/news/articles/c4gyp9v0e93o?at_medium=RSS&at_campaign=rss
73,2026-06-11-09-04-26 +0000,nyt,Why Mexico’s President Will Not Attend the World Cup Opening Match,https://www.nytimes.com/2026/06/11/world/americas/mexico-president-sheinbaum-world-cup.html
72,2026-06-10-21-37-13 +0000,nyt,Maine Senate Race Heats Up as Trump Attacks Platner,https://www.nytimes.com/2026/06/10/us/politics/maine-senate-graham-platner-susan-collins.html
72,2026-06-11-13-43-00 +0000,wsj,"Global Economy Could Slow to Half Its 2025 Pace if War Continues, Warns World Bank",https://www.wsj.com/economy/global/global-economy-could-slow-to-half-its-2025-pace-if-war-continues-warns-world-bank-603e7190
71,2026-06-10-21-45-36 +0000,nyt,Trump Says He’s ‘Not Looking to Renew’ Canada-Mexico Trade Deal,https://www.nytimes.com/2026/06/10/world/canada/trump-canada-mexico-trade-deal-usmca.html
70,2026-06-10-20-59-00 +0000,wsj,New Middle East Clashes and Inflation Fears Spark Dow’s Worst Day of 2026,https://www.wsj.com/finance/stocks/global-stocks-markets-dow-news-06-10-2026-c106c317?mod=rss_markets_main
69,2026-06-11-14-24-58 +0000,bbc,Artan to referee Uefa Super Cup after losing World Cup spot,https://www.bbc.com/sport/football/articles/c2kyx0l0499o?at_medium=RSS&at_campaign=rss
68,2026-06-11-14-14-48 +0000,nyt,Trump and Hegseth Broadcast U.S. Military Strikes Before They Happen,https://www.nytimes.com/2026/06/11/us/politics/trump-hegseth-military-operations.html
67,2026-06-11-13-48-00 +0000,wsj,"Stocks Rise as Investors Shrug Off Iran Tensions, Oracle Earnings",https://www.wsj.com/finance/oil-falls-despite-fresh-u-s-military-action-on-iran-u-s-futures-rise-94547df5?mod=rss_markets_main
67,2026-06-10-21-03-00 +0000,wsj,President Trump called on Congress to pass a short-term extension of a federal surveillance program that is set to expire at the end of the week,https://www.wsj.com/politics/policy/trump-calls-for-short-term-extension-of-surveillance-program-76de11fb
67,2026-06-11-14-26-08 +0000,nyt,"The latest U.S. strikes targeted Iran’s ability to control the Strait of Hormuz, an official says.",https://www.nytimes.com/live/2026/06/11/world/iran-war-trump-us-israel/the-latest-us-strikes-targeted-irans-ability-to-control-the-strait-of-hormuz-an-official-says
67,2026-06-11-13-49-58 +0000,nyt,Protests Threaten to Disrupt Mexico City’s World Cup Opening Ceremony,https://www.nytimes.com/2026/06/11/world/americas/world-cup-mexico-city-protests.html
67,2026-06-11-05-25-00 +0000,wsj,Oil Prices Rise as U.S.-Iran Tensions Escalate,https://www.wsj.com/finance/oil-prices-rise-as-u-s-iran-tensions-escalate-09538415
65,2026-06-11-15-22-04 +0000,nypost,"New York may have lost up to $666M in unemployment insurance, Republican senators say",https://nypost.com/2026/06/11/us-news/new-york-may-have-mislaid-up-to-666m-in-unemployment-insurance-republican-senators-say/
65,2026-06-11-15-15-44 +0000,nyt,Can the U.S.-Iran Cease-Fire Survive Days of Strikes?,https://www.nytimes.com/2026/06/11/world/middleeast/iran-us-war-strikes-ceasefire.html
65,2026-06-11-08-08-57 +0000,bbc,A sneak peek inside Mexico’s iconic Azteca Stadium before World Cup kickoff,https://www.bbc.com/news/videos/cvgekz5q06po?at_medium=RSS&at_campaign=rss
64,2026-06-11-15-13-33 +0000,nyt,"This Is Mexico and Canada’s World Cup, Too. Don’t Expect Unity.",https://www.nytimes.com/2026/06/11/world/americas/world-cup-fractured-north-america.html
64,2026-06-11-14-13-22 +0000,nypost,Trump admin yanks funding from LA homeless agency amid explosive fraud probe: ‘Necessary step’,https://nypost.com/2026/06/11/us-news/trump-admin-yanks-funding-from-la-homeless-agency-amid-fraud-probe/
63,2026-06-11-15-31-00 +0000,wsj,Oil Futures Mixed As Market Ponders Trump Threats,https://www.wsj.com/finance/commodities-futures/oil-rises-amid-escalating-supply-disruption-fears-46560652?mod=rss_markets_main
63,2026-06-11-13-46-42 +0000,nyt,The War in Ukraine Has Now Gone On Longer Than World War I,https://www.nytimes.com/2026/06/11/world/europe/ukraine-russia-world-war-i.html
63,2026-06-11-11-58-14 +0000,bbc,Knicks fans go wild as New York team makes biggest comeback in NBA Finals history,https://www.bbc.com/news/articles/cr47lyzr4q9o?at_medium=RSS&at_campaign=rss
62,2026-06-11-03-00-00 +0000,wsj,China Is Propping Up the World Economy by Importing a Lot Less Oil,https://www.wsj.com/business/energy-oil/china-is-propping-up-the-world-economy-by-importing-a-lot-less-oil-f12d7813?mod=pls_whats_news_us_business_f
62,2026-06-10-16-25-57 +0000,nyt,Trump-Backed Air Force Veteran Wins Republican House Primary in Nevada,https://www.nytimes.com/2026/06/10/us/politics/flippo-trump-nevada-republicans-house.html
61,2026-06-10-16-28-03 +0000,nypost,Meta and Google denied new trial after landmark verdict in youth social media addiction case,https://nypost.com/2026/06/10/business/meta-google-denied-new-trial-in-youth-social-media-addiction-case/
61,2026-06-11-02-00-00 +0000,wsj,World Cup Puts Mexico’s Cartel Crisis on the Global Stage,https://www.wsj.com/world/americas/world-cup-puts-mexicos-cartel-crisis-on-the-global-stage-c1933554
61,2026-06-11-14-58-00 +0000,wsj,The ECB became the first major central bank to raise rates to tackle a war-driven resurgence in inflation,https://www.wsj.com/economy/central-banking/ecb-becomes-first-major-central-bank-to-raise-rates-since-inflation-resurgence-1c083b0a
61,2026-06-11-14-35-18 +0000,nypost,Staggering new video shows Eaton Fire igniting — before quickly exploding into massive inferno,https://nypost.com/2026/06/11/us-news/staggering-new-video-shows-eaton-fire-igniting-before-quickly-exploding-into-massive-inferno/
60,2026-06-11-15-48-30 +0000,nypost,‘Airport hustling scammers’ are on the loose — NYC’s Port Authority warns ahead of World Cup,https://nypost.com/2026/06/11/lifestyle/world-cup-tourists-in-nyc-warned-about-airport-hustling-scammers/
59,2026-06-11-02-16-55 +0000,nyt,"No, There Was Not a Snake Invasion at the Swiss Team’s World Cup Training Facility",https://www.nytimes.com/2026/06/10/us/switzerland-world-cup-snakes-san-diego.html
59,2026-06-11-13-01-00 +0000,wsj,India Says U.S. Strike on Tanker in Iran Blockade Killed Three Nationals,https://www.wsj.com/world/india-says-u-s-strike-on-tanker-in-iran-blockade-killed-three-nationals-1c323b12
58,2026-06-10-22-16-32 +0000,latimes,California sues Trump administration over planned ICE facility near Gilroy,https://www.latimes.com/california/story/2026-06-10/california-sues-trump-administration-over-planned-ice-facility-near-gilroy
58,2026-06-11-09-05-11 +0000,nyt,"In a Trump-Endorsed Presidential Candidate, Colombia’s Women See a Familiar Far-Right Playbook",https://www.nytimes.com/2026/06/11/us/abelardo-de-la-espriella-right-wing-colombia-women.html
58,2026-06-11-10-52-00 +0000,wsj,U.S. Trades Fire With Iran for Second Day in Bid to ‘Negotiate With Bombs’,https://www.wsj.com/world/middle-east/u-s-launches-fresh-wave-of-strikes-against-iran-2a23d87b
57,2026-06-11-11-00-01 +0000,startribune,Who’s hosting World Cup watch parties in the Twin Cities?,https://www.startribune.com/whos-hosting-world-cup-watch-parties-in-the-twin-cities/601854868
57,2026-06-11-01-10-15 +0000,nypost,Trump nixed Mamdani’s planned meeting with leftist Colombia prez who tweeted ‘Heil Hitler’: report,https://nypost.com/2026/06/10/world-news/trump-nixed-mamdanis-planned-meeting-with-leftist-colombia-president-gustavo-petro-report/
57,2026-06-10-22-17-28 +0000,nypost,"Jeffrey Epstein panic sparked bizarre WH brainstorming session among Trump advisers, book says",https://nypost.com/2026/06/10/us-news/jeffrey-epstein-panic-sparked-bizarre-brainstorming-session-in-situation-room-book-says/
57,2026-06-10-18-39-31 +0000,bbc,World Cup expected to be the biggest betting event in history,https://www.bbc.com/news/articles/cwydgwdx83yo?at_medium=RSS&at_campaign=rss
56,2026-06-11-15-42-00 +0000,nypost,Lesley Stahl signs new two-year deal to stay at ‘60 Minutes’ after string of firings: report,https://nypost.com/2026/06/11/media/lesley-stahl-signs-new-two-year-deal-to-stay-at-60-minutes-after-string-of-firings-report/
56,2026-06-10-17-05-20 +0000,bbc,Trump: 'I love the inflation',https://www.bbc.com/news/videos/c0rygjggl7zo?at_medium=RSS&at_campaign=rss
56,2026-06-10-23-58-55 +0000,nypost,New York Times reporter downplays accusations against Graham Platner as ‘not like classic abuse allegations’,https://nypost.com/2026/06/10/us-news/new-york-times-reporter-downplays-accusations-against-graham-platner-as-not-like-classic-abuse-allegations/
55,2026-06-11-14-08-00 +0000,wsj,Iran’s Crude Production Slumped in May Under U.S. Blockade,https://www.wsj.com/business/energy-oil/opec-lowers-this-years-oil-demand-forecast-ac8d3f07?mod=pls_whats_news_us_business_f
55,2026-06-11-11-19-51 +0000,nypost,Canada considering social media ban for kids under 16 in global effort to tighten online protections,https://nypost.com/2026/06/11/world-news/canada-considering-social-media-ban-for-kids-under-16-in-global-effort-to-tighten-online-protections/
54,2026-06-11-16-07-07 +0000,nypost,Melania Trump unveils ‘Fostering the Future Accounts’ to help foster children,https://nypost.com/2026/06/11/us-news/melania-trump-unveils-fostering-the-future-accounts-as-part-of-foster-care-initiative/
54,2026-06-10-22-16-16 +0000,nyt,FIFA President Tells World Cup Critics to ‘Chill’ About Concerns,https://www.nytimes.com/2026/06/10/world/europe/fifa-president-world-cup.html
54,2026-06-11-10-00-00 +0000,latimes,"World Cup-related scams: What to know about fake websites, ticket offers and payment requests",https://www.latimes.com/california/story/2026-06-11/world-cup-related-scams-what-you-need-to-know-to-protect-yourself
53,2026-06-11-05-51-06 +0000,bbc,"Messi, Maradona or Pele? Ranking the top 10 World Cup legends",https://www.bbc.com/sport/football/articles/cgl34ne0g3eo?at_medium=RSS&at_campaign=rss
53,2026-06-10-23-54-51 +0000,bbc,Watch: Historic US-Canada border library gets new Quebec-only entrance,https://www.bbc.com/news/videos/clyrvrde160o?at_medium=RSS&at_campaign=rss
53,2026-06-11-15-29-54 +0000,nypost,Wholesale inflation in May hit highest level since November 2022 on soaring energy costs,https://nypost.com/2026/06/11/business/wholesale-inflation-in-may-hit-highest-level-since-november-2022-on-soaring-energy-costs/
52,2026-06-11-16-05-18 +0000,nyt,More Trump Losses in Court and a Federal Judge in Hot Water,https://www.nytimes.com/2026/06/11/us/politics/the-docket-legal-roundup.html
51,2026-06-10-21-15-46 +0000,nyt,Will Trump’s Repairs to Washington D.C.’s Reflecting Pool Work?,https://www.nytimes.com/2026/06/10/us/politics/trump-dc-reflecting-pool-repairs.html
51,2026-06-11-15-45-40 +0000,nyt,Iran’s Attacks on Gulf States Underscore Their Dependence on U.S.,https://www.nytimes.com/2026/06/11/world/middleeast/iran-attacks-kuwait-bahrain-gulf-states.html
51,2026-06-10-23-01-54 +0000,bbc,New candy stores are popping up across NYC. Why?,https://www.bbc.com/news/articles/c30ylzlygngo?at_medium=RSS&at_campaign=rss
51,2026-06-10-21-09-00 +0000,wsj,Bill Gates told Congress that Jeffrey Epstein discovered that he had had affairs during his marriage and tried to leverage that information,https://www.wsj.com/politics/policy/bill-gates-epstein-hearing-house-oversight-committee-3a1b5352
50,2026-06-11-15-23-08 +0000,nyt,Trump Administration Pushes Limits of Election Investigations,https://www.nytimes.com/2026/06/11/us/politics/trump-california-vote-elections-investigations.html
50,2026-06-10-16-27-59 +0000,bbc,Brother's memory inspires Williams for World Cup opener,https://www.bbc.com/sport/football/articles/cx21lpdl4r6o?at_medium=RSS&at_campaign=rss
50,2026-06-11-01-13-52 +0000,nypost,"Trump names ally Brian Johnson to be CFPB’s newest permanent director, awaits Senate confirmation",https://nypost.com/2026/06/10/us-news/trump-names-ally-brian-johnson-to-be-cfpbs-newest-permanent-director/
49,2026-06-10-21-46-43 +0000,wapo,A new wave of anti-immigrant violence hits U.K. as riots convulse Belfast,https://www.washingtonpost.com/world/2026/06/10/belfast-riots-mayhem-follow-alleged-stabbing-by-sudanese-asylum-seeker/
49,2026-06-11-15-33-30 +0000,nypost,California Coastal Commission plots new attack on vital offshore drilling platform,https://nypost.com/2026/06/11/us-news/california-coastal-commission-plots-new-attack-on-santa-barbara-offshore-drilling-platform/
48,2026-06-11-13-52-09 +0000,bbc,"Asylum appeal backlog at record high, new figures show",https://www.bbc.com/news/articles/cwyld5rnw9vo?at_medium=RSS&at_campaign=rss
48,2026-06-10-19-46-20 +0000,nyt,Texas Governor Seeks New Limits on Data Centers,https://www.nytimes.com/2026/06/10/us/texas-abbott-data-centers-regulation.html
48,2026-06-11-16-01-20 +0000,latimes,LA County DA claims four in five cases in $4 billion sex abuse payout may be fraudulent,https://www.latimes.com/california/story/2026-06-11/la-county-da-claims-four-in-five-cases-in-4-billion-sex-abuse-payout-may-be-fraudulent
48,2026-06-11-05-17-25 +0000,nyt,A Very Different World Cup,https://www.nytimes.com/2026/06/10/world/world-cup-mexico-iran-epstein.html
48,2026-06-11-13-53-12 +0000,nyt,Can’t Pay Medical Bills? Trump Administration Suggests Getting a Loan,https://www.nytimes.com/2026/06/11/business/aca-health-care-costs-medical-debt.html
47,2026-06-11-09-00-00 +0000,wsj,Climate Standard Setter SBTi Sets New Rules for Companies Seeking Net Zero,https://www.wsj.com/pro/sustainable-business/climate-standard-setter-sbti-sets-new-rules-for-companies-seeking-net-zero-43a38733?mod=pls_whats_news_us_business_f
47,2026-06-10-17-19-01 +0000,nyt,How Quiet Oman Landed Itself in Trump’s Cross Hairs,https://www.nytimes.com/2026/06/10/world/middleeast/oman-iran-trump-threat.html
47,2026-06-11-00-22-00 +0000,wsj,What to Know About Drone-Boat Maker Behind Iran Helicopter Crew Rescue,https://www.wsj.com/tech/what-to-know-about-drone-boat-maker-behind-iran-helicopter-crew-rescue-aa55d445
46,2026-06-11-15-00-53 +0000,nyt,"Women Who Fled Iran Are to Be Deported to Central African Republic, Lawyers Say",https://www.nytimes.com/2026/06/11/world/africa/deportations-central-african-republic-migrants-iran-women.html
46,2026-06-11-11-00-00 +0000,startribune,Roper: New pocket park could help revive a storied South Side corner,https://www.startribune.com/pocket-park-38th-4th-old-southside-history/601852769
44,2026-06-11-14-59-22 +0000,nypost,High-ranking Russian military official Damir Davydov blown up in car bomb in Moscow,https://nypost.com/2026/06/11/world-news/high-ranking-russian-military-official-blown-up-in-car-bomb-in-moscow/
44,2026-06-11-15-02-34 +0000,bbc,"Four days of extreme rain killed 7% of world's rarest orangutans, study says",https://www.bbc.com/news/articles/ce8jde20v83o?at_medium=RSS&at_campaign=rss
44,2026-06-10-19-48-45 +0000,wapo,"Prices are soaring on these everyday grocery items, driving up inflation",https://www.washingtonpost.com/business/2026/06/10/prices-are-soaring-these-products-driving-up-inflation/
44,2026-06-10-23-56-41 +0000,nyt,Canada Moves to Ban Social Media Use for Youth Under 16,https://www.nytimes.com/2026/06/10/world/canada/social-meda-kids-legislation-carney.html
43,2026-06-10-23-12-52 +0000,bbc,Canada proposes teen social media ban - with workaround for tech firms,https://www.bbc.com/news/articles/c872x47gnyjo?at_medium=RSS&at_campaign=rss
43,2026-06-11-16-04-41 +0000,nyt,Europe Raises Interest Rates as War Stokes Inflation,https://www.nytimes.com/2026/06/11/business/european-central-bank-inflation-interest-rates.html
43,2026-06-10-18-49-06 +0000,latimes,Supporters cheer new L.A. County healthcare sales tax: 'It's a lifesaver',https://www.latimes.com/california/story/2026-06-10/supporters-cheer-new-la-county-measure-er-sales-tax
42,2026-06-11-10-00-00 +0000,latimes,Who will be the new '60 Minutes' correspondents?,https://www.latimes.com/entertainment-arts/business/story/2026-06-11/who-will-take-over-as-next-60-minutes-correspondents
41,2026-06-11-15-29-06 +0000,nypost,Pope Leo visits ‘dock of shame’ in Canary Islands speaking up for migrant rights: ‘Human dignity has no passport’,https://nypost.com/2026/06/11/world-news/pope-leo-visits-dock-of-shame-in-canary-islands-speaks-up-for-migrants-human-dignity-has-no-passport/
41,2026-06-11-14-13-32 +0000,bbc,SpaceX's stock market blast-off could be Musk's biggest gamble yet,https://www.bbc.com/news/articles/cy8d9e4lzv1o?at_medium=RSS&at_campaign=rss
40,2026-06-11-09-30-00 +0000,wsj,"Rent Is So High, New Yorkers Are Living With Nuns",https://www.wsj.com/lifestyle/rent-is-so-high-new-yorkers-are-living-with-nuns-00dac324
39,2026-06-11-10-00-00 +0000,latimes,SpaceX is poised to make history with record $75-billion stock IPO,https://www.latimes.com/business/story/2026-06-11/spacex-is-poised-to-make-history-with-record-75-billion-stock-ipo
39,2026-06-10-21-38-52 +0000,nyt,Investors Feed A.I. Firms’ Voracious Appetite for New Money,https://www.nytimes.com/2026/06/10/business/investors-artificial-intelligence.html
38,2026-06-11-15-00-00 +0000,nypost,First car show since devastating Palisades Fire aims to help bring community back to life,https://nypost.com/2026/06/11/us-news/pacific-palisades-to-host-first-major-car-show-since-devastating-2025-fire/
38,2026-06-10-20-17-00 +0000,wsj,"Stocks Fall on Inflation, War Worries",https://www.wsj.com/finance/stocks/stocks-fall-on-inflation-war-worries-62bc4cb5?mod=rss_markets_main
36,2026-06-11-12-31-26 +0000,bbc,Three Indian sailors killed in US strike on oil tanker,https://www.bbc.com/news/articles/cy73dr081p8o?at_medium=RSS&at_campaign=rss
36,2026-06-10-19-33-41 +0000,nypost,Top Goldman Sachs banker departing after he opposed CEO David Solomon’s support of Epstein-linked lawyer: report,https://nypost.com/2026/06/10/business/top-goldman-banker-opposed-ceo-david-solomons-backing-of-kathy-ruemmler/
36,2026-06-11-13-07-09 +0000,bbc,Will UK interest rates go up?,https://www.bbc.com/news/articles/c3dky111m40o?at_medium=RSS&at_campaign=rss
36,2026-06-11-13-09-00 +0000,wsj,"Treasury Yields, Dollar Rise on War Rhetoric, U.S. Data",https://www.wsj.com/finance/investing/jgb-futures-fall-tracking-declines-in-u-s-treasury-market-c4408466?mod=rss_markets_main
36,2026-06-10-22-56-05 +0000,nyt,Inflation Accelerates to Fastest Pace in 3 Years as Energy Prices Bite,https://www.nytimes.com/2026/06/10/business/economy/inflation-consumer-price-index.html
36,2026-06-10-23-26-59 +0000,nyt,Suspect in the Killing of a Minnesota Lawmaker Strikes a Plea Deal,https://www.nytimes.com/2026/06/10/us/vince-boelter-plea-deal.html
35,2026-06-10-19-00-00 +0000,missionlocal,Excelsior Buzz: a new arcade is on its way to the neighborhood,https://missionlocal.org/2026/06/excelsior-buzz-arcade-quilt-store/
35,2026-06-11-14-54-26 +0000,nypost,White House’s scathing six-word threat to LA as it pulls the plug on city’s largest homeless agency,https://nypost.com/2026/06/11/us-news/white-houses-scathing-six-word-message-to-la-as-it-pulls-the-plug-on-citys-largest-homeless-agency/
35,2026-06-11-00-54-24 +0000,nyt,Britain Is Weighing a Social Media Ban for Children. How Did It Get Here?,https://www.nytimes.com/2026/06/10/world/europe/uk-social-media-ban-under-16.html
