score,pubdate,source,title,link
16,2025-09-19-00-06-37 +0000,nyt,Climate Activists Argue 3 Executive Orders Violate Their Constitutional Rights,https://www.nytimes.com/2025/09/18/climate/lighthiser-trial-climate-trump.html
16,2025-09-19-06-13-06 +0000,nypost,Skipper of NYC boat that burst into flames had no license to operate vessel: prosecutors,https://nypost.com/2025/09/19/us-news/skipper-of-nyc-boat-that-burst-into-flames-hit-had-no-license-to-operate-vessel-prosecutors/
16,2025-09-18-14-43-00 +0000,wsj,U.S. Leading Indicators Continue to Show Weakening Economy,https://www.wsj.com/economy/central-banking/u-s-leading-indicators-continue-to-show-weakening-economy-727296b6
16,2025-09-18-22-20-29 +0000,nyt,West Africans Deported by the U.S. Sue Ghana for Rights Violations,https://www.nytimes.com/2025/09/18/world/africa/us-deportees-sue-ghana.html
15,2025-09-18-20-56-28 +0000,nyt,"In Texas, Parents Fighting Vaccinations Say Their Movement Is Winning",https://www.nytimes.com/2025/09/18/us/politics/vaccine-mandates-covid-measles.html
15,2025-09-18-19-07-33 +0000,cbc,"Eby criticizes Smith's pipeline push, says feds' treatment of B.C. ferry passengers unfair",https://www.cbc.ca/news/politics/eby-smith-carney-pipeline-ferries-1.7637233?cmp=rss
15,2025-09-18-10-00-00 +0000,latimes,Edison details how much it plans to pay Eaton fire victims,https://www.latimes.com/environment/story/2025-09-18/edison-details-how-much-it-plans-to-pay-eaton-fire-victims
15,2025-09-18-15-43-23 +0000,bbc,Free welcome cafe opens to help community connect,https://www.bbc.com/news/articles/c62lgvxp5jxo?at_medium=RSS&at_campaign=rss
15,2025-09-18-21-58-58 +0000,cbc,"Suspected stalker ambushed and killed 3 Pennsylvania officers, prosecutor says",https://www.cbc.ca/news/world/pennsylvania-officers-killed-1.7637624?cmp=rss
14,2025-09-19-05-30-00 +0000,missionlocal,S.F. was supposed to have zero traffic deaths by now. What happened?,https://missionlocal.org/2025/09/s-f-was-supposed-to-have-zero-traffic-deaths-by-now-what-happened/
14,2025-09-18-09-45-00 +0000,nypost,"Solana’s meme coin mania: jackpots, wipeouts, and one wallet to watch",https://nypost.com/business/solana-meme-coins-how-to-buy-best-wallet/
14,2025-09-19-01-10-03 +0000,48hills,"The Engardio recall, Yimby urbanist elitism, and the next step in SF politics",https://48hills.org/2025/09/the-engardio-recall-yimby-urbanist-elitism-and-the-next-step-in-sf-politics/
14,2025-09-18-23-01-16 +0000,startribune,"Vikings’ injury list remains long, but Andrew Van Ginkel is making progress",https://www.startribune.com/minnesota-vikings-injury-report-cincinnati-bengals-nfl-week-3/601477001
14,2025-09-18-15-01-43 +0000,bbc,Burnham refuses to rule out Labour leadership hopes,https://www.bbc.com/news/articles/cvg4nl8mkl7o?at_medium=RSS&at_campaign=rss
14,2025-09-18-21-54-13 +0000,nyt,Where Will Gazans Go?,https://www.nytimes.com/video/world/middleeast/100000010405069/where-will-gazans-go.html
14,2025-09-18-20-48-00 +0000,wsj,Cracker Barrel Targeted With Proxy Fight by Steak ’n Shake Investor,https://www.wsj.com/business/cracker-barrel-targeted-with-proxy-fight-by-steak-n-shake-investor-be8ad543?mod=pls_whats_news_us_business_f
14,2025-09-18-16-14-17 +0000,nyt,How China Is Losing Its Title as the World’s Sneaker Factory,https://www.nytimes.com/2025/09/17/business/vietnam-sneaker-manufacturing-china.html
14,2025-09-18-12-47-09 +0000,nyt,How More Railroads Could Cut Pollution and Lighten Traffic,https://www.nytimes.com/2025/09/18/business/railroads-trucks-shipping.html
14,2025-09-19-02-44-48 +0000,missionlocal,"ACLU sues ICE in S.F. to stop courthouse arrests, ‘inhumane’ detention",https://missionlocal.org/2025/09/sf-aclu-lawsuit-ice-sansome/
14,2025-09-19-02-37-15 +0000,cbc,#TheMoment the final wall came down for a historic tunnel under the Alps,https://www.cbc.ca/player/play/9.6908794?cmp=rss
14,2025-09-18-14-00-00 +0000,wsj,California Wants to Halt Oil Industry Exodus After Years of Climate Focus,https://www.wsj.com/business/energy-oil/california-wants-to-halt-oil-industry-exodus-after-years-of-climate-focus-e5da733e?mod=pls_whats_news_us_business_f
14,2025-09-18-14-08-00 +0000,wsj,Why Putin Can’t Afford to Let Ukraine Prosper,https://www.wsj.com/world/europe/why-putin-cant-afford-to-let-ukraine-prosper-9854e35e
13,2025-09-18-20-57-59 +0000,nyt,Catholics Project Many Images Onto Pope Leo: Liberal? Conservative? Cubs Fan?,https://www.nytimes.com/2025/09/18/world/asia/pope-leo-liberal-conservative.html
13,2025-09-18-23-52-00 +0000,wsj,"Japan Consumer Prices Continue to Rise, But at Slower Pace",https://www.wsj.com/economy/japan-consumer-prices-continue-to-rise-but-at-slower-pace-b4458d76
13,2025-09-18-11-00-00 +0000,wsj,"Amex Revamps Its Platinum Card, Raises Fee to $895",https://www.wsj.com/personal-finance/amex-revamps-its-platinum-card-raises-fee-to-895-5c32cb3b?mod=rss_markets_main
13,2025-09-18-10-00-00 +0000,latimes,"Loyola Marymount abruptly rescinds recognition of faculty union, claiming religious exemption",https://www.latimes.com/business/story/2025-09-18/loyola-marymount-university-abruptly-stops-bargaining-with-faculty-union-claiming-religious-exemption
13,2025-09-19-04-01-17 +0000,nyt,How Kenyan Villagers Saved Their Sacred Caves From a Mining Company,https://www.nytimes.com/2025/09/19/world/africa/how-kenyan-villagers-saved-their-sacred-caves-from-a-mining-company.html
13,2025-09-18-12-10-42 +0000,wapo,A dog helped an injured wild crow. Now they’re best friends.,https://www.washingtonpost.com/lifestyle/2025/09/18/rescued-crow-dog-friends-oregon/
13,2025-09-18-20-38-49 +0000,nyt,"As Shutdown Looms, Democrats Outline Demands on Medicaid and Obamacare",https://www.nytimes.com/2025/09/17/us/politics/democrats-spending-demands-shutdown.html
13,2025-09-18-20-33-00 +0000,wsj,Opinion | Russia’s Drone Attack Is an Opening for U.S.-India Repair,https://www.wsj.com/opinion/russias-drone-attack-is-an-opening-for-u-s-india-repair-60be4de9
13,2025-09-18-15-36-52 +0000,nyt,Newark Airport Crisis Has Eased but Tech and Staffing Issues Persist,https://www.nytimes.com/2025/09/18/business/newark-airport-air-traffic-control.html
13,2025-09-18-21-32-00 +0000,wsj,Opinion | Robert Redford Was the Last Movie Star,https://www.wsj.com/opinion/robert-redford-was-the-last-movie-star-b1234699
13,2025-09-18-17-57-28 +0000,nyt,Here’s the latest.,https://www.nytimes.com/live/2025/09/18/world/trump-uk-visit/heres-the-latest
12,2025-09-18-14-37-00 +0000,wapo,"Wegovy pill could deliver as much weight loss as the shot, trial shows",https://www.washingtonpost.com/business/2025/09/18/wegovy-weight-loss-pill-results/
12,2025-09-18-18-16-09 +0000,startribune,Minnesota Republicans emphasize mental health over gun restrictions in response to shootings,https://www.startribune.com/republicans-see-mental-health-legislation-as-key-part-of-solution-to-recent-shootings/601472870
12,2025-09-18-18-11-36 +0000,cbc,Building ventilation invented by ancient Persians and Romans is making a modern comeback,https://www.cbc.ca/news/science/what-on-earth-solar-chimneys-1.7636962?cmp=rss
12,2025-09-18-22-00-29 +0000,startribune,Minnesotans now directly paying tariffs on even small overseas orders,https://www.startribune.com/de-minimis-exemption-trump-tariff-trade-war-pay-ups-fedex-dhl-kinoko-kids-moona-moono/601472700
12,2025-09-19-00-32-05 +0000,nyt,Kennedy Announces Firing of Organ Transplant Group After Safety Problems,https://www.nytimes.com/2025/09/18/us/organ-transplants-rfk-shutdown.html
12,2025-09-19-01-35-05 +0000,nyt,What to Know About the North American Summit Taking Place Without the U.S.,https://www.nytimes.com/2025/09/18/world/americas/canada-mexico-us-carney-sheinbaum-trump.html
12,2025-09-18-20-39-43 +0000,latimes,A seemingly cursed Big Sur hiking trail finally reopens. But for how long?,https://www.latimes.com/california/story/2025-09-18/big-sur-hiking-trail-reopens-disaster-prone
12,2025-09-18-09-04-47 +0000,nyt,"Amid Republican Crackdown on D.C., City Leaders to Testify",https://www.nytimes.com/2025/09/18/us/dc-leaders-testify.html
12,2025-09-19-06-25-45 +0000,bbc,"Fans, food and fast feet: Africa's top shots",https://www.bbc.com/news/articles/cly72p3rzp3o?at_medium=RSS&at_campaign=rss
12,2025-09-19-07-03-00 +0000,bbc,The lonely life and death of Delhi's only African elephant,https://www.bbc.com/news/articles/cx2nlevy2gpo?at_medium=RSS&at_campaign=rss
12,2025-09-18-14-00-00 +0000,wsj,From Gray Flannel to Birkin: How Wall Street Fashion Has Changed Over the Decades,https://www.wsj.com/style/fashion/wall-street-fashion-history-78bafda7
12,2025-09-19-01-20-07 +0000,missionlocal,‘A food desert:’ Bayview Lucky to close after less than three years,https://missionlocal.org/2025/09/a-food-desert-bayview-lucky-to-close-after-less-than-three-years/
11,2025-09-18-20-24-56 +0000,nyt,Internet Shutdowns Hit Parts of Afghanistan,https://www.nytimes.com/2025/09/18/world/asia/internet-shutdowns-afghanistan.html
11,2025-09-19-05-09-20 +0000,bbc,Scotland becoming less tolerant to immigration - Humza Yousaf,https://www.bbc.com/news/articles/cp3qkvr6pl4o?at_medium=RSS&at_campaign=rss
11,2025-09-19-04-24-00 +0000,48hills,Best of the Bay 2025 Editors’ Pick: Double Cross Trail,https://48hills.org/2025/09/best-of-the-bay-2025-editors-pick-double-cross-trail/
11,2025-09-19-00-09-23 +0000,nyt,Helicopter Carrying 4 Soldiers Crashes in Washington State,https://www.nytimes.com/2025/09/18/us/military-helicopter-crash-washington.html
11,2025-09-19-05-07-31 +0000,bbc,Borussia Dortmund sorry for TikTok 'mocking' woman's stammer,https://www.bbc.com/news/articles/c4gw8y847q7o?at_medium=RSS&at_campaign=rss
11,2025-09-19-05-10-08 +0000,bbc,In conversation with Lib Dem leader Ed Davey,https://www.bbc.com/news/articles/cwynqvkg403o?at_medium=RSS&at_campaign=rss
11,2025-09-19-06-18-15 +0000,bbc,Taliban ban books written by women from Afghan universities,https://www.bbc.com/news/articles/c0kn7yyzrjgo?at_medium=RSS&at_campaign=rss
11,2025-09-18-23-03-27 +0000,nyt,"The F.J. King, a Ship Lost in 1886, Is Found in Lake Michigan",https://www.nytimes.com/2025/09/18/us/ghost-ship-wreckage-lake-michigan.html
11,2025-09-18-16-53-42 +0000,nyt,"José María Tojeira, 78, Dies; Pursued Killers of His Fellow Priests",https://www.nytimes.com/2025/09/18/world/americas/jose-maria-tojeira-dead.html
11,2025-09-18-18-18-05 +0000,bbc,US deportees sue Ghana over 'illegal' detention,https://www.bbc.com/news/articles/cn821dk851do?at_medium=RSS&at_campaign=rss
11,2025-09-19-02-29-46 +0000,nyt,A Domestic Violence Case in Rural Pennsylvania Ended in a Deadly Ambush,https://www.nytimes.com/2025/09/18/us/pennsylvania-suspect-officers-killed.html
10,2025-09-18-10-00-00 +0000,latimes,Contributor: The right now embraces cancel culture,https://www.latimes.com/opinion/story/2025-09-18/jimmy-kimmel-cancel-culture-charlie-kirk
10,2025-09-18-13-36-44 +0000,bbc,I fear for Great Britain and worry things could turn ugly - Poots,https://www.bbc.com/news/articles/c701rrpgxk7o?at_medium=RSS&at_campaign=rss
10,2025-09-19-02-56-35 +0000,bbc,Doctor penalised for calling mushroom murderer 'disturbed sociopath',https://www.bbc.com/news/articles/cjr51251353o?at_medium=RSS&at_campaign=rss
10,2025-09-18-21-05-55 +0000,nyt,Rifts Grow Between Netanyahu and His Security Chiefs,https://www.nytimes.com/2025/09/18/world/middleeast/israel-netanyahu-military-gaza.html
10,2025-09-19-07-55-00 +0000,wsj,Jefferies Deepens Ties With Japan’s Sumitomo Mitsui,https://www.wsj.com/business/deals/jefferies-deepens-ties-with-japans-sumitomo-mitsui-5fe342f2?mod=rss_markets_main
10,2025-09-19-08-01-00 +0000,cbc,NATO deterrence mission in Latvia drains the Canadian Army's fleet of vehicles,https://www.cbc.ca/news/politics/nato-canadian-army-latvia-military-vehicles-1.7637922?cmp=rss
10,2025-09-18-10-43-09 +0000,nyt,When a Simple Swim Carries a Risk of Dangerous Illness,https://www.nytimes.com/2025/09/15/health/schistosomiasis-children.html
9,2025-09-18-23-01-14 +0000,bbc,Firmus gas prices to drop by 8.5% in  Belfast area,https://www.bbc.com/news/articles/ckgz3lrgm34o?at_medium=RSS&at_campaign=rss
9,2025-09-18-21-52-23 +0000,nyt,Man Dies After Roller Coaster Ride at Epic Universe,https://www.nytimes.com/2025/09/18/us/universal-ride-death-stardust-racers.html
9,2025-09-18-17-37-00 +0000,wsj,Opinion | Britain’s Conservative Party Heads for Extinction,https://www.wsj.com/opinion/britains-conservative-party-heads-for-extinction-7e2e10a0
9,2025-09-19-05-03-24 +0000,bbc,Why more students like me are choosing not to leave home,https://www.bbc.com/news/articles/c15kwylxjglo?at_medium=RSS&at_campaign=rss
9,2025-09-18-23-59-25 +0000,bbc,'It's not easy': Reform council strives to identify promised savings,https://www.bbc.com/news/articles/cly9m75101lo?at_medium=RSS&at_campaign=rss
9,2025-09-18-13-08-47 +0000,nyt,Oldest Dome-Headed Dinosaur Revealed by ‘Shockingly Beautiful’ Fossil,https://www.nytimes.com/2025/09/17/science/pachycephalosaurus-fossil-mongolia.html
9,2025-09-19-05-18-28 +0000,bbc,Butcher calls for more support for small businesses,https://www.bbc.com/news/articles/c4gw8nqwpqxo?at_medium=RSS&at_campaign=rss
8,2025-09-18-18-48-54 +0000,cbc,"Conservatives, Liberals spar over competing visions of bail reform",https://www.cbc.ca/news/politics/bail-reform-1.7637352?cmp=rss
8,2025-09-18-16-16-53 +0000,bbc,Malawi's parties warned not to prematurely declare election victory,https://www.bbc.com/news/articles/cwyrqz4egddo?at_medium=RSS&at_campaign=rss
8,2025-09-18-14-21-14 +0000,bbc,African pride as Rwanda prepares for cycling history,https://www.bbc.com/sport/cycling/articles/cddm2gpg5z3o?at_medium=RSS&at_campaign=rss
7,2025-09-19-06-29-00 +0000,wsj,U.K. Retail Sales Climbed Again in August,https://www.wsj.com/economy/u-k-retail-sales-climbed-again-in-august-7b9ab640
7,2025-09-18-13-13-00 +0000,wsj,U.S. Jobless Claims Fell Last Week,https://www.wsj.com/economy/jobs/u-s-jobless-claims-fell-last-week-8c746e4b
7,2025-09-18-09-38-00 +0000,wsj,"ECB Doesn’t Know If Easing Cycle Is Over, De Guindos Says",https://www.wsj.com/articles/ecb-should-follow-very-prudent-approach-given-high-uncertainty-de-guindos-says-abd542c4
7,2025-09-18-20-40-00 +0000,wsj,Opinion | Academic Publishing Performs a Public Service,https://www.wsj.com/opinion/academic-publishing-performs-a-public-service-peer-review-a6660a67?mod=pls_whats_news_us_business_f
7,2025-09-18-17-30-00 +0000,nypost,The boring crypto play that actually pays,https://nypost.com/business/crypto-staking-guide/
7,2025-09-18-15-57-20 +0000,nyt,Democratic Senators Call for U.S. Recognition of Palestinian State,https://www.nytimes.com/2025/09/18/us/politics/democrats-senators-palestinian-state.html
7,2025-09-18-14-41-53 +0000,nyt,"Do Reptiles Have Moods, Too?",https://www.nytimes.com/2025/09/18/science/reptiles-cognition-moods.html
6,2025-09-18-09-45-53 +0000,bbc,'Firenado' tears through Brazil sugarcane field,https://www.bbc.com/news/videos/c740wyyzj4vo?at_medium=RSS&at_campaign=rss
6,2025-09-18-21-21-00 +0000,wsj,What Is a Money Market Account?,https://www.wsj.com/buyside/personal-finance/banking/money-market-accounts?mod=rss_markets_main
6,2025-09-19-04-30-03 +0000,nyt,Drones vs. Lasers,https://www.nytimes.com/2025/09/19/briefing/nato-drones-russia.html
6,2025-09-18-15-30-00 +0000,48hills,Writer Michael Luo is ready for the happy ending,https://48hills.org/2025/09/writer-michael-luo-is-ready-for-the-happy-ending/
5,2025-09-18-11-00-00 +0000,startribune,What does it take to keep a Minneapolis music club going for decades?,https://www.startribune.com/dakota-first-avenue-bunkers-lowell-pickett-prince-nate-kranz-james-klein/601457273
5,2025-09-18-18-15-37 +0000,bbc,MP investigated over alleged racial abuse on X,https://www.bbc.com/news/articles/c79vqy8jyj8o?at_medium=RSS&at_campaign=rss
5,2025-09-18-21-57-00 +0000,wsj,Opinion | Gatekeepers and National Traumas,https://www.wsj.com/opinion/gatekeepers-and-national-traumas-5b1fef30?mod=pls_whats_news_us_business_f
5,2025-09-19-00-01-00 +0000,wsj,U.K. Consumer Sentiment Falls Back,https://www.wsj.com/economy/u-k-consumer-sentiment-falls-back-7385e57b
5,2025-09-18-23-01-17 +0000,bbc,Electric aviation awaits a battery breakthrough,https://www.bbc.com/news/articles/cx27vlp3zzgo?at_medium=RSS&at_campaign=rss
3,2025-09-18-21-30-00 +0000,wsj,Opinion | Back to Censor Culture,https://www.wsj.com/opinion/back-to-censor-culture-f6bd4637?mod=pls_whats_news_us_business_f
3,2025-09-18-21-34-00 +0000,wsj,Opinion | Why Johnny Can’t Add Anymore,https://www.wsj.com/opinion/u-s-math-education-crpe-report-naep-scores-648adf94
3,2025-09-18-09-00-10 +0000,nyt,Edward Enninful’s Big Reveal,https://www.nytimes.com/2025/09/18/style/edward-enninful-magazine-vogue.html
1,2025-09-18-13-00-00 +0000,missionlocal,Butterflies,https://missionlocal.org/2025/09/sf-photos-butterflies/
1,2025-09-18-09-56-11 +0000,nyt,The Road,https://www.nytimes.com/2025/09/18/world/middleeast/gaza-city-evacuation.html
