score,pubdate,source,title,link
34,2025-09-18-14-39-00 +0000,bbc,"Planning approvals for new homes at record low, figures show",https://www.bbc.com/news/articles/cgmzwk4yd1eo?at_medium=RSS&at_campaign=rss
33,2025-09-18-09-30-00 +0000,wsj,"Heard on the Street: With the Fed in cutting mode, many people expect mortgage rates to fall fast. Unfortunately, it isn’t that simple.",https://www.wsj.com/economy/housing/what-decides-where-mortgage-rates-go-from-here-b5b09e35
33,2025-09-19-05-03-04 +0000,bbc,Five new unitary authorities would 'save £52m a year',https://www.bbc.com/news/articles/c4g7kl1x404o?at_medium=RSS&at_campaign=rss
33,2025-09-18-14-39-43 +0000,nypost,"Israeli tanks and infantry roll into Gaza, area hit by telecoms blackout",https://nypost.com/2025/09/18/world-news/israeli-tanks-and-infantry-roll-into-gaza-area-hit-by-telecoms-blackout/
33,2025-09-18-22-52-57 +0000,nypost,"Ex-Biden chief of staff Jeff Zients called for post-debate cognitive test, said 46th prez’s memory grew worse in office: source",https://nypost.com/2025/09/18/us-news/ex-biden-chief-of-staff-jeff-zients-called-for-post-debate-cognitive-test-said-46th-prezs-memory-grew-worse-in-office-source/
32,2025-09-18-12-08-07 +0000,bbc,"Israeli minister touts Gaza 'real estate bonanza', defying international backlash",https://www.bbc.com/news/articles/c5y59z6rznvo?at_medium=RSS&at_campaign=rss
32,2025-09-18-21-01-00 +0000,wsj,"Tech Deal, Rate Cut Push Stocks to Records",https://www.wsj.com/finance/stocks/tech-deal-rate-cut-push-stocks-to-records-f9b92d8e?mod=rss_markets_main
32,2025-09-18-14-18-36 +0000,bbc,US firms pledge £150bn investment in UK as tech deal signed,https://www.bbc.com/news/articles/cx2nllgl3q7o?at_medium=RSS&at_campaign=rss
32,2025-09-19-06-59-37 +0000,nypost,Texas congressional staffer dead after catching fire at home — and uttering heartbreaking final words to her mom,https://nypost.com/2025/09/19/us-news/texas-congressional-staffer-regina-santos-aviles-dead-after-catching-fire-at-home/
32,2025-09-18-15-16-14 +0000,nyt,"How Did Hands Evolve? Look to Your Anus, a New Study Suggests.",https://www.nytimes.com/2025/09/17/science/evolution-crispr-hands.html
32,2025-09-18-14-46-49 +0000,bbc,"'Cataclysmic' situation in Gaza City, UN official says, as Israeli tanks advance",https://www.bbc.com/news/articles/c5y8l46m5evo?at_medium=RSS&at_campaign=rss
32,2025-09-18-14-44-32 +0000,wapo,"Pope Leo, in new biography, resists doctrinal change on hot-button topics",https://www.washingtonpost.com/world/2025/09/18/pope-leo-biography-first-interview/
31,2025-09-19-07-29-00 +0000,wsj,Israel’s Attack Blew Up Qatar’s Bet on Being Friends With Everyone,https://www.wsj.com/world/middle-east/israel-qatar-relationship-hamas-strike-abc40be3
31,2025-09-18-16-13-46 +0000,nypost,"Gaza aid truck driver shoots 2 Israelis to death at border crossing, officials say",https://nypost.com/2025/09/18/world-news/gaza-aid-truck-driver-shoots-2-israelis-to-death-at-border-crossing-officials-say/
31,2025-09-19-07-00-00 +0000,wsj,"The Bank of Japan said it would begin selling its stockholdings, a move seen as a step further in monetary policy normalization and a sign of confidence in the economy",https://www.wsj.com/articles/bank-of-japan-leaves-rates-unchanged-announces-etf-sales-22f98b86
30,2025-09-18-09-30-00 +0000,wsj,What Decides Where Mortgage Rates Go From Here,https://www.wsj.com/economy/housing/what-decides-where-mortgage-rates-go-from-here-b5b09e35?mod=rss_markets_main
30,2025-09-18-21-07-43 +0000,latimes,Watchdogs say new L.A. County rule is an attempt to muzzle criticism,https://www.latimes.com/california/story/2025-09-18/los-angeles-county-oversight-communications
30,2025-09-18-09-37-00 +0000,wsj,Taiwan Central Bank Leaves Key Interest Rates Unchanged,https://www.wsj.com/articles/taiwan-central-bank-leaves-key-interest-rates-unchanged-1e7b3c89
29,2025-09-18-14-46-25 +0000,wapo,Democrats release their own funding proposal as government shutdown looms,https://www.washingtonpost.com/business/2025/09/17/democrats-budget-proposal-shutdown/
29,2025-09-19-05-23-39 +0000,bbc,India regulator rejects US firm's fraud claims against Adani Group,https://www.bbc.com/news/articles/c0m4l14vdplo?at_medium=RSS&at_campaign=rss
29,2025-09-18-10-05-00 +0000,wapo,The cities where buying a house is most and least affordable as mortgage rates change,https://www.washingtonpost.com/business/2025/09/18/mortgage-rates-fed-zillow/
29,2025-09-18-18-12-43 +0000,nypost,Spain’s PM under fire for Israel nuclear weapon comment: ‘Blatant genocidal threat’,https://nypost.com/2025/09/18/world-news/spains-pm-under-fire-for-nuclear-weapon-comment-about-israel/
29,2025-09-18-09-04-33 +0000,nypost,Starbucks workers sue over company’s new dress code,https://nypost.com/2025/09/18/business/starbucks-workers-sue-over-companys-new-dress-code/
29,2025-09-18-15-54-38 +0000,wapo,"He was set to break a record cycling across Eurasia, then came Russia",https://www.washingtonpost.com/world/2025/09/18/sofiane-sehili-cyclist-arrested-vladivostok-russia/
29,2025-09-18-22-07-20 +0000,bbc,China is calling a TikTok deal a win. What's in it for them?,https://www.bbc.com/news/articles/c9dxq0jz2l9o?at_medium=RSS&at_campaign=rss
29,2025-09-18-15-30-29 +0000,nypost,"FTC files bombshell suit against Ticketmaster seeking billions over exorbitant fees, turning blind eye to bots",https://nypost.com/2025/09/18/business/ftc-files-bombshell-suit-against-ticketmaster-that-seeks-billions-in-fines/
28,2025-09-18-10-00-00 +0000,latimes,West Hollywood to become first in L.A. County to ban pet sales,https://www.latimes.com/california/story/2025-09-18/live-animals-are-not-for-sale-in-west-hollywood-officials-say
28,2025-09-19-03-09-38 +0000,latimes,"Did Joshua Tree's Invisible House charge $10,000 for a selfie? Here's what the owner says",https://www.latimes.com/california/story/2025-09-18/did-joshua-trees-invisible-house-charge-10-000-for-a-selfie-heres-what-the-owner-says
28,2025-09-19-03-49-57 +0000,nypost,RFK Jr’s hand-picked CDC advisory panel recommends against combo vaccine for kids,https://nypost.com/2025/09/18/us-news/rfk-jrs-hand-picked-cdc-advisory-panel-recommends-against-combo-vaccine-for-kids/
28,2025-09-18-19-50-08 +0000,wapo,Two Israeli soldiers killed by gunman at Jordanian border,https://www.washingtonpost.com/world/2025/09/18/israel-jordan-allenby-crossing-attack/
28,2025-09-18-22-56-00 +0000,nyt,"Takeaways from ‘107 Days,’ Kamala Harris’s New Book",https://www.nytimes.com/2025/09/18/us/politics/kamala-harris-book-takeaways.html
28,2025-09-18-18-55-39 +0000,nypost,"Zuckerberg unveils Meta Ray-Ban Display glasses that can play videos, create live subtitles for $799",https://nypost.com/2025/09/18/business/zuckerberg-unveils-meta-ray-ban-display-glasses-that-can-play-videos-create-live-subtitles-for-799/
28,2025-09-18-19-53-00 +0000,wsj,Saudi Arabia Seeks New Security Alliances as Trust in U.S. Erodes,https://www.wsj.com/world/middle-east/saudi-arabia-seeks-new-security-alliances-as-trust-in-u-s-erodes-fa3df9e0
27,2025-09-19-00-33-18 +0000,nypost,Desperate search on after US Army helicopter carrying 4 service members crashes near Washington military base,https://nypost.com/2025/09/18/us-news/us-army-helicopter-carrying-4-service-members-crashes-near-washington-military-base/
27,2025-09-18-18-16-24 +0000,bbc,Israeli air strikes hit southern Lebanon,https://www.bbc.com/news/articles/ckgedgjd648o?at_medium=RSS&at_campaign=rss
27,2025-09-19-01-22-45 +0000,nyt,The Fed Has No Good Options as Hiring Wobbles and Inflation Picks Up,https://www.nytimes.com/2025/09/18/business/fed-interest-rates-labor-inflation.html
27,2025-09-18-15-39-00 +0000,bbc,Workers across France strike over budget cut plans,https://www.bbc.com/news/articles/cj9zvg03elzo?at_medium=RSS&at_campaign=rss
26,2025-09-18-19-38-00 +0000,wsj,New Owners Plot Comeback for Tween Retailer Claire’s,https://www.wsj.com/business/retail/first-clean-the-carpets-new-owners-plot-comeback-for-tween-retailer-claires-caf988a7?mod=pls_whats_news_us_business_f
26,2025-09-18-09-00-48 +0000,nyt,What Will China’s Green-Tech Ambitions Cost the World?,https://www.nytimes.com/2025/09/18/magazine/china-green-tech-laos.html
26,2025-09-18-20-40-55 +0000,wapo,"This state will be the first to offer free child care, regardless of income",https://www.washingtonpost.com/nation/2025/09/18/new-mexico-free-child-care-grisham/
26,2025-09-18-14-06-23 +0000,latimes,Intel shares soar as Nvidia embrace brings it into the AI boom,https://www.latimes.com/business/story/2025-09-18/nvidia-to-invest-5-billion-in-intel-companies-will-work-together-on-ai-infrastructure-and-pcs
25,2025-09-18-11-42-43 +0000,nypost,Protesters in France target Paris Metro amid nationwide transport strikes,https://nypost.com/2025/09/18/world-news/protesters-hit-france-with-transport-strikes-on-thursday/
25,2025-09-18-22-44-35 +0000,nypost,"Hunter Biden weighed in on pardons dad Joe signed, ex-WH chief of staff Jeff Zients tells lawmakers: source",https://nypost.com/2025/09/18/us-news/hunter-biden-weighed-in-on-pardons-dad-joe-signed-ex-wh-chief-of-staff-jeff-zients-tells-lawmakers-source/
25,2025-09-18-18-45-52 +0000,nyt,"Nvidia to Buy $5 Billion Stake in Intel, Giving Rival a Lifeline",https://www.nytimes.com/2025/09/18/business/nvidia-intel-stake.html
25,2025-09-18-19-59-22 +0000,bbc,Corbyn and Sultana clash over new party membership,https://www.bbc.com/news/articles/cgkn3v1e7g3o?at_medium=RSS&at_campaign=rss
24,2025-09-19-08-00-00 +0000,cbc,Canadians are taking a big step back from the U.S. — and here's the data to prove it,https://www.cbc.ca/news/politics/canada-big-step-back-from-us-data-1.7637651?cmp=rss
24,2025-09-18-18-58-01 +0000,latimes,Rains are soaking Los Angeles for the first time in months. Is it enough to reduce wildfire risks?,https://www.latimes.com/california/story/2025-09-18/la-summer-rain-fire-season-ahead
24,2025-09-18-19-50-46 +0000,bbc,At least 10 dead in Lagos high-rise office building fire,https://www.bbc.com/news/articles/cr704re0kmpo?at_medium=RSS&at_campaign=rss
24,2025-09-18-18-30-52 +0000,latimes,FTC sues Ticketmaster and Live Nation over concert ticket resale practices,https://www.latimes.com/entertainment-arts/business/story/2025-09-18/federal-trade-comission-sues-ticketmaster-and-livenation-illegal-ticketing-practices
24,2025-09-19-04-00-00 +0000,wapo,"As the world frets over Palestine’s status, Israel flattens Gaza",https://www.washingtonpost.com/world/2025/09/19/united-nations-gaza-general-assembly-palestine-israel/
24,2025-09-19-01-29-31 +0000,nyt,Did Britain Win the Trade War? Why It’s Tough to Declare a Victor.,https://www.nytimes.com/2025/09/15/business/economy/britain-european-union-tariffs-winner.html
24,2025-09-18-16-39-38 +0000,latimes,L.A. County confirms first 4 West Nile virus cases of the summer in local residents,https://www.latimes.com/california/story/2025-09-18/la-county-west-nile-virus-cases
24,2025-09-18-12-00-54 +0000,nypost,Brigitte Macron to present scientific and photographic evidence to US court proving she’s a woman,https://nypost.com/2025/09/18/world-news/brigette-macron-to-present-scientific-and-photographic-evidence-to-us-court-proving-shes-a-woman/
24,2025-09-19-03-42-22 +0000,nypost,Remains believed to be Travis Decker found three months after murder of three young daughters,https://nypost.com/2025/09/18/us-news/remains-believed-to-be-travis-decker-found-three-months-after-murder-of-three-young-daughters/
23,2025-09-18-21-34-50 +0000,nyt,"IRS Official Sues Agency, Accusing It of Leaking Private Data to Fox News and Others",https://www.nytimes.com/2025/09/18/business/irs-lawsuit-holly-paz-fox-news.html
23,2025-09-18-22-24-23 +0000,nypost,Olivia Nuzzi hired by Vanity Fair nearly a year after RFK Jr. sexting scandal,https://nypost.com/2025/09/18/us-news/olivia-nuzzi-hired-by-vanity-fair-nearly-a-year-after-rfk-jr-sexting-scandal/
23,2025-09-18-09-30-00 +0000,wsj,Meta Approaches Media Companies About AI Content-Licensing Deals,https://www.wsj.com/business/media/meta-approaches-media-companies-about-ai-content-licensing-deals-d58c9fb6?mod=pls_whats_news_us_business_f
23,2025-09-18-19-45-56 +0000,nyt,U.S. to Cut Out Nongovernmental Groups in Refocusing Health Aid,https://www.nytimes.com/2025/09/18/us/politics/us-aid-health-ngos.html
23,2025-09-18-21-29-18 +0000,nyt,Judge Blocks Administration From Immediately Removing Guatemalan Children,https://www.nytimes.com/2025/09/18/us/politics/guatemalan-children-deportation.html
22,2025-09-18-19-47-33 +0000,bbc,"Ticketmaster, Live Nation face US suit over resale tactics",https://www.bbc.com/news/articles/cpq5nq9gyrvo?at_medium=RSS&at_campaign=rss
22,2025-09-18-23-14-27 +0000,wapo,"Shooter who killed 3 Pa. officers was accused of stalking ex, officials say",https://www.washingtonpost.com/nation/2025/09/18/matthew-ruth-york-pennsylvania-shooting/
22,2025-09-18-21-00-07 +0000,nyt,‘Come From Away’ Will Be This Season’s Most Produced Show in the U.S.,https://www.nytimes.com/2025/09/18/theater/come-from-away-most-produced-list.html
22,2025-09-18-10-00-00 +0000,nypost,Now is the time for Israel to pursue shift in its defense doctrine — it’s the only way to stop Hamas from rebuilding,https://nypost.com/2025/09/18/world-news/theres-only-one-way-for-israel-to-stop-hamas-from-rebuilding/
22,2025-09-18-11-00-00 +0000,missionlocal,San Francisco is full of AI billboards. One of them is this guy.,https://missionlocal.org/2025/09/s-f-is-full-of-ai-billboards-one-of-those-billboards-is-this-guy/
22,2025-09-19-04-32-31 +0000,bbc,Can you be sued for defaming virtual K-pop stars? South Korea court says yes,https://www.bbc.com/news/articles/ceq2y91qy88o?at_medium=RSS&at_campaign=rss
22,2025-09-19-04-05-46 +0000,nyt,Texas A&M President to Step Down After Controversy Over ‘Gender Ideology’,https://www.nytimes.com/2025/09/18/us/texas-am-president-gender-ideology-controversy.html
22,2025-09-19-02-59-48 +0000,latimes,Getting married in L.A. County is getting more expensive. Here's why,https://www.latimes.com/california/story/2025-09-18/getting-married-in-l-a-county-is-getting-more-expensive-heres-why
22,2025-09-19-02-54-12 +0000,wapo,Texas A&M president resigns after instructor’s firing over gender teachings,https://www.washingtonpost.com/nation/2025/09/18/texasam-president-resign-mark-welsh-gender/
22,2025-09-18-19-15-06 +0000,cbc,Former justice minister David Lametti named Canada's UN ambassador,https://www.cbc.ca/news/politics/david-lametti-canada-un-rep-1.7637462?cmp=rss
22,2025-09-18-18-19-59 +0000,bbc,"No outside pressure to drop China spying charges, says CPS head",https://www.bbc.com/news/articles/cgrqxe47gq4o?at_medium=RSS&at_campaign=rss
21,2025-09-19-01-00-00 +0000,wsj,Jensen Huang Walks an AI Tightrope Between the U.S. and China,https://www.wsj.com/tech/ai/nvidia-ceo-jensen-huang-us-china-relationship-b7d438a7?mod=pls_whats_news_us_business_f
21,2025-09-19-00-20-23 +0000,startribune,"Back on the ice, Wild’s Kirill Kaprizov says contract talks are ‘not my job right now’",https://www.startribune.com/back-on-the-ice-wilds-kirill-kaprizov-says-contract-talks-are-not-my-job-right-now/601456937
21,2025-09-18-12-41-53 +0000,bbc,Next warns UK economy faces 'anaemic' growth,https://www.bbc.com/news/articles/cwywkegwnyeo?at_medium=RSS&at_campaign=rss
21,2025-09-18-11-20-15 +0000,bbc,Togo leader's sister-in-law arrested after calling for end to family rule,https://www.bbc.com/news/articles/ce863ppp3k5o?at_medium=RSS&at_campaign=rss
21,2025-09-19-06-02-33 +0000,bbc,US blocks UN call for Gaza ceasefire for sixth time,https://www.bbc.com/news/articles/ce3yj41083no?at_medium=RSS&at_campaign=rss
21,2025-09-18-11-13-14 +0000,nyt,Longtime Putin Aide Who Opposed Ukraine War Is Granted Rare Resignation,https://www.nytimes.com/2025/09/18/world/europe/russia-putin-kozak-resigns.html
21,2025-09-18-18-26-00 +0000,wsj,Protesters in France Push Back on Efforts to Rein In Spending,https://www.wsj.com/world/europe/france-protests-budget-deficit-af87e6cd
21,2025-09-18-18-22-01 +0000,nyt,U.S. Sues Ticketmaster Over Claims of Illegal Resale Tactics,https://www.nytimes.com/2025/09/18/business/ticketmaster-ftc-suit.html
21,2025-09-18-16-30-58 +0000,bbc,Chipmaker Nvidia to invest $5bn in rival Intel,https://www.bbc.com/news/articles/c4gjd1mnjpyo?at_medium=RSS&at_campaign=rss
21,2025-09-18-23-11-00 +0000,wsj,Opinion | Now the Right Muzzles Free Speech,https://www.wsj.com/opinion/now-the-right-muzzles-free-speech-00acde84
21,2025-09-19-08-00-00 +0000,cbc,Federal government pulls plug on home retrofit loan program,https://www.cbc.ca/news/canada/calgary/bakx-greener-homes-cghl-retrofit-1.7636591?cmp=rss
20,2025-09-18-20-34-38 +0000,startribune,First federal charges in connection with housing program prosecutors call ‘riddled with fraud’,https://www.startribune.com/federal-prosecutors-charge-8-in-connection-with-minnesota-housing-program-riddled-with-fraud/601475500
20,2025-09-18-09-02-45 +0000,nyt,Help! Aer Lingus Wouldn’t Let Me Fly Because of a Visa I Didn’t Need.,https://www.nytimes.com/2025/09/18/travel/aer-lingus-uganda-visa.html
20,2025-09-19-00-18-24 +0000,latimes,RFK Jr.'s handpicked committee changed its recommendations for key childhood shots,https://www.latimes.com/science/story/2025-09-18/acip-rfk-jr-vote-mmr-shots
20,2025-09-18-17-15-16 +0000,bbc,UK set for talks over access to EU defence loans,https://www.bbc.com/news/articles/c07vdy4yz9do?at_medium=RSS&at_campaign=rss
20,2025-09-18-22-50-29 +0000,missionlocal,ICE arrests another 7 at S.F. immigration court — 2 without lawyers,https://missionlocal.org/2025/09/ice-arrests-another-7-at-s-f-immigration-court-2-without-lawyers/
20,2025-09-19-00-24-23 +0000,bbc,Chris Mason: Delight and relief in government after state visit,https://www.bbc.com/news/articles/cvgn3445655o?at_medium=RSS&at_campaign=rss
20,2025-09-18-09-21-01 +0000,bbc,Lib Dem leader on council tackling crime rates,https://www.bbc.com/news/videos/cgj1gp31g91o?at_medium=RSS&at_campaign=rss
19,2025-09-19-04-45-44 +0000,nypost,Trucker arrested after young half-sisters found trapped in refrigerated trailer set to hypothermia-inducing 30 degrees,https://nypost.com/2025/09/19/us-news/trucker-arrested-after-young-half-sisters-found-in-refrigerated-trailer/
19,2025-09-19-01-00-00 +0000,wsj,Solar-Powered Cars and Trucks Are Almost Here,https://www.wsj.com/business/energy-oil/aptera-motors-solar-powered-electric-vehicles-6ec1095f?mod=pls_whats_news_us_business_f
19,2025-09-18-18-47-14 +0000,nyt,Anti-Austerity Strikes and Protests Grip France,https://www.nytimes.com/2025/09/18/world/europe/france-protests-austerity.html
19,2025-09-19-00-28-24 +0000,nypost,Suspected human remains used for ‘rituals’ found in traveler’s luggage at Florida airport,https://nypost.com/2025/09/18/us-news/suspected-human-remains-for-rituals-found-in-travelers-luggage-at-florida-airport/
19,2025-09-18-13-22-03 +0000,nyt,Here’s Who Attended the State Dinner at Windsor Castle,https://www.nytimes.com/2025/09/17/world/europe/guest-list-state-dinner-windsor-castle.html
19,2025-09-18-10-00-00 +0000,latimes,"Hiltzik: Sen. Cassidy, whose vote got RFK Jr. his job, finally starts to make amends",https://www.latimes.com/business/story/2025-09-18/sen-cassidy-whose-vote-got-rfk-jr-his-job-finally-starts-to-make-amends
19,2025-09-18-21-37-00 +0000,wsj,Opinion | Israeli Lasers and American Defense,https://www.wsj.com/opinion/israel-iron-beam-laser-air-defense-18b48b00
19,2025-09-18-21-38-32 +0000,nyt,How China Became a Wedge Between Two South Pacific Neighbors,https://www.nytimes.com/2025/09/18/world/australia/china-pacific-nz-cook-islands.html
19,2025-09-18-23-07-20 +0000,nypost,"Fugitive teen gunman charged with deadly shooting of apparent innocent bystander, 57, using a walker: cops",https://nypost.com/2025/09/18/us-news/fugitive-teen-gunman-charged-with-deadly-shooting-of-apparent-innocent-bystander-57-using-a-walker-cops/
18,2025-09-18-13-14-51 +0000,wapo,"3 police officers killed, 2 wounded in southern Pennsylvania shooting",https://www.washingtonpost.com/nation/2025/09/17/pennsylvania-shooting-york-county-police/
18,2025-09-18-15-16-01 +0000,bbc,"Egypt says 3,000-year-old bracelet was stolen and melted down",https://www.bbc.com/news/articles/c1kw8dwy4dro?at_medium=RSS&at_campaign=rss
18,2025-09-18-21-55-19 +0000,latimes,Robbery suspect dies after being shot with 'less-lethal' LAPD projectile,https://www.latimes.com/california/story/2025-09-18/less-lethal-lapd-projectile-death
18,2025-09-18-09-18-31 +0000,bbc,"Genocide happening in Gaza, Sir Sadiq Khan says",https://www.bbc.com/news/articles/cx2pj14ylm6o?at_medium=RSS&at_campaign=rss
18,2025-09-18-10-00-22 +0000,wapo,Why private equity needs you more than you need them,https://www.washingtonpost.com/business/2025/09/18/why-private-equity-needs-you-more-than-you-need-them/
18,2025-09-18-23-15-34 +0000,nypost,"32 students, faculty hospitalized after pepper spray deployed during wild brawl at Florida high school",https://nypost.com/2025/09/18/us-news/32-students-faculty-hospitalized-after-pepper-spray-deployed-during-brawl-at-florida-high-school/
17,2025-09-19-03-56-47 +0000,nypost,"Greek heiress, 30, ‘never woke up’ after ‘itchy’ insect bite",https://nypost.com/2025/09/18/world-news/greek-heiress-30-found-dead-after-insect-bite/
17,2025-09-19-04-15-20 +0000,nypost,Arizona prisoner Richard Djerf apologizes before execution — says he won’t seek clemency,https://nypost.com/2025/09/19/us-news/arizona-prisoner-richard-djerf-apologizes-before-execution-says-he-wont-seek-clemency/
17,2025-09-18-21-42-27 +0000,nyt,Texas Man Dies in Fall From Alaska Mountain Trail,https://www.nytimes.com/2025/09/18/us/alaska-hikers-dead-juneau.html
17,2025-09-18-09-41-09 +0000,bbc,Newborn baby buried alive in India fights for her life,https://www.bbc.com/news/articles/c8jm18w299ko?at_medium=RSS&at_campaign=rss
17,2025-09-18-21-35-00 +0000,wsj,Opinion | Chuck Schumer Courts a Government Shutdown,https://www.wsj.com/opinion/government-shutdown-congress-chuck-schumer-mike-johnson-continuing-resolution-gop-democrats-ea4fd8af
17,2025-09-19-06-42-35 +0000,nypost,Byron Donalds fires back at Rashida Tlaib after ‘fascist’ jab: ‘Do I look like a member of the Third Reich?’,https://nypost.com/2025/09/19/us-news/byron-donalds-fires-back-at-rashida-tlaib-after-fascist-jab-do-i-look-like-a-member-of-the-third-reich/
17,2025-09-19-06-50-09 +0000,nypost,California driver named Isis fights with DMV to keep controversial ‘IAMISIS’ license plate,https://nypost.com/2025/09/19/us-news/california-driver-isis-wharton-fights-with-dmv-to-keep-controversial-iamisis-license-plate/
17,2025-09-18-20-44-28 +0000,nypost,Cracker Barrel facing aggressive proxy battle from Steak ‘n Shake owner,https://nypost.com/2025/09/18/business/cracker-barrel-facing-proxy-battle-from-steak-n-shake-owner/
17,2025-09-19-08-05-38 +0000,bbc,Highest government borrowing in August for five years,https://www.bbc.com/news/articles/cly9m4lqznro?at_medium=RSS&at_campaign=rss
17,2025-09-18-21-38-11 +0000,startribune,"Feds reject Rochester Public Schools’ appeal for mental health grant, citing DEI",https://www.startribune.com/feds-reject-rochester-public-schools-appeal-for-mental-health-grant-citing-dei/601476682
17,2025-09-18-17-58-18 +0000,bbc,MPs write to government over JLR supply chain jobs,https://www.bbc.com/news/articles/ce327e2rdw3o?at_medium=RSS&at_campaign=rss
17,2025-09-18-21-21-51 +0000,cbc,U.S. ambassador 'disappointed' with anti-American sentiment in Canada,https://www.cbc.ca/news/politics/us-ambassador-to-canada-disappointed-anti-american-campaign-1.7637534?cmp=rss
16,2025-09-18-18-47-50 +0000,nyt,"‘Tax the Rich,’ French Protesters Cry, as the Wealthy Push Back on Paying More",https://www.nytimes.com/2025/09/18/business/france-tax-protest-gabriel-zucman-billionaires.html
16,2025-09-18-23-14-19 +0000,nypost,Cause of death revealed in mysterious Burning Man murder of Russian national Vadim Kruglov,https://nypost.com/2025/09/18/us-news/cause-of-death-revealed-in-mysterious-burning-man-murder/
16,2025-09-18-15-35-13 +0000,nyt,"Wildfire Smoke Will Kill Thousands More by 2050, Study Finds",https://www.nytimes.com/2025/09/18/climate/wildfire-smoke-health-deaths.html
16,2025-09-18-15-52-09 +0000,nyt,E.P.A. Keeps Polluters on the Hook to Clean Up ‘Forever Chemicals’,https://www.nytimes.com/2025/09/18/climate/epa-pfas-forever-chemicals.html
16,2025-09-18-16-05-50 +0000,nyt,"With Amex’s Platinum Refresh, an Even More Exclusive Card Emerges",https://www.nytimes.com/2025/09/18/travel/amexs-platinum-card-benefits.html
16,2025-09-18-20-47-57 +0000,nyt,Exxon Urges Europe to Repeal Rules to Make Companies Track Climate Pollution,https://www.nytimes.com/2025/09/18/climate/exxon-woods-europe-climate-sustainability-repeal.html
16,2025-09-18-21-14-00 +0000,wsj,Is Nvidia Intel’s Savior? Not Quite,https://www.wsj.com/tech/intel-nvidia-deal-strategy-two-companies-ec7d7632?mod=rss_markets_main
16,2025-09-19-08-23-31 +0000,nypost,"Nearly 1,000 tourists trapped near Machu Picchu as protests shut down train services",https://nypost.com/2025/09/19/world-news/peru-protests-strand-1000-tourists-at-machu-picchu/
16,2025-09-18-10-00-00 +0000,nypost,"Russia adding 16K troops for renewed offensive in as little as 10 days, Ukrainian commander predicts",https://nypost.com/2025/09/18/world-news/russia-adding-16k-troops-for-renewed-offensive-soon-ukrainian-commander-predicts/
16,2025-09-18-22-53-16 +0000,nypost,"Damon Dash declared bankruptcy to avoid $5 million in lawsuit claims, lawyer says: ‘It’s not going to work’",https://nypost.com/2025/09/18/us-news/damon-dash-declared-bankruptcy-to-avoid-5-million-in-claims/
16,2025-09-19-00-50-20 +0000,bbc,Moment man narrowly avoids being hit by car in petrol station crash,https://www.bbc.com/news/videos/c4gq6xppq47o?at_medium=RSS&at_campaign=rss
