score,pubdate,source,title,link
35,2026-06-11-04-01-04 +0000,nyt,A.I. and the Chip Boom: Take a Quiz on New Korean Slang and Memes,https://www.nytimes.com/2026/06/11/world/asia/korean-ai-chips-quiz.html
35,2026-06-10-16-35-39 +0000,latimes,"5 teens killed in crash in Santa Maria; alcohol may have played a role, police say",https://www.latimes.com/california/story/2026-06-10/5-teens-killed-in-santa-maria-crash-alcohol-may-have-played-role-police-say
35,2026-06-11-15-20-13 +0000,nyt,Australia’s Social Media Ban Is Floundering. Can It Still Help Younger Kids?,https://www.nytimes.com/2026/06/10/world/australia/australia-social-media-ban-under-16.html
34,2026-06-11-15-01-48 +0000,nypost,House votes down FISA extension as lawmaker revolt grows over Bill Pulte pick as acting DNI,https://nypost.com/2026/06/11/us-news/house-votes-down-fisa-extension-as-lawmaker-revolt-grows-over-bill-pulte-pick-as-acting-dni/
34,2026-06-11-14-05-05 +0000,nyt,"Lee Raymond, Who Created Global Oil Behemoth Exxon Mobil, Dies at 87",https://www.nytimes.com/2026/06/10/business/lee-raymond-dead.html
34,2026-06-11-14-12-27 +0000,nyt,U.S. Strikes on Ships Off Oman Continue After Deaths of Indian Sailors,https://www.nytimes.com/2026/06/11/world/asia/india-sailors-iran-tanker-ships-us-strikes.html
34,2026-06-11-10-14-05 +0000,nypost,House Dem lashes out at GOP efforts to probe foreign donations with stunning claim on motive,https://nypost.com/2026/06/11/us-news/house-dem-terri-sewell-lashes-out-at-gop-efforts-to-probe-actblue-foreign-donations/
34,2026-06-10-16-56-48 +0000,nypost,"Regulators moving to allow most sports betting, barring war wagers on prediction platforms like Kalshi, Polymarket",https://nypost.com/2026/06/10/business/regulators-move-to-allow-most-sports-betting-bar-war-wagers-on-prediction-platforms-like-kalshi-polymarket/
33,2026-06-11-13-38-00 +0000,wsj,Oracle Shares Tumble Amid Pricey Data-Center Build-Out,https://www.wsj.com/business/earnings/oracle-reports-higher-profit-on-surging-cloud-revenue-5f7d25eb?mod=pls_whats_news_us_business_f
33,2026-06-11-15-04-30 +0000,nyt,House Rejects Bill to Extend Surveillance Power With FISA Section 702 Set to Expire,https://www.nytimes.com/2026/06/11/us/politics/house-spy-program-bill.html
33,2026-06-11-07-38-01 +0000,bbc,US college athlete smashes 110m hurdles world record,https://www.bbc.com/sport/athletics/articles/c982e7zr7deo?at_medium=RSS&at_campaign=rss
33,2026-06-10-23-14-00 +0000,wsj,The race between Maine Republican Sen. Susan Collins and Democrat Graham Platner leaves many women with a difficult choice,https://www.wsj.com/politics/policy/these-women-in-maine-are-agonizing-over-who-to-back-in-collins-platner-showdown-305b8579
33,2026-06-10-19-31-24 +0000,bbc,"Bill Gates says Epstein wanted personal relationship, but he 'never reciprocated'",https://www.bbc.com/news/articles/c0jy8v0ge66o?at_medium=RSS&at_campaign=rss
32,2026-06-11-10-00-00 +0000,latimes,"Becerra heads toward the November election with a major edge over Hilton in governor's race, poll shows",https://www.latimes.com/california/story/2026-06-11/becerra-heads-toward-november-election-with-major-edge-over-hilton-in-governors-race-poll-shows
32,2026-06-11-05-02-29 +0000,bbc,Social media on trial: Four important cases to watch,https://www.bbc.com/news/articles/c9q39l447l4o?at_medium=RSS&at_campaign=rss
32,2026-06-11-13-26-15 +0000,nyt,Analysis of Satellite Image and Videos Suggest Precision U.S. Strikes on Iranian Water Facility,https://www.nytimes.com/2026/06/10/world/middleeast/precision-strike-iran-water.html
32,2026-06-10-22-15-15 +0000,nyt,Bill Gates Says Epstein Tried to Use His Extramarital Affairs Against Him,https://www.nytimes.com/2026/06/10/business/bill-gates-epstein-testimony.html
32,2026-06-11-10-00-00 +0000,latimes,Mayor Karen Bass' brother joins Palisades fire lawsuit against city of L.A.,https://www.latimes.com/california/story/2026-06-11/mayor-bass-brother-joins-palisades-fire-lawsuit-against-city-of-la
31,2026-06-10-19-17-04 +0000,nypost,"2M barrels of oil per day is escaping the Strait of Hormuz, experts say: ‘Things are going to get worse’",https://nypost.com/2026/06/10/world-news/2m-barrels-of-oil-per-day-is-escaping-the-strait-of-hormuz-experts/
31,2026-06-10-21-00-00 +0000,wsj,Opinion | What Will It Take for California Pols to Reduce Fire Risk?,https://www.wsj.com/opinion/what-will-it-take-for-california-pols-to-reduce-fire-risk-90e4b31b
31,2026-06-11-09-59-00 +0000,wsj,"Tech, Media & Telecom Roundup: Market Talk",https://www.wsj.com/tech/tech-media-telecom-roundup-market-talk-2b642eb2?mod=pls_whats_news_us_business_f
31,2026-06-11-15-46-00 +0000,wsj,SpaceX IPO Draws at Least $5 Billion Order From BlackRock,https://www.wsj.com/business/spacex-ipo-draws-at-least-5-billion-order-from-blackrock-12fcd29f?mod=pls_whats_news_us_business_f
30,2026-06-10-17-48-54 +0000,bbc,Three Indian sailors missing after US says it hit tanker in Gulf of Oman,https://www.bbc.com/news/articles/c0rygjw1kqxo?at_medium=RSS&at_campaign=rss
30,2026-06-11-07-25-06 +0000,nypost,Police blast water cannons at Belfast protesters as unrest flares again after stabbing,https://nypost.com/2026/06/11/world-news/belfast-police-blast-water-cannons-at-protesters-as-unrest-flares-after-stabbing/
29,2026-06-11-02-41-01 +0000,nyt,Indonesian Military Court Sentences Four in Acid Attack on Rights Advocate,https://www.nytimes.com/2026/06/10/world/asia/indonesia-military-acid-attack-andrie.html
29,2026-06-11-14-10-17 +0000,nypost,"Long-suffering Knicks fans unite in the streets, airports to celebrate the stunning Game 4 comeback win over the Spurs",https://nypost.com/2026/06/11/sports/nyc-was-electric-after-knicks-historic-nba-finals-comeback-against-the-spurs/
29,2026-06-11-15-21-53 +0000,bbc,Toronto police officer dies in raid linked to US consulate shooting,https://www.bbc.com/news/articles/cx2dn84vww3o?at_medium=RSS&at_campaign=rss
29,2026-06-11-15-33-25 +0000,bbc,Healey quits as defence secretary amid military spending row,https://www.bbc.com/news/articles/c9w2lkd29l8o?at_medium=RSS&at_campaign=rss
29,2026-06-10-20-03-39 +0000,nypost,3-year-old girl dies after terrifying bounce house disaster during sudden windstorm,https://nypost.com/2026/06/10/world-news/canadian-girl-3-dies-in-bounce-house-tragedy/
29,2026-06-11-13-08-00 +0000,wsj,Best High-Yield Savings Accounts for June 2026: Up to 5.00%,https://www.wsj.com/buyside/personal-finance/banking/best-high-yield-savings-account
28,2026-06-10-18-20-54 +0000,bbc,'I will never get over watching my home burn': Belfast residents reel after night of unrest,https://www.bbc.com/news/articles/cevl9j9y8dmo?at_medium=RSS&at_campaign=rss
28,2026-06-10-18-55-35 +0000,nyt,Senior Russian Military Official Is Killed in Car Explosion Near Moscow,https://www.nytimes.com/2026/06/10/world/europe/russia-moscow-car-bomb.html
28,2026-06-11-14-36-00 +0000,wsj,Amazon Says Its Data Centers Used 2.5 Billion Gallons of Water in 2025,https://www.wsj.com/tech/amazon-says-its-data-centers-used-2-5-billion-gallons-of-water-in-2025-019e76f9?mod=pls_whats_news_us_business_f
28,2026-06-11-09-00-00 +0000,wapo,Democrats want to target companies that buy back their own stocks,https://www.washingtonpost.com/business/2026/06/11/democrats-want-target-companies-that-buy-back-their-own-stocks/
28,2026-06-11-09-30-00 +0000,wsj,You may think you understand how big a trillion is. But you don’t.,https://www.wsj.com/business/trillions-game-spacex-first-trillionaire-elon-musk-75cfbf1b
28,2026-06-11-15-46-37 +0000,nypost,Inside the wackiest Knicks watch parties as they staged jaw-dropping Game 4 comeback,https://nypost.com/2026/06/11/lifestyle/inside-the-wackiest-knicks-game-4-watch-parties-as-they-staged-jaw-dropping-comeback/
27,2026-06-10-22-25-29 +0000,latimes,"Democrat Fiona Ma, Republican Gloria Romero to face off in race for lieutenant governor",https://www.latimes.com/california/story/2026-06-10/democrat-fiona-ma-republican-gloria-romero-to-face-off-in-race-for-lieutenant-governor
27,2026-06-10-18-49-43 +0000,latimes,"In trial opening, feds accuse man of lighting Palisades fire as 'revenge' on the wealthy",https://www.latimes.com/california/story/2026-06-10/arson-trial-underway-for-man-accused-of-sparking-deadly-palisades-fire
27,2026-06-11-16-13-00 +0000,wsj,Opening of U.S.-Canada Bridge Delayed Due to Trade Tensions,https://www.wsj.com/world/americas/opening-of-u-s-canada-bridge-delayed-due-to-trade-tensions-e162b656
27,2026-06-10-19-08-03 +0000,nypost,"Desperate Putin planning Hail Mary winter offensive against Ukraine — as Russian economy in death spiral, experts say",https://nypost.com/2026/06/10/world-news/putin-planning-hail-mary-winter-offensive-against-ukraine-experts-say/
27,2026-06-11-14-00-00 +0000,wsj,Musk Confidant Antonio Gracias Set for $68 Billion SpaceX Win,https://www.wsj.com/business/musk-confidant-antonio-gracias-set-for-68-billion-spacex-win-83ad878a?mod=pls_whats_news_us_business_f
26,2026-06-11-05-53-00 +0000,wsj,South Korea Fines Coupang $410 Million Over Data-Law Breaches,https://www.wsj.com/business/retail/south-korea-fines-coupang-410-million-over-data-breach-0e3e400c
26,2026-06-10-20-30-00 +0000,bbc,SpaceX IPO: Preparing for the biggest liftoff yet?,https://www.bbc.co.uk/sounds/play/w3ct8gld?at_medium=RSS&at_campaign=rss
25,2026-06-11-13-01-58 +0000,nyt,Ryanair Is Being Investigated for Charging Parents to Sit Next to Their Children,https://www.nytimes.com/2026/06/11/world/europe/ryanair-investigation-parents-charges-flights.html
25,2026-06-10-19-38-57 +0000,nyt,Hong Kong Charges 7 People and 2 Companies Over Deadly Apartment Fire,https://www.nytimes.com/2026/06/10/world/asia/hong-kong-apartment-fire-charges.html
25,2026-06-10-16-45-49 +0000,nypost,Content creators are asserting their power like never before: ‘The model has flipped’,https://nypost.com/2026/06/10/business/creators-launching-companies-building-software-and-investing/
24,2026-06-11-04-13-58 +0000,bbc,Family of British toddler criticises police as Australian inquiry into cold case murders begins,https://www.bbc.com/news/articles/c0rygl7y1l0o?at_medium=RSS&at_campaign=rss
24,2026-06-11-01-01-00 +0000,wsj,What the SpaceX IPO Means for This Texas Border Town,https://www.wsj.com/business/what-the-spacex-ipo-means-for-this-texas-border-town-b4a0f5f5
24,2026-06-11-05-05-02 +0000,nypost,"US diplomat found dead in Myanmar, police take Thai woman into custody",https://nypost.com/2026/06/11/us-news/us-diplomat-found-dead-in-myanmar-as-police-take-thai-woman-into-custody/
24,2026-06-11-15-00-35 +0000,nypost,"Karmelo Anthony claims he’s ‘penniless,’ can’t afford lawyer for appeal — despite pocketing $625,000 — after murder conviction",https://nypost.com/2026/06/11/us-news/karmelo-anthony-claims-hes-penniless-cant-afford-lawyer-for-appeal-despite-pocketing-625000-after-murder-conviction/
24,2026-06-11-13-12-00 +0000,wsj,Wholesale Prices Continued to Surge in May,https://www.wsj.com/economy/wholesale-prices-continued-to-surge-in-may-a07465a9
24,2026-06-10-19-36-25 +0000,latimes,"Rebecca Grossman and ex-Dodger should pay nearly $200 million in boys' deaths, jury finds",https://www.latimes.com/california/story/2026-06-10/rebecca-grossman-scott-erickson-punitive-damages-boys-deaths
24,2026-06-11-14-53-18 +0000,nypost,Emergency Christianity summit held in Jerusalem to face global rise in antisemitism,https://nypost.com/2026/06/11/world-news/emergency-summit-held-in-jerusalem-to-confront-global-rise-in-antisemitism/
24,2026-06-11-14-17-36 +0000,nypost,‘TNT Tacos’ truck explosion lands husband and wife in hospital day before 25th anniversary,https://nypost.com/2026/06/11/us-news/tnt-tacos-truck-explodes-seriously-injuring-owners-day-before-their-25th-anniversary/
23,2026-06-11-12-00-00 +0000,wsj,Citigroup Is Rolling Out Tokenized Shares of Private Companies,https://www.wsj.com/finance/banking/citigroup-is-rolling-out-tokenized-shares-of-private-companies-64cd19ba?mod=rss_markets_main
23,2026-06-11-12-27-10 +0000,bbc,"Track UK's latest migration numbers - net migration, visas, asylum and small boats",https://www.bbc.com/news/articles/c70989jrdweo?at_medium=RSS&at_campaign=rss
23,2026-06-11-13-02-00 +0000,wsj,Dana to Combine With Eaton’s Mobility Business in $5.1 Billion Deal,https://www.wsj.com/business/deals/dana-to-combine-with-eatons-mobility-business-in-5-1-billion-deal-bacdb0d5?mod=pls_whats_news_us_business_f
23,2026-06-11-09-51-00 +0000,wsj,Energy & Utilities Roundup: Market Talk,https://www.wsj.com/business/energy-utilities-roundup-market-talk-839d9572?mod=pls_whats_news_us_business_f
23,2026-06-10-19-34-14 +0000,nypost,Child killer stabbed more than 30 times by inmates in 5-minute prison attack: ‘They left him for dead’,https://nypost.com/2026/06/10/world-news/child-killer-stabbed-more-than-30-times-by-inmates-in-5-minute-prison-attack-they-left-him-for-dead/
23,2026-06-11-15-32-43 +0000,nypost,"Beloved Knicks superfan witnessed stunning Game 4 victory — and met his namesake, Carmelo Anthony: ‘Beautiful experience’",https://nypost.com/2026/06/11/lifestyle/carmelo-rios-made-it-to-game-4-and-met-carmelo-anthony/
23,2026-06-10-18-47-53 +0000,nyt,Inflation Keeps Prospects of a Fed Rate Cut Low,https://www.nytimes.com/2026/06/10/business/economy/inflation-federal-reserve-interest-rates.html
23,2026-06-10-20-18-38 +0000,nypost,SF’s woke schools boss Maria Su cannot answer ‘white’ parents question from black congressman,https://nypost.com/2026/06/10/us-news/sf-schools-chief-maria-su-grilled-by-congress-on-parental-rights-trans-issues/
23,2026-06-11-14-46-43 +0000,nyt,Toronto Police Officer Fatally Shot While Investigating U.S. Consulate Shooting,https://www.nytimes.com/2026/06/11/world/canada/toronto-police-officer-shooting-us.html
23,2026-06-11-16-14-47 +0000,nypost,Cops fire on suspect with a weapon during rush hour on the 101 Freeway,https://nypost.com/2026/06/11/us-news/cops-fire-on-suspect-with-a-weapon-during-rush-hour-on-the-101-freeway/
23,2026-06-10-21-34-30 +0000,nypost,Camera catches fire and falls at soccer match — as operator narrowly avoids disaster,https://nypost.com/2026/06/10/world-news/camera-catches-fire-and-falls-at-soccer-match-as-operator-narrowly-avoids-disaster/
23,2026-06-10-22-34-16 +0000,nypost,Heidi Montag offers clue to future plans as she’s seen without Spencer Pratt,https://nypost.com/2026/06/10/us-news/spencer-pratts-wife-heidi-montag-spotted-holding-mic-after-his-los-angeles-mayoral-loss/
23,2026-06-11-02-03-50 +0000,nyt,Top Pentagon Official Worked Closely With C.I.A. Officer Later Found With Gold Bars,https://www.nytimes.com/2026/06/10/us/politics/pentagon-cia-officer-gold-bars.html
23,2026-06-11-06-45-10 +0000,bbc,Thai court sentences two men to death over Bangkok shrine bombing,https://www.bbc.com/news/articles/ckg8v51g9lno?at_medium=RSS&at_campaign=rss
22,2026-06-11-13-08-00 +0000,wsj,6 of the Best Financial Advisor Companies: Well-Known Fiduciary Investment Firms to Consider,https://www.wsj.com/buyside/personal-finance/financial-advisors/best-financial-advisors?mod=rss_markets_main
22,2026-06-11-13-44-27 +0000,wapo,Gunman expected to plead guilty to killing Minnesota lawmaker Melissa Hortman,https://www.washingtonpost.com/nation/2026/06/11/gunman-expected-plead-guilty-killing-minnesota-lawmaker-melissa-hortman/
22,2026-06-10-23-01-38 +0000,bbc,"I'd have vetoed foreign sale of UK tech giant, says Business Secretary",https://www.bbc.com/news/articles/cd0mg79ggm0o?at_medium=RSS&at_campaign=rss
22,2026-06-10-21-50-01 +0000,nyt,Night of Violence Grips Belfast After Stabbing Attack,https://www.nytimes.com/2026/06/10/world/europe/belfast-attack-riots-northern-ireland.html
22,2026-06-10-21-11-43 +0000,nyt,F.B.I. Searches California Plant Where Chemical Tank Nearly Exploded,https://www.nytimes.com/2026/06/10/us/fbi-search-orange-county-chemical-tank.html
22,2026-06-11-14-55-39 +0000,bbc,Opening of long awaited US-Canada bridge delayed again,https://www.bbc.com/news/articles/c23yv800e23o?at_medium=RSS&at_campaign=rss
22,2026-06-11-16-10-42 +0000,nyt,Vance Boelter Pleads Guilty in Assassination of Minnesota Lawmaker,https://www.nytimes.com/2026/06/11/us/minnesota-assassination-plea-hearing-hortman.html
22,2026-06-11-13-56-36 +0000,nyt,The Joy of Missing Out on SpaceX’s I.P.O.,https://www.nytimes.com/2026/06/11/business/spacex-ipo-investing.html
22,2026-06-11-11-00-00 +0000,startribune,"Minnesota, facing a shortage of mental health facilities for kids, could lose two more",https://www.startribune.com/minnesota-faces-a-shortage-of-mental-health-facilities-for-kids-it-could-lose-two-more/601852129
22,2026-06-11-01-03-00 +0000,wsj,How Cracker Barrel’s CEO Saved Her Job by Abandoning Her Own Strategy,https://www.wsj.com/business/hospitality/how-cracker-barrels-ceo-saved-her-job-by-abandoning-her-own-strategy-8ce653a4?mod=pls_whats_news_us_business_f
22,2026-06-11-10-00-00 +0000,latimes,"Democrats keep Prop. 50 promise alive through primary, with momentum heading toward November",https://www.latimes.com/politics/story/2026-06-11/democrats-keep-proposition-50-promise-alive-through-primary
22,2026-06-11-10-00-00 +0000,latimes,Spencer Pratt became a voice for L.A.'s disaffected. Where do his supporters go now?,https://www.latimes.com/california/story/2026-06-11/spencer-pratt-became-voice-for-l-a-s-disaffected-where-do-his-supporters-go-now
22,2026-06-11-03-20-12 +0000,nypost,Sen. Eric Schmitt bloodied after stellar catch as Republicans clobber Dems in Congressional Baseball Game for sixth straight year,https://nypost.com/2026/06/10/us-news/sen-eric-schmitt-dazzles-as-republicans-clobber-democrats-in-congressional-baseball-game-for-sixth-straight-year/
22,2026-06-10-20-42-00 +0000,nypost,"Justice Department opens sweeping ‘debanking’ probe into JPMorgan, Bank of America and more",https://nypost.com/2026/06/10/business/justice-department-opens-sweeping-debanking-probe-into-jpmorgan-bank-of-america-and-more/
21,2026-06-11-07-32-31 +0000,bbc,"Make stolen phones unusable, Met Police urges tech giants",https://www.bbc.com/news/articles/ckg4dey905yo?at_medium=RSS&at_campaign=rss
21,2026-06-11-10-34-25 +0000,nyt,‘Amazon.com of South Korea’ Is Fined a Record $409 Million,https://www.nytimes.com/2026/06/11/world/asia/south-korea-coupang-fine.html
21,2026-06-11-03-13-48 +0000,nypost,Nithya Raman bold-faced hypocrisy about state of LA as she comments on Spencer Pratt’s campaign,https://nypost.com/2026/06/10/us-news/nithya-raman-blames-voter-frustration-for-spencer-pratts-support-in-la-mayoral-race/
21,2026-06-11-04-04-42 +0000,latimes,"UC Davis favored less qualified Black, Latino med school applicants, Justice Department claims",https://www.latimes.com/california/story/2026-06-10/uc-davis-favored-black-latino-medical-school-applicants-doj-claims
21,2026-06-10-18-01-20 +0000,nyt,Air Canada Pilot Accused of Flying for 17 Years Without Proper License,https://www.nytimes.com/2026/06/09/world/canada/air-canada-pilot-fraud.html
21,2026-06-11-10-00-00 +0000,latimes,"Hiltzik: The right-wing attack on science reaches a nadir, but it could get worse",https://www.latimes.com/business/story/2026-06-11/the-right-wing-attack-on-science-reaches-a-nadir
21,2026-06-10-21-16-03 +0000,nypost,Foreign investment in US surges to $232 billion after four years of declines,https://nypost.com/2026/06/10/business/foreign-investment-in-us-surges-to-232b-after-four-years-of-declines/
21,2026-06-11-16-04-32 +0000,nypost,DOJ charges three with ‘wide-ranging conspiracy’ to smuggle migrant kids to the US,https://nypost.com/2026/06/11/us-news/doj-charges-three-with-wide-ranging-conspiracy-to-smuggle-migrant-kids-to-the-us/
21,2026-06-11-14-43-49 +0000,nypost,Britain’s oldest dancer vows to ‘keep on grooving’ at 100 as his latest viral video hits 1.5M views,https://nypost.com/2026/06/11/world-news/britains-oldest-dancer-vows-to-keep-on-grooving-at-100-as-his-latest-viral-video-hits-1-5m-views/
20,2026-06-11-00-33-00 +0000,wsj,UAW Reaches Tentative Deal to End Strike at Supplier to GM Trucks,https://www.wsj.com/business/autos/uaw-reaches-tentative-deal-to-end-strike-at-supplier-to-gm-trucks-711ecffa?mod=pls_whats_news_us_business_f
20,2026-06-11-00-28-36 +0000,latimes,This creepy insect has been found on grapevines. What it could mean for California's wine industry,https://www.latimes.com/california/story/2026-06-10/authorities-warn-of-invasive-insect-on-california-grapevines
20,2026-06-11-11-31-08 +0000,nyt,Violence in Belfast After Brutal Stabbing Attack: What to Know,https://www.nytimes.com/2026/06/10/world/europe/belfast-attack-riots-what-happened.html
20,2026-06-11-11-28-00 +0000,wsj,"KKR Launches $10 Billion AI Infrastructure Company With Nvidia, Vistra",https://www.wsj.com/finance/investing/kkr-launches-10b-ai-infrastructure-company-with-nvidia-vistra-kuwait-47a8246b?mod=rss_markets_main
20,2026-06-11-00-07-41 +0000,bbc,What we learned from Bill Gates' deposition on Epstein,https://www.bbc.com/news/videos/cly828v3l24o?at_medium=RSS&at_campaign=rss
20,2026-06-11-05-35-25 +0000,bbc,Chinese police detain man after dog torture videos spark outrage,https://www.bbc.com/news/articles/cp3xngy9vvxo?at_medium=RSS&at_campaign=rss
20,2026-06-11-09-41-00 +0000,wsj,Basic Materials Roundup: Market Talk,https://www.wsj.com/business/basic-materials-roundup-market-talk-0d547dbb?mod=rss_markets_main
20,2026-06-11-15-19-30 +0000,nypost,"Pentagon on lockdown, hazmat crews rush in over ‘hazardous materials incident’",https://nypost.com/2026/06/11/us-news/pentagon-on-lockdown-hazmat-crews-rush-in-over-hazardous-materials-incident/
20,2026-06-10-19-35-11 +0000,nypost,Russia recruiting teens to poison Ukrainian servicemen in honeypot trap: police chief,https://nypost.com/2026/06/10/world-news/russia-recruiting-teens-to-poison-ukrainian-servicemen-in-honeypot-trap-police-chief-says/
20,2026-06-11-15-14-50 +0000,nyt,"SpaceX’s IPO Could Turn 4,400 Employees Into Millionaires",https://www.nytimes.com/2026/06/10/technology/spacex-ipo-employee-millionaires.html
20,2026-06-10-21-38-06 +0000,48hills,The wild inside story of San Francisco’s first gay film festival,https://48hills.org/2026/06/the-wild-inside-story-of-san-franciscos-first-gay-film-festival/
20,2026-06-11-14-05-26 +0000,nypost,Painful video shows factory worker falling from factory roof and landing on his crotch: ‘Lucky to be alive’,https://nypost.com/2026/06/11/world-news/painful-video-shows-factory-worker-falling-from-factory-roof-and-landing-on-his-crotch/
19,2026-06-11-14-42-57 +0000,nypost,Storms knock out power in the Midwest and disrupt Chicago flights,https://nypost.com/2026/06/11/us-news/storms-knock-out-power-in-the-midwest-and-disrupt-chicago-flights/
19,2026-06-11-15-11-00 +0000,wsj,U.K. Defense Secretary Quits Over Lack of Military Spending,https://www.wsj.com/world/europe/u-k-defense-secretary-quits-over-lack-of-military-spending-0c64ce1e
19,2026-06-10-21-31-45 +0000,nyt,Hegseth Visits Guantánamo Bay Amid U.S. Tensions With Cuba,https://www.nytimes.com/2026/06/10/us/politics/hegseth-guantanamo-bay-cuba.html
19,2026-06-11-10-10-00 +0000,wsj,Financial Services Roundup: Market Talk,https://www.wsj.com/finance/banking/financial-services-roundup-market-talk-89ed51a1?mod=rss_markets_main
19,2026-06-11-07-32-57 +0000,bbc,Korea fines e-commerce giant $400m over data breach affecting millions,https://www.bbc.com/news/articles/cvgj4rgz2n2o?at_medium=RSS&at_campaign=rss
19,2026-06-11-10-00-00 +0000,latimes,"UFC Freedom 250: What to know about the White House bout, Paramount and the lawsuit",https://www.latimes.com/entertainment-arts/story/2026-06-11/ufc-freedom-250-fight-president-trump-white-house
19,2026-06-11-15-57-31 +0000,nyt,"In Britain, a Violent Cycle: Hateful Attacks, Right-Wing Agitation and Riots",https://www.nytimes.com/2026/06/11/world/europe/northern-ireland-stabbing-immigration.html
19,2026-06-11-08-25-00 +0000,wsj,Wizz Air Withholds Guidance Due to Middle East Conflict,https://www.wsj.com/business/earnings/wizz-air-withholds-guidance-due-to-middle-east-conflict-132bd917?mod=pls_whats_news_us_business_f
19,2026-06-11-01-23-58 +0000,latimes,"Reward jumps to $85,000 in cold-case killing of Altadena 4-year-old shot on a relative's porch",https://www.latimes.com/california/story/2026-06-10/reward-increased-in-cold-case-killing-of-la-county-4-year-old
19,2026-06-11-10-00-00 +0000,latimes,Locke High's grand charter school experiment faces shutdown as LAUSD moves to take back campus,https://www.latimes.com/california/story/2026-06-11/locke-high-school-charter-could-end
19,2026-06-10-22-37-19 +0000,latimes,Crews make progress battling fire at Camp Pendleton; evacuations lifted,https://www.latimes.com/california/story/2026-06-10/november-fire-at-camp-pendleton-prompts-evacuations-near-oceanside
18,2026-06-11-16-04-12 +0000,nyt,Dallas Takes Step Toward Leaving City Hall Building,https://www.nytimes.com/2026/06/11/us/dallas-city-hall-relocation.html
18,2026-06-11-11-50-28 +0000,nypost,5 American cruise passengers busted for Bahamas brawl — including a woman who threw a chair through a window,https://nypost.com/2026/06/11/world-news/five-americans-arrested-after-cruise-ship-brawl-in-the-bahamas/
18,2026-06-11-15-21-34 +0000,nyt,"Medicare Advantage Plans Often Deny Seniors Access to Special Care, Analysis Shows",https://www.nytimes.com/2026/06/11/business/medicare-advantage-nursing-homes.html
18,2026-06-11-13-21-00 +0000,wsj,Erika Kirk Lays Out a Vision for the Conservative Christian Woman,https://www.wsj.com/style/turning-point-usa-womens-summit-erika-kirk-97abb601
18,2026-06-10-20-55-23 +0000,nypost,Cracker Barrel shares surge 23% on upbeat sales forecast as logo controversy fades,https://nypost.com/2026/06/10/business/cracker-barrel-shares-surge-23-on-upbeat-sales-forecast-as-logo-controversy-fades/
