score,pubdate,source,title,link
18,2026-05-10-19-46-41 +0000,nyt,Lebanese Mourn Eight Members of One Family Killed in Israeli Strike,https://www.nytimes.com/2026/05/10/world/middleeast/lebanon-family-funeral-israel-strikes.html
18,2026-05-10-20-13-36 +0000,nypost,New AI office leases stoking hot Manhattan market,https://nypost.com/2026/05/10/business/new-ai-office-leases-stoking-hot-manhattan-market/
18,2026-05-11-02-11-00 +0000,nypost,Hawaiian hailed a hero for beating entitled tourist caught hurling rock at beloved seal ‘Lani’ in viral video,https://nypost.com/2026/05/10/us-news/seattle-tourist-beat-up-by-local-after-viral-video-of-him-tossing-huge-rock-at-endangered-seal/
17,2026-05-10-14-37-43 +0000,bbc,Labour MP challenges ministers to move against Starmer,https://www.bbc.com/news/articles/c362573l4gdo?at_medium=RSS&at_campaign=rss
17,2026-05-10-10-00-00 +0000,latimes,"After exile, California tribes could help oversee ancestral redwoods again",https://www.latimes.com/environment/story/2026-05-10/california-bill-shifts-away-from-logging-toward-tribal-co-management
17,2026-05-11-07-44-04 +0000,bbc,Can Starmer survive as PM? Seven scenarios for what might happen next,https://www.bbc.com/news/articles/cr7pz99l370o?at_medium=RSS&at_campaign=rss
17,2026-05-10-21-53-33 +0000,latimes,Man shot and killed while breaking up fight at Wilmington pizza shop,https://www.latimes.com/california/story/2026-05-10/man-killed-while-trying-to-stop-fight-at-wilmington-pizza-shop
17,2026-05-11-04-03-03 +0000,nypost,6 people found dead inside Texas railroad boxcar,https://nypost.com/2026/05/11/us-news/6-people-found-dead-inside-texas-railroad-boxcar/
17,2026-05-11-00-00-00 +0000,wsj,The Only Thing Harder Than Getting Into College Is Getting Off the Wait List,https://www.wsj.com/us-news/education/college-waitlists-national-decision-day-4cb7b5d8
16,2026-05-10-23-34-47 +0000,bbc,How social media turned Indian film star Vijay into a political force,https://www.bbc.com/news/articles/cj4pn1z8x45o?at_medium=RSS&at_campaign=rss
16,2026-05-10-11-00-00 +0000,wsj,Allison Ellsworth’s Poppi Exit Made Her a Megamillionaire. She’s Ready to Talk Money.,https://www.wsj.com/business/poppi-founder-allison-ellsworth-wsj-money-interview-c0c5d5c9?mod=pls_whats_news_us_business_f
16,2026-05-10-18-09-44 +0000,startribune,Parents of slain Annunciation student pressure Demuth to allow gun bill to move in the House,https://www.startribune.com/parents-of-slain-annunciation-student-pressure-demuth-to-allow-gun-bill-to-move-in-the-house/601839907
16,2026-05-10-18-43-26 +0000,latimes,Crews gain upper hand on fire in downtown L.A. fed by office supplies; firefighter injured,https://www.latimes.com/travel/story/2026-05-10/firefighter-injured-in-blaze-at-downtown-la-office-supplies-store
16,2026-05-10-17-59-42 +0000,nypost,Durst Organization’s 114 West 47th St. getting a glossy new look,https://nypost.com/2026/05/10/business/durst-organizations-114-west-47th-st-getting-a-glossy-new-look/
16,2026-05-10-18-59-55 +0000,nyt,Trial in 2000 Bombing Case Is Delayed Weeks Before It Was Set to Finally Start,https://www.nytimes.com/2026/05/10/us/trial-in-2000-bombing-case-is-delayed-weeks-before-it-was-set-to-finally-start.html
16,2026-05-10-21-23-56 +0000,nypost,Gavin Newsom’s $20M diaper deal torn apart with shocking figures: ‘Peak stupidity’,https://nypost.com/2026/05/10/us-news/gavin-newsoms-20m-diaper-deal-torn-apart-with-shocking-figures/
16,2026-05-10-16-00-00 +0000,wsj,Higher Gas Prices Are Seeping Into the Produce Aisle,https://www.wsj.com/business/logistics/higher-gas-prices-are-seeping-into-the-produce-aisle-0f3579a9?mod=pls_whats_news_us_business_f
16,2026-05-11-03-41-34 +0000,bbc,"Thailand's divisive ex-PM is out of jail, but is the Thaksin era over?",https://www.bbc.com/news/articles/c99l1590kr0o?at_medium=RSS&at_campaign=rss
16,2026-05-11-03-38-29 +0000,nypost,"Georgia teacher, 25, accused of sexually assaulting high school student in classroom closet",https://nypost.com/2026/05/10/us-news/georgia-teacher-25-allegedly-had-sex-with-high-school-student-in-classroom-closet/
16,2026-05-11-02-33-40 +0000,nypost,Dark plot to destroy Spencer Pratt as unions go on brutal ad blitz — and even drop the ‘R’ bomb,https://nypost.com/2026/05/10/us-news/spencer-pratts-details-plans-for-la-as-unions-launch-ad-blitz/
16,2026-05-11-03-56-30 +0000,startribune,Live from Game 4: Anthony Edwards scores 36 points as Timberwolves rally late to beat Spurs 114-109,https://www.startribune.com/live-from-game-4-timberwolves-hope-to-even-playoff-series-with-spurs-at-target-center/601836814
15,2026-05-11-07-58-13 +0000,bbc,Starmer to promise bolder action as leadership threats mount,https://www.bbc.com/news/articles/cjwpq1dg5q3o?at_medium=RSS&at_campaign=rss
15,2026-05-11-02-33-30 +0000,48hills,Looking for trustworthy health info? Here are six sites that cut through the noise,https://48hills.org/2026/05/looking-for-trustworthy-health-info-here-are-six-sites-that-cut-through-the-noise/
15,2026-05-11-01-55-28 +0000,nypost,Desperate LA mayor hopeful drops huge U-turn on key policy that’ll infuriate lefties,https://nypost.com/2026/05/10/us-news/desperate-la-mayor-hopeful-drops-huge-u-turn-on-key-policy-thatll-infuriate-lefties/
15,2026-05-11-01-48-07 +0000,nypost,"Fury as trans volleyball player switches to track and field and dominates, ‘coward’ Newsom told to act",https://nypost.com/2026/05/10/us-news/fury-as-trans-volleyball-player-switches-to-track-and-field-and-dominates/
15,2026-05-10-21-20-35 +0000,nypost,"Kamala Harris, Cory Booker, other Dems push DNC to release its 2024 postmortem",https://nypost.com/2026/05/10/us-news/kamala-harris-cory-booker-other-dems-push-dnc-to-release-its-2024-postmortem/
15,2026-05-10-13-52-57 +0000,bbc,Plaid members belt out anthem on Senedd steps,https://www.bbc.com/news/videos/c7593qw4ggzo?at_medium=RSS&at_campaign=rss
15,2026-05-10-10-00-00 +0000,startribune,Roper: North Oaks sewer debacle illustrates the high cost of urban sprawl,https://www.startribune.com/north-oaks-wastewater-metropolitan-council-twin-cities/601837799
15,2026-05-10-15-00-00 +0000,startribune,"Analysis: In a playoff series loaded with superstars, Wild’s Kirill Kaprizov still stands out",https://www.startribune.com/analysis-in-a-playoff-series-loaded-with-superstars-wilds-kirill-kaprizov-still-stands-out/601836816
14,2026-05-10-09-00-11 +0000,wapo,"Spring in Ukraine means the return of blooms, battles and wartime tourists",https://www.washingtonpost.com/world/2026/05/10/ukraine-war-tourism-increasing/
14,2026-05-10-10-00-00 +0000,latimes,Why Ana Navarro has enough outrage for two TV jobs and a podcast,https://www.latimes.com/entertainment-arts/business/story/2026-05-10/ana-navarro-trump-newsnight-cnn-view-abc
14,2026-05-11-07-53-53 +0000,bbc,BBC tours England and Argentina's World Cup training grounds,https://www.bbc.com/news/videos/clypw107dqzo?at_medium=RSS&at_campaign=rss
14,2026-05-11-07-26-03 +0000,nyt,How Israel Turned Eurovision’s Stage Into a Soft Power Tool,https://www.nytimes.com/2026/05/11/world/europe/eurovision-israel-gaza-netanyahu.html
14,2026-05-11-01-00-00 +0000,wsj,Wichita Is a Rare Mecca of Affordability for America’s New Middle Class,https://www.wsj.com/economy/housing/wichita-kansas-middle-class-affordability-9db486ef
14,2026-05-11-06-05-00 +0000,wsj,Hannover Re Posts Net Profit Increase With Large Losses Below Budget,https://www.wsj.com/business/earnings/hannover-re-posts-net-profit-increase-with-large-losses-below-budget-7f317fce?mod=pls_whats_news_us_business_f
14,2026-05-10-22-59-39 +0000,nyt,Democratic Candidates Scramble in Virginia After Court Tosses Map,https://www.nytimes.com/2026/05/10/us/politics/virginia-democratic-candidates-redistricting.html
14,2026-05-10-23-33-57 +0000,bbc,Why Eurovision's fallout over Israel may change the competition forever,https://www.bbc.com/news/articles/cgkpgm6vk48o?at_medium=RSS&at_campaign=rss
14,2026-05-10-20-12-13 +0000,nyt,"Hiker Killed by Bear at Glacier National Park, Officials Say",https://www.nytimes.com/2026/05/09/us/bear-attack-glacier-national-park.html
14,2026-05-10-19-58-10 +0000,nypost,LAUSD chief Alberto Carvalho breaks cover at San Pedro home after FBI raid,https://nypost.com/2026/05/10/us-news/lausd-chief-alberto-carvalho-seen-for-first-time-since-fbi-raids/
14,2026-05-10-14-11-00 +0000,wsj,Opinion | Venezuela Is No Better Off Under Rodríguez,https://www.wsj.com/opinion/venezuela-is-no-better-off-under-rodriguez-a001881c?mod=pls_whats_news_us_business_f
13,2026-05-11-02-48-53 +0000,bbc,Dua Lipa sues Samsung for $15m over use of her image on TV boxes,https://www.bbc.com/news/articles/ce9pvp210zdo?at_medium=RSS&at_campaign=rss
13,2026-05-11-01-00-00 +0000,wsj,How a Job at OpenAI Became the Greatest Lottery Ticket of the AI Boom,https://www.wsj.com/tech/openai-employee-stock-sales-71ed10bd?mod=pls_whats_news_us_business_f
13,2026-05-10-10-00-00 +0000,latimes,"Big donors backed Harris in 2024. For 2028, they're not so sure",https://www.latimes.com/politics/story/2026-05-10/kamala-harris-president-2028-democrats
13,2026-05-11-01-07-41 +0000,latimes,'How I Met Your Mother' actor Nick Pasqual convicted of attempted murder,https://www.latimes.com/california/story/2026-05-10/how-i-met-your-mother-actor-nick-pasqual-convicted-attempted-murder
12,2026-05-10-19-51-58 +0000,nyt,G.O.P. Fatigue in Iowa Strains the Republican Primary for Governor,https://www.nytimes.com/2026/05/10/us/elections/republican-primary-governor-iowa.html
12,2026-05-10-12-28-54 +0000,bbc,"Tories are still biggest party on the right, claims Cleverly",https://www.bbc.com/news/articles/c7v9778r9q9o?at_medium=RSS&at_campaign=rss
12,2026-05-10-12-20-22 +0000,bbc,Anthony Slaughter: The punk pioneer making Senedd history for the Greens,https://www.bbc.com/news/articles/cz72vq1z2glo?at_medium=RSS&at_campaign=rss
12,2026-05-10-20-01-15 +0000,nyt,One Big Headache for Politicians These Days: a Messy Digital Footprint,https://www.nytimes.com/2026/05/10/us/politics/politicians-old-tweets-controversies.html
12,2026-05-10-15-48-21 +0000,nyt,What’s Happened So Far at the Musk v. OpenAI Trial,https://www.nytimes.com/2026/05/08/business/dealbook/musk-openai-trial.html
12,2026-05-11-05-09-23 +0000,bbc,Council confirms £300 heating oil support,https://www.bbc.com/news/articles/cwy2qw80rqlo?at_medium=RSS&at_campaign=rss
12,2026-05-10-23-28-38 +0000,nypost,Catholic deacon mauled to death by bear left touching final voicemail for dad,https://nypost.com/2026/05/10/us-news/catholic-deacon-mauled-to-death-by-bear-left-touching-final-voicemail-for-dad/
12,2026-05-11-00-39-00 +0000,wsj,Apollo Holds Talks to Sell $3 Billion Private Credit Fund,https://www.wsj.com/finance/investing/apollo-holds-talks-to-sell-3-billion-private-credit-fund-76433c54?mod=rss_markets_main
12,2026-05-10-21-00-00 +0000,startribune,It’s Bike to Work Week. Here’s how to get in on the action in the Twin Cities.,https://www.startribune.com/its-bike-to-work-week-heres-how-to-get-in-on-the-action-in-the-twin-cities/601837059
12,2026-05-10-09-02-09 +0000,nyt,What to Do About the White House Correspondents Dinner After an Attack?,https://www.nytimes.com/2026/05/10/us/politics/white-house-trump-dinner.html
11,2026-05-10-10-00-00 +0000,startribune,‘The system is not working’: Minnesota’s hospitals are among least charitable in nation,https://www.startribune.com/minnesota-nonprofit-hospital-charity-care-medical-debt/601488936
11,2026-05-10-13-30-37 +0000,nyt,Sales Are Up. Celebrities Are In. Is Gap Officially Back?,https://www.nytimes.com/2026/05/10/business/richard-dickson-gap.html
11,2026-05-10-14-36-23 +0000,nyt,Retirees Expect Their Home to Be a Financial Safety Net. They Shouldn’t.,https://www.nytimes.com/2026/05/09/business/retirement-home-equity-selling-your-house.html
11,2026-05-10-09-00-53 +0000,wapo,She fled genital mutilation in Togo. The U.S. deported her.,https://www.washingtonpost.com/world/2026/05/10/trump-third-country-deportations-ghana-togo/
11,2026-05-10-21-00-00 +0000,startribune,"For the Frost, a marathon week and year of hockey comes down to a deciding Game 5",https://www.startribune.com/for-the-frost-a-marathon-week-and-year-of-hockey-comes-down-to-a-deciding-game-5/601839466
11,2026-05-10-20-19-39 +0000,wapo,"Abraham Foxman, influential leader of Anti-Defamation League, dies at 86",https://www.washingtonpost.com/obituaries/2026/05/10/abraham-foxman-anti-defamation-league-dead/
11,2026-05-10-23-34-59 +0000,bbc,Cyber-crime increasingly coming with threats of physical violence,https://www.bbc.com/news/articles/cr71d8vyjv0o?at_medium=RSS&at_campaign=rss
11,2026-05-11-00-57-13 +0000,nyt,"6 Bodies Found in a Boxcar in Texas, Officials Say",https://www.nytimes.com/2026/05/10/us/dead-bodies-boxcar-texas.html
11,2026-05-11-07-27-18 +0000,nyt,How to Win Eurovision With Just a Few Hundred Voters,https://www.nytimes.com/2026/05/11/world/europe/eurovision-israel-votes.html
11,2026-05-11-04-42-06 +0000,nyt,A One-Party India,https://www.nytimes.com/2026/05/10/world/india-modi-elections-trump-iran-proposal.html
11,2026-05-10-23-12-52 +0000,nypost,Iranian heiress’s sneaky tactic to shield millions from husband in bitter $200M divorce battle,https://nypost.com/2026/05/10/us-news/seterah-bral-and-dr-ryan-aronins-200-million-divorce-gets-uglier/
11,2026-05-10-17-10-36 +0000,nypost,Real estate execs still in on Park Ave. project to be anchored by Ken Griffin’s Citadel,https://nypost.com/2026/05/10/business/real-estate-execs-still-in-on-park-ave-project-to-be-anchored-by-ken-griffins-citadel/
11,2026-05-10-18-24-21 +0000,nyt,"After Stumbles, Technology Meant for Self-Driving Cars Finds a Second Act",https://www.nytimes.com/2026/05/07/business/autonomous-vehicles-technology-other-uses.html
10,2026-05-11-07-04-00 +0000,wsj,Prosus Sells Part of Delivery Hero Stake to Aspex Management for About $395 Million,https://www.wsj.com/business/deals/prosus-sells-part-of-delivery-hero-stake-to-aspex-management-for-about-395-million-ca9f0183?mod=pls_whats_news_us_business_f
10,2026-05-10-23-33-43 +0000,bbc,"No summer border delays for Brits, Greek tourism minister says",https://www.bbc.com/news/articles/cn5pxyr9xr7o?at_medium=RSS&at_campaign=rss
10,2026-05-10-17-55-00 +0000,latimes,Earthquake swarm shakes Imperial County with 4.7 magnitude quake reported,https://www.latimes.com/california/story/2026-05-10/earthquake-swarm-shakes-imperial-county-magnitude-4-7-quake-reported
10,2026-05-10-13-26-57 +0000,nyt,Strait of Hormuz Remains Effectively Blocked After Naval Skirmishes,https://www.nytimes.com/2026/05/09/world/middleeast/strait-hormuz-ships-blockade-us-iran.html
10,2026-05-10-23-08-39 +0000,nyt,Consumers Lean on a ‘Hamster Wheel’ of Credit to Manage Rising Costs,https://www.nytimes.com/2026/05/10/business/consumers-credit-inflation-costs.html
10,2026-05-11-00-01-32 +0000,wapo,Sports-mad Portland savors its second chance to root for women’s basketball,https://www.washingtonpost.com/nation/2026/05/10/portland-fire-wnba-fans/
10,2026-05-10-23-35-14 +0000,bbc,New laws expected to be in the King's Speech,https://www.bbc.com/news/articles/c2324yp7ygyo?at_medium=RSS&at_campaign=rss
10,2026-05-10-10-40-51 +0000,nyt,How Brandeis Is Trying to Change College Shopping,https://www.nytimes.com/2026/05/10/your-money/brandeis-college-cost-faye.html
10,2026-05-10-09-30-00 +0000,wsj,IMAX Has a Front-Row Seat to the Box Office Recovery,https://www.wsj.com/business/media/imax-has-a-front-row-seat-to-the-box-office-recovery-1e024a3f?mod=rss_markets_main
9,2026-05-10-14-29-45 +0000,bbc,Dress made from 500 loaves stuns African film awards,https://www.bbc.com/news/articles/c4g0d3d5zn4o?at_medium=RSS&at_campaign=rss
8,2026-05-10-09-30-00 +0000,wsj,Fortress Co-Founder Allegedly Extorted by Sexual Partner,https://www.wsj.com/us-news/law/fortress-co-founder-allegedly-extorted-by-sexual-partner-ee9d6666
8,2026-05-11-02-00-00 +0000,wsj,Private Credit’s Hot Streak Is Over,https://www.wsj.com/finance/investing/private-credits-hot-streak-is-over-aa9acfc1?mod=rss_markets_main
8,2026-05-10-15-58-00 +0000,wsj,Opinion | Race and the Virginia Gerrymander,https://www.wsj.com/opinion/race-and-the-virginia-gerrymander-6ac52f2a
8,2026-05-10-19-16-05 +0000,nyt,Britain’s Electorate Is ‘Splintering.’ Can Its System Stand the Strain?,https://www.nytimes.com/2026/05/09/world/europe/britain-elections-starmer-labour-reform.html
7,2026-05-10-10-59-47 +0000,nyt,Putin’s Forces Are Barely Inching Along on the Battlefield,https://www.nytimes.com/2026/05/10/world/europe/russia-ukraine-putin-war.html
7,2026-05-10-17-46-43 +0000,bbc,Councillor under investigation over racism allegations,https://www.bbc.com/news/articles/cm2pyy6ngz0o?at_medium=RSS&at_campaign=rss
7,2026-05-10-19-04-13 +0000,bbc,How hotels are stopping the 'dawn dash' for sunbeds after man wins payout,https://www.bbc.com/news/articles/c99l17m2ep9o?at_medium=RSS&at_campaign=rss
7,2026-05-10-17-13-53 +0000,nyt,A Monument to Chocolate Is Wrapped in Layers of Mexican History,https://www.nytimes.com/2026/05/10/arts/design/mexico-chocolate-museum.html
7,2026-05-10-15-07-29 +0000,nyt,U.S. Marines Take a Crash Course in Drone Warfare,https://www.nytimes.com/video/us/100000010875623/us-marines-drones-war-training.html
6,2026-05-11-02-53-51 +0000,startribune,Flooding expected in parts of Boundary Waters,https://www.startribune.com/boundary-waters-ely-spring-flooding/601840843
6,2026-05-10-14-32-31 +0000,bbc,Beatles' early years drama starts filming in Germany,https://www.bbc.com/news/articles/cy9208lwgngo?at_medium=RSS&at_campaign=rss
6,2026-05-10-11-29-30 +0000,nyt,The Man Who Cuts the Perfect Slice of Ham,https://www.nytimes.com/2026/05/10/world/europe/jamon-iberico-perfect-slice.html
6,2026-05-10-20-02-00 +0000,wsj,Opinion | Is Ukraine Turning the Russian Tide?,https://www.wsj.com/opinion/is-ukraine-turning-the-russian-tide-420e044e
6,2026-05-10-17-59-00 +0000,wsj,Opinion | All the Good From Goodwill,https://www.wsj.com/opinion/all-the-good-from-goodwill-196437bd
5,2026-05-10-19-08-35 +0000,nyt,How Pope Leo Is Shaping the U.S. Church,https://www.nytimes.com/2026/05/10/us/pope-leo-bishops.html
5,2026-05-10-20-00-00 +0000,wsj,Opinion | Hochul Opts In to Choice Scholarships,https://www.wsj.com/opinion/hochul-opts-in-to-choice-scholarships-bccafc8d
5,2026-05-10-10-02-39 +0000,nyt,Why Antiwar Protesters Are Rallying in Japan,https://www.nytimes.com/2026/05/09/world/asia/japan-antiwar-protests-constitution.html
5,2026-05-10-14-10-00 +0000,wsj,Opinion | The U.N.’s Plan for Reducing Airline Emissions Is Flawed,https://www.wsj.com/opinion/the-u-n-s-plan-for-reducing-airline-emissions-is-flawed-ef1ec6e5?mod=pls_whats_news_us_business_f
5,2026-05-10-17-58-00 +0000,wsj,Opinion | Why Argentina’s Comeback Has Stalled,https://www.wsj.com/opinion/why-argentinas-comeback-has-stalled-370399ac
5,2026-05-10-17-56-00 +0000,wsj,Opinion | Behind the Boom in Psychiatric Medication,https://www.wsj.com/opinion/behind-the-boom-in-psychiatric-medication-708235a0
4,2026-05-10-10-46-21 +0000,nyt,Why Some People Are Allergic to ‘Peanut Butter Raises’,https://www.nytimes.com/2026/05/10/business/peanut-butter-raises.html
3,2026-05-10-20-01-00 +0000,wsj,Opinion | An Ethanol Extortion Play,https://www.wsj.com/opinion/ethanol-farm-bill-renewable-fuel-standard-donald-trump-congress-23f77f7d
3,2026-05-10-16-53-26 +0000,nyt,Is This Telescope a Threat to U.S. Security?,https://www.nytimes.com/video/world/americas/100000010873671/is-this-telescope-a-threat-to-us-security.html
2,2026-05-10-13-00-00 +0000,missionlocal,Penthouse apartment,https://missionlocal.org/2026/05/penthouse-apartment/
