score,pubdate,source,title,link
17,2026-03-20-07-06-00 +0000,wsj,"Rupee, Most Other Asian Currencies Weaken on Economic Growth Worries",https://www.wsj.com/articles/rupee-most-other-asian-currencies-weaken-on-economic-growth-worries-fe935f8c
17,2026-03-20-16-42-51 +0000,wapo,"Calvin Tomkins, who narrated the rise of contemporary art, dies at 100",https://www.washingtonpost.com/obituaries/2026/03/20/calvin-tomkins-new-yorker-writer-dies-at-100/
17,2026-03-20-18-46-36 +0000,latimes,San Diego County agency selling water to keep its high rates in check,https://www.latimes.com/environment/story/2026-03-20/san-diego-county-water-deal
17,2026-03-20-08-00-00 +0000,cbc,Refugee family faces separation as father and son ordered deported from Canada,https://www.cbc.ca/news/canada/refugee-family-separation-9.7134573?cmp=rss
17,2026-03-20-11-53-00 +0000,wsj,"XPeng Posts First-Ever Profit on Strong Sales, Margins",https://www.wsj.com/business/earnings/xpeng-posts-first-ever-profit-on-strong-sales-margins-6394a66c?mod=pls_whats_news_us_business_f
17,2026-03-20-09-35-00 +0000,nypost,Gold IRA storage explained: What you’re paying for and what to verify,https://nypost.com/business/gold-ira-storage-explained/
16,2026-03-20-12-44-00 +0000,wsj,UBS Secures Bank License for Its Campaign to Expand U.S. Wealth Arm,https://www.wsj.com/finance/banking/ubs-secures-bank-license-for-its-campaign-to-expand-u-s-wealth-arm-0438a386?mod=rss_markets_main
16,2026-03-20-09-03-14 +0000,nyt,Record Number of Student Loan Borrowers Are in Delinquency and Default,https://www.nytimes.com/2026/03/20/business/student-loan-deliquency-default.html
16,2026-03-20-23-44-09 +0000,bbc,"Elon Musk misled Twitter investors, jury finds",https://www.bbc.com/news/articles/c62j3yl842eo?at_medium=RSS&at_campaign=rss
16,2026-03-20-12-00-48 +0000,wapo,"Grandpa, 101, goes viral from pottery class: ‘Happiest guy in the world’",https://www.washingtonpost.com/lifestyle/2026/03/20/viral-grandpa-george-pottery-tiktok/
16,2026-03-21-01-50-47 +0000,nyt,Cuba Power Outages and Flight Cancellations: What Travelers Need to Know in 2026,https://www.nytimes.com/2026/03/20/travel/cuba-flights-travel-advice-power-oil.html
16,2026-03-20-18-46-35 +0000,nypost,Amazon plans smartphone comeback more than a decade after Fire Phone flop,https://nypost.com/2026/03/20/business/amazon-plans-smartphone-comeback-more-than-a-decade-after-fire-phone-flop/
16,2026-03-20-15-50-23 +0000,missionlocal,‘Monet and Venice’ at de Young makes bold claim about artist’s fame,https://missionlocal.org/2026/03/monet-and-venice-and-de-young/
16,2026-03-20-18-55-33 +0000,bbc,Starmer most popular PM - in Toby Jug sales,https://www.bbc.com/news/articles/cp385808jk2o?at_medium=RSS&at_campaign=rss
16,2026-03-20-16-57-26 +0000,nypost,Cuban exiles in Miami say ‘this is the end’ for communism as island teeters on collapse,https://nypost.com/2026/03/20/world-news/cuban-exiles-in-miami-say-this-is-the-end-for-communism-as-island-teeters-on-collapse/
16,2026-03-20-18-47-21 +0000,bbc,Farage 'will fight' Essex council reorganisation,https://www.bbc.com/news/articles/c9d41ne6dx1o?at_medium=RSS&at_campaign=rss
16,2026-03-20-23-31-17 +0000,nyt,700 Dogs and Cats Are Rescued in Animal Cruelty Raid in Los Angeles County,https://www.nytimes.com/2026/03/20/us/700-dogs-cats-rescued-los-angeles-county.html
16,2026-03-20-17-53-49 +0000,nyt,"In This Crisis, the Best Investors Can Expect From the Fed Is Nothing",https://www.nytimes.com/2026/03/19/business/federal-reserve-iran-inflation-recession.html
16,2026-03-20-12-58-00 +0000,wsj,Cheapest Car Insurance Companies 2026,https://www.wsj.com/buyside/personal-finance/auto-insurance/cheapest-car-insurance
16,2026-03-20-15-05-00 +0000,wsj,Canada Retail Sales Look to Build on January’s 1.1% Rise,https://www.wsj.com/business/retail/canada-retail-sales-rose-1-1-in-january-c5e5802f?mod=pls_whats_news_us_business_f
15,2026-03-21-02-11-56 +0000,missionlocal,Hundreds ordered deported in absentia at S.F. immigration court,https://missionlocal.org/2026/03/san-francisco-immigration-court-in-absentia-deportations/
15,2026-03-20-18-18-57 +0000,nypost,Uganda reintroduces rhinos into a protected area after they were poached to near-extinction,https://nypost.com/2026/03/20/world-news/uganda-reintroduces-rhinos-into-a-protected-area-after-they-were-poached-to-near-exctinction/
15,2026-03-20-05-50-23 +0000,nyt,"Patriarch Ilia II, a Spiritual Symbol of Stability in Georgia, Dies at 93",https://www.nytimes.com/2026/03/19/world/europe/patriarch-ilia-ii-dead.html
15,2026-03-20-18-04-36 +0000,startribune,Momentum is growing to curtail data center secrecy in Minnesota. Some fear it could hurt development.,https://www.startribune.com/momentum-is-growing-to-curtail-data-center-secrecy-in-minnesota-some-fear-it-could-hurt-development/601597294
15,2026-03-20-15-52-35 +0000,nypost,American tourist detained after being in public during Bali shutdown,https://nypost.com/2026/03/20/world-news/american-tourist-detained-after-being-in-public-during-bali-shutdown/
15,2026-03-20-15-22-24 +0000,nypost,"Hidden, art-filled cloister in the center of Rome reveals a tumultuous past",https://nypost.com/2026/03/20/world-news/a-hidden-art-filled-cloister-in-the-center-of-rome-reveals-a-tumultuous-past/
15,2026-03-20-20-34-00 +0000,wsj,Opinion | When McDonald’s Was an Inexpensive Treat,https://www.wsj.com/opinion/when-mcdonalds-was-an-inexpensive-treat-01a2cfc2
15,2026-03-20-09-00-08 +0000,nyt,Blood Plasma Centers Move Into More Middle-Class Neighborhoods,https://www.nytimes.com/2026/03/20/business/middle-class-sell-their-plasma.html
15,2026-03-20-23-51-14 +0000,missionlocal,South of Market stabbing victim identified,https://missionlocal.org/2026/03/sf-soma-plaza-apartments-stabbing/
15,2026-03-20-14-14-58 +0000,bbc,"'Multiple factors' caused 2025 Spain and Portugal blackout, says report",https://www.bbc.com/news/articles/cvg0r3z3lvqo?at_medium=RSS&at_campaign=rss
15,2026-03-20-15-00-00 +0000,wsj,"Biometrics Sounds Cool—and Safe. Maybe, but Read This First",https://www.wsj.com/tech/cybersecurity/biometrics-risk-81912c30?mod=rss_markets_main
15,2026-03-20-19-21-29 +0000,startribune,Jane Fonda and Joan Baez coming to No Kings Twin Cities protest,https://www.startribune.com/jane-fonda-joan-baez-maggie-rogers-at-no-kings-twin-cities/601619178
15,2026-03-20-20-31-29 +0000,missionlocal,"Jay’s Cheesesteak, institution on 21st St., set to close at the end of the month",https://missionlocal.org/2026/03/jays-cheesesteak-closed-mission-valencia/
14,2026-03-20-12-41-45 +0000,bbc,Reform-led council approves councillor wage rise,https://www.bbc.com/news/articles/cwy35k5x5d3o?at_medium=RSS&at_campaign=rss
14,2026-03-20-10-00-00 +0000,nypost,Palantir CTO says artificial intelligence is key to reshoring American manufacturing,https://nypost.com/2026/03/20/business/palantir-cto-says-artificial-intelligence-is-key-to-reshoring-american-manufacturing/
14,2026-03-20-23-44-00 +0000,wsj,"Elon Musk Is Liable for Some Twitter Investors’ Losses, Jury Says",https://www.wsj.com/tech/elon-musk-is-liable-for-some-twitter-investors-losses-jury-says-4b0c10a3?mod=pls_whats_news_us_business_f
14,2026-03-20-21-49-25 +0000,nyt,Hegseth Invokes Divine Purpose to Justify Military Might,https://www.nytimes.com/2026/03/20/us/politics/hegseth-christianity-military.html
14,2026-03-20-15-30-58 +0000,bbc,Publisher cancels horror novel's release over AI claims,https://www.bbc.com/news/articles/c5y9d44jj24o?at_medium=RSS&at_campaign=rss
14,2026-03-20-20-06-02 +0000,startribune,Reusse: Spotlight on Gophers women’s sports is a welcome sight,https://www.startribune.com/minnesota-gophers-basketball-hockey-march-madness-abbey-murphy-patrick-reusse/601615301
14,2026-03-20-20-02-00 +0000,wsj,Brent Crude Closes Out Volatile Week Higher,https://www.wsj.com/finance/commodities-futures/oil-falls-amid-prospects-of-removal-of-u-s-sanctions-on-iranian-oil-at-sea-d63c9037?mod=rss_markets_main
14,2026-03-20-23-23-14 +0000,missionlocal,"Opposing fan kicked El Farolito striker’s toddler, sparking bleacher fight, players say",https://missionlocal.org/2026/03/opposing-fan-kicked-el-farolito-strikers-toddler-sparking-bleacher-fight-players-say/
14,2026-03-20-18-31-20 +0000,nyt,Supreme Court Allows Street Preacher’s Lawsuit,https://www.nytimes.com/2026/03/20/us/politics/supreme-court-street-preacher.html
14,2026-03-20-17-29-39 +0000,bbc,Watch timelapse of Artemis II rocket rollout to launch pad,https://www.bbc.com/news/videos/cx2wnxjvlxqo?at_medium=RSS&at_campaign=rss
14,2026-03-20-07-20-38 +0000,bbc,"I want to hold balance of power at next general election, says Zack Polanski",https://www.bbc.com/news/articles/cvg05xrgkg6o?at_medium=RSS&at_campaign=rss
14,2026-03-20-07-58-00 +0000,wsj,Dollar Edges Higher After Previous Day’s Falls,https://www.wsj.com/finance/currencies/asia-currencies-consolidate-as-traders-assess-mideast-developments-53801672?mod=rss_markets_main
14,2026-03-20-16-32-43 +0000,bbc,Nasa's Artemis Moon rocket rolls back to pad for possible April launch,https://www.bbc.com/news/articles/ckgrw045pg7o?at_medium=RSS&at_campaign=rss
13,2026-03-20-16-00-00 +0000,wsj,Fast Food’s Math Problem: Making Burgers Cheap With Beef at Records,https://www.wsj.com/business/hospitality/fast-food-chains-rush-to-offer-discounts-even-as-beef-prices-soar-cf4a9c47?mod=pls_whats_news_us_business_f
13,2026-03-20-18-42-50 +0000,nypost,Employer must pay $22.5M after newborn died in mother’s arms following work-from-home denial,https://nypost.com/2026/03/20/business/ohio-jury-awards-22-5m-after-newborn-died-in-mothers-arms-following-work-from-home-denial/
13,2026-03-20-16-18-06 +0000,nyt,"BTS Is Back With ‘Arirang,’ but the K-Pop Landscape Has Changed",https://www.nytimes.com/2026/03/20/arts/music/bts-k-pop-industry-demon-hunters.html
13,2026-03-20-18-59-03 +0000,nyt,"Shigeaki Mori, Hiroshima Survivor Photographed With Obama, Dies at 88",https://www.nytimes.com/2026/03/20/world/asia/shigeaki-mori-dead.html
13,2026-03-20-19-34-17 +0000,nyt,U.S. Dispatches Marines and Warships to Middle East,https://www.nytimes.com/2026/03/20/world/middleeast/us-marines-persian-gulf-iran-deploy.html
13,2026-03-21-02-05-14 +0000,nyt,San Francisco Driver Gets Probation After Killing a Family of 4,https://www.nytimes.com/2026/03/20/us/san-francisco-crash-sentence.html
13,2026-03-20-15-28-18 +0000,nyt,Pregnant in ICE Detention: Handcuffs and Pleas for Medical Care,https://www.nytimes.com/2026/03/20/us/politics/pregnant-women-ice-detention.html
13,2026-03-20-10-03-00 +0000,wsj,Smiths Group Leads FTSE 100 Fallers as It Issues Slightly Light Outlook,https://www.wsj.com/business/smiths-group-to-return-extra-2-billion-to-shareholders-ce043b7a?mod=pls_whats_news_us_business_f
13,2026-03-21-01-12-24 +0000,nyt,How Geopolitics Threaten K-Pop’s Ambitions in China,https://www.nytimes.com/2026/03/20/world/asia/k-pop-china-japan-south-korea.html
13,2026-03-20-21-29-00 +0000,wsj,Eight States Seek Restraining Order to Stop $6.2 Billion Nexstar-Tegna Combination,https://www.wsj.com/business/media/eight-states-seek-restraining-order-to-stop-6-2-billion-nexstar-tegna-combination-e7f252cd?mod=pls_whats_news_us_business_f
12,2026-03-20-14-14-20 +0000,bbc,Car stolen with two-month-old baby inside,https://www.bbc.com/news/articles/cy91eg3zl9go?at_medium=RSS&at_campaign=rss
12,2026-03-20-23-29-10 +0000,nyt,Here’s the latest.,https://www.nytimes.com/live/2026/03/20/world/iran-war-oil-trump/heres-the-latest
12,2026-03-20-07-48-00 +0000,wsj,Unilever in Talks to Separate Food Business and Combine It With McCormick,https://www.wsj.com/business/deals/unilever-in-talks-to-separate-food-business-and-combine-it-with-mccormick-212091ae?mod=pls_whats_news_us_business_f
12,2026-03-20-23-00-00 +0000,wsj,The Threats and Bare-Knuckle Tactics of MAGA’s Top Antitrust Fixer,https://www.wsj.com/us-news/law/lobbyists-antitrust-trump-davis-f6a02e04
12,2026-03-20-09-30-00 +0000,wsj,It’s One of the Hottest Tables in America—and It’s a College Dining Hall,https://www.wsj.com/us-news/education/its-one-of-the-hottest-tables-in-americaand-its-a-college-dining-hall-c52668df
12,2026-03-21-00-52-49 +0000,nyt,The Road to the Battle of Hastings in 1066? Maybe Not a Road After All.,https://www.nytimes.com/2026/03/20/world/europe/harold-1066-forced-march-ship-hastings.html
12,2026-03-20-09-14-51 +0000,bbc,Labour MPs threaten vote to show opposition to Mahmood's migration plans,https://www.bbc.com/news/articles/cy514kv2vzro?at_medium=RSS&at_campaign=rss
12,2026-03-20-15-30-00 +0000,startribune,Hostile parents relations led Minnesota hockey coach to resign in Cloquet,https://www.startribune.com/cloqueteskocarltons-girls-hockey-coach-kennedy-weets/601616040
12,2026-03-20-19-04-37 +0000,cbc,Randy Hillier's convoy case back on after stay of charges overturned,https://www.cbc.ca/news/canada/ottawa/randy-hillier-freedom-convoy-charge-trial-appeal-9.7136585?cmp=rss
12,2026-03-20-19-17-55 +0000,cbc,National Defence confirms Canadians on exchange with U.S. not deployed to Gulf,https://www.cbc.ca/news/politics/canadian-armed-forces-exchange-middle-east-iran-9.7136613?cmp=rss
12,2026-03-20-14-52-00 +0000,wsj,How Keeping Private Credit Safe Became Iowa’s Problem,https://www.wsj.com/finance/how-keeping-private-credit-safe-became-iowas-problem-dd49febb?mod=rss_markets_main
12,2026-03-20-16-00-00 +0000,wsj,Project ‘Buff Baby’ Transformed a Huggies Diaper. Now It Could Change the Way We Shop.,https://www.wsj.com/business/retail/inside-the-buff-baby-project-that-questioned-everything-about-diapersand-how-we-shop-0e54571e?mod=pls_whats_news_us_business_f
12,2026-03-20-18-52-00 +0000,wsj,Gold Settles With Largest Weekly Dollar Decline on Record,https://www.wsj.com/finance/commodities-futures/gold-edges-lower-on-inflation-concerns-dimmed-fed-rate-cut-hopes-1d2392c7?mod=rss_markets_main
12,2026-03-20-16-52-19 +0000,nyt,White House Unveils A.I. Policy Aimed at Blocking State Laws,https://www.nytimes.com/2026/03/20/us/politics/white-house-unveils-ai-policy-aimed-at-blocking-state-laws.html
12,2026-03-20-17-34-00 +0000,wsj,"Prestige Consumer Healthcare to Buy Breathe Right, Other Brands for $1.045 Billion",https://www.wsj.com/articles/prestige-consumer-healthcare-to-buy-breathe-right-other-brands-for-1-045-billion-d58024cf?mod=pls_whats_news_us_business_f
12,2026-03-20-17-41-00 +0000,wsj,Opinion | The U.S. Ammo Shortage Is Worse Than You Think,https://www.wsj.com/opinion/the-u-s-ammo-shortage-is-worse-than-you-think-97096193
12,2026-03-20-15-44-00 +0000,wsj,Banks Ready to Put Billions to Work After Regulatory Win,https://www.wsj.com/finance/banking/banks-ready-to-put-billions-to-work-after-regulatory-win-87ec4b85?mod=rss_markets_main
12,2026-03-20-17-43-11 +0000,bbc,Hottest March temperature in US history recorded in Arizona,https://www.bbc.com/news/articles/cj40xgv5vpdo?at_medium=RSS&at_campaign=rss
12,2026-03-20-13-17-56 +0000,bbc,Leading anti‑racism activist in Tunisia jailed for eight years,https://www.bbc.com/news/articles/clyjg1x7r43o?at_medium=RSS&at_campaign=rss
11,2026-03-20-04-13-07 +0000,bbc,US deports Singaporean vlogger convicted of child sex offences,https://www.bbc.com/news/articles/cj40xekver1o?at_medium=RSS&at_campaign=rss
11,2026-03-20-19-47-51 +0000,nyt,Stone Fragment Is Found in Wreck of Ship That Carried Parthenon Marbles,https://www.nytimes.com/2026/03/20/world/europe/ship-parthenon-greece-marbles-elgin.html
11,2026-03-20-15-42-00 +0000,wsj,Opinion | There’s No Judicial Climate Science Scandal,https://www.wsj.com/opinion/theres-no-judicial-climate-science-scandal-ebfaebf0
11,2026-03-20-16-40-51 +0000,nyt,A Meningitis Outbreak at the University of Kent Evokes Covid Memories,https://www.nytimes.com/2026/03/20/world/europe/meningitis-outbreak-canterbury-university-of-kent.html
11,2026-03-21-01-32-57 +0000,nypost,Eric Swalwell demands utility crackdown — but cashed $113K in PG&E checks,https://nypost.com/2026/03/20/us-news/eric-swalwell-pocketed-100k-from-pgampe-as-it-jacked-up-rates/
11,2026-03-20-18-19-00 +0000,wsj,Why Mayo and Soap No Longer Mix for Unilever,https://www.wsj.com/business/retail/why-mayo-and-soap-no-longer-mix-for-unilever-17445725?mod=pls_whats_news_us_business_f
11,2026-03-20-19-50-38 +0000,missionlocal,Tenderloin Buzz: Eid festival returns to Golden Gate avenue,https://missionlocal.org/2026/03/sf-eid-festival-tenderloin-returns/
10,2026-03-20-17-42-00 +0000,wsj,Corporate America Finally Reveals (Some of) Its Tax Secrets,https://www.wsj.com/business/nvidia-corporate-tax-disclosures-1621b927?mod=pls_whats_news_us_business_f
10,2026-03-20-06-15-10 +0000,bbc,School uniform reuse scheme launches in London,https://www.bbc.com/news/articles/c8ejrr7n50jo?at_medium=RSS&at_campaign=rss
10,2026-03-20-17-44-22 +0000,bbc,Hargreaves Lansdown says IT issues which affected thousands are over,https://www.bbc.com/news/articles/cx2reyjdyjzo?at_medium=RSS&at_campaign=rss
10,2026-03-20-23-45-07 +0000,nypost,Reigning NBA champion Thunder skipping White House visit,https://nypost.com/2026/03/20/sports/reigning-nba-champion-thunder-skipping-white-house-visit/
10,2026-03-20-19-04-11 +0000,nyt,What to Know About This Year’s Cherry Blossom Blooms,https://www.nytimes.com/2026/03/20/us/cherry-blossoms-washington-dc-new-york.html
10,2026-03-20-20-16-00 +0000,wsj,U.S. Stocks Suffer Fourth Straight Week of Declines,https://www.wsj.com/finance/stocks/oil-pulls-back-from-highs-as-leaders-seek-to-calm-markets-d6dd600c?mod=rss_markets_main
10,2026-03-20-09-00-41 +0000,wapo,Hezbollah is bombing northern Israel again. Residents are staying put.,https://www.washingtonpost.com/world/2026/03/20/northern-israel-no-evacuation-hezbollah/
10,2026-03-21-00-25-07 +0000,bbc,The fight to control the narrative in the Afghan-Pakistan conflict,https://www.bbc.com/news/articles/c5yxkj8gnr2o?at_medium=RSS&at_campaign=rss
10,2026-03-20-16-02-50 +0000,bbc,Israel strikes Syria after Druze clashes,https://www.bbc.com/news/articles/c248pgn158go?at_medium=RSS&at_campaign=rss
10,2026-03-20-15-54-39 +0000,cbc,IN PHOTOS | Celebrating Eid al-Fitr,https://www.cbc.ca/news/world/in-photos-celebrating-eid-al-fitr-9.7132099?cmp=rss
9,2026-03-20-22-36-13 +0000,bbc,"As Islamophobia rises, Australia's Muslims celebrate Eid",https://www.bbc.com/news/articles/cr410ezy312o?at_medium=RSS&at_campaign=rss
9,2026-03-20-10-48-05 +0000,bbc,Nigel Farage criticised for calling Welsh people 'foreign speakers',https://www.bbc.com/news/articles/c8xyxje7n29o?at_medium=RSS&at_campaign=rss
9,2026-03-20-21-32-00 +0000,wsj,Opinion | Late Mail Ballots at the Supreme Court,https://www.wsj.com/opinion/mail-ballots-supreme-court-mississippi-federal-elections-0c0fc65a
9,2026-03-20-18-56-04 +0000,nyt,‘Saturday Night Live’ Arrives in London,https://www.nytimes.com/2026/03/20/arts/television/saturday-night-live-london-uk.html
9,2026-03-20-15-20-57 +0000,bbc,Record-breaking heatwave hits the US West,https://www.bbc.com/news/videos/c9d413gd74do?at_medium=RSS&at_campaign=rss
9,2026-03-20-17-03-48 +0000,bbc,Border security chief to step down after 18 months in the job,https://www.bbc.com/news/articles/cx2dn1x9l3jo?at_medium=RSS&at_campaign=rss
8,2026-03-20-09-04-18 +0000,nyt,Can Jonah Peretti Save BuzzFeed From Extinction?,https://www.nytimes.com/2026/03/20/business/media/buzzfeed-jonah-peretti-ai-future.html
8,2026-03-20-10-00-00 +0000,nypost,This is the latest sign of a quiet crypto revolution,https://nypost.com/2026/03/20/business/blackrock-launches-ethereum-exchange-traded-fund/
8,2026-03-20-10-00-00 +0000,latimes,Contributor: A Democratic takeover of the Senate is now imaginable,https://www.latimes.com/opinion/story/2026-03-20/democrats-midterms-senate-control
8,2026-03-20-09-30-00 +0000,wsj,How Stagflation Puts Banks in a Vise,https://www.wsj.com/finance/banking/how-stagflation-puts-banks-in-a-vise-00196a7b?mod=rss_markets_main
7,2026-03-20-19-32-14 +0000,nyt,Mullin Said to Have Credited the King of Jordan for a Helicopter Rescue,https://www.nytimes.com/2026/03/20/us/politics/markwayne-mullin-dhs-helicopter-rescue.html
7,2026-03-20-20-35-00 +0000,wsj,Opinion | Why Won’t Mamdani Take On Educational Redlining?,https://www.wsj.com/opinion/why-wont-mamdani-take-on-educational-redlining-2c8bdecf
7,2026-03-20-17-42-00 +0000,wsj,Opinion | The Economics of Regulating AI,https://www.wsj.com/opinion/the-economics-of-regulating-ai-7773e722?mod=pls_whats_news_us_business_f
7,2026-03-20-20-57-00 +0000,wsj,"Heavy Rains Flood Oahu, Threatening Wahiawa Dam",https://www.wsj.com/us-news/hawaii-flood-oahu-evacuation-24997621
6,2026-03-20-10-13-20 +0000,bbc,NI households set for £30 electricity reduction in July,https://www.bbc.com/news/articles/c3v6x1x7pd3o?at_medium=RSS&at_campaign=rss
6,2026-03-20-05-05-11 +0000,nyt,The Downfall of a Food Icon,https://www.nytimes.com/2026/03/19/world/noma-restaurant-iran-oil-ozempic.html
6,2026-03-21-00-42-47 +0000,bbc,The forgotten Indian woman trailblazer in British medicine,https://www.bbc.com/news/articles/cy9gz8d075no?at_medium=RSS&at_campaign=rss
6,2026-03-20-15-16-00 +0000,wsj,‘Streetwise’ Review: A Banker’s Goldman Age,https://www.wsj.com/arts-culture/books/streetwise-review-a-bankers-goldman-age-abcf1bd9?mod=pls_whats_news_us_business_f
5,2026-03-20-07-31-00 +0000,wsj,U.K. Government Borrowing Rose in February,https://www.wsj.com/world/europe/u-k-government-borrowing-rose-in-february-aa68fe7e
5,2026-03-20-17-13-34 +0000,bbc,Hillsborough Law to be further delayed,https://www.bbc.com/news/articles/cj94lp9k28zo?at_medium=RSS&at_campaign=rss
5,2026-03-20-13-00-00 +0000,missionlocal,Family portrait,https://missionlocal.org/2026/03/family-portrait/
5,2026-03-20-19-42-50 +0000,nyt,"On a Holiday of Renewal, Iranians Are Mourning and Fearful",https://www.nytimes.com/2026/03/20/world/middleeast/iran-nowruz-new-year.html
4,2026-03-20-15-47-55 +0000,bbc,Neighbourhoods to get £20m funding boost,https://www.bbc.com/news/articles/cj3757n0p66o?at_medium=RSS&at_campaign=rss
4,2026-03-20-15-40-00 +0000,wsj,Opinion | The Negative Nattering Never Ends,https://www.wsj.com/opinion/the-negative-nattering-never-ends-a429db0f?mod=pls_whats_news_us_business_f
