score,pubdate,source,title,link
32,2026-03-20-13-35-31 +0000,nyt,Scramble for Jet Fuel Shows How Energy Shortages Are Rippling Across Asia,https://www.nytimes.com/2026/03/20/business/oil-jetfuel-asia.html
32,2026-03-20-20-45-00 +0000,nypost,"Super Micro shares plunge as US charges co-founder, two more for smuggling AI chips to China",https://nypost.com/2026/03/20/business/super-micro-shares-plunge-as-us-charges-co-founder-two-more-for-smuggling-ai-chips-to-china/
32,2026-03-20-11-00-00 +0000,nypost,Here’s why Warner CEO David Zaslav may actually deserve that $800M payout in Paramount deal,https://nypost.com/2026/03/20/media/heres-why-warner-ceo-david-zaslav-may-actually-deserve-that-800m-payout-in-paramount-deal/
31,2026-03-20-16-30-00 +0000,wsj,Best High-Yield Savings Accounts for March 2026: Up to 5.00%,https://www.wsj.com/buyside/personal-finance/banking/best-high-yield-savings-account
31,2026-03-20-21-57-35 +0000,nypost,Fate of historic NYC rec center with Keith Haring mural at risk as city pushes Adams-era plan – which Mamdani previously blasted,https://nypost.com/2026/03/20/us-news/fate-of-nyc-rec-center-with-keith-haring-mural-still-unclear/
31,2026-03-20-20-55-20 +0000,nyt,Justice Dept. Seeks to Drop Charges Against Officers in Breonna Taylor’s Death,https://www.nytimes.com/2026/03/20/us/politics/breonna-taylor-officer-charges.html
31,2026-03-20-20-41-21 +0000,bbc,"Chuck Norris, martial artist and Hollywood movie star, dies aged 86",https://www.bbc.com/news/articles/c0le8e5jg1xo?at_medium=RSS&at_campaign=rss
31,2026-03-20-19-03-14 +0000,cbc,"As Middle Eastern countries struggle to down Iranian drones, Ukraine sends 200 specialists to help",https://www.cbc.ca/news/world/drones-ukraine-kuwait-qatar-9.7136187?cmp=rss
30,2026-03-20-19-09-17 +0000,nyt,Denmark Was Ready to Blow Up Airfields to Stop a U.S. Invasion of Greenland,https://www.nytimes.com/2026/03/20/world/europe/denmark-blow-up-greenland-runways-us-invasion.html
30,2026-03-20-18-27-48 +0000,bbc,CBS News shuts down radio service after nearly 100 years,https://www.bbc.com/news/articles/cn439d9pqpvo?at_medium=RSS&at_campaign=rss
30,2026-03-20-21-33-57 +0000,latimes,Paramount deal for CNN and Warner Bros. draws concerns about news independence,https://www.latimes.com/entertainment-arts/business/story/2026-03-20/paramount-deal-for-cnn-warner-bros-draws-concerns-about-news-independence
30,2026-03-20-13-22-44 +0000,bbc,Typical energy bill forecast to rise by £332 a year in July,https://www.bbc.com/news/articles/cede1nn8wp5o?at_medium=RSS&at_campaign=rss
30,2026-03-20-09-30-00 +0000,wsj,How to Trade the War: Avoid Gimmicky Strategies and Overheated Assets,https://www.wsj.com/finance/investing/how-to-trade-the-war-avoid-gimmicky-strategies-and-overheated-assets-e150858f?mod=rss_markets_main
29,2026-03-21-02-25-52 +0000,nypost,Staggering hidden cost of wiping Cesar Chavez’s legacy from California,https://nypost.com/2026/03/20/us-news/cesar-chavez-removed-see-how-much-california-is-spending-to-erase-sites/
29,2026-03-20-20-12-25 +0000,latimes,"California's film and TV tax credit is working, but federal help is needed, lawmakers say",https://www.latimes.com/entertainment-arts/business/story/2026-03-20/california-lawmakers-aim-to-apply-film-tv-tax-credit-nationally
29,2026-03-20-21-22-57 +0000,bbc,Justice department seeks to dismiss charges against ex-officers over Breonna Taylor raid,https://www.bbc.com/news/articles/cx2v9k01156o?at_medium=RSS&at_campaign=rss
29,2026-03-20-12-24-10 +0000,nyt,"In Photos: The War in Ukraine, After 4 Years",https://www.nytimes.com/2026/03/20/world/europe/ukraine-russia-war-photos.html
29,2026-03-21-00-07-03 +0000,nypost,Ritzy LA enclave suffers staggering wealth wipe out — as mansion owners slam Gavin Newsom,https://nypost.com/2026/03/20/us-news/ritzy-la-enclave-suffers-staggering-wealth-wipe-out-as-mansion-owners-slam-gavin-newsom/
29,2026-03-20-10-00-00 +0000,latimes,"Newsom leads Harris for president among California Democrats, poll finds",https://www.latimes.com/california/story/2026-03-20/newsom-leads-harris-for-president-among-california-democrats-poll-finds
29,2026-03-20-23-12-08 +0000,latimes,California attorney general asks judge to block Nexstar-Tegna merger,https://www.latimes.com/entertainment-arts/business/story/2026-03-20/california-attorney-general-asks-judge-to-block-nexstar-tegna-merger
29,2026-03-20-15-41-00 +0000,wsj,Opinion | Time to Take Oil out of Newsom’s Hands,https://www.wsj.com/opinion/time-to-take-oil-out-of-newsoms-hands-50d08996?mod=pls_whats_news_us_business_f
28,2026-03-20-15-00-00 +0000,wsj,"From Four-Day Weeks to AC Bans, the World Is Scrambling to Save Energy",https://www.wsj.com/finance/commodities-futures/from-four-day-weeks-to-ac-bans-the-world-is-scrambling-to-save-energy-e16ccd81?mod=pls_whats_news_us_business_f
28,2026-03-20-21-59-11 +0000,nypost,Two more top bond-rating firms issue dire warning for NYC over Mamdani budget,https://nypost.com/2026/03/20/us-news/two-more-top-bond-rating-firms-issue-dire-warning-for-nyc-over-mamdani-budget/
28,2026-03-20-18-35-00 +0000,cbc,"Netflix, Warner Music sign multi-year deal to produce artist documentaries",https://www.cbc.ca/news/business/netflix-warner-music-group-artist-documentaries-9.7136519?cmp=rss
28,2026-03-20-10-00-00 +0000,latimes,"United Farm Workers could face lawsuits over Chavez sex abuse claims, attorneys say",https://www.latimes.com/california/story/2026-03-20/ufw-chavez-sex-abuse-claims
28,2026-03-20-13-00-05 +0000,nyt,The I.R.S. Is Phasing Out Paper Checks. Here’s How to Speed Your Refund.,https://www.nytimes.com/2026/03/20/your-money/irs-paper-checks-end-tax-refund-direct-deposit.html
28,2026-03-20-20-55-00 +0000,wsj,"Tech, Media & Telecom Roundup: Market Talk",https://www.wsj.com/tech/tech-media-telecom-roundup-market-talk-9e1fdb0b?mod=rss_markets_main
27,2026-03-21-01-37-31 +0000,latimes,Cause of death for Austin Beutner's 22-year-old daughter revealed,https://www.latimes.com/california/story/2026-03-20/cause-of-death-for-austin-beutners-22-year-old-daughter-revealed
27,2026-03-20-20-58-00 +0000,wsj,Deepening Energy Crisis Sends Stocks to Fourth Straight Weekly Loss,https://www.wsj.com/finance/stocks/deepening-energy-crisis-sends-stocks-to-fourth-straight-weekly-loss-2a42fe13?mod=rss_markets_main
27,2026-03-20-15-30-28 +0000,bbc,"Norway's crown princess breaks silence, claiming she was 'manipulated and deceived' by Epstein",https://www.bbc.com/news/articles/cde5y63y3n7o?at_medium=RSS&at_campaign=rss
26,2026-03-20-16-35-08 +0000,nypost,Business is still humming across the Persian Gulf – even as bombs continue to fly: sources,https://nypost.com/2026/03/20/business/business-is-still-humming-across-the-persian-gulf-even-as-bombs-continue-to-fly-sources/
26,2026-03-21-00-05-11 +0000,wapo,Pentagon press policy ruled unconstitutional in case brought by N.Y. Times,https://www.washingtonpost.com/business/2026/03/20/pentagon-press-policy-unconstitutional-nyt/
26,2026-03-20-17-24-33 +0000,nypost,Jes Staley’s wife files for divorce after ex-Barclays exec admitted to affair with Epstein staffer: report,https://nypost.com/2026/03/20/business/jes-staleys-wife-files-for-divorce-after-ex-barclays-exec-admitted-to-affair-with-epstein-staffer-report/
25,2026-03-20-10-00-00 +0000,nypost,Widower of Wall Street activist Evelyn Davis demands apology from ex-Goldman Sachs CEO Lloyd Blankfein,https://nypost.com/2026/03/20/business/widower-of-wall-street-activist-demands-apology-from-lloyd-blankfein/
25,2026-03-20-23-54-11 +0000,nyt,A Look at the Escalating Battle for the Strait of Hormuz,https://www.nytimes.com/2026/03/20/us/politics/battle-for-strait-of-hormuz.html
25,2026-03-20-07-35-32 +0000,nypost,Denmark secretly prepared to blow up Greenland’s runways to stop US aircraft: report,https://nypost.com/2026/03/20/world-news/denmark-prepared-to-blow-up-greenland-runways-to-stop-us-aircraft-report/
25,2026-03-20-20-16-29 +0000,bbc,Ukraine-Hungary oil pipeline row threatens EU loan,https://www.bbc.com/news/articles/cr71rkeg7xxo?at_medium=RSS&at_campaign=rss
25,2026-03-21-02-07-23 +0000,nyt,Judge Rules Pentagon Restrictions on Press Are Unconstitutional,https://www.nytimes.com/2026/03/20/business/media/pentagon-press-restrictions-new-york-times.html
25,2026-03-20-21-33-00 +0000,wsj,Tech Exec Accused of Smuggling Nvidia Chips to China Resigns From Board,https://www.wsj.com/tech/super-micro-computer-employees-arrested-for-alleged-sales-to-china-45a2bd73
25,2026-03-20-12-29-20 +0000,nyt,BTS Leans Into Korean History With ‘Arirang.’ Here Are the Major References.,https://www.nytimes.com/2026/03/20/world/asia/bts-arirang-korean-references.html
25,2026-03-20-22-20-39 +0000,nypost,"Boy, 16, falls to death while taking photos from cell tower at Brooklyn park with skyline views",https://nypost.com/2026/03/20/us-news/boy-16-falls-to-death-while-taking-social-media-photos-from-cell-tower-at-nyc-park-with-skyline-views-cops-sources/
25,2026-03-20-21-00-00 +0000,wsj,Financial Services Roundup: Market Talk,https://www.wsj.com/finance/banking/financial-services-roundup-market-talk-eade6365?mod=rss_markets_main
25,2026-03-20-23-00-00 +0000,wsj,Taylor Swift’s ‘Eras’ Tour Was Big. BTS Wants to Go Bigger.,https://www.wsj.com/business/taylor-swifts-eras-tour-was-big-bts-wants-to-go-bigger-57e38319?mod=pls_whats_news_us_business_f
24,2026-03-21-00-51-06 +0000,nypost,Owners of Marilyn Monroe’s $8M LA death home slammed by city after suing to tear it down,https://nypost.com/2026/03/20/us-news/la-responds-to-lawsuit-trying-to-demolish-marilyn-monroe-house/
24,2026-03-21-02-35-26 +0000,bbc,Watch: Thick smoke billows from South Korea car parts plant in deadly fire,https://www.bbc.com/news/videos/c87wg74wlgyo?at_medium=RSS&at_campaign=rss
24,2026-03-20-12-54-01 +0000,bbc,Did you know you could transfer your ISA?,https://www.bbc.com/news/videos/cdxdlzkwnkpo?at_medium=RSS&at_campaign=rss
24,2026-03-20-20-42-43 +0000,cbc,Canadian Armed Forces members among NATO troops pulled out of Iraq,https://www.cbc.ca/news/politics/caf-members-pulled-out-of-iraq-nato-mission-9.7136773?cmp=rss
24,2026-03-20-20-35-17 +0000,nypost,Florida gubernatorial candidate James Fishback’s own lawyers dump him over unpaid $150K bill,https://nypost.com/2026/03/20/business/florida-gubernatorial-candidate-james-fishbacks-own-lawyers-dump-him-over-unpaid-150k-bill/
24,2026-03-20-20-17-23 +0000,nypost,Senate fails to end DHS shutdown for a fifth time as airline passengers endure travel chaos,https://nypost.com/2026/03/20/us-news/senate-fails-to-end-dhs-shutdown-for-a-fifth-time-as-airline-passengers-endure-travel-chaos/
24,2026-03-20-18-54-55 +0000,bbc,Reform UK suspends Scotland candidate over financial allegations,https://www.bbc.com/news/articles/cj375v264rko?at_medium=RSS&at_campaign=rss
24,2026-03-21-01-31-00 +0000,wsj,U.S. Probes Colombian Leader for Alleged Use of Drug Money for Campaign,https://www.wsj.com/world/americas/u-s-probes-colombian-leader-for-alleged-use-of-drug-money-for-campaign-a0bfbe98
23,2026-03-21-01-40-35 +0000,nyt,U.S. Coast Guard Recovers One Man and Two Dead Bodies From Pacific Boat Strike Area,https://www.nytimes.com/2026/03/20/us/politics/pacific-boat-strike-survivor.html
23,2026-03-20-17-47-00 +0000,wsj,U.S. Gas Exporters Stand to Be the Big Winners of the Energy Crisis,https://www.wsj.com/business/energy-oil/u-s-gas-exporters-stand-to-be-the-big-winners-of-the-energy-crisis-c31f73a6?mod=pls_whats_news_us_business_f
23,2026-03-20-18-06-03 +0000,nyt,More! More! More! Tech Workers Max Out Their A.I. Use.,https://www.nytimes.com/2026/03/20/technology/tokenmaxxing-ai-agents.html
23,2026-03-20-17-15-49 +0000,nyt,"Lukashenko Jailed Her in Belarus, but She Wants the World to Talk to Him",https://www.nytimes.com/2026/03/20/world/europe/maria-kalesnikava-lukashenko-belarus.html
23,2026-03-20-17-24-55 +0000,nyt,Presidents Who Honored Cesar Chavez Have Yet to React to Abuse Allegations,https://www.nytimes.com/2026/03/20/us/politics/cesar-chavez-obama-bill-clinton-biden.html
23,2026-03-20-21-46-00 +0000,latimes,"In rare move, ICE drags criminal defendant out of a federal courtroom",https://www.latimes.com/california/story/2026-03-20/in-rare-move-ice-drags-criminal-defendant-out-of-federal-courtroom
23,2026-03-20-23-06-10 +0000,bbc,"BTS comeback concert: Seoul gets ready to host 260,000 fans",https://www.bbc.com/news/articles/cge0dyjwezgo?at_medium=RSS&at_campaign=rss
23,2026-03-21-00-04-55 +0000,nypost,Viral Jeffrey Epstein look-a-like ‘Palm Beach Pete’ says comparisons started because of the NY Post,https://nypost.com/2026/03/20/us-news/jeffrey-epstein-look-a-like-palm-beach-pete-went-viral-because-of-ny-post/
23,2026-03-21-01-03-01 +0000,bbc,Chuck Norris memes were undefeated for a generation of young fans,https://www.bbc.com/news/articles/c62541e29z9o?at_medium=RSS&at_campaign=rss
23,2026-03-21-01-05-03 +0000,bbc,Russia's school propaganda was  highlighted by Oscar-winning film - but does it work?,https://www.bbc.com/news/articles/c7vq5g64y98o?at_medium=RSS&at_campaign=rss
23,2026-03-20-14-55-02 +0000,bbc,UK borrowing costs hit highest level since 2008 financial crisis,https://www.bbc.com/news/articles/cx23yn735jdo?at_medium=RSS&at_campaign=rss
23,2026-03-20-12-58-00 +0000,wsj,Best Car Insurance Companies of 2026,https://www.wsj.com/buyside/personal-finance/auto-insurance/best-car-insurance
23,2026-03-20-14-01-59 +0000,nypost,"Walmart’s AI move could lead to surge pricing — shoppers and experts are outraged: ‘This isn’t innovative, it’s exploitative’",https://nypost.com/2026/03/20/tech/walmarts-ai-move-could-bring-surge-pricing-angry-shoppers/
23,2026-03-21-02-13-14 +0000,nyt,"Striking Down Pentagon Press Limits, Judge Vindicates Independent Journalism",https://www.nytimes.com/2026/03/20/us/federal-judge-constitution-press-freedom.html
22,2026-03-21-02-23-28 +0000,startribune,Scoggins: Amaya Battle helps loosen Gophers up in NCAA tournament opener,https://www.startribune.com/gophers-womens-basketball-ncaa-tournament-green-bay-amaya-battle-dawn-plitzuweit/601598719
22,2026-03-20-15-07-27 +0000,cbc,BTS to stage long-awaited comeback show at Seoul landmark,https://www.cbc.ca/news/entertainment/bts-comeback-concert-9.7136019?cmp=rss
22,2026-03-20-15-06-42 +0000,nypost,"DOJ sues Harvard for discriminating against Jewish, Israeli students",https://nypost.com/2026/03/20/us-news/doj-sues-harvard-for-discriminating-against-jewish-israeli-students/
22,2026-03-20-15-05-03 +0000,bbc,"Work from home and drive more slowly to save energy, global body urges",https://www.bbc.com/news/articles/cvg4540d0g4o?at_medium=RSS&at_campaign=rss
22,2026-03-20-12-38-01 +0000,bbc,I didn't know Epstein was a predator - Norway's crown princess,https://www.bbc.com/news/videos/c78l5x0zl0wo?at_medium=RSS&at_campaign=rss
22,2026-03-20-09-34-00 +0000,wsj,Vincorion Shares Gain on Market Debut as Investors Eye Rising Defense Demand,https://www.wsj.com/business/vincorion-shares-gain-on-market-debut-as-investors-eye-rising-defense-demand-4fd431b6?mod=rss_markets_main
22,2026-03-20-14-37-21 +0000,cbc,"Chuck Norris, Hollywood martial artist and actor, dead at 86",https://www.cbc.ca/news/entertainment/chuck-norris-actor-obituary-9.7136043?cmp=rss
22,2026-03-20-08-00-00 +0000,cbc,"Customers complain about long wait times, multiple calls to resolve issues with Rogers, Telus and Bell",https://www.cbc.ca/news/marketplace/rogers-telus-bell-telecom-customer-service-9.7131890?cmp=rss
22,2026-03-20-06-06-08 +0000,nypost,Six Flags rolls strict chaperone policy for guests under 17 over spring break — dividing parkgoers: ‘Way to ruin the fun’,https://nypost.com/2026/03/20/business/six-flags-rolls-out-strict-chaperone-policy-for-guests-under-17-over-spring-break-to-battle-disruptive-behavior/
22,2026-03-20-09-00-11 +0000,nyt,Tunisia’s Capital Is Captivating a New Generation of Travelers,https://www.nytimes.com/2026/03/20/travel/tunisia-capital-history-fashion-food-art.html
22,2026-03-21-01-03-36 +0000,bbc,Socialists battle to hold Paris in key mayoral elections across France,https://www.bbc.com/news/articles/c87wgw27201o?at_medium=RSS&at_campaign=rss
21,2026-03-21-00-05-56 +0000,nyt,Fresno Took 30 Years to Name Cesar Chavez Blvd. Undoing It Took a Day.,https://www.nytimes.com/2026/03/20/us/fresno-cesar-chavez-street-rename.html
21,2026-03-20-04-26-14 +0000,bbc,Trio charged over alleged plot to smuggle Nvidia chips from US to China,https://www.bbc.com/news/articles/cy41ly2d9wko?at_medium=RSS&at_campaign=rss
21,2026-03-20-18-39-42 +0000,cbc,3 Quebec maritime trainees return home after being stranded aboard ship in the Persian Gulf,https://www.cbc.ca/news/canada/montreal/quebec-maritime-trainees-9.7136552?cmp=rss
21,2026-03-21-00-31-44 +0000,nypost,Postal worker busted after violently shoving 4-year-old Jewish boy in NYC suburb,https://nypost.com/2026/03/20/us-news/ny-postal-worker-busted-after-violently-shoving-4-year-old-jewish-boy-in-shocking-caught-on-camera-attack/
21,2026-03-20-20-51-45 +0000,startribune,"Three Feeding Our Future defendants enter pleas, marking 63rd conviction in massive fraud case",https://www.startribune.com/three-feeding-our-future-defendants-enter-pleas-marking-63rd-conviction-in-massive-fraud-case/601599331
21,2026-03-21-00-00-00 +0000,wsj,Disney Sank Millions Into the New ‘Bachelorette.’ Then It Pulled the Plug.,https://www.wsj.com/business/media/disney-sank-millions-into-the-new-bachelorette-then-it-pulled-the-plug-742772eb?mod=pls_whats_news_us_business_f
21,2026-03-20-23-48-50 +0000,startribune,Feeding Our Future fraud leader Aimee Bock to be sentenced in May,https://www.startribune.com/aimee-bock-sentencing-may-feeding-our-future-minneseota-fraud/601620149
21,2026-03-20-22-21-31 +0000,nypost,Hochul formally pitches delaying NY climate mandates amid crippling looming utility hikes,https://nypost.com/2026/03/20/us-news/hochul-formally-pitches-delaying-ny-climate-mandates-amid-crippling-looming-utility-hikes/
21,2026-03-20-12-58-00 +0000,wsj,Best Term Life Insurance Companies of 2026,https://www.wsj.com/buyside/personal-finance/life-insurance/best-term-life-insurance
21,2026-03-20-21-32-00 +0000,wsj,Opinion | Cuba and New York Vie for Floridians,https://www.wsj.com/opinion/cuba-new-york-florida-residents-taxes-kathy-hochul-zohran-mamdani-5e9d53a2
21,2026-03-20-22-17-29 +0000,latimes,Gasoline price gouging in California draws a warning,https://www.latimes.com/environment/story/2026-03-20/la-enviro-oil-gas-watchdog-price-gouging
21,2026-03-20-20-53-00 +0000,wsj,Auto & Transport Roundup: Market Talk,https://www.wsj.com/business/auto-transport-roundup-market-talk-4227d8a5?mod=pls_whats_news_us_business_f
20,2026-03-20-19-42-00 +0000,wsj,Natural Gas Falls as Traders Sell Ahead of the Weekend,https://www.wsj.com/articles/european-gas-set-for-20-weekly-surge-on-qatar-lng-hit-a775feb4?mod=rss_markets_main
20,2026-03-20-12-58-00 +0000,wsj,Best Pet Insurance Companies of 2026,https://www.wsj.com/buyside/personal-finance/pet-insurance/best-pet-insurance
20,2026-03-20-21-05-00 +0000,wsj,ESG Roundup: Market Talk,https://www.wsj.com/articles/esg-roundup-market-talk-b028c3ea?mod=rss_markets_main
20,2026-03-20-15-51-44 +0000,nyt,"James Barnard, a Global Force in Wastewater Treatment, Dies at 90",https://www.nytimes.com/2026/03/18/science/james-barnard-dead.html
20,2026-03-20-09-01-29 +0000,nyt,How New Mexico Became an Obamacare Success Story,https://www.nytimes.com/2026/03/20/health/obamacare-new-mexico-subsidies-states.html
20,2026-03-20-10-00-00 +0000,latimes,Uber and Rivian plan to bring robotaxis to California,https://www.latimes.com/business/story/2026-03-20/uber-rivian-plan-to-bring-robotaxis-to-california
20,2026-03-20-14-36-11 +0000,nyt,What To Know About the BTS Comeback Concert Streaming Live on Netflix,https://www.nytimes.com/2026/03/20/world/asia/bts-concert-kpop-netflix-seoul.html
20,2026-03-20-13-13-06 +0000,nyt,How a Civil Rights Icon Used His Power to Abuse Girls and Women,https://www.nytimes.com/video/us/100000010787904/how-a-civil-rights-icon-used-his-power-to-abuse-girls-and-women.html
20,2026-03-20-10-34-23 +0000,bbc,"Farage pauses Cameo account for security reasons, says Reform UK",https://www.bbc.com/news/articles/c79jwxypp1ro?at_medium=RSS&at_campaign=rss
20,2026-03-20-10-41-00 +0000,wsj,You Can Play Media Mogul on This Deal,https://www.wsj.com/finance/stocks/you-can-play-media-mogul-on-this-deal-1ee35229?mod=rss_markets_main
20,2026-03-20-11-27-00 +0000,wsj,"South Korea, a ‘Model Ally,’ Confronts a Leaner U.S. Military Alliance",https://www.wsj.com/world/asia/south-korea-a-model-ally-confronts-a-leaner-u-s-military-alliance-f2073813
19,2026-03-20-15-15-59 +0000,nypost,3 men charged with conspiring to smuggle AI to China,https://nypost.com/2026/03/20/world-news/3-men-charged-with-conspiring-to-smuggle-ai-to-china/
19,2026-03-20-12-58-00 +0000,wsj,Best Business Debt Consolidation Loans in March 2026,https://www.wsj.com/buyside/personal-finance/business-loans/business-debt-consolidation-loans?mod=pls_whats_news_us_business_f
19,2026-03-20-03-34-02 +0000,bbc,Taxpayers to fund clear-up of huge illegal waste dumps,https://www.bbc.com/news/articles/cx2expk404vo?at_medium=RSS&at_campaign=rss
19,2026-03-20-10-43-00 +0000,wsj,Asian Central Banks Shift to Sidelines as Mideast Conflict Drags On,https://www.wsj.com/economy/central-banking/asian-central-banks-shift-to-sidelines-as-mideast-conflict-drags-on-aa8617a7
19,2026-03-20-22-41-58 +0000,nypost,Deranged West Virginia man accused of shooting father in face with crossbow captured following snowy manhunt,https://nypost.com/2026/03/20/us-news/deranged-west-virginia-man-accused-of-shooting-father-in-face-with-crossbow-captured/
19,2026-03-20-17-54-00 +0000,wsj,Blue Pool Capital Raises $1 Billion for First Private-Equity Fund,https://www.wsj.com/finance/investing/blue-pool-capital-raises-1-billion-for-first-private-equity-fund-2091966d?mod=rss_markets_main
19,2026-03-21-01-38-17 +0000,startribune,Jessie Diggins clinches her fourth overall World Cup title in cross-country skiing,https://www.startribune.com/jessie-diggins-clinches-her-fourth-overall-world-cup-title-in-cross-country-skiing/601620399
19,2026-03-21-00-10-29 +0000,nyt,"Seeking to Rely Less on China, U.S. Pushes a Rare Earths Partnership on a Reluctant Brazil",https://www.nytimes.com/2026/03/20/world/americas/us-rare-earth-minerals-brazil-china.html
18,2026-03-20-09-02-28 +0000,nyt,New Spider Mimics ‘The Last of Us’ Zombie Fungus Cordyceps,https://www.nytimes.com/2026/03/20/science/spider-cordyceps-fungus-zombies.html
18,2026-03-20-08-53-00 +0000,wsj,China Targets Lawyers Defending Jailed Christian Leaders,https://www.wsj.com/world/china/china-targets-lawyers-defending-jailed-christian-leaders-6d0d72c8
18,2026-03-20-23-15-34 +0000,nyt,Aid Ship Departs for Cuba as Island Grapples With a Fuel Blockade,https://www.nytimes.com/2026/03/20/world/americas/cuba-fuel-blockade-aid-convoy.html
18,2026-03-20-18-42-03 +0000,latimes,Hundreds of dogs and cats rescued in massive L.A. County animal enforcement operation,https://www.latimes.com/california/story/2026-03-20/animal-rescue-la-county-lake-hughes
18,2026-03-20-22-08-45 +0000,missionlocal,"Fired S.F. police watchdog attorney sues city, alleging retaliation and hostile workplace",https://missionlocal.org/2026/03/sf-fired-attorney-police-watchdog-retaliation-lawsuit/
18,2026-03-20-21-18-33 +0000,nyt,California Could Elect a Republican Governor Thanks to the ‘Jungle Primary’,https://www.nytimes.com/2026/03/20/us/politics/california-primary-gop-governors-race.html
18,2026-03-21-00-04-02 +0000,nypost,Adorable sea lion pups released back into uncertain sea as shooting threat remains,https://nypost.com/2026/03/20/us-news/sea-lions-released-back-into-the-sea-after-shocking-shootings/
18,2026-03-20-12-18-51 +0000,bbc,Venezuelan leader replaces senior military commanders,https://www.bbc.com/news/articles/cn43914zx31o?at_medium=RSS&at_campaign=rss
18,2026-03-20-10-57-38 +0000,bbc,Mexican teen dies while being held in US immigration custody,https://www.bbc.com/news/articles/cp84n0kn902o?at_medium=RSS&at_campaign=rss
18,2026-03-20-15-17-50 +0000,nypost,4 flight attendants injured after severe turbulence on Delta flight from LA,https://nypost.com/2026/03/20/lifestyle/4-flight-attendants-injured-after-turbulence-on-delta-flight/
18,2026-03-20-19-31-29 +0000,nypost,"US prosecutors investigate Colombian President Petro’s alleged ties to drug traffickers, sources say",https://nypost.com/2026/03/20/world-news/us-prosecutors-investigate-colombian-president-petros-alleged-ties-to-drug-traffickers-sources-say/
18,2026-03-20-21-54-51 +0000,wapo,"Cuba rejects U.S. Embassy request to bring in fuel, calls it ‘shameless’",https://www.washingtonpost.com/world/2026/03/20/us-embassy-havana-cuba-fuel-blackout/
17,2026-03-21-01-35-17 +0000,nyt,"Alfredo Bryce Echenique, 87, Dies; Novelist Bared Peru’s Privileged Class",https://www.nytimes.com/2026/03/17/books/alfredo-bryce-echenique-dead.html
17,2026-03-20-11-39-50 +0000,nyt,ICE Released Hundreds of Children from Immigration Detention,https://www.nytimes.com/2026/03/20/us/children-ice-detention-decrease.html
17,2026-03-20-13-15-12 +0000,nyt,Spain Says the Sun Shields It From Rising Gas Costs. Is That True?,https://www.nytimes.com/2026/03/20/world/europe/spain-iran-energy-renewables-gas-sun.html
17,2026-03-20-15-31-00 +0000,cbc,Palestinian man says Israeli settlers sexually assaulted him in front of his family,https://www.cbc.ca/news/world/palestinian-man-israeli-settlers-sexual-assault-west-bank-9.7136163?cmp=rss
17,2026-03-20-10-00-00 +0000,latimes,Unprecedented March heat wave in SoCal has experts worried about what comes next,https://www.latimes.com/california/story/2026-03-20/california-march-heat-wave-result-of-climate-change-expert
