score,pubdate,source,title,link
11,2026-01-29-11-37-15 +0000,bbc,"Keep suspended pupils in school, ministers say",https://www.bbc.com/news/articles/c0r425pyl57o?at_medium=RSS&at_campaign=rss
11,2026-01-29-21-10-23 +0000,latimes,"L.A. parent of Johnny Rockets, Fatburger and Round Table files for bankruptcy",https://www.latimes.com/business/story/2026-01-29/la-parent-of-johnny-rockets-fatburger-round-table-files-for-bankruptcy
11,2026-01-28-23-15-35 +0000,nyt,5 Key Takeaways from Josh Shapiro’s Memoir ‘Where We Keep the Light’,https://www.nytimes.com/2026/01/28/us/politics/josh-shapiro-memoir-where-we-keep-light.html
11,2026-01-29-18-50-39 +0000,latimes,Teen boy and older brother die in suspected fireworks explosion in Bell Gardens home,https://www.latimes.com/california/story/2026-01-29/teen-boy-older-brother-die-in-suspected-fireworks-explosion-in-bell-gardens-home
10,2026-01-28-22-41-53 +0000,wapo,Removal of flags for fallen Danish soldiers at U.S. Embassy sparks backlash,https://www.washingtonpost.com/world/2026/01/28/us-embassy-danish-flags-afghanistan-war/
10,2026-01-29-19-51-22 +0000,nyt,"Groups Back Larson Challenger, Calling for Generational Change",https://www.nytimes.com/2026/01/29/us/politics/john-larson-luke-bronin-primary-challenge.html
10,2026-01-29-20-59-04 +0000,nyt,Here’s the latest.,https://www.nytimes.com/live/2026/01/29/us/minnesota-ice-shooting-minneapolis/heres-the-latest
10,2026-01-29-15-29-16 +0000,bbc,Ministers reject Waspi calls for compensation after rethink,https://www.bbc.com/news/articles/c1jeyn3yxn9o?at_medium=RSS&at_campaign=rss
10,2026-01-29-19-19-00 +0000,wsj,Precious Metals Close Volatile Day Higher,https://www.wsj.com/finance/commodities-futures/gold-silver-hit-fresh-record-highs-amid-iran-tensions-1adbea45?mod=rss_markets_main
10,2026-01-28-22-13-57 +0000,nypost,Iranian regime executing elite wrestlers who back protestors as thousands take to streets,https://nypost.com/2026/01/28/world-news/iran-regime-targeting-athletes-and-coaches-who-join-protests/
10,2026-01-29-06-20-51 +0000,bbc,'You price something at £1.50 but people offer £1',https://www.bbc.com/news/articles/cvg1zp20y3ko?at_medium=RSS&at_campaign=rss
10,2026-01-29-14-04-05 +0000,nyt,U.K.’s Starmer Meets Xi Jinping in Beijing as Ties Warm,https://www.nytimes.com/2026/01/28/world/asia/china-starmer-xi-jinping.html
10,2026-01-29-15-35-05 +0000,bbc,What's happening with the assisted dying bill?,https://www.bbc.com/news/articles/c78vv47x422o?at_medium=RSS&at_campaign=rss
10,2026-01-29-20-30-02 +0000,nyt,"In Hostile Times, Maine Immigrants Cherish Artistic Traditions",https://www.nytimes.com/2026/01/29/arts/maine-immigrants-cambodian-dance.html
9,2026-01-29-21-44-37 +0000,nyt,A Global Pop Music Melting Pot,https://www.nytimes.com/2026/01/29/world/bad-bunny-grammys-pop-britain-china.html
9,2026-01-28-22-09-00 +0000,wsj,Opinion | America Doesn’t Do Fascism,https://www.wsj.com/opinion/america-doesnt-do-fascism-d4c64a8e
9,2026-01-28-22-15-44 +0000,bbc,"Chagos discussions with US continue, says Starmer",https://www.bbc.com/news/articles/cp80p875pdko?at_medium=RSS&at_campaign=rss
9,2026-01-29-12-54-47 +0000,bbc,Emergency loans offered to civil servants waiting on pensions,https://www.bbc.com/news/articles/c8e524n23rno?at_medium=RSS&at_campaign=rss
9,2026-01-29-11-43-18 +0000,bbc,James brought to tears by Cleveland video tribute,https://www.bbc.com/sport/basketball/articles/clymevmr2jyo?at_medium=RSS&at_campaign=rss
9,2026-01-29-03-03-00 +0000,wsj,How Remaking the Neighborhood Could Boost Poor Kids’ Futures,https://www.wsj.com/economy/housing/how-remaking-the-neighborhood-could-boost-poor-kids-futures-90b94e6d?mod=rss_markets_main
9,2026-01-29-13-12-13 +0000,nyt,The Journey of a Group of Cuban Deportees Stuck at Guantánamo,https://www.nytimes.com/2026/01/28/us/politics/cubans-gitmo-deportations.html
9,2026-01-29-17-37-36 +0000,bbc,'Relief' for pubs and hotels as rates revaluation halted,https://www.bbc.com/news/articles/cg5gpe3jdl9o?at_medium=RSS&at_campaign=rss
9,2026-01-28-22-54-00 +0000,wsj,Opinion | Guan Heng Gets U.S. Asylum,https://www.wsj.com/opinion/guan-heng-asylum-ruling-china-uyghurs-charles-ouslander-department-of-homeland-security-b70be0c8
9,2026-01-29-19-41-48 +0000,bbc,Senegal boss Thiaw banned after Afcon final chaos,https://www.bbc.com/sport/football/articles/c24gy9d52vno?at_medium=RSS&at_campaign=rss
9,2026-01-28-23-22-48 +0000,bbc,Driverless taxis set to launch in UK as soon as September,https://www.bbc.com/news/articles/czej9n578k9o?at_medium=RSS&at_campaign=rss
9,2026-01-29-00-10-00 +0000,wsj,Chinese Man Who Documented Uyghur Population Is Granted U.S. Asylum,https://www.wsj.com/world/china/chinese-man-who-documented-uyghur-population-is-granted-u-s-asylum-2d8dffe5
9,2026-01-29-01-54-47 +0000,bbc,Indians pay tribute after Arijit Singh retires at 38 as Bollywood singer,https://www.bbc.com/news/articles/cddgpp7jpm8o?at_medium=RSS&at_campaign=rss
9,2026-01-29-16-18-04 +0000,cbc,India reports 2 Nipah virus cases. What the infection is and how it spreads,https://www.cbc.ca/news/health/nipah-virus-india-9.7066315?cmp=rss
9,2026-01-29-15-59-00 +0000,wsj,Opinion | If You Give an Industry a Handout,https://www.wsj.com/opinion/if-you-give-an-industry-a-handout-29010555?mod=pls_whats_news_us_business_f
9,2026-01-29-13-49-00 +0000,wsj,U.S. Trade Deficit Grew in November,https://www.wsj.com/economy/trade/u-s-trade-deficit-grew-in-november-18c570d7
9,2026-01-29-11-59-18 +0000,bbc,Flights to northern Ethiopia cancelled as fears mount of renewed conflict,https://www.bbc.com/news/articles/cn40r3v770lo?at_medium=RSS&at_campaign=rss
9,2026-01-29-10-03-49 +0000,nyt,Three Great Documentaries to Stream,https://www.nytimes.com/2026/01/29/movies/three-great-documentaries-to-stream.html
9,2026-01-29-12-00-00 +0000,startribune,10 great dishes for under $10,https://www.startribune.com/10-great-dishes-under-10/601565657
8,2026-01-29-20-34-00 +0000,wsj,Opinion | Give the Board of Peace a Chance,https://www.wsj.com/opinion/give-the-board-of-peace-a-chance-92e7e287
8,2026-01-29-02-04-43 +0000,48hills,Good Taste: Damansara’s Dungeness crab is hot to go,https://48hills.org/2026/01/good-taste-damansaras-dungeness-crab-is-hot-to-go/
8,2026-01-29-00-28-00 +0000,wsj,Opinion | More Teamster Job Casualties at UPS,https://www.wsj.com/opinion/ups-layoffs-teamsters-union-sean-o-brien-carol-tome-5dcdd7b6
8,2026-01-29-14-13-00 +0000,wsj,Lockheed Martin to Quadruple Thaad Missile-Defense Output,https://www.wsj.com/politics/national-security/lockheed-martin-to-quadruple-thaad-missile-defense-output-7b619571
7,2026-01-29-00-31-07 +0000,nyt,"Homelessness Appears to Decline, Reversing a Yearslong Trend",https://www.nytimes.com/2026/01/28/us/politics/homelessness-decline-trend.html
7,2026-01-29-20-45-03 +0000,nyt,Costco Is Sued Over Preservatives in Its $5 Rotisserie Chickens,https://www.nytimes.com/2026/01/29/business/costco-chicken-lawsuit-preservatives.html
7,2026-01-29-11-00-00 +0000,latimes,"Hiltzik: Farewell to Peter Duesberg, a godfather of scientific disinformation",https://www.latimes.com/business/story/2026-01-29/farewell-to-peter-duesberg-godfather-of-scientific-disinformation
7,2026-01-29-00-44-50 +0000,bbc,Trubin's 'miracle' - how Mourinho's Benfica stunned Real Madrid,https://www.bbc.com/sport/football/articles/c8j329y9yk2o?at_medium=RSS&at_campaign=rss
7,2026-01-29-13-17-06 +0000,nyt,The A.I. Boom’s Uncertain Payoff,https://www.nytimes.com/2026/01/29/business/dealbook/ai-spending-meta-microsoft.html
7,2026-01-29-16-02-00 +0000,wsj,"Opinion | Jack Smith, a ‘Rabid Wolf’ for a Special Counsel",https://www.wsj.com/opinion/jack-smith-a-rabid-wolf-for-a-special-counsel-332fe35f
6,2026-01-29-16-24-47 +0000,bbc,The stars and styles from Paris Haute Couture Fashion Week,https://www.bbc.com/news/articles/cn42pnq5p8wo?at_medium=RSS&at_campaign=rss
6,2026-01-29-13-52-00 +0000,wsj,U.S. Jobless Claims Remain Subdued Last Week,https://www.wsj.com/economy/jobs/u-s-jobless-claims-remain-subdued-last-week-96eb2033
6,2026-01-29-20-17-55 +0000,nyt,A Solution for Too Many A’s? Harvard Considers Giving A-Pluses,https://www.nytimes.com/2026/01/29/us/harvard-grade-inflation.html
6,2026-01-29-17-33-46 +0000,nyt,What Americans Really Mean by ‘Affordability’,https://www.nytimes.com/2026/01/28/upshot/poll-affordability-housing-prices.html
5,2026-01-29-15-30-00 +0000,wsj,U.S. Factory Orders Rose in November,https://www.wsj.com/economy/u-s-factory-orders-rose-in-november-977a5fb5
5,2026-01-29-17-13-00 +0000,wsj,Call Screening Is Aggravating the Rich and Powerful,https://www.wsj.com/style/iphone-call-screening-feature-executives-511e51c4?mod=pls_whats_news_us_business_f
4,2026-01-29-17-20-00 +0000,wsj,Opinion | Britain Seems Committed to Stagnation,https://www.wsj.com/opinion/britain-seems-committed-to-stagnation-c33e5004
4,2026-01-29-13-53-55 +0000,nyt,Camping on Antarctica’s Thwaites Glacier,https://www.nytimes.com/2026/01/28/climate/antarctica-thwaites-glacier-drilling.html
3,2026-01-28-22-47-00 +0000,wsj,Opinion | Why the U.S. Needs Diego Garcia,https://www.wsj.com/opinion/diego-garcia-u-k-china-u-s-mauritius-military-base-donald-trump-01ad7f2f
2,2026-01-29-14-00-00 +0000,missionlocal,Friendly prescription,https://missionlocal.org/2026/01/friendly-prescription/
