score,pubdate,source,title,link
21,2026-01-31-02-44-17 +0000,nypost,"Crypto billionaires Chris Larsen, Tim Draper launch $40M ‘counterforce’ to fight tax-happy unions",https://nypost.com/2026/01/30/us-news/billionaires-chris-larsen-tim-draper-launch-anti-union-pac/
21,2026-01-31-02-51-06 +0000,nyt,‘Melania’ Review: 20 Stage-Managed Days in the Life of the First Lady,https://www.nytimes.com/2026/01/30/movies/melania-trump-movie-review.html
20,2026-01-30-11-00-00 +0000,latimes,California waits for a star to emerge in the 2026 race for governor,https://www.latimes.com/california/story/2026-01-30/california-waits-for-star-to-emerge-in-2026-race-for-governor
20,2026-01-30-17-00-00 +0000,wsj,Protein With a Side of Protein: Restaurants Change Up Menus to Lure Customers,https://www.wsj.com/business/hospitality/protein-food-restaurant-chain-406b5f2f?mod=pls_whats_news_us_business_f
20,2026-01-30-20-48-01 +0000,nyt,Ghislaine Maxwell appeared to receive a chummy missive in 2002 from a ‘Melania.’,https://www.nytimes.com/live/2026/01/30/us/epstein-files-release/ghislaine-maxwell-appeared-to-receive-a-chummy-missive-in-2002-from-a-melania
20,2026-01-30-13-05-25 +0000,bbc,Ex-Reform councillors join Advance UK party,https://www.bbc.com/news/articles/c5y3zy18vn0o?at_medium=RSS&at_campaign=rss
20,2026-01-30-12-40-00 +0000,wsj,Church & Dwight Logs Sales Growth,https://www.wsj.com/business/earnings/church-dwight-logs-sales-growth-becc0a1a?mod=pls_whats_news_us_business_f
20,2026-01-31-02-49-56 +0000,bbc,Stay or go - what's next for coyote that escaped to Alcatraz?,https://www.bbc.com/news/articles/c0q4y95yv4jo?at_medium=RSS&at_campaign=rss
20,2026-01-30-13-39-00 +0000,wsj,"Canadian National Railway Profit, Revenue Rise",https://www.wsj.com/business/earnings/canadian-national-railway-profit-revenue-rise-9a1f03f1?mod=pls_whats_news_us_business_f
20,2026-01-30-13-12-25 +0000,bbc,"At least 170 killed in air strikes during Myanmar's widely criticised election, UN says",https://www.bbc.com/news/articles/cg5gl8grv66o?at_medium=RSS&at_campaign=rss
20,2026-01-30-14-10-00 +0000,wsj,Zelensky Voices Support for U.S.-Backed ‘Energy Truce’ With Russia,https://www.wsj.com/world/zelensky-voices-support-for-u-s-backed-energy-truce-with-russia-1aeadb27
20,2026-01-30-16-02-00 +0000,wsj,American Express Revenue Rises as High-Income Consumers Keep Spending,https://www.wsj.com/business/earnings/american-express-profit-revenue-rise-on-increased-member-spending-2b3c010e?mod=pls_whats_news_us_business_f
20,2026-01-30-14-30-57 +0000,bbc,Kemi Badenoch denies sacked Tory's claim party doesn't allow free speech,https://www.bbc.com/news/articles/c62r1rgglgyo?at_medium=RSS&at_campaign=rss
20,2026-01-30-16-00-26 +0000,bbc,Greens name Gorton and Denton by-election pick,https://www.bbc.com/news/articles/cvgj5gplpl9o?at_medium=RSS&at_campaign=rss
20,2026-01-31-03-40-15 +0000,latimes,Cal Fire to probe Ventura County response to tractor blaze that reignited into Mountain fire,https://www.latimes.com/california/story/2026-01-30/cal-fire-investigates-response-to-tractor-blaze-that-reignited-as-mountain-fire
19,2026-01-30-10-20-29 +0000,bbc,Lib Dems name Gorton and Denton by-election choice,https://www.bbc.com/news/articles/c62w1202jj6o?at_medium=RSS&at_campaign=rss
19,2026-01-30-16-47-23 +0000,wapo,Belarusian balloons full of cigarettes pose NATO’s latest security threat,https://www.washingtonpost.com/world/2026/01/30/belarus-balloons-nato-russia-threat/
19,2026-01-31-01-41-31 +0000,startribune,"Maddyn Greenway joins 5,000-point club, becoming third girls basketball player to accomplish feat",https://www.startribune.com/maddyn-greenway-5000-points-providence-academy-blake-high-school-girls-basketball/601571699
19,2026-01-31-03-59-09 +0000,nypost,NASA stalls Artemis II moon launch due to rare arctic Florida outbreak,https://nypost.com/2026/01/30/us-news/nasa-stalls-artemis-ii-moon-launch-due-to-rare-arctic-florida-outbreak/
19,2026-01-30-10-30-00 +0000,wsj,Cracker Barrel Wants Its Staff to Eat One Thing on Work Trips: Cracker Barrel,https://www.wsj.com/lifestyle/workplace/cracker-barrel-work-trip-travel-expenses-meals-25eaf050?mod=pls_whats_news_us_business_f
19,2026-01-30-21-52-52 +0000,nyt,NASCAR Star’s Plane Had Several Instrument Failures Before Crash,https://www.nytimes.com/2026/01/30/us/biffle-nascar-crash-ntsb.html
18,2026-01-30-12-44-51 +0000,bbc,Social Democratic Party names by-election candidate,https://www.bbc.com/news/articles/c3dm39l254do?at_medium=RSS&at_campaign=rss
18,2026-01-30-16-24-18 +0000,bbc,"UN risks 'imminent financial collapse', secretary general warns",https://www.bbc.com/news/articles/cr579mdv4m7o?at_medium=RSS&at_campaign=rss
18,2026-01-30-16-10-24 +0000,bbc,South Africa and Israel expel each other's envoys in diplomatic row,https://www.bbc.com/news/articles/cvgn8ejljqwo?at_medium=RSS&at_campaign=rss
18,2026-01-30-19-14-32 +0000,nyt,Texas A&M Ends Women’s Studies and Overhauls Hundreds of Classes on Race and Gender,https://www.nytimes.com/2026/01/30/us/texas-am-gender-ethnic-womens-studies-academic-freedom.html
18,2026-01-30-21-31-44 +0000,nypost,IAF airstrike kills terrorists emerging from tunnel in Rafah as Hamas cease-fire continues,https://nypost.com/2026/01/30/world-news/iaf-airstrike-kills-terrorists-emerging-from-tunnel-in-rafah-as-hamas-cease-fire-continues/
18,2026-01-30-10-00-27 +0000,nyt,Lukoil Gas Station Franchisees Caught in a Fight Between US and Russia,https://www.nytimes.com/2026/01/30/business/energy-environment/lukoil-gas-stations-trump.html
18,2026-01-30-16-58-17 +0000,cbc,Appeal court rules in favour of Ottawa's toxic plastic listing,https://www.cbc.ca/news/politics/appeal-court-single-use-plastics-9.7066678?cmp=rss
18,2026-01-30-22-35-57 +0000,latimes,"Halfway through winter, heat is melting the California snowpack",https://www.latimes.com/environment/story/2026-01-30/california-warm-winter-little-snow
17,2026-01-30-22-29-51 +0000,startribune,Bar Brava closes indefinitely after fallout from owner’s social media posts,https://www.startribune.com/bar-brava-closes-indefinitely-after-fallout-from-owners-social-media-posts/601573064
17,2026-01-31-04-00-00 +0000,wsj,High-Profile Arrests Spark Exodus of Scam Workers in Cambodia,https://www.wsj.com/world/asia/high-profile-arrests-spark-exodus-of-scam-workers-in-cambodia-ad045325
17,2026-01-30-12-29-46 +0000,cbc,Lindsey Vonn says 'Olympic dream is not over' after crashing in last downhill before Winter Games,https://www.cbc.ca/sports/olympics/winter/alpine-skiing/lindsey-vonn-injured-alpine-skiing-crans-montana-9.7067806?cmp=rss
17,2026-01-31-00-30-05 +0000,cbc,Conservative Leader Pierre Poilievre wins leadership review with 87.4% approval,https://www.cbc.ca/news/politics/livestory/pierre-poilievre-speech-conservative-convention-leadership-review-live-updates-9.7068829?cmp=rss
17,2026-01-30-16-41-00 +0000,wsj,"Colgate Sales Rise, but Consumer Uncertainty Clouds Outlook",https://www.wsj.com/business/earnings/colgate-palmolive-swings-to-a-loss-on-charges-9c5715f2?mod=pls_whats_news_us_business_f
17,2026-01-31-01-07-35 +0000,nyt,"After Bovino Leaves, Minnesotans Search for Signs of Change in Crackdown",https://www.nytimes.com/2026/01/30/us/minneapolis-ice-crackdown-change.html
17,2026-01-30-18-05-51 +0000,bbc,"In this US county, measles starts to feel like next pandemic",https://www.bbc.com/news/articles/cwy10l9lwpyo?at_medium=RSS&at_campaign=rss
17,2026-01-30-10-00-47 +0000,wapo,A U.S. letter opposed Iraqis’ choice of prime minister. They went ahead anyway.,https://www.washingtonpost.com/world/2026/01/30/iraq-iran-nouri-maliki/
17,2026-01-30-22-08-04 +0000,nyt,Texas May Be Losing Its Grip as America’s Fastest-Growing State,https://www.nytimes.com/2026/01/30/us/texas-population-growth-migration-census.html
17,2026-01-30-20-16-00 +0000,wsj,U.S. Natural Gas Futures Rise on Weather-Driven Demand,https://www.wsj.com/articles/european-ttf-gas-rises-with-geopolitical-risks-adding-to-concerns-market-talk-dfad850d?mod=pls_whats_news_us_business_f
17,2026-01-31-05-01-07 +0000,nyt,"U.S. Allies Are Drawing Closer to China, but on Beijing’s Terms",https://www.nytimes.com/2026/01/31/world/asia/trump-xi-starmer-carney.html
17,2026-01-30-11-43-00 +0000,wsj,"Air Products Posts Higher Profit, Revenue on Pricing",https://www.wsj.com/business/earnings/air-products-posts-higher-profit-revenue-on-pricing-76d4086c?mod=pls_whats_news_us_business_f
17,2026-01-31-03-09-58 +0000,nypost,Cops launch frantic manhunt for violent offenders— including 3 murder suspects— who escaped Louisiana jail,https://nypost.com/2026/01/30/us-news/manhunt-launched-for-murder-suspects-who-escaped-louisiana-jail/
16,2026-01-30-18-34-00 +0000,wsj,Chevron CEO Says It’s Too Early to Determine Venezuela Outlook,https://www.wsj.com/business/earnings/exxon-chevron-post-slimmest-annual-profits-since-2021-b9b2e7aa?mod=pls_whats_news_us_business_f
16,2026-01-31-03-12-16 +0000,nypost,Sicko busted a third time for allegedly pretending to be disabled to get diaper changed,https://nypost.com/2026/01/30/us-news/sicko-busted-a-third-time-for-allegedly-pretending-to-be-disabled-to-get-diaper-changed/
16,2026-01-30-16-00-00 +0000,wsj,Pennsylvania Wins Bid for Eli Lilly Weight-Loss Drug Factory,https://www.wsj.com/business/pennsylvania-wins-bid-for-eli-lilly-weight-loss-drug-factory-651f9e8a?mod=pls_whats_news_us_business_f
16,2026-01-31-02-00-00 +0000,wsj,China’s PMI Falls in January,https://www.wsj.com/world/china/chinas-pmi-falls-in-january-5d41194b
16,2026-01-30-23-07-16 +0000,nypost,Scott Bessent eyes ‘top cop’ for Treasury to crack down on shady nonprofits,https://nypost.com/2026/01/30/business/scott-bessent-eyes-top-cop-for-treasury-to-crack-down-on-shady-nonprofits/
16,2026-01-30-22-47-00 +0000,wsj,UPS Finance Chief Says Delivery Giant Is Hard at Work Right-Sizing,https://www.wsj.com/articles/ups-finance-chief-says-delivery-giant-is-hard-at-work-right-sizing-0530b6a0?mod=pls_whats_news_us_business_f
16,2026-01-30-09-22-00 +0000,wsj,"Adidas Shares Gain After Buyback Plan, Revenue Rise",https://www.wsj.com/business/retail/adidas-shares-gain-after-buyback-plan-revenue-rise-cbabb486?mod=rss_markets_main
16,2026-01-30-10-00-20 +0000,nyt,Russia Is Finding the Gaps in Ukraine’s Front Line,https://www.nytimes.com/2026/01/30/world/europe/ukraine-war-zaporizhzhia-huliaipole.html
15,2026-01-31-01-21-31 +0000,cbc,Canadian Armed Forces member dies in Latvia,https://www.cbc.ca/news/politics/caf-member-latvia-death-9.7069298?cmp=rss
15,2026-01-30-23-33-00 +0000,wsj,Tensions Mount Over Compliance With Judges’ Orders in Immigration Crackdown,https://www.wsj.com/us-news/law/tensions-mount-over-compliance-with-judges-orders-in-immigration-crackdown-f2f356c1
15,2026-01-30-17-19-14 +0000,bbc,Watch: The dog breed that stands out in Westminster's agility competition,https://www.bbc.com/news/videos/cgrd7w9lyx2o?at_medium=RSS&at_campaign=rss
15,2026-01-30-17-39-00 +0000,wsj,Auto & Transport Roundup: Market Talk,https://www.wsj.com/articles/auto-transport-roundup-market-talk-ab0dd669?mod=pls_whats_news_us_business_f
15,2026-01-30-21-15-34 +0000,cbc,"Military men facing terrorism charges prepared for zombie apocalypse, informant alleges",https://www.cbc.ca/news/canada/montreal/former-members-of-military-facing-terrorism-charges-informant-9.7068700?cmp=rss
15,2026-01-30-20-33-38 +0000,nyt,"Hotel Owners and Workers, Tell Us How You’re Feeling",https://www.nytimes.com/2026/01/30/travel/ice-hotels-immigration.html
15,2026-01-31-04-05-36 +0000,nyt,Here’s the latest.,https://www.nytimes.com/2026/01/30/us/heres-the-latest.html
15,2026-01-30-14-00-07 +0000,nyt,Tips for Lowering Your Credit Card Interest Rate,https://www.nytimes.com/2026/01/30/your-money/credit-card-debt-interest-rates.html
15,2026-01-30-13-01-03 +0000,wapo,"Crossing guard’s assist prompts $8,000 in donations: ‘I like being a helper’",https://www.washingtonpost.com/lifestyle/2026/01/30/chicago-crossing-guard-fundraiser-kindness/
15,2026-01-31-04-39-28 +0000,startribune,No. 3 Gophers women’s hockey beats top-ranked Wisconsin 3-2 in overtime,https://www.startribune.com/no-3-gophers-womens-hockey-beats-top-ranked-wisconsin-3-2-in-overtime/601574433
15,2026-01-30-13-37-30 +0000,nyt,Xi’s Military Purge May Set Back His Taiwan Ambitions,https://www.nytimes.com/2026/01/29/world/asia/xi-military-purge-taiwan.html
14,2026-01-30-20-01-02 +0000,nypost,"$100k in stolen merch, including Lululemon, recovered in massive retail theft operation",https://nypost.com/2026/01/30/business/100k-in-stolen-merch-including-lululemon-recovered-in-massive-retail-theft-operation/
14,2026-01-30-11-00-00 +0000,wsj,Four More States Weigh Bans on Private-Equity Interference in Medical Care,https://www.wsj.com/articles/four-more-states-weigh-bans-on-private-equity-interference-in-medical-care-fb4ddd0a?mod=rss_markets_main
14,2026-01-30-21-01-38 +0000,nyt,How Strong Is Your Financial Knowledge? Take Our Quiz.,https://www.nytimes.com/2026/01/30/business/financial-knowledge-quiz.html
14,2026-01-30-20-34-00 +0000,wsj,OnlyFans in Talks to Sell Majority Stake to Investment Firm,https://www.wsj.com/business/deals/onlyfans-in-talks-to-sell-majority-stake-to-investment-firm-61f9971f?mod=pls_whats_news_us_business_f
14,2026-01-31-01-05-04 +0000,nyt,F.B.I. Presentation Outlines Allegations Against Powerful Men,https://www.nytimes.com/2026/01/30/us/fbi-presentation-powerful-men.html
14,2026-01-30-13-03-42 +0000,nyt,Can Food Be Art? Denmark Is Finding Out.,https://www.nytimes.com/2026/01/30/arts/denmark-food-fine-art-chefs.html
14,2026-01-31-02-36-29 +0000,nypost,Families warned not to drink tap water as concerns grow over Atlanta airport fuel spill,https://nypost.com/2026/01/30/us-news/atlanta-town-warns-against-drinking-tap-water-after-airport-fuel-spill/
14,2026-01-30-22-53-00 +0000,wsj,Opinion | How States Can Improve School Choice,https://www.wsj.com/opinion/states-school-choice-education-savings-accounts-15dd5ee5
14,2026-01-31-00-05-52 +0000,bbc,This army chief threatened to castrate opposition leader and claimed descent from Jesus,https://www.bbc.com/news/articles/cdjnp9m8wvgo?at_medium=RSS&at_campaign=rss
14,2026-01-30-23-47-54 +0000,nyt,Jeff Bezos’s Rocket Company Blue Origin Pauses Space Tourism to Focus on the Moon,https://www.nytimes.com/2026/01/30/science/blue-origin-new-shepard-rocket-bezos.html
14,2026-01-30-18-21-00 +0000,wsj,"Charter Mobile, Video Growth Offsets Internet Subscriber Declines",https://www.wsj.com/business/earnings/charter-revenue-hurt-by-declines-in-internet-subscriber-volumes-afa31d47?mod=pls_whats_news_us_business_f
14,2026-01-30-18-42-52 +0000,bbc,Lobbyists' trade body calls for urgent reform after Jim Murphy 'errors',https://www.bbc.com/news/articles/clyz5vely7wo?at_medium=RSS&at_campaign=rss
14,2026-01-30-22-03-00 +0000,wsj,Basic Materials Roundup: Market Talk,https://www.wsj.com/business/basic-materials-roundup-market-talk-7633b041?mod=rss_markets_main
14,2026-01-30-22-03-00 +0000,wsj,Gold and Silver Plunge in Worst Day Since 1980,https://www.wsj.com/finance/commodities-futures/gold-and-silver-plunge-in-worst-day-since-1980-df812b73?mod=rss_markets_main
14,2026-01-30-22-59-47 +0000,startribune,Scoggins: Kwesi Adofo-Mensah’s draft failures led to Vikings GM’s ouster,https://www.startribune.com/vikings-fire-general-manager-kwesi-adofo-mensah-mark-wilf-nfl-draft/601574076
14,2026-01-30-16-02-00 +0000,wsj,John Grisham Details the Routine That Has Churned Out Bestsellers for 40 Years,https://www.wsj.com/business/media/john-grisham-routine-widow-firm-6229b181?mod=pls_whats_news_us_business_f
14,2026-01-31-03-05-47 +0000,latimes,Austin Beutner's daughter found beside a highway in Palmdale the night she died,https://www.latimes.com/california/story/2026-01-30/austin-beutners-daughter-found-beside-highway-in-palmdale-night-she-died
13,2026-01-30-10-30-00 +0000,wsj,Memory Shortage Haunts Apple’s Blowout iPhone Sales,https://www.wsj.com/tech/memory-shortage-haunts-apples-blowout-iphone-sales-0410e375?mod=rss_markets_main
13,2026-01-30-17-25-09 +0000,bbc,Suspected jihadists attack airport near Niger's capital,https://www.bbc.com/news/articles/cvgp47neze4o?at_medium=RSS&at_campaign=rss
13,2026-01-30-14-16-48 +0000,nyt,How DoorDash and Other Food Delivery Apps Are Reshaping Mealtime in the U.S.,https://www.nytimes.com/2026/01/30/dining/food-delivery-apps-doordash-uber.html
13,2026-01-30-11-38-08 +0000,bbc,Inside Syrian camp holding wives and children of suspected IS fighters,https://www.bbc.com/news/videos/c3ve0xd451go?at_medium=RSS&at_campaign=rss
13,2026-01-30-21-44-00 +0000,wsj,SEC Names Retired EY Partner to Run Audit Watchdog,https://www.wsj.com/articles/sec-names-retired-ey-partner-to-run-audit-watchdog-f6eac6e9?mod=pls_whats_news_us_business_f
13,2026-01-30-13-57-56 +0000,bbc,Burkina Faso junta announces ban on all political parties,https://www.bbc.com/news/articles/cevnlv9my1no?at_medium=RSS&at_campaign=rss
13,2026-01-30-13-30-27 +0000,bbc,How Guest Dragon Jenna Meek likes to do business,https://www.bbc.com/news/videos/cx2xk9w6ewzo?at_medium=RSS&at_campaign=rss
13,2026-01-30-18-09-20 +0000,bbc,Mali lawmaker jailed in Ivory Coast for insulting president,https://www.bbc.com/news/articles/c74vgxp0zr4o?at_medium=RSS&at_campaign=rss
13,2026-01-30-13-00-46 +0000,bbc,Chinese whisky tariff cut to come into force on Monday,https://www.bbc.com/news/articles/c4g54xzzze0o?at_medium=RSS&at_campaign=rss
12,2026-01-30-14-00-00 +0000,missionlocal,"Girrrrl, you go!",https://missionlocal.org/2026/01/girrrrl-you-go/
12,2026-01-30-19-11-49 +0000,nyt,Chevron Points to Venezuela’s Promise as Big Oil Earnings Fall,https://www.nytimes.com/2026/01/30/business/energy-environment/chevron-exxon-mobil-earnings.html
12,2026-01-30-19-59-39 +0000,nyt,"Tesla’s Model S, Soon to Be History, Changed the Auto Industry",https://www.nytimes.com/2026/01/30/business/tesla-model-s-history.html
12,2026-01-30-22-30-00 +0000,wsj,Opinion | A Tiananmen Memory Crime in Hong Kong,https://www.wsj.com/opinion/hong-kong-tiananmen-square-vigil-trial-chow-hang-tung-albert-ho-lee-cheuk-yan-e9815d1f
12,2026-01-30-12-00-00 +0000,nypost,Why Zohran Mamdani’s commie compulsions aren’t causing bond investors to panic,https://nypost.com/2026/01/30/business/why-zohran-mamdanis-commie-compulsions-arent-causing-bond-investors-to-panic/
12,2026-01-30-12-54-17 +0000,nypost,"Colorado’s Metropolitan State University allegedly reserved scholarships for non-whites, illegal immigrants",https://nypost.com/2026/01/30/us-news/colorados-metropolitan-state-university-accused-of-reserving-scholarships-for-non-whites-illegal-immigrants/
12,2026-01-31-01-35-00 +0000,wsj,Elon Musk’s SpaceX and xAI Are Planning a Megamerger of Rockets and AI,https://www.wsj.com/tech/elon-musks-spacex-and-xai-are-planning-a-megamerger-of-rockets-and-ai-28e72fa9?mod=pls_whats_news_us_business_f
11,2026-01-30-11-30-00 +0000,wapo,Arkansas moves to ban books in prisons as a drug-fighting measure,https://www.washingtonpost.com/nation/2026/01/30/arkansas-prisons-book-ban-drugs/
11,2026-01-30-22-51-47 +0000,nyt,"‘Produce Pete’ Napolitano, a Fruit and Vegetable Celebrity, Dies at 80",https://www.nytimes.com/2026/01/30/business/media/produce-pete-napolitano-dead.html
11,2026-01-31-00-09-38 +0000,nyt,U.N. Says It’s in Danger of Financial Collapse Because of Members’ Unpaid Dues,https://www.nytimes.com/2026/01/30/world/americas/un-finances-collapse-debts.html
11,2026-01-30-19-14-05 +0000,nyt,Hollywood’s North Road Studio Acquired by the European Production Giant Mediawan,https://www.nytimes.com/2026/01/30/business/north-road-mediawan-deal.html
11,2026-01-30-20-21-40 +0000,wapo,"What to know about the deadly Nipah virus, amid outbreak in India",https://www.washingtonpost.com/world/2026/01/27/nipah-virus-outbreak-india/
11,2026-01-31-03-03-31 +0000,bbc,What we learned - and didn't - from the Melania documentary,https://www.bbc.com/news/articles/cwy1ed1vgxro?at_medium=RSS&at_campaign=rss
11,2026-01-30-13-46-55 +0000,nyt,A Challenge for Britain’s Royal Mail: Proving It Can Deliver the Mail,https://www.nytimes.com/2026/01/30/world/europe/uk-royal-mail-post-service-delays.html
11,2026-01-30-17-20-00 +0000,wsj,Impossible Foods CEO McGuinness to Step Down,https://www.wsj.com/business/impossible-foods-ceo-mcguinness-to-step-down-5ddaec33?mod=pls_whats_news_us_business_f
10,2026-01-30-18-16-00 +0000,wsj,Opinion | The Empty Moralizing of Canada’s Mark Carney,https://www.wsj.com/opinion/the-empty-moralizing-of-canadas-mark-carney-cf1ab234
10,2026-01-30-20-15-30 +0000,nyt,"Svalbard Polar Bears Are Getting Fatter (for Now), Study Finds",https://www.nytimes.com/2026/01/29/climate/polar-bears-svalbard.html
10,2026-01-30-18-54-00 +0000,wsj,Comex Gold Ends the Month 8.98% Higher at $4713.90,https://www.wsj.com/finance/commodities-futures/gold-rises-amid-ongoing-iran-tensions-7cdad827?mod=rss_markets_main
10,2026-01-30-14-07-00 +0000,wsj,Wholesale Prices Rose More Than Expected in December,https://www.wsj.com/economy/central-banking/wholesale-prices-rose-more-than-expected-in-december-ead013c5
10,2026-01-30-21-50-13 +0000,nyt,"Dan McQuade, a Catalyst in Cosby’s Downfall, Dies at 43",https://www.nytimes.com/2026/01/30/us/dan-mcquade-dead.html
9,2026-01-30-14-19-32 +0000,bbc,Lindsey Vonn airlifted to hospital after crash in Switzerland,https://www.bbc.com/sport/articles/c0erj11j3v2o?at_medium=RSS&at_campaign=rss
9,2026-01-30-17-59-02 +0000,nyt,Drilling Through the Thwaites Glacier for Clues to Its Melting,https://www.nytimes.com/2026/01/30/climate/antarctica-thwaites-glacier-drilling.html
8,2026-01-30-19-51-55 +0000,cbc,"Advocates call for federal, provincial governments to strengthen child-care system",https://www.cbc.ca/news/politics/child-care-advocates-increased-support-program-9.7068636?cmp=rss
8,2026-01-30-22-31-00 +0000,wsj,Opinion | Gavin Newsom Opines on Wealth and Taxes,https://www.wsj.com/opinion/california-wealth-tax-gavin-newsom-billionaires-13c91e8e
8,2026-01-31-00-01-04 +0000,bbc,An ingredient for this curry is missing - and in eight minutes it's at the door,https://www.bbc.com/news/articles/cvgx7ykl12go?at_medium=RSS&at_campaign=rss
8,2026-01-30-17-17-03 +0000,nyt,Argentina in Advanced Talks to Become Destination for U.S. Deportations,https://www.nytimes.com/2026/01/30/world/americas/argentina-us-deportations-immigrants-milei.html
8,2026-01-30-22-40-47 +0000,cbc,Alberta separatism casts shadow over Conservative convention,https://www.cbc.ca/news/canada/calgary/alberta-separatism-conservative-party-pierre-poilievre-9.7068928?cmp=rss
7,2026-01-30-14-53-37 +0000,bbc,Retail price index rose by 2.8% in 2025,https://www.bbc.com/news/articles/ce8rk0je220o?at_medium=RSS&at_campaign=rss
7,2026-01-30-10-00-14 +0000,nyt,Can Josh D’Amaro Break Disney’s Succession Curse?,https://www.nytimes.com/2026/01/30/business/media/disney-ceo.html
7,2026-01-30-22-43-00 +0000,missionlocal,El SFUSD está desestimando a los estudiantes inmigrantes,https://missionlocal.org/2026/01/el-sfusd-esta-desestimando-a-los-estudiantes-inmigrantes/
7,2026-01-30-16-36-00 +0000,wsj,Opinion | E-Ledgers Put Corporate Climate Accountability at Risk,https://www.wsj.com/opinion/e-ledgers-put-corporate-climate-accountability-at-risk-7ceaedb5?mod=pls_whats_news_us_business_f
7,2026-01-30-17-36-41 +0000,nyt,Three Great Documentaries to Stream,https://www.nytimes.com/2026/01/29/movies/three-great-documentaries-to-stream.html
6,2026-01-30-13-00-00 +0000,nypost,Divergent is changing the ways cars are made,https://nypost.com/2026/01/30/business/divergent-is-changing-the-ways-cars-are-made/
6,2026-01-30-11-25-00 +0000,wsj,Cruise Investors Got a Cabin Upgrade,https://www.wsj.com/finance/stocks/cruise-investors-got-a-cabin-upgrade-1de373fb?mod=rss_markets_main
1,2026-01-30-18-19-00 +0000,bbc,Americast,https://www.bbc.co.uk/sounds/play/w3ct8bz2?at_medium=RSS&at_campaign=rss
