score,pubdate,source,title,link
76,2026-02-14-15-01-39 +0000,nypost,Marco Rubio calls on Europe to join new world order: ‘Trump demands seriousness and reciprocity’,https://nypost.com/2026/02/14/world-news/marco-rubio-calls-us-child-of-europe-in-push-to-dismiss-end-of-the-transatlantic-era-claims/
60,2026-02-13-22-19-13 +0000,latimes,Newsom tells world leaders Trump's retreat on the environment will mean economic harm,https://www.latimes.com/california/story/2026-02-13/newsom-tells-world-leaders-trumps-retreat-on-environment-will-mean-economic-harm
57,2026-02-13-22-30-21 +0000,nyt,"At Munich Summit, European Leaders Agree With Trump: The Old World Order Is Over",https://www.nytimes.com/2026/02/13/world/europe/munich-security-conference-nato-rubio.html
55,2026-02-14-19-46-33 +0000,nyt,"In Munich, Europe Says It Is ‘De-risking’ From the U.S. Amid Trump’s Unpredictability",https://www.nytimes.com/2026/02/14/world/europe/europe-munich-rubio-russia.html
55,2026-02-14-17-47-57 +0000,wapo,"Rubio says U.S., Europe ‘belong together,’ despite rifts over Trump policies",https://www.washingtonpost.com/politics/2026/02/14/munich-security-conference-rubio-europe/
53,2026-02-14-02-40-00 +0000,cbc,Trump says regime change 'seems' to be 'best thing that could happen' for Iran,https://www.cbc.ca/news/world/iran-us-trump-regime-change-carrier-9.7089944?cmp=rss
53,2026-02-13-23-36-59 +0000,nyt,Trump Says Regime Change Would Be the ‘Best Thing’ for Iran,https://www.nytimes.com/2026/02/13/us/politics/trump-iran-regime-change.html
52,2026-02-13-23-14-00 +0000,wsj,The Trump administration Friday released its long-awaited road map for how it plans to resurrect the U.S. maritime industry,https://www.wsj.com/articles/white-house-pitches-new-fees-incentives-to-fund-maritime-revival-0d416844
51,2026-02-14-01-54-39 +0000,nyt,Trump Files Final Plans for White House Ballroom,https://www.nytimes.com/2026/02/13/us/politics/trump-white-house-ballroom-plans.html
51,2026-02-14-11-00-58 +0000,nyt,Democrats in Illinois Senate Primary Debate How to Combat Trump’s ICE,https://www.nytimes.com/2026/02/14/us/politics/democrats-illinois-senate-ice-trump.html
50,2026-02-14-01-53-44 +0000,nyt,"Ramping Up Election Attacks, Trump Does Not Let Reality Get in His Way",https://www.nytimes.com/2026/02/13/us/politics/trump-elections-midterms-voter-id.html
49,2026-02-14-06-47-49 +0000,nypost,"White House unveils cheeky Valentine’s Day cards featuring Maduro, Rubio and the shutdown sombrero: ‘You captured my heart’",https://nypost.com/2026/02/14/us-news/white-house-unveils-cheeky-valentines-day-cards-featuring-maduro-rubio-and-the-shutdown-sombrero/
48,2026-02-14-19-54-18 +0000,nypost,Witkoff and Kushner reportedly tell Trump nuclear deal with Iran ‘difficult to impossible’,https://nypost.com/2026/02/14/world-news/witkoff-and-kushner-reportedly-tell-trump-nuclear-deal-with-iran-difficult-to-impossible/
48,2026-02-14-02-00-00 +0000,wsj,"As midterm elections approach, some rank-and-file House Republicans are starting to show independence from President Trump",https://www.wsj.com/politics/policy/trump-is-having-to-work-harder-than-ever-to-keep-gop-in-line-efb653c6
48,2026-02-13-23-23-00 +0000,wsj,The Trump administration is considering an overhaul of steel and aluminum tariffs that is in part likely to reduce levies on many consumer goods,https://www.wsj.com/economy/trade/trumps-team-considers-overhaul-to-steel-and-aluminum-tariffs-5e54d947
47,2026-02-14-11-00-00 +0000,latimes,Criticism by Winter Olympic athletes of Trump policies mirror reaction to iconic 1968 protest,https://www.latimes.com/entertainment-arts/tv/story/2026-02-14/winter-olympics-athletes-criticism-trump-administration-1968-protest
47,2026-02-14-03-59-05 +0000,nypost,Rosie O’Donnell quietly slips back into US after defecting to Ireland after Trump’s re-election,https://nypost.com/2026/02/13/us-news/rosie-odonnell-slips-back-into-us-after-defecting-to-ireland-after-trumps-re-election/
47,2026-02-13-22-27-00 +0000,wsj,Opinion | You’re Paying 90% of Trump’s Tariffs,https://www.wsj.com/opinion/donald-trump-tariffs-consumers-new-york-federal-reserve-study-95bed1bc
47,2026-02-14-16-29-44 +0000,nypost,Pam Bondi was mocked for calling out  crime in Culver City. Days later a man was shot dead at a mall there,https://nypost.com/2026/02/14/us-news/man-dead-following-culver-city-mall-shooting/
46,2026-02-14-17-45-57 +0000,nypost,Trump slams Bill Maher in Truth Social post as ‘extremely nervous’ with ‘ZERO confidence in himself’,https://nypost.com/2026/02/14/us-news/trump-slams-bill-maher-in-truth-social-post-as-extremely-nervous-zero-confidence-in-himself/
46,2026-02-14-01-47-42 +0000,nyt,Trump’s Actions Test the Fragile World of Air Travel,https://www.nytimes.com/2026/02/12/business/air-travel-trump-el-paso.html
45,2026-02-14-01-35-22 +0000,latimes,Trump administration drops appeal of court order blocking $1.2-billion UCLA settlement,https://www.latimes.com/california/story/2026-02-13/trump-drops-appeal-of-court-order-blocking-uc-ucla-settlement
45,2026-02-13-22-00-08 +0000,nypost,Trump says Zelensky must ‘get moving’ with Ukraine peace talks,https://nypost.com/2026/02/13/us-news/trump-says-zelensky-must-get-moving-with-ukraine-peace-talks/
45,2026-02-13-23-05-05 +0000,nyt,Trump’s ‘Board of Peace’ Said to Have Raised First Pledges for Gaza,https://www.nytimes.com/2026/02/13/world/middleeast/board-peace-pledges-gaza.html
44,2026-02-13-23-45-00 +0000,wsj,Anthropic’s artificial-intelligence tool Claude was used in the U.S. military’s operation to capture former Venezuelan President Nicolás Maduro,https://www.wsj.com/politics/national-security/pentagon-used-anthropics-claude-in-maduro-venezuela-raid-583aff17
44,2026-02-14-09-26-53 +0000,nyt,First U.S. Troops Land in Nigeria for Trump-Led Christian Mission,https://www.nytimes.com/2026/02/13/world/africa/nigeria-us-military-christian-trump.html
43,2026-02-14-05-36-09 +0000,nypost,Lindsey Graham’s message to Europeans ‘nervous’ about Trump: ‘Who gives a s–t who owns Greenland?’,https://nypost.com/2026/02/14/us-news/lindsey-grahams-message-to-europeans-nervous-about-trump-who-gives-a-s-t-who-owns-greenland/
43,2026-02-14-00-22-58 +0000,cbc,'Canadians are with you. We will always be with you': PM addresses vigil for Tumbler Ridge shooting victims,https://www.cbc.ca/news/canada/british-columbia/tumbler-ridge-mass-shooting-vigil-9.7089792?cmp=rss
43,2026-02-13-22-37-50 +0000,wapo,U.S. orders second aircraft carrier to Middle East as Trump pressures Iran,https://www.washingtonpost.com/national-security/2026/02/13/trump-iran-aircraft-carrier-gerald-ford/
42,2026-02-14-13-34-40 +0000,cbc,"Alexei Navalny was poisoned by Kremlin with dart frog toxin, European nations say",https://www.cbc.ca/news/world/russia-navalny-european-nations-poisoned-kremlin-9.7090292?cmp=rss
41,2026-02-14-13-30-00 +0000,nypost,Floodgates closed: 8 in 10 asylum seekers now booted by judges as Trump attempts to restore borders,https://nypost.com/2026/02/14/us-news/eight-of-10-asylum-seekers-now-booted-by-judges-as-trump-restores-borders/
41,2026-02-14-12-00-25 +0000,wapo,First major protests since capture of Maduro test Venezuela’s new leader,https://www.washingtonpost.com/world/interactive/2026/venezuela-protests-prisoners-photos-maduro/
41,2026-02-14-12-00-00 +0000,startribune,Minneapolis has 950 surveillance cameras. Some want their footage saved longer amid ICE operation.,https://www.startribune.com/minneapolis-surveillance-cameras-retention-ice/601579475
41,2026-02-14-20-46-10 +0000,nyt,"Live Updates: In Munich, Rubio Calls Europe a Friend but Says It Must Change",https://www.nytimes.com/live/2026/02/14/world/munich-security-conference-rubio
41,2026-02-14-17-00-14 +0000,bbc,"Russia killed opposition leader Alexei Navalny using dart frog toxin, UK says",https://www.bbc.com/news/articles/cwyk4lz4e3eo?at_medium=RSS&at_campaign=rss
40,2026-02-13-22-07-58 +0000,nypost,White House unleashes at Gavin Newsom’s European ‘vanity project’ – as Gov makes shocking claim about auto industry,https://nypost.com/2026/02/13/us-news/newsom-calls-climate-rollback-death-sentence-for-carmakers/
40,2026-02-14-17-00-00 +0000,wsj,Canada Has a Secessionist Movement on Its Hands. Its Supporters Thank Trump.,https://www.wsj.com/world/americas/alberta-canada-independence-7549e240
39,2026-02-13-23-24-03 +0000,nyt,Homeland Security Demands Social Media Sites Reveal Names Behind Anti-ICE Posts,https://www.nytimes.com/2026/02/13/technology/dhs-anti-ice-social-media.html
39,2026-02-13-23-24-35 +0000,nyt,"Who Is Jeremy Carl, Trump’s Nominee for a Senior State Department Post?",https://www.nytimes.com/2026/02/13/us/politics/jeremy-carl-claremont-institute-senate-hearing.html
39,2026-02-14-05-25-21 +0000,nyt,Casey Wasserman Will Sell Entertainment Agency Amid Epstein Files Fallout,https://www.nytimes.com/2026/02/13/us/casey-wasserman-agency-epstein.html
38,2026-02-14-15-08-20 +0000,nypost,Savannah Guthrie’s husband Michael Feldman seen in public for first time since mother-in-law Nancy vanished,https://nypost.com/2026/02/14/us-news/savannah-guthries-husband-seen-in-public-for-first-time-since-nancy-guthrie-vanished/
38,2026-02-14-17-27-30 +0000,nyt,"ICE Agents Menaced Minnesota Protesters at Their Homes, Filings Say",https://www.nytimes.com/2026/02/13/us/minneapolis-ice-agents-protester-home-visits.html
37,2026-02-13-22-29-00 +0000,wsj,"Opinion | Mr. Trump, Free the Venezuelan 676",https://www.wsj.com/opinion/venezuela-political-prisoners-donald-trump-delcy-rodriguez-5e10ecb7
37,2026-02-14-16-00-54 +0000,bbc,"Europe must be ready to fight, PM tells Munich Security Conference",https://www.bbc.com/news/articles/cp853p5g9meo?at_medium=RSS&at_campaign=rss
37,2026-02-14-13-37-52 +0000,nypost,"Russian opposition leader Alexei Navalny poisoned by highly lethal dart frog toxin, widow says",https://nypost.com/2026/02/14/world-news/russian-opposition-leader-alexei-navalny-poisoned-by-highly-lethal-dart-frog-toxin-widow-says/
36,2026-02-14-17-02-08 +0000,nypost,200K protesters fight Iran’s Islamic Republic as exiled crown prince leads charge in Munich: ‘Hour of profound peril’,https://nypost.com/2026/02/14/world-news/200k-protesters-take-to-streets-of-munich-against-irans-islamic-republic/
36,2026-02-14-17-46-16 +0000,nyt,"Navalny Was Poisoned With Frog Toxin, European Governments Say",https://www.nytimes.com/2026/02/14/world/europe/russia-navalny-poison.html
35,2026-02-14-13-12-28 +0000,nyt,"Amid Fallout From Epstein Files, Dubai’s DP World Boss Is Replaced",https://www.nytimes.com/2026/02/13/world/middleeast/epstein-dp-world-ports-ahmed-bin-sulayem.html
35,2026-02-14-03-45-00 +0000,wsj,Casey Wasserman Is Putting His Talent Agency Up for Sale After Epstein Fallout,https://www.wsj.com/business/casey-wasserman-putting-his-talent-agency-up-for-sale-after-epstein-fallout-7eed1433?mod=pls_whats_news_us_business_f
35,2026-02-14-10-26-55 +0000,nypost,AI tool Claude helped capture Venezuelan dictator Nicolás Maduro in US military raid operation: report,https://nypost.com/2026/02/14/world-news/ai-tool-claude-helped-capture-venezuelan-dictator-nicolas-maduro-in-us-military-raid-operation-report/
34,2026-02-14-20-48-00 +0000,bbc,No arrests made after police search residence near Nancy Guthrie's home,https://www.bbc.com/news/articles/cly8j19rql7o?at_medium=RSS&at_campaign=rss
34,2026-02-14-17-38-58 +0000,nypost,White House rips Gavin Newsom for ditching his state for another overseas trip: ‘Should be fixing California’,https://nypost.com/2026/02/14/us-news/gavin-newsom-calls-trump-un-american-after-ditching-california-for-second-overseas-trip-in-less-than-a-month/
33,2026-02-14-12-00-00 +0000,latimes,"Lopez: In 50-year fight to protect California's coast, they're the real McCoys, still at it in their 80s",https://www.latimes.com/california/story/2026-02-14/in-50-year-fight-to-protect-californias-coast-theyre-still-at-it-in-their-80s
33,2026-02-14-16-00-00 +0000,startribune,"Minnesota’s ICE surge might not last forever, but these tattoos will",https://www.startribune.com/minnesotas-ice-surge-might-not-last-forever-but-these-tattoos-will/601576668
33,2026-02-13-22-48-03 +0000,cbc,The ‘Arc de Trump’ | About That,https://www.cbc.ca/player/play/9.7089576?cmp=rss
32,2026-02-13-22-13-46 +0000,nypost,Here’s the crude email exchange with Jeffrey Epstein that ended Kathy Ruemmler’s stint as Goldman Sachs’ top lawyer,https://nypost.com/2026/02/13/business/heres-the-crude-email-exchange-with-jeffrey-epstein-that-ended-kathy-ruemmlers-stint-as-goldman-sachs-top-lawyer/
32,2026-02-14-18-05-00 +0000,nypost,"Maniac pushes woman onto NYC subway tracks, punches second female straphanger in face: ‘Lock him up!’",https://nypost.com/2026/02/14/us-news/women-pushed-onto-nyc-subway-tracks-punched-in-face/
31,2026-02-14-19-53-58 +0000,startribune,"Live: As ICE operation winds down, Minnesotans grapple with what it leaves behind",https://www.startribune.com/ice-raids-minnesota/601546426
31,2026-02-14-19-32-13 +0000,nyt,"Europe’s Reaction to Rubio: Relief, Up to a Point",https://www.nytimes.com/2026/02/14/world/europe/europe-reaction-rubio.html
31,2026-02-14-13-16-08 +0000,nypost,"Officials made decoy Jeffrey Epstein body to ‘thwart’ media, move corpse unnoticed after suicide: DOJ files",https://nypost.com/2026/02/14/us-news/officials-made-decoy-epstein-body-to-thwart-the-media-and-move-pedos-body-to-hospital-unnoticed/
31,2026-02-14-12-00-00 +0000,startribune,"Four issues to watch as Minnesota Legislature convenes in wake of ICE surge, Hortman slaying",https://www.startribune.com/four-issues-to-watch-as-minnesota-legislature-convenes-in-wake-of-ice-surge-hortman-slaying/601579352
31,2026-02-14-18-56-25 +0000,nypost,"Iran’s exiled Crown Prince urges US military action with regime on brink of collapse, says negotiations futile",https://nypost.com/2026/02/14/world-news/irans-exiled-crown-prince-urges-us-military-action-with-regime-on-brink-of-collapse/
31,2026-02-14-20-47-25 +0000,wapo,Authorities conduct operation near Nancy Guthrie’s home in Tucson,https://www.washingtonpost.com/nation/2026/02/14/nancy-guthrie-missing-update/
30,2026-02-14-05-01-00 +0000,wsj,How a Homeland Security Shutdown Affects ICE and TSA,https://www.wsj.com/us-news/homeland-security-government-shutdown-e6ee00c5
30,2026-02-14-00-56-33 +0000,nyt,"After a Misstep, Sheriff Says Persistence Will Solve the Nancy Guthrie Case",https://www.nytimes.com/2026/02/13/us/after-a-misstep-sheriff-says-persistence-will-solve-the-guthrie-case.html
30,2026-02-14-19-10-38 +0000,nyt,Thousands Rally for Iran Regime Change in Cities Around the World,https://www.nytimes.com/2026/02/14/world/europe/iran-regime-rallies-munich.html
30,2026-02-14-16-22-00 +0000,wsj,"Navalny Killed by Poison Frog Toxin, European Governments Say",https://www.wsj.com/world/russia/navalny-killed-by-poison-frog-toxin-european-governments-say-7ca4b388
30,2026-02-14-15-27-35 +0000,nypost,FBI seizes Range Rover from parking lot two miles from Nancy Guthrie’s home: report,https://nypost.com/2026/02/14/us-news/fbi-seizes-range-rover-in-parking-lot-near-nancy-guthries-home/
30,2026-02-14-19-58-03 +0000,nypost,Nancy Guthrie kidnapper’s possible looks revealed by forensic artist after reviewing surveillance footage,https://nypost.com/2026/02/14/us-news/foresnsic-artist-lois-gibson-releases-sketch-of-nancy-guthrie-suspect/
30,2026-02-14-00-03-22 +0000,bbc,He was once a teen 'superstar'. Why did James Van Der Beek need help to pay his medical bills?,https://www.bbc.com/news/articles/cx2dw01p7k8o?at_medium=RSS&at_campaign=rss
30,2026-02-14-00-03-33 +0000,bbc,Can Bangladesh's new leader bring change after election landslide?,https://www.bbc.com/news/articles/cn0ex5d4g6xo?at_medium=RSS&at_campaign=rss
30,2026-02-13-23-14-00 +0000,wsj,"White House Pitches New Fees, Incentives to Fund Maritime Revival",https://www.wsj.com/articles/white-house-pitches-new-fees-incentives-to-fund-maritime-revival-0d416844?mod=pls_whats_news_us_business_f
30,2026-02-13-22-32-02 +0000,bbc,"ICE agents may have lied about shooting of migrant in Minneapolis, officials say",https://www.bbc.com/news/articles/cy8l9jp1z3yo?at_medium=RSS&at_campaign=rss
29,2026-02-14-15-30-57 +0000,nypost,A look inside Zohran Mamdani’s socialist dream to shake up NYC transit,https://nypost.com/2026/02/14/us-news/a-look-inside-mamdanis-socialist-dream-to-shakeup-transit-for-new-yorkers/
29,2026-02-14-20-10-23 +0000,latimes,"Factory-built housing hasn't taken off in California yet, but this year might be different",https://www.latimes.com/california/story/2026-02-14/factory-built-housing-hasnt-taken-off-in-california-yet-but-this-year-might-be-different
29,2026-02-14-11-36-15 +0000,nyt,"In Munich, Rubio Stresses Shared History to Europeans but Warns of ‘Civilizational Erasure’",https://www.nytimes.com/2026/02/14/world/europe/rubio-munich-security-conference-speech.html
29,2026-02-14-17-38-47 +0000,nyt,Investigators focus overnight on car and residence near Nancy Guthrie’s home.,https://www.nytimes.com/live/2026/02/14/us/nancy-guthrie-case-updates/investigators-focus-overnight-on-car-and-residence-near-nancy-guthries-home
29,2026-02-14-03-07-45 +0000,nypost,Ex-ESPN star Sarah Spain felt ‘ill’ sitting near ‘demon’ JD Vance at Winter Olympics: ‘Like the devil’,https://nypost.com/2026/02/13/us-news/ex-espn-star-felt-ill-sitting-near-jd-vance-at-winter-olympics/
29,2026-02-14-09-45-00 +0000,wsj,Rubio Seeks to Reassure European Allies in Munich Speech,https://www.wsj.com/world/europe/rubio-seeks-to-reassure-european-allies-in-munich-speech-e46f8805
28,2026-02-13-22-59-00 +0000,cbc,"Labelling Palestine Action a terrorist group was unlawful, Britain’s High Court rules",https://www.cbc.ca/radio/asithappens/palestine-action-ruling-9.7089382?cmp=rss
28,2026-02-14-04-33-43 +0000,nyt,"Gisèle Pelicot, the Woman at the Center of Rape Trial That Shook France, Shares Her Story",https://www.nytimes.com/2026/02/13/magazine/gisele-pelicot-france-rape-case-story.html
28,2026-02-13-22-26-00 +0000,wsj,ICE Plans $38 Billion Expansion of Immigration Detention Facilities,https://www.wsj.com/us-news/ice-plans-38-billion-expansion-of-immigration-detention-facilities-e63926dd
27,2026-02-14-10-02-57 +0000,nyt,How ICE Failed to Justify the Shooting of Julio Sosa-Celis in Minneapolis,https://www.nytimes.com/2026/02/14/us/julio-sosa-celis-ice-minneapolis-shooting.html
27,2026-02-14-02-19-03 +0000,nyt,Judge Orders ICE to Let Clergy Give Communion to Detained Migrants on Ash Wednesday,https://www.nytimes.com/2026/02/13/us/politics/ice-detention-catholics-ash-wednesday.html
27,2026-02-14-13-14-18 +0000,nypost,Are you feeling lucky? Migrants roll the dice on vastly different NY asylum court judges,https://nypost.com/2026/02/14/us-news/are-you-feeling-lucky-migrants-roll-the-dice-in-ny-asylum-courts/
27,2026-02-14-17-32-58 +0000,nypost,Arizona sheriff makes resounding promise in ‘exhausting’ search for Nancy Guthrie,https://nypost.com/2026/02/14/us-news/arizona-sheriff-promises-were-going-to-find-nancy-guthrie/
26,2026-02-14-13-28-26 +0000,bbc,Casey Wasserman to sell talent agency after Epstein fallout,https://www.bbc.com/news/articles/cy0dn4e1njjo?at_medium=RSS&at_campaign=rss
26,2026-02-14-12-00-00 +0000,startribune,"After ‘bad tactics’ of federal agents, local law enforcement regarded in a new light",https://www.startribune.com/after-bad-tactics-of-federal-agents-local-law-enforcement-regarded-in-a-new-light/601577404
26,2026-02-14-09-00-00 +0000,cbc,Head of military's space division warns Russia is considering putting nuclear weapons in orbit,https://www.cbc.ca/news/politics/russia-space-nuclear-weapon-canada-military-division-chief-9.7088665?cmp=rss
26,2026-02-14-14-26-05 +0000,nyt,Zelensky rules out holding elections until there is a cease-fire with Russia.,https://www.nytimes.com/live/2026/02/14/world/munich-security-conference-rubio/zelensky-rules-out-holding-elections-until-there-is-a-cease-fire-with-russia
25,2026-02-14-11-55-11 +0000,bbc,Rubio speech signals US-Europe relations are bruised but still friendly,https://www.bbc.com/news/articles/crk80vgrj2eo?at_medium=RSS&at_campaign=rss
25,2026-02-14-10-30-00 +0000,wsj,New York City’s Looming Deficit Threatens to Curb Mamdani’s Ambitions,https://www.wsj.com/us-news/new-york-citys-looming-deficit-threatens-to-curb-mamdanis-ambitions-28d1490f
24,2026-02-14-11-00-00 +0000,latimes,Granderson: There should be no partisan divide about naming Epstein's fellow abusers,https://www.latimes.com/opinion/story/2026-02-14/epstein-files-moral-crisis
24,2026-02-14-06-00-11 +0000,bbc,Gisèle Pelicot tells BBC: I felt crushed by horror - but I don't feel anger,https://www.bbc.com/news/articles/c9q5l22ryy4o?at_medium=RSS&at_campaign=rss
24,2026-02-14-10-02-23 +0000,nyt,Sick Detainees Describe Poor Care at CoreCivic ICE Facilities,https://www.nytimes.com/2026/02/14/business/ice-health-care-corecivic-immigrants-detention.html
24,2026-02-14-17-54-03 +0000,nyt,How ICE Is Pushing Tech Companies to Identify Protesters,https://www.nytimes.com/video/business/100000010709300/how-ice-is-pushing-tech-companies-to-identify-protesters.html
24,2026-02-14-14-00-00 +0000,latimes,Activists celebrate as immigration agents depart Terminal Island. 'The people kicked them out',https://www.latimes.com/california/story/2026-02-14/immigration-activists-celebrate-as-ice-agents-depart-terminal-island
24,2026-02-14-12-30-00 +0000,nypost,Canada trans shooter Jesse Van Rootselaar’s mom described him as sadistic — as twisted addiction to death videos revealed,https://nypost.com/2026/02/14/world-news/trans-shooter-jesse-van-rootselaar-was-described-by-mom-as-sadistic-child-became-hooked-to-death-videos-as-teen/
23,2026-02-14-18-44-47 +0000,bbc,Rubio says US and Europe 'belong together' despite tensions,https://www.bbc.com/news/articles/c2lrdq47149o?at_medium=RSS&at_campaign=rss
23,2026-02-13-23-22-27 +0000,nypost,Meet Kim Jong Un’s 13-year-old daughter — who is likely being groomed to replace him,https://nypost.com/2026/02/13/world-news/inside-the-rise-of-kim-jong-uns-13-year-old-heiress-apparent/
23,2026-02-13-22-48-34 +0000,nyt,"Chloe Kim, once a teenage phenom, loses to a new one.",https://www.nytimes.com/2026/02/12/world/chloe-kim-snowboard-halfpipe.html
23,2026-02-14-17-54-08 +0000,wapo,"‘Highly likely’ that rare poison killed Putin nemesis Navalny, Europeans say",https://www.washingtonpost.com/world/2026/02/14/alexei-navalny-russia-death-poison-frog/
22,2026-02-14-19-00-00 +0000,nypost,What is it really like to work for the Royal Family? New novel reveals all,https://nypost.com/2026/02/14/world-news/what-is-it-really-like-to-work-for-the-royal-family-new-novel-reveals-all/
22,2026-02-14-15-39-08 +0000,nypost,Military experts debunk AOC’s claim that Israel ‘enabled a genocide in Gaza’,https://nypost.com/2026/02/14/world-news/military-experts-debunk-aocs-gaza-genocide-claims-at-munich-conference/
22,2026-02-14-13-00-00 +0000,nypost,City Hall boots Israel drone supplier from Brooklyn Navy Yard — after Mamdani took office,https://nypost.com/2026/02/14/us-news/city-hall-boots-israel-drone-supplier-from-brooklyn-navy-yard-after-mamdani-took-office/
22,2026-02-14-13-16-56 +0000,nypost,AI clone of late ‘Dilbert’ creator Scott Adams pops up on X — and his family is peeved,https://nypost.com/2026/02/14/us-news/ai-clone-of-late-dilbert-creator-scott-adams-on-x-rankles-family/
22,2026-02-14-05-17-27 +0000,bbc,"'Canadians are with you,' says PM at Tumbler Ridge vigil",https://www.bbc.com/news/articles/cde4kdr2z6do?at_medium=RSS&at_campaign=rss
22,2026-02-14-19-37-45 +0000,nypost,Teacher of the Year finalist busted for offering cash for sex acts from ‘13-year-old boy’,https://nypost.com/2026/02/14/us-news/ca-teacher-of-the-year-candidate-arrested-for-offering-money-for-sex-acts-from-13-year-old-boy/
22,2026-02-14-09-00-00 +0000,cbc,From umbrella to uncertainty: Europe and Canada's nuclear deterrence anxiety,https://www.cbc.ca/news/politics/canada-france-europe-nuclear-weapons-9.7089805?cmp=rss
22,2026-02-14-00-38-06 +0000,missionlocal,‘Elderly nanny’ arrested by ICE in S.F. is ordered released,https://missionlocal.org/2026/02/mayor-lurie-aware-of-purported-ice-arrest-of-elderly-nanny-in-s-f/
21,2026-02-14-00-30-14 +0000,nyt,Judge Orders U.S. to Facilitate Return of College Student Who Was Deported in Error,https://www.nytimes.com/2026/02/13/us/politics/trump-immigration-babson-student-deported.html
21,2026-02-13-23-49-38 +0000,latimes,Three federal agents injured in clash with protesters in downtown L.A. during student walkout,https://www.latimes.com/california/story/2026-02-13/federal-agent-injured-in-clash-with-protesters-in-downtown-la-during-student-walkout
21,2026-02-14-17-59-40 +0000,cbc,"Zelenskyy says U.S. too often asks Ukraine, not Russia, for concessions, ahead of Geneva peace talks",https://www.cbc.ca/news/world/ukrainian-president-zelenskyy-geneva-talks-9.7090537?cmp=rss
21,2026-02-14-05-01-08 +0000,nyt,"How Peter Biar Ajak, a Sudanese Peace Activist, Was Caught Plotting a Coup",https://www.nytimes.com/2026/02/14/world/africa/south-sudan-peace-activist-coup-plot.html
21,2026-02-14-12-00-01 +0000,startribune,Readers send out love to their sweeties,https://www.startribune.com/readers-send-out-love-to-their-sweeties/601575409
21,2026-02-14-13-20-37 +0000,nyt,How Former N.Y.C. Schools Chief Joel Klein Became Friendly With Epstein,https://www.nytimes.com/2026/02/14/us/how-former-nyc-schools-chief-joel-klein-became-friendly-with-epstein.html
21,2026-02-14-06-00-21 +0000,bbc,Watch: 'I am a survivor' Gisèle Pelicot tells BBC Newsnight,https://www.bbc.com/news/videos/c80jvkem8lro?at_medium=RSS&at_campaign=rss
