score,pubdate,source,title,link
137,2026-05-07-01-00-00 +0000,wsj,"The airline industry is warning the Trump administration about the economic impact of high jet-fuel prices, saying the Iran war needs to end soon",https://www.wsj.com/politics/policy/jet-fuel-prices-are-spiking-and-trumps-advisers-are-worried-b0932f3c
114,2026-05-06-16-11-44 +0000,bbc,Oil prices drop and stock markets rise after reports of deal to end Iran war,https://www.bbc.com/news/articles/c4g8zejyyr3o?at_medium=RSS&at_campaign=rss
102,2026-05-07-04-06-33 +0000,bbc,Iran considering US proposal as Trump says war will be 'over quickly',https://www.bbc.com/news/articles/cj0pq2q8221o?at_medium=RSS&at_campaign=rss
99,2026-05-06-12-14-10 +0000,nypost,Trump tells Post ‘too soon’ to prep for Iran peace deal signing as uranium enrichment remains sticking point,https://nypost.com/2026/05/06/us-news/trump-tells-post-too-soon-to-prep-for-iran-peace-signing-after-reports-deal-near/
98,2026-05-06-14-57-00 +0000,wsj,"President Trump escalated his public feud with Pope Leo XIV, accusing the pontiff of endangering Catholics by opposing U.S. military action against Iran",https://www.wsj.com/politics/national-security/trump-accuses-pope-leo-of-endangering-catholics-by-opposing-iran-war-4805fe38
95,2026-05-06-10-21-02 +0000,nypost,"US, Iran ‘getting close’ to agreeing deal to end war after 67 days — what a potential pact would look like",https://nypost.com/2026/05/06/us-news/us-iran-getting-close-to-agreeing-deal-to-end-war-after-67-days/
91,2026-05-06-20-16-58 +0000,nyt,Oil Prices Fall on Hope U.S.-Iran War Turmoil in the Gulf May Be Easing,https://www.nytimes.com/2026/05/06/business/oil-gas-price-iran.html
91,2026-05-07-09-38-04 +0000,bbc,Shell latest oil giant to see profits surge due to Iran war impact,https://www.bbc.com/news/articles/ce3p0x54drwo?at_medium=RSS&at_campaign=rss
89,2026-05-06-17-32-04 +0000,bbc,Trump's hopes for an Iran peace deal come with caveats,https://www.bbc.com/news/articles/cvgzp74rvj5o?at_medium=RSS&at_campaign=rss
88,2026-05-06-14-13-37 +0000,nypost,"Deranged WHCD shooting suspect Cole Allen may have been motivated by Iran war, intelligence report finds",https://nypost.com/2026/05/06/us-news/deranged-whcd-shooting-suspect-cole-allen-may-have-motivated-by-iran-war-intelligence-report-finds/
84,2026-05-06-22-01-00 +0000,wapo,Trump threatens intense bombing if Iran peace deal is not reached,https://www.washingtonpost.com/world/2026/05/05/hegseth-briefing-iran-strait-hormuz-ceasefire/
81,2026-05-06-14-16-51 +0000,wapo,Hantavirus-hit cruise ship to head to Canary Islands as Swiss confirm new case,https://www.washingtonpost.com/health/2026/05/06/hantavirus-cruise-ship-hondius-outbreak-spain/
80,2026-05-06-17-21-15 +0000,nypost,"Trump, Ric Flair, Atlanta Braves,  media personalities react to Ted Turner’s death: ‘One of the Greats of All Time’",https://nypost.com/2026/05/06/media/trump-ric-flair-media-personalities-react-to-ted-turners-death-one-of-the-greats-of-all-time/
75,2026-05-06-14-30-26 +0000,nyt,Iran announces a new system for traffic in the Strait of Hormuz.,https://www.nytimes.com/live/2026/05/05/world/iran-war-trump-hormuz/iran-announces-a-new-system-for-traffic-in-the-strait-of-hormuz
74,2026-05-06-21-07-00 +0000,wsj,The Iran War Is Crushing Whirlpool’s Profit—and Higher Prices Are Coming,https://www.wsj.com/business/earnings/the-iran-war-is-crushing-whirlpools-profitsand-higher-prices-are-coming-98dd10bc?mod=pls_whats_news_us_business_f
71,2026-05-06-21-20-43 +0000,nyt,Iran War Looms Over Vance as He Visits Iowa,https://www.nytimes.com/2026/05/06/us/politics/jd-vance-iowa-2028.html
71,2026-05-07-09-00-48 +0000,wapo,Trump and Xi set to meet under shadow of Iran negotiations,https://www.washingtonpost.com/national-security/2026/05/07/trump-xi-us-china-summit-iran/
70,2026-05-06-23-42-41 +0000,nyt,Trump’s Gyrations on the War Leave Even Rubio Out of Sync,https://www.nytimes.com/2026/05/06/us/politics/trump-rubio-iran-war.html
69,2026-05-06-09-58-55 +0000,nyt,"In Talks With Iran, China Calls for Opening of Strait of Hormuz",https://www.nytimes.com/2026/05/06/world/asia/china-iran-us-trump-hormuz.html
67,2026-05-06-17-18-52 +0000,nypost,China calls for Strait of Hormuz to reopen in meeting with Iran,https://nypost.com/2026/05/06/world-news/china-calls-for-strait-of-hormuz-to-reopen-in-meeting-with-iran/
67,2026-05-07-09-33-00 +0000,wsj,There is concern about how AI is affecting work as each new month brings a wave of job-cut announcements from large employers. Here’s how this year’s layoffs are stacking up.,https://www.wsj.com/economy/jobs/layoffs-2026-tracker-784ea69f
67,2026-05-06-21-02-23 +0000,nyt,Iran Says It Is Reviewing a U.S. Proposal to End the War,https://www.nytimes.com/2026/05/06/world/middleeast/us-iran-peace-proposal.html
66,2026-05-07-07-41-03 +0000,nypost,Arrival of hantavirus-ridden MV Hondius cruise ship revives COVID flashbacks in Canary Islands: ‘I don’t think we can cope’,https://nypost.com/2026/05/07/world-news/arrival-of-virus-ridden-mv-hondius-cruise-ship-revives-covid-flashbacks-in-canary-islands-i-dont-think-we-can-cope/
64,2026-05-06-13-15-40 +0000,nypost,Unnerving photo shows suspected hantavirus patient evacuated from MV Hondius cruise — as 1 ex-passenger tests positive in Switzerland,https://nypost.com/2026/05/06/world-news/unnerving-gurney-photo-shows-suspected-hantavirus-patient-evacuated-from-doomed-cruise-ship-in-netherlands/
64,2026-05-07-09-00-00 +0000,nypost,Deadly hantavirus outbreak on MV Hondius cruise ship could have this lasting impact on industry: expert,https://nypost.com/2026/05/07/world-news/deadly-hantavirus-outbreak-on-mv-hondius-cruise-ship-could-have-this-lasting-impact-on-industry-expert/
64,2026-05-07-09-43-00 +0000,wsj,Eurozone Retail Sales Fell in March on Iran War,https://www.wsj.com/business/retail/eurozone-retail-sales-fell-in-march-on-iran-war-c5f641ab
63,2026-05-06-11-52-42 +0000,bbc,Cruise passengers tell of life on board ship stranded off Cape Verde after hantavirus outbreak,https://www.bbc.com/news/articles/clype7ededzo?at_medium=RSS&at_campaign=rss
63,2026-05-06-10-45-35 +0000,cbc,"WHO confirms Andes strain of hantavirus in cruise ship passengers, with 3 transferred from ship for treatment",https://www.cbc.ca/news/health/hondius-ship-hantavirus-andes-strain-9.7189281?cmp=rss
62,2026-05-07-08-59-00 +0000,wsj,"Euro Could Rise Further if U.S., Iran Finalize Peace Deal",https://www.wsj.com/finance/currencies/yen-consolidates-downside-likely-limited-by-possible-fx-intervention-2120c906?mod=rss_markets_main
62,2026-05-06-19-57-20 +0000,nyt,Macron Calls for U.S. and Iran to Open Strait of Hormuz While They Negotiate,https://www.nytimes.com/2026/05/06/world/middleeast/france-macron-strait-of-hormuz-iran-us.html
61,2026-05-06-15-28-00 +0000,wsj,The job market is starting to show glimmers of good news with some solid data this week. The real test will come with the April jobs report on Friday.,https://www.wsj.com/economy/jobs/jobs-payroll-data-adp-hiring-ff16b64a
60,2026-05-06-17-48-47 +0000,nypost,California governor candidate Matt Mahan floats revolutionary new EV tax,https://nypost.com/2026/05/06/us-news/california-governor-candidate-matt-mahan-floats-revolutionary-new-ev-tax/
60,2026-05-07-00-20-10 +0000,nyt,"U.S. Health Authorities Monitor Hantavirus Cruise Passengers in Georgia, California and Arizona",https://www.nytimes.com/2026/05/06/us/hantavirus-cruise-us-passengers.html
59,2026-05-06-20-48-09 +0000,nypost,Wall Street giant Apollo aims to open ‘second headquarters’ outside NYC — in latest fallout from Mamdani’s war on the wealthy,https://nypost.com/2026/05/06/business/wall-street-giant-apollo-aims-to-open-second-headquarters-outside-nyc-in-latest-fallout-from-mamdanis-war-on-the-wealthy/
59,2026-05-07-04-39-30 +0000,nyt,The Iran War and Angry Voters,https://www.nytimes.com/2026/05/06/world/britain-elections-far-right-europe-iran-deal.html
59,2026-05-06-12-00-18 +0000,wapo,Trump lashes out at Pope Leo again ahead of Rubio trip to Rome,https://www.washingtonpost.com/world/2026/05/05/trump-rubio-pope-leo-rift/
58,2026-05-06-20-39-00 +0000,wsj,"Over 20,000 Sailors Are Stranded by the Iran War. This Is Who They Call.",https://www.wsj.com/world/middle-east/over-20-000-sailors-are-trapped-in-the-strait-of-hormuz-this-is-who-they-call-2bb8ac1a
58,2026-05-06-17-41-14 +0000,nyt,Iran’s Oil Sector and Economy Are Under Pressure as U.S. Blockade Bites,https://www.nytimes.com/2026/05/06/world/middleeast/irans-oil-capacity-blockade.html
58,2026-05-06-14-55-04 +0000,nypost,Katie Porter slaps governor rival Chad Bianco with bizarre new nickname in wild debate clash,https://nypost.com/2026/05/06/us-news/katie-porter-slaps-governor-rival-chad-bianco-with-bizarre-new-nickname-in-wild-debate-clash/
57,2026-05-06-14-00-00 +0000,wsj,Trump’s latest tariff threat is a wake-up call for U.S. trade partners,https://www.wsj.com/economy/trade/trumps-latest-tariff-threat-is-a-wake-up-call-for-u-s-trade-partners-cc7d5a5c
57,2026-05-06-14-30-53 +0000,nyt,Trump’s U-turn and hopes of a deal ease tensions in energy markets.,https://www.nytimes.com/2026/05/06/world/middleeast/us-iran-hormuz-pause.html
57,2026-05-07-08-48-00 +0000,wsj,Oil Edges Lower as Investors Remain Cautious Ahead of Iran Response,https://www.wsj.com/finance/stocks/oil-edges-lower-as-investors-remain-cautious-ahead-of-iran-response-a82cc884?mod=rss_markets_main
56,2026-05-07-09-40-24 +0000,bbc,Hantavirus-hit cruise ship on way to Canary Islands after three evacuated,https://www.bbc.com/news/articles/c5y093d5n9ko?at_medium=RSS&at_campaign=rss
56,2026-05-06-15-18-01 +0000,nypost,Disney shares jump 8% as new CEO Josh D’Amaro’s growth strategy excites Wall Street,https://nypost.com/2026/05/06/media/disney-shares-jump-8-as-new-ceos-growth-strategy-excites-wall-street/
56,2026-05-06-17-01-04 +0000,latimes,"Southern California warms up; heat will peak on Mother's Day, forecasters say",https://www.latimes.com/california/story/2026-05-06/southern-california-mothers-day-weather
56,2026-05-06-18-22-27 +0000,nypost,"Trump rolls out ‘America First’ counterterror strategy targeting cartels, jihadists and domestic extremists",https://nypost.com/2026/05/06/us-news/trump-rolls-out-america-first-counterterror-strategy-targeting-cartels-jihadis-and-domestic-extremists/
55,2026-05-06-11-00-43 +0000,wapo,"Iran has hit far more U.S. military assets than reported, satellite images show",https://www.washingtonpost.com/investigations/2026/05/06/iran-us-bases-satellite-images/
55,2026-05-07-07-48-00 +0000,wsj,Oil Falls Sharply on Optimism for Iran Peace Breakthrough,https://www.wsj.com/finance/commodities-futures/oil-futures-rise-on-likely-technical-recovery-59d9a3b8?mod=rss_markets_main
55,2026-05-06-13-39-09 +0000,bbc,Trump pauses Hormuz plan 50 hours after he announced it - what happened?,https://www.bbc.com/news/articles/cd6p5q2dx1po?at_medium=RSS&at_campaign=rss
55,2026-05-06-14-31-05 +0000,cbc,"Tehran evaluating U.S. proposal to end war, but Iranian lawmaker calls it 'American wish list'",https://www.cbc.ca/news/world/livestory/us-iran-war-9.7189508?cmp=rss
55,2026-05-06-14-56-04 +0000,nypost,Health officials think they’ve tracked down source of cruise ship hantavirus outbreak,https://nypost.com/2026/05/06/world-news/health-officials-think-theyve-tracked-down-source-of-cruise-ship-hantavirus-outbreak/
53,2026-05-06-20-51-54 +0000,bbc,"US and Russia fuelling separatist  debate in Canada, new report says",https://www.bbc.com/news/articles/cze2dnn8kgwo?at_medium=RSS&at_campaign=rss
53,2026-05-07-00-45-00 +0000,wsj,Commerce Secretary Howard Lutnick told a congressional he had no personal or professional relationship with sex offender Jeffrey Epstein,https://www.wsj.com/politics/policy/lutnick-said-he-was-surprised-by-invite-to-visit-epsteins-island-ffd2b9fb
53,2026-05-07-08-11-43 +0000,nypost,"Trump administration can keep 2020 election ballots seized from Georgia, judge rules",https://nypost.com/2026/05/07/us-news/trump-administration-can-keep-2020-election-ballots-seized-from-georgia-judge-rules/
53,2026-05-06-10-30-00 +0000,wsj,Will the Iran Crisis Cause a Global Recession?,https://www.wsj.com/finance/stocks/will-the-iran-crisis-cause-a-global-recession-1e6a4044?mod=rss_markets_main
52,2026-05-06-23-52-50 +0000,missionlocal,Meet the S.F. school board candidates: Will you vote to merge or close schools in the 2030 school year?,https://missionlocal.org/2026/05/san-francisco-meet-the-candidates-school-board-closures/
52,2026-05-06-23-06-17 +0000,bbc,Gulf economies face long-term hit from Iran conflict,https://www.bbc.com/news/articles/c0k257g8jk5o?at_medium=RSS&at_campaign=rss
52,2026-05-06-12-00-00 +0000,latimes,"Last resort in Primm, former gambling mecca at the California-Nevada border, will close",https://www.latimes.com/california/story/2026-05-06/last-gambling-resort-in-primm-nevada-former-gambling-mecca-is-set-to-close
52,2026-05-06-22-16-26 +0000,bbc,Brazil's President Lula to discuss economy and security with Trump at White House,https://www.bbc.com/news/articles/c8d84g963eeo?at_medium=RSS&at_campaign=rss
52,2026-05-07-00-23-38 +0000,nyt,Tennessee Republicans Unveil New Congressional Map Carving Up Majority-Black House District,https://www.nytimes.com/2026/05/06/us/gop-memphis-tennessee-house-map.html
52,2026-05-06-23-10-00 +0000,wsj,Inside the Global Effort to Figure Out Where Hantavirus Will Strike Next,https://www.wsj.com/health/hantavirus-contact-tracing-cruise-ship-3a9afe33?mod=pls_whats_news_us_business_f
52,2026-05-07-07-51-06 +0000,nypost,China says ties with US remain stable ahead of Trump visit despite ‘disruptions’,https://nypost.com/2026/05/07/us-news/china-says-ties-with-us-remain-stable-ahead-of-trump-visit-despite-disruptions/
51,2026-05-06-16-05-59 +0000,nypost,California governor candidate Chad Bianco caught in awkward word salad by CNN’s Kaitlan Collins,https://nypost.com/2026/05/06/us-news/california-governor-candidate-caught-in-super-awkward-word-salad-by-cnns-kaitlan-collins/
50,2026-05-06-17-38-42 +0000,nypost,Ex-JPMorgan banker Chirayu Rana was referred for mental treatment after probe into ‘sex slave’ claims found nothing: sources,https://nypost.com/2026/05/06/business/ex-jpmorgan-banker-chirayu-rana-referred-to-mental-treatment-by-das-office-source/
50,2026-05-07-09-03-55 +0000,nyt,Trump to Host Brazil’s President Lula at White House After Months of Ups and Downs,https://www.nytimes.com/2026/05/07/world/americas/trump-brazil-lula-meeting.html
50,2026-05-06-11-48-54 +0000,nypost,Hantavirus outbreak spreads to Europe after MV Hondius cruise passenger tests positive back home,https://nypost.com/2026/05/06/world-news/hantavirus-outbreak-spreads-to-europe-after-mv-hondius-cruise-passenger-tests-positive-back-home/
50,2026-05-07-07-30-00 +0000,wsj,German Factory Orders Jumped in First Month of Iran Conflict,https://www.wsj.com/economy/german-factory-orders-jumped-in-first-month-of-iran-conflict-2068262d
49,2026-05-06-21-29-18 +0000,bbc,'Enjoy the show. Ignore the war': Venice Biennale faces backlash after including Russia,https://www.bbc.com/news/articles/cvgz14e1zeno?at_medium=RSS&at_campaign=rss
49,2026-05-07-09-00-25 +0000,nyt,German Leaders Clash With Spy Chiefs Over Domestic Threat From Iran,https://www.nytimes.com/2026/05/07/world/europe/germany-merz-iran-security-threat-spy.html
49,2026-05-06-11-51-17 +0000,nyt,Inside the Debate About Adding Stocks to Trump Accounts,https://www.nytimes.com/2026/05/06/business/dealbook/stocks-trump-accounts.html
49,2026-05-07-00-45-45 +0000,nypost,San Francisco’s CEO tax fight intensifies as new report sounds alarm,https://nypost.com/2026/05/06/us-news/san-francisco-crazy-high-business-taxes-could-get-even-worse/
49,2026-05-06-10-00-00 +0000,latimes,Hiltzik: WNBA star Kelsey Plum is taking heat for getting California tax law wrong. But don't blame her,https://www.latimes.com/business/story/2026-05-06/wnba-star-kelsey-plum-is-taking-heat-for-getting-california-tax-policy-wrong-but-dont-blame-her
48,2026-05-06-18-48-00 +0000,wsj,Trial Begins for Man Accused of Operating Secret Chinese Police Station in New York,https://www.wsj.com/world/china/trial-begins-for-man-accused-of-operating-secret-chinese-police-station-in-new-york-f369bfc3
48,2026-05-06-18-28-39 +0000,nypost,Elon Musk’s SpaceX joins forces with Anthropic in AI deal ahead of blockbuster IPO,https://nypost.com/2026/05/06/business/elon-musks-spacex-joins-forces-with-anthropic-in-ai-deal-ahead-of-blockbuster-ipo/
48,2026-05-07-07-03-00 +0000,wsj,"InterContinental Posts Global Room Revenue Rise, Sees Continued Growth Despite Middle East Conflict",https://www.wsj.com/business/retail/intercontinental-posts-global-room-revenue-rise-sees-continued-growth-despite-middle-east-conflict-da87cea7?mod=pls_whats_news_us_business_f
48,2026-05-07-03-39-00 +0000,wsj,"Iran, U.S. Working on Talks to End Fighting",https://www.wsj.com/world/middle-east/iran-u-s-working-on-talks-to-end-fighting-da8e9f53
48,2026-05-06-22-30-57 +0000,nypost,FDA approves fruit-flavored vapes in shocking first following reported pressure from Trump admin,https://nypost.com/2026/05/06/us-news/fda-approves-fruit-flavored-vapes-in-shocking-first-following-reported-pressure-from-trump-admin/
47,2026-05-07-02-00-00 +0000,wsj,Putin’s Strongman Image Is Fading as Ukraine Brings War Home to Russia,https://www.wsj.com/world/russia/putins-strongman-image-is-fading-as-ukraine-brings-war-home-to-russia-985ec454
47,2026-05-06-19-32-33 +0000,nypost,"23 hantavirus cruise passengers returned home to ‘all corners,’ including to the US — and one is already sick",https://nypost.com/2026/05/06/world-news/23-hantavirus-cruise-passengers-already-returned-home-including-to-the-us/
47,2026-05-06-22-52-24 +0000,nyt,Jack Smith Calls the Justice Dept. ‘Corrupted’ by Trump and His Allies,https://www.nytimes.com/2026/05/06/us/politics/jack-smith-justice-dept-trump.html
47,2026-05-07-01-00-00 +0000,wsj,Jet-Fuel Prices Are Spiking and Trump’s Advisers Are Worried,https://www.wsj.com/politics/policy/jet-fuel-prices-are-spiking-and-trumps-advisers-are-worried-b0932f3c?mod=pls_whats_news_us_business_f
47,2026-05-06-14-24-00 +0000,wsj,New Disney CEO Gives Vision for Company as Revenue Rises,https://www.wsj.com/business/earnings/disney-dis-q2-earnings-report-2026-b6102f6c?mod=pls_whats_news_us_business_f
47,2026-05-07-04-08-39 +0000,nyt,What to Know About the Hantavirus Outbreak on an Atlantic Cruise Ship,https://www.nytimes.com/article/hantavirus-cruise-ship-outbreak-hondius.html
46,2026-05-06-10-19-00 +0000,bbc,Polanski says he was wrong to claim he was a Red Cross spokesman,https://www.bbc.com/news/articles/cq5pgv35y7eo?at_medium=RSS&at_campaign=rss
46,2026-05-07-06-13-24 +0000,bbc,Watch: Passengers told virus-hit ship 'not infectious' after first death,https://www.bbc.com/news/videos/cx21gp04gglo?at_medium=RSS&at_campaign=rss
46,2026-05-07-07-43-00 +0000,wsj,"Dollar, Treasury Yields Turn Lower on Hopes Strait of Hormuz Will Reopen",https://www.wsj.com/finance/investing/jgbs-rise-aided-by-lower-oil-prices-stronger-yen-806f3eed?mod=rss_markets_main
46,2026-05-06-22-17-22 +0000,nyt,Trump’s Indiana Victory Shows His Enduring Grip on Core Republican Supporters,https://www.nytimes.com/2026/05/06/us/politics/trump-indiana-republican-base.html
46,2026-05-07-09-30-00 +0000,wsj,Frackers Are Finally Ready to Drill. Trump Won’t See a Return of the Go-Go Days.,https://www.wsj.com/business/energy-oil/frackers-are-finally-ready-to-drill-trump-wont-see-a-return-of-the-go-go-days-3cd2e830?mod=rss_markets_main
46,2026-05-06-11-00-00 +0000,nypost,GOP lawmakers urge Trump administration to defund ‘woke’ National Academies,https://nypost.com/2026/05/06/us-news/gop-lawmakers-urge-trump-admin-to-defund-woke-national-academies/
45,2026-05-07-02-24-48 +0000,latimes,"Bass, Raman and Pratt square off on Palisades fire, police hiring in bruising mayoral debate",https://www.latimes.com/california/story/2026-05-06/karen-bass-spencer-pratt-nithya-raman-square-off-at-three-way-candidate-debate
45,2026-05-06-17-50-36 +0000,cbc,Israel strikes Beirut suburbs for 1st time since ceasefire was announced,https://www.cbc.ca/news/world/israel-beirut-suburbs-air-strike-ceasefire-lebanon-9.7189905?cmp=rss
45,2026-05-07-05-19-09 +0000,nyt,Hantavirus Patients Land in Amsterdam With More Cruise Ship Evacuations Planned,https://www.nytimes.com/2026/05/06/world/hantavirus-cruise-ship.html
45,2026-05-07-03-38-32 +0000,nypost,"Texas shopping mall shooter allegedly killed 2, injured 3 in revenge plot against business partners for ‘taking his money’: court docs",https://nypost.com/2026/05/06/us-news/texas-shopping-mall-shooter-allegedly-killed-2-injured-3-in-revenge-plot-against-business-partners-for-taking-his-money-court-docs/
45,2026-05-06-11-37-00 +0000,wsj,"New York Times Profit, Revenue Climb on Subscription, Advertising Growth",https://www.wsj.com/business/media/new-york-times-profit-revenue-climb-on-subscription-advertising-growth-434cd8ba?mod=pls_whats_news_us_business_f
45,2026-05-07-03-20-25 +0000,bbc,"Ted Turner, media mogul who revolutionised TV news by launching CNN, dies at 87",https://www.bbc.com/news/articles/c1k2jnx8gmlo?at_medium=RSS&at_campaign=rss
44,2026-05-06-20-42-53 +0000,nypost,FIFA president Gianni Infantino appears to blame US resale market for sky-high World Cup prices,https://nypost.com/2026/05/06/business/fifa-president-gianni-infantino-blames-us-resale-market-for-world-cup-prices/
44,2026-05-07-08-00-00 +0000,cbc,The drone war comes home: Canada scrambles to shield military bases in legal grey zone,https://www.cbc.ca/news/politics/drones-attack-military-bases-legislation-9.7188515?cmp=rss
44,2026-05-06-10-22-24 +0000,nyt,How the Kremlin Lures Africans Into Russia’s War in Ukraine,https://www.nytimes.com/2026/05/04/world/africa/ukraine-russia-war-african-soldiers.html
44,2026-05-06-21-28-43 +0000,nypost,"Shivon Zilis, mother of Elon Musk’s kids and former OpenAI board member, testifies in explosive case",https://nypost.com/2026/05/06/business/shivon-zilis-mother-of-elon-musks-kids-and-former-openai-board-member-testifies-in-explosive-case/
44,2026-05-07-09-32-48 +0000,nyt,Starmer Braces for Local Election Losses Amid New Era of UK Politics,https://www.nytimes.com/2026/05/07/world/europe/uk-local-elections-2026-keir-starmer.html
43,2026-05-06-20-34-47 +0000,latimes,"Immigration crackdown souring Orange County's view of Trump, poll finds",https://www.latimes.com/california/story/2026-05-06/immigration-crackdown-souring-orange-countys-view-of-trump-poll-finds
43,2026-05-06-22-07-52 +0000,nypost,‘Shark Tank’ mogul Kevin O’Leary’s massive new data center enrages Utah residents: ‘Shame!’,https://nypost.com/2026/05/06/business/local-utah-officials-approval-of-shark-tank-mogul-kevin-olearys-massive-new-data-center-enrages-residents-shame/
43,2026-05-07-06-13-07 +0000,nypost,Teen charged for assaulting boy who was then fatally shot by another youngster in NYC park: DA,https://nypost.com/2026/05/07/us-news/teen-charged-for-assaulting-boy-before-he-was-fatally-shot-by-another-youngster-in-nyc-park-da/
42,2026-05-06-19-35-29 +0000,nyt,"Obama Talks Trump, Mamdani, Aliens and More in Colbert Interview",https://www.nytimes.com/2026/05/06/us/obama-colbert-interview-trump.html
42,2026-05-07-07-57-29 +0000,wsj,Stock Market Today: Stock Futures Rise After Two-Day AI Rally,https://www.wsj.com/livecoverage/stock-market-today-dow-sp-500-nasdaq-05-07-2026?mod=rss_markets_main
42,2026-05-06-17-40-44 +0000,nyt,Candidates for California Governor Debate Tonight: What to Know,https://www.nytimes.com/2026/05/06/us/california-governor-debate-newsletter.html
42,2026-05-06-20-38-59 +0000,latimes,Merger costs add up as Warner Bros. Discovery posts $2.9-billion quarterly loss,https://www.latimes.com/entertainment-arts/business/story/2026-05-06/warner-discovery-posts-2-point-9-billion-quarterly-loss-paramount-merger
41,2026-05-07-04-00-07 +0000,nyt,War and Energy Shortages Boost China’s Influence in Asia,https://www.nytimes.com/2026/05/07/business/war-energy-china-iran.html
41,2026-05-06-21-04-54 +0000,nyt,Attack on French Cargo Ship Highlights Continued Risks in Strait of Hormuz,https://www.nytimes.com/2026/05/06/business/french-ship-hormuz-central-command.html
40,2026-05-07-01-50-13 +0000,nypost,Disney makes move to ditch gas engines on iconic attraction amid crackdown from California regulators,https://nypost.com/2026/05/06/business/disneyland-set-to-retire-gas-powered-cars-on-autopia-ride/
40,2026-05-07-05-06-52 +0000,nyt,5 Takeaways From the Last Televised California Governor Debate,https://www.nytimes.com/2026/05/07/us/politics/california-governors-debate-takeaways.html
40,2026-05-07-06-50-00 +0000,wsj,UniCredit Strikes Deal to Sell Part of Russia Business to U.A.E. Investor,https://www.wsj.com/business/deals/unicredit-strikes-deal-to-sell-part-of-russia-business-to-u-a-e-investor-576f16bb?mod=rss_markets_main
40,2026-05-06-23-45-00 +0000,wsj,"The FBI on Wednesday searched the office of a longtime Virginia state lawmaker who was instrumental in the Democrats’ recent push to redraw congressional maps, people familiar with the matter said",https://www.wsj.com/politics/fbi-searches-office-of-virginia-democratic-lawmaker-70ff0b56
40,2026-05-06-10-01-00 +0000,latimes,Contributor: California law limiting bail is clear. Will judges keep ignoring it?,https://www.latimes.com/opinion/story/2026-05-06/california-pretrial-release-cash-bail-kowalczyk
40,2026-05-06-17-50-21 +0000,nypost,"Ex-JPMorgan banker Chirayu Rana turned down $1M, made eye-popping settlement demand before filing ‘fabricated’ ‘sex slave’ suit: sources",https://nypost.com/2026/05/06/business/ex-jpmorgan-banker-chirayu-rana-made-eye-popping-8-figure-settlement-demand-before-filing-fabricated-sex-slave-suit-sources/
