score,pubdate,source,title,link
13,2026-03-29-09-00-00 +0000,wapo,Daughter of immigrants brings history to bear in fight for birthright citizenship,https://www.washingtonpost.com/immigration/2026/03/29/birthright-citizenship-aclu-trump-immigrants/
13,2026-03-29-15-00-00 +0000,wsj,A Record Fog Snarled Highways—but Is Sustaining California’s Orchards,https://www.wsj.com/us-news/climate-environment/a-record-fog-snarled-highwaysbut-is-sustaining-californias-orchards-6db0f49c
12,2026-03-29-10-00-00 +0000,startribune,"Mining boosters see a golden opportunity for the Iron Range, if it doesn’t slip away",https://www.startribune.com/iron-range-mining-twin-metals-trump-administration-stauber-bill-mesabi-metallics/601585036
12,2026-03-28-18-54-09 +0000,cbc,Ontario Premier Doug Ford heading to Texas to talk trade and tariffs,https://www.cbc.ca/news/canada/toronto/doug-ford-texas-trip-9.7145909?cmp=rss
12,2026-03-29-00-02-36 +0000,bbc,Prison phone call recordings raise questions over ex-Abercrombie boss' fitness for trial,https://www.bbc.com/news/articles/c2034ww6kqxo?at_medium=RSS&at_campaign=rss
12,2026-03-29-15-30-49 +0000,nypost,Cops make horrifying discovery at home of sicko accused of recording families at his vacation mansion,https://nypost.com/2026/03/29/us-news/cops-make-horrifying-discovery-at-vaction-home-of-man-accused-of-filming-guests/
12,2026-03-29-16-00-00 +0000,wsj,Why the Cost of Your Coffee Has Soared—and Isn’t Going Down Soon,https://www.wsj.com/business/hospitality/coffee-price-increases-why-ee83a4b2?mod=rss_markets_main
12,2026-03-29-16-39-42 +0000,nypost,LA claims it’s handled massive RV homeless encampment — neighbors are furious,https://nypost.com/2026/03/29/us-news/los-angeles-claims-its-handled-huge-rv-homeless-encampment/
12,2026-03-29-16-11-59 +0000,nypost,Fish-y plans for old ferry deteriorating off NYC for more than decade,https://nypost.com/2026/03/29/us-news/east-river-ferry-to-be-sunk-in-ocean-as-an-artifical-reef/
12,2026-03-28-18-56-55 +0000,nypost,AOC broke law by spending $19k in campaign cash on ketamine-therapy shrink for ‘personal use’: complaint,https://nypost.com/2026/03/28/us-news/aoc-violated-laws-by-spending-19000-in-campaign-cash-on-ketamine-therapy-shrink-for-personal-use-complaint/
11,2026-03-28-23-25-03 +0000,bbc,India restoring a centuries-old royal kitchen that never stopped serving food,https://www.bbc.com/news/articles/cj0vj36yd12o?at_medium=RSS&at_campaign=rss
11,2026-03-28-21-04-30 +0000,bbc,"Frosting, sprinkles and layers of fun: Giant cake picnic hits Sydney",https://www.bbc.com/news/articles/c1w40dy58vwo?at_medium=RSS&at_campaign=rss
11,2026-03-28-19-41-17 +0000,bbc,Two Cuba-bound aid ships found days after disappearing,https://www.bbc.com/news/articles/clye4w10g22o?at_medium=RSS&at_campaign=rss
11,2026-03-29-11-26-41 +0000,nyt,Record Number of T.S.A. Employees Called Out on Friday,https://www.nytimes.com/2026/03/28/us/tsa-employees-airports-wait-times.html
11,2026-03-29-09-01-25 +0000,nyt,How Many Air Traffic Controllers Are Needed Overnight?,https://www.nytimes.com/2026/03/29/us/air-traffic-controllers-staffing.html
11,2026-03-29-07-05-17 +0000,nypost,Woman vandalizes ex-boyfriend’s Tesla in ‘petty’ act  after bad split,https://nypost.com/2026/03/29/us-news/california-woman-caught-on-camera-smashing-ex-boyfriends-tesla-after-breakup/
10,2026-03-28-20-18-24 +0000,nypost,News of the World: What you missed this week internationally,https://nypost.com/2026/03/28/world-news/news-of-the-world-what-you-missed-this-week-internationally-12/
10,2026-03-28-22-39-55 +0000,nyt,Astronaut’s Condition That Led to Space Station Evacuation Remains a Mystery,https://www.nytimes.com/2026/03/28/science/space/nasa-astronaut-medical-evaluation.html
10,2026-03-29-00-29-42 +0000,nyt,"Halfway Through Lent, a Small Quebec Island Celebrates With Masks and Jigs",https://www.nytimes.com/2026/03/28/world/canada/mid-lent-celebration-quebec-islands.html
10,2026-03-29-01-00-00 +0000,wsj,"Battered by Stock Losses, Investors Find Little Relief in Bonds",https://www.wsj.com/finance/investing/battered-by-stock-losses-investors-find-little-relief-in-bonds-af3f8a14?mod=rss_markets_main
10,2026-03-29-16-04-03 +0000,nyt,Chromebook Remorse: Tech Backlash at Schools Extends Beyond Phones,https://www.nytimes.com/2026/03/29/technology/chromebook-remorse-kansas-school-laptops.html
10,2026-03-29-16-27-00 +0000,wsj,Opinion | Medical Schools’ Rigor Is Not Under Threat,https://www.wsj.com/opinion/medical-schools-rigor-is-not-under-threat-5d9d8158
10,2026-03-28-23-00-49 +0000,bbc,Shops and restaurants in Egypt told to close early as energy crisis deepens,https://www.bbc.com/news/articles/c0rxz7ggv8go?at_medium=RSS&at_campaign=rss
9,2026-03-28-19-52-57 +0000,nypost,Older humpback males sing like rockstars to get the girls in epic comeback,https://nypost.com/2026/03/28/world-news/whale-songs-get-better-with-age-and-the-tunes-get-the-gals/
9,2026-03-29-09-00-04 +0000,wapo,"Invoking faith in wartime, Pete Hegseth breaks norms and worries critics",https://www.washingtonpost.com/nation/2026/03/29/pege-hegseth-christianity/
9,2026-03-29-16-26-00 +0000,wsj,"Opinion | Virginia Binges on Taxes, but Not Those Taxes",https://www.wsj.com/opinion/virginia-binges-on-taxes-but-not-those-taxes-266225f8
9,2026-03-28-18-58-33 +0000,nyt,A Downturn in Las Vegas Could Signal Tough Times for the Nation,https://www.nytimes.com/2026/03/28/us/politics/las-vegas-economy.html
8,2026-03-29-00-00-18 +0000,bbc,How deepfake porn scandal surrounding TV star rocked Germany,https://www.bbc.com/news/articles/c9vlm4j47e2o?at_medium=RSS&at_campaign=rss
8,2026-03-29-12-57-45 +0000,nyt,10 Million Grill Brushes Recalled After Some People Ingested Loose Bristles,https://www.nytimes.com/2026/03/28/business/nexgrill-grill-brush-recall-spikes-ingested.html
8,2026-03-28-19-06-35 +0000,nyt,Drinking Raw Milk Is Risky. Should People Be Able to Buy It Anyway?,https://www.nytimes.com/2026/03/28/us/politics/raw-milk-legal-sale-maha.html
8,2026-03-29-00-00-00 +0000,wsj,Is Another Financial Crisis Lurking in Private Credit?,https://www.wsj.com/economy/is-another-financial-crisis-lurking-in-private-credit-cad379b1?mod=rss_markets_main
8,2026-03-29-09-30-00 +0000,wsj,Food Megamergers Hardly Ever Work. Could McCormick-Unilever Be Different?,https://www.wsj.com/business/retail/food-mega-mergers-hardly-ever-work-could-mccormick-unilever-be-different-f9100870?mod=rss_markets_main
8,2026-03-29-12-11-20 +0000,bbc,Plant-based cookery classes 'bring people together',https://www.bbc.com/news/articles/czexd4ge1xko?at_medium=RSS&at_campaign=rss
7,2026-03-29-11-00-00 +0000,missionlocal,Photos: What symbols represent SoMa?,https://missionlocal.org/2026/03/photos-what-symbols-represent-soma/
7,2026-03-29-15-55-00 +0000,wsj,Opinion | What Do Democrats Mean by ‘Democracy’?,https://www.wsj.com/opinion/what-do-democrats-mean-by-democracy-1b3fd663
7,2026-03-29-12-17-20 +0000,startribune,"A funeral that went very wrong, and the lawsuit that followed",https://www.startribune.com/lawsuit-blames-prominent-minneapolis-funeral-home-for-twin-cities-educators-disastrous-burial/601585026
7,2026-03-29-07-58-16 +0000,nyt,Airstrikes batter a university and residential zones in Tehran.,https://www.nytimes.com/live/2026/03/29/world/iran-war-trump-israel-oil/airstrikes-university-tehran
7,2026-03-28-18-13-22 +0000,bbc,Senegal parade Afcon trophy despite title controversy,https://www.bbc.com/sport/football/articles/cqxl0gj9787o?at_medium=RSS&at_campaign=rss
6,2026-03-29-06-08-25 +0000,bbc,'Cost to supply potatoes has risen 40%',https://www.bbc.com/news/articles/c8957234108o?at_medium=RSS&at_campaign=rss
5,2026-03-29-16-19-37 +0000,nyt,The Fragile Hope for Salmon Recovery in Maine,https://www.nytimes.com/2026/03/29/science/atlantic-salmon-endangered-maine-climate.html
5,2026-03-29-15-48-12 +0000,nyt,"The Slum in Gangnam, the Richest Part of Seoul",https://www.nytimes.com/2026/03/29/world/asia/korea-seoul-gangnam-slum.html
4,2026-03-29-16-25-00 +0000,wsj,"Opinion | Allies, Obligations and the Strait of Hormuz",https://www.wsj.com/opinion/allies-obligations-and-the-strait-of-hormuz-6b3611e5
4,2026-03-29-15-38-04 +0000,nyt,Here’s the latest.,https://www.nytimes.com/live/2026/03/29/world/iran-war-trump-israel-oil/heres-the-latest
3,2026-03-29-15-54-00 +0000,wsj,Opinion | The Wages of ‘Land Acknowledgments’,https://www.wsj.com/opinion/the-wages-of-land-acknowledgments-0b9e2cfa
2,2026-03-29-13-00-00 +0000,missionlocal,iCero miedo!,https://missionlocal.org/2026/03/icero-miedo/
