score,pubdate,source,title,link
21,2026-02-14-05-04-15 +0000,bbc,"US homeland security shutdown could mean airport delays, travel groups say",https://www.bbc.com/news/articles/cwy8dw5zk7yo?at_medium=RSS&at_campaign=rss
20,2026-02-14-15-14-47 +0000,nyt,New U.S. Boat Strike Kills 3 in the Caribbean,https://www.nytimes.com/2026/02/14/us/politics/boat-strike-kills-3.html
20,2026-02-14-20-53-38 +0000,startribune,Live: U.S. men’s hockey team trails Denmark 2-1 after first period at the Olympics,https://www.startribune.com/2026-winter-olympics-milan-cortina-minnesota-olympians-live-updates/601573094
20,2026-02-14-16-06-45 +0000,nypost,Major transit crimes spike 17% as NYC sees first underground murder in 2026,https://nypost.com/2026/02/14/us-news/major-transit-crimes-surge-17-in-first-two-months-of-2026/
20,2026-02-14-13-39-40 +0000,bbc,One giant boys' club? Why Westminster can still feel like a man's world,https://www.bbc.com/news/articles/cy0dgpx71dyo?at_medium=RSS&at_campaign=rss
20,2026-02-14-19-26-00 +0000,wsj,How Kathy Ruemmler and Goldman Sachs Finally Reached Their Breaking Point,https://www.wsj.com/finance/how-kathy-ruemmler-and-goldman-sachs-finally-reached-their-breaking-point-4c33d77e?mod=rss_markets_main
20,2026-02-14-11-02-14 +0000,bbc,Ex-Reform MP Rupert Lowe launches new party,https://www.bbc.com/news/articles/cp813pn43gxo?at_medium=RSS&at_campaign=rss
20,2026-02-13-22-29-17 +0000,latimes,Parents who blame Snapchat for their children's deaths protest outside company's headquarters,https://www.latimes.com/business/story/2026-02-13/parents-who-blame-snapchat-for-their-childrens-deaths-protest-outside-companys-headquarters
20,2026-02-14-09-05-56 +0000,nyt,New Research Absolves the Woman Blamed for a Dynasty’s Ruin,https://www.nytimes.com/2026/02/14/world/asia/china-zhou-dynasty-king-climate-change.html
19,2026-02-13-23-02-41 +0000,nyt,The Mutually Beneficial Ties Between Jeffrey Epstein and Thorbjorn Jagland,https://www.nytimes.com/2026/02/13/world/europe/norway-jagland-epstein.html
19,2026-02-14-10-00-10 +0000,wapo,"If not for this one industry, the U.S. labor market would look a lot worse",https://www.washingtonpost.com/business/2026/02/14/health-care-industry-fuels-employment/
19,2026-02-14-02-00-00 +0000,wsj,America Fell Out of Love With the Sedan. Detroit Wants to Bring It Back.,https://www.wsj.com/business/autos/sedans-cars-trucks-detroit-afb034ee?mod=pls_whats_news_us_business_f
19,2026-02-14-02-25-54 +0000,latimes,"California coffee growing pioneers die of unknown causes, leaving behind 3 children",https://www.latimes.com/california/story/2026-02-13/california-coffee-growing-pioneers-die-of-unknown-causes-leaving-behind-3-children
19,2026-02-14-09-00-00 +0000,cbc,‘We’re so vulnerable’: How Canadians can cope with anxiety in the face of existential threats from the U.S.,https://www.cbc.ca/news/canada/united-states-threats-canada-anxiety-coping-9.7083301?cmp=rss
19,2026-02-14-19-18-58 +0000,nyt,Neighbor Recalls Investigators Searching Home Next Door in Guthrie Disappearance,https://www.nytimes.com/2026/02/14/us/nancy-guthrie-case-search-warrant.html
19,2026-02-14-13-20-09 +0000,nypost,Bad faith: NYC Catholics fume after Zohran Mamdani repeatedly snubs them,https://nypost.com/2026/02/14/us-news/bad-faith-catholics-fume-after-repeated-mamdani-snubs/
19,2026-02-14-10-00-36 +0000,wapo,A new mortgage crisis is quietly hitting those who can least afford it,https://www.washingtonpost.com/business/2026/02/14/mortgage-problems-delinquencies/
18,2026-02-13-22-03-04 +0000,nyt,"Four Killed in Plane Crash Near Steamboat Springs, Colo.",https://www.nytimes.com/2026/02/13/us/steamboat-springs-plane-crash.html
18,2026-02-13-23-37-14 +0000,nyt,"As Diplomats Talk, Pentagon Prepares for Possible War With Iran",https://www.nytimes.com/2026/02/13/us/politics/trump-iran-pentagon.html
18,2026-02-14-15-00-00 +0000,startribune,"In the shadow of the Whipple Building, a prayer camp springs up on sacred land",https://www.startribune.com/prayer-camp-whipple-mni-owe-sni-coldwater-spring-fort-snelling-ice-minnesota/601582318
18,2026-02-14-17-18-56 +0000,nyt,Larry Bushart Is Free From Jail — and Off Facebook — After Charlie Kirk Post,https://www.nytimes.com/2026/02/14/us/larry-bushart-facebook-charlie-kirk.html
18,2026-02-14-17-43-36 +0000,nypost,Teen shot as lawless mob takes over DTLA streets — hours after student agitators clashed with cops nearby,https://nypost.com/2026/02/14/us-news/teen-shot-as-lawless-mob-takes-over-dtla-streets-hours-after-student-agitators-clashed-with-cops-nearby/
17,2026-02-13-23-28-47 +0000,nypost,Va. Supreme Court greenlights redistricting measure that could add 4 more Democrat seats in Congress,https://nypost.com/2026/02/13/us-news/va-supreme-court-greenlights-redistricting-measure-aiming-to-add-democrat-seats-in-congress/
17,2026-02-14-01-50-08 +0000,nyt,"UK Ban on Palestine Action Is Unlawful, Court Finds",https://www.nytimes.com/2026/02/13/world/europe/uk-palestine-action-ban-court-ruling.html
17,2026-02-14-16-55-06 +0000,nyt,"After Mass Shooting, the Town of Tumbler Ridge, British Columbia Is Forever Changed",https://www.nytimes.com/2026/02/14/world/canada/tumbler-ridge-mass-shooting-canada.html
17,2026-02-14-17-45-34 +0000,cbc,"Russia is still waging war in Ukraine, but door opening for more of its athletes to compete",https://www.cbc.ca/news/world/olympics-russia-ukraine-sport-9.7090407?cmp=rss
16,2026-02-14-10-11-49 +0000,nyt,Japan Releases Chinese Boat Captain After Detaining Him for 30 Hours,https://www.nytimes.com/2026/02/14/world/asia/japan-china-boat-captain-release.html
16,2026-02-14-10-17-47 +0000,nyt,"Brazil, the World’s Largest Catholic Nation, Embraces Polyamory",https://www.nytimes.com/2026/02/14/world/americas/brazil-polyamory-non-monogamy-catholic.html
16,2026-02-13-21-57-00 +0000,wsj,"Stocks Rise on Softer Inflation Data, but AI Jitters Trigger Worst Week Since November",https://www.wsj.com/finance/stocks/stocks-rise-on-softer-inflation-data-but-ai-jitters-trigger-worst-week-since-november-611bd7ca?mod=rss_markets_main
16,2026-02-13-22-27-47 +0000,cbc,"Canada, Denmark deepen defence ties after Greenland annexation threat",https://www.cbc.ca/news/politics/canada-denmark-greenland-arctic-defence-trump-9.7089217?cmp=rss
16,2026-02-13-23-00-35 +0000,nyt,Why Are More Congress Members Retiring or Not Seeking Re-election in 2026?,https://www.nytimes.com/2026/02/13/us/politics/congress-retirements-house-senate.html
16,2026-02-14-11-00-34 +0000,nyt,Scotty James Is Edged Out by Yuto Totsuka of Japan in the Halfpipe.,https://www.nytimes.com/2026/02/14/world/scotty-james-halfpipe-snowboard-highlight.html
16,2026-02-14-19-33-00 +0000,nyt,Lucas Pinheiro Braathen of Brazil and Mikhail Shaidorov of Kazakhstan Win Olympic Gold Medals,https://www.nytimes.com/2026/02/14/world/olympics/brazil-kazakhstan-gold-medals-winter-olympics.html
16,2026-02-14-12-00-00 +0000,missionlocal,This Valentine’s Day: Tales of love from San Francisco’s county jail,https://missionlocal.org/2026/02/sf-hall-of-justice-valentines-day-jail/
16,2026-02-14-14-25-57 +0000,nyt,Shivering Americans Snap Up Firewood as Winter Grinds On,https://www.nytimes.com/2026/02/14/us/firewood-sales-boom-winter.html
16,2026-02-14-13-00-00 +0000,startribune,Ramstad: Immigration is Minnesota’s top issue. We need to hear specific numbers.,https://www.startribune.com/ramstad-immigration-is-minnesotas-top-issue-we-need-to-hear-specific-numbers/601556403
15,2026-02-14-17-17-35 +0000,nypost,Tokyo Disneyland replaces classic Splash Mountain sign — sparking backlash as critics slam ‘woke’ move,https://nypost.com/2026/02/14/world-news/disney-park-replaces-classic-sign-at-splash-mountain-sparks-backlash/
15,2026-02-14-18-19-55 +0000,nypost,AOC accuses Israel of ‘genocide’ while in Germany — the home of the Holocaust: ‘Shocking ignorance’,https://nypost.com/2026/02/14/world-news/aoc-accuses-israel-of-genocide-while-in-germany-the-home-of-the-holocaust-shocking-ignorance/
15,2026-02-14-19-58-44 +0000,nyt,"Ocasio-Cortez Offers a Working-Class Vision in Munich, With Some Stumbles",https://www.nytimes.com/2026/02/13/us/politics/aoc-populism-munich-security-conference.html
15,2026-02-14-18-07-55 +0000,nyt,California Billionaires Maneuver Now in Case Wealth Tax Passes,https://www.nytimes.com/2026/02/14/us/california-billionaire-wealth-tax.html
15,2026-02-14-18-01-26 +0000,nypost,College professor warns that scrapping SAT for sake of ‘inclusivity’ leaves students unprepared,https://nypost.com/2026/02/14/us-news/cal-state-prof-warns-scrapping-sat-is-leaving-students-unprepared/
15,2026-02-14-02-55-21 +0000,bbc,Two Britons among three dead in French Alps avalanche,https://www.bbc.com/news/articles/cd03elmng7do?at_medium=RSS&at_campaign=rss
15,2026-02-14-03-48-26 +0000,nypost,Va. Gov. Abigail Spanberger’s grilling techniques gets torched online as Schumer’s ‘E. coli’ burger resurfaces,https://nypost.com/2026/02/13/us-news/va-gov-abigail-spanbergers-grilling-techniques-gets-torched-online-as-schumers-e-coli-burger-resurfaces/
15,2026-02-13-21-58-00 +0000,wsj,"Tech, Media & Telecom Roundup: Market Talk",https://www.wsj.com/business/tech-media-telecom-roundup-market-talk-3a8de879?mod=pls_whats_news_us_business_f
15,2026-02-13-22-42-02 +0000,latimes,Rivian finds a way to shine even as the EV market struggles in the dark,https://www.latimes.com/business/story/2026-02-13/rivian-signals-comeback-with-better-than-expected-earnings-in-2025
15,2026-02-14-10-02-24 +0000,nyt,"Harris Sold Email List to D.N.C., Then Paid Off 2024 Debts",https://www.nytimes.com/2026/02/14/us/politics/dnc-kamala-harris-email-list-debt.html
15,2026-02-14-04-00-00 +0000,wsj,China Deploys a ‘National Team’ of Investors to Keep AI Stock Boom in Check,https://www.wsj.com/finance/stocks/china-deploys-a-national-team-of-investors-to-keep-ai-stock-boom-in-check-c3d9534a?mod=pls_whats_news_us_business_f
15,2026-02-14-10-02-40 +0000,nyt,Constant Sexual Aggression Drives Female Tortoises to Walk Off Cliffs,https://www.nytimes.com/2026/02/14/science/tortoises-island-sex-cliff.html
15,2026-02-14-05-08-21 +0000,nypost,3 dead after US strikes another alleged drug boat in Caribbean,https://nypost.com/2026/02/14/us-news/3-dead-after-us-strikes-another-alleged-drug-boat-in-caribbean/
15,2026-02-14-15-54-04 +0000,nyt,Software? No Way. We’re an A.I. Company Now!,https://www.nytimes.com/2026/02/14/business/dealbook/software-companies-ai.html
15,2026-02-14-12-52-30 +0000,nyt,Can You Rely on A.I. to Translate Love?,https://www.nytimes.com/video/business/100000010590569/can-you-rely-on-ai-relationships-love.html
15,2026-02-14-15-20-45 +0000,nyt,"Department of Homeland Security Shuts Down, Though Essential Work Continues",https://www.nytimes.com/2026/02/13/us/politics/dhs-shutdown-funding.html
15,2026-02-14-15-51-25 +0000,nyt,"Milo Rau’s ‘Hate Radio,’ ‘Pelicot Trial’ and More Theater of the Real",https://www.nytimes.com/2026/02/14/theater/milo-rau-hate-radio-pelicot-trial.html
14,2026-02-13-23-37-21 +0000,nypost,AOC won’t say whether US should defend Taiwan if China invades,https://nypost.com/2026/02/13/us-news/aoc-wont-say-whether-us-should-defend-taiwan-if-china-invades/
14,2026-02-14-01-57-43 +0000,bbc,Indian man admits plot to kill US-based Sikh separatist leader,https://www.bbc.com/news/articles/cx2ryxwdl7po?at_medium=RSS&at_campaign=rss
14,2026-02-14-11-00-00 +0000,latimes,L.A. streetlights take a year to fix. Council members say solar power is the answer,https://www.latimes.com/california/story/2026-02-14/la-streetlights-take-year-to-fix-city-council-touts-solar-power
14,2026-02-14-11-00-00 +0000,latimes,Notoriously hazardous South L.A. oil wells finally plugged after decades of community pressure,https://www.latimes.com/environment/story/2026-02-14/hazardous-south-la-oil-wells-plugged-after-decades-of-community-pressure
14,2026-02-14-16-20-33 +0000,bbc,Planned US-funded baby vaccine trial in Guinea-Bissau blasted by WHO,https://www.bbc.com/news/articles/c78j5k2gk02o?at_medium=RSS&at_campaign=rss
14,2026-02-14-15-00-00 +0000,startribune,Souhan: Gophers’ Amaya Battle authoring dramatic ending to her college career,https://www.startribune.com/gophers-womens-basketball-amaya-battle-dawn-plitzuweit-mara-braun-ncaa-tournament-hamilton/601579786
14,2026-02-14-19-04-32 +0000,nypost,‘The Hills’ star Stephanie Pratt brutally turns on brother Spencer over LA mayoral run: ‘Vote for stupidity’,https://nypost.com/2026/02/14/us-news/spencer-pratts-sister-stephanie-slams-his-la-mayoral-run/
14,2026-02-14-17-51-21 +0000,nyt,"ElRoy Face, Ace Forkballer and Effective Closer for Pirates, Dies at 97",https://www.nytimes.com/2026/02/14/us/elroy-face-dead.html
14,2026-02-14-14-00-00 +0000,nypost,"Ilhan Omar probe goes global with demand for info on hubby’s biz dealings in Kenya, Dubai and Somalia",https://nypost.com/2026/02/14/us-news/ilhan-omar-probe-goes-global-with-demand-for-info-on-hubbys-biz-dealings-in-kenya-dubai-and-somalia/
14,2026-02-14-18-35-15 +0000,bbc,Former Foreign Office cat Palmerston dies in Bermuda,https://www.bbc.com/news/articles/c5yv718pyz7o?at_medium=RSS&at_campaign=rss
13,2026-02-14-00-13-01 +0000,bbc,Gasps and disbelief in US as 'Quad God's' Olympic dream crumbles,https://www.bbc.com/news/videos/c93wgxnk351o?at_medium=RSS&at_campaign=rss
13,2026-02-14-15-53-57 +0000,nyt,RFK Jr. Allies Target States to Overturn Vaccine Mandates for Schools,https://www.nytimes.com/2026/02/13/health/rfk-school-vaccine-mandates.html
13,2026-02-14-18-04-51 +0000,bbc,Cuban cigar festival called off as US blockade worsens energy crisis,https://www.bbc.com/news/articles/c0q30k2xzk2o?at_medium=RSS&at_campaign=rss
13,2026-02-14-12-00-00 +0000,missionlocal,"For S.F. indie band Carpool Tunnel, Bottom of the Hill is a love story",https://missionlocal.org/2026/02/for-s-f-indie-band-carpool-tunnel-bottom-of-the-hill-is-a-love-story/
13,2026-02-14-02-03-37 +0000,bbc,Andrew facing claim he shared Treasury document with banking contact,https://www.bbc.com/news/articles/cddn6yyr66yo?at_medium=RSS&at_campaign=rss
13,2026-02-14-04-32-02 +0000,nypost,Thousands of smoke detectors sold on Amazon recalled due to potential fire hazard,https://nypost.com/2026/02/13/business/thousands-of-amazons-lshome-photoelectric-smoke-detectors-recalled-due-to-potential-fire-hazard/
13,2026-02-14-09-00-00 +0000,cbc,Inuit leaders urge Ottawa to follow Greenland's infrastructure lead,https://www.cbc.ca/news/politics/inuit-leaders-urge-ottawa-follow-greenland-infrastructure-9.7088538?cmp=rss
13,2026-02-13-22-40-00 +0000,wsj,Opinion | Teachers Hold California Children Hostage,https://www.wsj.com/opinion/california-teachers-unions-strikes-san-francisco-los-angeles-schools-2f53ec34
13,2026-02-13-22-08-00 +0000,wsj,Opinion | Compass Wants Zillow to Hide Homes From You,https://www.wsj.com/opinion/compass-wants-zillow-to-hide-homes-from-you-9416ef50
13,2026-02-13-22-37-08 +0000,bbc,Shaidorov wins gold as 'Quad God' Malinin crumbles,https://www.bbc.com/sport/articles/c99jx4l7191o?at_medium=RSS&at_campaign=rss
12,2026-02-13-23-10-28 +0000,nyt,"Venezuela’s Natural Gas, Not Oil, Might Be a Big Early Prize",https://www.nytimes.com/2026/02/13/business/energy-environment/venezuelas-natural-gas-trinidad-tobago.html
12,2026-02-14-00-21-16 +0000,nyt,Dutch Prosecutors Fine Louis Vuitton Netherlands in Money Laundering Case,https://www.nytimes.com/2026/02/12/world/europe/louis-vuitton-money-laundering-fine.html
12,2026-02-14-19-01-18 +0000,nyt,Meta Plans to Add Facial Recognition Technology to Its Smart Glasses,https://www.nytimes.com/2026/02/13/technology/meta-facial-recognition-smart-glasses.html
12,2026-02-14-15-59-14 +0000,latimes,Who pays for Newsom's travel? Hint: It's not always taxpayers,https://www.latimes.com/politics/story/2026-02-14/who-pays-for-newsoms-travel
12,2026-02-14-13-13-13 +0000,bbc,Tribes grant the Colorado River legal personhood - can this help save it?,https://www.bbc.com/news/videos/crmlgpnnzyxo?at_medium=RSS&at_campaign=rss
12,2026-02-14-16-54-02 +0000,nyt,"The Sea Took Her Prosthetic Leg. Months Later, It Gave It Back.",https://www.nytimes.com/2026/02/14/world/europe/sea-prosthetic-leg-limb.html
12,2026-02-14-19-44-17 +0000,cbc,Canada has officially joined the EU's loans-for-weapons program,https://www.cbc.ca/news/politics/canada-eu-safe-agreement-defence-loans-weapons-9.7090635?cmp=rss
12,2026-02-13-22-12-03 +0000,bbc,'We are not protected' says Hebron mayor as Israel expands West Bank control,https://www.bbc.com/news/articles/crl4ne5er5zo?at_medium=RSS&at_campaign=rss
12,2026-02-14-03-44-44 +0000,nyt,"Three Federal Officers Injured in Los Angeles Protests, D.H.S. Says",https://www.nytimes.com/2026/02/13/us/politics/dhs-ice-agents-injured.html
12,2026-02-14-01-26-44 +0000,bbc,Are families being priced out of restaurants?,https://www.bbc.com/news/articles/c0ljpxek5w2o?at_medium=RSS&at_campaign=rss
12,2026-02-13-22-01-00 +0000,wsj,Energy & Utilities Roundup: Market Talk,https://www.wsj.com/business/energy-oil/energy-utilities-roundup-market-talk-d97931b2?mod=pls_whats_news_us_business_f
12,2026-02-13-22-26-28 +0000,nyt,"Bob Croft, Who Dived Deep Into the Ocean on a Single Breath, Dies at 91",https://www.nytimes.com/2026/02/13/us/bob-croft-dead.html
11,2026-02-14-00-02-04 +0000,bbc,Kenyans drop flowers for Valentine's bouquets of cash. Not everyone is impressed,https://www.bbc.com/news/articles/cn87g2v73jno?at_medium=RSS&at_campaign=rss
11,2026-02-13-23-14-00 +0000,wsj,Los Angeles Sues American Industrial Partners Over Firetruck Rollup,https://www.wsj.com/articles/los-angeles-sues-american-industrial-partners-over-firetruck-rollup-2c1cff54?mod=pls_whats_news_us_business_f
11,2026-02-14-10-02-31 +0000,nyt,Vermont Made Child Care Affordable. Could It Lead by Example?,https://www.nytimes.com/video/us/100000010708448/vermont-affordable-childcare-act-76.html
11,2026-02-14-10-02-44 +0000,nyt,T.S.A. Workers Brace for Another Shutdown They Didn’t Cause,https://www.nytimes.com/2026/02/14/us/politics/tsa-homeland-security-shutdown.html
11,2026-02-14-16-09-27 +0000,nyt,"Roy Medvedev, Soviet Era Historian and Dissident, Is Dead at 100",https://www.nytimes.com/2026/02/14/world/europe/roy-medvedev-dead.html
11,2026-02-14-20-50-07 +0000,nyt,"Ebo Taylor, Musical Innovator of Highlife and Afrobeat, Dies at 90",https://www.nytimes.com/2026/02/13/arts/music/ebo-taylor-dead.html
11,2026-02-13-23-05-07 +0000,bbc,The two Chinese-American Olympians competing for rival superpowers,https://www.bbc.com/news/articles/czr07r0vengo?at_medium=RSS&at_campaign=rss
11,2026-02-14-05-00-08 +0000,nyt,"How China Built a Chip Industry, and Why It’s Still Not Enough",https://www.nytimes.com/2026/02/14/business/china-chips-nvidia-huawei.html
11,2026-02-13-22-30-17 +0000,bbc,France probes baby formula producers over contamination recalls,https://www.bbc.com/news/articles/cq8gqeq8yv0o?at_medium=RSS&at_campaign=rss
11,2026-02-13-23-03-00 +0000,wsj,The Battles Inside Kristi Noem’s DHS: Five Takeaways From the Journal’s Investigation,https://www.wsj.com/politics/policy/the-battles-inside-kristi-noems-dhs-five-takeaways-from-the-journals-investigation-67d01521
10,2026-02-13-22-23-36 +0000,missionlocal,"S.F. officials celebrate end of teachers strike, but warn of fiscal headwinds",https://missionlocal.org/2026/02/sf-teachers-strike-sfusd-budget-city-hall/
10,2026-02-13-22-32-32 +0000,nyt,"After a Harrowing Water Rescue, Baby Is Delivered on Mother’s Birthday",https://www.nytimes.com/2026/02/13/us/shedly-appollon-birthday-emergency-c-section-florida.html
10,2026-02-14-10-02-52 +0000,nyt,Inside the Debacle That Led to the Closure of El Paso’s Airspace,https://www.nytimes.com/2026/02/14/us/politics/el-paso-airspace-closure-faa-pentagon.html
10,2026-02-14-01-00-00 +0000,wsj,A Pilot’s Parents Work to Clear His Name After the Deadliest Crash in Decades,https://www.wsj.com/business/airlines/pilot-parents-american-airlines-potomac-helicopter-crash-b6c33697?mod=pls_whats_news_us_business_f
10,2026-02-14-04-00-00 +0000,wsj,Saudi Youth Couldn’t Date Openly a Decade Ago. Now Tinder Is Booming.,https://www.wsj.com/world/middle-east/saudi-arabia-tinder-youth-dating-c17f02fa
10,2026-02-14-00-10-50 +0000,nyt,Jury Deadlocked in Trial of Pro-Palestinian Demonstrators at Stanford,https://www.nytimes.com/2026/02/13/us/stanford-students-protests-trial.html
10,2026-02-13-23-38-13 +0000,nyt,Man Pleads Guilty in Murder Plot U.S. Says Is Tied to Indian Government,https://www.nytimes.com/2026/02/13/nyregion/nikhil-gupta-assasination-india-sikh-plea.html
10,2026-02-14-01-45-02 +0000,bbc,Why writer Arundhati Roy's cult classic film is still relevant in India,https://www.bbc.com/news/articles/cn9exzl254xo?at_medium=RSS&at_campaign=rss
10,2026-02-14-20-36-12 +0000,nyt,"King Leatherbury, Trainer and Trader of Horses, Dies at 92",https://www.nytimes.com/2026/02/14/us/king-leatherbury-trainer-and-trader-of-horses-dies-at-92.html
9,2026-02-14-20-13-40 +0000,latimes,Sprawling network of brothels in Ventura and L.A. counties busted by authorities,https://www.latimes.com/california/story/2026-02-14/sprawling-network-of-brothels-in-ventura-la-counties-busted-by-authorities
9,2026-02-13-23-51-04 +0000,nyt,Florida Couple Arrested After Pickleball Match Turns Into a Brawl,https://www.nytimes.com/2026/02/13/us/pickleball-brawl-florida-arrests.html
9,2026-02-14-00-07-58 +0000,bbc,What is the SAVE America Act that mandates voter ID?,https://www.bbc.com/news/articles/crk845r4vlyo?at_medium=RSS&at_campaign=rss
9,2026-02-13-23-06-00 +0000,wsj,Here’s What the Big Bank CEOs Got Paid in 2025,https://www.wsj.com/finance/banking/heres-what-the-big-bank-ceos-got-paid-in-2025-ba0c4ceb?mod=pls_whats_news_us_business_f
9,2026-02-14-02-07-51 +0000,nyt,Ilia Malinin’s catastrophic free skate: ‘I blew it.’,https://www.nytimes.com/2026/02/13/world/ilia-malinin-figure-skating-medal.html
9,2026-02-14-03-03-27 +0000,bbc,Oil refinery blaze hits Cuba as fuel crisis deepens,https://www.bbc.com/news/articles/cge89x7re74o?at_medium=RSS&at_campaign=rss
9,2026-02-14-00-02-58 +0000,latimes,"As a Colorado River deadline passes, reservoirs keep declining",https://www.latimes.com/environment/story/2026-02-13/states-miss-colorado-river-deadline
8,2026-02-13-22-32-05 +0000,bbc,"Heathrow not crowded but people walk in 'wrong place', says boss",https://www.bbc.com/news/articles/c4g52q0pl5yo?at_medium=RSS&at_campaign=rss
8,2026-02-14-17-18-15 +0000,nyt,Pakistan Accused of Denying Treatment for Imran Khan’s Failing Eyesight,https://www.nytimes.com/2026/02/14/world/asia/pakistan-imran-khan-eyesight.html
8,2026-02-14-17-00-00 +0000,wsj,"Phonographs, Player Pianos and Betamax: The Inventions That Transformed Entertainment",https://www.wsj.com/business/media/10-inventions-entertainment-phonograph-streaming-a7b97be6?mod=pls_whats_news_us_business_f
8,2026-02-14-11-00-00 +0000,latimes,Commentary: How SoCal became the nation's dairy queen,https://www.latimes.com/california/story/2026-02-14/how-socal-became-nations-dairy-queen
7,2026-02-14-10-50-32 +0000,nyt,The 2026 Milan Olympics Has Its Eyes on Grana Padano,https://www.nytimes.com/2026/02/14/dining/grana-padano-cheese-milan-olympics.html
7,2026-02-14-10-01-00 +0000,nyt,How A.I. Salaries Are Causing Couples to Rethink Money in Relationships,https://www.nytimes.com/2026/02/14/business/artificial-intelligence-relationships-income-gap.html
7,2026-02-14-08-17-08 +0000,bbc,Rising vet costs leave charity with £400k bill,https://www.bbc.com/news/articles/cgjz7wzgvlzo?at_medium=RSS&at_campaign=rss
5,2026-02-14-19-38-03 +0000,nyt,The Hidden Number Driving U.S. Job Growth,https://www.nytimes.com/video/business/economy/100000010706277/explaining-us-job-growth-healthcare-ai-trump.html
5,2026-02-14-10-30-00 +0000,wsj,How Ozempic Brought a Napster Moment to Big Pharma,https://www.wsj.com/health/pharma/how-ozempic-brought-a-napster-moment-to-big-pharma-b38339f0?mod=rss_markets_main
4,2026-02-14-10-00-45 +0000,nyt,Life in Beirut Beneath the Drones,https://www.nytimes.com/2026/02/14/world/middleeast/beirut-drones-sound-israel-airstrikes.html
4,2026-02-13-22-30-00 +0000,wsj,The WSJ Dollar Index Falls 0.95% This Week to 94.15,https://www.wsj.com/finance/currencies/asian-currencies-consolidate-risk-off-sentiment-could-weigh-b4a63f52?mod=rss_markets_main
4,2026-02-14-18-37-31 +0000,nyt,Here’s the latest.,https://www.nytimes.com/live/2026/02/14/world/munich-security-conference-rubio/munich-conference-europe-trump-day-two
4,2026-02-13-22-43-00 +0000,wsj,"Opinion | Edward H. Crane, Libertarian Builder",https://www.wsj.com/opinion/ed-crane-dies-age-81-cato-institute-libertarian-b5b2f68a
3,2026-02-14-11-00-00 +0000,wsj,"News quiz for Feb. 14, 2026",https://www.wsj.com/business/media/news-quiz-for-feb-14-2026-b2e130b3?mod=pls_whats_news_us_business_f
3,2026-02-14-16-49-46 +0000,nyt,Open Road,https://www.nytimes.com/2026/02/14/briefing/open-road.html
3,2026-02-14-14-00-00 +0000,missionlocal,The date from hell,https://missionlocal.org/2026/02/the-date-from-hell/
