score,pubdate,source,title,link
132,2026-03-21-01-17-19 +0000,nyt,Iran War Live Updates: Trump Says U.S. Is Considering ‘Winding Down’ War,https://www.nytimes.com/live/2026/03/20/world/iran-war-oil-trump
114,2026-03-20-20-27-24 +0000,nypost,"Trump vows no cease-fire with Iran, predicts Strait of Hormuz may ‘open itself’",https://nypost.com/2026/03/20/world-news/trump-vows-no-cease-fire-with-iran-predicts-strait-of-hormuz-may-open-itself/
111,2026-03-21-01-29-59 +0000,bbc,Trump says he is considering 'winding down' Iran war,https://www.bbc.com/news/articles/cpd5l00z7n6o?at_medium=RSS&at_campaign=rss
107,2026-03-20-13-20-07 +0000,nypost,Saudi Arabia warns oil prices could spike past $180 a barrel if Iran war rages on: report,https://nypost.com/2026/03/20/business/saudi-arabia-warns-oil-prices-could-spike-past-180-a-barrel-if-iran-war-rages-on-report/
105,2026-03-20-10-47-00 +0000,wsj,"In Nearly 90 Truth Social Posts, Trump Narrates the War in Iran",https://www.wsj.com/politics/policy/in-nearly-90-truth-social-posts-trump-narrates-the-war-in-iran-2086975c
103,2026-03-20-16-56-35 +0000,nyt,Iran War Underscores the Diverging Aims of Trump and Netanyahu,https://www.nytimes.com/2026/03/20/world/europe/iran-us-israel-goals.html
99,2026-03-20-18-19-51 +0000,nypost,UK agrees to let US military use its bases for strikes in the Strait of Hormuz after Trump calls European allies ‘cowards’ for refusing to help,https://nypost.com/2026/03/20/world-news/uk-to-let-us-use-its-bases-for-strikes-to-help-reopen-strait-of-hormuz/
94,2026-03-21-00-17-00 +0000,wsj,"A federal judge on Friday blocked the Trump administration from enforcing a policy that limits reporters’ access to the Pentagon, ruling that key elements of the new rules were unconstitutional",https://www.wsj.com/politics/the-pentagons-new-press-rules-violate-the-first-amendment-judge-rules-cbca9999
93,2026-03-20-18-52-25 +0000,nyt,Iran War Fallout: Southeast Asia Hard Hit by Skyrocketing Fuel Prices,https://www.nytimes.com/2026/03/20/world/asia/iran-war-oil-thailand-vietnam-philippines.html
91,2026-03-20-16-41-54 +0000,latimes,"Trump weighs 'winding down' war as Pentagon sends 2,500 California Marines to Mideast",https://www.latimes.com/politics/story/2026-03-20/iran-war-oil-prices
90,2026-03-20-07-10-45 +0000,nyt,Trump Says He Won’t Send Troops to Iran but Leaves Wiggle Room,https://www.nytimes.com/2026/03/19/world/middleeast/trump-iran-us-troops.html
87,2026-03-20-21-41-00 +0000,wsj,"No Cease-Fire With Iran, Trump Says",https://www.wsj.com/business/no-cease-fire-with-iran-trump-says-46bd29eb?mod=pls_whats_news_us_business_f
86,2026-03-20-18-32-39 +0000,wapo,4 women killed in West Bank are first Palestinian deaths in Iran war,https://www.washingtonpost.com/world/2026/03/20/west-bank-palestinian-women-killed-beit-awa/
82,2026-03-20-15-04-02 +0000,nyt,"Deferring to Trump, G.O.P. Lawmakers Resist a Public Accounting on Iran",https://www.nytimes.com/2026/03/20/us/politics/congress-iran-trump.html
81,2026-03-21-01-17-11 +0000,nyt,Trump Signals Retreat From Goal of Regime Change in Iran,https://www.nytimes.com/2026/03/20/world/middleeast/trump-winding-down-iran-war.html
77,2026-03-21-01-00-00 +0000,wsj,Iran Believes It’s Winning—and Wants a Steep Price to End the War,https://www.wsj.com/world/middle-east/iran-war-negotiations-demands-85555522
76,2026-03-20-18-37-09 +0000,nyt,Fed Official Urges Caution on Rate Cuts as Iran War Drags On,https://www.nytimes.com/2026/03/20/business/economy/fed-waller-interest-rates.html
76,2026-03-20-12-06-53 +0000,bbc,How the Iran war may affect your money and bills,https://www.bbc.com/news/articles/c2e4ygndjpwo?at_medium=RSS&at_campaign=rss
75,2026-03-20-21-58-54 +0000,nyt,Here’s What Happened in the War in Iran in Its Third Week,https://www.nytimes.com/2026/03/20/world/middleeast/iran-war-middle-east-recap.html
74,2026-03-20-14-19-43 +0000,nypost,Trump calls NATO members ‘cowards’ over refusal to ‘help open’ Strait of Hormuz,https://nypost.com/2026/03/20/us-news/trump-calls-nato-members-cowards-over-refusal-to-help-open-strait-of-hormuz/
73,2026-03-20-17-13-01 +0000,nyt,How the Iran War Narrowed Flight Corridors Between Europe and Asia,https://www.nytimes.com/2026/03/20/world/europe/iran-war-airports-russia-flight-paths.html
71,2026-03-20-10-59-00 +0000,wsj,The havoc Iran is wreaking on energy markets could cause lasting damage to the U.S. economy. Read more in today’s WSJ Politics Newsletter:,https://www.wsj.com/politics/for-the-white-house-oil-shock-could-quickly-become-recession-shock-2aa83f52
70,2026-03-20-17-59-34 +0000,nyt,A Diary of War From an Unlikely Author: the Son of Iran’s President,https://www.nytimes.com/2026/03/20/world/middleeast/iran-pezeshkian-son-diary.html
70,2026-03-20-20-34-06 +0000,nyt,Switzerland Blocks Arms Sales to U.S. Over Iran War,https://www.nytimes.com/2026/03/20/world/middleeast/switzerland-halts-arms-sales-us.html
69,2026-03-20-18-59-33 +0000,nyt,Iran’s New Supreme Leader Issues a Statement but Remains Unseen,https://www.nytimes.com/2026/03/20/world/middleeast/supreme-leader-statement.html
69,2026-03-20-23-53-34 +0000,nypost,US pauses sanctions on Iranian oil ‘stranded at sea’ to help curb skyrocketing energy prices,https://nypost.com/2026/03/20/us-news/us-pauses-sanctions-on-iranian-oil-stranded-at-sea-to-help-curb-rising-prices/
67,2026-03-21-02-00-00 +0000,wsj,Iran War Puts U.S. Diplomatic Missions in the Crosshairs,https://www.wsj.com/politics/national-security/iran-us-embassies-consulates-4eadefff
66,2026-03-20-13-41-54 +0000,bbc,In maps: Attacks across Iran and the Middle East continue across third week,https://www.bbc.com/news/articles/c4g0pnnj8xyo?at_medium=RSS&at_campaign=rss
66,2026-03-20-20-09-59 +0000,nypost,Trump praises ‘great supporter’ Chuck Norris after legendary movie star’s death at 86: ‘Tough cookie’,https://nypost.com/2026/03/20/us-news/trump-praises-great-supporter-chuck-norris-after-legendary-movie-stars-death-at-86-tough-cookie/
65,2026-03-20-18-25-07 +0000,nyt,NATO Pulls Last Military Trainers From Iraq Amid Strikes From Iran,https://www.nytimes.com/2026/03/20/world/middleeast/nato-iraq.html
62,2026-03-20-14-52-50 +0000,bbc,Iran warns UK letting US use bases is 'participation in aggression',https://www.bbc.com/news/articles/cvgkd3lqe2no?at_medium=RSS&at_campaign=rss
61,2026-03-20-10-08-21 +0000,nyt,Trump’s Complaint About Israeli Strike on Gas Field Exposes Divergent Strategies,https://www.nytimes.com/2026/03/19/us/politics/trump-netanyahu-iran-gas-field-attack.html
61,2026-03-20-16-05-05 +0000,nypost,"Trump is gearing up to fix the ‘name, image and likeness’ mess that’s dogging college sports: sources",https://nypost.com/2026/03/20/business/trump-is-gearing-up-to-fix-the-name-image-and-likeness-mess-thats-dogging-college-sports-sources/
61,2026-03-20-19-18-17 +0000,nyt,A Few Ships Are Trickling Through the Strait of Hormuz With Iran’s Approval,https://www.nytimes.com/2026/03/20/world/middleeast/strait-of-hormuz-iran-approval.html
60,2026-03-20-15-40-48 +0000,nypost,Pentagon makes another large deployment of Marines toward Iran,https://nypost.com/2026/03/20/us-news/pentagon-deploying-2500-marines-and-3-warships-to-the-middle-east/
60,2026-03-20-14-00-00 +0000,wsj,Giant South Pars Gas Field Is Iran’s Biggest Economic Safety Net,https://www.wsj.com/world/middle-east/giant-south-pars-gas-field-is-irans-biggest-economic-safety-net-b24c6578
60,2026-03-20-08-21-07 +0000,nypost,"Spokesperson for Iran’s Revolutionary Guards killed in strike, state media report",https://nypost.com/2026/03/20/world-news/irans-revolutionary-guards-spokesperson-ali-mohammad-naini-killed-in-strike-iranian-state-tv-reports/
60,2026-03-20-15-47-58 +0000,nypost,Iran makes chilling threat to target tourist sites worldwide — as spring break kicks off in US,https://nypost.com/2026/03/20/world-news/iran-makes-chilling-threat-to-target-tourist-sites-worldwide-as-spring-break-kicks-off-in-us/
60,2026-03-20-09-00-03 +0000,wapo,Trump bank immigration order delayed amid Wall Street pushback,https://www.washingtonpost.com/business/2026/03/20/banks-immigration-trump/
58,2026-03-20-21-31-00 +0000,wsj,Opinion | Iran Attacks the Gulf Arabs. Will They Fight Back?,https://www.wsj.com/opinion/iran-gulf-states-oman-united-arab-emirates-donald-trump-077149d2?mod=pls_whats_news_us_business_f
57,2026-03-21-01-00-00 +0000,wsj,Some Democrats on Capitol Hill are discussing how to get New York Sen. Chuck Schumer to step aside as Senate minority leader amid concerns about his negotiating style and midterms strategy,https://www.wsj.com/politics/policy/chuck-schumer-democrat-leadership-replacement-talks-666f1d75
57,2026-03-20-16-01-49 +0000,nypost,Trump brags he’s in better health than the Navy football team — and even got a doctor’s opinion,https://nypost.com/2026/03/20/us-news/trump-brags-hes-in-better-health-than-the-navy-football-team-and-even-got-a-doctors-opinion/
57,2026-03-20-14-36-14 +0000,nypost,Israel says it killed top intel official in Iran’s Basij paramilitary force,https://nypost.com/2026/03/20/world-news/israel-says-it-killed-basij-paramilitary-forces-top-intel-official/
55,2026-03-20-09-34-53 +0000,nyt,U.S. Asked to Keep Military Planes in Sri Lanka Before Iran Airstrikes,https://www.nytimes.com/2026/03/20/world/asia/sri-lanka-iran-war-ships-aircraft.html
53,2026-03-20-21-03-18 +0000,nypost,"University of Alabama student James Gracey was alone when he accidentally fell and drowned, footage shows",https://nypost.com/2026/03/20/world-news/university-of-alabama-student-james-gracey-was-alone-when-he-accidentally-fell-and-drowned-footage-shows/
52,2026-03-20-16-54-00 +0000,wsj,Trump Administration Sues Harvard Over Antisemitism Allegations,https://www.wsj.com/us-news/education/trump-harvard-lawsuit-civil-rights-jewish-e3326b0b
52,2026-03-20-10-30-00 +0000,nypost,Are soaring beef prices busting your grocery budget? Here’s how much you’ll pay at 6 popular stores,https://nypost.com/2026/03/20/lifestyle/soaring-beef-prices-are-busting-grocery-budgets-heres-how-much-youll-pay-at-6-popular-stores/
52,2026-03-20-10-54-55 +0000,nypost,Netanyahu warns against replacing ‘Hitler with Himmler’ in Iran,https://nypost.com/2026/03/20/world-news/benjamin-netanyahu-warns-against-replacing-hitler-with-himmler-in-iran/
51,2026-03-20-04-01-24 +0000,nyt,"Using Charm and Restraint, Japan’s Leader Mostly Avoids Trump’s Wrath",https://www.nytimes.com/2026/03/20/world/asia/trump-japan-prime-minister-meeting.html
51,2026-03-20-09-55-19 +0000,bbc,Trump makes Pearl Harbor remark in meeting with Japan's PM,https://www.bbc.com/news/articles/c8dlpr074q3o?at_medium=RSS&at_campaign=rss
51,2026-03-20-12-04-34 +0000,cbc,Iran women's soccer team greeted with a welcome ceremony in Tehran,https://www.cbc.ca/sports/soccer/iran-women-asylum-claims-return-welcome-ceremony-9.7135841?cmp=rss
50,2026-03-20-13-45-36 +0000,nyt,Attacks on Oil and Natural Gas Facilities Could Lead to Much Higher Prices,https://www.nytimes.com/2026/03/19/business/energy-environment/iran-oil-natural-gas-attacks.html
50,2026-03-20-15-41-00 +0000,wsj,Opinion | One More Flaw in the 2015 Iran Nuclear Deal,https://www.wsj.com/opinion/one-more-flaw-in-the-2015-iran-nuclear-deal-1094a55f
50,2026-03-20-23-52-54 +0000,bbc,US lifts sanctions on some Iranian oil as gas prices soar,https://www.bbc.com/news/articles/c9d415g55nno?at_medium=RSS&at_campaign=rss
49,2026-03-20-21-31-34 +0000,nyt,Trump Administration Sues Harvard Over Accusations of Antisemitism,https://www.nytimes.com/2026/03/20/us/trump-harvard-antisemitism-suit.html
49,2026-03-20-18-52-06 +0000,nyt,Trump Friend Asked ICE to Detain the Mother of His Child,https://www.nytimes.com/2026/03/20/us/paolo-zampolli-ice-melania-trump-epstein.html
49,2026-03-20-21-22-00 +0000,wsj,A Belligerent Iran Has the U.S. Rushing Missile and Drone Defenses to the Gulf,https://www.wsj.com/world/middle-east/iran-us-missile-drone-defenses-c50d21e0
49,2026-03-20-15-57-01 +0000,nyt,A Meatpacking Strike in Colorado Is Another Stress to Trump’s Economy,https://www.nytimes.com/2026/03/20/us/meatpacking-strike-beef-prices.html
49,2026-03-20-10-55-24 +0000,nypost,University of Alabama student James Gracey seen walking toward rocks near beach before death in Barcelona: witness,https://nypost.com/2026/03/20/world-news/university-of-alabama-student-james-gracey-seen-walking-toward-rocks-moments-before-death-in-barcelona-witness/
49,2026-03-21-00-00-00 +0000,wsj,The Quiet American: How Pope Leo Is Pushing Back Against Trump,https://www.wsj.com/world/american-pope-leo-donald-trump-relationship-c5e7e0a1
49,2026-03-20-13-13-55 +0000,nyt,U.S. Military Ramps Up Assaults on Iranian Drones and Vessels to Clear Strait of Hormuz,https://www.nytimes.com/2026/03/20/us/politics/us-military-strait-hormuz.html
47,2026-03-20-11-58-58 +0000,nyt,"Iran Executes 3 Men, Including Teenage Wrestler Saleh Mohammadi",https://www.nytimes.com/2026/03/20/world/middleeast/iran-executed-wrestler-mohammadi-hanging-protests.html
47,2026-03-20-18-10-57 +0000,nyt,"Hamas Considering Disarmament Plan From Trump’s Board of Peace, Officials Say",https://www.nytimes.com/2026/03/20/world/middleeast/hamas-disarming-plan-board-of-peace-trump.html
47,2026-03-20-22-05-39 +0000,nyt,Cal State Challenges Trump’s Order on Transgender Student Athletes,https://www.nytimes.com/2026/03/20/us/politics/cal-state-transgender-athletes.html
47,2026-03-20-09-01-06 +0000,nyt,Trump Organization Eyes Transylvania Golf Course Deal,https://www.nytimes.com/2026/03/20/world/europe/trump-romania-transylvania-apartments-golf-course.html
47,2026-03-20-09-00-04 +0000,wapo,U.S.-Israeli rift widens over potential endgame in Iran,https://www.washingtonpost.com/national-security/2026/03/20/us-israel-iran-goals-trump-netanyahu/
47,2026-03-20-20-57-00 +0000,wsj,Opinion | Why the Trump FCC Cares About Your Sports Viewing,https://www.wsj.com/opinion/why-the-trump-fcc-cares-about-your-sports-viewing-513a69f7?mod=pls_whats_news_us_business_f
46,2026-03-21-00-17-00 +0000,wsj,"The Pentagon’s New Press Rules Violate the First Amendment, Judge Rules",https://www.wsj.com/politics/the-pentagons-new-press-rules-violate-the-first-amendment-judge-rules-cbca9999?mod=pls_whats_news_us_business_f
46,2026-03-20-15-32-55 +0000,nypost,University of Alabama student James Gracey’s girlfriend pays heartbreaking tribute after his death: ‘Most pure-hearted soul’,https://nypost.com/2026/03/20/world-news/university-of-alabama-student-james-graceys-girlfriend-pays-tribute-after-his-death-most-pure-hearted-soul/
46,2026-03-20-10-00-00 +0000,latimes,New report on L.A. post-fire beach contamination finds something unexpected: good news,https://www.latimes.com/environment/story/2026-03-20/new-report-on-la-post-fire-beach-contamination-good-news
45,2026-03-21-00-12-55 +0000,nyt,"CBS News Radio, Onetime Home of Murrow, Will End Amid Layoffs",https://www.nytimes.com/2026/03/20/business/media/cbs-news-bari-weiss-layoffs.html
45,2026-03-20-20-22-08 +0000,bbc,UK allows US to use bases to strike Strait of Hormuz targets,https://www.bbc.com/news/articles/c36rny6xgppo?at_medium=RSS&at_campaign=rss
45,2026-03-20-04-42-56 +0000,nyt,How Japan Reacted to Trump’s Pearl Harbor Joke,https://www.nytimes.com/2026/03/20/world/asia/japan-trump-pearl-harbor.html
45,2026-03-20-17-24-21 +0000,nypost,Trump orders ‘exclusive window’ for annual Army-Navy football game,https://nypost.com/2026/03/20/sports/trump-orders-exclusive-window-for-annual-army-navy-football-game/
45,2026-03-20-22-17-10 +0000,nypost,Media veterans outraged as Bari Weiss shuts 100-year old CBS News Radio: ‘It’s disgusting’,https://nypost.com/2026/03/20/media/media-veterans-outraged-as-bari-weiss-shuts-100-year-old-cbs-news-radio-its-disgusting/
44,2026-03-20-20-06-37 +0000,nyt,"Trump Officials Bypass Congress to Sell Weapons to U.A.E., Kuwait and Jordan",https://www.nytimes.com/2026/03/20/us/politics/wartime-emergency-congress-weapons.html
44,2026-03-21-00-48-43 +0000,nyt,Oil Prices Tick Up and U.S. Stocks Fall Sharply,https://www.nytimes.com/2026/03/20/business/oil-stocks-gas-iran.html
44,2026-03-20-20-16-26 +0000,nypost,‘Armageddon’ attack on Qatari plant could keep energy prices high around the world: analysts,https://nypost.com/2026/03/20/business/armageddon-attack-on-qatari-plant-could-keep-energy-prices-high-around-the-world-analysts/
44,2026-03-20-17-00-00 +0000,wsj,"Week Ahead for FX, Bonds: PMI Data to Show Middle East War’s Impact on Sentiment",https://www.wsj.com/economy/week-ahead-for-fx-bonds-pmi-data-to-show-middle-east-wars-impact-on-sentiment-6fd000aa
44,2026-03-20-20-49-57 +0000,latimes,"California reaches proposed settlement with school district that mishandled student sex abuse claims, state AG says",https://www.latimes.com/california/story/2026-03-20/el-monte-school-district-proposed-settlement-student-sex-abuse-claims
43,2026-03-20-11-58-47 +0000,nyt,How High Will Oil Climb? Markets Brace for More Bad News.,https://www.nytimes.com/2026/03/20/business/dealbook/oil-iran-war-markets.html
42,2026-03-21-01-17-18 +0000,nypost,Ex-teacher and Texas Senate candidate James Talarico claims illegal migrants were his ‘most patriotic’ students,https://nypost.com/2026/03/20/us-news/ex-teacher-texas-senate-candidate-james-talarico-claims-illegal-migrants-were-his-most-patriotic-students/
42,2026-03-20-15-19-29 +0000,bbc,Trump-backed television merger moves forward,https://www.bbc.com/news/articles/cx2dndp7z12o?at_medium=RSS&at_campaign=rss
42,2026-03-20-21-44-42 +0000,nyt,Energy facilities have been a potent target in the war.,https://www.nytimes.com/live/2026/world/us-israel-iran-attack-maps/energy-facilities-have-been-a-potent-target-in-the-war
42,2026-03-20-19-48-47 +0000,nyt,"In Reversal, Trump Reinstates Support For Representative Jeff Hurd",https://www.nytimes.com/2026/03/20/us/politics/trump-jeff-hurd-republican-house-tariffs-endorsement-reversal.html
41,2026-03-20-09-02-22 +0000,nyt,New Data Shows Where ICE Has Been Most Active This Year,https://www.nytimes.com/2026/03/20/us/ice-arrests-immigration-enforcement.html
41,2026-03-20-10-40-17 +0000,nyt,"Death of University of Alabama Student in Barcelona Was Likely an Accident, Police Say",https://www.nytimes.com/2026/03/19/world/europe/american-student-missing-spain-barcelona-james-gracey.html
41,2026-03-20-22-34-05 +0000,bbc,"Iranian strikes on bases used by US caused $800m in damage, new analysis shows",https://www.bbc.com/news/articles/cddq7j48p35o?at_medium=RSS&at_campaign=rss
41,2026-03-20-16-04-57 +0000,nyt,The U.S. Economy Is Insulated From High Oil Prices. Americans Aren’t.,https://www.nytimes.com/2026/03/20/business/us-economy-oil-prices-inflation-iran-war-americans.html
40,2026-03-20-20-36-00 +0000,wsj,Opinion | An Ally’s Guide to Understanding Trump,https://www.wsj.com/opinion/an-allys-guide-to-understanding-trump-67bd61d4
40,2026-03-20-16-30-00 +0000,wsj,6 of the Best Financial Advisor Companies: Well-Known Fiduciary Investment Firms to Consider,https://www.wsj.com/buyside/personal-finance/financial-advisors/best-financial-advisors?mod=rss_markets_main
40,2026-03-20-20-47-25 +0000,nyt,U.K. Allows U.S. to Use Bases to Hit Iranian Forces Menacing Strait Traffic,https://www.nytimes.com/2026/03/20/world/middleeast/uk-bases-us-iran.html
40,2026-03-21-02-40-33 +0000,48hills,CBS workers in SF walk off the job as Bari Weiss eliminates national news radio,https://48hills.org/2026/03/cbs-workers-in-sf-walk-off-the-job-as-bari-weiss-eliminates-national-news-radio/
39,2026-03-20-23-27-28 +0000,nypost,"NYC driver hit with $14K bill, suspended license despite paying E-ZPass tolls on time: ‘I was on top of it’",https://nypost.com/2026/03/20/us-news/nyc-driver-hit-with-14k-bill-suspended-license-despite-paying-e-zpass-tolls-on-time/
39,2026-03-20-09-42-23 +0000,nyt,Central Banks Brace for Inflation as Energy Prices Surge,https://www.nytimes.com/2026/03/19/business/economy/boe-ecb-interest-rates-inflation.html
39,2026-03-20-08-55-00 +0000,wsj,"Work From Home, Carpool and Fly Less to Combat Soaring Oil Prices, IEA Says",https://www.wsj.com/finance/commodities-futures/work-from-home-carpool-and-fly-less-to-combat-soaring-oil-prices-iea-says-0276fd93?mod=pls_whats_news_us_business_f
39,2026-03-20-21-32-38 +0000,nypost,Here are key CBS News anchors and correspondents who got the ax today,https://nypost.com/2026/03/20/media/here-are-key-cbs-news-anchors-and-correspondents-who-got-the-ax-today/
39,2026-03-20-21-33-00 +0000,wsj,Opinion | Trump’s Lina Khan Impersonator,https://www.wsj.com/opinion/andrew-ferguson-ftc-fifth-circuit-lina-khan-merger-rule-2b9ea8b9?mod=pls_whats_news_us_business_f
39,2026-03-20-21-18-38 +0000,latimes,The worst heat wave to hit Southern California in March is finally coming to an end,https://www.latimes.com/california/story/2026-03-20/worst-heat-wave-to-hit-southern-california-in-march-is-finally-coming-to-end
38,2026-03-20-11-08-00 +0000,wsj,Russia Central Bank Lowers Key Rate Despite Oil-Price Boost,https://www.wsj.com/articles/russia-central-bank-lowers-key-rate-despite-oil-price-boost-71d3d010
38,2026-03-20-05-10-00 +0000,wsj,"Oil Falls, Asian Equities Mixed Amid Easing Supply-Disruption Concerns",https://www.wsj.com/finance/stocks/oil-prices-fall-on-easing-supply-disruption-concerns-b2d5c9cd?mod=rss_markets_main
38,2026-03-20-11-00-00 +0000,missionlocal,"Ed Siu, Chinatown’s ‘complaint guy,’ isn’t here to make friends. He’s here to get results.",https://missionlocal.org/2026/03/sf-chinatown-ed-siu-complaint-guy/
38,2026-03-20-23-14-50 +0000,nypost,Sad legacy of Chuck Norris’ first LA karate studio — here’s how it looks now,https://nypost.com/2026/03/20/us-news/the-sad-legacy-of-chuck-norris-early-socal-martial-arts-studios/
38,2026-03-20-15-08-38 +0000,latimes,CBS News shuts down radio unit amid division-wide cuts,https://www.latimes.com/entertainment-arts/business/story/2026-03-20/cbs-news-shuts-down-radio-unit-amid-division-wide-cuts
37,2026-03-20-09-00-30 +0000,wapo,Small businesses reeling from tariffs brace for spiking oil prices,https://www.washingtonpost.com/business/2026/03/20/small-businesses-costs-iran-war/
37,2026-03-20-16-38-00 +0000,wsj,"CBS News to End Storied Radio Broadcast, Lay Off 6% of Staff",https://www.wsj.com/business/media/cbs-news-layoffs-radio-6f3ee973?mod=pls_whats_news_us_business_f
37,2026-03-20-12-58-00 +0000,wsj,6 of the Best Wealth Management Firms: Well-Known Fiduciary Investment Companies to Consider,https://www.wsj.com/buyside/personal-finance/financial-advisors/best-wealth-management-firms?mod=rss_markets_main
37,2026-03-20-10-00-00 +0000,latimes,Pentagon's Anthropic bashing rekindles Silicon Valley's resistance to war,https://www.latimes.com/business/story/2026-03-20/pentagons-attempt-to-strong-arm-anthropic-rouses-resistance-reflection-in-silicon-valley
37,2026-03-21-01-08-21 +0000,nyt,U.S. Pauses Sanctions on Some Iranian Oil to Get More to Market,https://www.nytimes.com/2026/03/20/world/middleeast/us-sanctions-iran-oil.html
36,2026-03-20-12-58-00 +0000,wsj,5 of the Top Financial Advisor Companies for Retirees: Well-Known Fiduciary Firms to Consider,https://www.wsj.com/buyside/personal-finance/financial-advisors/top-financial-advisors-for-retirees?mod=rss_markets_main
36,2026-03-20-22-17-33 +0000,nyt,U.S. Attacks Iranian Targets to Try to Open Strait of Hormuz,https://www.nytimes.com/2026/03/20/world/middleeast/us-iran-strait-hormuz.html
36,2026-03-20-23-02-40 +0000,nypost,California surfer’s brave reaction after he was attacked by a shark: ‘I cannot die’,https://nypost.com/2026/03/20/us-news/california-surfers-brave-reaction-after-he-was-attacked-by-a-shark-i-cannot-die/
36,2026-03-20-16-30-54 +0000,nyt,"Educators, How Will You Teach Cesar Chavez’s Story After Abuse Allegations?",https://www.nytimes.com/2026/03/20/us/cesar-chavez-abuse-allegations-teachers-callout.html
36,2026-03-20-19-03-48 +0000,nyt,The Effects of High Oil Prices,https://www.nytimes.com/video/business/100000010782158/the-unexpected-impacts-of-high-oil-prices.html
36,2026-03-20-04-04-50 +0000,bbc,BTS return from military service - but does their album live up to the hype?,https://www.bbc.com/news/articles/c070eg32dryo?at_medium=RSS&at_campaign=rss
36,2026-03-21-02-00-28 +0000,nypost,Cause of death for daughter of ex-LA mayoral candidate Austin Beutner revealed,https://nypost.com/2026/03/20/us-news/la-mayoral-candidate-austin-beutners-daughters-cause-of-death-revealed/
35,2026-03-20-16-43-48 +0000,nypost,Big Brother bank: JPMorgan is reportedly tracking junior bankers’ hours with new surveillance tech after concerns about exhaustion,https://nypost.com/2026/03/20/business/big-brother-bank-jpmorgan-is-reportedly-tracking-junior-bankers-hours-with-new-surveillance-tech/
35,2026-03-20-10-34-02 +0000,bbc,Why are gas prices soaring and how could it affect you?,https://www.bbc.com/news/articles/cj6d66w0995o?at_medium=RSS&at_campaign=rss
33,2026-03-20-18-47-40 +0000,nypost,Pilot believes he’s found Amelia Earhart’s long-lost airplane on remote Pacific island — with the help of Google Earth,https://nypost.com/2026/03/20/world-news/pilot-believes-hes-found-amelia-earharts-long-lost-airplane-on-remote-pacific-island-with-the-help-of-google-earth/
33,2026-03-21-00-29-01 +0000,nypost,California school district allegedly buried rampant teacher sex abuse for years,https://nypost.com/2026/03/20/us-news/el-monte-school-district-buried-teacher-sex-abuse-reports-probe/
32,2026-03-21-00-29-41 +0000,nyt,War-Weary Lebanon Marks Eid With Muted Celebration,https://www.nytimes.com/2026/03/20/world/middleeast/muted-eid-in-lebanon.html
32,2026-03-20-20-57-00 +0000,wsj,Energy & Utilities Roundup: Market Talk,https://www.wsj.com/business/energy-oil/energy-utilities-roundup-market-talk-19607fe9?mod=pls_whats_news_us_business_f
