score,pubdate,source,title,link
9,2025-07-20-03-59-00 +0000,world,Chinese Rare-Earth Magnet Exports Surge After U.S. Trade Truce,https://www.wsj.com/world/asia/chinese-rare-earth-magnet-exports-surge-after-u-s-trade-truce-f9f6e059
6,2025-07-20-21-12-00 +0000,world,Opinion | Predatory Sparrow Hacks Iran’s Financial System,https://www.wsj.com/opinion/predatory-sparrow-hacks-irans-financial-system-attack-stablecoins-ad6e79b5
6,2025-07-20-19-52-00 +0000,world,Japan Election Throws a Wrench in Trade Talks,https://www.wsj.com/world/asia/japan-election-throws-a-wrench-in-trade-talks-e6c1abde
6,2025-07-20-13-19-00 +0000,world,Opinion | Giving China Chips Derails Trump Decoupling,https://www.wsj.com/opinion/giving-china-chips-derails-trump-decoupling-4a4aa6cd
5,2025-07-20-13-16-00 +0000,world,Opinion | The Senate Rescinded Vital Unicef Funding,https://www.wsj.com/opinion/the-senate-rescinded-vital-unicef-funding-765ad5d0
3,2025-07-20-21-47-00 +0000,world,Opinion | The Populist Wave Hits Japan,https://www.wsj.com/opinion/the-populist-wave-hits-japan-election-vote-results-tokyo-b809ea6b
3,2025-07-20-13-15-00 +0000,world,Opinion | Zohran Mamdani and the Jews,https://www.wsj.com/opinion/zohran-mamdani-and-the-jews-14af43f4
