score,pubdate,source,title,link
151,2026-04-27-19-43-00 +0000,wsj,President Trump is calling on Disney’s ABC to remove late-night host Jimmy Kimmel over a comedy bit last week that referred to first lady Melania Trump as an “expectant widow”,https://www.wsj.com/business/media/jimmy-kimmel-melania-trump-widow-comments-40f9478a
73,2026-04-27-09-27-55 +0000,nypost,Elon Musk and OpenAI CEO Sam Altman head to court in high-stakes showdown over AI,https://nypost.com/2026/04/27/business/elon-musk-and-openai-ceo-sam-altman-head-to-court-in-high-stakes-showdown-over-ai/
71,2026-04-27-17-57-06 +0000,nyt,Iran’s Foreign Minister Is in Russia for Talks With Putin on Middle East War,https://www.nytimes.com/2026/04/27/world/europe/iran-foreign-minister-russia.html
62,2026-04-27-22-50-26 +0000,nyt,King Charles Visits Trump’s Washington After Chaos From Press Dinner Shooting,https://www.nytimes.com/2026/04/27/us/politics/trump-king-charles-royals-dc-visit.html
54,2026-04-27-14-36-00 +0000,wsj,The Federal Reserve succession drama now comes down to a decision only Jerome Powell can make: Will he give up his seat on the Fed’s board when his chairmanship ends or stay on as a governor?,https://www.wsj.com/economy/central-banking/fed-chair-powell-confronts-his-final-big-decision-stay-or-go-635eb131
51,2026-04-27-11-02-00 +0000,wsj,The gunman at the White House Correspondents’ Dinner had an impact on many people—including journalists from The Wall Street Journal. Read more in today’s WSJ politics newsletter:,https://www.wsj.com/politics/what-the-wsj-saw-at-the-hilton-saturday-night-74b83811
41,2026-04-27-20-12-17 +0000,nyt,"Oil Rises, and Stocks Tick Higher, as Iran Makes New Peace Offer",https://www.nytimes.com/2026/04/26/business/oil-stocks-gas-iran.html
39,2026-04-27-18-07-33 +0000,nypost,California’s billionaire tax gamble — insiders warn of fallout no one is talking about,https://nypost.com/2026/04/27/business/billionaire-tax-could-kill-100000-california-jobs-and-sink-revenue-study/
36,2026-04-27-22-00-56 +0000,nyt,Carney to Launch Sovereign Wealth Fund to Distance Canada’s Economy From U.S.,https://www.nytimes.com/2026/04/27/world/canada/canada-sovereign-wealth-fund.html
34,2026-04-28-01-05-00 +0000,wsj,"The Defense Department can temporarily require journalists to be escorted inside the Pentagon, a federal appeals court ruled Monday, a win for the department in its efforts to limit media access",https://www.wsj.com/politics/national-security/appeals-court-says-pentagon-can-temporarily-mandate-escorts-for-journalists-84042f19
