score,pubdate,source,title,link
163,2025-09-17-03-28-00 +0000,wsj,"In her first public comments since Trump fired her, the former head of the government agency that measures inflation and job growth called her dismissal “a dangerous step” for the economy",https://www.wsj.com/economy/jobs/fired-bls-chief-breaks-silence-calls-her-dismissal-a-dangerous-step-7e3a6a86
116,2025-09-16-18-03-09 +0000,nypost,Bill Ackman denies Candace Owens’ claim he staged Charlie Kirk ‘intervention’ to ‘blackmail’ him over Israel,https://nypost.com/2025/09/16/media/bill-ackman-denies-candace-owens-claim-he-staged-charlie-kirk-intervention-over-israel/
96,2025-09-16-20-14-00 +0000,wsj,"Democrats are introducing a bill in the Senate aimed at drawing a firmer line between the White House and the Federal Reserve, hours after White House official Stephen Miran was sworn in as a Fed governor",https://www.wsj.com/economy/central-banking/senate-democrats-target-mirans-dual-fed-white-house-roles-a588151c
89,2025-09-17-11-44-17 +0000,cbc,"Israel opens new temporary route out of Gaza City as tanks advance, more forced to flee",https://www.cbc.ca/news/world/gaza-city-israel-new-route-1.7635863?cmp=rss
51,2025-09-16-22-28-55 +0000,nypost,Hochul argues Zohran Mamdani would be best candidate to ‘stand up’ to Trump — as she defends shock endorsement in NYC mayoral race,https://nypost.com/2025/09/16/us-news/hochul-argues-zohran-mamdani-would-be-best-candidate-to-stand-up-to-trump-as-she-defends-shock-endorsement-in-nyc-mayoral-race/
47,2025-09-16-14-41-00 +0000,cbc,"New York judge tosses terrorism charges against Luigi Mangione, lets murder count stand",https://www.cbc.ca/news/judge-dismisses-terrorism-charges-against-luigi-mangione-1.7634970?cmp=rss
45,2025-09-17-10-00-00 +0000,nypost,Kristi Noem reveals last text Charlie Kirk sent her on ‘Pod Force One’: ‘Will always feel bad that I didn’t respond’,https://nypost.com/2025/09/17/us-news/kristi-noem-reveals-last-text-charlie-kirk-sent-her-on-pod-force-one-will-always-feel-bad-that-i-didnt-respond/
44,2025-09-17-07-09-00 +0000,nypost,Ben & Jerry’s co-founder Jerry Greenfield resigns citing loss of independence under parent company,https://nypost.com/2025/09/17/business/ben-amp-jerrys-co-founder-jerry-greenfield-resigns-citing-loss-of-independence-under-unilever/
44,2025-09-17-09-00-00 +0000,wsj,"Republican Brad Raffensperger, the election chief who drew Donald Trump’s ire for refusing to overturn Georgia’s 2020 election results, is planning to run for governor, according to his campaign",https://www.wsj.com/politics/elections/georgia-governor-election-brad-raffensperger-9d620602
43,2025-09-16-17-49-00 +0000,wsj,A federal appeals court on Monday night rejected an emergency Trump administration request to remove Federal Reserve Governor Lisa Cook ahead of the central bank’s next meeting,https://www.wsj.com/economy/central-banking/appeals-court-rejects-trump-request-to-remove-fed-governor-lisa-cook-immediately-fc96f39b
