score,pubdate,source,title,link
159,2025-10-30-15-17-59 +0000,nyt,"Trump and Xi Ease Off the Trade War, but New Nuclear Threat Brings a Chill",https://www.nytimes.com/2025/10/30/us/politics/trump-xi-trade-meeting.html
66,2025-10-30-02-28-18 +0000,nypost,Trump says ‘we have a deal’ with China’s Xi Jinping — calls South Korea summit meeting ‘12’ out of 10,https://nypost.com/2025/10/29/us-news/trump-chinas-xi-jinping-meet-at-south-korea-summit-with-prez-optimistic-as-trade-war-rages-on/
57,2025-10-30-02-40-50 +0000,latimes,"He said he was an immigration lawyer but raped her, offered discount if she'd keep quiet, police say",https://www.latimes.com/california/story/2025-10-29/woman-allegedly-raped-by-man-who-offered-immigration-legal-aid
51,2025-10-30-01-32-00 +0000,wsj,Federal Reserve Chair Jerome Powell delivered a blunt message for investors who have assumed the central bank would be on cruise control toward a third rate cut in December: Not so fast.,https://www.wsj.com/economy/central-banking/fed-divisions-reveal-new-caution-over-continued-cuts-4cf868af
50,2025-10-30-17-31-09 +0000,nypost,"Hurricane Melissa leaves trail of death, destruction across Cuba, Haiti and Jamaica",https://nypost.com/2025/10/30/world-news/hurricane-melissa-leaves-trail-of-death-destruction-across-cuba-haiti-and-jamaica/
43,2025-10-30-19-35-06 +0000,nypost,Disgraced Prince Andrew to be stripped of ‘prince’ title — and forced to leave Royal Lodge after Jeffrey Epstein scandal,https://nypost.com/2025/10/30/world-news/prince-andrew-to-be-stripped-of-prince-title-buckingham-palace/
41,2025-10-29-22-01-00 +0000,wsj,"The financial pain from the government shutdown is spreading, helping prompt a pickup in informal talks to resolve the nearly monthlong impasse",https://www.wsj.com/politics/policy/government-shutdown-pay-food-stamps-healthcare-64c11243
40,2025-10-30-10-00-00 +0000,latimes,Warner Bros. Discovery is up for sale. Why CEO David Zaslav isn't ready to give up the reins,https://www.latimes.com/entertainment-arts/business/story/2025-10-30/david-zaslav-warner-bros-deal-paramount-ellison
40,2025-10-30-16-29-00 +0000,wsj,"Crocs Focuses on Long-Term Growth as Third-Quarter Profit, Sales Fall",https://www.wsj.com/business/earnings/crocs-profit-falls-on-weaker-demand-for-namesake-brand-e1a5abfc?mod=pls_whats_news_us_business_f
39,2025-10-30-20-51-44 +0000,nypost,Virginia teacher recalls harrowing moment when 6-year-old student shot her in school: ‘It got all black’,https://nypost.com/2025/10/30/us-news/virginia-teacher-recalls-moment-she-was-shot-by-6-year-old/
