score,pubdate,source,title,link
131,2026-05-20-20-03-00 +0000,wsj,Q&A: Here’s what to know about the Trump administration’s ending of tax audits of President Trump,https://www.wsj.com/politics/policy/what-to-know-about-the-trump-administration-ending-tax-audits-of-trump-5c1e81c1
88,2026-05-21-11-06-00 +0000,wsj,"Jeff Bezos wades into politics, and New York City Mayor Zohran Mamdani was waiting for him. Read more in today’s WSJ Politics newsletter:",https://www.wsj.com/politics/policy/bezos-wades-into-politics-and-mamdani-was-waiting-for-him-d65a15ba
68,2026-05-21-00-05-00 +0000,nyt,Justice Dept. Charges Raúl Castro as Trump Escalates Pressure Campaign Against Cuba,https://www.nytimes.com/2026/05/20/us/raul-castro-cuba-doj-indictment.html
58,2026-05-20-19-46-00 +0000,wsj,Federal Reserve officials all but retired the question that had dominated their debates for the past two years—whether to cut interest rates—and began more seriously at their April meeting to weigh the opposite: whether to raise them,https://www.wsj.com/economy/central-banking/fed-minutes-reveal-support-for-rate-hikes-if-inflation-proves-persistent-97e63b1c
52,2026-05-20-20-18-32 +0000,nypost,Feds probe suspicious oil trades worth $800M made just before major Iran war news: report,https://nypost.com/2026/05/20/business/feds-probe-suspicious-oil-trades-worth-800m-made-just-before-major-iran-war-news-report/
49,2026-05-21-10-36-32 +0000,nyt,"Trump Again Says He Will Talk to Taiwan’s Leader, Risking China’s Anger",https://www.nytimes.com/2026/05/21/world/asia/trump-taiwan-president-call-weapons-sale-china.html
47,2026-05-20-17-11-00 +0000,wsj,"The GOP-controlled House passed a new version of the federal housing bill, throwing a lifeline to home builders by striking a provision that builders said would have destroyed part of their business",https://www.wsj.com/politics/policy/newly-passed-housing-bill-throws-lifeline-to-homebuilders-d5dec1d4
47,2026-05-20-13-52-32 +0000,nypost,"WHO says risk of Ebola outbreak spreading globally is low, but high at regional levels as cases expected to rise",https://nypost.com/2026/05/20/world-news/who-says-risk-of-ebola-outbreak-spreading-globally-is-low-but-high-at-national-regional-levels-as-number-of-cases-expected-to-rise/
46,2026-05-20-22-33-35 +0000,nypost,Nvidia’s revenue hits record $81B — easily topping Wall Street estimates — on massive demand for AI chips,https://nypost.com/2026/05/20/business/nvidias-revenue-hits-record-81b-on-massive-demand-for-ai-chips/
41,2026-05-21-02-41-41 +0000,latimes,Mayoral candidate Spencer Pratt hosts South L.A. block party on Bass' old turf,https://www.latimes.com/california/story/2026-05-20/pratt-south-la-appearance
